--------- beginning of main
06-05 18:34:38.277 V/PhoneStatusBar( 1711): setLightsOn(true)
06-05 18:34:38.281 V/PhoneStatusBar( 1711): setLightsOn(true)
--------- beginning of system
06-05 18:34:38.283 W/ActivityManager( 1629): Finishing task with all activities already finished
06-05 18:34:38.284 W/ActivityManager( 1629): Duplicate finish request for ActivityRecord{9a83762 u0 com.evancharlton.mileage/.Mileage t3087 f}
06-05 18:34:38.308 D/gralloc_ranchu( 1346): gralloc_alloc: Creating ashmem region of size 3145728
06-05 18:34:38.314 E/EGL_emulation( 1346): tid 1346: eglCreateSyncKHR(1901): error 0x3004 (EGL_BAD_ATTRIBUTE)
06-05 18:34:38.332 W/ActivityManager( 1629): Finishing task with all activities already finished
06-05 18:34:38.332 W/ActivityManager( 1629): Duplicate finish request for ActivityRecord{9a83762 u0 com.evancharlton.mileage/.Mileage t3087 f}
06-05 18:34:38.333 W/ActivityManager( 1629): Finishing task with all activities already finished
06-05 18:34:38.333 W/ActivityManager( 1629): Duplicate finish request for ActivityRecord{9a83762 u0 com.evancharlton.mileage/.Mileage t3087 f}
06-05 18:34:38.333 W/ActivityManager( 1629): Finishing task with all activities already finished
06-05 18:34:38.333 W/ActivityManager( 1629): Duplicate finish request for ActivityRecord{9a83762 u0 com.evancharlton.mileage/.Mileage t3087 f}
06-05 18:34:38.333 W/ActivityManager( 1629): Finishing task with all activities already finished
06-05 18:34:38.333 W/ActivityManager( 1629): Duplicate finish request for ActivityRecord{9a83762 u0 com.evancharlton.mileage/.Mileage t3087 f}
06-05 18:34:38.357 D/EGL_emulation( 1711): eglMakeCurrent: 0xa5b6bd80: ver 2 0 (tinfo 0xb1367140)
06-05 18:34:38.371 D/EGL_emulation( 1711): eglMakeCurrent: 0xa5b6bd80: ver 2 0 (tinfo 0xb1367140)
06-05 18:34:38.371 D/EGL_emulation( 2150): eglMakeCurrent: 0xb4f852a0: ver 2 0 (tinfo 0xb4f832e0)
06-05 18:34:38.405 D/EGL_emulation( 1711): eglMakeCurrent: 0xa5b6bd80: ver 2 0 (tinfo 0xb1367140)
06-05 18:34:38.421 D/EGL_emulation( 1711): eglMakeCurrent: 0xa5b6bd80: ver 2 0 (tinfo 0xb1367140)
06-05 18:34:38.423 D/EGL_emulation( 1711): eglMakeCurrent: 0xa5b6bd80: ver 2 0 (tinfo 0xb1367140)
06-05 18:34:38.437 D/EGL_emulation( 1711): eglMakeCurrent: 0xa5b6bd80: ver 2 0 (tinfo 0xb1367140)
06-05 18:34:38.440 D/EGL_emulation( 1711): eglMakeCurrent: 0xa5b6bd80: ver 2 0 (tinfo 0xb1367140)
06-05 18:34:38.454 D/EGL_emulation( 1711): eglMakeCurrent: 0xa5b6bd80: ver 2 0 (tinfo 0xb1367140)
06-05 18:34:38.455 D/EGL_emulation( 1711): eglMakeCurrent: 0xa5b6bd80: ver 2 0 (tinfo 0xb1367140)
06-05 18:34:38.465 D/AndroidRuntime( 6155): >>>>>> START com.android.internal.os.RuntimeInit uid 2000 <<<<<<
06-05 18:34:38.466 D/AndroidRuntime( 6155): CheckJNI is ON
06-05 18:34:38.470 D/EGL_emulation( 1711): eglMakeCurrent: 0xa5b6bd80: ver 2 0 (tinfo 0xb1367140)
06-05 18:34:38.472 D/EGL_emulation( 1711): eglMakeCurrent: 0xa5b6bd80: ver 2 0 (tinfo 0xb1367140)
06-05 18:34:38.477 W/art     ( 6155): Unexpected CPU variant for X86 using defaults: x86
06-05 18:34:38.479 D/ICU     ( 6155): No timezone override file found: /data/misc/zoneinfo/current/icu/icu_tzdata.dat
06-05 18:34:38.487 E/memtrack( 6155): Couldn't load memtrack module (No such file or directory)
06-05 18:34:38.487 E/android.os.Debug( 6155): failed to load memtrack module: -2
06-05 18:34:38.487 D/EGL_emulation( 1711): eglMakeCurrent: 0xa5b6bd80: ver 2 0 (tinfo 0xb1367140)
06-05 18:34:38.487 I/Radio-JNI( 6155): register_android_hardware_Radio DONE
06-05 18:34:38.489 D/EGL_emulation( 1711): eglMakeCurrent: 0xa5b6bd80: ver 2 0 (tinfo 0xb1367140)
06-05 18:34:38.491 D/AndroidRuntime( 6155): Calling main entry com.android.commands.am.Am
06-05 18:34:38.493 I/ActivityManager( 1629): Force stopping com.evancharlton.mileage appid=10160 user=0: start instr
06-05 18:34:38.493 I/ActivityManager( 1629): Killing 6106:com.evancharlton.mileage/u0a160 (adj 0): stop com.evancharlton.mileage
06-05 18:34:38.493 D/ActivityManager( 1629): cleanUpApplicationRecord -- 6106
06-05 18:34:38.493 W/ActivityManager( 1629): Crash of app com.evancharlton.mileage running instrumentation ComponentInfo{com.evancharlton.mileage.test/sh.calaba.instrumentationbackend.CalabashInstrumentationTestRunner}
06-05 18:34:38.493 I/ActivityManager( 1629): Force stopping com.evancharlton.mileage appid=10160 user=0: finished inst
06-05 18:34:38.496 I/art     ( 6165): Not late-enabling -Xcheck:jni (already on)
06-05 18:34:38.497 W/art     ( 6165): Unexpected CPU variant for X86 using defaults: x86
06-05 18:34:38.504 I/ActivityManager( 1629): Start proc 6165:com.evancharlton.mileage/u0a160 for added application com.evancharlton.mileage
06-05 18:34:38.504 E/JavaBinder( 1629): !!! FAILED BINDER TRANSACTION !!!  (parcel size = 52)
06-05 18:34:38.504 D/AndroidRuntime( 6155): Shutting down VM
06-05 18:34:38.505 D/EGL_emulation( 1711): eglMakeCurrent: 0xa5b6bd80: ver 2 0 (tinfo 0xb1367140)
06-05 18:34:38.508 D/EGL_emulation( 1711): eglMakeCurrent: 0xa5b6bd80: ver 2 0 (tinfo 0xb1367140)
06-05 18:34:38.509 W/System  ( 6165): ClassLoader referenced unknown path: /data/app/com.evancharlton.mileage.test-1/lib/x86
06-05 18:34:38.509 W/System  ( 6165): ClassLoader referenced unknown path: /data/app/com.evancharlton.mileage-1/lib/x86
06-05 18:34:38.511 W/System  ( 6165): ClassLoader referenced unknown path: 
06-05 18:34:38.516 I/System.out( 6165): Main activity name automatically set to: com.evancharlton.mileage.Mileage
06-05 18:34:38.517 I/System.out( 6165): Calabash did not load Mono. This is only a problem if you are trying to test a Mono application
06-05 18:34:38.517 I/calabash( 6165): Test server port: 7102
06-05 18:34:38.517 I/InstrumentationBackend( 6165): Added:'GetPreferences', with key:'get_preferences'
06-05 18:34:38.521 D/EGL_emulation( 1711): eglMakeCurrent: 0xa5b6bd80: ver 2 0 (tinfo 0xb1367140)
06-05 18:34:38.522 D/EGL_emulation( 1711): eglMakeCurrent: 0xa5b6bd80: ver 2 0 (tinfo 0xb1367140)
06-05 18:34:38.524 I/InstrumentationBackend( 6165): Added:'SetPreferences', with key:'set_preferences'
06-05 18:34:38.524 I/InstrumentationBackend( 6165): Added:'ClearPreferences', with key:'clear_preferences'
06-05 18:34:38.524 I/InstrumentationBackend( 6165): Added:'PressElement', with key:'press_l10n_element'
06-05 18:34:38.524 I/InstrumentationBackend( 6165): Added:'WaitForElement', with key:'wait_for_l10n_element'
06-05 18:34:38.524 I/InstrumentationBackend( 6165): Added:'NullAction', with key:'nullAction'
06-05 18:34:38.525 I/InstrumentationBackend( 6165): Added:'PressKey', with key:'press_key'
06-05 18:34:38.525 I/InstrumentationBackend( 6165): Added:'SetActivityOrientation', with key:'set_activity_orientation'
06-05 18:34:38.525 I/InstrumentationBackend( 6165): Added:'GetActivityOrientation', with key:'get_activity_orientation'
06-05 18:34:38.525 I/InstrumentationBackend( 6165): Added:'FakeGPSLocation', with key:'set_gps_coordinates'
06-05 18:34:38.525 I/InstrumentationBackend( 6165): Added:'SetPropertyByCssSelector', with key:'set_property_by_css_selector'
06-05 18:34:38.525 I/InstrumentationBackend( 6165): Added:'GetUrl', with key:'get_url'
06-05 18:34:38.525 I/InstrumentationBackend( 6165): Added:'ScrollTo', with key:'scroll_to'
06-05 18:34:38.525 I/InstrumentationBackend( 6165): Added:'GetLoadProgress', with key:'get_load_progress'
06-05 18:34:38.525 I/InstrumentationBackend( 6165): Added:'DumpHtml', with key:'dump_html'
06-05 18:34:38.525 I/InstrumentationBackend( 6165): Added:'DumpBodyHtml', with key:'dump_body_html'
06-05 18:34:38.526 I/InstrumentationBackend( 6165): Added:'EnterTextByCssSelector', with key:'enter_text_by_selector'
06-05 18:34:38.526 I/InstrumentationBackend( 6165): Added:'AndroidSDKVersion', with key:'android_sdk_version'
06-05 18:34:38.526 I/InstrumentationBackend( 6165): Added:'Version', with key:'version'
06-05 18:34:38.526 I/InstrumentationBackend( 6165): Added:'Drag', with key:'drag'
06-05 18:34:38.526 I/InstrumentationBackend( 6165): Added:'TouchCoordinates', with key:'touch_coordinate'
06-05 18:34:38.526 I/InstrumentationBackend( 6165): Added:'LongPressCoordinate', with key:'long_press_coordinate'
06-05 18:34:38.526 I/InstrumentationBackend( 6165): Added:'DragCoordinates', with key:'drag_coordinates'
06-05 18:34:38.526 I/InstrumentationBackend( 6165): Added:'ResumeApplication', with key:'resume_application'
06-05 18:34:38.526 I/InstrumentationBackend( 6165): Added:'Swipe', with key:'swipe'
06-05 18:34:38.526 I/InstrumentationBackend( 6165): Added:'DoubleTapCoordinate', with key:'double_tap_coordinate'
06-05 18:34:38.526 I/InstrumentationBackend( 6165): Added:'ClickOnScreen', with key:'click_on_screen'
06-05 18:34:38.526 I/InstrumentationBackend( 6165): Added:'GetActivityName', with key:'get_activity_name'
06-05 18:34:38.526 I/InstrumentationBackend( 6165): Added:'ScrollToView', with key:'scroll_to_view'
06-05 18:34:38.527 I/InstrumentationBackend( 6165): Added:'ViewConfiguration', with key:'view_configuration'
06-05 18:34:38.527 I/InstrumentationBackend( 6165): Added:'IsCurrentActivityFocused', with key:'is_current_activity_focused'
06-05 18:34:38.527 I/InstrumentationBackend( 6165): Added:'SendTcp', with key:'send_tcp'
06-05 18:34:38.527 I/InstrumentationBackend( 6165): Added:'DpToDevicePixel', with key:'dp_to_device_pixel'
06-05 18:34:38.527 I/InstrumentationBackend( 6165): Added:'KeyboardEnterText', with key:'keyboard_enter_text'
06-05 18:34:38.527 I/InstrumentationBackend( 6165): Added:'DeleteSurroundingText', with key:'delete_surrounding_text'
06-05 18:34:38.527 I/InstrumentationBackend( 6165): Added:'SetComposingRegion', with key:'set_composing_region'
06-05 18:34:38.527 I/InstrumentationBackend( 6165): Added:'SetSelection', with key:'set_selection'
06-05 18:34:38.527 I/InstrumentationBackend( 6165): Added:'KeyboardKeyEvent', with key:'keyboard_key_event'
06-05 18:34:38.527 I/InstrumentationBackend( 6165): Added:'PressUserActionButton', with key:'press_user_action_button'
06-05 18:34:38.527 I/InstrumentationBackend( 6165): Added:'HideSoftKeyboard', with key:'hide_soft_keyboard'
06-05 18:34:38.527 I/InstrumentationBackend( 6165): Added:'ListActions', with key:'list_actions'
06-05 18:34:38.527 I/calabash( 6165): Instantiating http server at 7102
06-05 18:34:38.528 I/System.out( 6165): HTTP Daemon listening on: 7102
06-05 18:34:38.537 D/EGL_emulation( 1711): eglMakeCurrent: 0xa5b6bd80: ver 2 0 (tinfo 0xb1367140)
06-05 18:34:38.539 D/EGL_emulation( 1711): eglMakeCurrent: 0xa5b6bd80: ver 2 0 (tinfo 0xb1367140)
06-05 18:34:38.554 D/EGL_emulation( 1711): eglMakeCurrent: 0xa5b6bd80: ver 2 0 (tinfo 0xb1367140)
06-05 18:34:38.556 D/EGL_emulation( 1711): eglMakeCurrent: 0xa5b6bd80: ver 2 0 (tinfo 0xb1367140)
06-05 18:34:38.571 W/InputDispatcher( 1629): channel '2178d99 com.evancharlton.mileage/com.evancharlton.mileage.Mileage (server)' ~ Consumer closed input channel or an error occurred.  events=0x9
06-05 18:34:38.571 E/InputDispatcher( 1629): channel '2178d99 com.evancharlton.mileage/com.evancharlton.mileage.Mileage (server)' ~ Channel is unrecoverably broken and will be disposed!
06-05 18:34:38.571 W/InputDispatcher( 1629): channel '113550e Toast (server)' ~ Consumer closed input channel or an error occurred.  events=0x9
06-05 18:34:38.571 E/InputDispatcher( 1629): channel '113550e Toast (server)' ~ Channel is unrecoverably broken and will be disposed!
06-05 18:34:38.571 I/WindowManager( 1629): WIN DEATH: Window{113550e u0 Toast}
06-05 18:34:38.571 W/InputDispatcher( 1629): Attempted to unregister already unregistered input channel '113550e Toast (server)'
06-05 18:34:38.572 I/WindowManager( 1629): WIN DEATH: Window{2178d99 u0 com.evancharlton.mileage/com.evancharlton.mileage.Mileage EXITING}
06-05 18:34:38.572 W/InputDispatcher( 1629): Attempted to unregister already unregistered input channel '2178d99 com.evancharlton.mileage/com.evancharlton.mileage.Mileage (server)'
06-05 18:34:38.583 D/EGL_emulation( 1711): eglMakeCurrent: 0xa5b6bd80: ver 2 0 (tinfo 0xb1367140)
06-05 18:34:38.587 D/EGL_emulation( 1711): eglMakeCurrent: 0xa5b6bd80: ver 2 0 (tinfo 0xb1367140)
06-05 18:34:38.588 D/EGL_emulation( 1711): eglMakeCurrent: 0xa5b6bd80: ver 2 0 (tinfo 0xb1367140)
06-05 18:34:38.615 I/System.out( 6165): URI: //ping
06-05 18:34:38.615 I/System.out( 6165): params: {json={}
06-05 18:34:38.615 I/System.out( 6165): }
06-05 18:34:38.616 I/System.out( 6165): URI: //ping
06-05 18:34:38.616 I/System.out( 6165): params: {json={}
06-05 18:34:38.616 I/System.out( 6165): }
06-05 18:34:38.618 I/System.out( 6165): URI: //ready
06-05 18:34:38.618 I/System.out( 6165): params: {json={}
06-05 18:34:38.618 I/System.out( 6165): }
06-05 18:34:38.619 I/System.out( 6165): URI: //
06-05 18:34:38.619 I/System.out( 6165): params: {json={"command":"version","arguments":[]}
06-05 18:34:38.619 I/System.out( 6165): }
06-05 18:34:38.619 I/System.out( 6165): header: {content-type=application/json;charset=utf-8, date=Fri, 05 Jun 2020 23:34:38 GMT, accept=*/*, host=127.0.0.1:34783, content-length=36, user-agent=HTTPClient/1.0 (2.8.3, ruby 2.5.1 (2018-03-29))}
06-05 18:34:38.619 I/System.out( 6165): params: {json={"command":"version","arguments":[]}
06-05 18:34:38.619 I/System.out( 6165): }
06-05 18:34:38.619 I/System.out( 6165): ProP json = {"command":"version","arguments":[]}
06-05 18:34:38.619 I/System.out( 6165): files: {}
06-05 18:34:38.619 I/System.out( 6165): command: {"command":"version","arguments":[]}
06-05 18:34:38.622 I/InstrumentationBackend( 6165): Got command:'Command:'Line:null,version', arguments:'[]'
06-05 18:34:38.628 I/System.out( 6165): result:{"bonusInformation":[],"message":"0.9.8","success":true}
06-05 18:34:38.629 I/System.out( 6165): URI: //start-application
06-05 18:34:38.629 I/System.out( 6165): params: {json={"intent":null}
06-05 18:34:38.629 I/System.out( 6165): }
06-05 18:34:38.638 I/ActivityManager( 1629): START u0 {act=android.intent.action.MAIN cat=[android.intent.category.LAUNCHER] flg=0x10200000 cmp=com.evancharlton.mileage/.Mileage} from uid 10160 on display 0
06-05 18:34:38.643 I/calabash( 6165): newActivity1
06-05 18:34:38.650 I/calabash( 6165): newActivity1
06-05 18:34:38.651 W/ActivityManager( 1629): Bad activity token: android.os.BinderProxy@44191b1
06-05 18:34:38.651 W/ActivityManager( 1629): java.lang.ClassCastException: android.os.BinderProxy cannot be cast to com.android.server.am.ActivityRecord$Token
06-05 18:34:38.651 W/ActivityManager( 1629): 	at com.android.server.am.ActivityRecord.forTokenLocked(ActivityRecord.java:586)
06-05 18:34:38.651 W/ActivityManager( 1629): 	at com.android.server.am.ActivityRecord.isInStackLocked(ActivityRecord.java:1327)
06-05 18:34:38.651 W/ActivityManager( 1629): 	at com.android.server.am.ActivityRecord.getStackLocked(ActivityRecord.java:1332)
06-05 18:34:38.651 W/ActivityManager( 1629): 	at com.android.server.am.ActivityManagerService.getActivityDisplayId(ActivityManagerService.java:9806)
06-05 18:34:38.651 W/ActivityManager( 1629): 	at android.app.ActivityManagerNative.onTransact(ActivityManagerNative.java:2566)
06-05 18:34:38.651 W/ActivityManager( 1629): 	at com.android.server.am.ActivityManagerService.onTransact(ActivityManagerService.java:2757)
06-05 18:34:38.651 W/ActivityManager( 1629): 	at android.os.Binder.execTransact(Binder.java:565)
06-05 18:34:38.652 W/ActivityManager( 1629): Bad activity token: android.os.BinderProxy@44191b1
06-05 18:34:38.652 W/ActivityManager( 1629): java.lang.ClassCastException: android.os.BinderProxy cannot be cast to com.android.server.am.ActivityRecord$Token
06-05 18:34:38.652 W/ActivityManager( 1629): 	at com.android.server.am.ActivityRecord.forTokenLocked(ActivityRecord.java:586)
06-05 18:34:38.652 W/ActivityManager( 1629): 	at com.android.server.am.ActivityRecord.isInStackLocked(ActivityRecord.java:1327)
06-05 18:34:38.652 W/ActivityManager( 1629): 	at com.android.server.am.ActivityManagerService.setTaskDescription(ActivityManagerService.java:9358)
06-05 18:34:38.652 W/ActivityManager( 1629): 	at android.app.ActivityManagerNative.onTransact(ActivityManagerNative.java:2639)
06-05 18:34:38.652 W/ActivityManager( 1629): 	at com.android.server.am.ActivityManagerService.onTransact(ActivityManagerService.java:2757)
06-05 18:34:38.652 W/ActivityManager( 1629): 	at android.os.Binder.execTransact(Binder.java:565)
06-05 18:34:38.652 W/ActivityManager( 1629): Bad activity token: android.os.BinderProxy@44191b1
06-05 18:34:38.652 W/ActivityManager( 1629): java.lang.ClassCastException: android.os.BinderProxy cannot be cast to com.android.server.am.ActivityRecord$Token
06-05 18:34:38.652 W/ActivityManager( 1629): 	at com.android.server.am.ActivityRecord.forTokenLocked(ActivityRecord.java:586)
06-05 18:34:38.652 W/ActivityManager( 1629): 	at com.android.server.am.ActivityRecord.isInStackLocked(ActivityRecord.java:1327)
06-05 18:34:38.652 W/ActivityManager( 1629): 	at com.android.server.am.ActivityRecord.getStackLocked(ActivityRecord.java:1332)
06-05 18:34:38.652 W/ActivityManager( 1629): 	at com.android.server.am.ActivityManagerService.getActivityStackId(ActivityManagerService.java:9817)
06-05 18:34:38.652 W/ActivityManager( 1629): 	at android.app.ActivityManagerNative.onTransact(ActivityManagerNative.java:2856)
06-05 18:34:38.652 W/ActivityManager( 1629): 	at com.android.server.am.ActivityManagerService.onTransact(ActivityManagerService.java:2757)
06-05 18:34:38.652 W/ActivityManager( 1629): 	at android.os.Binder.execTransact(Binder.java:565)
06-05 18:34:38.668 W/ActivityManager( 1629): Bad activity token: android.os.BinderProxy@44191b1
06-05 18:34:38.668 W/ActivityManager( 1629): java.lang.ClassCastException: android.os.BinderProxy cannot be cast to com.android.server.am.ActivityRecord$Token
06-05 18:34:38.668 W/ActivityManager( 1629): 	at com.android.server.am.ActivityRecord.forTokenLocked(ActivityRecord.java:586)
06-05 18:34:38.668 W/ActivityManager( 1629): 	at com.android.server.am.ActivityRecord.isInStackLocked(ActivityRecord.java:1327)
06-05 18:34:38.668 W/ActivityManager( 1629): 	at com.android.server.am.ActivityManagerService.getActivityOptions(ActivityManagerService.java:12559)
06-05 18:34:38.668 W/ActivityManager( 1629): 	at android.app.ActivityManagerNative.onTransact(ActivityManagerNative.java:1933)
06-05 18:34:38.668 W/ActivityManager( 1629): 	at com.android.server.am.ActivityManagerService.onTransact(ActivityManagerService.java:2757)
06-05 18:34:38.668 W/ActivityManager( 1629): 	at android.os.Binder.execTransact(Binder.java:565)
06-05 18:34:38.668 W/ActivityManager( 1629): Bad activity token: android.os.BinderProxy@44191b1
06-05 18:34:38.668 W/ActivityManager( 1629): java.lang.ClassCastException: android.os.BinderProxy cannot be cast to com.android.server.am.ActivityRecord$Token
06-05 18:34:38.668 W/ActivityManager( 1629): 	at com.android.server.am.ActivityRecord.forTokenLocked(ActivityRecord.java:586)
06-05 18:34:38.668 W/ActivityManager( 1629): 	at com.android.server.am.ActivityRecord.isInStackLocked(ActivityRecord.java:1327)
06-05 18:34:38.668 W/ActivityManager( 1629): 	at com.android.server.am.ActivityManagerService.getActivityOptions(ActivityManagerService.java:12559)
06-05 18:34:38.668 W/ActivityManager( 1629): 	at android.app.ActivityManagerNative.onTransact(ActivityManagerNative.java:1933)
06-05 18:34:38.668 W/ActivityManager( 1629): 	at com.android.server.am.ActivityManagerService.onTransact(ActivityManagerService.java:2757)
06-05 18:34:38.668 W/ActivityManager( 1629): 	at android.os.Binder.execTransact(Binder.java:565)
06-05 18:34:38.671 D/gralloc_ranchu( 1346): gralloc_alloc: Creating ashmem region of size 9023488
06-05 18:34:38.693 V/PhoneStatusBar( 1711): setLightsOn(true)
06-05 18:34:38.705 D/EGL_emulation( 1711): eglMakeCurrent: 0xa5b6bd80: ver 2 0 (tinfo 0xb1367140)
06-05 18:34:38.706 V/PhoneStatusBar( 1711): setLightsOn(true)
06-05 18:34:38.717 V/PhoneStatusBar( 1711): setLightsOn(true)
06-05 18:34:38.717 D/gralloc_ranchu( 1346): gralloc_alloc: Creating ashmem region of size 9023488
06-05 18:34:38.723 V/PhoneStatusBar( 1711): setLightsOn(true)
06-05 18:34:38.727 D/EGL_emulation( 2150): eglMakeCurrent: 0xb4f852a0: ver 2 0 (tinfo 0xb4f832e0)
06-05 18:34:38.730 D/        ( 6165): HostConnection::get() New Host Connection established 0x98c24440, tid 6165
06-05 18:34:38.739 D/EGL_emulation( 1711): eglMakeCurrent: 0xa5b6bd80: ver 2 0 (tinfo 0xb1367140)
06-05 18:34:38.807 I/WindowManager( 1629): Destroying surface Surface(name=com.evancharlton.mileage/com.evancharlton.mileage.Mileage) called by com.android.server.wm.WindowStateAnimator.destroySurface:2016 com.android.server.wm.WindowStateAnimator.destroySurfaceLocked:882 com.android.server.wm.WindowState.removeLocked:1456 com.android.server.wm.WindowManagerService.removeWindowInnerLocked:2484 com.android.server.wm.AppWindowToken.destroySurfaces:365 com.android.server.wm.WindowStateAnimator.finishExit:565 com.android.server.wm.AppWindowAnimator.stepAnimationLocked:427 com.android.server.wm.WindowAnimator.updateAppWindowsLocked:196 
06-05 18:34:38.808 D/EGL_emulation( 1711): eglMakeCurrent: 0xa5b6bd80: ver 2 0 (tinfo 0xb1367140)
06-05 18:34:38.812 D/EGL_emulation( 1711): eglMakeCurrent: 0xa5b6bd80: ver 2 0 (tinfo 0xb1367140)
06-05 18:34:38.825 D/EGL_emulation( 1711): eglMakeCurrent: 0xa5b6bd80: ver 2 0 (tinfo 0xb1367140)
06-05 18:34:38.828 V/PhoneStatusBar( 1711): setLightsOn(true)
06-05 18:34:38.829 D/EGL_emulation( 1711): eglMakeCurrent: 0xa5b6bd80: ver 2 0 (tinfo 0xb1367140)
06-05 18:34:38.838 D/EGL_emulation( 1711): eglMakeCurrent: 0xa5b6bd80: ver 2 0 (tinfo 0xb1367140)
06-05 18:34:38.840 D/EGL_emulation( 1711): eglMakeCurrent: 0xa5b6bd80: ver 2 0 (tinfo 0xb1367140)
06-05 18:34:38.854 D/EGL_emulation( 1711): eglMakeCurrent: 0xa5b6bd80: ver 2 0 (tinfo 0xb1367140)
06-05 18:34:38.854 D/gralloc_ranchu( 1346): gralloc_alloc: Creating ashmem region of size 9023488
06-05 18:34:38.854 V/PhoneStatusBar( 1711): setLightsOn(true)
06-05 18:34:38.855 I/ActivityManager( 1629): Displayed com.evancharlton.mileage/.Mileage: +214ms
06-05 18:34:38.868 D/EGL_emulation( 1711): eglMakeCurrent: 0xa5b6bd80: ver 2 0 (tinfo 0xb1367140)
06-05 18:34:38.871 D/EGL_emulation( 1711): eglMakeCurrent: 0xa5b6bd80: ver 2 0 (tinfo 0xb1367140)
06-05 18:34:38.881 D/EGL_emulation( 1711): eglMakeCurrent: 0xa5b6bd80: ver 2 0 (tinfo 0xb1367140)
06-05 18:34:38.887 D/EGL_emulation( 1711): eglMakeCurrent: 0xa5b6bd80: ver 2 0 (tinfo 0xb1367140)
06-05 18:34:38.889 D/EGL_emulation( 1711): eglMakeCurrent: 0xa5b6bd80: ver 2 0 (tinfo 0xb1367140)
06-05 18:34:38.904 D/EGL_emulation( 1711): eglMakeCurrent: 0xa5b6bd80: ver 2 0 (tinfo 0xb1367140)
06-05 18:34:38.904 V/PhoneStatusBar( 1711): setLightsOn(true)
06-05 18:34:38.906 D/EGL_emulation( 1711): eglMakeCurrent: 0xa5b6bd80: ver 2 0 (tinfo 0xb1367140)
06-05 18:34:38.912 I/System.out( 6165): URI: //map
06-05 18:34:38.912 I/System.out( 6165): params: {json={"query":"* marked:'Statistics'","operation":{"method_name":"query","arguments":[]}}
06-05 18:34:38.912 I/System.out( 6165): }
06-05 18:34:38.921 D/EGL_emulation( 1711): eglMakeCurrent: 0xa5b6bd80: ver 2 0 (tinfo 0xb1367140)
06-05 18:34:38.923 D/EGL_emulation( 1711): eglMakeCurrent: 0xa5b6bd80: ver 2 0 (tinfo 0xb1367140)
06-05 18:34:38.931 W/ResourceType( 6165): No package identifier when getting name for resource number 0x00000001
06-05 18:34:38.937 D/EGL_emulation( 1711): eglMakeCurrent: 0xa5b6bd80: ver 2 0 (tinfo 0xb1367140)
06-05 18:34:38.939 D/EGL_emulation( 1711): eglMakeCurrent: 0xa5b6bd80: ver 2 0 (tinfo 0xb1367140)
06-05 18:34:38.946 I/System.out( 6165): URI: //gesture
06-05 18:34:38.946 I/System.out( 6165): params: {json={"query_timeout":5.0,"gestures":[{"query_string":"* marked:'Statistics'","touches":[{"x":50,"y":50,"offset_x":0,"offset_y":0,"wait":0.0,"time":0.2,"release":true,"query_string":null}]}]}
06-05 18:34:38.946 I/System.out( 6165): }
06-05 18:34:38.951 W/ResourceType( 6165): No package identifier when getting name for resource number 0x00000001
06-05 18:34:38.987 V/PhoneStatusBar( 1711): setLightsOn(true)
06-05 18:34:39.054 I/WindowManager( 1629): Destroying surface Surface(name=Starting com.evancharlton.mileage) called by com.android.server.wm.WindowStateAnimator.destroySurface:2016 com.android.server.wm.WindowStateAnimator.destroySurfaceLocked:882 com.android.server.wm.WindowState.destroyOrSaveSurface:2100 com.android.server.wm.AppWindowToken.destroySurfaces:363 com.android.server.wm.WindowStateAnimator.finishExit:565 com.android.server.wm.WindowStateAnimator.stepAnimationLocked:491 com.android.server.wm.WindowAnimator.updateWindowsLocked:303 com.android.server.wm.WindowAnimator.animateLocked:704 
06-05 18:34:39.055 V/PhoneStatusBar( 1711): setLightsOn(true)
06-05 18:34:39.071 V/PhoneStatusBar( 1711): setLightsOn(true)
06-05 18:34:39.120 V/PhoneStatusBar( 1711): setLightsOn(true)
06-05 18:34:39.121 I/WindowManager( 1629): Destroying surface Surface(name=Toast) called by com.android.server.wm.WindowStateAnimator.destroySurface:2016 com.android.server.wm.WindowStateAnimator.destroySurfaceLocked:882 com.android.server.wm.WindowState.destroyOrSaveSurface:2100 com.android.server.wm.WindowSurfacePlacer.performSurfacePlacementInner:429 com.android.server.wm.WindowSurfacePlacer.performSurfacePlacementLoop:232 com.android.server.wm.WindowSurfacePlacer.performSurfacePlacement:180 com.android.server.wm.WindowManagerService$H.handleMessage:8086 android.os.Handler.dispatchMessage:102 
06-05 18:34:39.122 V/PhoneStatusBar( 1711): setLightsOn(true)
06-05 18:34:39.171 V/PhoneStatusBar( 1711): setLightsOn(true)
06-05 18:34:39.173 I/calabash( 6165): newActivity1
06-05 18:34:39.182 I/System.out( 6165): URI: //map
06-05 18:34:39.182 I/System.out( 6165): params: {json={"query":"android.widget.ScrollView index:0","operation":{"method_name":"query","arguments":[]}}
06-05 18:34:39.182 I/System.out( 6165): }
06-05 18:34:39.186 W/ActivityManager( 1629): Bad activity token: android.os.BinderProxy@3d74a3
06-05 18:34:39.186 W/ActivityManager( 1629): java.lang.ClassCastException: android.os.BinderProxy cannot be cast to com.android.server.am.ActivityRecord$Token
06-05 18:34:39.186 W/ActivityManager( 1629): 	at com.android.server.am.ActivityRecord.forTokenLocked(ActivityRecord.java:586)
06-05 18:34:39.186 W/ActivityManager( 1629): 	at com.android.server.am.ActivityRecord.isInStackLocked(ActivityRecord.java:1327)
06-05 18:34:39.186 W/ActivityManager( 1629): 	at com.android.server.am.ActivityRecord.getStackLocked(ActivityRecord.java:1332)
06-05 18:34:39.186 W/ActivityManager( 1629): 	at com.android.server.am.ActivityManagerService.getActivityDisplayId(ActivityManagerService.java:9806)
06-05 18:34:39.186 W/ActivityManager( 1629): 	at android.app.ActivityManagerNative.onTransact(ActivityManagerNative.java:2566)
06-05 18:34:39.186 W/ActivityManager( 1629): 	at com.android.server.am.ActivityManagerService.onTransact(ActivityManagerService.java:2757)
06-05 18:34:39.186 W/ActivityManager( 1629): 	at android.os.Binder.execTransact(Binder.java:565)
06-05 18:34:39.187 W/ActivityManager( 1629): Bad activity token: android.os.BinderProxy@3d74a3
06-05 18:34:39.187 W/ActivityManager( 1629): java.lang.ClassCastException: android.os.BinderProxy cannot be cast to com.android.server.am.ActivityRecord$Token
06-05 18:34:39.187 W/ActivityManager( 1629): 	at com.android.server.am.ActivityRecord.forTokenLocked(ActivityRecord.java:586)
06-05 18:34:39.187 W/ActivityManager( 1629): 	at com.android.server.am.ActivityRecord.isInStackLocked(ActivityRecord.java:1327)
06-05 18:34:39.187 W/ActivityManager( 1629): 	at com.android.server.am.ActivityManagerService.setTaskDescription(ActivityManagerService.java:9358)
06-05 18:34:39.187 W/ActivityManager( 1629): 	at android.app.ActivityManagerNative.onTransact(ActivityManagerNative.java:2639)
06-05 18:34:39.187 W/ActivityManager( 1629): 	at com.android.server.am.ActivityManagerService.onTransact(ActivityManagerService.java:2757)
06-05 18:34:39.187 W/ActivityManager( 1629): 	at android.os.Binder.execTransact(Binder.java:565)
06-05 18:34:39.187 W/ActivityManager( 1629): Bad activity token: android.os.BinderProxy@3d74a3
06-05 18:34:39.187 W/ActivityManager( 1629): java.lang.ClassCastException: android.os.BinderProxy cannot be cast to com.android.server.am.ActivityRecord$Token
06-05 18:34:39.187 W/ActivityManager( 1629): 	at com.android.server.am.ActivityRecord.forTokenLocked(ActivityRecord.java:586)
06-05 18:34:39.187 W/ActivityManager( 1629): 	at com.android.server.am.ActivityRecord.isInStackLocked(ActivityRecord.java:1327)
06-05 18:34:39.187 W/ActivityManager( 1629): 	at com.android.server.am.ActivityRecord.getStackLocked(ActivityRecord.java:1332)
06-05 18:34:39.187 W/ActivityManager( 1629): 	at com.android.server.am.ActivityManagerService.getActivityStackId(ActivityManagerService.java:9817)
06-05 18:34:39.187 W/ActivityManager( 1629): 	at android.app.ActivityManagerNative.onTransact(ActivityManagerNative.java:2856)
06-05 18:34:39.187 W/ActivityManager( 1629): 	at com.android.server.am.ActivityManagerService.onTransact(ActivityManagerService.java:2757)
06-05 18:34:39.187 W/ActivityManager( 1629): 	at android.os.Binder.execTransact(Binder.java:565)
06-05 18:34:39.192 D/VehicleStatisticsActivity( 6165): Checking recalculation ...
06-05 18:34:39.193 D/VehicleStatisticsActivity( 6165): Recalculation not necessary.
06-05 18:34:39.204 W/ActivityManager( 1629): Bad activity token: android.os.BinderProxy@3d74a3
06-05 18:34:39.204 W/ActivityManager( 1629): java.lang.ClassCastException: android.os.BinderProxy cannot be cast to com.android.server.am.ActivityRecord$Token
06-05 18:34:39.204 W/ActivityManager( 1629): 	at com.android.server.am.ActivityRecord.forTokenLocked(ActivityRecord.java:586)
06-05 18:34:39.204 W/ActivityManager( 1629): 	at com.android.server.am.ActivityRecord.isInStackLocked(ActivityRecord.java:1327)
06-05 18:34:39.204 W/ActivityManager( 1629): 	at com.android.server.am.ActivityManagerService.getActivityOptions(ActivityManagerService.java:12559)
06-05 18:34:39.204 W/ActivityManager( 1629): 	at android.app.ActivityManagerNative.onTransact(ActivityManagerNative.java:1933)
06-05 18:34:39.204 W/ActivityManager( 1629): 	at com.android.server.am.ActivityManagerService.onTransact(ActivityManagerService.java:2757)
06-05 18:34:39.204 W/ActivityManager( 1629): 	at android.os.Binder.execTransact(Binder.java:565)
06-05 18:34:39.205 W/ActivityManager( 1629): Bad activity token: android.os.BinderProxy@3d74a3
06-05 18:34:39.205 W/ActivityManager( 1629): java.lang.ClassCastException: android.os.BinderProxy cannot be cast to com.android.server.am.ActivityRecord$Token
06-05 18:34:39.205 W/ActivityManager( 1629): 	at com.android.server.am.ActivityRecord.forTokenLocked(ActivityRecord.java:586)
06-05 18:34:39.205 W/ActivityManager( 1629): 	at com.android.server.am.ActivityRecord.isInStackLocked(ActivityRecord.java:1327)
06-05 18:34:39.205 W/ActivityManager( 1629): 	at com.android.server.am.ActivityManagerService.getActivityOptions(ActivityManagerService.java:12559)
06-05 18:34:39.205 W/ActivityManager( 1629): 	at android.app.ActivityManagerNative.onTransact(ActivityManagerNative.java:1933)
06-05 18:34:39.205 W/ActivityManager( 1629): 	at com.android.server.am.ActivityManagerService.onTransact(ActivityManagerService.java:2757)
06-05 18:34:39.205 W/ActivityManager( 1629): 	at android.os.Binder.execTransact(Binder.java:565)
06-05 18:34:39.206 D/VehicleStatisticsActivity( 6165): Checking recalculation ...
06-05 18:34:39.207 D/VehicleStatisticsActivity( 6165): Recalculation not necessary.
06-05 18:34:39.305 I/System.out( 6165): URI: //map
06-05 18:34:39.305 I/System.out( 6165): params: {json={"query":"android.widget.AbsListView index:0","operation":{"method_name":"query","arguments":[]}}
06-05 18:34:39.305 I/System.out( 6165): }
06-05 18:34:39.310 I/art     ( 6165): Do partial code cache collection, code=30KB, data=29KB
06-05 18:34:39.311 I/art     ( 6165): After code cache collection, code=29KB, data=28KB
06-05 18:34:39.311 I/art     ( 6165): Increasing code cache capacity to 128KB
06-05 18:34:39.322 I/System.out( 6165): URI: //map
06-05 18:34:39.322 I/System.out( 6165): params: {json={"query":"android.widget.AbsListView index:0","operation":{"method_name":"query","arguments":[]}}
06-05 18:34:39.322 I/System.out( 6165): }
06-05 18:34:39.337 I/System.out( 6165): URI: //map
06-05 18:34:39.337 I/System.out( 6165): params: {json={"query":"android.widget.AbsListView index:0","operation":{"method_name":"query","arguments":[]}}
06-05 18:34:39.337 I/System.out( 6165): }
06-05 18:34:39.353 I/System.out( 6165): URI: //map
06-05 18:34:39.353 I/System.out( 6165): params: {json={"query":"android.widget.AbsListView index:0","operation":{"method_name":"query","arguments":["getFirstVisiblePosition"]}}
06-05 18:34:39.353 I/System.out( 6165): }
06-05 18:34:39.368 I/System.out( 6165): URI: //map
06-05 18:34:39.368 I/System.out( 6165): params: {json={"query":"android.widget.AbsListView index:0","operation":{"method_name":"query","arguments":["getLastVisiblePosition"]}}
06-05 18:34:39.368 I/System.out( 6165): }
06-05 18:34:39.380 I/System.out( 6165): URI: //map
06-05 18:34:39.380 I/System.out( 6165): params: {json={"query":"android.widget.AbsListView index:0","operation":{"method_name":"query","arguments":[{"method_name":"setSelection","arguments":[26]}]}}
06-05 18:34:39.380 I/System.out( 6165): }
06-05 18:34:39.397 I/System.out( 6165): URI: //map
06-05 18:34:39.397 I/System.out( 6165): params: {json={"query":"* marked:'Average price'","operation":{"method_name":"query","arguments":[]}}
06-05 18:34:39.397 I/System.out( 6165): }
06-05 18:34:39.442 D/gralloc_ranchu( 1346): gralloc_alloc: Creating ashmem region of size 9023488
06-05 18:34:39.471 V/PhoneStatusBar( 1711): setLightsOn(true)
06-05 18:34:39.472 V/PhoneStatusBar( 1711): setLightsOn(true)
06-05 18:34:39.473 W/OpenGLRenderer( 2150): Incorrectly called buildLayer on View: ShortcutAndWidgetContainer, destroying layer...
06-05 18:34:39.488 I/WindowManager( 1629): Destroying surface Surface(name=com.android.launcher3/com.android.launcher3.Launcher) called by com.android.server.wm.WindowStateAnimator.destroySurface:2016 com.android.server.wm.WindowStateAnimator.destroySurfaceLocked:882 com.android.server.wm.WindowState.destroyOrSaveSurface:2100 com.android.server.wm.AppWindowToken.destroySurfaces:363 com.android.server.wm.AppWindowToken.notifyAppStopped:389 com.android.server.wm.WindowManagerService.notifyAppStopped:4463 com.android.server.am.ActivityStack.activityStoppedLocked:1252 com.android.server.am.ActivityManagerService.activityStopped:6903 
06-05 18:34:39.489 V/PhoneStatusBar( 1711): setLightsOn(true)
06-05 18:34:39.491 W/ResourceType( 6165): No package identifier when getting name for resource number 0x00000001
06-05 18:34:39.505 I/System.out( 6165): URI: //gesture
06-05 18:34:39.505 I/System.out( 6165): params: {json={"query_timeout":5.0,"gestures":[{"query_string":"* marked:'Average price'","touches":[{"x":50,"y":50,"offset_x":0,"offset_y":0,"wait":0.0,"time":0.2,"release":true,"query_string":null}]}]}
06-05 18:34:39.505 I/System.out( 6165): }
06-05 18:34:39.511 W/ResourceType( 6165): No package identifier when getting name for resource number 0x00000001
06-05 18:34:39.739 I/ActivityManager( 1629): START u0 {cmp=com.evancharlton.mileage/.charts.AveragePriceChart (has extras)} from uid 10160 on display 0
06-05 18:34:39.741 V/PhoneStatusBar( 1711): setLightsOn(true)
06-05 18:34:39.742 V/PhoneStatusBar( 1711): setLightsOn(true)
06-05 18:34:39.764 I/System.out( 6165): URI: //map
06-05 18:34:39.764 I/System.out( 6165): params: {json={"query":"* {text CONTAINS[c] 'Average fuel price'}","operation":{"method_name":"query","arguments":[]}}
06-05 18:34:39.764 I/System.out( 6165): }
06-05 18:34:39.792 I/calabash( 6165): newActivity1
06-05 18:34:39.795 W/aiCharts( 6165): License file is invalid or missing. 
06-05 18:34:39.795 W/aiCharts( 6165): Please place proper license.lic to /assets folder.
06-05 18:34:39.808 V/PhoneStatusBar( 1711): setLightsOn(true)
06-05 18:34:39.837 V/PhoneStatusBar( 1711): setLightsOn(true)
06-05 18:34:39.842 I/WindowManager( 1629): Destroying surface Surface(name=Creating chart…) called by com.android.server.wm.WindowStateAnimator.destroySurface:2016 com.android.server.wm.WindowStateAnimator.destroySurfaceLocked:882 com.android.server.wm.WindowState.removeLocked:1456 com.android.server.wm.WindowManagerService.removeWindowInnerLocked:2484 com.android.server.wm.WindowManagerService.removeWindowLocked:2442 com.android.server.wm.WindowManagerService.removeWindowLocked:2311 com.android.server.wm.WindowManagerService.removeWindow:2306 com.android.server.wm.Session.remove:202 
06-05 18:34:39.844 D/gralloc_ranchu( 1346): gralloc_alloc: Creating ashmem region of size 9023488
06-05 18:34:39.854 V/PhoneStatusBar( 1711): setLightsOn(true)
06-05 18:34:39.878 I/ActivityManager( 1629): Displayed com.evancharlton.mileage/.charts.AveragePriceChart: +89ms
06-05 18:34:39.887 V/PhoneStatusBar( 1711): setLightsOn(true)
06-05 18:34:39.921 V/PhoneStatusBar( 1711): setLightsOn(true)
06-05 18:34:39.927 W/NotificationService( 1629): Object died trying to hide notification android.app.ITransientNotification$Stub$Proxy@a659eef in package com.evancharlton.mileage
06-05 18:34:39.937 V/PhoneStatusBar( 1711): setLightsOn(true)
06-05 18:34:40.124 V/PhoneStatusBar( 1711): setLightsOn(true)
06-05 18:34:40.124 I/System.out( 6165): URI: //map
06-05 18:34:40.124 I/System.out( 6165): params: {json={"query":"* {text CONTAINS[c] 'Average fuel price'}","operation":{"method_name":"query","arguments":[]}}
06-05 18:34:40.124 I/System.out( 6165): }
06-05 18:34:40.168 I/art     ( 6165): Do partial code cache collection, code=60KB, data=62KB
06-05 18:34:40.168 I/System.out( 6165): URI: //
06-05 18:34:40.168 I/System.out( 6165): params: {json={"command":"press_key","arguments":["KEYCODE_BACK"]}
06-05 18:34:40.168 I/art     ( 6165): After code cache collection, code=60KB, data=62KB
06-05 18:34:40.168 I/System.out( 6165): }
06-05 18:34:40.168 I/art     ( 6165): Increasing code cache capacity to 256KB
06-05 18:34:40.168 I/System.out( 6165): header: {content-type=application/json;charset=utf-8, date=Fri, 05 Jun 2020 23:34:40 GMT, accept=*/*, host=127.0.0.1:34783, content-length=52, user-agent=HTTPClient/1.0 (2.8.3, ruby 2.5.1 (2018-03-29))}
06-05 18:34:40.168 I/System.out( 6165): params: {json={"command":"press_key","arguments":["KEYCODE_BACK"]}
06-05 18:34:40.168 I/System.out( 6165): }
06-05 18:34:40.168 I/System.out( 6165): ProP json = {"command":"press_key","arguments":["KEYCODE_BACK"]}
06-05 18:34:40.168 I/System.out( 6165): files: {}
06-05 18:34:40.168 I/System.out( 6165): command: {"command":"press_key","arguments":["KEYCODE_BACK"]}
06-05 18:34:40.170 I/InstrumentationBackend( 6165): Got command:'Command:'Line:null,press_key', arguments:'[KEYCODE_BACK]'
06-05 18:34:40.173 V/PhoneStatusBar( 1711): setLightsOn(true)
06-05 18:34:40.175 V/PhoneStatusBar( 1711): setLightsOn(true)
06-05 18:34:40.178 I/System.out( 6165): result:{"bonusInformation":[],"message":"","success":true}
06-05 18:34:40.179 D/VehicleStatisticsActivity( 6165): Checking recalculation ...
06-05 18:34:40.179 D/VehicleStatisticsActivity( 6165): Recalculation not necessary.
06-05 18:34:40.181 I/System.out( 6165): URI: //map
06-05 18:34:40.181 I/System.out( 6165): params: {json={"query":"* {text CONTAINS[c] 'Statistics'}","operation":{"method_name":"query","arguments":[]}}
06-05 18:34:40.181 I/System.out( 6165): }
06-05 18:34:40.187 V/PhoneStatusBar( 1711): setLightsOn(true)
06-05 18:34:40.204 D/gralloc_ranchu( 1346): gralloc_alloc: Creating ashmem region of size 9023488
06-05 18:34:40.204 V/PhoneStatusBar( 1711): setLightsOn(true)
06-05 18:34:40.220 V/PhoneStatusBar( 1711): setLightsOn(true)
06-05 18:34:40.237 V/PhoneStatusBar( 1711): setLightsOn(true)
