--------- beginning of main
06-06 17:45:33.091 V/PhoneStatusBar( 1713): setLightsOn(true)
06-06 17:45:33.092 V/PhoneStatusBar( 1713): setLightsOn(true)
--------- beginning of system
06-06 17:45:33.093 W/ActivityManager( 1631): Finishing task with all activities already finished
06-06 17:45:33.093 W/ActivityManager( 1631): Duplicate finish request for ActivityRecord{f4e534f u0 com.evancharlton.mileage/.Mileage t24715 f}
06-06 17:45:33.099 D/gralloc_ranchu( 1348): gralloc_alloc: Creating ashmem region of size 3145728
06-06 17:45:33.104 E/EGL_emulation( 1348): tid 1348: eglCreateSyncKHR(1901): error 0x3004 (EGL_BAD_ATTRIBUTE)
06-06 17:45:33.117 W/ActivityManager( 1631): Finishing task with all activities already finished
06-06 17:45:33.117 W/ActivityManager( 1631): Duplicate finish request for ActivityRecord{f4e534f u0 com.evancharlton.mileage/.Mileage t24715 f}
06-06 17:45:33.118 W/ActivityManager( 1631): Finishing task with all activities already finished
06-06 17:45:33.118 W/ActivityManager( 1631): Duplicate finish request for ActivityRecord{f4e534f u0 com.evancharlton.mileage/.Mileage t24715 f}
06-06 17:45:33.118 W/ActivityManager( 1631): Finishing task with all activities already finished
06-06 17:45:33.118 W/ActivityManager( 1631): Duplicate finish request for ActivityRecord{f4e534f u0 com.evancharlton.mileage/.Mileage t24715 f}
06-06 17:45:33.118 W/ActivityManager( 1631): Finishing task with all activities already finished
06-06 17:45:33.118 W/ActivityManager( 1631): Duplicate finish request for ActivityRecord{f4e534f u0 com.evancharlton.mileage/.Mileage t24715 f}
06-06 17:45:33.150 D/EGL_emulation( 1713): eglMakeCurrent: 0xa6a85780: ver 2 0 (tinfo 0xa6a83640)
06-06 17:45:33.165 D/EGL_emulation( 1713): eglMakeCurrent: 0xa6a85780: ver 2 0 (tinfo 0xa6a83640)
06-06 17:45:33.166 D/EGL_emulation( 2106): eglMakeCurrent: 0xa6a85300: ver 2 0 (tinfo 0xa6a83220)
06-06 17:45:33.200 D/EGL_emulation( 1713): eglMakeCurrent: 0xa6a85780: ver 2 0 (tinfo 0xa6a83640)
06-06 17:45:33.215 D/EGL_emulation( 1713): eglMakeCurrent: 0xa6a85780: ver 2 0 (tinfo 0xa6a83640)
06-06 17:45:33.217 D/EGL_emulation( 1713): eglMakeCurrent: 0xa6a85780: ver 2 0 (tinfo 0xa6a83640)
06-06 17:45:33.231 D/EGL_emulation( 1713): eglMakeCurrent: 0xa6a85780: ver 2 0 (tinfo 0xa6a83640)
06-06 17:45:33.234 D/EGL_emulation( 1713): eglMakeCurrent: 0xa6a85780: ver 2 0 (tinfo 0xa6a83640)
06-06 17:45:33.248 D/EGL_emulation( 1713): eglMakeCurrent: 0xa6a85780: ver 2 0 (tinfo 0xa6a83640)
06-06 17:45:33.250 D/EGL_emulation( 1713): eglMakeCurrent: 0xa6a85780: ver 2 0 (tinfo 0xa6a83640)
06-06 17:45:33.256 D/AndroidRuntime(17193): >>>>>> START com.android.internal.os.RuntimeInit uid 2000 <<<<<<
06-06 17:45:33.257 D/AndroidRuntime(17193): CheckJNI is ON
06-06 17:45:33.265 D/EGL_emulation( 1713): eglMakeCurrent: 0xa6a85780: ver 2 0 (tinfo 0xa6a83640)
06-06 17:45:33.266 D/EGL_emulation( 1713): eglMakeCurrent: 0xa6a85780: ver 2 0 (tinfo 0xa6a83640)
06-06 17:45:33.268 W/art     (17193): Unexpected CPU variant for X86 using defaults: x86
06-06 17:45:33.270 D/ICU     (17193): No timezone override file found: /data/misc/zoneinfo/current/icu/icu_tzdata.dat
06-06 17:45:33.276 E/memtrack(17193): Couldn't load memtrack module (No such file or directory)
06-06 17:45:33.276 E/android.os.Debug(17193): failed to load memtrack module: -2
06-06 17:45:33.277 I/Radio-JNI(17193): register_android_hardware_Radio DONE
06-06 17:45:33.281 D/AndroidRuntime(17193): Calling main entry com.android.commands.am.Am
06-06 17:45:33.281 D/EGL_emulation( 1713): eglMakeCurrent: 0xa6a85780: ver 2 0 (tinfo 0xa6a83640)
06-06 17:45:33.283 I/ActivityManager( 1631): Force stopping com.evancharlton.mileage appid=10728 user=0: start instr
06-06 17:45:33.283 I/ActivityManager( 1631): Killing 17145:com.evancharlton.mileage/u0a728 (adj 0): stop com.evancharlton.mileage
06-06 17:45:33.283 D/ActivityManager( 1631): cleanUpApplicationRecord -- 17145
06-06 17:45:33.283 D/EGL_emulation( 1713): eglMakeCurrent: 0xa6a85780: ver 2 0 (tinfo 0xa6a83640)
06-06 17:45:33.283 W/ActivityManager( 1631): Crash of app com.evancharlton.mileage running instrumentation ComponentInfo{com.evancharlton.mileage.test/sh.calaba.instrumentationbackend.CalabashInstrumentationTestRunner}
06-06 17:45:33.283 I/ActivityManager( 1631): Force stopping com.evancharlton.mileage appid=10728 user=0: finished inst
06-06 17:45:33.286 W/InputDispatcher( 1631): channel 'acd9e6 Toast (server)' ~ Consumer closed input channel or an error occurred.  events=0x9
06-06 17:45:33.286 E/InputDispatcher( 1631): channel 'acd9e6 Toast (server)' ~ Channel is unrecoverably broken and will be disposed!
06-06 17:45:33.286 W/InputDispatcher( 1631): channel '2889e6a com.evancharlton.mileage/com.evancharlton.mileage.Mileage (server)' ~ Consumer closed input channel or an error occurred.  events=0x9
06-06 17:45:33.286 E/InputDispatcher( 1631): channel '2889e6a com.evancharlton.mileage/com.evancharlton.mileage.Mileage (server)' ~ Channel is unrecoverably broken and will be disposed!
06-06 17:45:33.286 I/WindowManager( 1631): WIN DEATH: Window{2889e6a u0 com.evancharlton.mileage/com.evancharlton.mileage.Mileage EXITING}
06-06 17:45:33.286 W/InputDispatcher( 1631): Attempted to unregister already unregistered input channel '2889e6a com.evancharlton.mileage/com.evancharlton.mileage.Mileage (server)'
06-06 17:45:33.286 I/art     (17203): Not late-enabling -Xcheck:jni (already on)
06-06 17:45:33.286 W/art     (17203): Unexpected CPU variant for X86 using defaults: x86
06-06 17:45:33.287 I/WindowManager( 1631): WIN DEATH: Window{acd9e6 u0 Toast}
06-06 17:45:33.287 W/InputDispatcher( 1631): Attempted to unregister already unregistered input channel 'acd9e6 Toast (server)'
06-06 17:45:33.294 I/ActivityManager( 1631): Start proc 17203:com.evancharlton.mileage/u0a728 for added application com.evancharlton.mileage
06-06 17:45:33.294 D/AndroidRuntime(17193): Shutting down VM
06-06 17:45:33.299 D/EGL_emulation( 1713): eglMakeCurrent: 0xa6a85780: ver 2 0 (tinfo 0xa6a83640)
06-06 17:45:33.300 W/System  (17203): ClassLoader referenced unknown path: /data/app/com.evancharlton.mileage.test-1/lib/x86
06-06 17:45:33.300 W/System  (17203): ClassLoader referenced unknown path: /data/app/com.evancharlton.mileage-1/lib/x86
06-06 17:45:33.302 D/EGL_emulation( 1713): eglMakeCurrent: 0xa6a85780: ver 2 0 (tinfo 0xa6a83640)
06-06 17:45:33.303 W/System  (17203): ClassLoader referenced unknown path: 
06-06 17:45:33.308 I/System.out(17203): Main activity name automatically set to: com.evancharlton.mileage.Mileage
06-06 17:45:33.308 I/System.out(17203): Calabash did not load Mono. This is only a problem if you are trying to test a Mono application
06-06 17:45:33.308 I/calabash(17203): Test server port: 7102
06-06 17:45:33.309 I/InstrumentationBackend(17203): Added:'GetPreferences', with key:'get_preferences'
06-06 17:45:33.314 I/InstrumentationBackend(17203): Added:'SetPreferences', with key:'set_preferences'
06-06 17:45:33.315 I/InstrumentationBackend(17203): Added:'ClearPreferences', with key:'clear_preferences'
06-06 17:45:33.315 I/InstrumentationBackend(17203): Added:'PressElement', with key:'press_l10n_element'
06-06 17:45:33.315 I/InstrumentationBackend(17203): Added:'WaitForElement', with key:'wait_for_l10n_element'
06-06 17:45:33.315 D/EGL_emulation( 1713): eglMakeCurrent: 0xa6a85780: ver 2 0 (tinfo 0xa6a83640)
06-06 17:45:33.315 I/InstrumentationBackend(17203): Added:'NullAction', with key:'nullAction'
06-06 17:45:33.315 I/InstrumentationBackend(17203): Added:'PressKey', with key:'press_key'
06-06 17:45:33.315 I/InstrumentationBackend(17203): Added:'SetActivityOrientation', with key:'set_activity_orientation'
06-06 17:45:33.315 I/InstrumentationBackend(17203): Added:'GetActivityOrientation', with key:'get_activity_orientation'
06-06 17:45:33.315 I/InstrumentationBackend(17203): Added:'FakeGPSLocation', with key:'set_gps_coordinates'
06-06 17:45:33.315 I/InstrumentationBackend(17203): Added:'SetPropertyByCssSelector', with key:'set_property_by_css_selector'
06-06 17:45:33.315 I/InstrumentationBackend(17203): Added:'GetUrl', with key:'get_url'
06-06 17:45:33.316 I/InstrumentationBackend(17203): Added:'ScrollTo', with key:'scroll_to'
06-06 17:45:33.316 I/InstrumentationBackend(17203): Added:'GetLoadProgress', with key:'get_load_progress'
06-06 17:45:33.316 I/InstrumentationBackend(17203): Added:'DumpHtml', with key:'dump_html'
06-06 17:45:33.316 I/InstrumentationBackend(17203): Added:'DumpBodyHtml', with key:'dump_body_html'
06-06 17:45:33.316 I/InstrumentationBackend(17203): Added:'EnterTextByCssSelector', with key:'enter_text_by_selector'
06-06 17:45:33.316 D/EGL_emulation( 1713): eglMakeCurrent: 0xa6a85780: ver 2 0 (tinfo 0xa6a83640)
06-06 17:45:33.316 I/InstrumentationBackend(17203): Added:'AndroidSDKVersion', with key:'android_sdk_version'
06-06 17:45:33.317 I/InstrumentationBackend(17203): Added:'Version', with key:'version'
06-06 17:45:33.317 I/InstrumentationBackend(17203): Added:'Drag', with key:'drag'
06-06 17:45:33.317 I/InstrumentationBackend(17203): Added:'TouchCoordinates', with key:'touch_coordinate'
06-06 17:45:33.317 I/InstrumentationBackend(17203): Added:'LongPressCoordinate', with key:'long_press_coordinate'
06-06 17:45:33.317 I/InstrumentationBackend(17203): Added:'DragCoordinates', with key:'drag_coordinates'
06-06 17:45:33.317 I/InstrumentationBackend(17203): Added:'ResumeApplication', with key:'resume_application'
06-06 17:45:33.317 I/InstrumentationBackend(17203): Added:'Swipe', with key:'swipe'
06-06 17:45:33.317 I/InstrumentationBackend(17203): Added:'DoubleTapCoordinate', with key:'double_tap_coordinate'
06-06 17:45:33.317 I/InstrumentationBackend(17203): Added:'ClickOnScreen', with key:'click_on_screen'
06-06 17:45:33.317 I/InstrumentationBackend(17203): Added:'GetActivityName', with key:'get_activity_name'
06-06 17:45:33.317 I/InstrumentationBackend(17203): Added:'ScrollToView', with key:'scroll_to_view'
06-06 17:45:33.318 I/InstrumentationBackend(17203): Added:'ViewConfiguration', with key:'view_configuration'
06-06 17:45:33.318 I/InstrumentationBackend(17203): Added:'IsCurrentActivityFocused', with key:'is_current_activity_focused'
06-06 17:45:33.318 I/InstrumentationBackend(17203): Added:'SendTcp', with key:'send_tcp'
06-06 17:45:33.318 I/InstrumentationBackend(17203): Added:'DpToDevicePixel', with key:'dp_to_device_pixel'
06-06 17:45:33.318 I/InstrumentationBackend(17203): Added:'KeyboardEnterText', with key:'keyboard_enter_text'
06-06 17:45:33.318 I/InstrumentationBackend(17203): Added:'DeleteSurroundingText', with key:'delete_surrounding_text'
06-06 17:45:33.318 I/InstrumentationBackend(17203): Added:'SetComposingRegion', with key:'set_composing_region'
06-06 17:45:33.318 I/InstrumentationBackend(17203): Added:'SetSelection', with key:'set_selection'
06-06 17:45:33.318 I/InstrumentationBackend(17203): Added:'KeyboardKeyEvent', with key:'keyboard_key_event'
06-06 17:45:33.318 I/InstrumentationBackend(17203): Added:'PressUserActionButton', with key:'press_user_action_button'
06-06 17:45:33.318 I/InstrumentationBackend(17203): Added:'HideSoftKeyboard', with key:'hide_soft_keyboard'
06-06 17:45:33.318 I/InstrumentationBackend(17203): Added:'ListActions', with key:'list_actions'
06-06 17:45:33.319 I/calabash(17203): Instantiating http server at 7102
06-06 17:45:33.319 I/System.out(17203): HTTP Daemon listening on: 7102
06-06 17:45:33.331 D/EGL_emulation( 1713): eglMakeCurrent: 0xa6a85780: ver 2 0 (tinfo 0xa6a83640)
06-06 17:45:33.333 D/EGL_emulation( 1713): eglMakeCurrent: 0xa6a85780: ver 2 0 (tinfo 0xa6a83640)
06-06 17:45:33.348 D/EGL_emulation( 1713): eglMakeCurrent: 0xa6a85780: ver 2 0 (tinfo 0xa6a83640)
06-06 17:45:33.350 D/EGL_emulation( 1713): eglMakeCurrent: 0xa6a85780: ver 2 0 (tinfo 0xa6a83640)
06-06 17:45:33.365 D/EGL_emulation( 1713): eglMakeCurrent: 0xa6a85780: ver 2 0 (tinfo 0xa6a83640)
06-06 17:45:33.381 D/EGL_emulation( 1713): eglMakeCurrent: 0xa6a85780: ver 2 0 (tinfo 0xa6a83640)
06-06 17:45:33.383 D/EGL_emulation( 1713): eglMakeCurrent: 0xa6a85780: ver 2 0 (tinfo 0xa6a83640)
06-06 17:45:33.403 I/System.out(17203): URI: //ping
06-06 17:45:33.403 I/System.out(17203): params: {json={}
06-06 17:45:33.403 I/System.out(17203): }
06-06 17:45:33.406 I/System.out(17203): URI: //ping
06-06 17:45:33.406 I/System.out(17203): params: {json={}
06-06 17:45:33.406 I/System.out(17203): }
06-06 17:45:33.407 I/System.out(17203): URI: //ready
06-06 17:45:33.407 I/System.out(17203): params: {json={}
06-06 17:45:33.407 I/System.out(17203): }
06-06 17:45:33.408 I/System.out(17203): URI: //
06-06 17:45:33.409 I/System.out(17203): params: {json={"command":"version","arguments":[]}
06-06 17:45:33.409 I/System.out(17203): }
06-06 17:45:33.409 I/System.out(17203): header: {content-type=application/json;charset=utf-8, date=Sat, 06 Jun 2020 22:45:33 GMT, accept=*/*, host=127.0.0.1:34784, content-length=36, user-agent=HTTPClient/1.0 (2.8.3, ruby 2.5.1 (2018-03-29))}
06-06 17:45:33.409 I/System.out(17203): params: {json={"command":"version","arguments":[]}
06-06 17:45:33.409 I/System.out(17203): }
06-06 17:45:33.409 I/System.out(17203): ProP json = {"command":"version","arguments":[]}
06-06 17:45:33.409 I/System.out(17203): files: {}
06-06 17:45:33.409 I/System.out(17203): command: {"command":"version","arguments":[]}
06-06 17:45:33.411 I/InstrumentationBackend(17203): Got command:'Command:'Line:null,version', arguments:'[]'
06-06 17:45:33.418 I/System.out(17203): result:{"bonusInformation":[],"message":"0.9.8","success":true}
06-06 17:45:33.420 I/System.out(17203): URI: //start-application
06-06 17:45:33.420 I/System.out(17203): params: {json={"intent":null}
06-06 17:45:33.420 I/System.out(17203): }
06-06 17:45:33.429 I/ActivityManager( 1631): START u0 {act=android.intent.action.MAIN cat=[android.intent.category.LAUNCHER] flg=0x10200000 cmp=com.evancharlton.mileage/.Mileage} from uid 10728 on display 0
06-06 17:45:33.436 I/calabash(17203): newActivity1
06-06 17:45:33.445 I/calabash(17203): newActivity1
06-06 17:45:33.446 W/ActivityManager( 1631): Bad activity token: android.os.BinderProxy@82fafe9
06-06 17:45:33.446 W/ActivityManager( 1631): java.lang.ClassCastException: android.os.BinderProxy cannot be cast to com.android.server.am.ActivityRecord$Token
06-06 17:45:33.446 W/ActivityManager( 1631): 	at com.android.server.am.ActivityRecord.forTokenLocked(ActivityRecord.java:586)
06-06 17:45:33.446 W/ActivityManager( 1631): 	at com.android.server.am.ActivityRecord.isInStackLocked(ActivityRecord.java:1327)
06-06 17:45:33.446 W/ActivityManager( 1631): 	at com.android.server.am.ActivityRecord.getStackLocked(ActivityRecord.java:1332)
06-06 17:45:33.446 W/ActivityManager( 1631): 	at com.android.server.am.ActivityManagerService.getActivityDisplayId(ActivityManagerService.java:9806)
06-06 17:45:33.446 W/ActivityManager( 1631): 	at android.app.ActivityManagerNative.onTransact(ActivityManagerNative.java:2566)
06-06 17:45:33.446 W/ActivityManager( 1631): 	at com.android.server.am.ActivityManagerService.onTransact(ActivityManagerService.java:2757)
06-06 17:45:33.446 W/ActivityManager( 1631): 	at android.os.Binder.execTransact(Binder.java:565)
06-06 17:45:33.447 W/ActivityManager( 1631): Bad activity token: android.os.BinderProxy@82fafe9
06-06 17:45:33.447 W/ActivityManager( 1631): java.lang.ClassCastException: android.os.BinderProxy cannot be cast to com.android.server.am.ActivityRecord$Token
06-06 17:45:33.447 W/ActivityManager( 1631): 	at com.android.server.am.ActivityRecord.forTokenLocked(ActivityRecord.java:586)
06-06 17:45:33.447 W/ActivityManager( 1631): 	at com.android.server.am.ActivityRecord.isInStackLocked(ActivityRecord.java:1327)
06-06 17:45:33.447 W/ActivityManager( 1631): 	at com.android.server.am.ActivityManagerService.setTaskDescription(ActivityManagerService.java:9358)
06-06 17:45:33.447 W/ActivityManager( 1631): 	at android.app.ActivityManagerNative.onTransact(ActivityManagerNative.java:2639)
06-06 17:45:33.447 W/ActivityManager( 1631): 	at com.android.server.am.ActivityManagerService.onTransact(ActivityManagerService.java:2757)
06-06 17:45:33.447 W/ActivityManager( 1631): 	at android.os.Binder.execTransact(Binder.java:565)
06-06 17:45:33.447 W/ActivityManager( 1631): Bad activity token: android.os.BinderProxy@82fafe9
06-06 17:45:33.447 W/ActivityManager( 1631): java.lang.ClassCastException: android.os.BinderProxy cannot be cast to com.android.server.am.ActivityRecord$Token
06-06 17:45:33.447 W/ActivityManager( 1631): 	at com.android.server.am.ActivityRecord.forTokenLocked(ActivityRecord.java:586)
06-06 17:45:33.447 W/ActivityManager( 1631): 	at com.android.server.am.ActivityRecord.isInStackLocked(ActivityRecord.java:1327)
06-06 17:45:33.447 W/ActivityManager( 1631): 	at com.android.server.am.ActivityRecord.getStackLocked(ActivityRecord.java:1332)
06-06 17:45:33.447 W/ActivityManager( 1631): 	at com.android.server.am.ActivityManagerService.getActivityStackId(ActivityManagerService.java:9817)
06-06 17:45:33.447 W/ActivityManager( 1631): 	at android.app.ActivityManagerNative.onTransact(ActivityManagerNative.java:2856)
06-06 17:45:33.447 W/ActivityManager( 1631): 	at com.android.server.am.ActivityManagerService.onTransact(ActivityManagerService.java:2757)
06-06 17:45:33.447 W/ActivityManager( 1631): 	at android.os.Binder.execTransact(Binder.java:565)
06-06 17:45:33.449 D/gralloc_ranchu( 1348): gralloc_alloc: Creating ashmem region of size 9023488
06-06 17:45:33.469 W/ActivityManager( 1631): Bad activity token: android.os.BinderProxy@82fafe9
06-06 17:45:33.469 W/ActivityManager( 1631): java.lang.ClassCastException: android.os.BinderProxy cannot be cast to com.android.server.am.ActivityRecord$Token
06-06 17:45:33.469 W/ActivityManager( 1631): 	at com.android.server.am.ActivityRecord.forTokenLocked(ActivityRecord.java:586)
06-06 17:45:33.469 W/ActivityManager( 1631): 	at com.android.server.am.ActivityRecord.isInStackLocked(ActivityRecord.java:1327)
06-06 17:45:33.469 W/ActivityManager( 1631): 	at com.android.server.am.ActivityManagerService.getActivityOptions(ActivityManagerService.java:12559)
06-06 17:45:33.469 W/ActivityManager( 1631): 	at android.app.ActivityManagerNative.onTransact(ActivityManagerNative.java:1933)
06-06 17:45:33.469 W/ActivityManager( 1631): 	at com.android.server.am.ActivityManagerService.onTransact(ActivityManagerService.java:2757)
06-06 17:45:33.469 W/ActivityManager( 1631): 	at android.os.Binder.execTransact(Binder.java:565)
06-06 17:45:33.470 W/ActivityManager( 1631): Bad activity token: android.os.BinderProxy@82fafe9
06-06 17:45:33.470 W/ActivityManager( 1631): java.lang.ClassCastException: android.os.BinderProxy cannot be cast to com.android.server.am.ActivityRecord$Token
06-06 17:45:33.470 W/ActivityManager( 1631): 	at com.android.server.am.ActivityRecord.forTokenLocked(ActivityRecord.java:586)
06-06 17:45:33.470 W/ActivityManager( 1631): 	at com.android.server.am.ActivityRecord.isInStackLocked(ActivityRecord.java:1327)
06-06 17:45:33.470 W/ActivityManager( 1631): 	at com.android.server.am.ActivityManagerService.getActivityOptions(ActivityManagerService.java:12559)
06-06 17:45:33.470 W/ActivityManager( 1631): 	at android.app.ActivityManagerNative.onTransact(ActivityManagerNative.java:1933)
06-06 17:45:33.470 W/ActivityManager( 1631): 	at com.android.server.am.ActivityManagerService.onTransact(ActivityManagerService.java:2757)
06-06 17:45:33.470 W/ActivityManager( 1631): 	at android.os.Binder.execTransact(Binder.java:565)
06-06 17:45:33.498 D/gralloc_ranchu( 1348): gralloc_alloc: Creating ashmem region of size 9023488
06-06 17:45:33.502 D/EGL_emulation( 2106): eglMakeCurrent: 0xa6a85300: ver 2 0 (tinfo 0xa6a83220)
06-06 17:45:33.503 D/        (17203): HostConnection::get() New Host Connection established 0x954aa4c0, tid 17203
06-06 17:45:33.503 D/EGL_emulation( 1713): eglMakeCurrent: 0xa6a85780: ver 2 0 (tinfo 0xa6a83640)
06-06 17:45:33.545 D/EGL_emulation( 1713): eglMakeCurrent: 0xa6a85780: ver 2 0 (tinfo 0xa6a83640)
06-06 17:45:33.550 D/EGL_emulation( 1713): eglMakeCurrent: 0xa6a85780: ver 2 0 (tinfo 0xa6a83640)
06-06 17:45:33.550 V/PhoneStatusBar( 1713): setLightsOn(true)
06-06 17:45:33.552 D/EGL_emulation( 1713): eglMakeCurrent: 0xa6a85780: ver 2 0 (tinfo 0xa6a83640)
06-06 17:45:33.567 D/EGL_emulation( 1713): eglMakeCurrent: 0xa6a85780: ver 2 0 (tinfo 0xa6a83640)
06-06 17:45:33.569 D/EGL_emulation( 1713): eglMakeCurrent: 0xa6a85780: ver 2 0 (tinfo 0xa6a83640)
06-06 17:45:33.582 D/EGL_emulation( 1713): eglMakeCurrent: 0xa6a85780: ver 2 0 (tinfo 0xa6a83640)
06-06 17:45:33.583 D/EGL_emulation( 1713): eglMakeCurrent: 0xa6a85780: ver 2 0 (tinfo 0xa6a83640)
06-06 17:45:33.598 D/EGL_emulation( 1713): eglMakeCurrent: 0xa6a85780: ver 2 0 (tinfo 0xa6a83640)
06-06 17:45:33.599 D/gralloc_ranchu( 1348): gralloc_alloc: Creating ashmem region of size 9023488
06-06 17:45:33.600 I/WindowManager( 1631): Destroying surface Surface(name=com.evancharlton.mileage/com.evancharlton.mileage.Mileage) called by com.android.server.wm.WindowStateAnimator.destroySurface:2016 com.android.server.wm.WindowStateAnimator.destroySurfaceLocked:882 com.android.server.wm.WindowState.removeLocked:1456 com.android.server.wm.WindowManagerService.removeWindowInnerLocked:2484 com.android.server.wm.AppWindowToken.destroySurfaces:365 com.android.server.wm.WindowStateAnimator.finishExit:565 com.android.server.wm.AppWindowAnimator.stepAnimationLocked:427 com.android.server.wm.WindowAnimator.updateAppWindowsLocked:196 
06-06 17:45:33.606 D/EGL_emulation( 1713): eglMakeCurrent: 0xa6a85780: ver 2 0 (tinfo 0xa6a83640)
06-06 17:45:33.615 I/ActivityManager( 1631): Displayed com.evancharlton.mileage/.Mileage: +182ms
06-06 17:45:33.621 D/EGL_emulation( 1713): eglMakeCurrent: 0xa6a85780: ver 2 0 (tinfo 0xa6a83640)
06-06 17:45:33.623 D/EGL_emulation( 1713): eglMakeCurrent: 0xa6a85780: ver 2 0 (tinfo 0xa6a83640)
06-06 17:45:33.635 D/EGL_emulation( 1713): eglMakeCurrent: 0xa6a85780: ver 2 0 (tinfo 0xa6a83640)
06-06 17:45:33.636 D/EGL_emulation( 1713): eglMakeCurrent: 0xa6a85780: ver 2 0 (tinfo 0xa6a83640)
06-06 17:45:33.648 D/EGL_emulation( 1713): eglMakeCurrent: 0xa6a85780: ver 2 0 (tinfo 0xa6a83640)
06-06 17:45:33.649 V/PhoneStatusBar( 1713): setLightsOn(true)
06-06 17:45:33.650 D/EGL_emulation( 1713): eglMakeCurrent: 0xa6a85780: ver 2 0 (tinfo 0xa6a83640)
06-06 17:45:33.655 I/System.out(17203): URI: //map
06-06 17:45:33.655 I/System.out(17203): params: {json={"query":"* marked:'Statistics'","operation":{"method_name":"query","arguments":[]}}
06-06 17:45:33.655 I/System.out(17203): }
06-06 17:45:33.665 D/EGL_emulation( 1713): eglMakeCurrent: 0xa6a85780: ver 2 0 (tinfo 0xa6a83640)
06-06 17:45:33.666 D/EGL_emulation( 1713): eglMakeCurrent: 0xa6a85780: ver 2 0 (tinfo 0xa6a83640)
06-06 17:45:33.671 W/ResourceType(17203): No package identifier when getting name for resource number 0x00000001
06-06 17:45:33.681 D/EGL_emulation( 1713): eglMakeCurrent: 0xa6a85780: ver 2 0 (tinfo 0xa6a83640)
06-06 17:45:33.683 I/System.out(17203): URI: //gesture
06-06 17:45:33.683 D/EGL_emulation( 1713): eglMakeCurrent: 0xa6a85780: ver 2 0 (tinfo 0xa6a83640)
06-06 17:45:33.683 I/System.out(17203): params: {json={"query_timeout":5.0,"gestures":[{"query_string":"* marked:'Statistics'","touches":[{"x":50,"y":50,"offset_x":0,"offset_y":0,"wait":0.0,"time":0.2,"release":true,"query_string":null}]}]}
06-06 17:45:33.683 I/System.out(17203): }
06-06 17:45:33.687 W/ResourceType(17203): No package identifier when getting name for resource number 0x00000001
06-06 17:45:33.698 D/EGL_emulation( 1713): eglMakeCurrent: 0xa6a85780: ver 2 0 (tinfo 0xa6a83640)
06-06 17:45:33.706 D/EGL_emulation( 1713): eglMakeCurrent: 0xa6a85780: ver 2 0 (tinfo 0xa6a83640)
06-06 17:45:33.717 D/EGL_emulation( 1713): eglMakeCurrent: 0xa6a85780: ver 2 0 (tinfo 0xa6a83640)
06-06 17:45:33.722 D/EGL_emulation( 1713): eglMakeCurrent: 0xa6a85780: ver 2 0 (tinfo 0xa6a83640)
06-06 17:45:33.816 I/WindowManager( 1631): Destroying surface Surface(name=Starting com.evancharlton.mileage) called by com.android.server.wm.WindowStateAnimator.destroySurface:2016 com.android.server.wm.WindowStateAnimator.destroySurfaceLocked:882 com.android.server.wm.WindowState.destroyOrSaveSurface:2100 com.android.server.wm.AppWindowToken.destroySurfaces:363 com.android.server.wm.WindowStateAnimator.finishExit:565 com.android.server.wm.WindowStateAnimator.stepAnimationLocked:491 com.android.server.wm.WindowAnimator.updateWindowsLocked:303 com.android.server.wm.WindowAnimator.animateLocked:704 
06-06 17:45:33.821 V/PhoneStatusBar( 1713): setLightsOn(true)
06-06 17:45:33.821 I/WindowManager( 1631): Destroying surface Surface(name=Toast) called by com.android.server.wm.WindowStateAnimator.destroySurface:2016 com.android.server.wm.WindowStateAnimator.destroySurfaceLocked:882 com.android.server.wm.WindowState.destroyOrSaveSurface:2100 com.android.server.wm.WindowSurfacePlacer.performSurfacePlacementInner:429 com.android.server.wm.WindowSurfacePlacer.performSurfacePlacementLoop:232 com.android.server.wm.WindowSurfacePlacer.performSurfacePlacement:180 com.android.server.wm.WindowManagerService.removeWindowInnerLocked:2555 com.android.server.wm.AppWindowToken.destroySurfaces:365 
06-06 17:45:33.824 V/PhoneStatusBar( 1713): setLightsOn(true)
06-06 17:45:33.849 V/PhoneStatusBar( 1713): setLightsOn(true)
06-06 17:45:33.921 I/calabash(17203): newActivity1
06-06 17:45:33.951 I/System.out(17203): URI: //map
06-06 17:45:33.951 I/System.out(17203): params: {json={"query":"android.widget.ScrollView index:0","operation":{"method_name":"query","arguments":[]}}
06-06 17:45:33.951 I/System.out(17203): }
06-06 17:45:33.957 W/ActivityManager( 1631): Bad activity token: android.os.BinderProxy@4cdef1b
06-06 17:45:33.957 W/ActivityManager( 1631): java.lang.ClassCastException: android.os.BinderProxy cannot be cast to com.android.server.am.ActivityRecord$Token
06-06 17:45:33.957 W/ActivityManager( 1631): 	at com.android.server.am.ActivityRecord.forTokenLocked(ActivityRecord.java:586)
06-06 17:45:33.957 W/ActivityManager( 1631): 	at com.android.server.am.ActivityRecord.isInStackLocked(ActivityRecord.java:1327)
06-06 17:45:33.957 W/ActivityManager( 1631): 	at com.android.server.am.ActivityRecord.getStackLocked(ActivityRecord.java:1332)
06-06 17:45:33.957 W/ActivityManager( 1631): 	at com.android.server.am.ActivityManagerService.getActivityDisplayId(ActivityManagerService.java:9806)
06-06 17:45:33.957 W/ActivityManager( 1631): 	at android.app.ActivityManagerNative.onTransact(ActivityManagerNative.java:2566)
06-06 17:45:33.957 W/ActivityManager( 1631): 	at com.android.server.am.ActivityManagerService.onTransact(ActivityManagerService.java:2757)
06-06 17:45:33.957 W/ActivityManager( 1631): 	at android.os.Binder.execTransact(Binder.java:565)
06-06 17:45:33.958 W/ActivityManager( 1631): Bad activity token: android.os.BinderProxy@4cdef1b
06-06 17:45:33.958 W/ActivityManager( 1631): java.lang.ClassCastException: android.os.BinderProxy cannot be cast to com.android.server.am.ActivityRecord$Token
06-06 17:45:33.958 W/ActivityManager( 1631): 	at com.android.server.am.ActivityRecord.forTokenLocked(ActivityRecord.java:586)
06-06 17:45:33.958 W/ActivityManager( 1631): 	at com.android.server.am.ActivityRecord.isInStackLocked(ActivityRecord.java:1327)
06-06 17:45:33.958 W/ActivityManager( 1631): 	at com.android.server.am.ActivityManagerService.setTaskDescription(ActivityManagerService.java:9358)
06-06 17:45:33.958 W/ActivityManager( 1631): 	at android.app.ActivityManagerNative.onTransact(ActivityManagerNative.java:2639)
06-06 17:45:33.958 W/ActivityManager( 1631): 	at com.android.server.am.ActivityManagerService.onTransact(ActivityManagerService.java:2757)
06-06 17:45:33.958 W/ActivityManager( 1631): 	at android.os.Binder.execTransact(Binder.java:565)
06-06 17:45:33.959 W/ActivityManager( 1631): Bad activity token: android.os.BinderProxy@4cdef1b
06-06 17:45:33.959 W/ActivityManager( 1631): java.lang.ClassCastException: android.os.BinderProxy cannot be cast to com.android.server.am.ActivityRecord$Token
06-06 17:45:33.959 W/ActivityManager( 1631): 	at com.android.server.am.ActivityRecord.forTokenLocked(ActivityRecord.java:586)
06-06 17:45:33.959 W/ActivityManager( 1631): 	at com.android.server.am.ActivityRecord.isInStackLocked(ActivityRecord.java:1327)
06-06 17:45:33.959 W/ActivityManager( 1631): 	at com.android.server.am.ActivityRecord.getStackLocked(ActivityRecord.java:1332)
06-06 17:45:33.959 W/ActivityManager( 1631): 	at com.android.server.am.ActivityManagerService.getActivityStackId(ActivityManagerService.java:9817)
06-06 17:45:33.959 W/ActivityManager( 1631): 	at android.app.ActivityManagerNative.onTransact(ActivityManagerNative.java:2856)
06-06 17:45:33.959 W/ActivityManager( 1631): 	at com.android.server.am.ActivityManagerService.onTransact(ActivityManagerService.java:2757)
06-06 17:45:33.959 W/ActivityManager( 1631): 	at android.os.Binder.execTransact(Binder.java:565)
06-06 17:45:33.965 V/PhoneStatusBar( 1713): setLightsOn(true)
06-06 17:45:33.965 D/VehicleStatisticsActivity(17203): Checking recalculation ...
06-06 17:45:33.966 D/VehicleStatisticsActivity(17203): Recalculation not necessary.
06-06 17:45:33.981 W/ActivityManager( 1631): Bad activity token: android.os.BinderProxy@4cdef1b
06-06 17:45:33.981 W/ActivityManager( 1631): java.lang.ClassCastException: android.os.BinderProxy cannot be cast to com.android.server.am.ActivityRecord$Token
06-06 17:45:33.981 W/ActivityManager( 1631): 	at com.android.server.am.ActivityRecord.forTokenLocked(ActivityRecord.java:586)
06-06 17:45:33.981 W/ActivityManager( 1631): 	at com.android.server.am.ActivityRecord.isInStackLocked(ActivityRecord.java:1327)
06-06 17:45:33.981 W/ActivityManager( 1631): 	at com.android.server.am.ActivityManagerService.getActivityOptions(ActivityManagerService.java:12559)
06-06 17:45:33.981 W/ActivityManager( 1631): 	at android.app.ActivityManagerNative.onTransact(ActivityManagerNative.java:1933)
06-06 17:45:33.981 W/ActivityManager( 1631): 	at com.android.server.am.ActivityManagerService.onTransact(ActivityManagerService.java:2757)
06-06 17:45:33.981 W/ActivityManager( 1631): 	at android.os.Binder.execTransact(Binder.java:565)
06-06 17:45:33.982 W/ActivityManager( 1631): Bad activity token: android.os.BinderProxy@4cdef1b
06-06 17:45:33.982 W/ActivityManager( 1631): java.lang.ClassCastException: android.os.BinderProxy cannot be cast to com.android.server.am.ActivityRecord$Token
06-06 17:45:33.982 W/ActivityManager( 1631): 	at com.android.server.am.ActivityRecord.forTokenLocked(ActivityRecord.java:586)
06-06 17:45:33.982 W/ActivityManager( 1631): 	at com.android.server.am.ActivityRecord.isInStackLocked(ActivityRecord.java:1327)
06-06 17:45:33.982 W/ActivityManager( 1631): 	at com.android.server.am.ActivityManagerService.getActivityOptions(ActivityManagerService.java:12559)
06-06 17:45:33.982 W/ActivityManager( 1631): 	at android.app.ActivityManagerNative.onTransact(ActivityManagerNative.java:1933)
06-06 17:45:33.982 W/ActivityManager( 1631): 	at com.android.server.am.ActivityManagerService.onTransact(ActivityManagerService.java:2757)
06-06 17:45:33.982 W/ActivityManager( 1631): 	at android.os.Binder.execTransact(Binder.java:565)
06-06 17:45:33.983 D/VehicleStatisticsActivity(17203): Checking recalculation ...
06-06 17:45:33.984 D/VehicleStatisticsActivity(17203): Recalculation not necessary.
06-06 17:45:34.069 I/System.out(17203): URI: //map
06-06 17:45:34.069 I/System.out(17203): params: {json={"query":"android.widget.AbsListView index:0","operation":{"method_name":"query","arguments":[]}}
06-06 17:45:34.069 I/System.out(17203): }
06-06 17:45:34.074 I/art     (17203): Do partial code cache collection, code=30KB, data=29KB
06-06 17:45:34.074 I/art     (17203): After code cache collection, code=29KB, data=28KB
06-06 17:45:34.074 I/art     (17203): Increasing code cache capacity to 128KB
06-06 17:45:34.083 I/System.out(17203): URI: //map
06-06 17:45:34.083 I/System.out(17203): params: {json={"query":"android.widget.AbsListView index:0","operation":{"method_name":"query","arguments":[]}}
06-06 17:45:34.083 I/System.out(17203): }
06-06 17:45:34.096 I/System.out(17203): URI: //map
06-06 17:45:34.096 I/System.out(17203): params: {json={"query":"android.widget.AbsListView index:0","operation":{"method_name":"query","arguments":[]}}
06-06 17:45:34.096 I/System.out(17203): }
06-06 17:45:34.110 I/System.out(17203): URI: //map
06-06 17:45:34.110 I/System.out(17203): params: {json={"query":"android.widget.AbsListView index:0","operation":{"method_name":"query","arguments":["getFirstVisiblePosition"]}}
06-06 17:45:34.110 I/System.out(17203): }
06-06 17:45:34.121 I/System.out(17203): URI: //map
06-06 17:45:34.121 I/System.out(17203): params: {json={"query":"android.widget.AbsListView index:0","operation":{"method_name":"query","arguments":["getLastVisiblePosition"]}}
06-06 17:45:34.121 I/System.out(17203): }
06-06 17:45:34.134 I/System.out(17203): URI: //map
06-06 17:45:34.134 I/System.out(17203): params: {json={"query":"android.widget.AbsListView index:0","operation":{"method_name":"query","arguments":[{"method_name":"setSelection","arguments":[26]}]}}
06-06 17:45:34.134 I/System.out(17203): }
06-06 17:45:34.154 I/System.out(17203): URI: //map
06-06 17:45:34.154 I/System.out(17203): params: {json={"query":"* marked:'North'","operation":{"method_name":"query","arguments":[]}}
06-06 17:45:34.154 I/System.out(17203): }
06-06 17:45:34.185 D/gralloc_ranchu( 1348): gralloc_alloc: Creating ashmem region of size 9023488
06-06 17:45:34.218 W/ResourceType(17203): No package identifier when getting name for resource number 0x00000001
06-06 17:45:34.228 I/System.out(17203): URI: //gesture
06-06 17:45:34.228 I/System.out(17203): params: {json={"query_timeout":5.0,"gestures":[{"query_string":"* marked:'North'","touches":[{"x":50,"y":50,"offset_x":0,"offset_y":0,"wait":0.0,"time":0.2,"release":true,"query_string":null}]}]}
06-06 17:45:34.228 I/System.out(17203): }
06-06 17:45:34.231 W/ResourceType(17203): No package identifier when getting name for resource number 0x00000001
06-06 17:45:34.249 V/PhoneStatusBar( 1713): setLightsOn(true)
06-06 17:45:34.251 V/PhoneStatusBar( 1713): setLightsOn(true)
06-06 17:45:34.253 W/OpenGLRenderer( 2106): Incorrectly called buildLayer on View: ShortcutAndWidgetContainer, destroying layer...
06-06 17:45:34.266 V/PhoneStatusBar( 1713): setLightsOn(true)
06-06 17:45:34.269 I/WindowManager( 1631): Destroying surface Surface(name=com.android.launcher3/com.android.launcher3.Launcher) called by com.android.server.wm.WindowStateAnimator.destroySurface:2016 com.android.server.wm.WindowStateAnimator.destroySurfaceLocked:882 com.android.server.wm.WindowState.destroyOrSaveSurface:2100 com.android.server.wm.AppWindowToken.destroySurfaces:363 com.android.server.wm.AppWindowToken.notifyAppStopped:389 com.android.server.wm.WindowManagerService.notifyAppStopped:4463 com.android.server.am.ActivityStack.activityStoppedLocked:1252 com.android.server.am.ActivityManagerService.activityStopped:6903 
06-06 17:45:34.468 I/ActivityManager( 1631): START u0 {cmp=com.evancharlton.mileage/.charts.NorthChart (has extras)} from uid 10728 on display 0
06-06 17:45:34.473 V/PhoneStatusBar( 1713): setLightsOn(true)
06-06 17:45:34.476 V/PhoneStatusBar( 1713): setLightsOn(true)
06-06 17:45:34.511 I/System.out(17203): URI: //map
06-06 17:45:34.511 I/System.out(17203): params: {json={"query":"* {text CONTAINS[c] 'Farthest north fillup'}","operation":{"method_name":"query","arguments":[]}}
06-06 17:45:34.511 I/System.out(17203): }
06-06 17:45:34.535 I/calabash(17203): newActivity1
06-06 17:45:34.539 W/aiCharts(17203): License file is invalid or missing. 
06-06 17:45:34.539 W/aiCharts(17203): Please place proper license.lic to /assets folder.
06-06 17:45:34.557 V/PhoneStatusBar( 1713): setLightsOn(true)
06-06 17:45:34.582 V/PhoneStatusBar( 1713): setLightsOn(true)
06-06 17:45:34.593 I/WindowManager( 1631): Destroying surface Surface(name=Creating chart…) called by com.android.server.wm.WindowStateAnimator.destroySurface:2016 com.android.server.wm.WindowStateAnimator.destroySurfaceLocked:882 com.android.server.wm.WindowState.removeLocked:1456 com.android.server.wm.WindowManagerService.removeWindowInnerLocked:2484 com.android.server.wm.WindowManagerService.removeWindowLocked:2442 com.android.server.wm.WindowManagerService.removeWindowLocked:2311 com.android.server.wm.WindowManagerService.removeWindow:2306 com.android.server.wm.Session.remove:202 
06-06 17:45:34.598 V/PhoneStatusBar( 1713): setLightsOn(true)
06-06 17:45:34.598 D/gralloc_ranchu( 1348): gralloc_alloc: Creating ashmem region of size 9023488
06-06 17:45:34.630 I/ActivityManager( 1631): Displayed com.evancharlton.mileage/.charts.NorthChart: +98ms
06-06 17:45:34.633 V/PhoneStatusBar( 1713): setLightsOn(true)
06-06 17:45:34.652 W/NotificationService( 1631): Object died trying to hide notification android.app.ITransientNotification$Stub$Proxy@2a9b6e7 in package com.evancharlton.mileage
06-06 17:45:34.665 V/PhoneStatusBar( 1713): setLightsOn(true)
06-06 17:45:34.682 V/PhoneStatusBar( 1713): setLightsOn(true)
06-06 17:45:34.865 V/PhoneStatusBar( 1713): setLightsOn(true)
06-06 17:45:34.873 I/System.out(17203): URI: //map
06-06 17:45:34.873 I/System.out(17203): params: {json={"query":"* {text CONTAINS[c] 'Farthest north fillup'}","operation":{"method_name":"query","arguments":[]}}
06-06 17:45:34.873 I/System.out(17203): }
06-06 17:45:34.888 I/System.out(17203): URI: //
06-06 17:45:34.888 I/System.out(17203): params: {json={"command":"press_key","arguments":["KEYCODE_BACK"]}
06-06 17:45:34.888 I/System.out(17203): }
06-06 17:45:34.888 I/System.out(17203): header: {content-type=application/json;charset=utf-8, date=Sat, 06 Jun 2020 22:45:35 GMT, accept=*/*, host=127.0.0.1:34784, content-length=52, user-agent=HTTPClient/1.0 (2.8.3, ruby 2.5.1 (2018-03-29))}
06-06 17:45:34.888 I/System.out(17203): params: {json={"command":"press_key","arguments":["KEYCODE_BACK"]}
06-06 17:45:34.888 I/System.out(17203): }
06-06 17:45:34.888 I/System.out(17203): ProP json = {"command":"press_key","arguments":["KEYCODE_BACK"]}
06-06 17:45:34.888 I/System.out(17203): files: {}
06-06 17:45:34.888 I/System.out(17203): command: {"command":"press_key","arguments":["KEYCODE_BACK"]}
06-06 17:45:34.889 I/InstrumentationBackend(17203): Got command:'Command:'Line:null,press_key', arguments:'[KEYCODE_BACK]'
06-06 17:45:34.891 V/PhoneStatusBar( 1713): setLightsOn(true)
06-06 17:45:34.893 V/PhoneStatusBar( 1713): setLightsOn(true)
06-06 17:45:34.894 I/art     (17203): Do partial code cache collection, code=60KB, data=62KB
06-06 17:45:34.895 I/art     (17203): After code cache collection, code=59KB, data=61KB
06-06 17:45:34.895 I/art     (17203): Increasing code cache capacity to 256KB
06-06 17:45:34.895 D/VehicleStatisticsActivity(17203): Checking recalculation ...
06-06 17:45:34.896 D/VehicleStatisticsActivity(17203): Recalculation not necessary.
06-06 17:45:34.896 I/System.out(17203): result:{"bonusInformation":[],"message":"","success":true}
06-06 17:45:34.898 V/PhoneStatusBar( 1713): setLightsOn(true)
06-06 17:45:34.899 I/System.out(17203): URI: //map
06-06 17:45:34.899 I/System.out(17203): params: {json={"query":"* {text CONTAINS[c] 'Statistics'}","operation":{"method_name":"query","arguments":[]}}
06-06 17:45:34.899 I/System.out(17203): }
06-06 17:45:34.914 D/gralloc_ranchu( 1348): gralloc_alloc: Creating ashmem region of size 9023488
06-06 17:45:34.915 V/PhoneStatusBar( 1713): setLightsOn(true)
06-06 17:45:34.931 V/PhoneStatusBar( 1713): setLightsOn(true)
06-06 17:45:34.948 V/PhoneStatusBar( 1713): setLightsOn(true)
