--------- beginning of main
06-05 19:59:33.568 V/PhoneStatusBar( 1711): setLightsOn(true)
06-05 19:59:33.570 D/gralloc_ranchu( 1348): gralloc_alloc: Creating ashmem region of size 3145728
06-05 19:59:33.574 E/EGL_emulation( 1348): tid 1348: eglCreateSyncKHR(1901): error 0x3004 (EGL_BAD_ATTRIBUTE)
--------- beginning of system
06-05 19:59:33.583 W/ActivityManager( 1629): Finishing task with all activities already finished
06-05 19:59:33.583 W/ActivityManager( 1629): Duplicate finish request for ActivityRecord{ff70b96 u0 com.evancharlton.mileage/.Mileage t4460 f}
06-05 19:59:33.583 W/ActivityManager( 1629): Finishing task with all activities already finished
06-05 19:59:33.583 W/ActivityManager( 1629): Duplicate finish request for ActivityRecord{ff70b96 u0 com.evancharlton.mileage/.Mileage t4460 f}
06-05 19:59:33.583 W/ActivityManager( 1629): Finishing task with all activities already finished
06-05 19:59:33.584 W/ActivityManager( 1629): Duplicate finish request for ActivityRecord{ff70b96 u0 com.evancharlton.mileage/.Mileage t4460 f}
06-05 19:59:33.584 W/ActivityManager( 1629): Finishing task with all activities already finished
06-05 19:59:33.584 W/ActivityManager( 1629): Duplicate finish request for ActivityRecord{ff70b96 u0 com.evancharlton.mileage/.Mileage t4460 f}
06-05 19:59:33.584 W/ActivityManager( 1629): Finishing task with all activities already finished
06-05 19:59:33.584 W/ActivityManager( 1629): Duplicate finish request for ActivityRecord{ff70b96 u0 com.evancharlton.mileage/.Mileage t4460 f}
06-05 19:59:33.584 W/ActivityManager( 1629): Finishing task with all activities already finished
06-05 19:59:33.584 W/ActivityManager( 1629): Duplicate finish request for ActivityRecord{35f51d0 u0 com.evancharlton.mileage/.charts.MaximumPriceChart t4460 f}
06-05 19:59:33.584 W/ActivityManager( 1629): Finishing task with all activities already finished
06-05 19:59:33.584 W/ActivityManager( 1629): Duplicate finish request for ActivityRecord{35f51d0 u0 com.evancharlton.mileage/.charts.MaximumPriceChart t4460 f}
06-05 19:59:33.584 W/ActivityManager( 1629): Finishing task with all activities already finished
06-05 19:59:33.584 W/ActivityManager( 1629): Duplicate finish request for ActivityRecord{ff70b96 u0 com.evancharlton.mileage/.Mileage t4460 f}
06-05 19:59:33.584 W/ActivityManager( 1629): Finishing task with all activities already finished
06-05 19:59:33.584 W/ActivityManager( 1629): Duplicate finish request for ActivityRecord{ff70b96 u0 com.evancharlton.mileage/.Mileage t4460 f}
06-05 19:59:33.602 D/EGL_emulation( 2147): eglMakeCurrent: 0xa3805360: ver 2 0 (tinfo 0xa3803630)
06-05 19:59:33.619 D/EGL_emulation( 1711): eglMakeCurrent: 0x9f1709c0: ver 2 0 (tinfo 0xa0e61d00)
06-05 19:59:33.635 D/EGL_emulation( 1711): eglMakeCurrent: 0x9f1709c0: ver 2 0 (tinfo 0xa0e61d00)
06-05 19:59:33.637 D/EGL_emulation( 1711): eglMakeCurrent: 0x9f1709c0: ver 2 0 (tinfo 0xa0e61d00)
06-05 19:59:33.651 D/EGL_emulation( 1711): eglMakeCurrent: 0x9f1709c0: ver 2 0 (tinfo 0xa0e61d00)
06-05 19:59:33.654 D/EGL_emulation( 1711): eglMakeCurrent: 0x9f1709c0: ver 2 0 (tinfo 0xa0e61d00)
06-05 19:59:33.668 D/EGL_emulation( 1711): eglMakeCurrent: 0x9f1709c0: ver 2 0 (tinfo 0xa0e61d00)
06-05 19:59:33.670 D/EGL_emulation( 1711): eglMakeCurrent: 0x9f1709c0: ver 2 0 (tinfo 0xa0e61d00)
06-05 19:59:33.685 D/EGL_emulation( 1711): eglMakeCurrent: 0x9f1709c0: ver 2 0 (tinfo 0xa0e61d00)
06-05 19:59:33.687 D/EGL_emulation( 1711): eglMakeCurrent: 0x9f1709c0: ver 2 0 (tinfo 0xa0e61d00)
06-05 19:59:33.702 D/EGL_emulation( 1711): eglMakeCurrent: 0x9f1709c0: ver 2 0 (tinfo 0xa0e61d00)
06-05 19:59:33.704 D/EGL_emulation( 1711): eglMakeCurrent: 0x9f1709c0: ver 2 0 (tinfo 0xa0e61d00)
06-05 19:59:33.718 D/EGL_emulation( 1711): eglMakeCurrent: 0x9f1709c0: ver 2 0 (tinfo 0xa0e61d00)
06-05 19:59:33.720 D/EGL_emulation( 1711): eglMakeCurrent: 0x9f1709c0: ver 2 0 (tinfo 0xa0e61d00)
06-05 19:59:33.735 D/EGL_emulation( 1711): eglMakeCurrent: 0x9f1709c0: ver 2 0 (tinfo 0xa0e61d00)
06-05 19:59:33.736 D/EGL_emulation( 1711): eglMakeCurrent: 0x9f1709c0: ver 2 0 (tinfo 0xa0e61d00)
06-05 19:59:33.752 D/EGL_emulation( 1711): eglMakeCurrent: 0x9f1709c0: ver 2 0 (tinfo 0xa0e61d00)
06-05 19:59:33.752 D/AndroidRuntime(20550): >>>>>> START com.android.internal.os.RuntimeInit uid 2000 <<<<<<
06-05 19:59:33.753 D/EGL_emulation( 1711): eglMakeCurrent: 0x9f1709c0: ver 2 0 (tinfo 0xa0e61d00)
06-05 19:59:33.753 D/AndroidRuntime(20550): CheckJNI is ON
06-05 19:59:33.765 W/art     (20550): Unexpected CPU variant for X86 using defaults: x86
06-05 19:59:33.767 D/ICU     (20550): No timezone override file found: /data/misc/zoneinfo/current/icu/icu_tzdata.dat
06-05 19:59:33.768 D/EGL_emulation( 1711): eglMakeCurrent: 0x9f1709c0: ver 2 0 (tinfo 0xa0e61d00)
06-05 19:59:33.770 D/EGL_emulation( 1711): eglMakeCurrent: 0x9f1709c0: ver 2 0 (tinfo 0xa0e61d00)
06-05 19:59:33.774 E/memtrack(20550): Couldn't load memtrack module (No such file or directory)
06-05 19:59:33.774 E/android.os.Debug(20550): failed to load memtrack module: -2
06-05 19:59:33.775 I/Radio-JNI(20550): register_android_hardware_Radio DONE
06-05 19:59:33.779 D/AndroidRuntime(20550): Calling main entry com.android.commands.am.Am
06-05 19:59:33.780 I/ActivityManager( 1629): Force stopping com.evancharlton.mileage appid=10196 user=0: start instr
06-05 19:59:33.781 I/ActivityManager( 1629): Killing 20497:com.evancharlton.mileage/u0a196 (adj 0): stop com.evancharlton.mileage
06-05 19:59:33.781 D/ActivityManager( 1629): cleanUpApplicationRecord -- 20497
06-05 19:59:33.781 I/WindowManager( 1629): Destroying surface Surface(name=com.evancharlton.mileage/com.evancharlton.mileage.charts.MaximumPriceChart) called by com.android.server.wm.WindowStateAnimator.destroySurface:2016 com.android.server.wm.WindowStateAnimator.destroySurfaceLocked:882 com.android.server.wm.WindowState.removeLocked:1456 com.android.server.wm.WindowManagerService.removeWindowInnerLocked:2484 com.android.server.wm.WindowManagerService.removeWindowLocked:2442 com.android.server.wm.WindowManagerService.removeWindowLocked:2311 com.android.server.wm.AppWindowToken.removeAllWindows:530 com.android.server.wm.AppWindowToken.removeAppFromTaskLocked:326 
06-05 19:59:33.782 W/ActivityManager( 1629): Crash of app com.evancharlton.mileage running instrumentation ComponentInfo{com.evancharlton.mileage.test/sh.calaba.instrumentationbackend.CalabashInstrumentationTestRunner}
06-05 19:59:33.782 I/ActivityManager( 1629): Force stopping com.evancharlton.mileage appid=10196 user=0: finished inst
06-05 19:59:33.785 I/art     (20560): Not late-enabling -Xcheck:jni (already on)
06-05 19:59:33.785 D/EGL_emulation( 1711): eglMakeCurrent: 0x9f1709c0: ver 2 0 (tinfo 0xa0e61d00)
06-05 19:59:33.785 W/art     (20560): Unexpected CPU variant for X86 using defaults: x86
06-05 19:59:33.787 D/EGL_emulation( 1711): eglMakeCurrent: 0x9f1709c0: ver 2 0 (tinfo 0xa0e61d00)
06-05 19:59:33.793 I/ActivityManager( 1629): Start proc 20560:com.evancharlton.mileage/u0a196 for added application com.evancharlton.mileage
06-05 19:59:33.793 D/AndroidRuntime(20550): Shutting down VM
06-05 19:59:33.798 W/System  (20560): ClassLoader referenced unknown path: /data/app/com.evancharlton.mileage.test-1/lib/x86
06-05 19:59:33.798 W/System  (20560): ClassLoader referenced unknown path: /data/app/com.evancharlton.mileage-1/lib/x86
06-05 19:59:33.801 W/System  (20560): ClassLoader referenced unknown path: 
06-05 19:59:33.801 D/EGL_emulation( 1711): eglMakeCurrent: 0x9f1709c0: ver 2 0 (tinfo 0xa0e61d00)
06-05 19:59:33.804 D/EGL_emulation( 1711): eglMakeCurrent: 0x9f1709c0: ver 2 0 (tinfo 0xa0e61d00)
06-05 19:59:33.806 I/System.out(20560): Main activity name automatically set to: com.evancharlton.mileage.Mileage
06-05 19:59:33.806 I/System.out(20560): Calabash did not load Mono. This is only a problem if you are trying to test a Mono application
06-05 19:59:33.806 I/calabash(20560): Test server port: 7102
06-05 19:59:33.807 I/InstrumentationBackend(20560): Added:'GetPreferences', with key:'get_preferences'
06-05 19:59:33.812 I/InstrumentationBackend(20560): Added:'SetPreferences', with key:'set_preferences'
06-05 19:59:33.812 I/InstrumentationBackend(20560): Added:'ClearPreferences', with key:'clear_preferences'
06-05 19:59:33.812 I/InstrumentationBackend(20560): Added:'PressElement', with key:'press_l10n_element'
06-05 19:59:33.812 I/InstrumentationBackend(20560): Added:'WaitForElement', with key:'wait_for_l10n_element'
06-05 19:59:33.812 I/InstrumentationBackend(20560): Added:'NullAction', with key:'nullAction'
06-05 19:59:33.813 I/InstrumentationBackend(20560): Added:'PressKey', with key:'press_key'
06-05 19:59:33.813 I/InstrumentationBackend(20560): Added:'SetActivityOrientation', with key:'set_activity_orientation'
06-05 19:59:33.813 I/InstrumentationBackend(20560): Added:'GetActivityOrientation', with key:'get_activity_orientation'
06-05 19:59:33.813 I/InstrumentationBackend(20560): Added:'FakeGPSLocation', with key:'set_gps_coordinates'
06-05 19:59:33.813 I/InstrumentationBackend(20560): Added:'SetPropertyByCssSelector', with key:'set_property_by_css_selector'
06-05 19:59:33.813 I/InstrumentationBackend(20560): Added:'GetUrl', with key:'get_url'
06-05 19:59:33.814 I/InstrumentationBackend(20560): Added:'ScrollTo', with key:'scroll_to'
06-05 19:59:33.814 I/InstrumentationBackend(20560): Added:'GetLoadProgress', with key:'get_load_progress'
06-05 19:59:33.814 I/InstrumentationBackend(20560): Added:'DumpHtml', with key:'dump_html'
06-05 19:59:33.814 I/InstrumentationBackend(20560): Added:'DumpBodyHtml', with key:'dump_body_html'
06-05 19:59:33.814 I/InstrumentationBackend(20560): Added:'EnterTextByCssSelector', with key:'enter_text_by_selector'
06-05 19:59:33.815 I/InstrumentationBackend(20560): Added:'AndroidSDKVersion', with key:'android_sdk_version'
06-05 19:59:33.815 I/InstrumentationBackend(20560): Added:'Version', with key:'version'
06-05 19:59:33.815 I/InstrumentationBackend(20560): Added:'Drag', with key:'drag'
06-05 19:59:33.815 I/InstrumentationBackend(20560): Added:'TouchCoordinates', with key:'touch_coordinate'
06-05 19:59:33.815 I/InstrumentationBackend(20560): Added:'LongPressCoordinate', with key:'long_press_coordinate'
06-05 19:59:33.815 I/InstrumentationBackend(20560): Added:'DragCoordinates', with key:'drag_coordinates'
06-05 19:59:33.815 I/InstrumentationBackend(20560): Added:'ResumeApplication', with key:'resume_application'
06-05 19:59:33.815 I/InstrumentationBackend(20560): Added:'Swipe', with key:'swipe'
06-05 19:59:33.815 I/InstrumentationBackend(20560): Added:'DoubleTapCoordinate', with key:'double_tap_coordinate'
06-05 19:59:33.815 I/InstrumentationBackend(20560): Added:'ClickOnScreen', with key:'click_on_screen'
06-05 19:59:33.815 I/InstrumentationBackend(20560): Added:'GetActivityName', with key:'get_activity_name'
06-05 19:59:33.815 I/InstrumentationBackend(20560): Added:'ScrollToView', with key:'scroll_to_view'
06-05 19:59:33.816 I/InstrumentationBackend(20560): Added:'ViewConfiguration', with key:'view_configuration'
06-05 19:59:33.816 I/InstrumentationBackend(20560): Added:'IsCurrentActivityFocused', with key:'is_current_activity_focused'
06-05 19:59:33.816 I/InstrumentationBackend(20560): Added:'SendTcp', with key:'send_tcp'
06-05 19:59:33.816 I/InstrumentationBackend(20560): Added:'DpToDevicePixel', with key:'dp_to_device_pixel'
06-05 19:59:33.816 I/InstrumentationBackend(20560): Added:'KeyboardEnterText', with key:'keyboard_enter_text'
06-05 19:59:33.816 I/InstrumentationBackend(20560): Added:'DeleteSurroundingText', with key:'delete_surrounding_text'
06-05 19:59:33.816 I/InstrumentationBackend(20560): Added:'SetComposingRegion', with key:'set_composing_region'
06-05 19:59:33.816 I/InstrumentationBackend(20560): Added:'SetSelection', with key:'set_selection'
06-05 19:59:33.816 I/InstrumentationBackend(20560): Added:'KeyboardKeyEvent', with key:'keyboard_key_event'
06-05 19:59:33.816 I/InstrumentationBackend(20560): Added:'PressUserActionButton', with key:'press_user_action_button'
06-05 19:59:33.816 I/InstrumentationBackend(20560): Added:'HideSoftKeyboard', with key:'hide_soft_keyboard'
06-05 19:59:33.816 I/InstrumentationBackend(20560): Added:'ListActions', with key:'list_actions'
06-05 19:59:33.817 I/calabash(20560): Instantiating http server at 7102
06-05 19:59:33.817 I/System.out(20560): HTTP Daemon listening on: 7102
06-05 19:59:33.819 D/EGL_emulation( 1711): eglMakeCurrent: 0x9f1709c0: ver 2 0 (tinfo 0xa0e61d00)
06-05 19:59:33.821 I/WindowManager( 1629): WIN DEATH: Window{f9b459 u0 com.evancharlton.mileage/com.evancharlton.mileage.Mileage EXITING}
06-05 19:59:33.835 D/EGL_emulation( 1711): eglMakeCurrent: 0x9f1709c0: ver 2 0 (tinfo 0xa0e61d00)
06-05 19:59:33.839 D/EGL_emulation( 1711): eglMakeCurrent: 0x9f1709c0: ver 2 0 (tinfo 0xa0e61d00)
06-05 19:59:33.906 I/System.out(20560): URI: //ping
06-05 19:59:33.906 I/System.out(20560): params: {json={}
06-05 19:59:33.906 I/System.out(20560): }
06-05 19:59:33.912 I/System.out(20560): URI: //ping
06-05 19:59:33.912 I/System.out(20560): params: {json={}
06-05 19:59:33.912 I/System.out(20560): }
06-05 19:59:33.918 I/System.out(20560): URI: //ready
06-05 19:59:33.919 I/System.out(20560): params: {json={}
06-05 19:59:33.919 I/System.out(20560): }
06-05 19:59:33.926 I/System.out(20560): URI: //
06-05 19:59:33.926 I/System.out(20560): params: {json={"command":"version","arguments":[]}
06-05 19:59:33.926 I/System.out(20560): }
06-05 19:59:33.926 I/System.out(20560): header: {content-type=application/json;charset=utf-8, date=Sat, 06 Jun 2020 00:59:34 GMT, accept=*/*, host=127.0.0.1:34783, content-length=36, user-agent=HTTPClient/1.0 (2.8.3, ruby 2.5.1 (2018-03-29))}
06-05 19:59:33.926 I/System.out(20560): params: {json={"command":"version","arguments":[]}
06-05 19:59:33.926 I/System.out(20560): }
06-05 19:59:33.926 I/System.out(20560): ProP json = {"command":"version","arguments":[]}
06-05 19:59:33.927 I/System.out(20560): files: {}
06-05 19:59:33.927 I/System.out(20560): command: {"command":"version","arguments":[]}
06-05 19:59:33.934 I/InstrumentationBackend(20560): Got command:'Command:'Line:null,version', arguments:'[]'
06-05 19:59:33.945 I/System.out(20560): result:{"bonusInformation":[],"message":"0.9.8","success":true}
06-05 19:59:33.948 I/System.out(20560): URI: //start-application
06-05 19:59:33.948 I/System.out(20560): params: {json={"intent":null}
06-05 19:59:33.948 I/System.out(20560): }
06-05 19:59:33.958 I/ActivityManager( 1629): START u0 {act=android.intent.action.MAIN cat=[android.intent.category.LAUNCHER] flg=0x10200000 cmp=com.evancharlton.mileage/.Mileage} from uid 10196 on display 0
06-05 19:59:33.964 I/calabash(20560): newActivity1
06-05 19:59:33.972 I/calabash(20560): newActivity1
06-05 19:59:33.973 W/ActivityManager( 1629): Bad activity token: android.os.BinderProxy@8be3a65
06-05 19:59:33.973 W/ActivityManager( 1629): java.lang.ClassCastException: android.os.BinderProxy cannot be cast to com.android.server.am.ActivityRecord$Token
06-05 19:59:33.973 W/ActivityManager( 1629): 	at com.android.server.am.ActivityRecord.forTokenLocked(ActivityRecord.java:586)
06-05 19:59:33.973 W/ActivityManager( 1629): 	at com.android.server.am.ActivityRecord.isInStackLocked(ActivityRecord.java:1327)
06-05 19:59:33.973 W/ActivityManager( 1629): 	at com.android.server.am.ActivityRecord.getStackLocked(ActivityRecord.java:1332)
06-05 19:59:33.973 W/ActivityManager( 1629): 	at com.android.server.am.ActivityManagerService.getActivityDisplayId(ActivityManagerService.java:9806)
06-05 19:59:33.973 W/ActivityManager( 1629): 	at android.app.ActivityManagerNative.onTransact(ActivityManagerNative.java:2566)
06-05 19:59:33.973 W/ActivityManager( 1629): 	at com.android.server.am.ActivityManagerService.onTransact(ActivityManagerService.java:2757)
06-05 19:59:33.973 W/ActivityManager( 1629): 	at android.os.Binder.execTransact(Binder.java:565)
06-05 19:59:33.974 W/ActivityManager( 1629): Bad activity token: android.os.BinderProxy@8be3a65
06-05 19:59:33.974 W/ActivityManager( 1629): java.lang.ClassCastException: android.os.BinderProxy cannot be cast to com.android.server.am.ActivityRecord$Token
06-05 19:59:33.974 W/ActivityManager( 1629): 	at com.android.server.am.ActivityRecord.forTokenLocked(ActivityRecord.java:586)
06-05 19:59:33.974 W/ActivityManager( 1629): 	at com.android.server.am.ActivityRecord.isInStackLocked(ActivityRecord.java:1327)
06-05 19:59:33.974 W/ActivityManager( 1629): 	at com.android.server.am.ActivityManagerService.setTaskDescription(ActivityManagerService.java:9358)
06-05 19:59:33.974 W/ActivityManager( 1629): 	at android.app.ActivityManagerNative.onTransact(ActivityManagerNative.java:2639)
06-05 19:59:33.974 W/ActivityManager( 1629): 	at com.android.server.am.ActivityManagerService.onTransact(ActivityManagerService.java:2757)
06-05 19:59:33.974 W/ActivityManager( 1629): 	at android.os.Binder.execTransact(Binder.java:565)
06-05 19:59:33.974 W/ActivityManager( 1629): Bad activity token: android.os.BinderProxy@8be3a65
06-05 19:59:33.974 W/ActivityManager( 1629): java.lang.ClassCastException: android.os.BinderProxy cannot be cast to com.android.server.am.ActivityRecord$Token
06-05 19:59:33.974 W/ActivityManager( 1629): 	at com.android.server.am.ActivityRecord.forTokenLocked(ActivityRecord.java:586)
06-05 19:59:33.974 W/ActivityManager( 1629): 	at com.android.server.am.ActivityRecord.isInStackLocked(ActivityRecord.java:1327)
06-05 19:59:33.974 W/ActivityManager( 1629): 	at com.android.server.am.ActivityRecord.getStackLocked(ActivityRecord.java:1332)
06-05 19:59:33.974 W/ActivityManager( 1629): 	at com.android.server.am.ActivityManagerService.getActivityStackId(ActivityManagerService.java:9817)
06-05 19:59:33.974 W/ActivityManager( 1629): 	at android.app.ActivityManagerNative.onTransact(ActivityManagerNative.java:2856)
06-05 19:59:33.974 W/ActivityManager( 1629): 	at com.android.server.am.ActivityManagerService.onTransact(ActivityManagerService.java:2757)
06-05 19:59:33.974 W/ActivityManager( 1629): 	at android.os.Binder.execTransact(Binder.java:565)
06-05 19:59:33.985 D/gralloc_ranchu( 1348): gralloc_alloc: Creating ashmem region of size 9023488
06-05 19:59:33.989 W/ActivityManager( 1629): Bad activity token: android.os.BinderProxy@8be3a65
06-05 19:59:33.989 W/ActivityManager( 1629): java.lang.ClassCastException: android.os.BinderProxy cannot be cast to com.android.server.am.ActivityRecord$Token
06-05 19:59:33.989 W/ActivityManager( 1629): 	at com.android.server.am.ActivityRecord.forTokenLocked(ActivityRecord.java:586)
06-05 19:59:33.989 W/ActivityManager( 1629): 	at com.android.server.am.ActivityRecord.isInStackLocked(ActivityRecord.java:1327)
06-05 19:59:33.989 W/ActivityManager( 1629): 	at com.android.server.am.ActivityManagerService.getActivityOptions(ActivityManagerService.java:12559)
06-05 19:59:33.989 W/ActivityManager( 1629): 	at android.app.ActivityManagerNative.onTransact(ActivityManagerNative.java:1933)
06-05 19:59:33.989 W/ActivityManager( 1629): 	at com.android.server.am.ActivityManagerService.onTransact(ActivityManagerService.java:2757)
06-05 19:59:33.989 W/ActivityManager( 1629): 	at android.os.Binder.execTransact(Binder.java:565)
06-05 19:59:33.989 W/ActivityManager( 1629): Bad activity token: android.os.BinderProxy@8be3a65
06-05 19:59:33.989 W/ActivityManager( 1629): java.lang.ClassCastException: android.os.BinderProxy cannot be cast to com.android.server.am.ActivityRecord$Token
06-05 19:59:33.989 W/ActivityManager( 1629): 	at com.android.server.am.ActivityRecord.forTokenLocked(ActivityRecord.java:586)
06-05 19:59:33.989 W/ActivityManager( 1629): 	at com.android.server.am.ActivityRecord.isInStackLocked(ActivityRecord.java:1327)
06-05 19:59:33.989 W/ActivityManager( 1629): 	at com.android.server.am.ActivityManagerService.getActivityOptions(ActivityManagerService.java:12559)
06-05 19:59:33.989 W/ActivityManager( 1629): 	at android.app.ActivityManagerNative.onTransact(ActivityManagerNative.java:1933)
06-05 19:59:33.989 W/ActivityManager( 1629): 	at com.android.server.am.ActivityManagerService.onTransact(ActivityManagerService.java:2757)
06-05 19:59:33.989 W/ActivityManager( 1629): 	at android.os.Binder.execTransact(Binder.java:565)
06-05 19:59:34.009 V/PhoneStatusBar( 1711): setLightsOn(true)
06-05 19:59:34.018 D/EGL_emulation( 1711): eglMakeCurrent: 0x9f1709c0: ver 2 0 (tinfo 0xa0e61d00)
06-05 19:59:34.018 V/PhoneStatusBar( 1711): setLightsOn(true)
06-05 19:59:34.020 V/PhoneStatusBar( 1711): setLightsOn(true)
06-05 19:59:34.021 D/gralloc_ranchu( 1348): gralloc_alloc: Creating ashmem region of size 9023488
06-05 19:59:34.025 D/        (20560): HostConnection::get() New Host Connection established 0x9f139f80, tid 20560
06-05 19:59:34.034 I/WindowManager( 1629): Destroying surface Surface(name=com.evancharlton.mileage/com.evancharlton.mileage.Mileage) called by com.android.server.wm.WindowStateAnimator.destroySurface:2016 com.android.server.wm.WindowStateAnimator.destroySurfaceLocked:882 com.android.server.wm.WindowState.removeLocked:1456 com.android.server.wm.WindowManagerService.removeWindowInnerLocked:2484 com.android.server.wm.AppWindowToken.destroySurfaces:365 com.android.server.wm.WindowStateAnimator.finishExit:565 com.android.server.wm.AppWindowAnimator.stepAnimationLocked:427 com.android.server.wm.WindowAnimator.updateAppWindowsLocked:196 
06-05 19:59:34.057 D/EGL_emulation( 1711): eglMakeCurrent: 0x9f1709c0: ver 2 0 (tinfo 0xa0e61d00)
06-05 19:59:34.057 D/EGL_emulation( 2147): eglMakeCurrent: 0xa3805360: ver 2 0 (tinfo 0xa3803630)
06-05 19:59:34.061 D/EGL_emulation( 1711): eglMakeCurrent: 0x9f1709c0: ver 2 0 (tinfo 0xa0e61d00)
06-05 19:59:34.063 D/EGL_emulation( 1711): eglMakeCurrent: 0x9f1709c0: ver 2 0 (tinfo 0xa0e61d00)
06-05 19:59:34.064 D/EGL_emulation( 1711): eglMakeCurrent: 0x9f1709c0: ver 2 0 (tinfo 0xa0e61d00)
06-05 19:59:34.068 D/EGL_emulation( 1711): eglMakeCurrent: 0x9f1709c0: ver 2 0 (tinfo 0xa0e61d00)
06-05 19:59:34.070 D/EGL_emulation( 1711): eglMakeCurrent: 0x9f1709c0: ver 2 0 (tinfo 0xa0e61d00)
06-05 19:59:34.071 V/PhoneStatusBar( 1711): setLightsOn(true)
06-05 19:59:34.080 I/ActivityManager( 1629): Displayed com.evancharlton.mileage/.Mileage: +119ms
06-05 19:59:34.084 D/gralloc_ranchu( 1348): gralloc_alloc: Creating ashmem region of size 9023488
06-05 19:59:34.085 D/EGL_emulation( 1711): eglMakeCurrent: 0x9f1709c0: ver 2 0 (tinfo 0xa0e61d00)
06-05 19:59:34.097 D/EGL_emulation( 1711): eglMakeCurrent: 0x9f1709c0: ver 2 0 (tinfo 0xa0e61d00)
06-05 19:59:34.108 D/EGL_emulation( 1711): eglMakeCurrent: 0x9f1709c0: ver 2 0 (tinfo 0xa0e61d00)
06-05 19:59:34.110 D/EGL_emulation( 1711): eglMakeCurrent: 0x9f1709c0: ver 2 0 (tinfo 0xa0e61d00)
06-05 19:59:34.111 V/PhoneStatusBar( 1711): setLightsOn(true)
06-05 19:59:34.121 D/EGL_emulation( 1711): eglMakeCurrent: 0x9f1709c0: ver 2 0 (tinfo 0xa0e61d00)
06-05 19:59:34.123 D/EGL_emulation( 1711): eglMakeCurrent: 0x9f1709c0: ver 2 0 (tinfo 0xa0e61d00)
06-05 19:59:34.129 I/System.out(20560): URI: //map
06-05 19:59:34.129 I/System.out(20560): params: {json={"query":"* marked:'Statistics'","operation":{"method_name":"query","arguments":[]}}
06-05 19:59:34.129 I/System.out(20560): }
06-05 19:59:34.135 D/EGL_emulation( 1711): eglMakeCurrent: 0x9f1709c0: ver 2 0 (tinfo 0xa0e61d00)
06-05 19:59:34.136 D/EGL_emulation( 1711): eglMakeCurrent: 0x9f1709c0: ver 2 0 (tinfo 0xa0e61d00)
06-05 19:59:34.140 W/ResourceType(20560): No package identifier when getting name for resource number 0x00000001
06-05 19:59:34.151 D/EGL_emulation( 1711): eglMakeCurrent: 0x9f1709c0: ver 2 0 (tinfo 0xa0e61d00)
06-05 19:59:34.152 I/System.out(20560): URI: //gesture
06-05 19:59:34.152 I/System.out(20560): params: {json={"query_timeout":5.0,"gestures":[{"query_string":"* marked:'Statistics'","touches":[{"x":50,"y":50,"offset_x":0,"offset_y":0,"wait":0.0,"time":0.2,"release":true,"query_string":null}]}]}
06-05 19:59:34.152 I/System.out(20560): }
06-05 19:59:34.153 D/EGL_emulation( 1711): eglMakeCurrent: 0x9f1709c0: ver 2 0 (tinfo 0xa0e61d00)
06-05 19:59:34.157 W/ResourceType(20560): No package identifier when getting name for resource number 0x00000001
06-05 19:59:34.168 D/EGL_emulation( 1711): eglMakeCurrent: 0x9f1709c0: ver 2 0 (tinfo 0xa0e61d00)
06-05 19:59:34.180 D/EGL_emulation( 1711): eglMakeCurrent: 0x9f1709c0: ver 2 0 (tinfo 0xa0e61d00)
06-05 19:59:34.187 D/EGL_emulation( 1711): eglMakeCurrent: 0x9f1709c0: ver 2 0 (tinfo 0xa0e61d00)
06-05 19:59:34.202 D/EGL_emulation( 1711): eglMakeCurrent: 0x9f1709c0: ver 2 0 (tinfo 0xa0e61d00)
06-05 19:59:34.204 D/EGL_emulation( 1711): eglMakeCurrent: 0x9f1709c0: ver 2 0 (tinfo 0xa0e61d00)
06-05 19:59:34.206 D/EGL_emulation( 1711): eglMakeCurrent: 0x9f1709c0: ver 2 0 (tinfo 0xa0e61d00)
06-05 19:59:34.218 D/EGL_emulation( 1711): eglMakeCurrent: 0x9f1709c0: ver 2 0 (tinfo 0xa0e61d00)
06-05 19:59:34.222 D/EGL_emulation( 1711): eglMakeCurrent: 0x9f1709c0: ver 2 0 (tinfo 0xa0e61d00)
06-05 19:59:34.235 D/EGL_emulation( 1711): eglMakeCurrent: 0x9f1709c0: ver 2 0 (tinfo 0xa0e61d00)
06-05 19:59:34.237 D/EGL_emulation( 1711): eglMakeCurrent: 0x9f1709c0: ver 2 0 (tinfo 0xa0e61d00)
06-05 19:59:34.252 D/EGL_emulation( 1711): eglMakeCurrent: 0x9f1709c0: ver 2 0 (tinfo 0xa0e61d00)
06-05 19:59:34.268 I/WindowManager( 1629): Destroying surface Surface(name=Starting com.evancharlton.mileage) called by com.android.server.wm.WindowStateAnimator.destroySurface:2016 com.android.server.wm.WindowStateAnimator.destroySurfaceLocked:882 com.android.server.wm.WindowState.destroyOrSaveSurface:2100 com.android.server.wm.AppWindowToken.destroySurfaces:363 com.android.server.wm.WindowStateAnimator.finishExit:565 com.android.server.wm.WindowStateAnimator.stepAnimationLocked:491 com.android.server.wm.WindowAnimator.updateWindowsLocked:303 com.android.server.wm.WindowAnimator.animateLocked:704 
06-05 19:59:34.270 V/PhoneStatusBar( 1711): setLightsOn(true)
06-05 19:59:34.271 V/PhoneStatusBar( 1711): setLightsOn(true)
06-05 19:59:34.387 I/calabash(20560): newActivity1
06-05 19:59:34.397 I/System.out(20560): URI: //map
06-05 19:59:34.397 I/System.out(20560): params: {json={"query":"android.widget.ScrollView index:0","operation":{"method_name":"query","arguments":[]}}
06-05 19:59:34.397 I/System.out(20560): }
06-05 19:59:34.399 W/ActivityManager( 1629): Bad activity token: android.os.BinderProxy@23c85db
06-05 19:59:34.399 W/ActivityManager( 1629): java.lang.ClassCastException: android.os.BinderProxy cannot be cast to com.android.server.am.ActivityRecord$Token
06-05 19:59:34.399 W/ActivityManager( 1629): 	at com.android.server.am.ActivityRecord.forTokenLocked(ActivityRecord.java:586)
06-05 19:59:34.399 W/ActivityManager( 1629): 	at com.android.server.am.ActivityRecord.isInStackLocked(ActivityRecord.java:1327)
06-05 19:59:34.399 W/ActivityManager( 1629): 	at com.android.server.am.ActivityRecord.getStackLocked(ActivityRecord.java:1332)
06-05 19:59:34.399 W/ActivityManager( 1629): 	at com.android.server.am.ActivityManagerService.getActivityDisplayId(ActivityManagerService.java:9806)
06-05 19:59:34.399 W/ActivityManager( 1629): 	at android.app.ActivityManagerNative.onTransact(ActivityManagerNative.java:2566)
06-05 19:59:34.399 W/ActivityManager( 1629): 	at com.android.server.am.ActivityManagerService.onTransact(ActivityManagerService.java:2757)
06-05 19:59:34.399 W/ActivityManager( 1629): 	at android.os.Binder.execTransact(Binder.java:565)
06-05 19:59:34.400 W/ActivityManager( 1629): Bad activity token: android.os.BinderProxy@23c85db
06-05 19:59:34.400 W/ActivityManager( 1629): java.lang.ClassCastException: android.os.BinderProxy cannot be cast to com.android.server.am.ActivityRecord$Token
06-05 19:59:34.400 W/ActivityManager( 1629): 	at com.android.server.am.ActivityRecord.forTokenLocked(ActivityRecord.java:586)
06-05 19:59:34.400 W/ActivityManager( 1629): 	at com.android.server.am.ActivityRecord.isInStackLocked(ActivityRecord.java:1327)
06-05 19:59:34.400 W/ActivityManager( 1629): 	at com.android.server.am.ActivityManagerService.setTaskDescription(ActivityManagerService.java:9358)
06-05 19:59:34.400 W/ActivityManager( 1629): 	at android.app.ActivityManagerNative.onTransact(ActivityManagerNative.java:2639)
06-05 19:59:34.400 W/ActivityManager( 1629): 	at com.android.server.am.ActivityManagerService.onTransact(ActivityManagerService.java:2757)
06-05 19:59:34.400 W/ActivityManager( 1629): 	at android.os.Binder.execTransact(Binder.java:565)
06-05 19:59:34.401 W/ActivityManager( 1629): Bad activity token: android.os.BinderProxy@23c85db
06-05 19:59:34.401 W/ActivityManager( 1629): java.lang.ClassCastException: android.os.BinderProxy cannot be cast to com.android.server.am.ActivityRecord$Token
06-05 19:59:34.401 W/ActivityManager( 1629): 	at com.android.server.am.ActivityRecord.forTokenLocked(ActivityRecord.java:586)
06-05 19:59:34.401 W/ActivityManager( 1629): 	at com.android.server.am.ActivityRecord.isInStackLocked(ActivityRecord.java:1327)
06-05 19:59:34.401 W/ActivityManager( 1629): 	at com.android.server.am.ActivityRecord.getStackLocked(ActivityRecord.java:1332)
06-05 19:59:34.401 W/ActivityManager( 1629): 	at com.android.server.am.ActivityManagerService.getActivityStackId(ActivityManagerService.java:9817)
06-05 19:59:34.401 W/ActivityManager( 1629): 	at android.app.ActivityManagerNative.onTransact(ActivityManagerNative.java:2856)
06-05 19:59:34.401 W/ActivityManager( 1629): 	at com.android.server.am.ActivityManagerService.onTransact(ActivityManagerService.java:2757)
06-05 19:59:34.401 W/ActivityManager( 1629): 	at android.os.Binder.execTransact(Binder.java:565)
06-05 19:59:34.407 D/VehicleStatisticsActivity(20560): Checking recalculation ...
06-05 19:59:34.408 D/VehicleStatisticsActivity(20560): Recalculation not necessary.
06-05 19:59:34.409 W/ActivityManager( 1629): Bad activity token: android.os.BinderProxy@23c85db
06-05 19:59:34.409 W/ActivityManager( 1629): java.lang.ClassCastException: android.os.BinderProxy cannot be cast to com.android.server.am.ActivityRecord$Token
06-05 19:59:34.409 W/ActivityManager( 1629): 	at com.android.server.am.ActivityRecord.forTokenLocked(ActivityRecord.java:586)
06-05 19:59:34.409 W/ActivityManager( 1629): 	at com.android.server.am.ActivityRecord.isInStackLocked(ActivityRecord.java:1327)
06-05 19:59:34.409 W/ActivityManager( 1629): 	at com.android.server.am.ActivityManagerService.getActivityOptions(ActivityManagerService.java:12559)
06-05 19:59:34.409 W/ActivityManager( 1629): 	at android.app.ActivityManagerNative.onTransact(ActivityManagerNative.java:1933)
06-05 19:59:34.409 W/ActivityManager( 1629): 	at com.android.server.am.ActivityManagerService.onTransact(ActivityManagerService.java:2757)
06-05 19:59:34.409 W/ActivityManager( 1629): 	at android.os.Binder.execTransact(Binder.java:565)
06-05 19:59:34.409 W/ActivityManager( 1629): Bad activity token: android.os.BinderProxy@23c85db
06-05 19:59:34.409 W/ActivityManager( 1629): java.lang.ClassCastException: android.os.BinderProxy cannot be cast to com.android.server.am.ActivityRecord$Token
06-05 19:59:34.409 W/ActivityManager( 1629): 	at com.android.server.am.ActivityRecord.forTokenLocked(ActivityRecord.java:586)
06-05 19:59:34.409 W/ActivityManager( 1629): 	at com.android.server.am.ActivityRecord.isInStackLocked(ActivityRecord.java:1327)
06-05 19:59:34.409 W/ActivityManager( 1629): 	at com.android.server.am.ActivityManagerService.getActivityOptions(ActivityManagerService.java:12559)
06-05 19:59:34.409 W/ActivityManager( 1629): 	at android.app.ActivityManagerNative.onTransact(ActivityManagerNative.java:1933)
06-05 19:59:34.409 W/ActivityManager( 1629): 	at com.android.server.am.ActivityManagerService.onTransact(ActivityManagerService.java:2757)
06-05 19:59:34.409 W/ActivityManager( 1629): 	at android.os.Binder.execTransact(Binder.java:565)
06-05 19:59:34.411 D/VehicleStatisticsActivity(20560): Checking recalculation ...
06-05 19:59:34.412 D/VehicleStatisticsActivity(20560): Recalculation not necessary.
06-05 19:59:34.468 V/PhoneStatusBar( 1711): setLightsOn(true)
06-05 19:59:34.468 I/System.out(20560): URI: //map
06-05 19:59:34.468 I/System.out(20560): params: {json={"query":"android.widget.AbsListView index:0","operation":{"method_name":"query","arguments":[]}}
06-05 19:59:34.468 I/System.out(20560): }
06-05 19:59:34.474 I/art     (20560): Do partial code cache collection, code=30KB, data=29KB
06-05 19:59:34.474 I/art     (20560): After code cache collection, code=29KB, data=28KB
06-05 19:59:34.474 I/art     (20560): Increasing code cache capacity to 128KB
06-05 19:59:34.484 I/System.out(20560): URI: //map
06-05 19:59:34.484 I/System.out(20560): params: {json={"query":"android.widget.AbsListView index:0","operation":{"method_name":"query","arguments":[]}}
06-05 19:59:34.484 I/System.out(20560): }
06-05 19:59:34.502 I/System.out(20560): URI: //map
06-05 19:59:34.502 I/System.out(20560): params: {json={"query":"android.widget.AbsListView index:0","operation":{"method_name":"query","arguments":[]}}
06-05 19:59:34.502 I/System.out(20560): }
06-05 19:59:34.516 I/System.out(20560): URI: //map
06-05 19:59:34.516 I/System.out(20560): params: {json={"query":"android.widget.AbsListView index:0","operation":{"method_name":"query","arguments":["getFirstVisiblePosition"]}}
06-05 19:59:34.516 I/System.out(20560): }
06-05 19:59:34.529 I/System.out(20560): URI: //map
06-05 19:59:34.529 I/System.out(20560): params: {json={"query":"android.widget.AbsListView index:0","operation":{"method_name":"query","arguments":["getLastVisiblePosition"]}}
06-05 19:59:34.529 I/System.out(20560): }
06-05 19:59:34.543 I/System.out(20560): URI: //map
06-05 19:59:34.543 I/System.out(20560): params: {json={"query":"android.widget.AbsListView index:0","operation":{"method_name":"query","arguments":[{"method_name":"setSelection","arguments":[26]}]}}
06-05 19:59:34.543 I/System.out(20560): }
06-05 19:59:34.562 I/System.out(20560): URI: //map
06-05 19:59:34.562 I/System.out(20560): params: {json={"query":"* marked:'Smallest fillup'","operation":{"method_name":"query","arguments":[]}}
06-05 19:59:34.562 I/System.out(20560): }
06-05 19:59:34.606 D/gralloc_ranchu( 1348): gralloc_alloc: Creating ashmem region of size 9023488
06-05 19:59:34.648 W/ResourceType(20560): No package identifier when getting name for resource number 0x00000001
06-05 19:59:34.659 I/System.out(20560): URI: //gesture
06-05 19:59:34.659 I/System.out(20560): params: {json={"query_timeout":5.0,"gestures":[{"query_string":"* marked:'Smallest fillup'","touches":[{"x":50,"y":50,"offset_x":0,"offset_y":0,"wait":0.0,"time":0.2,"release":true,"query_string":null}]}]}
06-05 19:59:34.659 I/System.out(20560): }
06-05 19:59:34.662 W/ResourceType(20560): No package identifier when getting name for resource number 0x00000001
06-05 19:59:34.768 V/PhoneStatusBar( 1711): setLightsOn(true)
06-05 19:59:34.769 V/PhoneStatusBar( 1711): setLightsOn(true)
06-05 19:59:34.770 W/OpenGLRenderer( 2147): Incorrectly called buildLayer on View: ShortcutAndWidgetContainer, destroying layer...
06-05 19:59:34.787 V/PhoneStatusBar( 1711): setLightsOn(true)
06-05 19:59:34.787 I/WindowManager( 1629): Destroying surface Surface(name=com.android.launcher3/com.android.launcher3.Launcher) called by com.android.server.wm.WindowStateAnimator.destroySurface:2016 com.android.server.wm.WindowStateAnimator.destroySurfaceLocked:882 com.android.server.wm.WindowState.destroyOrSaveSurface:2100 com.android.server.wm.AppWindowToken.destroySurfaces:363 com.android.server.wm.AppWindowToken.notifyAppStopped:389 com.android.server.wm.WindowManagerService.notifyAppStopped:4463 com.android.server.am.ActivityStack.activityStoppedLocked:1252 com.android.server.am.ActivityManagerService.activityStopped:6903 
06-05 19:59:34.888 I/ActivityManager( 1629): START u0 {cmp=com.evancharlton.mileage/.charts.MinimumVolumeChart (has extras)} from uid 10196 on display 0
06-05 19:59:34.892 V/PhoneStatusBar( 1711): setLightsOn(true)
06-05 19:59:34.896 V/PhoneStatusBar( 1711): setLightsOn(true)
06-05 19:59:34.922 I/System.out(20560): URI: //map
06-05 19:59:34.922 I/System.out(20560): params: {json={"query":"* {text CONTAINS[c] 'Smallest fillup size'}","operation":{"method_name":"query","arguments":[]}}
06-05 19:59:34.922 I/System.out(20560): }
06-05 19:59:34.947 I/calabash(20560): newActivity1
06-05 19:59:34.950 W/aiCharts(20560): License file is invalid or missing. 
06-05 19:59:34.950 W/aiCharts(20560): Please place proper license.lic to /assets folder.
06-05 19:59:34.964 V/PhoneStatusBar( 1711): setLightsOn(true)
06-05 19:59:34.984 V/PhoneStatusBar( 1711): setLightsOn(true)
06-05 19:59:34.988 I/WindowManager( 1629): Destroying surface Surface(name=Creating chart…) called by com.android.server.wm.WindowStateAnimator.destroySurface:2016 com.android.server.wm.WindowStateAnimator.destroySurfaceLocked:882 com.android.server.wm.WindowState.removeLocked:1456 com.android.server.wm.WindowManagerService.removeWindowInnerLocked:2484 com.android.server.wm.WindowManagerService.removeWindowLocked:2442 com.android.server.wm.WindowManagerService.removeWindowLocked:2311 com.android.server.wm.WindowManagerService.removeWindow:2306 com.android.server.wm.Session.remove:202 
06-05 19:59:34.990 D/gralloc_ranchu( 1348): gralloc_alloc: Creating ashmem region of size 9023488
06-05 19:59:35.001 V/PhoneStatusBar( 1711): setLightsOn(true)
06-05 19:59:35.013 I/ActivityManager( 1629): Displayed com.evancharlton.mileage/.charts.MinimumVolumeChart: +68ms
06-05 19:59:35.018 V/PhoneStatusBar( 1711): setLightsOn(true)
06-05 19:59:35.051 V/PhoneStatusBar( 1711): setLightsOn(true)
06-05 19:59:35.068 V/PhoneStatusBar( 1711): setLightsOn(true)
06-05 19:59:35.251 V/PhoneStatusBar( 1711): setLightsOn(true)
06-05 19:59:35.277 I/System.out(20560): URI: //map
06-05 19:59:35.277 I/System.out(20560): params: {json={"query":"* {text CONTAINS[c] 'Smallest fillup size'}","operation":{"method_name":"query","arguments":[]}}
06-05 19:59:35.277 I/System.out(20560): }
06-05 19:59:35.294 I/System.out(20560): URI: //
06-05 19:59:35.294 I/System.out(20560): params: {json={"command":"press_key","arguments":["KEYCODE_BACK"]}
06-05 19:59:35.294 I/System.out(20560): }
06-05 19:59:35.294 I/System.out(20560): header: {content-type=application/json;charset=utf-8, date=Sat, 06 Jun 2020 00:59:36 GMT, accept=*/*, host=127.0.0.1:34783, content-length=52, user-agent=HTTPClient/1.0 (2.8.3, ruby 2.5.1 (2018-03-29))}
06-05 19:59:35.294 I/System.out(20560): params: {json={"command":"press_key","arguments":["KEYCODE_BACK"]}
06-05 19:59:35.294 I/System.out(20560): }
06-05 19:59:35.294 I/System.out(20560): ProP json = {"command":"press_key","arguments":["KEYCODE_BACK"]}
06-05 19:59:35.294 I/System.out(20560): files: {}
06-05 19:59:35.294 I/System.out(20560): command: {"command":"press_key","arguments":["KEYCODE_BACK"]}
06-05 19:59:35.295 I/InstrumentationBackend(20560): Got command:'Command:'Line:null,press_key', arguments:'[KEYCODE_BACK]'
06-05 19:59:35.297 V/PhoneStatusBar( 1711): setLightsOn(true)
06-05 19:59:35.299 V/PhoneStatusBar( 1711): setLightsOn(true)
06-05 19:59:35.300 I/art     (20560): Do partial code cache collection, code=60KB, data=62KB
06-05 19:59:35.300 I/art     (20560): After code cache collection, code=59KB, data=61KB
06-05 19:59:35.300 I/art     (20560): Increasing code cache capacity to 256KB
06-05 19:59:35.300 I/System.out(20560): result:{"bonusInformation":[],"message":"","success":true}
06-05 19:59:35.302 D/VehicleStatisticsActivity(20560): Checking recalculation ...
06-05 19:59:35.303 D/VehicleStatisticsActivity(20560): Recalculation not necessary.
06-05 19:59:35.304 I/System.out(20560): URI: //map
06-05 19:59:35.304 I/System.out(20560): params: {json={"query":"* {text CONTAINS[c] 'Statistics'}","operation":{"method_name":"query","arguments":[]}}
06-05 19:59:35.304 I/System.out(20560): }
06-05 19:59:35.317 D/gralloc_ranchu( 1348): gralloc_alloc: Creating ashmem region of size 9023488
06-05 19:59:35.318 V/PhoneStatusBar( 1711): setLightsOn(true)
06-05 19:59:35.338 V/PhoneStatusBar( 1711): setLightsOn(true)
06-05 19:59:35.367 V/PhoneStatusBar( 1711): setLightsOn(true)
