--------- beginning of main
06-05 18:18:23.559 V/PhoneStatusBar( 1712): setLightsOn(true)
06-05 18:18:23.564 D/gralloc_ranchu( 1346): gralloc_alloc: Creating ashmem region of size 3145728
06-05 18:18:23.570 E/EGL_emulation( 1346): tid 1346: eglCreateSyncKHR(1901): error 0x3004 (EGL_BAD_ATTRIBUTE)
--------- beginning of system
06-05 18:18:23.587 W/ActivityManager( 1630): Finishing task with all activities already finished
06-05 18:18:23.587 W/ActivityManager( 1630): Duplicate finish request for ActivityRecord{bc669e4 u0 com.evancharlton.mileage/.Mileage t2744 f}
06-05 18:18:23.587 W/ActivityManager( 1630): Finishing task with all activities already finished
06-05 18:18:23.587 W/ActivityManager( 1630): Duplicate finish request for ActivityRecord{bc669e4 u0 com.evancharlton.mileage/.Mileage t2744 f}
06-05 18:18:23.588 W/ActivityManager( 1630): Finishing task with all activities already finished
06-05 18:18:23.588 W/ActivityManager( 1630): Duplicate finish request for ActivityRecord{bc669e4 u0 com.evancharlton.mileage/.Mileage t2744 f}
06-05 18:18:23.588 W/ActivityManager( 1630): Finishing task with all activities already finished
06-05 18:18:23.588 W/ActivityManager( 1630): Duplicate finish request for ActivityRecord{bc669e4 u0 com.evancharlton.mileage/.Mileage t2744 f}
06-05 18:18:23.588 W/ActivityManager( 1630): Finishing task with all activities already finished
06-05 18:18:23.588 W/ActivityManager( 1630): Duplicate finish request for ActivityRecord{bc669e4 u0 com.evancharlton.mileage/.Mileage t2744 f}
06-05 18:18:23.588 W/ActivityManager( 1630): Finishing task with all activities already finished
06-05 18:18:23.588 W/ActivityManager( 1630): Duplicate finish request for ActivityRecord{e55d4ae u0 com.evancharlton.mileage/.charts.NorthChart t2744 f}
06-05 18:18:23.588 W/ActivityManager( 1630): Finishing task with all activities already finished
06-05 18:18:23.588 W/ActivityManager( 1630): Duplicate finish request for ActivityRecord{e55d4ae u0 com.evancharlton.mileage/.charts.NorthChart t2744 f}
06-05 18:18:23.588 W/ActivityManager( 1630): Finishing task with all activities already finished
06-05 18:18:23.588 W/ActivityManager( 1630): Duplicate finish request for ActivityRecord{bc669e4 u0 com.evancharlton.mileage/.Mileage t2744 f}
06-05 18:18:23.589 W/ActivityManager( 1630): Finishing task with all activities already finished
06-05 18:18:23.589 W/ActivityManager( 1630): Duplicate finish request for ActivityRecord{bc669e4 u0 com.evancharlton.mileage/.Mileage t2744 f}
06-05 18:18:23.627 D/EGL_emulation( 2099): eglMakeCurrent: 0xb4085240: ver 2 0 (tinfo 0xb40832d0)
06-05 18:18:23.628 D/EGL_emulation( 1712): eglMakeCurrent: 0xb4085540: ver 2 0 (tinfo 0xb4083740)
06-05 18:18:23.642 D/EGL_emulation( 1712): eglMakeCurrent: 0xb4085540: ver 2 0 (tinfo 0xb4083740)
06-05 18:18:23.660 D/EGL_emulation( 1712): eglMakeCurrent: 0xb4085540: ver 2 0 (tinfo 0xb4083740)
06-05 18:18:23.676 D/EGL_emulation( 1712): eglMakeCurrent: 0xb4085540: ver 2 0 (tinfo 0xb4083740)
06-05 18:18:23.678 D/EGL_emulation( 1712): eglMakeCurrent: 0xb4085540: ver 2 0 (tinfo 0xb4083740)
06-05 18:18:23.693 D/EGL_emulation( 1712): eglMakeCurrent: 0xb4085540: ver 2 0 (tinfo 0xb4083740)
06-05 18:18:23.695 D/EGL_emulation( 1712): eglMakeCurrent: 0xb4085540: ver 2 0 (tinfo 0xb4083740)
06-05 18:18:23.709 D/EGL_emulation( 1712): eglMakeCurrent: 0xb4085540: ver 2 0 (tinfo 0xb4083740)
06-05 18:18:23.711 D/EGL_emulation( 1712): eglMakeCurrent: 0xb4085540: ver 2 0 (tinfo 0xb4083740)
06-05 18:18:23.713 D/AndroidRuntime( 5758): >>>>>> START com.android.internal.os.RuntimeInit uid 2000 <<<<<<
06-05 18:18:23.714 D/AndroidRuntime( 5758): CheckJNI is ON
06-05 18:18:23.724 W/art     ( 5758): Unexpected CPU variant for X86 using defaults: x86
06-05 18:18:23.726 D/EGL_emulation( 1712): eglMakeCurrent: 0xb4085540: ver 2 0 (tinfo 0xb4083740)
06-05 18:18:23.727 D/ICU     ( 5758): No timezone override file found: /data/misc/zoneinfo/current/icu/icu_tzdata.dat
06-05 18:18:23.729 D/EGL_emulation( 1712): eglMakeCurrent: 0xb4085540: ver 2 0 (tinfo 0xb4083740)
06-05 18:18:23.736 E/memtrack( 5758): Couldn't load memtrack module (No such file or directory)
06-05 18:18:23.736 E/android.os.Debug( 5758): failed to load memtrack module: -2
06-05 18:18:23.736 I/Radio-JNI( 5758): register_android_hardware_Radio DONE
06-05 18:18:23.740 D/AndroidRuntime( 5758): Calling main entry com.android.commands.am.Am
06-05 18:18:23.742 I/ActivityManager( 1630): Force stopping com.evancharlton.mileage appid=10150 user=0: start instr
06-05 18:18:23.742 I/ActivityManager( 1630): Killing 5706:com.evancharlton.mileage/u0a150 (adj 0): stop com.evancharlton.mileage
06-05 18:18:23.742 D/ActivityManager( 1630): cleanUpApplicationRecord -- 5706
06-05 18:18:23.742 I/WindowManager( 1630): Destroying surface Surface(name=com.evancharlton.mileage/com.evancharlton.mileage.charts.NorthChart) called by com.android.server.wm.WindowStateAnimator.destroySurface:2016 com.android.server.wm.WindowStateAnimator.destroySurfaceLocked:882 com.android.server.wm.WindowState.removeLocked:1456 com.android.server.wm.WindowManagerService.removeWindowInnerLocked:2484 com.android.server.wm.WindowManagerService.removeWindowLocked:2442 com.android.server.wm.WindowManagerService.removeWindowLocked:2311 com.android.server.wm.AppWindowToken.removeAllWindows:530 com.android.server.wm.AppWindowToken.removeAppFromTaskLocked:326 
06-05 18:18:23.743 D/EGL_emulation( 1712): eglMakeCurrent: 0xb4085540: ver 2 0 (tinfo 0xb4083740)
06-05 18:18:23.744 W/ActivityManager( 1630): Crash of app com.evancharlton.mileage running instrumentation ComponentInfo{com.evancharlton.mileage.test/sh.calaba.instrumentationbackend.CalabashInstrumentationTestRunner}
06-05 18:18:23.744 I/ActivityManager( 1630): Force stopping com.evancharlton.mileage appid=10150 user=0: finished inst
06-05 18:18:23.744 W/InputDispatcher( 1630): channel '4270a03 com.evancharlton.mileage/com.evancharlton.mileage.Mileage (server)' ~ Consumer closed input channel or an error occurred.  events=0x9
06-05 18:18:23.744 E/InputDispatcher( 1630): channel '4270a03 com.evancharlton.mileage/com.evancharlton.mileage.Mileage (server)' ~ Channel is unrecoverably broken and will be disposed!
06-05 18:18:23.744 I/WindowManager( 1630): WIN DEATH: Window{4270a03 u0 com.evancharlton.mileage/com.evancharlton.mileage.Mileage EXITING}
06-05 18:18:23.744 W/InputDispatcher( 1630): Attempted to unregister already unregistered input channel '4270a03 com.evancharlton.mileage/com.evancharlton.mileage.Mileage (server)'
06-05 18:18:23.747 I/art     ( 5768): Not late-enabling -Xcheck:jni (already on)
06-05 18:18:23.747 W/art     ( 5768): Unexpected CPU variant for X86 using defaults: x86
06-05 18:18:23.754 I/ActivityManager( 1630): Start proc 5768:com.evancharlton.mileage/u0a150 for added application com.evancharlton.mileage
06-05 18:18:23.754 D/AndroidRuntime( 5758): Shutting down VM
06-05 18:18:23.755 D/EGL_emulation( 1712): eglMakeCurrent: 0xb4085540: ver 2 0 (tinfo 0xb4083740)
06-05 18:18:23.759 W/System  ( 5768): ClassLoader referenced unknown path: /data/app/com.evancharlton.mileage.test-1/lib/x86
06-05 18:18:23.759 W/System  ( 5768): ClassLoader referenced unknown path: /data/app/com.evancharlton.mileage-1/lib/x86
06-05 18:18:23.759 D/EGL_emulation( 1712): eglMakeCurrent: 0xb4085540: ver 2 0 (tinfo 0xb4083740)
06-05 18:18:23.761 D/EGL_emulation( 1712): eglMakeCurrent: 0xb4085540: ver 2 0 (tinfo 0xb4083740)
06-05 18:18:23.761 W/System  ( 5768): ClassLoader referenced unknown path: 
06-05 18:18:23.765 I/System.out( 5768): Main activity name automatically set to: com.evancharlton.mileage.Mileage
06-05 18:18:23.766 I/System.out( 5768): Calabash did not load Mono. This is only a problem if you are trying to test a Mono application
06-05 18:18:23.766 I/calabash( 5768): Test server port: 7102
06-05 18:18:23.766 I/InstrumentationBackend( 5768): Added:'GetPreferences', with key:'get_preferences'
06-05 18:18:23.770 I/InstrumentationBackend( 5768): Added:'SetPreferences', with key:'set_preferences'
06-05 18:18:23.770 I/InstrumentationBackend( 5768): Added:'ClearPreferences', with key:'clear_preferences'
06-05 18:18:23.770 I/InstrumentationBackend( 5768): Added:'PressElement', with key:'press_l10n_element'
06-05 18:18:23.770 I/InstrumentationBackend( 5768): Added:'WaitForElement', with key:'wait_for_l10n_element'
06-05 18:18:23.771 I/InstrumentationBackend( 5768): Added:'NullAction', with key:'nullAction'
06-05 18:18:23.771 I/InstrumentationBackend( 5768): Added:'PressKey', with key:'press_key'
06-05 18:18:23.771 I/InstrumentationBackend( 5768): Added:'SetActivityOrientation', with key:'set_activity_orientation'
06-05 18:18:23.771 I/InstrumentationBackend( 5768): Added:'GetActivityOrientation', with key:'get_activity_orientation'
06-05 18:18:23.771 I/InstrumentationBackend( 5768): Added:'FakeGPSLocation', with key:'set_gps_coordinates'
06-05 18:18:23.771 I/InstrumentationBackend( 5768): Added:'SetPropertyByCssSelector', with key:'set_property_by_css_selector'
06-05 18:18:23.771 I/InstrumentationBackend( 5768): Added:'GetUrl', with key:'get_url'
06-05 18:18:23.771 I/InstrumentationBackend( 5768): Added:'ScrollTo', with key:'scroll_to'
06-05 18:18:23.771 I/InstrumentationBackend( 5768): Added:'GetLoadProgress', with key:'get_load_progress'
06-05 18:18:23.771 I/InstrumentationBackend( 5768): Added:'DumpHtml', with key:'dump_html'
06-05 18:18:23.771 I/InstrumentationBackend( 5768): Added:'DumpBodyHtml', with key:'dump_body_html'
06-05 18:18:23.771 I/InstrumentationBackend( 5768): Added:'EnterTextByCssSelector', with key:'enter_text_by_selector'
06-05 18:18:23.772 I/InstrumentationBackend( 5768): Added:'AndroidSDKVersion', with key:'android_sdk_version'
06-05 18:18:23.772 I/InstrumentationBackend( 5768): Added:'Version', with key:'version'
06-05 18:18:23.772 I/InstrumentationBackend( 5768): Added:'Drag', with key:'drag'
06-05 18:18:23.772 I/InstrumentationBackend( 5768): Added:'TouchCoordinates', with key:'touch_coordinate'
06-05 18:18:23.772 I/InstrumentationBackend( 5768): Added:'LongPressCoordinate', with key:'long_press_coordinate'
06-05 18:18:23.772 I/InstrumentationBackend( 5768): Added:'DragCoordinates', with key:'drag_coordinates'
06-05 18:18:23.772 I/InstrumentationBackend( 5768): Added:'ResumeApplication', with key:'resume_application'
06-05 18:18:23.772 I/InstrumentationBackend( 5768): Added:'Swipe', with key:'swipe'
06-05 18:18:23.772 I/InstrumentationBackend( 5768): Added:'DoubleTapCoordinate', with key:'double_tap_coordinate'
06-05 18:18:23.772 I/InstrumentationBackend( 5768): Added:'ClickOnScreen', with key:'click_on_screen'
06-05 18:18:23.772 I/InstrumentationBackend( 5768): Added:'GetActivityName', with key:'get_activity_name'
06-05 18:18:23.772 I/InstrumentationBackend( 5768): Added:'ScrollToView', with key:'scroll_to_view'
06-05 18:18:23.772 I/InstrumentationBackend( 5768): Added:'ViewConfiguration', with key:'view_configuration'
06-05 18:18:23.772 I/InstrumentationBackend( 5768): Added:'IsCurrentActivityFocused', with key:'is_current_activity_focused'
06-05 18:18:23.772 I/InstrumentationBackend( 5768): Added:'SendTcp', with key:'send_tcp'
06-05 18:18:23.772 I/InstrumentationBackend( 5768): Added:'DpToDevicePixel', with key:'dp_to_device_pixel'
06-05 18:18:23.772 I/InstrumentationBackend( 5768): Added:'KeyboardEnterText', with key:'keyboard_enter_text'
06-05 18:18:23.772 I/InstrumentationBackend( 5768): Added:'DeleteSurroundingText', with key:'delete_surrounding_text'
06-05 18:18:23.772 I/InstrumentationBackend( 5768): Added:'SetComposingRegion', with key:'set_composing_region'
06-05 18:18:23.772 I/InstrumentationBackend( 5768): Added:'SetSelection', with key:'set_selection'
06-05 18:18:23.772 I/InstrumentationBackend( 5768): Added:'KeyboardKeyEvent', with key:'keyboard_key_event'
06-05 18:18:23.772 I/InstrumentationBackend( 5768): Added:'PressUserActionButton', with key:'press_user_action_button'
06-05 18:18:23.772 I/InstrumentationBackend( 5768): Added:'HideSoftKeyboard', with key:'hide_soft_keyboard'
06-05 18:18:23.773 I/InstrumentationBackend( 5768): Added:'ListActions', with key:'list_actions'
06-05 18:18:23.773 I/calabash( 5768): Instantiating http server at 7102
06-05 18:18:23.773 I/System.out( 5768): HTTP Daemon listening on: 7102
06-05 18:18:23.776 D/EGL_emulation( 1712): eglMakeCurrent: 0xb4085540: ver 2 0 (tinfo 0xb4083740)
06-05 18:18:23.778 D/EGL_emulation( 1712): eglMakeCurrent: 0xb4085540: ver 2 0 (tinfo 0xb4083740)
06-05 18:18:23.792 D/EGL_emulation( 1712): eglMakeCurrent: 0xb4085540: ver 2 0 (tinfo 0xb4083740)
06-05 18:18:23.794 D/EGL_emulation( 1712): eglMakeCurrent: 0xb4085540: ver 2 0 (tinfo 0xb4083740)
06-05 18:18:23.809 D/EGL_emulation( 1712): eglMakeCurrent: 0xb4085540: ver 2 0 (tinfo 0xb4083740)
06-05 18:18:23.811 D/EGL_emulation( 1712): eglMakeCurrent: 0xb4085540: ver 2 0 (tinfo 0xb4083740)
06-05 18:18:23.826 D/EGL_emulation( 1712): eglMakeCurrent: 0xb4085540: ver 2 0 (tinfo 0xb4083740)
06-05 18:18:23.827 D/EGL_emulation( 1712): eglMakeCurrent: 0xb4085540: ver 2 0 (tinfo 0xb4083740)
06-05 18:18:23.844 D/EGL_emulation( 1712): eglMakeCurrent: 0xb4085540: ver 2 0 (tinfo 0xb4083740)
06-05 18:18:23.861 D/EGL_emulation( 1712): eglMakeCurrent: 0xb4085540: ver 2 0 (tinfo 0xb4083740)
06-05 18:18:23.867 D/EGL_emulation( 1712): eglMakeCurrent: 0xb4085540: ver 2 0 (tinfo 0xb4083740)
06-05 18:18:23.869 I/System.out( 5768): URI: //ping
06-05 18:18:23.869 I/System.out( 5768): params: {json={}
06-05 18:18:23.869 I/System.out( 5768): }
06-05 18:18:23.879 I/System.out( 5768): URI: //ping
06-05 18:18:23.879 I/System.out( 5768): params: {json={}
06-05 18:18:23.879 I/System.out( 5768): }
06-05 18:18:23.886 I/System.out( 5768): URI: //ready
06-05 18:18:23.886 I/System.out( 5768): params: {json={}
06-05 18:18:23.886 I/System.out( 5768): }
06-05 18:18:23.899 I/System.out( 5768): URI: //
06-05 18:18:23.899 I/System.out( 5768): params: {json={"command":"version","arguments":[]}
06-05 18:18:23.899 I/System.out( 5768): }
06-05 18:18:23.899 I/System.out( 5768): header: {content-type=application/json;charset=utf-8, date=Fri, 05 Jun 2020 23:18:24 GMT, accept=*/*, host=127.0.0.1:34784, content-length=36, user-agent=HTTPClient/1.0 (2.8.3, ruby 2.5.1 (2018-03-29))}
06-05 18:18:23.899 I/System.out( 5768): params: {json={"command":"version","arguments":[]}
06-05 18:18:23.899 I/System.out( 5768): }
06-05 18:18:23.899 I/System.out( 5768): ProP json = {"command":"version","arguments":[]}
06-05 18:18:23.899 I/System.out( 5768): files: {}
06-05 18:18:23.899 I/System.out( 5768): command: {"command":"version","arguments":[]}
06-05 18:18:23.916 I/InstrumentationBackend( 5768): Got command:'Command:'Line:null,version', arguments:'[]'
06-05 18:18:23.957 I/System.out( 5768): result:{"bonusInformation":[],"message":"0.9.8","success":true}
06-05 18:18:23.967 I/System.out( 5768): URI: //start-application
06-05 18:18:23.967 I/System.out( 5768): params: {json={"intent":null}
06-05 18:18:23.967 I/System.out( 5768): }
06-05 18:18:23.997 I/ActivityManager( 1630): START u0 {act=android.intent.action.MAIN cat=[android.intent.category.LAUNCHER] flg=0x10200000 cmp=com.evancharlton.mileage/.Mileage} from uid 10150 on display 0
06-05 18:18:24.012 I/calabash( 5768): newActivity1
06-05 18:18:24.027 D/gralloc_ranchu( 1346): gralloc_alloc: Creating ashmem region of size 9023488
06-05 18:18:24.037 I/calabash( 5768): newActivity1
06-05 18:18:24.039 W/ActivityManager( 1630): Bad activity token: android.os.BinderProxy@7bf1e28
06-05 18:18:24.039 W/ActivityManager( 1630): java.lang.ClassCastException: android.os.BinderProxy cannot be cast to com.android.server.am.ActivityRecord$Token
06-05 18:18:24.039 W/ActivityManager( 1630): 	at com.android.server.am.ActivityRecord.forTokenLocked(ActivityRecord.java:586)
06-05 18:18:24.039 W/ActivityManager( 1630): 	at com.android.server.am.ActivityRecord.isInStackLocked(ActivityRecord.java:1327)
06-05 18:18:24.039 W/ActivityManager( 1630): 	at com.android.server.am.ActivityRecord.getStackLocked(ActivityRecord.java:1332)
06-05 18:18:24.039 W/ActivityManager( 1630): 	at com.android.server.am.ActivityManagerService.getActivityDisplayId(ActivityManagerService.java:9806)
06-05 18:18:24.039 W/ActivityManager( 1630): 	at android.app.ActivityManagerNative.onTransact(ActivityManagerNative.java:2566)
06-05 18:18:24.039 W/ActivityManager( 1630): 	at com.android.server.am.ActivityManagerService.onTransact(ActivityManagerService.java:2757)
06-05 18:18:24.039 W/ActivityManager( 1630): 	at android.os.Binder.execTransact(Binder.java:565)
06-05 18:18:24.041 W/ActivityManager( 1630): Bad activity token: android.os.BinderProxy@7bf1e28
06-05 18:18:24.041 W/ActivityManager( 1630): java.lang.ClassCastException: android.os.BinderProxy cannot be cast to com.android.server.am.ActivityRecord$Token
06-05 18:18:24.041 W/ActivityManager( 1630): 	at com.android.server.am.ActivityRecord.forTokenLocked(ActivityRecord.java:586)
06-05 18:18:24.041 W/ActivityManager( 1630): 	at com.android.server.am.ActivityRecord.isInStackLocked(ActivityRecord.java:1327)
06-05 18:18:24.041 W/ActivityManager( 1630): 	at com.android.server.am.ActivityManagerService.setTaskDescription(ActivityManagerService.java:9358)
06-05 18:18:24.041 W/ActivityManager( 1630): 	at android.app.ActivityManagerNative.onTransact(ActivityManagerNative.java:2639)
06-05 18:18:24.041 W/ActivityManager( 1630): 	at com.android.server.am.ActivityManagerService.onTransact(ActivityManagerService.java:2757)
06-05 18:18:24.041 W/ActivityManager( 1630): 	at android.os.Binder.execTransact(Binder.java:565)
06-05 18:18:24.042 W/ActivityManager( 1630): Bad activity token: android.os.BinderProxy@7bf1e28
06-05 18:18:24.042 W/ActivityManager( 1630): java.lang.ClassCastException: android.os.BinderProxy cannot be cast to com.android.server.am.ActivityRecord$Token
06-05 18:18:24.042 W/ActivityManager( 1630): 	at com.android.server.am.ActivityRecord.forTokenLocked(ActivityRecord.java:586)
06-05 18:18:24.042 W/ActivityManager( 1630): 	at com.android.server.am.ActivityRecord.isInStackLocked(ActivityRecord.java:1327)
06-05 18:18:24.042 W/ActivityManager( 1630): 	at com.android.server.am.ActivityRecord.getStackLocked(ActivityRecord.java:1332)
06-05 18:18:24.042 W/ActivityManager( 1630): 	at com.android.server.am.ActivityManagerService.getActivityStackId(ActivityManagerService.java:9817)
06-05 18:18:24.042 W/ActivityManager( 1630): 	at android.app.ActivityManagerNative.onTransact(ActivityManagerNative.java:2856)
06-05 18:18:24.042 W/ActivityManager( 1630): 	at com.android.server.am.ActivityManagerService.onTransact(ActivityManagerService.java:2757)
06-05 18:18:24.042 W/ActivityManager( 1630): 	at android.os.Binder.execTransact(Binder.java:565)
06-05 18:18:24.071 I/WindowManager( 1630): Destroying surface Surface(name=com.evancharlton.mileage/com.evancharlton.mileage.Mileage) called by com.android.server.wm.WindowStateAnimator.destroySurface:2016 com.android.server.wm.WindowStateAnimator.destroySurfaceLocked:882 com.android.server.wm.WindowState.removeLocked:1456 com.android.server.wm.WindowManagerService.removeWindowInnerLocked:2484 com.android.server.wm.AppWindowToken.destroySurfaces:365 com.android.server.wm.WindowStateAnimator.finishExit:565 com.android.server.wm.AppWindowAnimator.stepAnimationLocked:427 com.android.server.wm.WindowAnimator.updateAppWindowsLocked:196 
06-05 18:18:24.073 W/ActivityManager( 1630): Bad activity token: android.os.BinderProxy@7bf1e28
06-05 18:18:24.073 W/ActivityManager( 1630): java.lang.ClassCastException: android.os.BinderProxy cannot be cast to com.android.server.am.ActivityRecord$Token
06-05 18:18:24.073 W/ActivityManager( 1630): 	at com.android.server.am.ActivityRecord.forTokenLocked(ActivityRecord.java:586)
06-05 18:18:24.073 W/ActivityManager( 1630): 	at com.android.server.am.ActivityRecord.isInStackLocked(ActivityRecord.java:1327)
06-05 18:18:24.073 W/ActivityManager( 1630): 	at com.android.server.am.ActivityManagerService.getActivityOptions(ActivityManagerService.java:12559)
06-05 18:18:24.073 W/ActivityManager( 1630): 	at android.app.ActivityManagerNative.onTransact(ActivityManagerNative.java:1933)
06-05 18:18:24.073 W/ActivityManager( 1630): 	at com.android.server.am.ActivityManagerService.onTransact(ActivityManagerService.java:2757)
06-05 18:18:24.073 W/ActivityManager( 1630): 	at android.os.Binder.execTransact(Binder.java:565)
06-05 18:18:24.073 W/ActivityManager( 1630): Bad activity token: android.os.BinderProxy@7bf1e28
06-05 18:18:24.073 W/ActivityManager( 1630): java.lang.ClassCastException: android.os.BinderProxy cannot be cast to com.android.server.am.ActivityRecord$Token
06-05 18:18:24.073 W/ActivityManager( 1630): 	at com.android.server.am.ActivityRecord.forTokenLocked(ActivityRecord.java:586)
06-05 18:18:24.073 W/ActivityManager( 1630): 	at com.android.server.am.ActivityRecord.isInStackLocked(ActivityRecord.java:1327)
06-05 18:18:24.073 W/ActivityManager( 1630): 	at com.android.server.am.ActivityManagerService.getActivityOptions(ActivityManagerService.java:12559)
06-05 18:18:24.073 W/ActivityManager( 1630): 	at android.app.ActivityManagerNative.onTransact(ActivityManagerNative.java:1933)
06-05 18:18:24.073 W/ActivityManager( 1630): 	at com.android.server.am.ActivityManagerService.onTransact(ActivityManagerService.java:2757)
06-05 18:18:24.073 W/ActivityManager( 1630): 	at android.os.Binder.execTransact(Binder.java:565)
06-05 18:18:24.074 V/PhoneStatusBar( 1712): setLightsOn(true)
06-05 18:18:24.076 D/EGL_emulation( 2099): eglMakeCurrent: 0xb4085240: ver 2 0 (tinfo 0xb40832d0)
06-05 18:18:24.078 D/EGL_emulation( 1712): eglMakeCurrent: 0xb4085540: ver 2 0 (tinfo 0xb4083740)
06-05 18:18:24.092 D/EGL_emulation( 1712): eglMakeCurrent: 0xb4085540: ver 2 0 (tinfo 0xb4083740)
06-05 18:18:24.095 D/EGL_emulation( 1712): eglMakeCurrent: 0xb4085540: ver 2 0 (tinfo 0xb4083740)
06-05 18:18:24.109 D/EGL_emulation( 1712): eglMakeCurrent: 0xb4085540: ver 2 0 (tinfo 0xb4083740)
06-05 18:18:24.111 D/EGL_emulation( 1712): eglMakeCurrent: 0xb4085540: ver 2 0 (tinfo 0xb4083740)
06-05 18:18:24.112 D/gralloc_ranchu( 1346): gralloc_alloc: Creating ashmem region of size 9023488
06-05 18:18:24.118 D/        ( 5768): HostConnection::get() New Host Connection established 0x97d25500, tid 5768
06-05 18:18:24.152 D/EGL_emulation( 1712): eglMakeCurrent: 0xb4085540: ver 2 0 (tinfo 0xb4083740)
06-05 18:18:24.154 D/EGL_emulation( 1712): eglMakeCurrent: 0xb4085540: ver 2 0 (tinfo 0xb4083740)
06-05 18:18:24.155 V/PhoneStatusBar( 1712): setLightsOn(true)
06-05 18:18:24.157 D/EGL_emulation( 1712): eglMakeCurrent: 0xb4085540: ver 2 0 (tinfo 0xb4083740)
06-05 18:18:24.158 D/EGL_emulation( 1712): eglMakeCurrent: 0xb4085540: ver 2 0 (tinfo 0xb4083740)
06-05 18:18:24.159 D/EGL_emulation( 1712): eglMakeCurrent: 0xb4085540: ver 2 0 (tinfo 0xb4083740)
06-05 18:18:24.160 D/EGL_emulation( 1712): eglMakeCurrent: 0xb4085540: ver 2 0 (tinfo 0xb4083740)
06-05 18:18:24.169 I/ActivityManager( 1630): Displayed com.evancharlton.mileage/.Mileage: +163ms
06-05 18:18:24.176 D/gralloc_ranchu( 1346): gralloc_alloc: Creating ashmem region of size 9023488
06-05 18:18:24.183 D/EGL_emulation( 1712): eglMakeCurrent: 0xb4085540: ver 2 0 (tinfo 0xb4083740)
06-05 18:18:24.192 D/EGL_emulation( 1712): eglMakeCurrent: 0xb4085540: ver 2 0 (tinfo 0xb4083740)
06-05 18:18:24.201 D/EGL_emulation( 1712): eglMakeCurrent: 0xb4085540: ver 2 0 (tinfo 0xb4083740)
06-05 18:18:24.204 D/EGL_emulation( 1712): eglMakeCurrent: 0xb4085540: ver 2 0 (tinfo 0xb4083740)
06-05 18:18:24.204 V/PhoneStatusBar( 1712): setLightsOn(true)
06-05 18:18:24.214 D/EGL_emulation( 1712): eglMakeCurrent: 0xb4085540: ver 2 0 (tinfo 0xb4083740)
06-05 18:18:24.215 D/EGL_emulation( 1712): eglMakeCurrent: 0xb4085540: ver 2 0 (tinfo 0xb4083740)
06-05 18:18:24.220 I/System.out( 5768): URI: //map
06-05 18:18:24.220 I/System.out( 5768): params: {json={"query":"* marked:'Statistics'","operation":{"method_name":"query","arguments":[]}}
06-05 18:18:24.220 I/System.out( 5768): }
06-05 18:18:24.226 D/EGL_emulation( 1712): eglMakeCurrent: 0xb4085540: ver 2 0 (tinfo 0xb4083740)
06-05 18:18:24.227 D/EGL_emulation( 1712): eglMakeCurrent: 0xb4085540: ver 2 0 (tinfo 0xb4083740)
06-05 18:18:24.231 W/ResourceType( 5768): No package identifier when getting name for resource number 0x00000001
06-05 18:18:24.243 D/EGL_emulation( 1712): eglMakeCurrent: 0xb4085540: ver 2 0 (tinfo 0xb4083740)
06-05 18:18:24.244 D/EGL_emulation( 1712): eglMakeCurrent: 0xb4085540: ver 2 0 (tinfo 0xb4083740)
06-05 18:18:24.246 I/System.out( 5768): URI: //gesture
06-05 18:18:24.246 I/System.out( 5768): params: {json={"query_timeout":5.0,"gestures":[{"query_string":"* marked:'Statistics'","touches":[{"x":50,"y":50,"offset_x":0,"offset_y":0,"wait":0.0,"time":0.2,"release":true,"query_string":null}]}]}
06-05 18:18:24.246 I/System.out( 5768): }
06-05 18:18:24.250 W/ResourceType( 5768): No package identifier when getting name for resource number 0x00000001
06-05 18:18:24.266 D/EGL_emulation( 1712): eglMakeCurrent: 0xb4085540: ver 2 0 (tinfo 0xb4083740)
06-05 18:18:24.268 D/EGL_emulation( 1712): eglMakeCurrent: 0xb4085540: ver 2 0 (tinfo 0xb4083740)
06-05 18:18:24.279 D/EGL_emulation( 1712): eglMakeCurrent: 0xb4085540: ver 2 0 (tinfo 0xb4083740)
06-05 18:18:24.284 D/EGL_emulation( 1712): eglMakeCurrent: 0xb4085540: ver 2 0 (tinfo 0xb4083740)
06-05 18:18:24.293 D/EGL_emulation( 1712): eglMakeCurrent: 0xb4085540: ver 2 0 (tinfo 0xb4083740)
06-05 18:18:24.360 I/WindowManager( 1630): Destroying surface Surface(name=Starting com.evancharlton.mileage) called by com.android.server.wm.WindowStateAnimator.destroySurface:2016 com.android.server.wm.WindowStateAnimator.destroySurfaceLocked:882 com.android.server.wm.WindowState.destroyOrSaveSurface:2100 com.android.server.wm.AppWindowToken.destroySurfaces:363 com.android.server.wm.WindowStateAnimator.finishExit:565 com.android.server.wm.WindowStateAnimator.stepAnimationLocked:491 com.android.server.wm.WindowAnimator.updateWindowsLocked:303 com.android.server.wm.WindowAnimator.animateLocked:704 
06-05 18:18:24.364 V/PhoneStatusBar( 1712): setLightsOn(true)
06-05 18:18:24.369 V/PhoneStatusBar( 1712): setLightsOn(true)
06-05 18:18:24.483 I/calabash( 5768): newActivity1
06-05 18:18:24.498 V/PhoneStatusBar( 1712): setLightsOn(true)
06-05 18:18:24.535 I/System.out( 5768): URI: //map
06-05 18:18:24.535 I/System.out( 5768): params: {json={"query":"android.widget.ScrollView index:0","operation":{"method_name":"query","arguments":[]}}
06-05 18:18:24.535 I/System.out( 5768): }
06-05 18:18:24.539 W/ActivityManager( 1630): Bad activity token: android.os.BinderProxy@c5cf396
06-05 18:18:24.539 W/ActivityManager( 1630): java.lang.ClassCastException: android.os.BinderProxy cannot be cast to com.android.server.am.ActivityRecord$Token
06-05 18:18:24.539 W/ActivityManager( 1630): 	at com.android.server.am.ActivityRecord.forTokenLocked(ActivityRecord.java:586)
06-05 18:18:24.539 W/ActivityManager( 1630): 	at com.android.server.am.ActivityRecord.isInStackLocked(ActivityRecord.java:1327)
06-05 18:18:24.539 W/ActivityManager( 1630): 	at com.android.server.am.ActivityRecord.getStackLocked(ActivityRecord.java:1332)
06-05 18:18:24.539 W/ActivityManager( 1630): 	at com.android.server.am.ActivityManagerService.getActivityDisplayId(ActivityManagerService.java:9806)
06-05 18:18:24.539 W/ActivityManager( 1630): 	at android.app.ActivityManagerNative.onTransact(ActivityManagerNative.java:2566)
06-05 18:18:24.539 W/ActivityManager( 1630): 	at com.android.server.am.ActivityManagerService.onTransact(ActivityManagerService.java:2757)
06-05 18:18:24.539 W/ActivityManager( 1630): 	at android.os.Binder.execTransact(Binder.java:565)
06-05 18:18:24.541 W/ActivityManager( 1630): Bad activity token: android.os.BinderProxy@c5cf396
06-05 18:18:24.541 W/ActivityManager( 1630): java.lang.ClassCastException: android.os.BinderProxy cannot be cast to com.android.server.am.ActivityRecord$Token
06-05 18:18:24.541 W/ActivityManager( 1630): 	at com.android.server.am.ActivityRecord.forTokenLocked(ActivityRecord.java:586)
06-05 18:18:24.541 W/ActivityManager( 1630): 	at com.android.server.am.ActivityRecord.isInStackLocked(ActivityRecord.java:1327)
06-05 18:18:24.541 W/ActivityManager( 1630): 	at com.android.server.am.ActivityManagerService.setTaskDescription(ActivityManagerService.java:9358)
06-05 18:18:24.541 W/ActivityManager( 1630): 	at android.app.ActivityManagerNative.onTransact(ActivityManagerNative.java:2639)
06-05 18:18:24.541 W/ActivityManager( 1630): 	at com.android.server.am.ActivityManagerService.onTransact(ActivityManagerService.java:2757)
06-05 18:18:24.541 W/ActivityManager( 1630): 	at android.os.Binder.execTransact(Binder.java:565)
06-05 18:18:24.542 W/ActivityManager( 1630): Bad activity token: android.os.BinderProxy@c5cf396
06-05 18:18:24.542 W/ActivityManager( 1630): java.lang.ClassCastException: android.os.BinderProxy cannot be cast to com.android.server.am.ActivityRecord$Token
06-05 18:18:24.542 W/ActivityManager( 1630): 	at com.android.server.am.ActivityRecord.forTokenLocked(ActivityRecord.java:586)
06-05 18:18:24.542 W/ActivityManager( 1630): 	at com.android.server.am.ActivityRecord.isInStackLocked(ActivityRecord.java:1327)
06-05 18:18:24.542 W/ActivityManager( 1630): 	at com.android.server.am.ActivityRecord.getStackLocked(ActivityRecord.java:1332)
06-05 18:18:24.542 W/ActivityManager( 1630): 	at com.android.server.am.ActivityManagerService.getActivityStackId(ActivityManagerService.java:9817)
06-05 18:18:24.542 W/ActivityManager( 1630): 	at android.app.ActivityManagerNative.onTransact(ActivityManagerNative.java:2856)
06-05 18:18:24.542 W/ActivityManager( 1630): 	at com.android.server.am.ActivityManagerService.onTransact(ActivityManagerService.java:2757)
06-05 18:18:24.542 W/ActivityManager( 1630): 	at android.os.Binder.execTransact(Binder.java:565)
06-05 18:18:24.558 D/VehicleStatisticsActivity( 5768): Checking recalculation ...
06-05 18:18:24.561 D/VehicleStatisticsActivity( 5768): Recalculation not necessary.
06-05 18:18:24.565 W/ActivityManager( 1630): Bad activity token: android.os.BinderProxy@c5cf396
06-05 18:18:24.565 W/ActivityManager( 1630): java.lang.ClassCastException: android.os.BinderProxy cannot be cast to com.android.server.am.ActivityRecord$Token
06-05 18:18:24.565 W/ActivityManager( 1630): 	at com.android.server.am.ActivityRecord.forTokenLocked(ActivityRecord.java:586)
06-05 18:18:24.565 W/ActivityManager( 1630): 	at com.android.server.am.ActivityRecord.isInStackLocked(ActivityRecord.java:1327)
06-05 18:18:24.565 W/ActivityManager( 1630): 	at com.android.server.am.ActivityManagerService.getActivityOptions(ActivityManagerService.java:12559)
06-05 18:18:24.565 W/ActivityManager( 1630): 	at android.app.ActivityManagerNative.onTransact(ActivityManagerNative.java:1933)
06-05 18:18:24.565 W/ActivityManager( 1630): 	at com.android.server.am.ActivityManagerService.onTransact(ActivityManagerService.java:2757)
06-05 18:18:24.565 W/ActivityManager( 1630): 	at android.os.Binder.execTransact(Binder.java:565)
06-05 18:18:24.565 W/ActivityManager( 1630): Bad activity token: android.os.BinderProxy@c5cf396
06-05 18:18:24.565 W/ActivityManager( 1630): java.lang.ClassCastException: android.os.BinderProxy cannot be cast to com.android.server.am.ActivityRecord$Token
06-05 18:18:24.565 W/ActivityManager( 1630): 	at com.android.server.am.ActivityRecord.forTokenLocked(ActivityRecord.java:586)
06-05 18:18:24.565 W/ActivityManager( 1630): 	at com.android.server.am.ActivityRecord.isInStackLocked(ActivityRecord.java:1327)
06-05 18:18:24.565 W/ActivityManager( 1630): 	at com.android.server.am.ActivityManagerService.getActivityOptions(ActivityManagerService.java:12559)
06-05 18:18:24.565 W/ActivityManager( 1630): 	at android.app.ActivityManagerNative.onTransact(ActivityManagerNative.java:1933)
06-05 18:18:24.565 W/ActivityManager( 1630): 	at com.android.server.am.ActivityManagerService.onTransact(ActivityManagerService.java:2757)
06-05 18:18:24.565 W/ActivityManager( 1630): 	at android.os.Binder.execTransact(Binder.java:565)
06-05 18:18:24.569 D/VehicleStatisticsActivity( 5768): Checking recalculation ...
06-05 18:18:24.571 D/VehicleStatisticsActivity( 5768): Recalculation not necessary.
06-05 18:18:24.639 I/System.out( 5768): URI: //map
06-05 18:18:24.639 I/System.out( 5768): params: {json={"query":"android.widget.AbsListView index:0","operation":{"method_name":"query","arguments":[]}}
06-05 18:18:24.639 I/System.out( 5768): }
06-05 18:18:24.648 I/art     ( 5768): Do partial code cache collection, code=30KB, data=29KB
06-05 18:18:24.648 I/art     ( 5768): After code cache collection, code=29KB, data=28KB
06-05 18:18:24.648 I/art     ( 5768): Increasing code cache capacity to 128KB
06-05 18:18:24.666 I/System.out( 5768): URI: //map
06-05 18:18:24.666 I/System.out( 5768): params: {json={"query":"android.widget.AbsListView index:0","operation":{"method_name":"query","arguments":[]}}
06-05 18:18:24.666 I/System.out( 5768): }
06-05 18:18:24.690 I/System.out( 5768): URI: //map
06-05 18:18:24.690 I/System.out( 5768): params: {json={"query":"android.widget.AbsListView index:0","operation":{"method_name":"query","arguments":[]}}
06-05 18:18:24.690 I/System.out( 5768): }
06-05 18:18:24.708 I/System.out( 5768): URI: //map
06-05 18:18:24.708 I/System.out( 5768): params: {json={"query":"android.widget.AbsListView index:0","operation":{"method_name":"query","arguments":["getFirstVisiblePosition"]}}
06-05 18:18:24.708 I/System.out( 5768): }
06-05 18:18:24.728 I/System.out( 5768): URI: //map
06-05 18:18:24.728 I/System.out( 5768): params: {json={"query":"android.widget.AbsListView index:0","operation":{"method_name":"query","arguments":["getLastVisiblePosition"]}}
06-05 18:18:24.728 I/System.out( 5768): }
06-05 18:18:24.747 I/System.out( 5768): URI: //map
06-05 18:18:24.747 I/System.out( 5768): params: {json={"query":"android.widget.AbsListView index:0","operation":{"method_name":"query","arguments":[{"method_name":"setSelection","arguments":[26]}]}}
06-05 18:18:24.747 I/System.out( 5768): }
06-05 18:18:24.772 I/System.out( 5768): URI: //map
06-05 18:18:24.772 I/System.out( 5768): params: {json={"query":"* marked:'South'","operation":{"method_name":"query","arguments":[]}}
06-05 18:18:24.772 I/System.out( 5768): }
06-05 18:18:24.810 V/PhoneStatusBar( 1712): setLightsOn(true)
06-05 18:18:24.812 V/PhoneStatusBar( 1712): setLightsOn(true)
06-05 18:18:24.814 W/OpenGLRenderer( 2099): Incorrectly called buildLayer on View: ShortcutAndWidgetContainer, destroying layer...
06-05 18:18:24.826 I/WindowManager( 1630): Destroying surface Surface(name=com.android.launcher3/com.android.launcher3.Launcher) called by com.android.server.wm.WindowStateAnimator.destroySurface:2016 com.android.server.wm.WindowStateAnimator.destroySurfaceLocked:882 com.android.server.wm.WindowState.destroyOrSaveSurface:2100 com.android.server.wm.AppWindowToken.destroySurfaces:363 com.android.server.wm.AppWindowToken.notifyAppStopped:389 com.android.server.wm.WindowManagerService.notifyAppStopped:4463 com.android.server.am.ActivityStack.activityStoppedLocked:1252 com.android.server.am.ActivityManagerService.activityStopped:6903 
06-05 18:18:24.827 V/PhoneStatusBar( 1712): setLightsOn(true)
06-05 18:18:24.837 D/gralloc_ranchu( 1346): gralloc_alloc: Creating ashmem region of size 9023488
06-05 18:18:24.902 W/ResourceType( 5768): No package identifier when getting name for resource number 0x00000001
06-05 18:18:24.917 I/System.out( 5768): URI: //gesture
06-05 18:18:24.917 I/System.out( 5768): params: {json={"query_timeout":5.0,"gestures":[{"query_string":"* marked:'South'","touches":[{"x":50,"y":50,"offset_x":0,"offset_y":0,"wait":0.0,"time":0.2,"release":true,"query_string":null}]}]}
06-05 18:18:24.917 I/System.out( 5768): }
06-05 18:18:24.923 W/ResourceType( 5768): No package identifier when getting name for resource number 0x00000001
06-05 18:18:25.163 I/ActivityManager( 1630): START u0 {cmp=com.evancharlton.mileage/.charts.SouthChart (has extras)} from uid 10150 on display 0
06-05 18:18:25.167 V/PhoneStatusBar( 1712): setLightsOn(true)
06-05 18:18:25.171 V/PhoneStatusBar( 1712): setLightsOn(true)
06-05 18:18:25.202 I/System.out( 5768): URI: //map
06-05 18:18:25.202 I/System.out( 5768): params: {json={"query":"* {text CONTAINS[c] 'Farthest south fillup'}","operation":{"method_name":"query","arguments":[]}}
06-05 18:18:25.202 I/System.out( 5768): }
06-05 18:18:25.223 I/calabash( 5768): newActivity1
06-05 18:18:25.226 W/aiCharts( 5768): License file is invalid or missing. 
06-05 18:18:25.226 W/aiCharts( 5768): Please place proper license.lic to /assets folder.
06-05 18:18:25.239 V/PhoneStatusBar( 1712): setLightsOn(true)
06-05 18:18:25.259 V/PhoneStatusBar( 1712): setLightsOn(true)
06-05 18:18:25.264 I/WindowManager( 1630): Destroying surface Surface(name=Creating chart…) called by com.android.server.wm.WindowStateAnimator.destroySurface:2016 com.android.server.wm.WindowStateAnimator.destroySurfaceLocked:882 com.android.server.wm.WindowState.removeLocked:1456 com.android.server.wm.WindowManagerService.removeWindowInnerLocked:2484 com.android.server.wm.WindowManagerService.removeWindowLocked:2442 com.android.server.wm.WindowManagerService.removeWindowLocked:2311 com.android.server.wm.WindowManagerService.removeWindow:2306 com.android.server.wm.Session.remove:202 
06-05 18:18:25.267 D/gralloc_ranchu( 1346): gralloc_alloc: Creating ashmem region of size 9023488
06-05 18:18:25.276 V/PhoneStatusBar( 1712): setLightsOn(true)
06-05 18:18:25.292 V/PhoneStatusBar( 1712): setLightsOn(true)
06-05 18:18:25.309 I/ActivityManager( 1630): Displayed com.evancharlton.mileage/.charts.SouthChart: +88ms
06-05 18:18:25.309 V/PhoneStatusBar( 1712): setLightsOn(true)
06-05 18:18:25.325 V/PhoneStatusBar( 1712): setLightsOn(true)
06-05 18:18:25.527 V/PhoneStatusBar( 1712): setLightsOn(true)
06-05 18:18:25.555 I/System.out( 5768): URI: //map
06-05 18:18:25.555 I/System.out( 5768): params: {json={"query":"* {text CONTAINS[c] 'Farthest south fillup'}","operation":{"method_name":"query","arguments":[]}}
06-05 18:18:25.555 I/System.out( 5768): }
06-05 18:18:25.594 I/System.out( 5768): URI: //
06-05 18:18:25.594 I/System.out( 5768): params: {json={"command":"press_key","arguments":["KEYCODE_BACK"]}
06-05 18:18:25.594 I/System.out( 5768): }
06-05 18:18:25.594 I/System.out( 5768): header: {content-type=application/json;charset=utf-8, date=Fri, 05 Jun 2020 23:18:26 GMT, accept=*/*, host=127.0.0.1:34784, content-length=52, user-agent=HTTPClient/1.0 (2.8.3, ruby 2.5.1 (2018-03-29))}
06-05 18:18:25.594 I/System.out( 5768): params: {json={"command":"press_key","arguments":["KEYCODE_BACK"]}
06-05 18:18:25.594 I/System.out( 5768): }
06-05 18:18:25.594 I/System.out( 5768): ProP json = {"command":"press_key","arguments":["KEYCODE_BACK"]}
06-05 18:18:25.594 I/System.out( 5768): files: {}
06-05 18:18:25.594 I/System.out( 5768): command: {"command":"press_key","arguments":["KEYCODE_BACK"]}
06-05 18:18:25.596 I/InstrumentationBackend( 5768): Got command:'Command:'Line:null,press_key', arguments:'[KEYCODE_BACK]'
06-05 18:18:25.599 V/PhoneStatusBar( 1712): setLightsOn(true)
06-05 18:18:25.601 V/PhoneStatusBar( 1712): setLightsOn(true)
06-05 18:18:25.604 I/art     ( 5768): Do partial code cache collection, code=60KB, data=62KB
06-05 18:18:25.605 I/art     ( 5768): After code cache collection, code=59KB, data=61KB
06-05 18:18:25.605 I/art     ( 5768): Increasing code cache capacity to 256KB
06-05 18:18:25.605 D/VehicleStatisticsActivity( 5768): Checking recalculation ...
06-05 18:18:25.606 I/System.out( 5768): result:{"bonusInformation":[],"message":"","success":true}
06-05 18:18:25.606 D/VehicleStatisticsActivity( 5768): Recalculation not necessary.
06-05 18:18:25.609 V/PhoneStatusBar( 1712): setLightsOn(true)
06-05 18:18:25.610 I/System.out( 5768): URI: //map
06-05 18:18:25.610 I/System.out( 5768): params: {json={"query":"* {text CONTAINS[c] 'Statistics'}","operation":{"method_name":"query","arguments":[]}}
06-05 18:18:25.610 I/System.out( 5768): }
06-05 18:18:25.626 D/gralloc_ranchu( 1346): gralloc_alloc: Creating ashmem region of size 9023488
06-05 18:18:25.626 V/PhoneStatusBar( 1712): setLightsOn(true)
06-05 18:18:25.643 V/PhoneStatusBar( 1712): setLightsOn(true)
06-05 18:18:25.675 V/PhoneStatusBar( 1712): setLightsOn(true)
