--------- beginning of main
06-05 21:21:43.594 V/PhoneStatusBar( 1711): setLightsOn(true)
06-05 21:21:43.613 D/gralloc_ranchu( 1347): gralloc_alloc: Creating ashmem region of size 3145728
06-05 21:21:43.617 E/EGL_emulation( 1347): tid 1347: eglCreateSyncKHR(1901): error 0x3004 (EGL_BAD_ATTRIBUTE)
--------- beginning of system
06-05 21:21:43.632 W/ActivityManager( 1630): Finishing task with all activities already finished
06-05 21:21:43.632 W/ActivityManager( 1630): Duplicate finish request for ActivityRecord{1711c1a u0 com.evancharlton.mileage/.Mileage t7507 f}
06-05 21:21:43.633 W/ActivityManager( 1630): Finishing task with all activities already finished
06-05 21:21:43.633 W/ActivityManager( 1630): Duplicate finish request for ActivityRecord{1711c1a u0 com.evancharlton.mileage/.Mileage t7507 f}
06-05 21:21:43.633 W/ActivityManager( 1630): Finishing task with all activities already finished
06-05 21:21:43.633 W/ActivityManager( 1630): Duplicate finish request for ActivityRecord{1711c1a u0 com.evancharlton.mileage/.Mileage t7507 f}
06-05 21:21:43.633 W/ActivityManager( 1630): Finishing task with all activities already finished
06-05 21:21:43.633 W/ActivityManager( 1630): Duplicate finish request for ActivityRecord{1711c1a u0 com.evancharlton.mileage/.Mileage t7507 f}
06-05 21:21:43.633 W/ActivityManager( 1630): Finishing task with all activities already finished
06-05 21:21:43.633 W/ActivityManager( 1630): Duplicate finish request for ActivityRecord{1711c1a u0 com.evancharlton.mileage/.Mileage t7507 f}
06-05 21:21:43.633 W/ActivityManager( 1630): Finishing task with all activities already finished
06-05 21:21:43.634 W/ActivityManager( 1630): Duplicate finish request for ActivityRecord{72f7388 u0 com.evancharlton.mileage/.charts.AverageVolumeChart t7507 f}
06-05 21:21:43.634 W/ActivityManager( 1630): Finishing task with all activities already finished
06-05 21:21:43.634 W/ActivityManager( 1630): Duplicate finish request for ActivityRecord{72f7388 u0 com.evancharlton.mileage/.charts.AverageVolumeChart t7507 f}
06-05 21:21:43.634 W/ActivityManager( 1630): Finishing task with all activities already finished
06-05 21:21:43.634 W/ActivityManager( 1630): Duplicate finish request for ActivityRecord{1711c1a u0 com.evancharlton.mileage/.Mileage t7507 f}
06-05 21:21:43.634 W/ActivityManager( 1630): Finishing task with all activities already finished
06-05 21:21:43.634 W/ActivityManager( 1630): Duplicate finish request for ActivityRecord{1711c1a u0 com.evancharlton.mileage/.Mileage t7507 f}
06-05 21:21:43.679 D/EGL_emulation( 2083): eglMakeCurrent: 0xb0f85240: ver 2 0 (tinfo 0xb0f832d0)
06-05 21:21:43.680 D/EGL_emulation( 1711): eglMakeCurrent: 0xb0f853c0: ver 2 0 (tinfo 0xb0f833e0)
06-05 21:21:43.695 D/EGL_emulation( 1711): eglMakeCurrent: 0xb0f853c0: ver 2 0 (tinfo 0xb0f833e0)
06-05 21:21:43.713 D/EGL_emulation( 1711): eglMakeCurrent: 0xb0f853c0: ver 2 0 (tinfo 0xb0f833e0)
06-05 21:21:43.728 D/EGL_emulation( 1711): eglMakeCurrent: 0xb0f853c0: ver 2 0 (tinfo 0xb0f833e0)
06-05 21:21:43.730 D/EGL_emulation( 1711): eglMakeCurrent: 0xb0f853c0: ver 2 0 (tinfo 0xb0f833e0)
06-05 21:21:43.744 D/EGL_emulation( 1711): eglMakeCurrent: 0xb0f853c0: ver 2 0 (tinfo 0xb0f833e0)
06-05 21:21:43.746 D/EGL_emulation( 1711): eglMakeCurrent: 0xb0f853c0: ver 2 0 (tinfo 0xb0f833e0)
06-05 21:21:43.761 D/EGL_emulation( 1711): eglMakeCurrent: 0xb0f853c0: ver 2 0 (tinfo 0xb0f833e0)
06-05 21:21:43.763 D/EGL_emulation( 1711): eglMakeCurrent: 0xb0f853c0: ver 2 0 (tinfo 0xb0f833e0)
06-05 21:21:43.778 D/EGL_emulation( 1711): eglMakeCurrent: 0xb0f853c0: ver 2 0 (tinfo 0xb0f833e0)
06-05 21:21:43.779 D/EGL_emulation( 1711): eglMakeCurrent: 0xb0f853c0: ver 2 0 (tinfo 0xb0f833e0)
06-05 21:21:43.794 D/EGL_emulation( 1711): eglMakeCurrent: 0xb0f853c0: ver 2 0 (tinfo 0xb0f833e0)
06-05 21:21:43.796 D/EGL_emulation( 1711): eglMakeCurrent: 0xb0f853c0: ver 2 0 (tinfo 0xb0f833e0)
06-05 21:21:43.806 D/AndroidRuntime(10139): >>>>>> START com.android.internal.os.RuntimeInit uid 2000 <<<<<<
06-05 21:21:43.808 D/AndroidRuntime(10139): CheckJNI is ON
06-05 21:21:43.811 D/EGL_emulation( 1711): eglMakeCurrent: 0xb0f853c0: ver 2 0 (tinfo 0xb0f833e0)
06-05 21:21:43.812 D/EGL_emulation( 1711): eglMakeCurrent: 0xb0f853c0: ver 2 0 (tinfo 0xb0f833e0)
06-05 21:21:43.820 W/art     (10139): Unexpected CPU variant for X86 using defaults: x86
06-05 21:21:43.821 D/ICU     (10139): No timezone override file found: /data/misc/zoneinfo/current/icu/icu_tzdata.dat
06-05 21:21:43.827 D/EGL_emulation( 1711): eglMakeCurrent: 0xb0f853c0: ver 2 0 (tinfo 0xb0f833e0)
06-05 21:21:43.828 E/memtrack(10139): Couldn't load memtrack module (No such file or directory)
06-05 21:21:43.828 E/android.os.Debug(10139): failed to load memtrack module: -2
06-05 21:21:43.829 D/EGL_emulation( 1711): eglMakeCurrent: 0xb0f853c0: ver 2 0 (tinfo 0xb0f833e0)
06-05 21:21:43.829 I/Radio-JNI(10139): register_android_hardware_Radio DONE
06-05 21:21:43.833 D/AndroidRuntime(10139): Calling main entry com.android.commands.am.Am
06-05 21:21:43.835 I/ActivityManager( 1630): Force stopping com.evancharlton.mileage appid=10286 user=0: start instr
06-05 21:21:43.835 I/ActivityManager( 1630): Killing 10087:com.evancharlton.mileage/u0a286 (adj 0): stop com.evancharlton.mileage
06-05 21:21:43.835 D/ActivityManager( 1630): cleanUpApplicationRecord -- 10087
06-05 21:21:43.835 I/WindowManager( 1630): Destroying surface Surface(name=com.evancharlton.mileage/com.evancharlton.mileage.charts.AverageVolumeChart) called by com.android.server.wm.WindowStateAnimator.destroySurface:2016 com.android.server.wm.WindowStateAnimator.destroySurfaceLocked:882 com.android.server.wm.WindowState.removeLocked:1456 com.android.server.wm.WindowManagerService.removeWindowInnerLocked:2484 com.android.server.wm.WindowManagerService.removeWindowLocked:2442 com.android.server.wm.WindowManagerService.removeWindowLocked:2311 com.android.server.wm.AppWindowToken.removeAllWindows:530 com.android.server.wm.AppWindowToken.removeAppFromTaskLocked:326 
06-05 21:21:43.837 W/ActivityManager( 1630): Crash of app com.evancharlton.mileage running instrumentation ComponentInfo{com.evancharlton.mileage.test/sh.calaba.instrumentationbackend.CalabashInstrumentationTestRunner}
06-05 21:21:43.837 I/ActivityManager( 1630): Force stopping com.evancharlton.mileage appid=10286 user=0: finished inst
06-05 21:21:43.840 I/art     (10149): Not late-enabling -Xcheck:jni (already on)
06-05 21:21:43.840 W/art     (10149): Unexpected CPU variant for X86 using defaults: x86
06-05 21:21:43.844 D/EGL_emulation( 1711): eglMakeCurrent: 0xb0f853c0: ver 2 0 (tinfo 0xb0f833e0)
06-05 21:21:43.846 D/EGL_emulation( 1711): eglMakeCurrent: 0xb0f853c0: ver 2 0 (tinfo 0xb0f833e0)
06-05 21:21:43.847 I/ActivityManager( 1630): Start proc 10149:com.evancharlton.mileage/u0a286 for added application com.evancharlton.mileage
06-05 21:21:43.848 D/AndroidRuntime(10139): Shutting down VM
06-05 21:21:43.854 W/System  (10149): ClassLoader referenced unknown path: /data/app/com.evancharlton.mileage.test-1/lib/x86
06-05 21:21:43.854 W/System  (10149): ClassLoader referenced unknown path: /data/app/com.evancharlton.mileage-1/lib/x86
06-05 21:21:43.857 W/System  (10149): ClassLoader referenced unknown path: 
06-05 21:21:43.861 D/EGL_emulation( 1711): eglMakeCurrent: 0xb0f853c0: ver 2 0 (tinfo 0xb0f833e0)
06-05 21:21:43.863 D/EGL_emulation( 1711): eglMakeCurrent: 0xb0f853c0: ver 2 0 (tinfo 0xb0f833e0)
06-05 21:21:43.863 I/System.out(10149): Main activity name automatically set to: com.evancharlton.mileage.Mileage
06-05 21:21:43.863 I/System.out(10149): Calabash did not load Mono. This is only a problem if you are trying to test a Mono application
06-05 21:21:43.863 I/calabash(10149): Test server port: 7102
06-05 21:21:43.864 I/InstrumentationBackend(10149): Added:'GetPreferences', with key:'get_preferences'
06-05 21:21:43.870 I/InstrumentationBackend(10149): Added:'SetPreferences', with key:'set_preferences'
06-05 21:21:43.870 I/InstrumentationBackend(10149): Added:'ClearPreferences', with key:'clear_preferences'
06-05 21:21:43.870 I/InstrumentationBackend(10149): Added:'PressElement', with key:'press_l10n_element'
06-05 21:21:43.870 I/InstrumentationBackend(10149): Added:'WaitForElement', with key:'wait_for_l10n_element'
06-05 21:21:43.870 I/InstrumentationBackend(10149): Added:'NullAction', with key:'nullAction'
06-05 21:21:43.870 I/InstrumentationBackend(10149): Added:'PressKey', with key:'press_key'
06-05 21:21:43.870 I/InstrumentationBackend(10149): Added:'SetActivityOrientation', with key:'set_activity_orientation'
06-05 21:21:43.870 I/InstrumentationBackend(10149): Added:'GetActivityOrientation', with key:'get_activity_orientation'
06-05 21:21:43.870 I/InstrumentationBackend(10149): Added:'FakeGPSLocation', with key:'set_gps_coordinates'
06-05 21:21:43.870 I/InstrumentationBackend(10149): Added:'SetPropertyByCssSelector', with key:'set_property_by_css_selector'
06-05 21:21:43.870 I/InstrumentationBackend(10149): Added:'GetUrl', with key:'get_url'
06-05 21:21:43.871 I/InstrumentationBackend(10149): Added:'ScrollTo', with key:'scroll_to'
06-05 21:21:43.871 I/InstrumentationBackend(10149): Added:'GetLoadProgress', with key:'get_load_progress'
06-05 21:21:43.871 I/InstrumentationBackend(10149): Added:'DumpHtml', with key:'dump_html'
06-05 21:21:43.871 I/InstrumentationBackend(10149): Added:'DumpBodyHtml', with key:'dump_body_html'
06-05 21:21:43.871 I/InstrumentationBackend(10149): Added:'EnterTextByCssSelector', with key:'enter_text_by_selector'
06-05 21:21:43.871 I/InstrumentationBackend(10149): Added:'AndroidSDKVersion', with key:'android_sdk_version'
06-05 21:21:43.872 I/InstrumentationBackend(10149): Added:'Version', with key:'version'
06-05 21:21:43.872 I/InstrumentationBackend(10149): Added:'Drag', with key:'drag'
06-05 21:21:43.872 I/InstrumentationBackend(10149): Added:'TouchCoordinates', with key:'touch_coordinate'
06-05 21:21:43.872 I/InstrumentationBackend(10149): Added:'LongPressCoordinate', with key:'long_press_coordinate'
06-05 21:21:43.872 I/InstrumentationBackend(10149): Added:'DragCoordinates', with key:'drag_coordinates'
06-05 21:21:43.872 I/InstrumentationBackend(10149): Added:'ResumeApplication', with key:'resume_application'
06-05 21:21:43.872 I/InstrumentationBackend(10149): Added:'Swipe', with key:'swipe'
06-05 21:21:43.872 I/InstrumentationBackend(10149): Added:'DoubleTapCoordinate', with key:'double_tap_coordinate'
06-05 21:21:43.872 I/InstrumentationBackend(10149): Added:'ClickOnScreen', with key:'click_on_screen'
06-05 21:21:43.872 I/InstrumentationBackend(10149): Added:'GetActivityName', with key:'get_activity_name'
06-05 21:21:43.872 I/InstrumentationBackend(10149): Added:'ScrollToView', with key:'scroll_to_view'
06-05 21:21:43.873 I/InstrumentationBackend(10149): Added:'ViewConfiguration', with key:'view_configuration'
06-05 21:21:43.873 I/InstrumentationBackend(10149): Added:'IsCurrentActivityFocused', with key:'is_current_activity_focused'
06-05 21:21:43.873 I/InstrumentationBackend(10149): Added:'SendTcp', with key:'send_tcp'
06-05 21:21:43.873 I/InstrumentationBackend(10149): Added:'DpToDevicePixel', with key:'dp_to_device_pixel'
06-05 21:21:43.873 I/InstrumentationBackend(10149): Added:'KeyboardEnterText', with key:'keyboard_enter_text'
06-05 21:21:43.873 I/InstrumentationBackend(10149): Added:'DeleteSurroundingText', with key:'delete_surrounding_text'
06-05 21:21:43.873 I/InstrumentationBackend(10149): Added:'SetComposingRegion', with key:'set_composing_region'
06-05 21:21:43.873 I/InstrumentationBackend(10149): Added:'SetSelection', with key:'set_selection'
06-05 21:21:43.873 I/InstrumentationBackend(10149): Added:'KeyboardKeyEvent', with key:'keyboard_key_event'
06-05 21:21:43.873 I/InstrumentationBackend(10149): Added:'PressUserActionButton', with key:'press_user_action_button'
06-05 21:21:43.873 I/InstrumentationBackend(10149): Added:'HideSoftKeyboard', with key:'hide_soft_keyboard'
06-05 21:21:43.873 I/InstrumentationBackend(10149): Added:'ListActions', with key:'list_actions'
06-05 21:21:43.874 I/calabash(10149): Instantiating http server at 7102
06-05 21:21:43.874 I/System.out(10149): HTTP Daemon listening on: 7102
06-05 21:21:43.878 D/EGL_emulation( 1711): eglMakeCurrent: 0xb0f853c0: ver 2 0 (tinfo 0xb0f833e0)
06-05 21:21:43.895 D/EGL_emulation( 1711): eglMakeCurrent: 0xb0f853c0: ver 2 0 (tinfo 0xb0f833e0)
06-05 21:21:43.896 D/EGL_emulation( 1711): eglMakeCurrent: 0xb0f853c0: ver 2 0 (tinfo 0xb0f833e0)
06-05 21:21:43.898 I/WindowManager( 1630): WIN DEATH: Window{fe99fed u0 com.evancharlton.mileage/com.evancharlton.mileage.Mileage EXITING}
06-05 21:21:43.911 D/EGL_emulation( 1711): eglMakeCurrent: 0xb0f853c0: ver 2 0 (tinfo 0xb0f833e0)
06-05 21:21:43.914 D/EGL_emulation( 1711): eglMakeCurrent: 0xb0f853c0: ver 2 0 (tinfo 0xb0f833e0)
06-05 21:21:43.960 I/System.out(10149): URI: //ping
06-05 21:21:43.961 I/System.out(10149): params: {json={}
06-05 21:21:43.961 I/System.out(10149): }
06-05 21:21:43.964 I/System.out(10149): URI: //ping
06-05 21:21:43.964 I/System.out(10149): params: {json={}
06-05 21:21:43.964 I/System.out(10149): }
06-05 21:21:43.966 I/System.out(10149): URI: //ready
06-05 21:21:43.966 I/System.out(10149): params: {json={}
06-05 21:21:43.966 I/System.out(10149): }
06-05 21:21:43.968 I/System.out(10149): URI: //
06-05 21:21:43.968 I/System.out(10149): params: {json={"command":"version","arguments":[]}
06-05 21:21:43.968 I/System.out(10149): }
06-05 21:21:43.968 I/System.out(10149): header: {content-type=application/json;charset=utf-8, date=Sat, 06 Jun 2020 02:21:44 GMT, accept=*/*, host=127.0.0.1:34777, content-length=36, user-agent=HTTPClient/1.0 (2.8.3, ruby 2.5.1 (2018-03-29))}
06-05 21:21:43.968 I/System.out(10149): params: {json={"command":"version","arguments":[]}
06-05 21:21:43.968 I/System.out(10149): }
06-05 21:21:43.968 I/System.out(10149): ProP json = {"command":"version","arguments":[]}
06-05 21:21:43.968 I/System.out(10149): files: {}
06-05 21:21:43.968 I/System.out(10149): command: {"command":"version","arguments":[]}
06-05 21:21:43.972 I/InstrumentationBackend(10149): Got command:'Command:'Line:null,version', arguments:'[]'
06-05 21:21:43.980 I/System.out(10149): result:{"bonusInformation":[],"message":"0.9.8","success":true}
06-05 21:21:43.983 I/System.out(10149): URI: //start-application
06-05 21:21:43.983 I/System.out(10149): params: {json={"intent":null}
06-05 21:21:43.983 I/System.out(10149): }
06-05 21:21:43.993 I/ActivityManager( 1630): START u0 {act=android.intent.action.MAIN cat=[android.intent.category.LAUNCHER] flg=0x10200000 cmp=com.evancharlton.mileage/.Mileage} from uid 10286 on display 0
06-05 21:21:44.000 I/calabash(10149): newActivity1
06-05 21:21:44.009 I/calabash(10149): newActivity1
06-05 21:21:44.010 W/ActivityManager( 1630): Bad activity token: android.os.BinderProxy@7ef4f3d
06-05 21:21:44.010 W/ActivityManager( 1630): java.lang.ClassCastException: android.os.BinderProxy cannot be cast to com.android.server.am.ActivityRecord$Token
06-05 21:21:44.010 W/ActivityManager( 1630): 	at com.android.server.am.ActivityRecord.forTokenLocked(ActivityRecord.java:586)
06-05 21:21:44.010 W/ActivityManager( 1630): 	at com.android.server.am.ActivityRecord.isInStackLocked(ActivityRecord.java:1327)
06-05 21:21:44.010 W/ActivityManager( 1630): 	at com.android.server.am.ActivityRecord.getStackLocked(ActivityRecord.java:1332)
06-05 21:21:44.010 W/ActivityManager( 1630): 	at com.android.server.am.ActivityManagerService.getActivityDisplayId(ActivityManagerService.java:9806)
06-05 21:21:44.010 W/ActivityManager( 1630): 	at android.app.ActivityManagerNative.onTransact(ActivityManagerNative.java:2566)
06-05 21:21:44.010 W/ActivityManager( 1630): 	at com.android.server.am.ActivityManagerService.onTransact(ActivityManagerService.java:2757)
06-05 21:21:44.010 W/ActivityManager( 1630): 	at android.os.Binder.execTransact(Binder.java:565)
06-05 21:21:44.011 W/ActivityManager( 1630): Bad activity token: android.os.BinderProxy@7ef4f3d
06-05 21:21:44.011 W/ActivityManager( 1630): java.lang.ClassCastException: android.os.BinderProxy cannot be cast to com.android.server.am.ActivityRecord$Token
06-05 21:21:44.011 W/ActivityManager( 1630): 	at com.android.server.am.ActivityRecord.forTokenLocked(ActivityRecord.java:586)
06-05 21:21:44.011 W/ActivityManager( 1630): 	at com.android.server.am.ActivityRecord.isInStackLocked(ActivityRecord.java:1327)
06-05 21:21:44.011 W/ActivityManager( 1630): 	at com.android.server.am.ActivityManagerService.setTaskDescription(ActivityManagerService.java:9358)
06-05 21:21:44.011 W/ActivityManager( 1630): 	at android.app.ActivityManagerNative.onTransact(ActivityManagerNative.java:2639)
06-05 21:21:44.011 W/ActivityManager( 1630): 	at com.android.server.am.ActivityManagerService.onTransact(ActivityManagerService.java:2757)
06-05 21:21:44.011 W/ActivityManager( 1630): 	at android.os.Binder.execTransact(Binder.java:565)
06-05 21:21:44.011 W/ActivityManager( 1630): Bad activity token: android.os.BinderProxy@7ef4f3d
06-05 21:21:44.011 W/ActivityManager( 1630): java.lang.ClassCastException: android.os.BinderProxy cannot be cast to com.android.server.am.ActivityRecord$Token
06-05 21:21:44.011 W/ActivityManager( 1630): 	at com.android.server.am.ActivityRecord.forTokenLocked(ActivityRecord.java:586)
06-05 21:21:44.011 W/ActivityManager( 1630): 	at com.android.server.am.ActivityRecord.isInStackLocked(ActivityRecord.java:1327)
06-05 21:21:44.011 W/ActivityManager( 1630): 	at com.android.server.am.ActivityRecord.getStackLocked(ActivityRecord.java:1332)
06-05 21:21:44.011 W/ActivityManager( 1630): 	at com.android.server.am.ActivityManagerService.getActivityStackId(ActivityManagerService.java:9817)
06-05 21:21:44.011 W/ActivityManager( 1630): 	at android.app.ActivityManagerNative.onTransact(ActivityManagerNative.java:2856)
06-05 21:21:44.011 W/ActivityManager( 1630): 	at com.android.server.am.ActivityManagerService.onTransact(ActivityManagerService.java:2757)
06-05 21:21:44.011 W/ActivityManager( 1630): 	at android.os.Binder.execTransact(Binder.java:565)
06-05 21:21:44.027 W/ActivityManager( 1630): Bad activity token: android.os.BinderProxy@7ef4f3d
06-05 21:21:44.027 W/ActivityManager( 1630): java.lang.ClassCastException: android.os.BinderProxy cannot be cast to com.android.server.am.ActivityRecord$Token
06-05 21:21:44.027 W/ActivityManager( 1630): 	at com.android.server.am.ActivityRecord.forTokenLocked(ActivityRecord.java:586)
06-05 21:21:44.027 W/ActivityManager( 1630): 	at com.android.server.am.ActivityRecord.isInStackLocked(ActivityRecord.java:1327)
06-05 21:21:44.027 W/ActivityManager( 1630): 	at com.android.server.am.ActivityManagerService.getActivityOptions(ActivityManagerService.java:12559)
06-05 21:21:44.027 W/ActivityManager( 1630): 	at android.app.ActivityManagerNative.onTransact(ActivityManagerNative.java:1933)
06-05 21:21:44.027 W/ActivityManager( 1630): 	at com.android.server.am.ActivityManagerService.onTransact(ActivityManagerService.java:2757)
06-05 21:21:44.027 W/ActivityManager( 1630): 	at android.os.Binder.execTransact(Binder.java:565)
06-05 21:21:44.027 W/ActivityManager( 1630): Bad activity token: android.os.BinderProxy@7ef4f3d
06-05 21:21:44.027 W/ActivityManager( 1630): java.lang.ClassCastException: android.os.BinderProxy cannot be cast to com.android.server.am.ActivityRecord$Token
06-05 21:21:44.027 W/ActivityManager( 1630): 	at com.android.server.am.ActivityRecord.forTokenLocked(ActivityRecord.java:586)
06-05 21:21:44.027 W/ActivityManager( 1630): 	at com.android.server.am.ActivityRecord.isInStackLocked(ActivityRecord.java:1327)
06-05 21:21:44.027 W/ActivityManager( 1630): 	at com.android.server.am.ActivityManagerService.getActivityOptions(ActivityManagerService.java:12559)
06-05 21:21:44.027 W/ActivityManager( 1630): 	at android.app.ActivityManagerNative.onTransact(ActivityManagerNative.java:1933)
06-05 21:21:44.027 W/ActivityManager( 1630): 	at com.android.server.am.ActivityManagerService.onTransact(ActivityManagerService.java:2757)
06-05 21:21:44.027 W/ActivityManager( 1630): 	at android.os.Binder.execTransact(Binder.java:565)
06-05 21:21:44.028 D/gralloc_ranchu( 1347): gralloc_alloc: Creating ashmem region of size 9023488
06-05 21:21:44.049 V/PhoneStatusBar( 1711): setLightsOn(true)
06-05 21:21:44.061 D/EGL_emulation( 1711): eglMakeCurrent: 0xb0f853c0: ver 2 0 (tinfo 0xb0f833e0)
06-05 21:21:44.061 V/PhoneStatusBar( 1711): setLightsOn(true)
06-05 21:21:44.064 V/PhoneStatusBar( 1711): setLightsOn(true)
06-05 21:21:44.064 D/gralloc_ranchu( 1347): gralloc_alloc: Creating ashmem region of size 9023488
06-05 21:21:44.066 V/PhoneStatusBar( 1711): setLightsOn(true)
06-05 21:21:44.069 D/        (10149): HostConnection::get() New Host Connection established 0xa4a94480, tid 10149
06-05 21:21:44.100 D/EGL_emulation( 1711): eglMakeCurrent: 0xb0f853c0: ver 2 0 (tinfo 0xb0f833e0)
06-05 21:21:44.100 D/EGL_emulation( 2083): eglMakeCurrent: 0xb0f85240: ver 2 0 (tinfo 0xb0f832d0)
06-05 21:21:44.103 D/EGL_emulation( 1711): eglMakeCurrent: 0xb0f853c0: ver 2 0 (tinfo 0xb0f833e0)
06-05 21:21:44.105 D/EGL_emulation( 1711): eglMakeCurrent: 0xb0f853c0: ver 2 0 (tinfo 0xb0f833e0)
06-05 21:21:44.107 D/EGL_emulation( 1711): eglMakeCurrent: 0xb0f853c0: ver 2 0 (tinfo 0xb0f833e0)
06-05 21:21:44.111 I/WindowManager( 1630): Destroying surface Surface(name=com.evancharlton.mileage/com.evancharlton.mileage.Mileage) called by com.android.server.wm.WindowStateAnimator.destroySurface:2016 com.android.server.wm.WindowStateAnimator.destroySurfaceLocked:882 com.android.server.wm.WindowState.removeLocked:1456 com.android.server.wm.WindowManagerService.removeWindowInnerLocked:2484 com.android.server.wm.AppWindowToken.destroySurfaces:365 com.android.server.wm.WindowStateAnimator.finishExit:565 com.android.server.wm.AppWindowAnimator.stepAnimationLocked:427 com.android.server.wm.WindowAnimator.updateAppWindowsLocked:196 
06-05 21:21:44.116 D/EGL_emulation( 1711): eglMakeCurrent: 0xb0f853c0: ver 2 0 (tinfo 0xb0f833e0)
06-05 21:21:44.117 D/EGL_emulation( 1711): eglMakeCurrent: 0xb0f853c0: ver 2 0 (tinfo 0xb0f833e0)
06-05 21:21:44.119 I/ActivityManager( 1630): Displayed com.evancharlton.mileage/.Mileage: +122ms
06-05 21:21:44.128 D/gralloc_ranchu( 1347): gralloc_alloc: Creating ashmem region of size 9023488
06-05 21:21:44.135 D/EGL_emulation( 1711): eglMakeCurrent: 0xb0f853c0: ver 2 0 (tinfo 0xb0f833e0)
06-05 21:21:44.142 D/EGL_emulation( 1711): eglMakeCurrent: 0xb0f853c0: ver 2 0 (tinfo 0xb0f833e0)
06-05 21:21:44.150 D/EGL_emulation( 1711): eglMakeCurrent: 0xb0f853c0: ver 2 0 (tinfo 0xb0f833e0)
06-05 21:21:44.153 D/EGL_emulation( 1711): eglMakeCurrent: 0xb0f853c0: ver 2 0 (tinfo 0xb0f833e0)
06-05 21:21:44.154 V/PhoneStatusBar( 1711): setLightsOn(true)
06-05 21:21:44.164 D/EGL_emulation( 1711): eglMakeCurrent: 0xb0f853c0: ver 2 0 (tinfo 0xb0f833e0)
06-05 21:21:44.169 D/EGL_emulation( 1711): eglMakeCurrent: 0xb0f853c0: ver 2 0 (tinfo 0xb0f833e0)
06-05 21:21:44.171 I/System.out(10149): URI: //map
06-05 21:21:44.172 I/System.out(10149): params: {json={"query":"* marked:'Statistics'","operation":{"method_name":"query","arguments":[]}}
06-05 21:21:44.172 I/System.out(10149): }
06-05 21:21:44.178 D/EGL_emulation( 1711): eglMakeCurrent: 0xb0f853c0: ver 2 0 (tinfo 0xb0f833e0)
06-05 21:21:44.180 D/EGL_emulation( 1711): eglMakeCurrent: 0xb0f853c0: ver 2 0 (tinfo 0xb0f833e0)
06-05 21:21:44.184 W/ResourceType(10149): No package identifier when getting name for resource number 0x00000001
06-05 21:21:44.194 D/EGL_emulation( 1711): eglMakeCurrent: 0xb0f853c0: ver 2 0 (tinfo 0xb0f833e0)
06-05 21:21:44.196 D/EGL_emulation( 1711): eglMakeCurrent: 0xb0f853c0: ver 2 0 (tinfo 0xb0f833e0)
06-05 21:21:44.201 I/System.out(10149): URI: //gesture
06-05 21:21:44.201 I/System.out(10149): params: {json={"query_timeout":5.0,"gestures":[{"query_string":"* marked:'Statistics'","touches":[{"x":50,"y":50,"offset_x":0,"offset_y":0,"wait":0.0,"time":0.2,"release":true,"query_string":null}]}]}
06-05 21:21:44.201 I/System.out(10149): }
06-05 21:21:44.206 W/ResourceType(10149): No package identifier when getting name for resource number 0x00000001
06-05 21:21:44.211 D/EGL_emulation( 1711): eglMakeCurrent: 0xb0f853c0: ver 2 0 (tinfo 0xb0f833e0)
06-05 21:21:44.219 D/EGL_emulation( 1711): eglMakeCurrent: 0xb0f853c0: ver 2 0 (tinfo 0xb0f833e0)
06-05 21:21:44.230 D/EGL_emulation( 1711): eglMakeCurrent: 0xb0f853c0: ver 2 0 (tinfo 0xb0f833e0)
06-05 21:21:44.235 D/EGL_emulation( 1711): eglMakeCurrent: 0xb0f853c0: ver 2 0 (tinfo 0xb0f833e0)
06-05 21:21:44.245 D/EGL_emulation( 1711): eglMakeCurrent: 0xb0f853c0: ver 2 0 (tinfo 0xb0f833e0)
06-05 21:21:44.246 D/EGL_emulation( 1711): eglMakeCurrent: 0xb0f853c0: ver 2 0 (tinfo 0xb0f833e0)
06-05 21:21:44.261 D/EGL_emulation( 1711): eglMakeCurrent: 0xb0f853c0: ver 2 0 (tinfo 0xb0f833e0)
06-05 21:21:44.263 D/EGL_emulation( 1711): eglMakeCurrent: 0xb0f853c0: ver 2 0 (tinfo 0xb0f833e0)
06-05 21:21:44.278 D/EGL_emulation( 1711): eglMakeCurrent: 0xb0f853c0: ver 2 0 (tinfo 0xb0f833e0)
06-05 21:21:44.279 D/EGL_emulation( 1711): eglMakeCurrent: 0xb0f853c0: ver 2 0 (tinfo 0xb0f833e0)
06-05 21:21:44.294 D/EGL_emulation( 1711): eglMakeCurrent: 0xb0f853c0: ver 2 0 (tinfo 0xb0f833e0)
06-05 21:21:44.311 I/WindowManager( 1630): Destroying surface Surface(name=Starting com.evancharlton.mileage) called by com.android.server.wm.WindowStateAnimator.destroySurface:2016 com.android.server.wm.WindowStateAnimator.destroySurfaceLocked:882 com.android.server.wm.WindowState.destroyOrSaveSurface:2100 com.android.server.wm.AppWindowToken.destroySurfaces:363 com.android.server.wm.WindowStateAnimator.finishExit:565 com.android.server.wm.WindowStateAnimator.stepAnimationLocked:491 com.android.server.wm.WindowAnimator.updateWindowsLocked:303 com.android.server.wm.WindowAnimator.animateLocked:704 
06-05 21:21:44.312 V/PhoneStatusBar( 1711): setLightsOn(true)
06-05 21:21:44.314 V/PhoneStatusBar( 1711): setLightsOn(true)
06-05 21:21:44.431 I/calabash(10149): newActivity1
06-05 21:21:44.448 I/System.out(10149): URI: //map
06-05 21:21:44.448 I/System.out(10149): params: {json={"query":"android.widget.ScrollView index:0","operation":{"method_name":"query","arguments":[]}}
06-05 21:21:44.448 I/System.out(10149): }
06-05 21:21:44.448 W/ActivityManager( 1630): Bad activity token: android.os.BinderProxy@d9c5873
06-05 21:21:44.448 W/ActivityManager( 1630): java.lang.ClassCastException: android.os.BinderProxy cannot be cast to com.android.server.am.ActivityRecord$Token
06-05 21:21:44.448 W/ActivityManager( 1630): 	at com.android.server.am.ActivityRecord.forTokenLocked(ActivityRecord.java:586)
06-05 21:21:44.448 W/ActivityManager( 1630): 	at com.android.server.am.ActivityRecord.isInStackLocked(ActivityRecord.java:1327)
06-05 21:21:44.448 W/ActivityManager( 1630): 	at com.android.server.am.ActivityRecord.getStackLocked(ActivityRecord.java:1332)
06-05 21:21:44.448 W/ActivityManager( 1630): 	at com.android.server.am.ActivityManagerService.getActivityDisplayId(ActivityManagerService.java:9806)
06-05 21:21:44.448 W/ActivityManager( 1630): 	at android.app.ActivityManagerNative.onTransact(ActivityManagerNative.java:2566)
06-05 21:21:44.448 W/ActivityManager( 1630): 	at com.android.server.am.ActivityManagerService.onTransact(ActivityManagerService.java:2757)
06-05 21:21:44.448 W/ActivityManager( 1630): 	at android.os.Binder.execTransact(Binder.java:565)
06-05 21:21:44.449 W/ActivityManager( 1630): Bad activity token: android.os.BinderProxy@d9c5873
06-05 21:21:44.449 W/ActivityManager( 1630): java.lang.ClassCastException: android.os.BinderProxy cannot be cast to com.android.server.am.ActivityRecord$Token
06-05 21:21:44.449 W/ActivityManager( 1630): 	at com.android.server.am.ActivityRecord.forTokenLocked(ActivityRecord.java:586)
06-05 21:21:44.449 W/ActivityManager( 1630): 	at com.android.server.am.ActivityRecord.isInStackLocked(ActivityRecord.java:1327)
06-05 21:21:44.449 W/ActivityManager( 1630): 	at com.android.server.am.ActivityManagerService.setTaskDescription(ActivityManagerService.java:9358)
06-05 21:21:44.449 W/ActivityManager( 1630): 	at android.app.ActivityManagerNative.onTransact(ActivityManagerNative.java:2639)
06-05 21:21:44.449 W/ActivityManager( 1630): 	at com.android.server.am.ActivityManagerService.onTransact(ActivityManagerService.java:2757)
06-05 21:21:44.449 W/ActivityManager( 1630): 	at android.os.Binder.execTransact(Binder.java:565)
06-05 21:21:44.450 W/ActivityManager( 1630): Bad activity token: android.os.BinderProxy@d9c5873
06-05 21:21:44.450 W/ActivityManager( 1630): java.lang.ClassCastException: android.os.BinderProxy cannot be cast to com.android.server.am.ActivityRecord$Token
06-05 21:21:44.450 W/ActivityManager( 1630): 	at com.android.server.am.ActivityRecord.forTokenLocked(ActivityRecord.java:586)
06-05 21:21:44.450 W/ActivityManager( 1630): 	at com.android.server.am.ActivityRecord.isInStackLocked(ActivityRecord.java:1327)
06-05 21:21:44.450 W/ActivityManager( 1630): 	at com.android.server.am.ActivityRecord.getStackLocked(ActivityRecord.java:1332)
06-05 21:21:44.450 W/ActivityManager( 1630): 	at com.android.server.am.ActivityManagerService.getActivityStackId(ActivityManagerService.java:9817)
06-05 21:21:44.450 W/ActivityManager( 1630): 	at android.app.ActivityManagerNative.onTransact(ActivityManagerNative.java:2856)
06-05 21:21:44.450 W/ActivityManager( 1630): 	at com.android.server.am.ActivityManagerService.onTransact(ActivityManagerService.java:2757)
06-05 21:21:44.450 W/ActivityManager( 1630): 	at android.os.Binder.execTransact(Binder.java:565)
06-05 21:21:44.456 D/VehicleStatisticsActivity(10149): Checking recalculation ...
06-05 21:21:44.457 D/VehicleStatisticsActivity(10149): Recalculation not necessary.
06-05 21:21:44.458 W/ActivityManager( 1630): Bad activity token: android.os.BinderProxy@d9c5873
06-05 21:21:44.458 W/ActivityManager( 1630): java.lang.ClassCastException: android.os.BinderProxy cannot be cast to com.android.server.am.ActivityRecord$Token
06-05 21:21:44.458 W/ActivityManager( 1630): 	at com.android.server.am.ActivityRecord.forTokenLocked(ActivityRecord.java:586)
06-05 21:21:44.458 W/ActivityManager( 1630): 	at com.android.server.am.ActivityRecord.isInStackLocked(ActivityRecord.java:1327)
06-05 21:21:44.458 W/ActivityManager( 1630): 	at com.android.server.am.ActivityManagerService.getActivityOptions(ActivityManagerService.java:12559)
06-05 21:21:44.458 W/ActivityManager( 1630): 	at android.app.ActivityManagerNative.onTransact(ActivityManagerNative.java:1933)
06-05 21:21:44.458 W/ActivityManager( 1630): 	at com.android.server.am.ActivityManagerService.onTransact(ActivityManagerService.java:2757)
06-05 21:21:44.458 W/ActivityManager( 1630): 	at android.os.Binder.execTransact(Binder.java:565)
06-05 21:21:44.459 W/ActivityManager( 1630): Bad activity token: android.os.BinderProxy@d9c5873
06-05 21:21:44.459 W/ActivityManager( 1630): java.lang.ClassCastException: android.os.BinderProxy cannot be cast to com.android.server.am.ActivityRecord$Token
06-05 21:21:44.459 W/ActivityManager( 1630): 	at com.android.server.am.ActivityRecord.forTokenLocked(ActivityRecord.java:586)
06-05 21:21:44.459 W/ActivityManager( 1630): 	at com.android.server.am.ActivityRecord.isInStackLocked(ActivityRecord.java:1327)
06-05 21:21:44.459 W/ActivityManager( 1630): 	at com.android.server.am.ActivityManagerService.getActivityOptions(ActivityManagerService.java:12559)
06-05 21:21:44.459 W/ActivityManager( 1630): 	at android.app.ActivityManagerNative.onTransact(ActivityManagerNative.java:1933)
06-05 21:21:44.459 W/ActivityManager( 1630): 	at com.android.server.am.ActivityManagerService.onTransact(ActivityManagerService.java:2757)
06-05 21:21:44.459 W/ActivityManager( 1630): 	at android.os.Binder.execTransact(Binder.java:565)
06-05 21:21:44.460 D/VehicleStatisticsActivity(10149): Checking recalculation ...
06-05 21:21:44.461 D/VehicleStatisticsActivity(10149): Recalculation not necessary.
06-05 21:21:44.511 I/System.out(10149): URI: //map
06-05 21:21:44.511 I/System.out(10149): params: {json={"query":"android.widget.AbsListView index:0","operation":{"method_name":"query","arguments":[]}}
06-05 21:21:44.511 I/System.out(10149): }
06-05 21:21:44.511 V/PhoneStatusBar( 1711): setLightsOn(true)
06-05 21:21:44.515 I/art     (10149): Do partial code cache collection, code=30KB, data=29KB
06-05 21:21:44.515 I/art     (10149): After code cache collection, code=29KB, data=28KB
06-05 21:21:44.515 I/art     (10149): Increasing code cache capacity to 128KB
06-05 21:21:44.525 I/System.out(10149): URI: //map
06-05 21:21:44.525 I/System.out(10149): params: {json={"query":"android.widget.AbsListView index:0","operation":{"method_name":"query","arguments":[]}}
06-05 21:21:44.525 I/System.out(10149): }
06-05 21:21:44.542 I/System.out(10149): URI: //map
06-05 21:21:44.542 I/System.out(10149): params: {json={"query":"android.widget.AbsListView index:0","operation":{"method_name":"query","arguments":[]}}
06-05 21:21:44.542 I/System.out(10149): }
06-05 21:21:44.557 I/System.out(10149): URI: //map
06-05 21:21:44.557 I/System.out(10149): params: {json={"query":"android.widget.AbsListView index:0","operation":{"method_name":"query","arguments":["getFirstVisiblePosition"]}}
06-05 21:21:44.557 I/System.out(10149): }
06-05 21:21:44.570 I/System.out(10149): URI: //map
06-05 21:21:44.570 I/System.out(10149): params: {json={"query":"android.widget.AbsListView index:0","operation":{"method_name":"query","arguments":["getLastVisiblePosition"]}}
06-05 21:21:44.570 I/System.out(10149): }
06-05 21:21:44.584 I/System.out(10149): URI: //map
06-05 21:21:44.584 I/System.out(10149): params: {json={"query":"android.widget.AbsListView index:0","operation":{"method_name":"query","arguments":[{"method_name":"setSelection","arguments":[26]}]}}
06-05 21:21:44.584 I/System.out(10149): }
06-05 21:21:44.601 I/System.out(10149): URI: //map
06-05 21:21:44.601 I/System.out(10149): params: {json={"query":"* marked:'Total fuel'","operation":{"method_name":"query","arguments":[]}}
06-05 21:21:44.601 I/System.out(10149): }
06-05 21:21:44.656 D/gralloc_ranchu( 1347): gralloc_alloc: Creating ashmem region of size 9023488
06-05 21:21:44.713 W/ResourceType(10149): No package identifier when getting name for resource number 0x00000001
06-05 21:21:44.725 I/System.out(10149): URI: //gesture
06-05 21:21:44.725 I/System.out(10149): params: {json={"query_timeout":5.0,"gestures":[{"query_string":"* marked:'Total fuel'","touches":[{"x":50,"y":50,"offset_x":0,"offset_y":0,"wait":0.0,"time":0.2,"release":true,"query_string":null}]}]}
06-05 21:21:44.725 I/System.out(10149): }
06-05 21:21:44.729 W/ResourceType(10149): No package identifier when getting name for resource number 0x00000001
06-05 21:21:44.814 V/PhoneStatusBar( 1711): setLightsOn(true)
06-05 21:21:44.817 V/PhoneStatusBar( 1711): setLightsOn(true)
06-05 21:21:44.820 W/OpenGLRenderer( 2083): Incorrectly called buildLayer on View: ShortcutAndWidgetContainer, destroying layer...
06-05 21:21:44.830 I/WindowManager( 1630): Destroying surface Surface(name=com.android.launcher3/com.android.launcher3.Launcher) called by com.android.server.wm.WindowStateAnimator.destroySurface:2016 com.android.server.wm.WindowStateAnimator.destroySurfaceLocked:882 com.android.server.wm.WindowState.destroyOrSaveSurface:2100 com.android.server.wm.AppWindowToken.destroySurfaces:363 com.android.server.wm.AppWindowToken.notifyAppStopped:389 com.android.server.wm.WindowManagerService.notifyAppStopped:4463 com.android.server.am.ActivityStack.activityStoppedLocked:1252 com.android.server.am.ActivityManagerService.activityStopped:6903 
06-05 21:21:44.832 V/PhoneStatusBar( 1711): setLightsOn(true)
06-05 21:21:44.964 I/ActivityManager( 1630): START u0 {cmp=com.evancharlton.mileage/.charts.TotalVolumeChart (has extras)} from uid 10286 on display 0
06-05 21:21:44.967 V/PhoneStatusBar( 1711): setLightsOn(true)
06-05 21:21:44.969 V/PhoneStatusBar( 1711): setLightsOn(true)
06-05 21:21:44.986 I/System.out(10149): URI: //map
06-05 21:21:44.986 I/System.out(10149): params: {json={"query":"* {text CONTAINS[c] 'Total fuel purchased'}","operation":{"method_name":"query","arguments":[]}}
06-05 21:21:44.986 I/System.out(10149): }
06-05 21:21:45.025 I/calabash(10149): newActivity1
06-05 21:21:45.029 W/aiCharts(10149): License file is invalid or missing. 
06-05 21:21:45.029 W/aiCharts(10149): Please place proper license.lic to /assets folder.
06-05 21:21:45.045 V/PhoneStatusBar( 1711): setLightsOn(true)
06-05 21:21:45.077 V/PhoneStatusBar( 1711): setLightsOn(true)
06-05 21:21:45.083 I/WindowManager( 1630): Destroying surface Surface(name=Creating chart…) called by com.android.server.wm.WindowStateAnimator.destroySurface:2016 com.android.server.wm.WindowStateAnimator.destroySurfaceLocked:882 com.android.server.wm.WindowState.removeLocked:1456 com.android.server.wm.WindowManagerService.removeWindowInnerLocked:2484 com.android.server.wm.WindowManagerService.removeWindowLocked:2442 com.android.server.wm.WindowManagerService.removeWindowLocked:2311 com.android.server.wm.WindowManagerService.removeWindow:2306 com.android.server.wm.Session.remove:202 
06-05 21:21:45.086 D/gralloc_ranchu( 1347): gralloc_alloc: Creating ashmem region of size 9023488
06-05 21:21:45.094 V/PhoneStatusBar( 1711): setLightsOn(true)
06-05 21:21:45.117 I/ActivityManager( 1630): Displayed com.evancharlton.mileage/.charts.TotalVolumeChart: +95ms
06-05 21:21:45.128 V/PhoneStatusBar( 1711): setLightsOn(true)
06-05 21:21:45.161 V/PhoneStatusBar( 1711): setLightsOn(true)
06-05 21:21:45.177 V/PhoneStatusBar( 1711): setLightsOn(true)
06-05 21:21:45.361 I/System.out(10149): URI: //map
06-05 21:21:45.361 I/System.out(10149): params: {json={"query":"* {text CONTAINS[c] 'Total fuel purchased'}","operation":{"method_name":"query","arguments":[]}}
06-05 21:21:45.361 I/System.out(10149): }
06-05 21:21:45.362 V/PhoneStatusBar( 1711): setLightsOn(true)
06-05 21:21:45.381 I/System.out(10149): URI: //
06-05 21:21:45.381 I/System.out(10149): params: {json={"command":"press_key","arguments":["KEYCODE_BACK"]}
06-05 21:21:45.381 I/System.out(10149): }
06-05 21:21:45.381 I/System.out(10149): header: {content-type=application/json;charset=utf-8, date=Sat, 06 Jun 2020 02:21:45 GMT, accept=*/*, host=127.0.0.1:34777, content-length=52, user-agent=HTTPClient/1.0 (2.8.3, ruby 2.5.1 (2018-03-29))}
06-05 21:21:45.381 I/System.out(10149): params: {json={"command":"press_key","arguments":["KEYCODE_BACK"]}
06-05 21:21:45.381 I/System.out(10149): }
06-05 21:21:45.381 I/System.out(10149): ProP json = {"command":"press_key","arguments":["KEYCODE_BACK"]}
06-05 21:21:45.381 I/System.out(10149): files: {}
06-05 21:21:45.381 I/System.out(10149): command: {"command":"press_key","arguments":["KEYCODE_BACK"]}
06-05 21:21:45.382 I/InstrumentationBackend(10149): Got command:'Command:'Line:null,press_key', arguments:'[KEYCODE_BACK]'
06-05 21:21:45.385 V/PhoneStatusBar( 1711): setLightsOn(true)
06-05 21:21:45.388 V/PhoneStatusBar( 1711): setLightsOn(true)
06-05 21:21:45.389 I/art     (10149): Do partial code cache collection, code=60KB, data=62KB
06-05 21:21:45.389 I/art     (10149): After code cache collection, code=60KB, data=61KB
06-05 21:21:45.389 I/art     (10149): Increasing code cache capacity to 256KB
06-05 21:21:45.390 D/VehicleStatisticsActivity(10149): Checking recalculation ...
06-05 21:21:45.390 I/System.out(10149): result:{"bonusInformation":[],"message":"","success":true}
06-05 21:21:45.391 D/VehicleStatisticsActivity(10149): Recalculation not necessary.
06-05 21:21:45.392 I/System.out(10149): URI: //map
06-05 21:21:45.392 I/System.out(10149): params: {json={"query":"* {text CONTAINS[c] 'Statistics'}","operation":{"method_name":"query","arguments":[]}}
06-05 21:21:45.392 I/System.out(10149): }
06-05 21:21:45.394 V/PhoneStatusBar( 1711): setLightsOn(true)
06-05 21:21:45.411 D/gralloc_ranchu( 1347): gralloc_alloc: Creating ashmem region of size 9023488
06-05 21:21:45.411 V/PhoneStatusBar( 1711): setLightsOn(true)
06-05 21:21:45.427 V/PhoneStatusBar( 1711): setLightsOn(true)
06-05 21:21:45.444 V/PhoneStatusBar( 1711): setLightsOn(true)
