--------- beginning of main
06-06 00:59:26.767 V/PhoneStatusBar( 1712): setLightsOn(true)
06-06 00:59:26.769 V/PhoneStatusBar( 1712): setLightsOn(true)
06-06 00:59:26.785 D/gralloc_ranchu( 1347): gralloc_alloc: Creating ashmem region of size 3145728
06-06 00:59:26.790 E/EGL_emulation( 1347): tid 1347: eglCreateSyncKHR(1901): error 0x3004 (EGL_BAD_ATTRIBUTE)
--------- beginning of system
06-06 00:59:26.805 W/ActivityManager( 1631): Finishing task with all activities already finished
06-06 00:59:26.805 W/ActivityManager( 1631): Duplicate finish request for ActivityRecord{9eb982 u0 com.evancharlton.mileage/.Mileage t10847 f}
06-06 00:59:26.805 W/ActivityManager( 1631): Finishing task with all activities already finished
06-06 00:59:26.805 W/ActivityManager( 1631): Duplicate finish request for ActivityRecord{9eb982 u0 com.evancharlton.mileage/.Mileage t10847 f}
06-06 00:59:26.805 W/ActivityManager( 1631): Finishing task with all activities already finished
06-06 00:59:26.805 W/ActivityManager( 1631): Duplicate finish request for ActivityRecord{9eb982 u0 com.evancharlton.mileage/.Mileage t10847 f}
06-06 00:59:26.806 W/ActivityManager( 1631): Finishing task with all activities already finished
06-06 00:59:26.806 W/ActivityManager( 1631): Duplicate finish request for ActivityRecord{9eb982 u0 com.evancharlton.mileage/.Mileage t10847 f}
06-06 00:59:26.806 W/ActivityManager( 1631): Finishing task with all activities already finished
06-06 00:59:26.806 W/ActivityManager( 1631): Duplicate finish request for ActivityRecord{9eb982 u0 com.evancharlton.mileage/.Mileage t10847 f}
06-06 00:59:26.838 D/EGL_emulation( 1712): eglMakeCurrent: 0xb0685360: ver 2 0 (tinfo 0xb06836c0)
06-06 00:59:26.850 D/EGL_emulation( 1712): eglMakeCurrent: 0xb0685360: ver 2 0 (tinfo 0xb06836c0)
06-06 00:59:26.852 D/EGL_emulation( 2076): eglMakeCurrent: 0xb0685360: ver 2 0 (tinfo 0xb06836b0)
06-06 00:59:26.884 D/EGL_emulation( 1712): eglMakeCurrent: 0xb0685360: ver 2 0 (tinfo 0xb06836c0)
06-06 00:59:26.900 D/EGL_emulation( 1712): eglMakeCurrent: 0xb0685360: ver 2 0 (tinfo 0xb06836c0)
06-06 00:59:26.903 D/EGL_emulation( 1712): eglMakeCurrent: 0xb0685360: ver 2 0 (tinfo 0xb06836c0)
06-06 00:59:26.917 D/EGL_emulation( 1712): eglMakeCurrent: 0xb0685360: ver 2 0 (tinfo 0xb06836c0)
06-06 00:59:26.919 D/EGL_emulation( 1712): eglMakeCurrent: 0xb0685360: ver 2 0 (tinfo 0xb06836c0)
06-06 00:59:26.925 D/AndroidRuntime(23426): >>>>>> START com.android.internal.os.RuntimeInit uid 2000 <<<<<<
06-06 00:59:26.926 D/AndroidRuntime(23426): CheckJNI is ON
06-06 00:59:26.933 D/EGL_emulation( 1712): eglMakeCurrent: 0xb0685360: ver 2 0 (tinfo 0xb06836c0)
06-06 00:59:26.935 D/EGL_emulation( 1712): eglMakeCurrent: 0xb0685360: ver 2 0 (tinfo 0xb06836c0)
06-06 00:59:26.938 W/art     (23426): Unexpected CPU variant for X86 using defaults: x86
06-06 00:59:26.940 D/ICU     (23426): No timezone override file found: /data/misc/zoneinfo/current/icu/icu_tzdata.dat
06-06 00:59:26.949 E/memtrack(23426): Couldn't load memtrack module (No such file or directory)
06-06 00:59:26.949 E/android.os.Debug(23426): failed to load memtrack module: -2
06-06 00:59:26.950 I/Radio-JNI(23426): register_android_hardware_Radio DONE
06-06 00:59:26.950 D/EGL_emulation( 1712): eglMakeCurrent: 0xb0685360: ver 2 0 (tinfo 0xb06836c0)
06-06 00:59:26.951 D/EGL_emulation( 1712): eglMakeCurrent: 0xb0685360: ver 2 0 (tinfo 0xb06836c0)
06-06 00:59:26.955 D/AndroidRuntime(23426): Calling main entry com.android.commands.am.Am
06-06 00:59:26.956 I/ActivityManager( 1631): Force stopping com.evancharlton.mileage appid=10374 user=0: start instr
06-06 00:59:26.956 I/ActivityManager( 1631): Killing 23377:com.evancharlton.mileage/u0a374 (adj 0): stop com.evancharlton.mileage
06-06 00:59:26.956 D/ActivityManager( 1631): cleanUpApplicationRecord -- 23377
06-06 00:59:26.956 W/ActivityManager( 1631): Crash of app com.evancharlton.mileage running instrumentation ComponentInfo{com.evancharlton.mileage.test/sh.calaba.instrumentationbackend.CalabashInstrumentationTestRunner}
06-06 00:59:26.956 I/ActivityManager( 1631): Force stopping com.evancharlton.mileage appid=10374 user=0: finished inst
06-06 00:59:26.960 I/art     (23436): Not late-enabling -Xcheck:jni (already on)
06-06 00:59:26.960 W/art     (23436): Unexpected CPU variant for X86 using defaults: x86
06-06 00:59:26.967 D/EGL_emulation( 1712): eglMakeCurrent: 0xb0685360: ver 2 0 (tinfo 0xb06836c0)
06-06 00:59:26.967 I/ActivityManager( 1631): Start proc 23436:com.evancharlton.mileage/u0a374 for added application com.evancharlton.mileage
06-06 00:59:26.967 D/AndroidRuntime(23426): Shutting down VM
06-06 00:59:26.969 D/EGL_emulation( 1712): eglMakeCurrent: 0xb0685360: ver 2 0 (tinfo 0xb06836c0)
06-06 00:59:26.971 W/System  (23436): ClassLoader referenced unknown path: /data/app/com.evancharlton.mileage.test-1/lib/x86
06-06 00:59:26.971 W/System  (23436): ClassLoader referenced unknown path: /data/app/com.evancharlton.mileage-1/lib/x86
06-06 00:59:26.973 W/System  (23436): ClassLoader referenced unknown path: 
06-06 00:59:26.977 I/System.out(23436): Main activity name automatically set to: com.evancharlton.mileage.Mileage
06-06 00:59:26.978 I/System.out(23436): Calabash did not load Mono. This is only a problem if you are trying to test a Mono application
06-06 00:59:26.978 I/calabash(23436): Test server port: 7102
06-06 00:59:26.980 I/InstrumentationBackend(23436): Added:'GetPreferences', with key:'get_preferences'
06-06 00:59:26.983 D/EGL_emulation( 1712): eglMakeCurrent: 0xb0685360: ver 2 0 (tinfo 0xb06836c0)
06-06 00:59:26.985 I/InstrumentationBackend(23436): Added:'SetPreferences', with key:'set_preferences'
06-06 00:59:26.985 I/InstrumentationBackend(23436): Added:'ClearPreferences', with key:'clear_preferences'
06-06 00:59:26.985 I/InstrumentationBackend(23436): Added:'PressElement', with key:'press_l10n_element'
06-06 00:59:26.985 I/InstrumentationBackend(23436): Added:'WaitForElement', with key:'wait_for_l10n_element'
06-06 00:59:26.985 I/InstrumentationBackend(23436): Added:'NullAction', with key:'nullAction'
06-06 00:59:26.985 I/InstrumentationBackend(23436): Added:'PressKey', with key:'press_key'
06-06 00:59:26.985 I/InstrumentationBackend(23436): Added:'SetActivityOrientation', with key:'set_activity_orientation'
06-06 00:59:26.985 I/InstrumentationBackend(23436): Added:'GetActivityOrientation', with key:'get_activity_orientation'
06-06 00:59:26.985 I/InstrumentationBackend(23436): Added:'FakeGPSLocation', with key:'set_gps_coordinates'
06-06 00:59:26.985 I/InstrumentationBackend(23436): Added:'SetPropertyByCssSelector', with key:'set_property_by_css_selector'
06-06 00:59:26.985 I/InstrumentationBackend(23436): Added:'GetUrl', with key:'get_url'
06-06 00:59:26.985 I/InstrumentationBackend(23436): Added:'ScrollTo', with key:'scroll_to'
06-06 00:59:26.985 I/InstrumentationBackend(23436): Added:'GetLoadProgress', with key:'get_load_progress'
06-06 00:59:26.985 I/InstrumentationBackend(23436): Added:'DumpHtml', with key:'dump_html'
06-06 00:59:26.985 I/InstrumentationBackend(23436): Added:'DumpBodyHtml', with key:'dump_body_html'
06-06 00:59:26.985 I/InstrumentationBackend(23436): Added:'EnterTextByCssSelector', with key:'enter_text_by_selector'
06-06 00:59:26.985 D/EGL_emulation( 1712): eglMakeCurrent: 0xb0685360: ver 2 0 (tinfo 0xb06836c0)
06-06 00:59:26.986 I/InstrumentationBackend(23436): Added:'AndroidSDKVersion', with key:'android_sdk_version'
06-06 00:59:26.986 I/InstrumentationBackend(23436): Added:'Version', with key:'version'
06-06 00:59:26.986 I/InstrumentationBackend(23436): Added:'Drag', with key:'drag'
06-06 00:59:26.986 I/InstrumentationBackend(23436): Added:'TouchCoordinates', with key:'touch_coordinate'
06-06 00:59:26.986 I/InstrumentationBackend(23436): Added:'LongPressCoordinate', with key:'long_press_coordinate'
06-06 00:59:26.986 I/InstrumentationBackend(23436): Added:'DragCoordinates', with key:'drag_coordinates'
06-06 00:59:26.986 I/InstrumentationBackend(23436): Added:'ResumeApplication', with key:'resume_application'
06-06 00:59:26.986 I/InstrumentationBackend(23436): Added:'Swipe', with key:'swipe'
06-06 00:59:26.986 I/InstrumentationBackend(23436): Added:'DoubleTapCoordinate', with key:'double_tap_coordinate'
06-06 00:59:26.986 I/InstrumentationBackend(23436): Added:'ClickOnScreen', with key:'click_on_screen'
06-06 00:59:26.986 I/InstrumentationBackend(23436): Added:'GetActivityName', with key:'get_activity_name'
06-06 00:59:26.986 I/InstrumentationBackend(23436): Added:'ScrollToView', with key:'scroll_to_view'
06-06 00:59:26.986 I/InstrumentationBackend(23436): Added:'ViewConfiguration', with key:'view_configuration'
06-06 00:59:26.986 I/InstrumentationBackend(23436): Added:'IsCurrentActivityFocused', with key:'is_current_activity_focused'
06-06 00:59:26.986 I/InstrumentationBackend(23436): Added:'SendTcp', with key:'send_tcp'
06-06 00:59:26.986 I/InstrumentationBackend(23436): Added:'DpToDevicePixel', with key:'dp_to_device_pixel'
06-06 00:59:26.986 I/InstrumentationBackend(23436): Added:'KeyboardEnterText', with key:'keyboard_enter_text'
06-06 00:59:26.986 I/InstrumentationBackend(23436): Added:'DeleteSurroundingText', with key:'delete_surrounding_text'
06-06 00:59:26.986 I/InstrumentationBackend(23436): Added:'SetComposingRegion', with key:'set_composing_region'
06-06 00:59:26.986 I/InstrumentationBackend(23436): Added:'SetSelection', with key:'set_selection'
06-06 00:59:26.986 I/InstrumentationBackend(23436): Added:'KeyboardKeyEvent', with key:'keyboard_key_event'
06-06 00:59:26.987 I/InstrumentationBackend(23436): Added:'PressUserActionButton', with key:'press_user_action_button'
06-06 00:59:26.987 I/InstrumentationBackend(23436): Added:'HideSoftKeyboard', with key:'hide_soft_keyboard'
06-06 00:59:26.987 I/InstrumentationBackend(23436): Added:'ListActions', with key:'list_actions'
06-06 00:59:26.987 I/calabash(23436): Instantiating http server at 7102
06-06 00:59:26.987 I/System.out(23436): HTTP Daemon listening on: 7102
06-06 00:59:26.993 W/InputDispatcher( 1631): channel '9c27639 com.evancharlton.mileage/com.evancharlton.mileage.Mileage (server)' ~ Consumer closed input channel or an error occurred.  events=0x9
06-06 00:59:26.994 E/InputDispatcher( 1631): channel '9c27639 com.evancharlton.mileage/com.evancharlton.mileage.Mileage (server)' ~ Channel is unrecoverably broken and will be disposed!
06-06 00:59:26.994 I/WindowManager( 1631): WIN DEATH: Window{9c27639 u0 com.evancharlton.mileage/com.evancharlton.mileage.Mileage EXITING}
06-06 00:59:26.994 W/InputDispatcher( 1631): Attempted to unregister already unregistered input channel '9c27639 com.evancharlton.mileage/com.evancharlton.mileage.Mileage (server)'
06-06 00:59:26.994 W/InputDispatcher( 1631): channel 'd14692e Toast (server)' ~ Consumer closed input channel or an error occurred.  events=0x9
06-06 00:59:26.994 E/InputDispatcher( 1631): channel 'd14692e Toast (server)' ~ Channel is unrecoverably broken and will be disposed!
06-06 00:59:26.995 I/WindowManager( 1631): WIN DEATH: Window{d14692e u0 Toast}
06-06 00:59:26.995 W/InputDispatcher( 1631): Attempted to unregister already unregistered input channel 'd14692e Toast (server)'
06-06 00:59:27.003 D/EGL_emulation( 1712): eglMakeCurrent: 0xb0685360: ver 2 0 (tinfo 0xb06836c0)
06-06 00:59:27.007 D/EGL_emulation( 1712): eglMakeCurrent: 0xb0685360: ver 2 0 (tinfo 0xb06836c0)
06-06 00:59:27.017 D/EGL_emulation( 1712): eglMakeCurrent: 0xb0685360: ver 2 0 (tinfo 0xb06836c0)
06-06 00:59:27.018 D/EGL_emulation( 1712): eglMakeCurrent: 0xb0685360: ver 2 0 (tinfo 0xb06836c0)
06-06 00:59:27.033 D/EGL_emulation( 1712): eglMakeCurrent: 0xb0685360: ver 2 0 (tinfo 0xb06836c0)
06-06 00:59:27.035 D/EGL_emulation( 1712): eglMakeCurrent: 0xb0685360: ver 2 0 (tinfo 0xb06836c0)
06-06 00:59:27.051 D/EGL_emulation( 1712): eglMakeCurrent: 0xb0685360: ver 2 0 (tinfo 0xb06836c0)
06-06 00:59:27.067 D/EGL_emulation( 1712): eglMakeCurrent: 0xb0685360: ver 2 0 (tinfo 0xb06836c0)
06-06 00:59:27.068 D/EGL_emulation( 1712): eglMakeCurrent: 0xb0685360: ver 2 0 (tinfo 0xb06836c0)
06-06 00:59:27.076 I/System.out(23436): URI: //ping
06-06 00:59:27.076 I/System.out(23436): params: {json={}
06-06 00:59:27.076 I/System.out(23436): }
06-06 00:59:27.079 I/System.out(23436): URI: //ping
06-06 00:59:27.079 I/System.out(23436): params: {json={}
06-06 00:59:27.079 I/System.out(23436): }
06-06 00:59:27.081 I/System.out(23436): URI: //ready
06-06 00:59:27.081 I/System.out(23436): params: {json={}
06-06 00:59:27.081 I/System.out(23436): }
06-06 00:59:27.084 I/System.out(23436): URI: //
06-06 00:59:27.084 I/System.out(23436): params: {json={"command":"version","arguments":[]}
06-06 00:59:27.084 I/System.out(23436): }
06-06 00:59:27.084 I/System.out(23436): header: {content-type=application/json;charset=utf-8, date=Sat, 06 Jun 2020 05:59:27 GMT, accept=*/*, host=127.0.0.1:34777, content-length=36, user-agent=HTTPClient/1.0 (2.8.3, ruby 2.5.1 (2018-03-29))}
06-06 00:59:27.084 I/System.out(23436): params: {json={"command":"version","arguments":[]}
06-06 00:59:27.084 I/System.out(23436): }
06-06 00:59:27.084 I/System.out(23436): ProP json = {"command":"version","arguments":[]}
06-06 00:59:27.084 I/System.out(23436): files: {}
06-06 00:59:27.084 I/System.out(23436): command: {"command":"version","arguments":[]}
06-06 00:59:27.086 I/InstrumentationBackend(23436): Got command:'Command:'Line:null,version', arguments:'[]'
06-06 00:59:27.092 I/System.out(23436): result:{"bonusInformation":[],"message":"0.9.8","success":true}
06-06 00:59:27.094 I/System.out(23436): URI: //start-application
06-06 00:59:27.095 I/System.out(23436): params: {json={"intent":null}
06-06 00:59:27.095 I/System.out(23436): }
06-06 00:59:27.105 I/ActivityManager( 1631): START u0 {act=android.intent.action.MAIN cat=[android.intent.category.LAUNCHER] flg=0x10200000 cmp=com.evancharlton.mileage/.Mileage} from uid 10374 on display 0
06-06 00:59:27.111 I/calabash(23436): newActivity1
06-06 00:59:27.121 I/calabash(23436): newActivity1
06-06 00:59:27.122 W/ActivityManager( 1631): Bad activity token: android.os.BinderProxy@1b7be51
06-06 00:59:27.122 W/ActivityManager( 1631): java.lang.ClassCastException: android.os.BinderProxy cannot be cast to com.android.server.am.ActivityRecord$Token
06-06 00:59:27.122 W/ActivityManager( 1631): 	at com.android.server.am.ActivityRecord.forTokenLocked(ActivityRecord.java:586)
06-06 00:59:27.122 W/ActivityManager( 1631): 	at com.android.server.am.ActivityRecord.isInStackLocked(ActivityRecord.java:1327)
06-06 00:59:27.122 W/ActivityManager( 1631): 	at com.android.server.am.ActivityRecord.getStackLocked(ActivityRecord.java:1332)
06-06 00:59:27.122 W/ActivityManager( 1631): 	at com.android.server.am.ActivityManagerService.getActivityDisplayId(ActivityManagerService.java:9806)
06-06 00:59:27.122 W/ActivityManager( 1631): 	at android.app.ActivityManagerNative.onTransact(ActivityManagerNative.java:2566)
06-06 00:59:27.122 W/ActivityManager( 1631): 	at com.android.server.am.ActivityManagerService.onTransact(ActivityManagerService.java:2757)
06-06 00:59:27.122 W/ActivityManager( 1631): 	at android.os.Binder.execTransact(Binder.java:565)
06-06 00:59:27.123 W/ActivityManager( 1631): Bad activity token: android.os.BinderProxy@1b7be51
06-06 00:59:27.123 W/ActivityManager( 1631): java.lang.ClassCastException: android.os.BinderProxy cannot be cast to com.android.server.am.ActivityRecord$Token
06-06 00:59:27.123 W/ActivityManager( 1631): 	at com.android.server.am.ActivityRecord.forTokenLocked(ActivityRecord.java:586)
06-06 00:59:27.123 W/ActivityManager( 1631): 	at com.android.server.am.ActivityRecord.isInStackLocked(ActivityRecord.java:1327)
06-06 00:59:27.123 W/ActivityManager( 1631): 	at com.android.server.am.ActivityManagerService.setTaskDescription(ActivityManagerService.java:9358)
06-06 00:59:27.123 W/ActivityManager( 1631): 	at android.app.ActivityManagerNative.onTransact(ActivityManagerNative.java:2639)
06-06 00:59:27.123 W/ActivityManager( 1631): 	at com.android.server.am.ActivityManagerService.onTransact(ActivityManagerService.java:2757)
06-06 00:59:27.123 W/ActivityManager( 1631): 	at android.os.Binder.execTransact(Binder.java:565)
06-06 00:59:27.123 W/ActivityManager( 1631): Bad activity token: android.os.BinderProxy@1b7be51
06-06 00:59:27.123 W/ActivityManager( 1631): java.lang.ClassCastException: android.os.BinderProxy cannot be cast to com.android.server.am.ActivityRecord$Token
06-06 00:59:27.123 W/ActivityManager( 1631): 	at com.android.server.am.ActivityRecord.forTokenLocked(ActivityRecord.java:586)
06-06 00:59:27.123 W/ActivityManager( 1631): 	at com.android.server.am.ActivityRecord.isInStackLocked(ActivityRecord.java:1327)
06-06 00:59:27.123 W/ActivityManager( 1631): 	at com.android.server.am.ActivityRecord.getStackLocked(ActivityRecord.java:1332)
06-06 00:59:27.123 W/ActivityManager( 1631): 	at com.android.server.am.ActivityManagerService.getActivityStackId(ActivityManagerService.java:9817)
06-06 00:59:27.123 W/ActivityManager( 1631): 	at android.app.ActivityManagerNative.onTransact(ActivityManagerNative.java:2856)
06-06 00:59:27.123 W/ActivityManager( 1631): 	at com.android.server.am.ActivityManagerService.onTransact(ActivityManagerService.java:2757)
06-06 00:59:27.123 W/ActivityManager( 1631): 	at android.os.Binder.execTransact(Binder.java:565)
06-06 00:59:27.134 D/gralloc_ranchu( 1347): gralloc_alloc: Creating ashmem region of size 9023488
06-06 00:59:27.141 W/ActivityManager( 1631): Bad activity token: android.os.BinderProxy@1b7be51
06-06 00:59:27.141 W/ActivityManager( 1631): java.lang.ClassCastException: android.os.BinderProxy cannot be cast to com.android.server.am.ActivityRecord$Token
06-06 00:59:27.141 W/ActivityManager( 1631): 	at com.android.server.am.ActivityRecord.forTokenLocked(ActivityRecord.java:586)
06-06 00:59:27.141 W/ActivityManager( 1631): 	at com.android.server.am.ActivityRecord.isInStackLocked(ActivityRecord.java:1327)
06-06 00:59:27.141 W/ActivityManager( 1631): 	at com.android.server.am.ActivityManagerService.getActivityOptions(ActivityManagerService.java:12559)
06-06 00:59:27.141 W/ActivityManager( 1631): 	at android.app.ActivityManagerNative.onTransact(ActivityManagerNative.java:1933)
06-06 00:59:27.141 W/ActivityManager( 1631): 	at com.android.server.am.ActivityManagerService.onTransact(ActivityManagerService.java:2757)
06-06 00:59:27.141 W/ActivityManager( 1631): 	at android.os.Binder.execTransact(Binder.java:565)
06-06 00:59:27.141 W/ActivityManager( 1631): Bad activity token: android.os.BinderProxy@1b7be51
06-06 00:59:27.141 W/ActivityManager( 1631): java.lang.ClassCastException: android.os.BinderProxy cannot be cast to com.android.server.am.ActivityRecord$Token
06-06 00:59:27.141 W/ActivityManager( 1631): 	at com.android.server.am.ActivityRecord.forTokenLocked(ActivityRecord.java:586)
06-06 00:59:27.141 W/ActivityManager( 1631): 	at com.android.server.am.ActivityRecord.isInStackLocked(ActivityRecord.java:1327)
06-06 00:59:27.141 W/ActivityManager( 1631): 	at com.android.server.am.ActivityManagerService.getActivityOptions(ActivityManagerService.java:12559)
06-06 00:59:27.141 W/ActivityManager( 1631): 	at android.app.ActivityManagerNative.onTransact(ActivityManagerNative.java:1933)
06-06 00:59:27.141 W/ActivityManager( 1631): 	at com.android.server.am.ActivityManagerService.onTransact(ActivityManagerService.java:2757)
06-06 00:59:27.141 W/ActivityManager( 1631): 	at android.os.Binder.execTransact(Binder.java:565)
06-06 00:59:27.173 V/PhoneStatusBar( 1712): setLightsOn(true)
06-06 00:59:27.183 D/EGL_emulation( 1712): eglMakeCurrent: 0xb0685360: ver 2 0 (tinfo 0xb06836c0)
06-06 00:59:27.183 V/PhoneStatusBar( 1712): setLightsOn(true)
06-06 00:59:27.184 V/PhoneStatusBar( 1712): setLightsOn(true)
06-06 00:59:27.186 D/gralloc_ranchu( 1347): gralloc_alloc: Creating ashmem region of size 9023488
06-06 00:59:27.186 V/PhoneStatusBar( 1712): setLightsOn(true)
06-06 00:59:27.188 V/PhoneStatusBar( 1712): setLightsOn(true)
06-06 00:59:27.190 D/        (23436): HostConnection::get() New Host Connection established 0x9401a080, tid 23436
06-06 00:59:27.230 D/EGL_emulation( 1712): eglMakeCurrent: 0xb0685360: ver 2 0 (tinfo 0xb06836c0)
06-06 00:59:27.231 D/EGL_emulation( 2076): eglMakeCurrent: 0xb0685360: ver 2 0 (tinfo 0xb06836b0)
06-06 00:59:27.233 D/EGL_emulation( 1712): eglMakeCurrent: 0xb0685360: ver 2 0 (tinfo 0xb06836c0)
06-06 00:59:27.235 D/EGL_emulation( 1712): eglMakeCurrent: 0xb0685360: ver 2 0 (tinfo 0xb06836c0)
06-06 00:59:27.237 D/EGL_emulation( 1712): eglMakeCurrent: 0xb0685360: ver 2 0 (tinfo 0xb06836c0)
06-06 00:59:27.254 D/EGL_emulation( 1712): eglMakeCurrent: 0xb0685360: ver 2 0 (tinfo 0xb06836c0)
06-06 00:59:27.255 D/EGL_emulation( 1712): eglMakeCurrent: 0xb0685360: ver 2 0 (tinfo 0xb06836c0)
06-06 00:59:27.255 V/PhoneStatusBar( 1712): setLightsOn(true)
06-06 00:59:27.267 D/EGL_emulation( 1712): eglMakeCurrent: 0xb0685360: ver 2 0 (tinfo 0xb06836c0)
06-06 00:59:27.268 D/EGL_emulation( 1712): eglMakeCurrent: 0xb0685360: ver 2 0 (tinfo 0xb06836c0)
06-06 00:59:27.284 D/EGL_emulation( 1712): eglMakeCurrent: 0xb0685360: ver 2 0 (tinfo 0xb06836c0)
06-06 00:59:27.285 D/gralloc_ranchu( 1347): gralloc_alloc: Creating ashmem region of size 9023488
06-06 00:59:27.286 I/WindowManager( 1631): Destroying surface Surface(name=com.evancharlton.mileage/com.evancharlton.mileage.Mileage) called by com.android.server.wm.WindowStateAnimator.destroySurface:2016 com.android.server.wm.WindowStateAnimator.destroySurfaceLocked:882 com.android.server.wm.WindowState.removeLocked:1456 com.android.server.wm.WindowManagerService.removeWindowInnerLocked:2484 com.android.server.wm.AppWindowToken.destroySurfaces:365 com.android.server.wm.WindowStateAnimator.finishExit:565 com.android.server.wm.AppWindowAnimator.stepAnimationLocked:427 com.android.server.wm.WindowAnimator.updateAppWindowsLocked:196 
06-06 00:59:27.292 D/EGL_emulation( 1712): eglMakeCurrent: 0xb0685360: ver 2 0 (tinfo 0xb06836c0)
06-06 00:59:27.301 I/ActivityManager( 1631): Displayed com.evancharlton.mileage/.Mileage: +193ms
06-06 00:59:27.302 D/EGL_emulation( 1712): eglMakeCurrent: 0xb0685360: ver 2 0 (tinfo 0xb06836c0)
06-06 00:59:27.304 D/EGL_emulation( 1712): eglMakeCurrent: 0xb0685360: ver 2 0 (tinfo 0xb06836c0)
06-06 00:59:27.304 V/PhoneStatusBar( 1712): setLightsOn(true)
06-06 00:59:27.317 D/EGL_emulation( 1712): eglMakeCurrent: 0xb0685360: ver 2 0 (tinfo 0xb06836c0)
06-06 00:59:27.319 D/EGL_emulation( 1712): eglMakeCurrent: 0xb0685360: ver 2 0 (tinfo 0xb06836c0)
06-06 00:59:27.333 D/EGL_emulation( 1712): eglMakeCurrent: 0xb0685360: ver 2 0 (tinfo 0xb06836c0)
06-06 00:59:27.335 D/EGL_emulation( 1712): eglMakeCurrent: 0xb0685360: ver 2 0 (tinfo 0xb06836c0)
06-06 00:59:27.336 V/PhoneStatusBar( 1712): setLightsOn(true)
06-06 00:59:27.350 D/EGL_emulation( 1712): eglMakeCurrent: 0xb0685360: ver 2 0 (tinfo 0xb06836c0)
06-06 00:59:27.352 D/EGL_emulation( 1712): eglMakeCurrent: 0xb0685360: ver 2 0 (tinfo 0xb06836c0)
06-06 00:59:27.367 D/EGL_emulation( 1712): eglMakeCurrent: 0xb0685360: ver 2 0 (tinfo 0xb06836c0)
06-06 00:59:27.368 D/EGL_emulation( 1712): eglMakeCurrent: 0xb0685360: ver 2 0 (tinfo 0xb06836c0)
06-06 00:59:27.373 I/System.out(23436): URI: //map
06-06 00:59:27.373 I/System.out(23436): params: {json={"query":"* marked:'Statistics'","operation":{"method_name":"query","arguments":[]}}
06-06 00:59:27.373 I/System.out(23436): }
06-06 00:59:27.383 D/EGL_emulation( 1712): eglMakeCurrent: 0xb0685360: ver 2 0 (tinfo 0xb06836c0)
06-06 00:59:27.384 W/ResourceType(23436): No package identifier when getting name for resource number 0x00000001
06-06 00:59:27.385 D/EGL_emulation( 1712): eglMakeCurrent: 0xb0685360: ver 2 0 (tinfo 0xb06836c0)
06-06 00:59:27.397 I/System.out(23436): URI: //gesture
06-06 00:59:27.397 I/System.out(23436): params: {json={"query_timeout":5.0,"gestures":[{"query_string":"* marked:'Statistics'","touches":[{"x":50,"y":50,"offset_x":0,"offset_y":0,"wait":0.0,"time":0.2,"release":true,"query_string":null}]}]}
06-06 00:59:27.397 I/System.out(23436): }
06-06 00:59:27.400 D/EGL_emulation( 1712): eglMakeCurrent: 0xb0685360: ver 2 0 (tinfo 0xb06836c0)
06-06 00:59:27.401 D/EGL_emulation( 1712): eglMakeCurrent: 0xb0685360: ver 2 0 (tinfo 0xb06836c0)
06-06 00:59:27.402 W/ResourceType(23436): No package identifier when getting name for resource number 0x00000001
06-06 00:59:27.417 D/EGL_emulation( 1712): eglMakeCurrent: 0xb0685360: ver 2 0 (tinfo 0xb06836c0)
06-06 00:59:27.501 I/WindowManager( 1631): Destroying surface Surface(name=Starting com.evancharlton.mileage) called by com.android.server.wm.WindowStateAnimator.destroySurface:2016 com.android.server.wm.WindowStateAnimator.destroySurfaceLocked:882 com.android.server.wm.WindowState.destroyOrSaveSurface:2100 com.android.server.wm.AppWindowToken.destroySurfaces:363 com.android.server.wm.WindowStateAnimator.finishExit:565 com.android.server.wm.WindowStateAnimator.stepAnimationLocked:491 com.android.server.wm.WindowAnimator.updateWindowsLocked:303 com.android.server.wm.WindowAnimator.animateLocked:704 
06-06 00:59:27.506 V/PhoneStatusBar( 1712): setLightsOn(true)
06-06 00:59:27.535 V/PhoneStatusBar( 1712): setLightsOn(true)
06-06 00:59:27.537 I/WindowManager( 1631): Destroying surface Surface(name=Toast) called by com.android.server.wm.WindowStateAnimator.destroySurface:2016 com.android.server.wm.WindowStateAnimator.destroySurfaceLocked:882 com.android.server.wm.WindowState.destroyOrSaveSurface:2100 com.android.server.wm.WindowSurfacePlacer.performSurfacePlacementInner:429 com.android.server.wm.WindowSurfacePlacer.performSurfacePlacementLoop:232 com.android.server.wm.WindowSurfacePlacer.performSurfacePlacement:180 com.android.server.wm.WindowManagerService$H.handleMessage:8086 android.os.Handler.dispatchMessage:102 
06-06 00:59:27.540 V/PhoneStatusBar( 1712): setLightsOn(true)
06-06 00:59:27.585 V/PhoneStatusBar( 1712): setLightsOn(true)
06-06 00:59:27.641 I/calabash(23436): newActivity1
06-06 00:59:27.651 V/PhoneStatusBar( 1712): setLightsOn(true)
06-06 00:59:27.674 I/System.out(23436): URI: //map
06-06 00:59:27.674 I/System.out(23436): params: {json={"query":"android.widget.ScrollView index:0","operation":{"method_name":"query","arguments":[]}}
06-06 00:59:27.674 I/System.out(23436): }
06-06 00:59:27.681 W/ActivityManager( 1631): Bad activity token: android.os.BinderProxy@1aa6443
06-06 00:59:27.681 W/ActivityManager( 1631): java.lang.ClassCastException: android.os.BinderProxy cannot be cast to com.android.server.am.ActivityRecord$Token
06-06 00:59:27.681 W/ActivityManager( 1631): 	at com.android.server.am.ActivityRecord.forTokenLocked(ActivityRecord.java:586)
06-06 00:59:27.681 W/ActivityManager( 1631): 	at com.android.server.am.ActivityRecord.isInStackLocked(ActivityRecord.java:1327)
06-06 00:59:27.681 W/ActivityManager( 1631): 	at com.android.server.am.ActivityRecord.getStackLocked(ActivityRecord.java:1332)
06-06 00:59:27.681 W/ActivityManager( 1631): 	at com.android.server.am.ActivityManagerService.getActivityDisplayId(ActivityManagerService.java:9806)
06-06 00:59:27.681 W/ActivityManager( 1631): 	at android.app.ActivityManagerNative.onTransact(ActivityManagerNative.java:2566)
06-06 00:59:27.681 W/ActivityManager( 1631): 	at com.android.server.am.ActivityManagerService.onTransact(ActivityManagerService.java:2757)
06-06 00:59:27.681 W/ActivityManager( 1631): 	at android.os.Binder.execTransact(Binder.java:565)
06-06 00:59:27.683 W/ActivityManager( 1631): Bad activity token: android.os.BinderProxy@1aa6443
06-06 00:59:27.683 W/ActivityManager( 1631): java.lang.ClassCastException: android.os.BinderProxy cannot be cast to com.android.server.am.ActivityRecord$Token
06-06 00:59:27.683 W/ActivityManager( 1631): 	at com.android.server.am.ActivityRecord.forTokenLocked(ActivityRecord.java:586)
06-06 00:59:27.683 W/ActivityManager( 1631): 	at com.android.server.am.ActivityRecord.isInStackLocked(ActivityRecord.java:1327)
06-06 00:59:27.683 W/ActivityManager( 1631): 	at com.android.server.am.ActivityManagerService.setTaskDescription(ActivityManagerService.java:9358)
06-06 00:59:27.683 W/ActivityManager( 1631): 	at android.app.ActivityManagerNative.onTransact(ActivityManagerNative.java:2639)
06-06 00:59:27.683 W/ActivityManager( 1631): 	at com.android.server.am.ActivityManagerService.onTransact(ActivityManagerService.java:2757)
06-06 00:59:27.683 W/ActivityManager( 1631): 	at android.os.Binder.execTransact(Binder.java:565)
06-06 00:59:27.684 W/ActivityManager( 1631): Bad activity token: android.os.BinderProxy@1aa6443
06-06 00:59:27.684 W/ActivityManager( 1631): java.lang.ClassCastException: android.os.BinderProxy cannot be cast to com.android.server.am.ActivityRecord$Token
06-06 00:59:27.684 W/ActivityManager( 1631): 	at com.android.server.am.ActivityRecord.forTokenLocked(ActivityRecord.java:586)
06-06 00:59:27.684 W/ActivityManager( 1631): 	at com.android.server.am.ActivityRecord.isInStackLocked(ActivityRecord.java:1327)
06-06 00:59:27.684 W/ActivityManager( 1631): 	at com.android.server.am.ActivityRecord.getStackLocked(ActivityRecord.java:1332)
06-06 00:59:27.684 W/ActivityManager( 1631): 	at com.android.server.am.ActivityManagerService.getActivityStackId(ActivityManagerService.java:9817)
06-06 00:59:27.684 W/ActivityManager( 1631): 	at android.app.ActivityManagerNative.onTransact(ActivityManagerNative.java:2856)
06-06 00:59:27.684 W/ActivityManager( 1631): 	at com.android.server.am.ActivityManagerService.onTransact(ActivityManagerService.java:2757)
06-06 00:59:27.684 W/ActivityManager( 1631): 	at android.os.Binder.execTransact(Binder.java:565)
06-06 00:59:27.690 D/VehicleStatisticsActivity(23436): Checking recalculation ...
06-06 00:59:27.691 D/VehicleStatisticsActivity(23436): Recalculation not necessary.
06-06 00:59:27.700 W/ActivityManager( 1631): Bad activity token: android.os.BinderProxy@1aa6443
06-06 00:59:27.700 W/ActivityManager( 1631): java.lang.ClassCastException: android.os.BinderProxy cannot be cast to com.android.server.am.ActivityRecord$Token
06-06 00:59:27.700 W/ActivityManager( 1631): 	at com.android.server.am.ActivityRecord.forTokenLocked(ActivityRecord.java:586)
06-06 00:59:27.700 W/ActivityManager( 1631): 	at com.android.server.am.ActivityRecord.isInStackLocked(ActivityRecord.java:1327)
06-06 00:59:27.700 W/ActivityManager( 1631): 	at com.android.server.am.ActivityManagerService.getActivityOptions(ActivityManagerService.java:12559)
06-06 00:59:27.700 W/ActivityManager( 1631): 	at android.app.ActivityManagerNative.onTransact(ActivityManagerNative.java:1933)
06-06 00:59:27.700 W/ActivityManager( 1631): 	at com.android.server.am.ActivityManagerService.onTransact(ActivityManagerService.java:2757)
06-06 00:59:27.700 W/ActivityManager( 1631): 	at android.os.Binder.execTransact(Binder.java:565)
06-06 00:59:27.700 W/ActivityManager( 1631): Bad activity token: android.os.BinderProxy@1aa6443
06-06 00:59:27.700 W/ActivityManager( 1631): java.lang.ClassCastException: android.os.BinderProxy cannot be cast to com.android.server.am.ActivityRecord$Token
06-06 00:59:27.700 W/ActivityManager( 1631): 	at com.android.server.am.ActivityRecord.forTokenLocked(ActivityRecord.java:586)
06-06 00:59:27.700 W/ActivityManager( 1631): 	at com.android.server.am.ActivityRecord.isInStackLocked(ActivityRecord.java:1327)
06-06 00:59:27.700 W/ActivityManager( 1631): 	at com.android.server.am.ActivityManagerService.getActivityOptions(ActivityManagerService.java:12559)
06-06 00:59:27.700 W/ActivityManager( 1631): 	at android.app.ActivityManagerNative.onTransact(ActivityManagerNative.java:1933)
06-06 00:59:27.700 W/ActivityManager( 1631): 	at com.android.server.am.ActivityManagerService.onTransact(ActivityManagerService.java:2757)
06-06 00:59:27.700 W/ActivityManager( 1631): 	at android.os.Binder.execTransact(Binder.java:565)
06-06 00:59:27.702 D/VehicleStatisticsActivity(23436): Checking recalculation ...
06-06 00:59:27.702 D/VehicleStatisticsActivity(23436): Recalculation not necessary.
06-06 00:59:27.788 I/System.out(23436): URI: //map
06-06 00:59:27.788 I/System.out(23436): params: {json={"query":"android.widget.AbsListView index:0","operation":{"method_name":"query","arguments":[]}}
06-06 00:59:27.788 I/System.out(23436): }
06-06 00:59:27.794 I/art     (23436): Do partial code cache collection, code=30KB, data=29KB
06-06 00:59:27.794 I/art     (23436): After code cache collection, code=29KB, data=28KB
06-06 00:59:27.794 I/art     (23436): Increasing code cache capacity to 128KB
06-06 00:59:27.805 I/System.out(23436): URI: //map
06-06 00:59:27.805 I/System.out(23436): params: {json={"query":"android.widget.AbsListView index:0","operation":{"method_name":"query","arguments":[]}}
06-06 00:59:27.805 I/System.out(23436): }
06-06 00:59:27.820 I/System.out(23436): URI: //map
06-06 00:59:27.820 I/System.out(23436): params: {json={"query":"android.widget.AbsListView index:0","operation":{"method_name":"query","arguments":[]}}
06-06 00:59:27.820 I/System.out(23436): }
06-06 00:59:27.836 I/System.out(23436): URI: //map
06-06 00:59:27.836 I/System.out(23436): params: {json={"query":"android.widget.AbsListView index:0","operation":{"method_name":"query","arguments":["getFirstVisiblePosition"]}}
06-06 00:59:27.836 I/System.out(23436): }
06-06 00:59:27.847 I/System.out(23436): URI: //map
06-06 00:59:27.847 I/System.out(23436): params: {json={"query":"android.widget.AbsListView index:0","operation":{"method_name":"query","arguments":["getLastVisiblePosition"]}}
06-06 00:59:27.847 I/System.out(23436): }
06-06 00:59:27.863 I/System.out(23436): URI: //map
06-06 00:59:27.863 I/System.out(23436): params: {json={"query":"android.widget.AbsListView index:0","operation":{"method_name":"query","arguments":[{"method_name":"setSelection","arguments":[26]}]}}
06-06 00:59:27.863 I/System.out(23436): }
06-06 00:59:27.883 I/System.out(23436): URI: //map
06-06 00:59:27.883 I/System.out(23436): params: {json={"query":"* marked:'Average price'","operation":{"method_name":"query","arguments":[]}}
06-06 00:59:27.883 I/System.out(23436): }
06-06 00:59:27.924 D/gralloc_ranchu( 1347): gralloc_alloc: Creating ashmem region of size 9023488
06-06 00:59:27.950 V/PhoneStatusBar( 1712): setLightsOn(true)
06-06 00:59:27.951 V/PhoneStatusBar( 1712): setLightsOn(true)
06-06 00:59:27.953 W/OpenGLRenderer( 2076): Incorrectly called buildLayer on View: ShortcutAndWidgetContainer, destroying layer...
06-06 00:59:27.967 V/PhoneStatusBar( 1712): setLightsOn(true)
06-06 00:59:27.968 I/WindowManager( 1631): Destroying surface Surface(name=com.android.launcher3/com.android.launcher3.Launcher) called by com.android.server.wm.WindowStateAnimator.destroySurface:2016 com.android.server.wm.WindowStateAnimator.destroySurfaceLocked:882 com.android.server.wm.WindowState.destroyOrSaveSurface:2100 com.android.server.wm.AppWindowToken.destroySurfaces:363 com.android.server.wm.AppWindowToken.notifyAppStopped:389 com.android.server.wm.WindowManagerService.notifyAppStopped:4463 com.android.server.am.ActivityStack.activityStoppedLocked:1252 com.android.server.am.ActivityManagerService.activityStopped:6903 
06-06 00:59:27.976 W/ResourceType(23436): No package identifier when getting name for resource number 0x00000001
06-06 00:59:27.988 I/System.out(23436): URI: //gesture
06-06 00:59:27.988 I/System.out(23436): params: {json={"query_timeout":5.0,"gestures":[{"query_string":"* marked:'Average price'","touches":[{"x":50,"y":50,"offset_x":0,"offset_y":0,"wait":0.0,"time":0.2,"release":true,"query_string":null}]}]}
06-06 00:59:27.988 I/System.out(23436): }
06-06 00:59:27.991 W/ResourceType(23436): No package identifier when getting name for resource number 0x00000001
06-06 00:59:28.220 I/ActivityManager( 1631): START u0 {cmp=com.evancharlton.mileage/.charts.AveragePriceChart (has extras)} from uid 10374 on display 0
06-06 00:59:28.224 V/PhoneStatusBar( 1712): setLightsOn(true)
06-06 00:59:28.228 V/PhoneStatusBar( 1712): setLightsOn(true)
06-06 00:59:28.259 I/System.out(23436): URI: //map
06-06 00:59:28.259 I/System.out(23436): params: {json={"query":"* {text CONTAINS[c] 'Average fuel price'}","operation":{"method_name":"query","arguments":[]}}
06-06 00:59:28.259 I/System.out(23436): }
06-06 00:59:28.295 I/calabash(23436): newActivity1
06-06 00:59:28.299 W/aiCharts(23436): License file is invalid or missing. 
06-06 00:59:28.299 W/aiCharts(23436): Please place proper license.lic to /assets folder.
06-06 00:59:28.313 V/PhoneStatusBar( 1712): setLightsOn(true)
06-06 00:59:28.333 V/PhoneStatusBar( 1712): setLightsOn(true)
06-06 00:59:28.339 I/WindowManager( 1631): Destroying surface Surface(name=Creating chart…) called by com.android.server.wm.WindowStateAnimator.destroySurface:2016 com.android.server.wm.WindowStateAnimator.destroySurfaceLocked:882 com.android.server.wm.WindowState.removeLocked:1456 com.android.server.wm.WindowManagerService.removeWindowInnerLocked:2484 com.android.server.wm.WindowManagerService.removeWindowLocked:2442 com.android.server.wm.WindowManagerService.removeWindowLocked:2311 com.android.server.wm.WindowManagerService.removeWindow:2306 com.android.server.wm.Session.remove:202 
06-06 00:59:28.342 D/gralloc_ranchu( 1347): gralloc_alloc: Creating ashmem region of size 9023488
06-06 00:59:28.350 V/PhoneStatusBar( 1712): setLightsOn(true)
06-06 00:59:28.371 I/ActivityManager( 1631): Displayed com.evancharlton.mileage/.charts.AveragePriceChart: +78ms
06-06 00:59:28.383 V/PhoneStatusBar( 1712): setLightsOn(true)
06-06 00:59:28.416 V/PhoneStatusBar( 1712): setLightsOn(true)
06-06 00:59:28.466 V/PhoneStatusBar( 1712): setLightsOn(true)
06-06 00:59:28.516 W/NotificationService( 1631): Object died trying to hide notification android.app.ITransientNotification$Stub$Proxy@c37908f in package com.evancharlton.mileage
06-06 00:59:28.619 V/PhoneStatusBar( 1712): setLightsOn(true)
06-06 00:59:28.630 I/System.out(23436): URI: //map
06-06 00:59:28.630 I/System.out(23436): params: {json={"query":"* {text CONTAINS[c] 'Average fuel price'}","operation":{"method_name":"query","arguments":[]}}
06-06 00:59:28.630 I/System.out(23436): }
06-06 00:59:28.663 I/System.out(23436): URI: //
06-06 00:59:28.663 I/System.out(23436): params: {json={"command":"press_key","arguments":["KEYCODE_BACK"]}
06-06 00:59:28.663 I/System.out(23436): }
06-06 00:59:28.663 I/System.out(23436): header: {content-type=application/json;charset=utf-8, date=Sat, 06 Jun 2020 05:59:28 GMT, accept=*/*, host=127.0.0.1:34777, content-length=52, user-agent=HTTPClient/1.0 (2.8.3, ruby 2.5.1 (2018-03-29))}
06-06 00:59:28.663 I/System.out(23436): params: {json={"command":"press_key","arguments":["KEYCODE_BACK"]}
06-06 00:59:28.663 I/System.out(23436): }
06-06 00:59:28.663 I/System.out(23436): ProP json = {"command":"press_key","arguments":["KEYCODE_BACK"]}
06-06 00:59:28.663 I/System.out(23436): files: {}
06-06 00:59:28.663 I/System.out(23436): command: {"command":"press_key","arguments":["KEYCODE_BACK"]}
06-06 00:59:28.664 I/InstrumentationBackend(23436): Got command:'Command:'Line:null,press_key', arguments:'[KEYCODE_BACK]'
06-06 00:59:28.668 V/PhoneStatusBar( 1712): setLightsOn(true)
06-06 00:59:28.670 V/PhoneStatusBar( 1712): setLightsOn(true)
06-06 00:59:28.672 I/System.out(23436): result:{"bonusInformation":[],"message":"","success":true}
06-06 00:59:28.673 I/art     (23436): Do partial code cache collection, code=60KB, data=62KB
06-06 00:59:28.673 I/art     (23436): After code cache collection, code=59KB, data=61KB
06-06 00:59:28.673 D/VehicleStatisticsActivity(23436): Checking recalculation ...
06-06 00:59:28.673 I/art     (23436): Increasing code cache capacity to 256KB
06-06 00:59:28.674 D/VehicleStatisticsActivity(23436): Recalculation not necessary.
06-06 00:59:28.675 I/System.out(23436): URI: //map
06-06 00:59:28.675 I/System.out(23436): params: {json={"query":"* {text CONTAINS[c] 'Statistics'}","operation":{"method_name":"query","arguments":[]}}
06-06 00:59:28.675 I/System.out(23436): }
06-06 00:59:28.684 V/PhoneStatusBar( 1712): setLightsOn(true)
06-06 00:59:28.701 V/PhoneStatusBar( 1712): setLightsOn(true)
06-06 00:59:28.715 D/gralloc_ranchu( 1347): gralloc_alloc: Creating ashmem region of size 9023488
06-06 00:59:28.716 V/PhoneStatusBar( 1712): setLightsOn(true)
06-06 00:59:28.749 V/PhoneStatusBar( 1712): setLightsOn(true)
