--------- beginning of system
06-05 18:34:57.760 W/ActivityManager( 1629): Finishing task with all activities already finished
06-05 18:34:57.760 W/ActivityManager( 1629): Duplicate finish request for ActivityRecord{8c752d3 u0 com.evancharlton.mileage/.Mileage t3096 f}
--------- beginning of main
06-05 18:34:57.771 V/PhoneStatusBar( 1711): setLightsOn(true)
06-05 18:34:57.773 D/gralloc_ranchu( 1346): gralloc_alloc: Creating ashmem region of size 3145728
06-05 18:34:57.780 E/EGL_emulation( 1346): tid 1346: eglCreateSyncKHR(1901): error 0x3004 (EGL_BAD_ATTRIBUTE)
06-05 18:34:57.795 W/ActivityManager( 1629): Finishing task with all activities already finished
06-05 18:34:57.795 W/ActivityManager( 1629): Duplicate finish request for ActivityRecord{8c752d3 u0 com.evancharlton.mileage/.Mileage t3096 f}
06-05 18:34:57.795 W/ActivityManager( 1629): Finishing task with all activities already finished
06-05 18:34:57.795 W/ActivityManager( 1629): Duplicate finish request for ActivityRecord{8c752d3 u0 com.evancharlton.mileage/.Mileage t3096 f}
06-05 18:34:57.795 W/ActivityManager( 1629): Finishing task with all activities already finished
06-05 18:34:57.796 W/ActivityManager( 1629): Duplicate finish request for ActivityRecord{8c752d3 u0 com.evancharlton.mileage/.Mileage t3096 f}
06-05 18:34:57.797 W/ActivityManager( 1629): Finishing task with all activities already finished
06-05 18:34:57.797 W/ActivityManager( 1629): Duplicate finish request for ActivityRecord{8c752d3 u0 com.evancharlton.mileage/.Mileage t3096 f}
06-05 18:34:57.797 W/ActivityManager( 1629): Finishing task with all activities already finished
06-05 18:34:57.797 W/ActivityManager( 1629): Duplicate finish request for ActivityRecord{682b3e9 u0 com.evancharlton.mileage/.charts.NorthChart t3096 f}
06-05 18:34:57.797 W/ActivityManager( 1629): Finishing task with all activities already finished
06-05 18:34:57.797 W/ActivityManager( 1629): Duplicate finish request for ActivityRecord{682b3e9 u0 com.evancharlton.mileage/.charts.NorthChart t3096 f}
06-05 18:34:57.797 W/ActivityManager( 1629): Finishing task with all activities already finished
06-05 18:34:57.797 W/ActivityManager( 1629): Duplicate finish request for ActivityRecord{8c752d3 u0 com.evancharlton.mileage/.Mileage t3096 f}
06-05 18:34:57.797 W/ActivityManager( 1629): Finishing task with all activities already finished
06-05 18:34:57.797 W/ActivityManager( 1629): Duplicate finish request for ActivityRecord{8c752d3 u0 com.evancharlton.mileage/.Mileage t3096 f}
06-05 18:34:57.825 D/EGL_emulation( 1711): eglMakeCurrent: 0xa5b6bd80: ver 2 0 (tinfo 0xb1367140)
06-05 18:34:57.837 D/EGL_emulation( 1711): eglMakeCurrent: 0xa5b6bd80: ver 2 0 (tinfo 0xb1367140)
06-05 18:34:57.838 D/EGL_emulation( 2150): eglMakeCurrent: 0xb4f852a0: ver 2 0 (tinfo 0xb4f832e0)
06-05 18:34:57.871 D/EGL_emulation( 1711): eglMakeCurrent: 0xa5b6bd80: ver 2 0 (tinfo 0xb1367140)
06-05 18:34:57.879 D/AndroidRuntime( 6708): >>>>>> START com.android.internal.os.RuntimeInit uid 2000 <<<<<<
06-05 18:34:57.880 D/AndroidRuntime( 6708): CheckJNI is ON
06-05 18:34:57.887 D/EGL_emulation( 1711): eglMakeCurrent: 0xa5b6bd80: ver 2 0 (tinfo 0xb1367140)
06-05 18:34:57.889 D/EGL_emulation( 1711): eglMakeCurrent: 0xa5b6bd80: ver 2 0 (tinfo 0xb1367140)
06-05 18:34:57.893 W/art     ( 6708): Unexpected CPU variant for X86 using defaults: x86
06-05 18:34:57.895 D/ICU     ( 6708): No timezone override file found: /data/misc/zoneinfo/current/icu/icu_tzdata.dat
06-05 18:34:57.904 D/EGL_emulation( 1711): eglMakeCurrent: 0xa5b6bd80: ver 2 0 (tinfo 0xb1367140)
06-05 18:34:57.905 E/memtrack( 6708): Couldn't load memtrack module (No such file or directory)
06-05 18:34:57.905 E/android.os.Debug( 6708): failed to load memtrack module: -2
06-05 18:34:57.906 I/Radio-JNI( 6708): register_android_hardware_Radio DONE
06-05 18:34:57.906 D/EGL_emulation( 1711): eglMakeCurrent: 0xa5b6bd80: ver 2 0 (tinfo 0xb1367140)
06-05 18:34:57.911 D/AndroidRuntime( 6708): Calling main entry com.android.commands.am.Am
06-05 18:34:57.912 I/ActivityManager( 1629): Force stopping com.evancharlton.mileage appid=10160 user=0: start instr
06-05 18:34:57.913 I/ActivityManager( 1629): Killing 6656:com.evancharlton.mileage/u0a160 (adj 0): stop com.evancharlton.mileage
06-05 18:34:57.913 D/ActivityManager( 1629): cleanUpApplicationRecord -- 6656
06-05 18:34:57.913 I/WindowManager( 1629): Destroying surface Surface(name=com.evancharlton.mileage/com.evancharlton.mileage.charts.NorthChart) called by com.android.server.wm.WindowStateAnimator.destroySurface:2016 com.android.server.wm.WindowStateAnimator.destroySurfaceLocked:882 com.android.server.wm.WindowState.removeLocked:1456 com.android.server.wm.WindowManagerService.removeWindowInnerLocked:2484 com.android.server.wm.WindowManagerService.removeWindowLocked:2442 com.android.server.wm.WindowManagerService.removeWindowLocked:2311 com.android.server.wm.AppWindowToken.removeAllWindows:530 com.android.server.wm.AppWindowToken.removeAppFromTaskLocked:326 
06-05 18:34:57.915 W/ActivityManager( 1629): Crash of app com.evancharlton.mileage running instrumentation ComponentInfo{com.evancharlton.mileage.test/sh.calaba.instrumentationbackend.CalabashInstrumentationTestRunner}
06-05 18:34:57.915 I/ActivityManager( 1629): Force stopping com.evancharlton.mileage appid=10160 user=0: finished inst
06-05 18:34:57.918 I/art     ( 6718): Not late-enabling -Xcheck:jni (already on)
06-05 18:34:57.918 W/art     ( 6718): Unexpected CPU variant for X86 using defaults: x86
06-05 18:34:57.921 D/EGL_emulation( 1711): eglMakeCurrent: 0xa5b6bd80: ver 2 0 (tinfo 0xb1367140)
06-05 18:34:57.922 D/EGL_emulation( 1711): eglMakeCurrent: 0xa5b6bd80: ver 2 0 (tinfo 0xb1367140)
06-05 18:34:57.926 I/ActivityManager( 1629): Start proc 6718:com.evancharlton.mileage/u0a160 for added application com.evancharlton.mileage
06-05 18:34:57.926 D/AndroidRuntime( 6708): Shutting down VM
06-05 18:34:57.931 W/System  ( 6718): ClassLoader referenced unknown path: /data/app/com.evancharlton.mileage.test-1/lib/x86
06-05 18:34:57.931 W/System  ( 6718): ClassLoader referenced unknown path: /data/app/com.evancharlton.mileage-1/lib/x86
06-05 18:34:57.933 W/System  ( 6718): ClassLoader referenced unknown path: 
06-05 18:34:57.937 I/System.out( 6718): Main activity name automatically set to: com.evancharlton.mileage.Mileage
06-05 18:34:57.937 D/EGL_emulation( 1711): eglMakeCurrent: 0xa5b6bd80: ver 2 0 (tinfo 0xb1367140)
06-05 18:34:57.937 I/System.out( 6718): Calabash did not load Mono. This is only a problem if you are trying to test a Mono application
06-05 18:34:57.938 I/calabash( 6718): Test server port: 7102
06-05 18:34:57.938 I/InstrumentationBackend( 6718): Added:'GetPreferences', with key:'get_preferences'
06-05 18:34:57.939 D/EGL_emulation( 1711): eglMakeCurrent: 0xa5b6bd80: ver 2 0 (tinfo 0xb1367140)
06-05 18:34:57.942 I/InstrumentationBackend( 6718): Added:'SetPreferences', with key:'set_preferences'
06-05 18:34:57.942 I/InstrumentationBackend( 6718): Added:'ClearPreferences', with key:'clear_preferences'
06-05 18:34:57.942 I/InstrumentationBackend( 6718): Added:'PressElement', with key:'press_l10n_element'
06-05 18:34:57.942 I/InstrumentationBackend( 6718): Added:'WaitForElement', with key:'wait_for_l10n_element'
06-05 18:34:57.942 I/InstrumentationBackend( 6718): Added:'NullAction', with key:'nullAction'
06-05 18:34:57.942 I/InstrumentationBackend( 6718): Added:'PressKey', with key:'press_key'
06-05 18:34:57.942 I/InstrumentationBackend( 6718): Added:'SetActivityOrientation', with key:'set_activity_orientation'
06-05 18:34:57.942 I/InstrumentationBackend( 6718): Added:'GetActivityOrientation', with key:'get_activity_orientation'
06-05 18:34:57.942 I/InstrumentationBackend( 6718): Added:'FakeGPSLocation', with key:'set_gps_coordinates'
06-05 18:34:57.942 I/InstrumentationBackend( 6718): Added:'SetPropertyByCssSelector', with key:'set_property_by_css_selector'
06-05 18:34:57.942 I/InstrumentationBackend( 6718): Added:'GetUrl', with key:'get_url'
06-05 18:34:57.943 I/InstrumentationBackend( 6718): Added:'ScrollTo', with key:'scroll_to'
06-05 18:34:57.943 I/InstrumentationBackend( 6718): Added:'GetLoadProgress', with key:'get_load_progress'
06-05 18:34:57.943 I/InstrumentationBackend( 6718): Added:'DumpHtml', with key:'dump_html'
06-05 18:34:57.943 I/InstrumentationBackend( 6718): Added:'DumpBodyHtml', with key:'dump_body_html'
06-05 18:34:57.943 I/InstrumentationBackend( 6718): Added:'EnterTextByCssSelector', with key:'enter_text_by_selector'
06-05 18:34:57.943 I/InstrumentationBackend( 6718): Added:'AndroidSDKVersion', with key:'android_sdk_version'
06-05 18:34:57.943 I/InstrumentationBackend( 6718): Added:'Version', with key:'version'
06-05 18:34:57.943 I/InstrumentationBackend( 6718): Added:'Drag', with key:'drag'
06-05 18:34:57.943 I/InstrumentationBackend( 6718): Added:'TouchCoordinates', with key:'touch_coordinate'
06-05 18:34:57.943 I/InstrumentationBackend( 6718): Added:'LongPressCoordinate', with key:'long_press_coordinate'
06-05 18:34:57.943 I/InstrumentationBackend( 6718): Added:'DragCoordinates', with key:'drag_coordinates'
06-05 18:34:57.943 I/InstrumentationBackend( 6718): Added:'ResumeApplication', with key:'resume_application'
06-05 18:34:57.943 I/InstrumentationBackend( 6718): Added:'Swipe', with key:'swipe'
06-05 18:34:57.943 I/InstrumentationBackend( 6718): Added:'DoubleTapCoordinate', with key:'double_tap_coordinate'
06-05 18:34:57.943 I/InstrumentationBackend( 6718): Added:'ClickOnScreen', with key:'click_on_screen'
06-05 18:34:57.944 I/InstrumentationBackend( 6718): Added:'GetActivityName', with key:'get_activity_name'
06-05 18:34:57.944 I/InstrumentationBackend( 6718): Added:'ScrollToView', with key:'scroll_to_view'
06-05 18:34:57.944 I/InstrumentationBackend( 6718): Added:'ViewConfiguration', with key:'view_configuration'
06-05 18:34:57.944 I/InstrumentationBackend( 6718): Added:'IsCurrentActivityFocused', with key:'is_current_activity_focused'
06-05 18:34:57.944 I/InstrumentationBackend( 6718): Added:'SendTcp', with key:'send_tcp'
06-05 18:34:57.944 I/InstrumentationBackend( 6718): Added:'DpToDevicePixel', with key:'dp_to_device_pixel'
06-05 18:34:57.944 I/InstrumentationBackend( 6718): Added:'KeyboardEnterText', with key:'keyboard_enter_text'
06-05 18:34:57.944 I/InstrumentationBackend( 6718): Added:'DeleteSurroundingText', with key:'delete_surrounding_text'
06-05 18:34:57.944 I/InstrumentationBackend( 6718): Added:'SetComposingRegion', with key:'set_composing_region'
06-05 18:34:57.944 I/InstrumentationBackend( 6718): Added:'SetSelection', with key:'set_selection'
06-05 18:34:57.944 I/InstrumentationBackend( 6718): Added:'KeyboardKeyEvent', with key:'keyboard_key_event'
06-05 18:34:57.944 I/InstrumentationBackend( 6718): Added:'PressUserActionButton', with key:'press_user_action_button'
06-05 18:34:57.944 I/InstrumentationBackend( 6718): Added:'HideSoftKeyboard', with key:'hide_soft_keyboard'
06-05 18:34:57.944 I/InstrumentationBackend( 6718): Added:'ListActions', with key:'list_actions'
06-05 18:34:57.944 I/calabash( 6718): Instantiating http server at 7102
06-05 18:34:57.945 I/System.out( 6718): HTTP Daemon listening on: 7102
06-05 18:34:57.951 W/InputDispatcher( 1629): channel '6fef3be com.evancharlton.mileage/com.evancharlton.mileage.Mileage (server)' ~ Consumer closed input channel or an error occurred.  events=0x9
06-05 18:34:57.951 E/InputDispatcher( 1629): channel '6fef3be com.evancharlton.mileage/com.evancharlton.mileage.Mileage (server)' ~ Channel is unrecoverably broken and will be disposed!
06-05 18:34:57.951 I/WindowManager( 1629): WIN DEATH: Window{6fef3be u0 com.evancharlton.mileage/com.evancharlton.mileage.Mileage EXITING}
06-05 18:34:57.951 W/InputDispatcher( 1629): Attempted to unregister already unregistered input channel '6fef3be com.evancharlton.mileage/com.evancharlton.mileage.Mileage (server)'
06-05 18:34:57.961 D/EGL_emulation( 1711): eglMakeCurrent: 0xa5b6bd80: ver 2 0 (tinfo 0xb1367140)
06-05 18:34:57.965 D/EGL_emulation( 1711): eglMakeCurrent: 0xa5b6bd80: ver 2 0 (tinfo 0xb1367140)
06-05 18:34:57.970 D/EGL_emulation( 1711): eglMakeCurrent: 0xa5b6bd80: ver 2 0 (tinfo 0xb1367140)
06-05 18:34:57.973 D/EGL_emulation( 1711): eglMakeCurrent: 0xa5b6bd80: ver 2 0 (tinfo 0xb1367140)
06-05 18:34:57.989 D/EGL_emulation( 1711): eglMakeCurrent: 0xa5b6bd80: ver 2 0 (tinfo 0xb1367140)
06-05 18:34:57.996 D/EGL_emulation( 1711): eglMakeCurrent: 0xa5b6bd80: ver 2 0 (tinfo 0xb1367140)
06-05 18:34:58.006 D/EGL_emulation( 1711): eglMakeCurrent: 0xa5b6bd80: ver 2 0 (tinfo 0xb1367140)
06-05 18:34:58.014 D/EGL_emulation( 1711): eglMakeCurrent: 0xa5b6bd80: ver 2 0 (tinfo 0xb1367140)
06-05 18:34:58.023 D/EGL_emulation( 1711): eglMakeCurrent: 0xa5b6bd80: ver 2 0 (tinfo 0xb1367140)
06-05 18:34:58.030 D/EGL_emulation( 1711): eglMakeCurrent: 0xa5b6bd80: ver 2 0 (tinfo 0xb1367140)
06-05 18:34:58.042 I/System.out( 6718): URI: //ping
06-05 18:34:58.042 I/System.out( 6718): params: {json={}
06-05 18:34:58.042 I/System.out( 6718): }
06-05 18:34:58.043 D/EGL_emulation( 1711): eglMakeCurrent: 0xa5b6bd80: ver 2 0 (tinfo 0xb1367140)
06-05 18:34:58.055 I/System.out( 6718): URI: //ping
06-05 18:34:58.055 I/System.out( 6718): params: {json={}
06-05 18:34:58.055 I/System.out( 6718): }
06-05 18:34:58.056 D/EGL_emulation( 1711): eglMakeCurrent: 0xa5b6bd80: ver 2 0 (tinfo 0xb1367140)
06-05 18:34:58.063 D/EGL_emulation( 1711): eglMakeCurrent: 0xa5b6bd80: ver 2 0 (tinfo 0xb1367140)
06-05 18:34:58.066 I/System.out( 6718): URI: //ready
06-05 18:34:58.067 I/System.out( 6718): params: {json={}
06-05 18:34:58.067 I/System.out( 6718): }
06-05 18:34:58.078 I/System.out( 6718): URI: //
06-05 18:34:58.078 I/System.out( 6718): params: {json={"command":"version","arguments":[]}
06-05 18:34:58.078 I/System.out( 6718): }
06-05 18:34:58.078 I/System.out( 6718): header: {content-type=application/json;charset=utf-8, date=Fri, 05 Jun 2020 23:34:58 GMT, accept=*/*, host=127.0.0.1:34783, content-length=36, user-agent=HTTPClient/1.0 (2.8.3, ruby 2.5.1 (2018-03-29))}
06-05 18:34:58.079 I/System.out( 6718): params: {json={"command":"version","arguments":[]}
06-05 18:34:58.079 I/System.out( 6718): }
06-05 18:34:58.079 I/System.out( 6718): ProP json = {"command":"version","arguments":[]}
06-05 18:34:58.079 I/System.out( 6718): files: {}
06-05 18:34:58.079 I/System.out( 6718): command: {"command":"version","arguments":[]}
06-05 18:34:58.097 I/InstrumentationBackend( 6718): Got command:'Command:'Line:null,version', arguments:'[]'
06-05 18:34:58.114 I/System.out( 6718): result:{"bonusInformation":[],"message":"0.9.8","success":true}
06-05 18:34:58.117 I/System.out( 6718): URI: //start-application
06-05 18:34:58.117 I/System.out( 6718): params: {json={"intent":null}
06-05 18:34:58.117 I/System.out( 6718): }
06-05 18:34:58.132 I/ActivityManager( 1629): START u0 {act=android.intent.action.MAIN cat=[android.intent.category.LAUNCHER] flg=0x10200000 cmp=com.evancharlton.mileage/.Mileage} from uid 10160 on display 0
06-05 18:34:58.140 I/calabash( 6718): newActivity1
06-05 18:34:58.150 I/calabash( 6718): newActivity1
06-05 18:34:58.151 W/ActivityManager( 1629): Bad activity token: android.os.BinderProxy@261b90b
06-05 18:34:58.151 W/ActivityManager( 1629): java.lang.ClassCastException: android.os.BinderProxy cannot be cast to com.android.server.am.ActivityRecord$Token
06-05 18:34:58.151 W/ActivityManager( 1629): 	at com.android.server.am.ActivityRecord.forTokenLocked(ActivityRecord.java:586)
06-05 18:34:58.151 W/ActivityManager( 1629): 	at com.android.server.am.ActivityRecord.isInStackLocked(ActivityRecord.java:1327)
06-05 18:34:58.151 W/ActivityManager( 1629): 	at com.android.server.am.ActivityRecord.getStackLocked(ActivityRecord.java:1332)
06-05 18:34:58.151 W/ActivityManager( 1629): 	at com.android.server.am.ActivityManagerService.getActivityDisplayId(ActivityManagerService.java:9806)
06-05 18:34:58.151 W/ActivityManager( 1629): 	at android.app.ActivityManagerNative.onTransact(ActivityManagerNative.java:2566)
06-05 18:34:58.151 W/ActivityManager( 1629): 	at com.android.server.am.ActivityManagerService.onTransact(ActivityManagerService.java:2757)
06-05 18:34:58.151 W/ActivityManager( 1629): 	at android.os.Binder.execTransact(Binder.java:565)
06-05 18:34:58.152 W/ActivityManager( 1629): Bad activity token: android.os.BinderProxy@261b90b
06-05 18:34:58.152 W/ActivityManager( 1629): java.lang.ClassCastException: android.os.BinderProxy cannot be cast to com.android.server.am.ActivityRecord$Token
06-05 18:34:58.152 W/ActivityManager( 1629): 	at com.android.server.am.ActivityRecord.forTokenLocked(ActivityRecord.java:586)
06-05 18:34:58.152 W/ActivityManager( 1629): 	at com.android.server.am.ActivityRecord.isInStackLocked(ActivityRecord.java:1327)
06-05 18:34:58.152 W/ActivityManager( 1629): 	at com.android.server.am.ActivityManagerService.setTaskDescription(ActivityManagerService.java:9358)
06-05 18:34:58.152 W/ActivityManager( 1629): 	at android.app.ActivityManagerNative.onTransact(ActivityManagerNative.java:2639)
06-05 18:34:58.152 W/ActivityManager( 1629): 	at com.android.server.am.ActivityManagerService.onTransact(ActivityManagerService.java:2757)
06-05 18:34:58.152 W/ActivityManager( 1629): 	at android.os.Binder.execTransact(Binder.java:565)
06-05 18:34:58.153 W/ActivityManager( 1629): Bad activity token: android.os.BinderProxy@261b90b
06-05 18:34:58.153 W/ActivityManager( 1629): java.lang.ClassCastException: android.os.BinderProxy cannot be cast to com.android.server.am.ActivityRecord$Token
06-05 18:34:58.153 W/ActivityManager( 1629): 	at com.android.server.am.ActivityRecord.forTokenLocked(ActivityRecord.java:586)
06-05 18:34:58.153 W/ActivityManager( 1629): 	at com.android.server.am.ActivityRecord.isInStackLocked(ActivityRecord.java:1327)
06-05 18:34:58.153 W/ActivityManager( 1629): 	at com.android.server.am.ActivityRecord.getStackLocked(ActivityRecord.java:1332)
06-05 18:34:58.153 W/ActivityManager( 1629): 	at com.android.server.am.ActivityManagerService.getActivityStackId(ActivityManagerService.java:9817)
06-05 18:34:58.153 W/ActivityManager( 1629): 	at android.app.ActivityManagerNative.onTransact(ActivityManagerNative.java:2856)
06-05 18:34:58.153 W/ActivityManager( 1629): 	at com.android.server.am.ActivityManagerService.onTransact(ActivityManagerService.java:2757)
06-05 18:34:58.153 W/ActivityManager( 1629): 	at android.os.Binder.execTransact(Binder.java:565)
06-05 18:34:58.154 D/gralloc_ranchu( 1346): gralloc_alloc: Creating ashmem region of size 9023488
06-05 18:34:58.178 W/ActivityManager( 1629): Bad activity token: android.os.BinderProxy@261b90b
06-05 18:34:58.178 W/ActivityManager( 1629): java.lang.ClassCastException: android.os.BinderProxy cannot be cast to com.android.server.am.ActivityRecord$Token
06-05 18:34:58.178 W/ActivityManager( 1629): 	at com.android.server.am.ActivityRecord.forTokenLocked(ActivityRecord.java:586)
06-05 18:34:58.178 W/ActivityManager( 1629): 	at com.android.server.am.ActivityRecord.isInStackLocked(ActivityRecord.java:1327)
06-05 18:34:58.178 W/ActivityManager( 1629): 	at com.android.server.am.ActivityManagerService.getActivityOptions(ActivityManagerService.java:12559)
06-05 18:34:58.178 W/ActivityManager( 1629): 	at android.app.ActivityManagerNative.onTransact(ActivityManagerNative.java:1933)
06-05 18:34:58.178 W/ActivityManager( 1629): 	at com.android.server.am.ActivityManagerService.onTransact(ActivityManagerService.java:2757)
06-05 18:34:58.178 W/ActivityManager( 1629): 	at android.os.Binder.execTransact(Binder.java:565)
06-05 18:34:58.179 W/ActivityManager( 1629): Bad activity token: android.os.BinderProxy@261b90b
06-05 18:34:58.179 W/ActivityManager( 1629): java.lang.ClassCastException: android.os.BinderProxy cannot be cast to com.android.server.am.ActivityRecord$Token
06-05 18:34:58.179 W/ActivityManager( 1629): 	at com.android.server.am.ActivityRecord.forTokenLocked(ActivityRecord.java:586)
06-05 18:34:58.179 W/ActivityManager( 1629): 	at com.android.server.am.ActivityRecord.isInStackLocked(ActivityRecord.java:1327)
06-05 18:34:58.179 W/ActivityManager( 1629): 	at com.android.server.am.ActivityManagerService.getActivityOptions(ActivityManagerService.java:12559)
06-05 18:34:58.179 W/ActivityManager( 1629): 	at android.app.ActivityManagerNative.onTransact(ActivityManagerNative.java:1933)
06-05 18:34:58.179 W/ActivityManager( 1629): 	at com.android.server.am.ActivityManagerService.onTransact(ActivityManagerService.java:2757)
06-05 18:34:58.179 W/ActivityManager( 1629): 	at android.os.Binder.execTransact(Binder.java:565)
06-05 18:34:58.187 V/PhoneStatusBar( 1711): setLightsOn(true)
06-05 18:34:58.187 D/EGL_emulation( 2150): eglMakeCurrent: 0xb4f852a0: ver 2 0 (tinfo 0xb4f832e0)
06-05 18:34:58.205 D/EGL_emulation( 1711): eglMakeCurrent: 0xa5b6bd80: ver 2 0 (tinfo 0xb1367140)
06-05 18:34:58.205 V/PhoneStatusBar( 1711): setLightsOn(true)
06-05 18:34:58.220 D/gralloc_ranchu( 1346): gralloc_alloc: Creating ashmem region of size 9023488
06-05 18:34:58.224 D/EGL_emulation( 1711): eglMakeCurrent: 0xa5b6bd80: ver 2 0 (tinfo 0xb1367140)
06-05 18:34:58.225 D/        ( 6718): HostConnection::get() New Host Connection established 0x98c2e4c0, tid 6718
06-05 18:34:58.272 D/EGL_emulation( 1711): eglMakeCurrent: 0xa5b6bd80: ver 2 0 (tinfo 0xb1367140)
06-05 18:34:58.272 V/PhoneStatusBar( 1711): setLightsOn(true)
06-05 18:34:58.275 I/WindowManager( 1629): Destroying surface Surface(name=com.evancharlton.mileage/com.evancharlton.mileage.Mileage) called by com.android.server.wm.WindowStateAnimator.destroySurface:2016 com.android.server.wm.WindowStateAnimator.destroySurfaceLocked:882 com.android.server.wm.WindowState.removeLocked:1456 com.android.server.wm.WindowManagerService.removeWindowInnerLocked:2484 com.android.server.wm.AppWindowToken.destroySurfaces:365 com.android.server.wm.WindowStateAnimator.finishExit:565 com.android.server.wm.AppWindowAnimator.stepAnimationLocked:427 com.android.server.wm.WindowAnimator.updateAppWindowsLocked:196 
06-05 18:34:58.277 D/EGL_emulation( 1711): eglMakeCurrent: 0xa5b6bd80: ver 2 0 (tinfo 0xb1367140)
06-05 18:34:58.279 D/EGL_emulation( 1711): eglMakeCurrent: 0xa5b6bd80: ver 2 0 (tinfo 0xb1367140)
06-05 18:34:58.289 D/EGL_emulation( 1711): eglMakeCurrent: 0xa5b6bd80: ver 2 0 (tinfo 0xb1367140)
06-05 18:34:58.291 D/EGL_emulation( 1711): eglMakeCurrent: 0xa5b6bd80: ver 2 0 (tinfo 0xb1367140)
06-05 18:34:58.291 V/PhoneStatusBar( 1711): setLightsOn(true)
06-05 18:34:58.304 D/EGL_emulation( 1711): eglMakeCurrent: 0xa5b6bd80: ver 2 0 (tinfo 0xb1367140)
06-05 18:34:58.306 D/EGL_emulation( 1711): eglMakeCurrent: 0xa5b6bd80: ver 2 0 (tinfo 0xb1367140)
06-05 18:34:58.321 D/EGL_emulation( 1711): eglMakeCurrent: 0xa5b6bd80: ver 2 0 (tinfo 0xb1367140)
06-05 18:34:58.322 D/gralloc_ranchu( 1346): gralloc_alloc: Creating ashmem region of size 9023488
06-05 18:34:58.338 I/ActivityManager( 1629): Displayed com.evancharlton.mileage/.Mileage: +201ms
06-05 18:34:58.341 D/EGL_emulation( 1711): eglMakeCurrent: 0xa5b6bd80: ver 2 0 (tinfo 0xb1367140)
06-05 18:34:58.342 D/EGL_emulation( 1711): eglMakeCurrent: 0xa5b6bd80: ver 2 0 (tinfo 0xb1367140)
06-05 18:34:58.352 D/EGL_emulation( 1711): eglMakeCurrent: 0xa5b6bd80: ver 2 0 (tinfo 0xb1367140)
06-05 18:34:58.352 V/PhoneStatusBar( 1711): setLightsOn(true)
06-05 18:34:58.354 D/EGL_emulation( 1711): eglMakeCurrent: 0xa5b6bd80: ver 2 0 (tinfo 0xb1367140)
06-05 18:34:58.356 D/EGL_emulation( 1711): eglMakeCurrent: 0xa5b6bd80: ver 2 0 (tinfo 0xb1367140)
06-05 18:34:58.371 D/EGL_emulation( 1711): eglMakeCurrent: 0xa5b6bd80: ver 2 0 (tinfo 0xb1367140)
06-05 18:34:58.373 D/EGL_emulation( 1711): eglMakeCurrent: 0xa5b6bd80: ver 2 0 (tinfo 0xb1367140)
06-05 18:34:58.373 V/PhoneStatusBar( 1711): setLightsOn(true)
06-05 18:34:58.378 I/System.out( 6718): URI: //map
06-05 18:34:58.378 I/System.out( 6718): params: {json={"query":"* marked:'Statistics'","operation":{"method_name":"query","arguments":[]}}
06-05 18:34:58.378 I/System.out( 6718): }
06-05 18:34:58.388 D/EGL_emulation( 1711): eglMakeCurrent: 0xa5b6bd80: ver 2 0 (tinfo 0xb1367140)
06-05 18:34:58.390 D/EGL_emulation( 1711): eglMakeCurrent: 0xa5b6bd80: ver 2 0 (tinfo 0xb1367140)
06-05 18:34:58.393 W/ResourceType( 6718): No package identifier when getting name for resource number 0x00000001
06-05 18:34:58.405 D/EGL_emulation( 1711): eglMakeCurrent: 0xa5b6bd80: ver 2 0 (tinfo 0xb1367140)
06-05 18:34:58.409 I/System.out( 6718): URI: //gesture
06-05 18:34:58.409 I/System.out( 6718): params: {json={"query_timeout":5.0,"gestures":[{"query_string":"* marked:'Statistics'","touches":[{"x":50,"y":50,"offset_x":0,"offset_y":0,"wait":0.0,"time":0.2,"release":true,"query_string":null}]}]}
06-05 18:34:58.409 I/System.out( 6718): }
06-05 18:34:58.414 W/ResourceType( 6718): No package identifier when getting name for resource number 0x00000001
06-05 18:34:58.538 I/WindowManager( 1629): Destroying surface Surface(name=Starting com.evancharlton.mileage) called by com.android.server.wm.WindowStateAnimator.destroySurface:2016 com.android.server.wm.WindowStateAnimator.destroySurfaceLocked:882 com.android.server.wm.WindowState.destroyOrSaveSurface:2100 com.android.server.wm.AppWindowToken.destroySurfaces:363 com.android.server.wm.WindowStateAnimator.finishExit:565 com.android.server.wm.WindowStateAnimator.stepAnimationLocked:491 com.android.server.wm.WindowAnimator.updateWindowsLocked:303 com.android.server.wm.WindowAnimator.animateLocked:704 
06-05 18:34:58.540 V/PhoneStatusBar( 1711): setLightsOn(true)
06-05 18:34:58.571 V/PhoneStatusBar( 1711): setLightsOn(true)
06-05 18:34:58.638 V/PhoneStatusBar( 1711): setLightsOn(true)
06-05 18:34:58.641 I/calabash( 6718): newActivity1
06-05 18:34:58.658 I/System.out( 6718): URI: //map
06-05 18:34:58.658 I/System.out( 6718): params: {json={"query":"android.widget.ScrollView index:0","operation":{"method_name":"query","arguments":[]}}
06-05 18:34:58.658 I/System.out( 6718): }
06-05 18:34:58.662 W/ActivityManager( 1629): Bad activity token: android.os.BinderProxy@cda0571
06-05 18:34:58.662 W/ActivityManager( 1629): java.lang.ClassCastException: android.os.BinderProxy cannot be cast to com.android.server.am.ActivityRecord$Token
06-05 18:34:58.662 W/ActivityManager( 1629): 	at com.android.server.am.ActivityRecord.forTokenLocked(ActivityRecord.java:586)
06-05 18:34:58.662 W/ActivityManager( 1629): 	at com.android.server.am.ActivityRecord.isInStackLocked(ActivityRecord.java:1327)
06-05 18:34:58.662 W/ActivityManager( 1629): 	at com.android.server.am.ActivityRecord.getStackLocked(ActivityRecord.java:1332)
06-05 18:34:58.662 W/ActivityManager( 1629): 	at com.android.server.am.ActivityManagerService.getActivityDisplayId(ActivityManagerService.java:9806)
06-05 18:34:58.662 W/ActivityManager( 1629): 	at android.app.ActivityManagerNative.onTransact(ActivityManagerNative.java:2566)
06-05 18:34:58.662 W/ActivityManager( 1629): 	at com.android.server.am.ActivityManagerService.onTransact(ActivityManagerService.java:2757)
06-05 18:34:58.662 W/ActivityManager( 1629): 	at android.os.Binder.execTransact(Binder.java:565)
06-05 18:34:58.663 W/ActivityManager( 1629): Bad activity token: android.os.BinderProxy@cda0571
06-05 18:34:58.663 W/ActivityManager( 1629): java.lang.ClassCastException: android.os.BinderProxy cannot be cast to com.android.server.am.ActivityRecord$Token
06-05 18:34:58.663 W/ActivityManager( 1629): 	at com.android.server.am.ActivityRecord.forTokenLocked(ActivityRecord.java:586)
06-05 18:34:58.663 W/ActivityManager( 1629): 	at com.android.server.am.ActivityRecord.isInStackLocked(ActivityRecord.java:1327)
06-05 18:34:58.663 W/ActivityManager( 1629): 	at com.android.server.am.ActivityManagerService.setTaskDescription(ActivityManagerService.java:9358)
06-05 18:34:58.663 W/ActivityManager( 1629): 	at android.app.ActivityManagerNative.onTransact(ActivityManagerNative.java:2639)
06-05 18:34:58.663 W/ActivityManager( 1629): 	at com.android.server.am.ActivityManagerService.onTransact(ActivityManagerService.java:2757)
06-05 18:34:58.663 W/ActivityManager( 1629): 	at android.os.Binder.execTransact(Binder.java:565)
06-05 18:34:58.664 W/ActivityManager( 1629): Bad activity token: android.os.BinderProxy@cda0571
06-05 18:34:58.664 W/ActivityManager( 1629): java.lang.ClassCastException: android.os.BinderProxy cannot be cast to com.android.server.am.ActivityRecord$Token
06-05 18:34:58.664 W/ActivityManager( 1629): 	at com.android.server.am.ActivityRecord.forTokenLocked(ActivityRecord.java:586)
06-05 18:34:58.664 W/ActivityManager( 1629): 	at com.android.server.am.ActivityRecord.isInStackLocked(ActivityRecord.java:1327)
06-05 18:34:58.664 W/ActivityManager( 1629): 	at com.android.server.am.ActivityRecord.getStackLocked(ActivityRecord.java:1332)
06-05 18:34:58.664 W/ActivityManager( 1629): 	at com.android.server.am.ActivityManagerService.getActivityStackId(ActivityManagerService.java:9817)
06-05 18:34:58.664 W/ActivityManager( 1629): 	at android.app.ActivityManagerNative.onTransact(ActivityManagerNative.java:2856)
06-05 18:34:58.664 W/ActivityManager( 1629): 	at com.android.server.am.ActivityManagerService.onTransact(ActivityManagerService.java:2757)
06-05 18:34:58.664 W/ActivityManager( 1629): 	at android.os.Binder.execTransact(Binder.java:565)
06-05 18:34:58.669 D/VehicleStatisticsActivity( 6718): Checking recalculation ...
06-05 18:34:58.670 D/VehicleStatisticsActivity( 6718): Recalculation not necessary.
06-05 18:34:58.687 W/ActivityManager( 1629): Bad activity token: android.os.BinderProxy@cda0571
06-05 18:34:58.687 W/ActivityManager( 1629): java.lang.ClassCastException: android.os.BinderProxy cannot be cast to com.android.server.am.ActivityRecord$Token
06-05 18:34:58.687 W/ActivityManager( 1629): 	at com.android.server.am.ActivityRecord.forTokenLocked(ActivityRecord.java:586)
06-05 18:34:58.687 W/ActivityManager( 1629): 	at com.android.server.am.ActivityRecord.isInStackLocked(ActivityRecord.java:1327)
06-05 18:34:58.687 W/ActivityManager( 1629): 	at com.android.server.am.ActivityManagerService.getActivityOptions(ActivityManagerService.java:12559)
06-05 18:34:58.687 W/ActivityManager( 1629): 	at android.app.ActivityManagerNative.onTransact(ActivityManagerNative.java:1933)
06-05 18:34:58.687 W/ActivityManager( 1629): 	at com.android.server.am.ActivityManagerService.onTransact(ActivityManagerService.java:2757)
06-05 18:34:58.687 W/ActivityManager( 1629): 	at android.os.Binder.execTransact(Binder.java:565)
06-05 18:34:58.688 W/ActivityManager( 1629): Bad activity token: android.os.BinderProxy@cda0571
06-05 18:34:58.688 W/ActivityManager( 1629): java.lang.ClassCastException: android.os.BinderProxy cannot be cast to com.android.server.am.ActivityRecord$Token
06-05 18:34:58.688 W/ActivityManager( 1629): 	at com.android.server.am.ActivityRecord.forTokenLocked(ActivityRecord.java:586)
06-05 18:34:58.688 W/ActivityManager( 1629): 	at com.android.server.am.ActivityRecord.isInStackLocked(ActivityRecord.java:1327)
06-05 18:34:58.688 W/ActivityManager( 1629): 	at com.android.server.am.ActivityManagerService.getActivityOptions(ActivityManagerService.java:12559)
06-05 18:34:58.688 W/ActivityManager( 1629): 	at android.app.ActivityManagerNative.onTransact(ActivityManagerNative.java:1933)
06-05 18:34:58.688 W/ActivityManager( 1629): 	at com.android.server.am.ActivityManagerService.onTransact(ActivityManagerService.java:2757)
06-05 18:34:58.688 W/ActivityManager( 1629): 	at android.os.Binder.execTransact(Binder.java:565)
06-05 18:34:58.689 D/VehicleStatisticsActivity( 6718): Checking recalculation ...
06-05 18:34:58.690 D/VehicleStatisticsActivity( 6718): Recalculation not necessary.
06-05 18:34:58.776 I/System.out( 6718): URI: //map
06-05 18:34:58.776 I/System.out( 6718): params: {json={"query":"android.widget.AbsListView index:0","operation":{"method_name":"query","arguments":[]}}
06-05 18:34:58.776 I/System.out( 6718): }
06-05 18:34:58.781 I/art     ( 6718): Do partial code cache collection, code=30KB, data=29KB
06-05 18:34:58.781 I/art     ( 6718): After code cache collection, code=29KB, data=28KB
06-05 18:34:58.781 I/art     ( 6718): Increasing code cache capacity to 128KB
06-05 18:34:58.792 I/System.out( 6718): URI: //map
06-05 18:34:58.792 I/System.out( 6718): params: {json={"query":"android.widget.AbsListView index:0","operation":{"method_name":"query","arguments":[]}}
06-05 18:34:58.792 I/System.out( 6718): }
06-05 18:34:58.806 I/System.out( 6718): URI: //map
06-05 18:34:58.806 I/System.out( 6718): params: {json={"query":"android.widget.AbsListView index:0","operation":{"method_name":"query","arguments":[]}}
06-05 18:34:58.806 I/System.out( 6718): }
06-05 18:34:58.820 I/System.out( 6718): URI: //map
06-05 18:34:58.820 I/System.out( 6718): params: {json={"query":"android.widget.AbsListView index:0","operation":{"method_name":"query","arguments":["getFirstVisiblePosition"]}}
06-05 18:34:58.820 I/System.out( 6718): }
06-05 18:34:58.832 I/System.out( 6718): URI: //map
06-05 18:34:58.832 I/System.out( 6718): params: {json={"query":"android.widget.AbsListView index:0","operation":{"method_name":"query","arguments":["getLastVisiblePosition"]}}
06-05 18:34:58.832 I/System.out( 6718): }
06-05 18:34:58.846 I/System.out( 6718): URI: //map
06-05 18:34:58.846 I/System.out( 6718): params: {json={"query":"android.widget.AbsListView index:0","operation":{"method_name":"query","arguments":[{"method_name":"setSelection","arguments":[26]}]}}
06-05 18:34:58.846 I/System.out( 6718): }
06-05 18:34:58.867 I/System.out( 6718): URI: //map
06-05 18:34:58.867 I/System.out( 6718): params: {json={"query":"* marked:'South'","operation":{"method_name":"query","arguments":[]}}
06-05 18:34:58.867 I/System.out( 6718): }
06-05 18:34:58.922 D/gralloc_ranchu( 1346): gralloc_alloc: Creating ashmem region of size 9023488
06-05 18:34:58.937 V/PhoneStatusBar( 1711): setLightsOn(true)
06-05 18:34:58.939 V/PhoneStatusBar( 1711): setLightsOn(true)
06-05 18:34:58.940 W/OpenGLRenderer( 2150): Incorrectly called buildLayer on View: ShortcutAndWidgetContainer, destroying layer...
06-05 18:34:58.955 I/WindowManager( 1629): Destroying surface Surface(name=com.android.launcher3/com.android.launcher3.Launcher) called by com.android.server.wm.WindowStateAnimator.destroySurface:2016 com.android.server.wm.WindowStateAnimator.destroySurfaceLocked:882 com.android.server.wm.WindowState.destroyOrSaveSurface:2100 com.android.server.wm.AppWindowToken.destroySurfaces:363 com.android.server.wm.AppWindowToken.notifyAppStopped:389 com.android.server.wm.WindowManagerService.notifyAppStopped:4463 com.android.server.am.ActivityStack.activityStoppedLocked:1252 com.android.server.am.ActivityManagerService.activityStopped:6903 
06-05 18:34:58.956 V/PhoneStatusBar( 1711): setLightsOn(true)
06-05 18:34:58.968 W/ResourceType( 6718): No package identifier when getting name for resource number 0x00000001
06-05 18:34:58.979 I/System.out( 6718): URI: //gesture
06-05 18:34:58.979 I/System.out( 6718): params: {json={"query_timeout":5.0,"gestures":[{"query_string":"* marked:'South'","touches":[{"x":50,"y":50,"offset_x":0,"offset_y":0,"wait":0.0,"time":0.2,"release":true,"query_string":null}]}]}
06-05 18:34:58.979 I/System.out( 6718): }
06-05 18:34:58.983 W/ResourceType( 6718): No package identifier when getting name for resource number 0x00000001
06-05 18:34:59.207 I/ActivityManager( 1629): START u0 {cmp=com.evancharlton.mileage/.charts.SouthChart (has extras)} from uid 10160 on display 0
06-05 18:34:59.211 V/PhoneStatusBar( 1711): setLightsOn(true)
06-05 18:34:59.214 V/PhoneStatusBar( 1711): setLightsOn(true)
06-05 18:34:59.250 I/System.out( 6718): URI: //map
06-05 18:34:59.250 I/System.out( 6718): params: {json={"query":"* {text CONTAINS[c] 'Farthest south fillup'}","operation":{"method_name":"query","arguments":[]}}
06-05 18:34:59.250 I/System.out( 6718): }
06-05 18:34:59.281 I/calabash( 6718): newActivity1
06-05 18:34:59.284 W/aiCharts( 6718): License file is invalid or missing. 
06-05 18:34:59.284 W/aiCharts( 6718): Please place proper license.lic to /assets folder.
06-05 18:34:59.297 V/PhoneStatusBar( 1711): setLightsOn(true)
06-05 18:34:59.320 V/PhoneStatusBar( 1711): setLightsOn(true)
06-05 18:34:59.325 I/WindowManager( 1629): Destroying surface Surface(name=Creating chart…) called by com.android.server.wm.WindowStateAnimator.destroySurface:2016 com.android.server.wm.WindowStateAnimator.destroySurfaceLocked:882 com.android.server.wm.WindowState.removeLocked:1456 com.android.server.wm.WindowManagerService.removeWindowInnerLocked:2484 com.android.server.wm.WindowManagerService.removeWindowLocked:2442 com.android.server.wm.WindowManagerService.removeWindowLocked:2311 com.android.server.wm.WindowManagerService.removeWindow:2306 com.android.server.wm.Session.remove:202 
06-05 18:34:59.328 D/gralloc_ranchu( 1346): gralloc_alloc: Creating ashmem region of size 9023488
06-05 18:34:59.337 V/PhoneStatusBar( 1711): setLightsOn(true)
06-05 18:34:59.369 I/ActivityManager( 1629): Displayed com.evancharlton.mileage/.charts.SouthChart: +92ms
06-05 18:34:59.371 V/PhoneStatusBar( 1711): setLightsOn(true)
06-05 18:34:59.404 V/PhoneStatusBar( 1711): setLightsOn(true)
06-05 18:34:59.420 V/PhoneStatusBar( 1711): setLightsOn(true)
06-05 18:34:59.606 V/PhoneStatusBar( 1711): setLightsOn(true)
06-05 18:34:59.616 I/System.out( 6718): URI: //map
06-05 18:34:59.616 I/System.out( 6718): params: {json={"query":"* {text CONTAINS[c] 'Farthest south fillup'}","operation":{"method_name":"query","arguments":[]}}
06-05 18:34:59.616 I/System.out( 6718): }
06-05 18:34:59.653 I/System.out( 6718): URI: //
06-05 18:34:59.653 I/System.out( 6718): params: {json={"command":"press_key","arguments":["KEYCODE_BACK"]}
06-05 18:34:59.653 I/System.out( 6718): }
06-05 18:34:59.653 I/System.out( 6718): header: {content-type=application/json;charset=utf-8, date=Fri, 05 Jun 2020 23:34:59 GMT, accept=*/*, host=127.0.0.1:34783, content-length=52, user-agent=HTTPClient/1.0 (2.8.3, ruby 2.5.1 (2018-03-29))}
06-05 18:34:59.653 I/System.out( 6718): params: {json={"command":"press_key","arguments":["KEYCODE_BACK"]}
06-05 18:34:59.653 I/System.out( 6718): }
06-05 18:34:59.653 I/System.out( 6718): ProP json = {"command":"press_key","arguments":["KEYCODE_BACK"]}
06-05 18:34:59.653 I/System.out( 6718): files: {}
06-05 18:34:59.653 I/System.out( 6718): command: {"command":"press_key","arguments":["KEYCODE_BACK"]}
06-05 18:34:59.654 I/InstrumentationBackend( 6718): Got command:'Command:'Line:null,press_key', arguments:'[KEYCODE_BACK]'
06-05 18:34:59.657 V/PhoneStatusBar( 1711): setLightsOn(true)
06-05 18:34:59.660 V/PhoneStatusBar( 1711): setLightsOn(true)
06-05 18:34:59.662 I/art     ( 6718): Do partial code cache collection, code=60KB, data=62KB
06-05 18:34:59.662 I/art     ( 6718): After code cache collection, code=59KB, data=61KB
06-05 18:34:59.662 I/art     ( 6718): Increasing code cache capacity to 256KB
06-05 18:34:59.663 I/System.out( 6718): result:{"bonusInformation":[],"message":"","success":true}
06-05 18:34:59.664 D/VehicleStatisticsActivity( 6718): Checking recalculation ...
06-05 18:34:59.665 D/VehicleStatisticsActivity( 6718): Recalculation not necessary.
06-05 18:34:59.669 I/System.out( 6718): URI: //map
06-05 18:34:59.669 I/System.out( 6718): params: {json={"query":"* {text CONTAINS[c] 'Statistics'}","operation":{"method_name":"query","arguments":[]}}
06-05 18:34:59.669 I/System.out( 6718): }
06-05 18:34:59.670 V/PhoneStatusBar( 1711): setLightsOn(true)
06-05 18:34:59.687 D/gralloc_ranchu( 1346): gralloc_alloc: Creating ashmem region of size 9023488
06-05 18:34:59.687 V/PhoneStatusBar( 1711): setLightsOn(true)
06-05 18:34:59.704 V/PhoneStatusBar( 1711): setLightsOn(true)
06-05 18:34:59.721 V/PhoneStatusBar( 1711): setLightsOn(true)
