--------- beginning of main
06-05 18:35:01.656 D/gralloc_ranchu( 1346): gralloc_alloc: Creating ashmem region of size 3145728
06-05 18:35:01.660 E/EGL_emulation( 1346): tid 1346: eglCreateSyncKHR(1901): error 0x3004 (EGL_BAD_ATTRIBUTE)
--------- beginning of system
06-05 18:35:01.669 W/ActivityManager( 1629): Finishing task with all activities already finished
06-05 18:35:01.669 W/ActivityManager( 1629): Duplicate finish request for ActivityRecord{acd0b6 u0 com.evancharlton.mileage/.Mileage t3098 f}
06-05 18:35:01.669 W/ActivityManager( 1629): Finishing task with all activities already finished
06-05 18:35:01.669 W/ActivityManager( 1629): Duplicate finish request for ActivityRecord{acd0b6 u0 com.evancharlton.mileage/.Mileage t3098 f}
06-05 18:35:01.669 W/ActivityManager( 1629): Finishing task with all activities already finished
06-05 18:35:01.669 W/ActivityManager( 1629): Duplicate finish request for ActivityRecord{acd0b6 u0 com.evancharlton.mileage/.Mileage t3098 f}
06-05 18:35:01.669 W/ActivityManager( 1629): Finishing task with all activities already finished
06-05 18:35:01.669 W/ActivityManager( 1629): Duplicate finish request for ActivityRecord{acd0b6 u0 com.evancharlton.mileage/.Mileage t3098 f}
06-05 18:35:01.669 W/ActivityManager( 1629): Finishing task with all activities already finished
06-05 18:35:01.669 W/ActivityManager( 1629): Duplicate finish request for ActivityRecord{8ea7df0 u0 com.evancharlton.mileage/.charts.EastChart t3098 f}
06-05 18:35:01.669 W/ActivityManager( 1629): Finishing task with all activities already finished
06-05 18:35:01.669 W/ActivityManager( 1629): Duplicate finish request for ActivityRecord{8ea7df0 u0 com.evancharlton.mileage/.charts.EastChart t3098 f}
06-05 18:35:01.669 W/ActivityManager( 1629): Finishing task with all activities already finished
06-05 18:35:01.669 W/ActivityManager( 1629): Duplicate finish request for ActivityRecord{acd0b6 u0 com.evancharlton.mileage/.Mileage t3098 f}
06-05 18:35:01.670 W/ActivityManager( 1629): Finishing task with all activities already finished
06-05 18:35:01.670 W/ActivityManager( 1629): Duplicate finish request for ActivityRecord{acd0b6 u0 com.evancharlton.mileage/.Mileage t3098 f}
06-05 18:35:01.689 D/EGL_emulation( 2150): eglMakeCurrent: 0xb4f852a0: ver 2 0 (tinfo 0xb4f832e0)
06-05 18:35:01.705 D/EGL_emulation( 1711): eglMakeCurrent: 0xa5b6bd80: ver 2 0 (tinfo 0xb1367140)
06-05 18:35:01.720 D/EGL_emulation( 1711): eglMakeCurrent: 0xa5b6bd80: ver 2 0 (tinfo 0xb1367140)
06-05 18:35:01.722 D/EGL_emulation( 1711): eglMakeCurrent: 0xa5b6bd80: ver 2 0 (tinfo 0xb1367140)
06-05 18:35:01.737 D/EGL_emulation( 1711): eglMakeCurrent: 0xa5b6bd80: ver 2 0 (tinfo 0xb1367140)
06-05 18:35:01.739 D/EGL_emulation( 1711): eglMakeCurrent: 0xa5b6bd80: ver 2 0 (tinfo 0xb1367140)
06-05 18:35:01.754 D/EGL_emulation( 1711): eglMakeCurrent: 0xa5b6bd80: ver 2 0 (tinfo 0xb1367140)
06-05 18:35:01.756 D/EGL_emulation( 1711): eglMakeCurrent: 0xa5b6bd80: ver 2 0 (tinfo 0xb1367140)
06-05 18:35:01.771 D/EGL_emulation( 1711): eglMakeCurrent: 0xa5b6bd80: ver 2 0 (tinfo 0xb1367140)
06-05 18:35:01.772 D/EGL_emulation( 1711): eglMakeCurrent: 0xa5b6bd80: ver 2 0 (tinfo 0xb1367140)
06-05 18:35:01.787 D/EGL_emulation( 1711): eglMakeCurrent: 0xa5b6bd80: ver 2 0 (tinfo 0xb1367140)
06-05 18:35:01.789 D/EGL_emulation( 1711): eglMakeCurrent: 0xa5b6bd80: ver 2 0 (tinfo 0xb1367140)
06-05 18:35:01.804 D/EGL_emulation( 1711): eglMakeCurrent: 0xa5b6bd80: ver 2 0 (tinfo 0xb1367140)
06-05 18:35:01.807 D/EGL_emulation( 1711): eglMakeCurrent: 0xa5b6bd80: ver 2 0 (tinfo 0xb1367140)
06-05 18:35:01.812 D/AndroidRuntime( 6832): >>>>>> START com.android.internal.os.RuntimeInit uid 2000 <<<<<<
06-05 18:35:01.813 D/AndroidRuntime( 6832): CheckJNI is ON
06-05 18:35:01.821 D/EGL_emulation( 1711): eglMakeCurrent: 0xa5b6bd80: ver 2 0 (tinfo 0xb1367140)
06-05 18:35:01.822 D/EGL_emulation( 1711): eglMakeCurrent: 0xa5b6bd80: ver 2 0 (tinfo 0xb1367140)
06-05 18:35:01.824 W/art     ( 6832): Unexpected CPU variant for X86 using defaults: x86
06-05 18:35:01.826 D/ICU     ( 6832): No timezone override file found: /data/misc/zoneinfo/current/icu/icu_tzdata.dat
06-05 18:35:01.832 E/memtrack( 6832): Couldn't load memtrack module (No such file or directory)
06-05 18:35:01.832 E/android.os.Debug( 6832): failed to load memtrack module: -2
06-05 18:35:01.833 I/Radio-JNI( 6832): register_android_hardware_Radio DONE
06-05 18:35:01.836 D/AndroidRuntime( 6832): Calling main entry com.android.commands.am.Am
06-05 18:35:01.837 D/EGL_emulation( 1711): eglMakeCurrent: 0xa5b6bd80: ver 2 0 (tinfo 0xb1367140)
06-05 18:35:01.838 I/ActivityManager( 1629): Force stopping com.evancharlton.mileage appid=10160 user=0: start instr
06-05 18:35:01.838 I/ActivityManager( 1629): Killing 6780:com.evancharlton.mileage/u0a160 (adj 0): stop com.evancharlton.mileage
06-05 18:35:01.838 D/ActivityManager( 1629): cleanUpApplicationRecord -- 6780
06-05 18:35:01.838 W/ActivityManager( 1629): Crash of app com.evancharlton.mileage running instrumentation ComponentInfo{com.evancharlton.mileage.test/sh.calaba.instrumentationbackend.CalabashInstrumentationTestRunner}
06-05 18:35:01.838 I/ActivityManager( 1629): Force stopping com.evancharlton.mileage appid=10160 user=0: finished inst
06-05 18:35:01.839 D/EGL_emulation( 1711): eglMakeCurrent: 0xa5b6bd80: ver 2 0 (tinfo 0xb1367140)
06-05 18:35:01.841 I/art     ( 6842): Not late-enabling -Xcheck:jni (already on)
06-05 18:35:01.841 W/art     ( 6842): Unexpected CPU variant for X86 using defaults: x86
06-05 18:35:01.849 I/ActivityManager( 1629): Start proc 6842:com.evancharlton.mileage/u0a160 for added application com.evancharlton.mileage
06-05 18:35:01.849 D/AndroidRuntime( 6832): Shutting down VM
06-05 18:35:01.853 W/System  ( 6842): ClassLoader referenced unknown path: /data/app/com.evancharlton.mileage.test-1/lib/x86
06-05 18:35:01.853 W/System  ( 6842): ClassLoader referenced unknown path: /data/app/com.evancharlton.mileage-1/lib/x86
06-05 18:35:01.854 D/EGL_emulation( 1711): eglMakeCurrent: 0xa5b6bd80: ver 2 0 (tinfo 0xb1367140)
06-05 18:35:01.856 D/EGL_emulation( 1711): eglMakeCurrent: 0xa5b6bd80: ver 2 0 (tinfo 0xb1367140)
06-05 18:35:01.856 W/System  ( 6842): ClassLoader referenced unknown path: 
06-05 18:35:01.860 I/System.out( 6842): Main activity name automatically set to: com.evancharlton.mileage.Mileage
06-05 18:35:01.860 I/System.out( 6842): Calabash did not load Mono. This is only a problem if you are trying to test a Mono application
06-05 18:35:01.860 I/calabash( 6842): Test server port: 7102
06-05 18:35:01.861 I/InstrumentationBackend( 6842): Added:'GetPreferences', with key:'get_preferences'
06-05 18:35:01.864 I/InstrumentationBackend( 6842): Added:'SetPreferences', with key:'set_preferences'
06-05 18:35:01.864 I/InstrumentationBackend( 6842): Added:'ClearPreferences', with key:'clear_preferences'
06-05 18:35:01.864 I/InstrumentationBackend( 6842): Added:'PressElement', with key:'press_l10n_element'
06-05 18:35:01.864 I/InstrumentationBackend( 6842): Added:'WaitForElement', with key:'wait_for_l10n_element'
06-05 18:35:01.865 I/InstrumentationBackend( 6842): Added:'NullAction', with key:'nullAction'
06-05 18:35:01.865 I/InstrumentationBackend( 6842): Added:'PressKey', with key:'press_key'
06-05 18:35:01.865 I/InstrumentationBackend( 6842): Added:'SetActivityOrientation', with key:'set_activity_orientation'
06-05 18:35:01.865 I/InstrumentationBackend( 6842): Added:'GetActivityOrientation', with key:'get_activity_orientation'
06-05 18:35:01.865 I/InstrumentationBackend( 6842): Added:'FakeGPSLocation', with key:'set_gps_coordinates'
06-05 18:35:01.865 I/InstrumentationBackend( 6842): Added:'SetPropertyByCssSelector', with key:'set_property_by_css_selector'
06-05 18:35:01.865 I/InstrumentationBackend( 6842): Added:'GetUrl', with key:'get_url'
06-05 18:35:01.865 I/InstrumentationBackend( 6842): Added:'ScrollTo', with key:'scroll_to'
06-05 18:35:01.865 I/InstrumentationBackend( 6842): Added:'GetLoadProgress', with key:'get_load_progress'
06-05 18:35:01.865 I/InstrumentationBackend( 6842): Added:'DumpHtml', with key:'dump_html'
06-05 18:35:01.865 I/InstrumentationBackend( 6842): Added:'DumpBodyHtml', with key:'dump_body_html'
06-05 18:35:01.865 I/InstrumentationBackend( 6842): Added:'EnterTextByCssSelector', with key:'enter_text_by_selector'
06-05 18:35:01.866 I/InstrumentationBackend( 6842): Added:'AndroidSDKVersion', with key:'android_sdk_version'
06-05 18:35:01.866 I/InstrumentationBackend( 6842): Added:'Version', with key:'version'
06-05 18:35:01.866 I/InstrumentationBackend( 6842): Added:'Drag', with key:'drag'
06-05 18:35:01.866 I/InstrumentationBackend( 6842): Added:'TouchCoordinates', with key:'touch_coordinate'
06-05 18:35:01.866 I/InstrumentationBackend( 6842): Added:'LongPressCoordinate', with key:'long_press_coordinate'
06-05 18:35:01.866 I/InstrumentationBackend( 6842): Added:'DragCoordinates', with key:'drag_coordinates'
06-05 18:35:01.866 I/InstrumentationBackend( 6842): Added:'ResumeApplication', with key:'resume_application'
06-05 18:35:01.866 I/InstrumentationBackend( 6842): Added:'Swipe', with key:'swipe'
06-05 18:35:01.866 I/InstrumentationBackend( 6842): Added:'DoubleTapCoordinate', with key:'double_tap_coordinate'
06-05 18:35:01.866 I/InstrumentationBackend( 6842): Added:'ClickOnScreen', with key:'click_on_screen'
06-05 18:35:01.866 I/InstrumentationBackend( 6842): Added:'GetActivityName', with key:'get_activity_name'
06-05 18:35:01.866 I/InstrumentationBackend( 6842): Added:'ScrollToView', with key:'scroll_to_view'
06-05 18:35:01.866 I/InstrumentationBackend( 6842): Added:'ViewConfiguration', with key:'view_configuration'
06-05 18:35:01.866 I/InstrumentationBackend( 6842): Added:'IsCurrentActivityFocused', with key:'is_current_activity_focused'
06-05 18:35:01.866 I/InstrumentationBackend( 6842): Added:'SendTcp', with key:'send_tcp'
06-05 18:35:01.866 I/InstrumentationBackend( 6842): Added:'DpToDevicePixel', with key:'dp_to_device_pixel'
06-05 18:35:01.866 I/InstrumentationBackend( 6842): Added:'KeyboardEnterText', with key:'keyboard_enter_text'
06-05 18:35:01.866 I/InstrumentationBackend( 6842): Added:'DeleteSurroundingText', with key:'delete_surrounding_text'
06-05 18:35:01.866 I/InstrumentationBackend( 6842): Added:'SetComposingRegion', with key:'set_composing_region'
06-05 18:35:01.866 I/InstrumentationBackend( 6842): Added:'SetSelection', with key:'set_selection'
06-05 18:35:01.866 I/InstrumentationBackend( 6842): Added:'KeyboardKeyEvent', with key:'keyboard_key_event'
06-05 18:35:01.866 I/InstrumentationBackend( 6842): Added:'PressUserActionButton', with key:'press_user_action_button'
06-05 18:35:01.866 I/InstrumentationBackend( 6842): Added:'HideSoftKeyboard', with key:'hide_soft_keyboard'
06-05 18:35:01.866 I/InstrumentationBackend( 6842): Added:'ListActions', with key:'list_actions'
06-05 18:35:01.867 I/calabash( 6842): Instantiating http server at 7102
06-05 18:35:01.867 I/System.out( 6842): HTTP Daemon listening on: 7102
06-05 18:35:01.871 D/EGL_emulation( 1711): eglMakeCurrent: 0xa5b6bd80: ver 2 0 (tinfo 0xb1367140)
06-05 18:35:01.872 D/EGL_emulation( 1711): eglMakeCurrent: 0xa5b6bd80: ver 2 0 (tinfo 0xb1367140)
06-05 18:35:01.888 D/EGL_emulation( 1711): eglMakeCurrent: 0xa5b6bd80: ver 2 0 (tinfo 0xb1367140)
06-05 18:35:01.890 D/EGL_emulation( 1711): eglMakeCurrent: 0xa5b6bd80: ver 2 0 (tinfo 0xb1367140)
06-05 18:35:01.891 I/WindowManager( 1629): WIN DEATH: Window{2e86fd u0 com.evancharlton.mileage/com.evancharlton.mileage.Mileage EXITING}
06-05 18:35:01.891 W/InputDispatcher( 1629): channel '9402afa com.evancharlton.mileage/com.evancharlton.mileage.charts.EastChart (server)' ~ Consumer closed input channel or an error occurred.  events=0x9
06-05 18:35:01.892 E/InputDispatcher( 1629): channel '9402afa com.evancharlton.mileage/com.evancharlton.mileage.charts.EastChart (server)' ~ Channel is unrecoverably broken and will be disposed!
06-05 18:35:01.892 I/WindowManager( 1629): WIN DEATH: Window{9402afa u0 com.evancharlton.mileage/com.evancharlton.mileage.charts.EastChart}
06-05 18:35:01.892 W/InputDispatcher( 1629): Attempted to unregister already unregistered input channel '9402afa com.evancharlton.mileage/com.evancharlton.mileage.charts.EastChart (server)'
06-05 18:35:01.892 I/WindowManager( 1629): Destroying surface Surface(name=com.evancharlton.mileage/com.evancharlton.mileage.charts.EastChart) called by com.android.server.wm.WindowStateAnimator.destroySurface:2016 com.android.server.wm.WindowStateAnimator.destroySurfaceLocked:882 com.android.server.wm.WindowState.removeLocked:1456 com.android.server.wm.WindowManagerService.removeWindowInnerLocked:2484 com.android.server.wm.WindowManagerService.removeWindowLocked:2442 com.android.server.wm.WindowState$DeathRecipient.binderDied:1787 android.os.BinderProxy.sendDeathNotice:688 <bottom of call stack> 
06-05 18:35:01.907 D/EGL_emulation( 1711): eglMakeCurrent: 0xa5b6bd80: ver 2 0 (tinfo 0xb1367140)
06-05 18:35:01.921 D/EGL_emulation( 1711): eglMakeCurrent: 0xa5b6bd80: ver 2 0 (tinfo 0xb1367140)
06-05 18:35:01.922 D/EGL_emulation( 1711): eglMakeCurrent: 0xa5b6bd80: ver 2 0 (tinfo 0xb1367140)
06-05 18:35:01.958 I/System.out( 6842): URI: //ping
06-05 18:35:01.958 I/System.out( 6842): params: {json={}
06-05 18:35:01.958 I/System.out( 6842): }
06-05 18:35:01.962 I/System.out( 6842): URI: //ping
06-05 18:35:01.962 I/System.out( 6842): params: {json={}
06-05 18:35:01.962 I/System.out( 6842): }
06-05 18:35:01.966 I/System.out( 6842): URI: //ready
06-05 18:35:01.966 I/System.out( 6842): params: {json={}
06-05 18:35:01.966 I/System.out( 6842): }
06-05 18:35:01.970 I/System.out( 6842): URI: //
06-05 18:35:01.970 I/System.out( 6842): params: {json={"command":"version","arguments":[]}
06-05 18:35:01.970 I/System.out( 6842): }
06-05 18:35:01.970 I/System.out( 6842): header: {content-type=application/json;charset=utf-8, date=Fri, 05 Jun 2020 23:35:02 GMT, accept=*/*, host=127.0.0.1:34783, content-length=36, user-agent=HTTPClient/1.0 (2.8.3, ruby 2.5.1 (2018-03-29))}
06-05 18:35:01.970 I/System.out( 6842): params: {json={"command":"version","arguments":[]}
06-05 18:35:01.970 I/System.out( 6842): }
06-05 18:35:01.970 I/System.out( 6842): ProP json = {"command":"version","arguments":[]}
06-05 18:35:01.970 I/System.out( 6842): files: {}
06-05 18:35:01.970 I/System.out( 6842): command: {"command":"version","arguments":[]}
06-05 18:35:01.977 I/InstrumentationBackend( 6842): Got command:'Command:'Line:null,version', arguments:'[]'
06-05 18:35:01.992 I/System.out( 6842): result:{"bonusInformation":[],"message":"0.9.8","success":true}
06-05 18:35:01.996 I/System.out( 6842): URI: //start-application
06-05 18:35:01.996 I/System.out( 6842): params: {json={"intent":null}
06-05 18:35:01.996 I/System.out( 6842): }
06-05 18:35:02.012 I/ActivityManager( 1629): START u0 {act=android.intent.action.MAIN cat=[android.intent.category.LAUNCHER] flg=0x10200000 cmp=com.evancharlton.mileage/.Mileage} from uid 10160 on display 0
06-05 18:35:02.019 I/calabash( 6842): newActivity1
06-05 18:35:02.027 I/calabash( 6842): newActivity1
06-05 18:35:02.028 W/ActivityManager( 1629): Bad activity token: android.os.BinderProxy@1bb0e05
06-05 18:35:02.028 W/ActivityManager( 1629): java.lang.ClassCastException: android.os.BinderProxy cannot be cast to com.android.server.am.ActivityRecord$Token
06-05 18:35:02.028 W/ActivityManager( 1629): 	at com.android.server.am.ActivityRecord.forTokenLocked(ActivityRecord.java:586)
06-05 18:35:02.028 W/ActivityManager( 1629): 	at com.android.server.am.ActivityRecord.isInStackLocked(ActivityRecord.java:1327)
06-05 18:35:02.028 W/ActivityManager( 1629): 	at com.android.server.am.ActivityRecord.getStackLocked(ActivityRecord.java:1332)
06-05 18:35:02.028 W/ActivityManager( 1629): 	at com.android.server.am.ActivityManagerService.getActivityDisplayId(ActivityManagerService.java:9806)
06-05 18:35:02.028 W/ActivityManager( 1629): 	at android.app.ActivityManagerNative.onTransact(ActivityManagerNative.java:2566)
06-05 18:35:02.028 W/ActivityManager( 1629): 	at com.android.server.am.ActivityManagerService.onTransact(ActivityManagerService.java:2757)
06-05 18:35:02.028 W/ActivityManager( 1629): 	at android.os.Binder.execTransact(Binder.java:565)
06-05 18:35:02.029 W/ActivityManager( 1629): Bad activity token: android.os.BinderProxy@1bb0e05
06-05 18:35:02.029 W/ActivityManager( 1629): java.lang.ClassCastException: android.os.BinderProxy cannot be cast to com.android.server.am.ActivityRecord$Token
06-05 18:35:02.029 W/ActivityManager( 1629): 	at com.android.server.am.ActivityRecord.forTokenLocked(ActivityRecord.java:586)
06-05 18:35:02.029 W/ActivityManager( 1629): 	at com.android.server.am.ActivityRecord.isInStackLocked(ActivityRecord.java:1327)
06-05 18:35:02.029 W/ActivityManager( 1629): 	at com.android.server.am.ActivityManagerService.setTaskDescription(ActivityManagerService.java:9358)
06-05 18:35:02.029 W/ActivityManager( 1629): 	at android.app.ActivityManagerNative.onTransact(ActivityManagerNative.java:2639)
06-05 18:35:02.029 W/ActivityManager( 1629): 	at com.android.server.am.ActivityManagerService.onTransact(ActivityManagerService.java:2757)
06-05 18:35:02.029 W/ActivityManager( 1629): 	at android.os.Binder.execTransact(Binder.java:565)
06-05 18:35:02.029 W/ActivityManager( 1629): Bad activity token: android.os.BinderProxy@1bb0e05
06-05 18:35:02.029 W/ActivityManager( 1629): java.lang.ClassCastException: android.os.BinderProxy cannot be cast to com.android.server.am.ActivityRecord$Token
06-05 18:35:02.029 W/ActivityManager( 1629): 	at com.android.server.am.ActivityRecord.forTokenLocked(ActivityRecord.java:586)
06-05 18:35:02.029 W/ActivityManager( 1629): 	at com.android.server.am.ActivityRecord.isInStackLocked(ActivityRecord.java:1327)
06-05 18:35:02.029 W/ActivityManager( 1629): 	at com.android.server.am.ActivityRecord.getStackLocked(ActivityRecord.java:1332)
06-05 18:35:02.029 W/ActivityManager( 1629): 	at com.android.server.am.ActivityManagerService.getActivityStackId(ActivityManagerService.java:9817)
06-05 18:35:02.029 W/ActivityManager( 1629): 	at android.app.ActivityManagerNative.onTransact(ActivityManagerNative.java:2856)
06-05 18:35:02.029 W/ActivityManager( 1629): 	at com.android.server.am.ActivityManagerService.onTransact(ActivityManagerService.java:2757)
06-05 18:35:02.029 W/ActivityManager( 1629): 	at android.os.Binder.execTransact(Binder.java:565)
06-05 18:35:02.037 D/gralloc_ranchu( 1346): gralloc_alloc: Creating ashmem region of size 9023488
06-05 18:35:02.046 W/ActivityManager( 1629): Bad activity token: android.os.BinderProxy@1bb0e05
06-05 18:35:02.046 W/ActivityManager( 1629): java.lang.ClassCastException: android.os.BinderProxy cannot be cast to com.android.server.am.ActivityRecord$Token
06-05 18:35:02.046 W/ActivityManager( 1629): 	at com.android.server.am.ActivityRecord.forTokenLocked(ActivityRecord.java:586)
06-05 18:35:02.046 W/ActivityManager( 1629): 	at com.android.server.am.ActivityRecord.isInStackLocked(ActivityRecord.java:1327)
06-05 18:35:02.046 W/ActivityManager( 1629): 	at com.android.server.am.ActivityManagerService.getActivityOptions(ActivityManagerService.java:12559)
06-05 18:35:02.046 W/ActivityManager( 1629): 	at android.app.ActivityManagerNative.onTransact(ActivityManagerNative.java:1933)
06-05 18:35:02.046 W/ActivityManager( 1629): 	at com.android.server.am.ActivityManagerService.onTransact(ActivityManagerService.java:2757)
06-05 18:35:02.046 W/ActivityManager( 1629): 	at android.os.Binder.execTransact(Binder.java:565)
06-05 18:35:02.046 W/ActivityManager( 1629): Bad activity token: android.os.BinderProxy@1bb0e05
06-05 18:35:02.046 W/ActivityManager( 1629): java.lang.ClassCastException: android.os.BinderProxy cannot be cast to com.android.server.am.ActivityRecord$Token
06-05 18:35:02.046 W/ActivityManager( 1629): 	at com.android.server.am.ActivityRecord.forTokenLocked(ActivityRecord.java:586)
06-05 18:35:02.046 W/ActivityManager( 1629): 	at com.android.server.am.ActivityRecord.isInStackLocked(ActivityRecord.java:1327)
06-05 18:35:02.046 W/ActivityManager( 1629): 	at com.android.server.am.ActivityManagerService.getActivityOptions(ActivityManagerService.java:12559)
06-05 18:35:02.046 W/ActivityManager( 1629): 	at android.app.ActivityManagerNative.onTransact(ActivityManagerNative.java:1933)
06-05 18:35:02.046 W/ActivityManager( 1629): 	at com.android.server.am.ActivityManagerService.onTransact(ActivityManagerService.java:2757)
06-05 18:35:02.046 W/ActivityManager( 1629): 	at android.os.Binder.execTransact(Binder.java:565)
06-05 18:35:02.060 V/PhoneStatusBar( 1711): setLightsOn(true)
06-05 18:35:02.071 D/EGL_emulation( 2150): eglMakeCurrent: 0xb4f852a0: ver 2 0 (tinfo 0xb4f832e0)
06-05 18:35:02.072 D/EGL_emulation( 1711): eglMakeCurrent: 0xa5b6bd80: ver 2 0 (tinfo 0xb1367140)
06-05 18:35:02.087 D/gralloc_ranchu( 1346): gralloc_alloc: Creating ashmem region of size 9023488
06-05 18:35:02.087 D/EGL_emulation( 1711): eglMakeCurrent: 0xa5b6bd80: ver 2 0 (tinfo 0xb1367140)
06-05 18:35:02.091 D/        ( 6842): HostConnection::get() New Host Connection established 0x98c2e480, tid 6842
06-05 18:35:02.092 D/EGL_emulation( 1711): eglMakeCurrent: 0xa5b6bd80: ver 2 0 (tinfo 0xb1367140)
06-05 18:35:02.092 V/PhoneStatusBar( 1711): setLightsOn(true)
06-05 18:35:02.118 D/EGL_emulation( 1711): eglMakeCurrent: 0xa5b6bd80: ver 2 0 (tinfo 0xb1367140)
06-05 18:35:02.120 I/WindowManager( 1629): Destroying surface Surface(name=com.evancharlton.mileage/com.evancharlton.mileage.Mileage) called by com.android.server.wm.WindowStateAnimator.destroySurface:2016 com.android.server.wm.WindowStateAnimator.destroySurfaceLocked:882 com.android.server.wm.WindowState.removeLocked:1456 com.android.server.wm.WindowManagerService.removeWindowInnerLocked:2484 com.android.server.wm.AppWindowToken.destroySurfaces:365 com.android.server.wm.WindowStateAnimator.finishExit:565 com.android.server.wm.AppWindowAnimator.stepAnimationLocked:427 com.android.server.wm.WindowAnimator.updateAppWindowsLocked:196 
06-05 18:35:02.121 D/EGL_emulation( 1711): eglMakeCurrent: 0xa5b6bd80: ver 2 0 (tinfo 0xb1367140)
06-05 18:35:02.122 D/EGL_emulation( 1711): eglMakeCurrent: 0xa5b6bd80: ver 2 0 (tinfo 0xb1367140)
06-05 18:35:02.123 D/EGL_emulation( 1711): eglMakeCurrent: 0xa5b6bd80: ver 2 0 (tinfo 0xb1367140)
06-05 18:35:02.124 V/PhoneStatusBar( 1711): setLightsOn(true)
06-05 18:35:02.132 I/ActivityManager( 1629): Displayed com.evancharlton.mileage/.Mileage: +116ms
06-05 18:35:02.137 D/gralloc_ranchu( 1346): gralloc_alloc: Creating ashmem region of size 9023488
06-05 18:35:02.137 D/EGL_emulation( 1711): eglMakeCurrent: 0xa5b6bd80: ver 2 0 (tinfo 0xb1367140)
06-05 18:35:02.150 D/EGL_emulation( 1711): eglMakeCurrent: 0xa5b6bd80: ver 2 0 (tinfo 0xb1367140)
06-05 18:35:02.158 D/EGL_emulation( 1711): eglMakeCurrent: 0xa5b6bd80: ver 2 0 (tinfo 0xb1367140)
06-05 18:35:02.161 D/EGL_emulation( 1711): eglMakeCurrent: 0xa5b6bd80: ver 2 0 (tinfo 0xb1367140)
06-05 18:35:02.161 V/PhoneStatusBar( 1711): setLightsOn(true)
06-05 18:35:02.171 D/EGL_emulation( 1711): eglMakeCurrent: 0xa5b6bd80: ver 2 0 (tinfo 0xb1367140)
06-05 18:35:02.173 D/EGL_emulation( 1711): eglMakeCurrent: 0xa5b6bd80: ver 2 0 (tinfo 0xb1367140)
06-05 18:35:02.177 I/System.out( 6842): URI: //map
06-05 18:35:02.177 I/System.out( 6842): params: {json={"query":"* marked:'Statistics'","operation":{"method_name":"query","arguments":[]}}
06-05 18:35:02.177 I/System.out( 6842): }
06-05 18:35:02.187 D/EGL_emulation( 1711): eglMakeCurrent: 0xa5b6bd80: ver 2 0 (tinfo 0xb1367140)
06-05 18:35:02.189 D/EGL_emulation( 1711): eglMakeCurrent: 0xa5b6bd80: ver 2 0 (tinfo 0xb1367140)
06-05 18:35:02.190 W/ResourceType( 6842): No package identifier when getting name for resource number 0x00000001
06-05 18:35:02.202 I/System.out( 6842): URI: //gesture
06-05 18:35:02.202 I/System.out( 6842): params: {json={"query_timeout":5.0,"gestures":[{"query_string":"* marked:'Statistics'","touches":[{"x":50,"y":50,"offset_x":0,"offset_y":0,"wait":0.0,"time":0.2,"release":true,"query_string":null}]}]}
06-05 18:35:02.202 I/System.out( 6842): }
06-05 18:35:02.204 D/EGL_emulation( 1711): eglMakeCurrent: 0xa5b6bd80: ver 2 0 (tinfo 0xb1367140)
06-05 18:35:02.206 D/EGL_emulation( 1711): eglMakeCurrent: 0xa5b6bd80: ver 2 0 (tinfo 0xb1367140)
06-05 18:35:02.206 W/ResourceType( 6842): No package identifier when getting name for resource number 0x00000001
06-05 18:35:02.221 D/EGL_emulation( 1711): eglMakeCurrent: 0xa5b6bd80: ver 2 0 (tinfo 0xb1367140)
06-05 18:35:02.228 D/EGL_emulation( 1711): eglMakeCurrent: 0xa5b6bd80: ver 2 0 (tinfo 0xb1367140)
06-05 18:35:02.238 D/EGL_emulation( 1711): eglMakeCurrent: 0xa5b6bd80: ver 2 0 (tinfo 0xb1367140)
06-05 18:35:02.243 D/EGL_emulation( 1711): eglMakeCurrent: 0xa5b6bd80: ver 2 0 (tinfo 0xb1367140)
06-05 18:35:02.254 D/EGL_emulation( 1711): eglMakeCurrent: 0xa5b6bd80: ver 2 0 (tinfo 0xb1367140)
06-05 18:35:02.256 D/EGL_emulation( 1711): eglMakeCurrent: 0xa5b6bd80: ver 2 0 (tinfo 0xb1367140)
06-05 18:35:02.271 D/EGL_emulation( 1711): eglMakeCurrent: 0xa5b6bd80: ver 2 0 (tinfo 0xb1367140)
06-05 18:35:02.273 D/EGL_emulation( 1711): eglMakeCurrent: 0xa5b6bd80: ver 2 0 (tinfo 0xb1367140)
06-05 18:35:02.288 D/EGL_emulation( 1711): eglMakeCurrent: 0xa5b6bd80: ver 2 0 (tinfo 0xb1367140)
06-05 18:35:02.321 I/WindowManager( 1629): Destroying surface Surface(name=Starting com.evancharlton.mileage) called by com.android.server.wm.WindowStateAnimator.destroySurface:2016 com.android.server.wm.WindowStateAnimator.destroySurfaceLocked:882 com.android.server.wm.WindowState.destroyOrSaveSurface:2100 com.android.server.wm.AppWindowToken.destroySurfaces:363 com.android.server.wm.WindowStateAnimator.finishExit:565 com.android.server.wm.WindowStateAnimator.stepAnimationLocked:491 com.android.server.wm.WindowAnimator.updateWindowsLocked:303 com.android.server.wm.WindowAnimator.animateLocked:704 
06-05 18:35:02.326 V/PhoneStatusBar( 1711): setLightsOn(true)
06-05 18:35:02.331 V/PhoneStatusBar( 1711): setLightsOn(true)
06-05 18:35:02.444 I/calabash( 6842): newActivity1
06-05 18:35:02.469 I/System.out( 6842): URI: //map
06-05 18:35:02.469 I/System.out( 6842): params: {json={"query":"android.widget.ScrollView index:0","operation":{"method_name":"query","arguments":[]}}
06-05 18:35:02.469 I/System.out( 6842): }
06-05 18:35:02.477 W/ActivityManager( 1629): Bad activity token: android.os.BinderProxy@5a9fa7b
06-05 18:35:02.477 W/ActivityManager( 1629): java.lang.ClassCastException: android.os.BinderProxy cannot be cast to com.android.server.am.ActivityRecord$Token
06-05 18:35:02.477 W/ActivityManager( 1629): 	at com.android.server.am.ActivityRecord.forTokenLocked(ActivityRecord.java:586)
06-05 18:35:02.477 W/ActivityManager( 1629): 	at com.android.server.am.ActivityRecord.isInStackLocked(ActivityRecord.java:1327)
06-05 18:35:02.477 W/ActivityManager( 1629): 	at com.android.server.am.ActivityRecord.getStackLocked(ActivityRecord.java:1332)
06-05 18:35:02.477 W/ActivityManager( 1629): 	at com.android.server.am.ActivityManagerService.getActivityDisplayId(ActivityManagerService.java:9806)
06-05 18:35:02.477 W/ActivityManager( 1629): 	at android.app.ActivityManagerNative.onTransact(ActivityManagerNative.java:2566)
06-05 18:35:02.477 W/ActivityManager( 1629): 	at com.android.server.am.ActivityManagerService.onTransact(ActivityManagerService.java:2757)
06-05 18:35:02.477 W/ActivityManager( 1629): 	at android.os.Binder.execTransact(Binder.java:565)
06-05 18:35:02.478 W/ActivityManager( 1629): Bad activity token: android.os.BinderProxy@5a9fa7b
06-05 18:35:02.478 W/ActivityManager( 1629): java.lang.ClassCastException: android.os.BinderProxy cannot be cast to com.android.server.am.ActivityRecord$Token
06-05 18:35:02.478 W/ActivityManager( 1629): 	at com.android.server.am.ActivityRecord.forTokenLocked(ActivityRecord.java:586)
06-05 18:35:02.478 W/ActivityManager( 1629): 	at com.android.server.am.ActivityRecord.isInStackLocked(ActivityRecord.java:1327)
06-05 18:35:02.478 W/ActivityManager( 1629): 	at com.android.server.am.ActivityManagerService.setTaskDescription(ActivityManagerService.java:9358)
06-05 18:35:02.478 W/ActivityManager( 1629): 	at android.app.ActivityManagerNative.onTransact(ActivityManagerNative.java:2639)
06-05 18:35:02.478 W/ActivityManager( 1629): 	at com.android.server.am.ActivityManagerService.onTransact(ActivityManagerService.java:2757)
06-05 18:35:02.478 W/ActivityManager( 1629): 	at android.os.Binder.execTransact(Binder.java:565)
06-05 18:35:02.479 W/ActivityManager( 1629): Bad activity token: android.os.BinderProxy@5a9fa7b
06-05 18:35:02.479 W/ActivityManager( 1629): java.lang.ClassCastException: android.os.BinderProxy cannot be cast to com.android.server.am.ActivityRecord$Token
06-05 18:35:02.479 W/ActivityManager( 1629): 	at com.android.server.am.ActivityRecord.forTokenLocked(ActivityRecord.java:586)
06-05 18:35:02.479 W/ActivityManager( 1629): 	at com.android.server.am.ActivityRecord.isInStackLocked(ActivityRecord.java:1327)
06-05 18:35:02.479 W/ActivityManager( 1629): 	at com.android.server.am.ActivityRecord.getStackLocked(ActivityRecord.java:1332)
06-05 18:35:02.479 W/ActivityManager( 1629): 	at com.android.server.am.ActivityManagerService.getActivityStackId(ActivityManagerService.java:9817)
06-05 18:35:02.479 W/ActivityManager( 1629): 	at android.app.ActivityManagerNative.onTransact(ActivityManagerNative.java:2856)
06-05 18:35:02.479 W/ActivityManager( 1629): 	at com.android.server.am.ActivityManagerService.onTransact(ActivityManagerService.java:2757)
06-05 18:35:02.479 W/ActivityManager( 1629): 	at android.os.Binder.execTransact(Binder.java:565)
06-05 18:35:02.485 D/VehicleStatisticsActivity( 6842): Checking recalculation ...
06-05 18:35:02.485 D/VehicleStatisticsActivity( 6842): Recalculation not necessary.
06-05 18:35:02.486 W/ActivityManager( 1629): Bad activity token: android.os.BinderProxy@5a9fa7b
06-05 18:35:02.486 W/ActivityManager( 1629): java.lang.ClassCastException: android.os.BinderProxy cannot be cast to com.android.server.am.ActivityRecord$Token
06-05 18:35:02.486 W/ActivityManager( 1629): 	at com.android.server.am.ActivityRecord.forTokenLocked(ActivityRecord.java:586)
06-05 18:35:02.486 W/ActivityManager( 1629): 	at com.android.server.am.ActivityRecord.isInStackLocked(ActivityRecord.java:1327)
06-05 18:35:02.486 W/ActivityManager( 1629): 	at com.android.server.am.ActivityManagerService.getActivityOptions(ActivityManagerService.java:12559)
06-05 18:35:02.486 W/ActivityManager( 1629): 	at android.app.ActivityManagerNative.onTransact(ActivityManagerNative.java:1933)
06-05 18:35:02.486 W/ActivityManager( 1629): 	at com.android.server.am.ActivityManagerService.onTransact(ActivityManagerService.java:2757)
06-05 18:35:02.486 W/ActivityManager( 1629): 	at android.os.Binder.execTransact(Binder.java:565)
06-05 18:35:02.487 W/ActivityManager( 1629): Bad activity token: android.os.BinderProxy@5a9fa7b
06-05 18:35:02.487 W/ActivityManager( 1629): java.lang.ClassCastException: android.os.BinderProxy cannot be cast to com.android.server.am.ActivityRecord$Token
06-05 18:35:02.487 W/ActivityManager( 1629): 	at com.android.server.am.ActivityRecord.forTokenLocked(ActivityRecord.java:586)
06-05 18:35:02.487 W/ActivityManager( 1629): 	at com.android.server.am.ActivityRecord.isInStackLocked(ActivityRecord.java:1327)
06-05 18:35:02.487 W/ActivityManager( 1629): 	at com.android.server.am.ActivityManagerService.getActivityOptions(ActivityManagerService.java:12559)
06-05 18:35:02.487 W/ActivityManager( 1629): 	at android.app.ActivityManagerNative.onTransact(ActivityManagerNative.java:1933)
06-05 18:35:02.487 W/ActivityManager( 1629): 	at com.android.server.am.ActivityManagerService.onTransact(ActivityManagerService.java:2757)
06-05 18:35:02.487 W/ActivityManager( 1629): 	at android.os.Binder.execTransact(Binder.java:565)
06-05 18:35:02.488 D/VehicleStatisticsActivity( 6842): Checking recalculation ...
06-05 18:35:02.489 D/VehicleStatisticsActivity( 6842): Recalculation not necessary.
06-05 18:35:02.505 V/PhoneStatusBar( 1711): setLightsOn(true)
06-05 18:35:02.533 I/System.out( 6842): URI: //map
06-05 18:35:02.533 I/System.out( 6842): params: {json={"query":"android.widget.AbsListView index:0","operation":{"method_name":"query","arguments":[]}}
06-05 18:35:02.533 I/System.out( 6842): }
06-05 18:35:02.538 I/art     ( 6842): Do partial code cache collection, code=30KB, data=29KB
06-05 18:35:02.538 I/art     ( 6842): After code cache collection, code=29KB, data=29KB
06-05 18:35:02.538 I/art     ( 6842): Increasing code cache capacity to 128KB
06-05 18:35:02.547 I/System.out( 6842): URI: //map
06-05 18:35:02.547 I/System.out( 6842): params: {json={"query":"android.widget.AbsListView index:0","operation":{"method_name":"query","arguments":[]}}
06-05 18:35:02.547 I/System.out( 6842): }
06-05 18:35:02.560 I/System.out( 6842): URI: //map
06-05 18:35:02.560 I/System.out( 6842): params: {json={"query":"android.widget.AbsListView index:0","operation":{"method_name":"query","arguments":[]}}
06-05 18:35:02.560 I/System.out( 6842): }
06-05 18:35:02.573 I/System.out( 6842): URI: //map
06-05 18:35:02.573 I/System.out( 6842): params: {json={"query":"android.widget.AbsListView index:0","operation":{"method_name":"query","arguments":["getFirstVisiblePosition"]}}
06-05 18:35:02.573 I/System.out( 6842): }
06-05 18:35:02.584 I/System.out( 6842): URI: //map
06-05 18:35:02.584 I/System.out( 6842): params: {json={"query":"android.widget.AbsListView index:0","operation":{"method_name":"query","arguments":["getLastVisiblePosition"]}}
06-05 18:35:02.584 I/System.out( 6842): }
06-05 18:35:02.595 I/System.out( 6842): URI: //map
06-05 18:35:02.595 I/System.out( 6842): params: {json={"query":"android.widget.AbsListView index:0","operation":{"method_name":"query","arguments":[{"method_name":"setSelection","arguments":[26]}]}}
06-05 18:35:02.595 I/System.out( 6842): }
06-05 18:35:02.611 I/System.out( 6842): URI: //map
06-05 18:35:02.612 I/System.out( 6842): params: {json={"query":"* marked:'West'","operation":{"method_name":"query","arguments":[]}}
06-05 18:35:02.612 I/System.out( 6842): }
06-05 18:35:02.682 W/ResourceType( 6842): No package identifier when getting name for resource number 0x00000001
06-05 18:35:02.693 I/System.out( 6842): URI: //gesture
06-05 18:35:02.693 I/System.out( 6842): params: {json={"query_timeout":5.0,"gestures":[{"query_string":"* marked:'West'","touches":[{"x":50,"y":50,"offset_x":0,"offset_y":0,"wait":0.0,"time":0.2,"release":true,"query_string":null}]}]}
06-05 18:35:02.693 I/System.out( 6842): }
06-05 18:35:02.696 W/ResourceType( 6842): No package identifier when getting name for resource number 0x00000001
06-05 18:35:02.806 V/PhoneStatusBar( 1711): setLightsOn(true)
06-05 18:35:02.811 V/PhoneStatusBar( 1711): setLightsOn(true)
06-05 18:35:02.816 W/OpenGLRenderer( 2150): Incorrectly called buildLayer on View: ShortcutAndWidgetContainer, destroying layer...
06-05 18:35:02.828 V/PhoneStatusBar( 1711): setLightsOn(true)
06-05 18:35:02.847 I/WindowManager( 1629): Destroying surface Surface(name=com.android.launcher3/com.android.launcher3.Launcher) called by com.android.server.wm.WindowStateAnimator.destroySurface:2016 com.android.server.wm.WindowStateAnimator.destroySurfaceLocked:882 com.android.server.wm.WindowState.destroyOrSaveSurface:2100 com.android.server.wm.AppWindowToken.destroySurfaces:363 com.android.server.wm.AppWindowToken.notifyAppStopped:389 com.android.server.wm.WindowManagerService.notifyAppStopped:4463 com.android.server.am.ActivityStack.activityStoppedLocked:1252 com.android.server.am.ActivityManagerService.activityStopped:6903 
06-05 18:35:02.921 I/ActivityManager( 1629): START u0 {cmp=com.evancharlton.mileage/.charts.WestChart (has extras)} from uid 10160 on display 0
06-05 18:35:02.922 V/PhoneStatusBar( 1711): setLightsOn(true)
06-05 18:35:02.923 V/PhoneStatusBar( 1711): setLightsOn(true)
06-05 18:35:02.931 I/System.out( 6842): URI: //map
06-05 18:35:02.931 I/System.out( 6842): params: {json={"query":"* {text CONTAINS[c] 'Farthest west fillup'}","operation":{"method_name":"query","arguments":[]}}
06-05 18:35:02.931 I/System.out( 6842): }
06-05 18:35:02.969 I/calabash( 6842): newActivity1
06-05 18:35:02.973 W/aiCharts( 6842): License file is invalid or missing. 
06-05 18:35:02.973 W/aiCharts( 6842): Please place proper license.lic to /assets folder.
06-05 18:35:02.985 V/PhoneStatusBar( 1711): setLightsOn(true)
06-05 18:35:03.004 V/PhoneStatusBar( 1711): setLightsOn(true)
06-05 18:35:03.009 I/WindowManager( 1629): Destroying surface Surface(name=Creating chart…) called by com.android.server.wm.WindowStateAnimator.destroySurface:2016 com.android.server.wm.WindowStateAnimator.destroySurfaceLocked:882 com.android.server.wm.WindowState.removeLocked:1456 com.android.server.wm.WindowManagerService.removeWindowInnerLocked:2484 com.android.server.wm.WindowManagerService.removeWindowLocked:2442 com.android.server.wm.WindowManagerService.removeWindowLocked:2311 com.android.server.wm.WindowManagerService.removeWindow:2306 com.android.server.wm.Session.remove:202 
06-05 18:35:03.012 D/gralloc_ranchu( 1346): gralloc_alloc: Creating ashmem region of size 9023488
06-05 18:35:03.020 V/PhoneStatusBar( 1711): setLightsOn(true)
06-05 18:35:03.036 I/ActivityManager( 1629): Displayed com.evancharlton.mileage/.charts.WestChart: +69ms
06-05 18:35:03.037 V/PhoneStatusBar( 1711): setLightsOn(true)
06-05 18:35:03.070 V/PhoneStatusBar( 1711): setLightsOn(true)
06-05 18:35:03.088 V/PhoneStatusBar( 1711): setLightsOn(true)
06-05 18:35:03.272 V/PhoneStatusBar( 1711): setLightsOn(true)
06-05 18:35:03.301 I/System.out( 6842): URI: //map
06-05 18:35:03.301 I/System.out( 6842): params: {json={"query":"* {text CONTAINS[c] 'Farthest west fillup'}","operation":{"method_name":"query","arguments":[]}}
06-05 18:35:03.301 I/System.out( 6842): }
06-05 18:35:03.317 I/System.out( 6842): URI: //
06-05 18:35:03.317 I/System.out( 6842): params: {json={"command":"press_key","arguments":["KEYCODE_BACK"]}
06-05 18:35:03.317 I/System.out( 6842): }
06-05 18:35:03.317 I/System.out( 6842): header: {content-type=application/json;charset=utf-8, date=Fri, 05 Jun 2020 23:35:03 GMT, accept=*/*, host=127.0.0.1:34783, content-length=52, user-agent=HTTPClient/1.0 (2.8.3, ruby 2.5.1 (2018-03-29))}
06-05 18:35:03.317 I/System.out( 6842): params: {json={"command":"press_key","arguments":["KEYCODE_BACK"]}
06-05 18:35:03.317 I/System.out( 6842): }
06-05 18:35:03.317 I/System.out( 6842): ProP json = {"command":"press_key","arguments":["KEYCODE_BACK"]}
06-05 18:35:03.317 I/System.out( 6842): files: {}
06-05 18:35:03.317 I/System.out( 6842): command: {"command":"press_key","arguments":["KEYCODE_BACK"]}
06-05 18:35:03.317 I/InstrumentationBackend( 6842): Got command:'Command:'Line:null,press_key', arguments:'[KEYCODE_BACK]'
06-05 18:35:03.320 V/PhoneStatusBar( 1711): setLightsOn(true)
06-05 18:35:03.323 V/PhoneStatusBar( 1711): setLightsOn(true)
06-05 18:35:03.324 I/System.out( 6842): result:{"bonusInformation":[],"message":"","success":true}
06-05 18:35:03.324 I/art     ( 6842): Do partial code cache collection, code=60KB, data=62KB
06-05 18:35:03.325 I/art     ( 6842): After code cache collection, code=59KB, data=61KB
06-05 18:35:03.325 I/art     ( 6842): Increasing code cache capacity to 256KB
06-05 18:35:03.325 D/VehicleStatisticsActivity( 6842): Checking recalculation ...
06-05 18:35:03.326 D/VehicleStatisticsActivity( 6842): Recalculation not necessary.
06-05 18:35:03.327 I/System.out( 6842): URI: //map
06-05 18:35:03.327 I/System.out( 6842): params: {json={"query":"* {text CONTAINS[c] 'Statistics'}","operation":{"method_name":"query","arguments":[]}}
06-05 18:35:03.327 I/System.out( 6842): }
06-05 18:35:03.337 V/PhoneStatusBar( 1711): setLightsOn(true)
06-05 18:35:03.354 D/gralloc_ranchu( 1346): gralloc_alloc: Creating ashmem region of size 9023488
06-05 18:35:03.355 V/PhoneStatusBar( 1711): setLightsOn(true)
06-05 18:35:03.370 V/PhoneStatusBar( 1711): setLightsOn(true)
06-05 18:35:03.404 V/PhoneStatusBar( 1711): setLightsOn(true)
