--------- beginning of main
06-06 00:59:44.516 V/PhoneStatusBar( 1712): setLightsOn(true)
06-06 00:59:44.518 D/gralloc_ranchu( 1347): gralloc_alloc: Creating ashmem region of size 3145728
06-06 00:59:44.522 E/EGL_emulation( 1347): tid 1347: eglCreateSyncKHR(1901): error 0x3004 (EGL_BAD_ATTRIBUTE)
--------- beginning of system
06-06 00:59:44.531 W/ActivityManager( 1631): Finishing task with all activities already finished
06-06 00:59:44.531 W/ActivityManager( 1631): Duplicate finish request for ActivityRecord{993ca73 u0 com.evancharlton.mileage/.Mileage t10856 f}
06-06 00:59:44.532 W/ActivityManager( 1631): Finishing task with all activities already finished
06-06 00:59:44.532 W/ActivityManager( 1631): Duplicate finish request for ActivityRecord{993ca73 u0 com.evancharlton.mileage/.Mileage t10856 f}
06-06 00:59:44.532 W/ActivityManager( 1631): Finishing task with all activities already finished
06-06 00:59:44.532 W/ActivityManager( 1631): Duplicate finish request for ActivityRecord{993ca73 u0 com.evancharlton.mileage/.Mileage t10856 f}
06-06 00:59:44.532 W/ActivityManager( 1631): Finishing task with all activities already finished
06-06 00:59:44.532 W/ActivityManager( 1631): Duplicate finish request for ActivityRecord{993ca73 u0 com.evancharlton.mileage/.Mileage t10856 f}
06-06 00:59:44.532 W/ActivityManager( 1631): Finishing task with all activities already finished
06-06 00:59:44.532 W/ActivityManager( 1631): Duplicate finish request for ActivityRecord{993ca73 u0 com.evancharlton.mileage/.Mileage t10856 f}
06-06 00:59:44.532 W/ActivityManager( 1631): Finishing task with all activities already finished
06-06 00:59:44.532 W/ActivityManager( 1631): Duplicate finish request for ActivityRecord{64ad489 u0 com.evancharlton.mileage/.charts.NorthChart t10856 f}
06-06 00:59:44.532 W/ActivityManager( 1631): Finishing task with all activities already finished
06-06 00:59:44.532 W/ActivityManager( 1631): Duplicate finish request for ActivityRecord{64ad489 u0 com.evancharlton.mileage/.charts.NorthChart t10856 f}
06-06 00:59:44.532 W/ActivityManager( 1631): Finishing task with all activities already finished
06-06 00:59:44.532 W/ActivityManager( 1631): Duplicate finish request for ActivityRecord{993ca73 u0 com.evancharlton.mileage/.Mileage t10856 f}
06-06 00:59:44.532 W/ActivityManager( 1631): Finishing task with all activities already finished
06-06 00:59:44.532 W/ActivityManager( 1631): Duplicate finish request for ActivityRecord{993ca73 u0 com.evancharlton.mileage/.Mileage t10856 f}
06-06 00:59:44.553 D/EGL_emulation( 2076): eglMakeCurrent: 0xb0685360: ver 2 0 (tinfo 0xb06836b0)
06-06 00:59:44.567 D/EGL_emulation( 1712): eglMakeCurrent: 0xb0685360: ver 2 0 (tinfo 0xb06836c0)
06-06 00:59:44.583 D/EGL_emulation( 1712): eglMakeCurrent: 0xb0685360: ver 2 0 (tinfo 0xb06836c0)
06-06 00:59:44.586 D/EGL_emulation( 1712): eglMakeCurrent: 0xb0685360: ver 2 0 (tinfo 0xb06836c0)
06-06 00:59:44.600 D/EGL_emulation( 1712): eglMakeCurrent: 0xb0685360: ver 2 0 (tinfo 0xb06836c0)
06-06 00:59:44.602 D/EGL_emulation( 1712): eglMakeCurrent: 0xb0685360: ver 2 0 (tinfo 0xb06836c0)
06-06 00:59:44.617 D/EGL_emulation( 1712): eglMakeCurrent: 0xb0685360: ver 2 0 (tinfo 0xb06836c0)
06-06 00:59:44.618 D/EGL_emulation( 1712): eglMakeCurrent: 0xb0685360: ver 2 0 (tinfo 0xb06836c0)
06-06 00:59:44.633 D/EGL_emulation( 1712): eglMakeCurrent: 0xb0685360: ver 2 0 (tinfo 0xb06836c0)
06-06 00:59:44.634 D/EGL_emulation( 1712): eglMakeCurrent: 0xb0685360: ver 2 0 (tinfo 0xb06836c0)
06-06 00:59:44.650 D/EGL_emulation( 1712): eglMakeCurrent: 0xb0685360: ver 2 0 (tinfo 0xb06836c0)
06-06 00:59:44.652 D/EGL_emulation( 1712): eglMakeCurrent: 0xb0685360: ver 2 0 (tinfo 0xb06836c0)
06-06 00:59:44.666 D/EGL_emulation( 1712): eglMakeCurrent: 0xb0685360: ver 2 0 (tinfo 0xb06836c0)
06-06 00:59:44.668 D/EGL_emulation( 1712): eglMakeCurrent: 0xb0685360: ver 2 0 (tinfo 0xb06836c0)
06-06 00:59:44.678 D/AndroidRuntime(23977): >>>>>> START com.android.internal.os.RuntimeInit uid 2000 <<<<<<
06-06 00:59:44.679 D/AndroidRuntime(23977): CheckJNI is ON
06-06 00:59:44.683 D/EGL_emulation( 1712): eglMakeCurrent: 0xb0685360: ver 2 0 (tinfo 0xb06836c0)
06-06 00:59:44.685 D/EGL_emulation( 1712): eglMakeCurrent: 0xb0685360: ver 2 0 (tinfo 0xb06836c0)
06-06 00:59:44.690 W/art     (23977): Unexpected CPU variant for X86 using defaults: x86
06-06 00:59:44.692 D/ICU     (23977): No timezone override file found: /data/misc/zoneinfo/current/icu/icu_tzdata.dat
06-06 00:59:44.698 E/memtrack(23977): Couldn't load memtrack module (No such file or directory)
06-06 00:59:44.698 E/android.os.Debug(23977): failed to load memtrack module: -2
06-06 00:59:44.699 I/Radio-JNI(23977): register_android_hardware_Radio DONE
06-06 00:59:44.700 D/EGL_emulation( 1712): eglMakeCurrent: 0xb0685360: ver 2 0 (tinfo 0xb06836c0)
06-06 00:59:44.701 D/EGL_emulation( 1712): eglMakeCurrent: 0xb0685360: ver 2 0 (tinfo 0xb06836c0)
06-06 00:59:44.703 D/AndroidRuntime(23977): Calling main entry com.android.commands.am.Am
06-06 00:59:44.704 I/ActivityManager( 1631): Force stopping com.evancharlton.mileage appid=10374 user=0: start instr
06-06 00:59:44.704 I/ActivityManager( 1631): Killing 23925:com.evancharlton.mileage/u0a374 (adj 0): stop com.evancharlton.mileage
06-06 00:59:44.704 D/ActivityManager( 1631): cleanUpApplicationRecord -- 23925
06-06 00:59:44.704 W/ActivityManager( 1631): Crash of app com.evancharlton.mileage running instrumentation ComponentInfo{com.evancharlton.mileage.test/sh.calaba.instrumentationbackend.CalabashInstrumentationTestRunner}
06-06 00:59:44.704 I/ActivityManager( 1631): Force stopping com.evancharlton.mileage appid=10374 user=0: finished inst
06-06 00:59:44.706 W/InputDispatcher( 1631): channel 'fde64cb com.evancharlton.mileage/com.evancharlton.mileage.charts.NorthChart (server)' ~ Consumer closed input channel or an error occurred.  events=0x9
06-06 00:59:44.706 E/InputDispatcher( 1631): channel 'fde64cb com.evancharlton.mileage/com.evancharlton.mileage.charts.NorthChart (server)' ~ Channel is unrecoverably broken and will be disposed!
06-06 00:59:44.706 W/InputDispatcher( 1631): channel 'f638bea com.evancharlton.mileage/com.evancharlton.mileage.Mileage (server)' ~ Consumer closed input channel or an error occurred.  events=0x9
06-06 00:59:44.706 E/InputDispatcher( 1631): channel 'f638bea com.evancharlton.mileage/com.evancharlton.mileage.Mileage (server)' ~ Channel is unrecoverably broken and will be disposed!
06-06 00:59:44.706 I/WindowManager( 1631): WIN DEATH: Window{f638bea u0 com.evancharlton.mileage/com.evancharlton.mileage.Mileage EXITING}
06-06 00:59:44.706 W/InputDispatcher( 1631): Attempted to unregister already unregistered input channel 'f638bea com.evancharlton.mileage/com.evancharlton.mileage.Mileage (server)'
06-06 00:59:44.707 I/art     (23987): Not late-enabling -Xcheck:jni (already on)
06-06 00:59:44.707 W/art     (23987): Unexpected CPU variant for X86 using defaults: x86
06-06 00:59:44.707 I/WindowManager( 1631): WIN DEATH: Window{fde64cb u0 com.evancharlton.mileage/com.evancharlton.mileage.charts.NorthChart EXITING}
06-06 00:59:44.707 W/InputDispatcher( 1631): Attempted to unregister already unregistered input channel 'fde64cb com.evancharlton.mileage/com.evancharlton.mileage.charts.NorthChart (server)'
06-06 00:59:44.715 I/ActivityManager( 1631): Start proc 23987:com.evancharlton.mileage/u0a374 for added application com.evancharlton.mileage
06-06 00:59:44.715 D/AndroidRuntime(23977): Shutting down VM
06-06 00:59:44.716 I/WindowManager( 1631): Destroying surface Surface(name=com.evancharlton.mileage/com.evancharlton.mileage.charts.NorthChart) called by com.android.server.wm.WindowStateAnimator.destroySurface:2016 com.android.server.wm.WindowStateAnimator.destroySurfaceLocked:882 com.android.server.wm.WindowState.removeLocked:1456 com.android.server.wm.WindowManagerService.removeWindowInnerLocked:2484 com.android.server.wm.AppWindowToken.destroySurfaces:365 com.android.server.wm.WindowStateAnimator.finishExit:565 com.android.server.wm.AppWindowAnimator.stepAnimationLocked:427 com.android.server.wm.WindowAnimator.updateAppWindowsLocked:176 
06-06 00:59:44.717 D/EGL_emulation( 1712): eglMakeCurrent: 0xb0685360: ver 2 0 (tinfo 0xb06836c0)
06-06 00:59:44.719 W/System  (23987): ClassLoader referenced unknown path: /data/app/com.evancharlton.mileage.test-1/lib/x86
06-06 00:59:44.719 W/System  (23987): ClassLoader referenced unknown path: /data/app/com.evancharlton.mileage-1/lib/x86
06-06 00:59:44.720 D/EGL_emulation( 1712): eglMakeCurrent: 0xb0685360: ver 2 0 (tinfo 0xb06836c0)
06-06 00:59:44.721 W/System  (23987): ClassLoader referenced unknown path: 
06-06 00:59:44.725 I/System.out(23987): Main activity name automatically set to: com.evancharlton.mileage.Mileage
06-06 00:59:44.725 I/System.out(23987): Calabash did not load Mono. This is only a problem if you are trying to test a Mono application
06-06 00:59:44.725 I/calabash(23987): Test server port: 7102
06-06 00:59:44.726 I/InstrumentationBackend(23987): Added:'GetPreferences', with key:'get_preferences'
06-06 00:59:44.729 I/InstrumentationBackend(23987): Added:'SetPreferences', with key:'set_preferences'
06-06 00:59:44.729 I/InstrumentationBackend(23987): Added:'ClearPreferences', with key:'clear_preferences'
06-06 00:59:44.729 I/InstrumentationBackend(23987): Added:'PressElement', with key:'press_l10n_element'
06-06 00:59:44.729 I/InstrumentationBackend(23987): Added:'WaitForElement', with key:'wait_for_l10n_element'
06-06 00:59:44.729 I/InstrumentationBackend(23987): Added:'NullAction', with key:'nullAction'
06-06 00:59:44.729 I/InstrumentationBackend(23987): Added:'PressKey', with key:'press_key'
06-06 00:59:44.729 I/InstrumentationBackend(23987): Added:'SetActivityOrientation', with key:'set_activity_orientation'
06-06 00:59:44.729 I/InstrumentationBackend(23987): Added:'GetActivityOrientation', with key:'get_activity_orientation'
06-06 00:59:44.729 I/InstrumentationBackend(23987): Added:'FakeGPSLocation', with key:'set_gps_coordinates'
06-06 00:59:44.729 I/InstrumentationBackend(23987): Added:'SetPropertyByCssSelector', with key:'set_property_by_css_selector'
06-06 00:59:44.729 I/InstrumentationBackend(23987): Added:'GetUrl', with key:'get_url'
06-06 00:59:44.730 I/InstrumentationBackend(23987): Added:'ScrollTo', with key:'scroll_to'
06-06 00:59:44.730 I/InstrumentationBackend(23987): Added:'GetLoadProgress', with key:'get_load_progress'
06-06 00:59:44.730 I/InstrumentationBackend(23987): Added:'DumpHtml', with key:'dump_html'
06-06 00:59:44.730 I/InstrumentationBackend(23987): Added:'DumpBodyHtml', with key:'dump_body_html'
06-06 00:59:44.730 I/InstrumentationBackend(23987): Added:'EnterTextByCssSelector', with key:'enter_text_by_selector'
06-06 00:59:44.730 I/InstrumentationBackend(23987): Added:'AndroidSDKVersion', with key:'android_sdk_version'
06-06 00:59:44.730 I/InstrumentationBackend(23987): Added:'Version', with key:'version'
06-06 00:59:44.730 I/InstrumentationBackend(23987): Added:'Drag', with key:'drag'
06-06 00:59:44.730 I/InstrumentationBackend(23987): Added:'TouchCoordinates', with key:'touch_coordinate'
06-06 00:59:44.730 I/InstrumentationBackend(23987): Added:'LongPressCoordinate', with key:'long_press_coordinate'
06-06 00:59:44.730 I/InstrumentationBackend(23987): Added:'DragCoordinates', with key:'drag_coordinates'
06-06 00:59:44.730 I/InstrumentationBackend(23987): Added:'ResumeApplication', with key:'resume_application'
06-06 00:59:44.730 I/InstrumentationBackend(23987): Added:'Swipe', with key:'swipe'
06-06 00:59:44.730 I/InstrumentationBackend(23987): Added:'DoubleTapCoordinate', with key:'double_tap_coordinate'
06-06 00:59:44.730 I/InstrumentationBackend(23987): Added:'ClickOnScreen', with key:'click_on_screen'
06-06 00:59:44.730 I/InstrumentationBackend(23987): Added:'GetActivityName', with key:'get_activity_name'
06-06 00:59:44.730 I/InstrumentationBackend(23987): Added:'ScrollToView', with key:'scroll_to_view'
06-06 00:59:44.730 I/InstrumentationBackend(23987): Added:'ViewConfiguration', with key:'view_configuration'
06-06 00:59:44.730 I/InstrumentationBackend(23987): Added:'IsCurrentActivityFocused', with key:'is_current_activity_focused'
06-06 00:59:44.730 I/InstrumentationBackend(23987): Added:'SendTcp', with key:'send_tcp'
06-06 00:59:44.730 I/InstrumentationBackend(23987): Added:'DpToDevicePixel', with key:'dp_to_device_pixel'
06-06 00:59:44.730 I/InstrumentationBackend(23987): Added:'KeyboardEnterText', with key:'keyboard_enter_text'
06-06 00:59:44.730 I/InstrumentationBackend(23987): Added:'DeleteSurroundingText', with key:'delete_surrounding_text'
06-06 00:59:44.730 I/InstrumentationBackend(23987): Added:'SetComposingRegion', with key:'set_composing_region'
06-06 00:59:44.731 I/InstrumentationBackend(23987): Added:'SetSelection', with key:'set_selection'
06-06 00:59:44.731 I/InstrumentationBackend(23987): Added:'KeyboardKeyEvent', with key:'keyboard_key_event'
06-06 00:59:44.731 I/InstrumentationBackend(23987): Added:'PressUserActionButton', with key:'press_user_action_button'
06-06 00:59:44.731 I/InstrumentationBackend(23987): Added:'HideSoftKeyboard', with key:'hide_soft_keyboard'
06-06 00:59:44.731 I/InstrumentationBackend(23987): Added:'ListActions', with key:'list_actions'
06-06 00:59:44.731 I/calabash(23987): Instantiating http server at 7102
06-06 00:59:44.731 I/System.out(23987): HTTP Daemon listening on: 7102
06-06 00:59:44.734 D/EGL_emulation( 1712): eglMakeCurrent: 0xb0685360: ver 2 0 (tinfo 0xb06836c0)
06-06 00:59:44.736 D/EGL_emulation( 1712): eglMakeCurrent: 0xb0685360: ver 2 0 (tinfo 0xb06836c0)
06-06 00:59:44.750 D/EGL_emulation( 1712): eglMakeCurrent: 0xb0685360: ver 2 0 (tinfo 0xb06836c0)
06-06 00:59:44.752 D/EGL_emulation( 1712): eglMakeCurrent: 0xb0685360: ver 2 0 (tinfo 0xb06836c0)
06-06 00:59:44.768 D/EGL_emulation( 1712): eglMakeCurrent: 0xb0685360: ver 2 0 (tinfo 0xb06836c0)
06-06 00:59:44.784 D/EGL_emulation( 1712): eglMakeCurrent: 0xb0685360: ver 2 0 (tinfo 0xb06836c0)
06-06 00:59:44.798 D/EGL_emulation( 1712): eglMakeCurrent: 0xb0685360: ver 2 0 (tinfo 0xb06836c0)
06-06 00:59:44.826 I/System.out(23987): URI: //ping
06-06 00:59:44.826 I/System.out(23987): params: {json={}
06-06 00:59:44.826 I/System.out(23987): }
06-06 00:59:44.832 I/System.out(23987): URI: //ping
06-06 00:59:44.832 I/System.out(23987): params: {json={}
06-06 00:59:44.832 I/System.out(23987): }
06-06 00:59:44.836 I/System.out(23987): URI: //ready
06-06 00:59:44.837 I/System.out(23987): params: {json={}
06-06 00:59:44.837 I/System.out(23987): }
06-06 00:59:44.840 I/System.out(23987): URI: //
06-06 00:59:44.840 I/System.out(23987): params: {json={"command":"version","arguments":[]}
06-06 00:59:44.840 I/System.out(23987): }
06-06 00:59:44.840 I/System.out(23987): header: {content-type=application/json;charset=utf-8, date=Sat, 06 Jun 2020 05:59:45 GMT, accept=*/*, host=127.0.0.1:34777, content-length=36, user-agent=HTTPClient/1.0 (2.8.3, ruby 2.5.1 (2018-03-29))}
06-06 00:59:44.840 I/System.out(23987): params: {json={"command":"version","arguments":[]}
06-06 00:59:44.840 I/System.out(23987): }
06-06 00:59:44.840 I/System.out(23987): ProP json = {"command":"version","arguments":[]}
06-06 00:59:44.840 I/System.out(23987): files: {}
06-06 00:59:44.840 I/System.out(23987): command: {"command":"version","arguments":[]}
06-06 00:59:44.846 I/InstrumentationBackend(23987): Got command:'Command:'Line:null,version', arguments:'[]'
06-06 00:59:44.857 I/System.out(23987): result:{"bonusInformation":[],"message":"0.9.8","success":true}
06-06 00:59:44.860 I/System.out(23987): URI: //start-application
06-06 00:59:44.860 I/System.out(23987): params: {json={"intent":null}
06-06 00:59:44.860 I/System.out(23987): }
06-06 00:59:44.870 I/ActivityManager( 1631): START u0 {act=android.intent.action.MAIN cat=[android.intent.category.LAUNCHER] flg=0x10200000 cmp=com.evancharlton.mileage/.Mileage} from uid 10374 on display 0
06-06 00:59:44.875 I/calabash(23987): newActivity1
06-06 00:59:44.882 I/calabash(23987): newActivity1
06-06 00:59:44.883 W/ActivityManager( 1631): Bad activity token: android.os.BinderProxy@89624ab
06-06 00:59:44.883 W/ActivityManager( 1631): java.lang.ClassCastException: android.os.BinderProxy cannot be cast to com.android.server.am.ActivityRecord$Token
06-06 00:59:44.883 W/ActivityManager( 1631): 	at com.android.server.am.ActivityRecord.forTokenLocked(ActivityRecord.java:586)
06-06 00:59:44.883 W/ActivityManager( 1631): 	at com.android.server.am.ActivityRecord.isInStackLocked(ActivityRecord.java:1327)
06-06 00:59:44.883 W/ActivityManager( 1631): 	at com.android.server.am.ActivityRecord.getStackLocked(ActivityRecord.java:1332)
06-06 00:59:44.883 W/ActivityManager( 1631): 	at com.android.server.am.ActivityManagerService.getActivityDisplayId(ActivityManagerService.java:9806)
06-06 00:59:44.883 W/ActivityManager( 1631): 	at android.app.ActivityManagerNative.onTransact(ActivityManagerNative.java:2566)
06-06 00:59:44.883 W/ActivityManager( 1631): 	at com.android.server.am.ActivityManagerService.onTransact(ActivityManagerService.java:2757)
06-06 00:59:44.883 W/ActivityManager( 1631): 	at android.os.Binder.execTransact(Binder.java:565)
06-06 00:59:44.884 W/ActivityManager( 1631): Bad activity token: android.os.BinderProxy@89624ab
06-06 00:59:44.884 W/ActivityManager( 1631): java.lang.ClassCastException: android.os.BinderProxy cannot be cast to com.android.server.am.ActivityRecord$Token
06-06 00:59:44.884 W/ActivityManager( 1631): 	at com.android.server.am.ActivityRecord.forTokenLocked(ActivityRecord.java:586)
06-06 00:59:44.884 W/ActivityManager( 1631): 	at com.android.server.am.ActivityRecord.isInStackLocked(ActivityRecord.java:1327)
06-06 00:59:44.884 W/ActivityManager( 1631): 	at com.android.server.am.ActivityManagerService.setTaskDescription(ActivityManagerService.java:9358)
06-06 00:59:44.884 W/ActivityManager( 1631): 	at android.app.ActivityManagerNative.onTransact(ActivityManagerNative.java:2639)
06-06 00:59:44.884 W/ActivityManager( 1631): 	at com.android.server.am.ActivityManagerService.onTransact(ActivityManagerService.java:2757)
06-06 00:59:44.884 W/ActivityManager( 1631): 	at android.os.Binder.execTransact(Binder.java:565)
06-06 00:59:44.884 W/ActivityManager( 1631): Bad activity token: android.os.BinderProxy@89624ab
06-06 00:59:44.884 W/ActivityManager( 1631): java.lang.ClassCastException: android.os.BinderProxy cannot be cast to com.android.server.am.ActivityRecord$Token
06-06 00:59:44.884 W/ActivityManager( 1631): 	at com.android.server.am.ActivityRecord.forTokenLocked(ActivityRecord.java:586)
06-06 00:59:44.884 W/ActivityManager( 1631): 	at com.android.server.am.ActivityRecord.isInStackLocked(ActivityRecord.java:1327)
06-06 00:59:44.884 W/ActivityManager( 1631): 	at com.android.server.am.ActivityRecord.getStackLocked(ActivityRecord.java:1332)
06-06 00:59:44.884 W/ActivityManager( 1631): 	at com.android.server.am.ActivityManagerService.getActivityStackId(ActivityManagerService.java:9817)
06-06 00:59:44.884 W/ActivityManager( 1631): 	at android.app.ActivityManagerNative.onTransact(ActivityManagerNative.java:2856)
06-06 00:59:44.884 W/ActivityManager( 1631): 	at com.android.server.am.ActivityManagerService.onTransact(ActivityManagerService.java:2757)
06-06 00:59:44.884 W/ActivityManager( 1631): 	at android.os.Binder.execTransact(Binder.java:565)
06-06 00:59:44.897 W/ActivityManager( 1631): Bad activity token: android.os.BinderProxy@89624ab
06-06 00:59:44.897 W/ActivityManager( 1631): java.lang.ClassCastException: android.os.BinderProxy cannot be cast to com.android.server.am.ActivityRecord$Token
06-06 00:59:44.897 W/ActivityManager( 1631): 	at com.android.server.am.ActivityRecord.forTokenLocked(ActivityRecord.java:586)
06-06 00:59:44.897 W/ActivityManager( 1631): 	at com.android.server.am.ActivityRecord.isInStackLocked(ActivityRecord.java:1327)
06-06 00:59:44.897 W/ActivityManager( 1631): 	at com.android.server.am.ActivityManagerService.getActivityOptions(ActivityManagerService.java:12559)
06-06 00:59:44.897 W/ActivityManager( 1631): 	at android.app.ActivityManagerNative.onTransact(ActivityManagerNative.java:1933)
06-06 00:59:44.897 W/ActivityManager( 1631): 	at com.android.server.am.ActivityManagerService.onTransact(ActivityManagerService.java:2757)
06-06 00:59:44.897 W/ActivityManager( 1631): 	at android.os.Binder.execTransact(Binder.java:565)
06-06 00:59:44.897 W/ActivityManager( 1631): Bad activity token: android.os.BinderProxy@89624ab
06-06 00:59:44.897 W/ActivityManager( 1631): java.lang.ClassCastException: android.os.BinderProxy cannot be cast to com.android.server.am.ActivityRecord$Token
06-06 00:59:44.897 W/ActivityManager( 1631): 	at com.android.server.am.ActivityRecord.forTokenLocked(ActivityRecord.java:586)
06-06 00:59:44.897 W/ActivityManager( 1631): 	at com.android.server.am.ActivityRecord.isInStackLocked(ActivityRecord.java:1327)
06-06 00:59:44.897 W/ActivityManager( 1631): 	at com.android.server.am.ActivityManagerService.getActivityOptions(ActivityManagerService.java:12559)
06-06 00:59:44.897 W/ActivityManager( 1631): 	at android.app.ActivityManagerNative.onTransact(ActivityManagerNative.java:1933)
06-06 00:59:44.897 W/ActivityManager( 1631): 	at com.android.server.am.ActivityManagerService.onTransact(ActivityManagerService.java:2757)
06-06 00:59:44.897 W/ActivityManager( 1631): 	at android.os.Binder.execTransact(Binder.java:565)
06-06 00:59:44.900 D/gralloc_ranchu( 1347): gralloc_alloc: Creating ashmem region of size 9023488
06-06 00:59:44.922 V/PhoneStatusBar( 1712): setLightsOn(true)
06-06 00:59:44.933 D/EGL_emulation( 1712): eglMakeCurrent: 0xb0685360: ver 2 0 (tinfo 0xb06836c0)
06-06 00:59:44.934 V/PhoneStatusBar( 1712): setLightsOn(true)
06-06 00:59:44.935 V/PhoneStatusBar( 1712): setLightsOn(true)
06-06 00:59:44.936 D/gralloc_ranchu( 1347): gralloc_alloc: Creating ashmem region of size 9023488
06-06 00:59:44.938 V/PhoneStatusBar( 1712): setLightsOn(true)
06-06 00:59:44.940 D/        (23987): HostConnection::get() New Host Connection established 0x9401b0c0, tid 23987
06-06 00:59:44.969 D/EGL_emulation( 1712): eglMakeCurrent: 0xb0685360: ver 2 0 (tinfo 0xb06836c0)
06-06 00:59:44.969 D/EGL_emulation( 2076): eglMakeCurrent: 0xb0685360: ver 2 0 (tinfo 0xb06836b0)
06-06 00:59:44.973 D/EGL_emulation( 1712): eglMakeCurrent: 0xb0685360: ver 2 0 (tinfo 0xb06836c0)
06-06 00:59:44.974 D/EGL_emulation( 1712): eglMakeCurrent: 0xb0685360: ver 2 0 (tinfo 0xb06836c0)
06-06 00:59:44.975 D/EGL_emulation( 1712): eglMakeCurrent: 0xb0685360: ver 2 0 (tinfo 0xb06836c0)
06-06 00:59:44.984 D/EGL_emulation( 1712): eglMakeCurrent: 0xb0685360: ver 2 0 (tinfo 0xb06836c0)
06-06 00:59:44.985 I/WindowManager( 1631): Destroying surface Surface(name=com.evancharlton.mileage/com.evancharlton.mileage.Mileage) called by com.android.server.wm.WindowStateAnimator.destroySurface:2016 com.android.server.wm.WindowStateAnimator.destroySurfaceLocked:882 com.android.server.wm.WindowState.removeLocked:1456 com.android.server.wm.WindowManagerService.removeWindowInnerLocked:2484 com.android.server.wm.AppWindowToken.destroySurfaces:365 com.android.server.wm.WindowStateAnimator.finishExit:565 com.android.server.wm.AppWindowAnimator.stepAnimationLocked:427 com.android.server.wm.WindowAnimator.updateAppWindowsLocked:196 
06-06 00:59:44.985 D/gralloc_ranchu( 1347): gralloc_alloc: Creating ashmem region of size 9023488
06-06 00:59:44.985 D/EGL_emulation( 1712): eglMakeCurrent: 0xb0685360: ver 2 0 (tinfo 0xb06836c0)
06-06 00:59:44.987 I/ActivityManager( 1631): Displayed com.evancharlton.mileage/.Mileage: +115ms
06-06 00:59:45.007 D/EGL_emulation( 1712): eglMakeCurrent: 0xb0685360: ver 2 0 (tinfo 0xb06836c0)
06-06 00:59:45.010 D/EGL_emulation( 1712): eglMakeCurrent: 0xb0685360: ver 2 0 (tinfo 0xb06836c0)
06-06 00:59:45.010 V/PhoneStatusBar( 1712): setLightsOn(true)
06-06 00:59:45.020 D/EGL_emulation( 1712): eglMakeCurrent: 0xb0685360: ver 2 0 (tinfo 0xb06836c0)
06-06 00:59:45.022 D/EGL_emulation( 1712): eglMakeCurrent: 0xb0685360: ver 2 0 (tinfo 0xb06836c0)
06-06 00:59:45.026 I/System.out(23987): URI: //map
06-06 00:59:45.026 I/System.out(23987): params: {json={"query":"* marked:'Statistics'","operation":{"method_name":"query","arguments":[]}}
06-06 00:59:45.026 I/System.out(23987): }
06-06 00:59:45.034 D/EGL_emulation( 1712): eglMakeCurrent: 0xb0685360: ver 2 0 (tinfo 0xb06836c0)
06-06 00:59:45.035 D/EGL_emulation( 1712): eglMakeCurrent: 0xb0685360: ver 2 0 (tinfo 0xb06836c0)
06-06 00:59:45.040 W/ResourceType(23987): No package identifier when getting name for resource number 0x00000001
06-06 00:59:45.050 D/EGL_emulation( 1712): eglMakeCurrent: 0xb0685360: ver 2 0 (tinfo 0xb06836c0)
06-06 00:59:45.052 D/EGL_emulation( 1712): eglMakeCurrent: 0xb0685360: ver 2 0 (tinfo 0xb06836c0)
06-06 00:59:45.055 I/System.out(23987): URI: //gesture
06-06 00:59:45.055 I/System.out(23987): params: {json={"query_timeout":5.0,"gestures":[{"query_string":"* marked:'Statistics'","touches":[{"x":50,"y":50,"offset_x":0,"offset_y":0,"wait":0.0,"time":0.2,"release":true,"query_string":null}]}]}
06-06 00:59:45.055 I/System.out(23987): }
06-06 00:59:45.059 W/ResourceType(23987): No package identifier when getting name for resource number 0x00000001
06-06 00:59:45.074 D/EGL_emulation( 1712): eglMakeCurrent: 0xb0685360: ver 2 0 (tinfo 0xb06836c0)
06-06 00:59:45.077 D/EGL_emulation( 1712): eglMakeCurrent: 0xb0685360: ver 2 0 (tinfo 0xb06836c0)
06-06 00:59:45.088 D/EGL_emulation( 1712): eglMakeCurrent: 0xb0685360: ver 2 0 (tinfo 0xb06836c0)
06-06 00:59:45.093 D/EGL_emulation( 1712): eglMakeCurrent: 0xb0685360: ver 2 0 (tinfo 0xb06836c0)
06-06 00:59:45.100 D/EGL_emulation( 1712): eglMakeCurrent: 0xb0685360: ver 2 0 (tinfo 0xb06836c0)
06-06 00:59:45.102 D/EGL_emulation( 1712): eglMakeCurrent: 0xb0685360: ver 2 0 (tinfo 0xb06836c0)
06-06 00:59:45.117 D/EGL_emulation( 1712): eglMakeCurrent: 0xb0685360: ver 2 0 (tinfo 0xb06836c0)
06-06 00:59:45.119 D/EGL_emulation( 1712): eglMakeCurrent: 0xb0685360: ver 2 0 (tinfo 0xb06836c0)
06-06 00:59:45.133 D/EGL_emulation( 1712): eglMakeCurrent: 0xb0685360: ver 2 0 (tinfo 0xb06836c0)
06-06 00:59:45.135 D/EGL_emulation( 1712): eglMakeCurrent: 0xb0685360: ver 2 0 (tinfo 0xb06836c0)
06-06 00:59:45.150 D/EGL_emulation( 1712): eglMakeCurrent: 0xb0685360: ver 2 0 (tinfo 0xb06836c0)
06-06 00:59:45.154 D/EGL_emulation( 1712): eglMakeCurrent: 0xb0685360: ver 2 0 (tinfo 0xb06836c0)
06-06 00:59:45.169 D/EGL_emulation( 1712): eglMakeCurrent: 0xb0685360: ver 2 0 (tinfo 0xb06836c0)
06-06 00:59:45.184 I/WindowManager( 1631): Destroying surface Surface(name=Starting com.evancharlton.mileage) called by com.android.server.wm.WindowStateAnimator.destroySurface:2016 com.android.server.wm.WindowStateAnimator.destroySurfaceLocked:882 com.android.server.wm.WindowState.destroyOrSaveSurface:2100 com.android.server.wm.AppWindowToken.destroySurfaces:363 com.android.server.wm.WindowStateAnimator.finishExit:565 com.android.server.wm.WindowStateAnimator.stepAnimationLocked:491 com.android.server.wm.WindowAnimator.updateWindowsLocked:303 com.android.server.wm.WindowAnimator.animateLocked:704 
06-06 00:59:45.189 V/PhoneStatusBar( 1712): setLightsOn(true)
06-06 00:59:45.194 V/PhoneStatusBar( 1712): setLightsOn(true)
06-06 00:59:45.286 I/calabash(23987): newActivity1
06-06 00:59:45.296 I/System.out(23987): URI: //map
06-06 00:59:45.296 I/System.out(23987): params: {json={"query":"android.widget.ScrollView index:0","operation":{"method_name":"query","arguments":[]}}
06-06 00:59:45.296 I/System.out(23987): }
06-06 00:59:45.302 W/ActivityManager( 1631): Bad activity token: android.os.BinderProxy@b397e4d
06-06 00:59:45.302 W/ActivityManager( 1631): java.lang.ClassCastException: android.os.BinderProxy cannot be cast to com.android.server.am.ActivityRecord$Token
06-06 00:59:45.302 W/ActivityManager( 1631): 	at com.android.server.am.ActivityRecord.forTokenLocked(ActivityRecord.java:586)
06-06 00:59:45.302 W/ActivityManager( 1631): 	at com.android.server.am.ActivityRecord.isInStackLocked(ActivityRecord.java:1327)
06-06 00:59:45.302 W/ActivityManager( 1631): 	at com.android.server.am.ActivityRecord.getStackLocked(ActivityRecord.java:1332)
06-06 00:59:45.302 W/ActivityManager( 1631): 	at com.android.server.am.ActivityManagerService.getActivityDisplayId(ActivityManagerService.java:9806)
06-06 00:59:45.302 W/ActivityManager( 1631): 	at android.app.ActivityManagerNative.onTransact(ActivityManagerNative.java:2566)
06-06 00:59:45.302 W/ActivityManager( 1631): 	at com.android.server.am.ActivityManagerService.onTransact(ActivityManagerService.java:2757)
06-06 00:59:45.302 W/ActivityManager( 1631): 	at android.os.Binder.execTransact(Binder.java:565)
06-06 00:59:45.303 W/ActivityManager( 1631): Bad activity token: android.os.BinderProxy@b397e4d
06-06 00:59:45.303 W/ActivityManager( 1631): java.lang.ClassCastException: android.os.BinderProxy cannot be cast to com.android.server.am.ActivityRecord$Token
06-06 00:59:45.303 W/ActivityManager( 1631): 	at com.android.server.am.ActivityRecord.forTokenLocked(ActivityRecord.java:586)
06-06 00:59:45.303 W/ActivityManager( 1631): 	at com.android.server.am.ActivityRecord.isInStackLocked(ActivityRecord.java:1327)
06-06 00:59:45.303 W/ActivityManager( 1631): 	at com.android.server.am.ActivityManagerService.setTaskDescription(ActivityManagerService.java:9358)
06-06 00:59:45.303 W/ActivityManager( 1631): 	at android.app.ActivityManagerNative.onTransact(ActivityManagerNative.java:2639)
06-06 00:59:45.303 W/ActivityManager( 1631): 	at com.android.server.am.ActivityManagerService.onTransact(ActivityManagerService.java:2757)
06-06 00:59:45.303 W/ActivityManager( 1631): 	at android.os.Binder.execTransact(Binder.java:565)
06-06 00:59:45.304 W/ActivityManager( 1631): Bad activity token: android.os.BinderProxy@b397e4d
06-06 00:59:45.304 W/ActivityManager( 1631): java.lang.ClassCastException: android.os.BinderProxy cannot be cast to com.android.server.am.ActivityRecord$Token
06-06 00:59:45.304 W/ActivityManager( 1631): 	at com.android.server.am.ActivityRecord.forTokenLocked(ActivityRecord.java:586)
06-06 00:59:45.304 W/ActivityManager( 1631): 	at com.android.server.am.ActivityRecord.isInStackLocked(ActivityRecord.java:1327)
06-06 00:59:45.304 W/ActivityManager( 1631): 	at com.android.server.am.ActivityRecord.getStackLocked(ActivityRecord.java:1332)
06-06 00:59:45.304 W/ActivityManager( 1631): 	at com.android.server.am.ActivityManagerService.getActivityStackId(ActivityManagerService.java:9817)
06-06 00:59:45.304 W/ActivityManager( 1631): 	at android.app.ActivityManagerNative.onTransact(ActivityManagerNative.java:2856)
06-06 00:59:45.304 W/ActivityManager( 1631): 	at com.android.server.am.ActivityManagerService.onTransact(ActivityManagerService.java:2757)
06-06 00:59:45.304 W/ActivityManager( 1631): 	at android.os.Binder.execTransact(Binder.java:565)
06-06 00:59:45.309 D/VehicleStatisticsActivity(23987): Checking recalculation ...
06-06 00:59:45.310 D/VehicleStatisticsActivity(23987): Recalculation not necessary.
06-06 00:59:45.312 W/ActivityManager( 1631): Bad activity token: android.os.BinderProxy@b397e4d
06-06 00:59:45.312 W/ActivityManager( 1631): java.lang.ClassCastException: android.os.BinderProxy cannot be cast to com.android.server.am.ActivityRecord$Token
06-06 00:59:45.312 W/ActivityManager( 1631): 	at com.android.server.am.ActivityRecord.forTokenLocked(ActivityRecord.java:586)
06-06 00:59:45.312 W/ActivityManager( 1631): 	at com.android.server.am.ActivityRecord.isInStackLocked(ActivityRecord.java:1327)
06-06 00:59:45.312 W/ActivityManager( 1631): 	at com.android.server.am.ActivityManagerService.getActivityOptions(ActivityManagerService.java:12559)
06-06 00:59:45.312 W/ActivityManager( 1631): 	at android.app.ActivityManagerNative.onTransact(ActivityManagerNative.java:1933)
06-06 00:59:45.312 W/ActivityManager( 1631): 	at com.android.server.am.ActivityManagerService.onTransact(ActivityManagerService.java:2757)
06-06 00:59:45.312 W/ActivityManager( 1631): 	at android.os.Binder.execTransact(Binder.java:565)
06-06 00:59:45.312 W/ActivityManager( 1631): Bad activity token: android.os.BinderProxy@b397e4d
06-06 00:59:45.312 W/ActivityManager( 1631): java.lang.ClassCastException: android.os.BinderProxy cannot be cast to com.android.server.am.ActivityRecord$Token
06-06 00:59:45.312 W/ActivityManager( 1631): 	at com.android.server.am.ActivityRecord.forTokenLocked(ActivityRecord.java:586)
06-06 00:59:45.312 W/ActivityManager( 1631): 	at com.android.server.am.ActivityRecord.isInStackLocked(ActivityRecord.java:1327)
06-06 00:59:45.312 W/ActivityManager( 1631): 	at com.android.server.am.ActivityManagerService.getActivityOptions(ActivityManagerService.java:12559)
06-06 00:59:45.312 W/ActivityManager( 1631): 	at android.app.ActivityManagerNative.onTransact(ActivityManagerNative.java:1933)
06-06 00:59:45.312 W/ActivityManager( 1631): 	at com.android.server.am.ActivityManagerService.onTransact(ActivityManagerService.java:2757)
06-06 00:59:45.312 W/ActivityManager( 1631): 	at android.os.Binder.execTransact(Binder.java:565)
06-06 00:59:45.314 D/VehicleStatisticsActivity(23987): Checking recalculation ...
06-06 00:59:45.314 D/VehicleStatisticsActivity(23987): Recalculation not necessary.
06-06 00:59:45.382 I/System.out(23987): URI: //map
06-06 00:59:45.382 I/System.out(23987): params: {json={"query":"android.widget.AbsListView index:0","operation":{"method_name":"query","arguments":[]}}
06-06 00:59:45.382 I/System.out(23987): }
06-06 00:59:45.384 V/PhoneStatusBar( 1712): setLightsOn(true)
06-06 00:59:45.389 I/art     (23987): Do partial code cache collection, code=30KB, data=29KB
06-06 00:59:45.389 I/art     (23987): After code cache collection, code=29KB, data=28KB
06-06 00:59:45.389 I/art     (23987): Increasing code cache capacity to 128KB
06-06 00:59:45.400 I/System.out(23987): URI: //map
06-06 00:59:45.400 I/System.out(23987): params: {json={"query":"android.widget.AbsListView index:0","operation":{"method_name":"query","arguments":[]}}
06-06 00:59:45.400 I/System.out(23987): }
06-06 00:59:45.419 I/System.out(23987): URI: //map
06-06 00:59:45.419 I/System.out(23987): params: {json={"query":"android.widget.AbsListView index:0","operation":{"method_name":"query","arguments":[]}}
06-06 00:59:45.419 I/System.out(23987): }
06-06 00:59:45.434 I/System.out(23987): URI: //map
06-06 00:59:45.434 I/System.out(23987): params: {json={"query":"android.widget.AbsListView index:0","operation":{"method_name":"query","arguments":["getFirstVisiblePosition"]}}
06-06 00:59:45.434 I/System.out(23987): }
06-06 00:59:45.447 I/System.out(23987): URI: //map
06-06 00:59:45.447 I/System.out(23987): params: {json={"query":"android.widget.AbsListView index:0","operation":{"method_name":"query","arguments":["getLastVisiblePosition"]}}
06-06 00:59:45.447 I/System.out(23987): }
06-06 00:59:45.464 I/System.out(23987): URI: //map
06-06 00:59:45.464 I/System.out(23987): params: {json={"query":"android.widget.AbsListView index:0","operation":{"method_name":"query","arguments":[{"method_name":"setSelection","arguments":[26]}]}}
06-06 00:59:45.464 I/System.out(23987): }
06-06 00:59:45.485 I/System.out(23987): URI: //map
06-06 00:59:45.485 I/System.out(23987): params: {json={"query":"* marked:'South'","operation":{"method_name":"query","arguments":[]}}
06-06 00:59:45.485 I/System.out(23987): }
06-06 00:59:45.556 D/gralloc_ranchu( 1347): gralloc_alloc: Creating ashmem region of size 9023488
06-06 00:59:45.622 W/ResourceType(23987): No package identifier when getting name for resource number 0x00000001
06-06 00:59:45.636 I/System.out(23987): URI: //gesture
06-06 00:59:45.636 I/System.out(23987): params: {json={"query_timeout":5.0,"gestures":[{"query_string":"* marked:'South'","touches":[{"x":50,"y":50,"offset_x":0,"offset_y":0,"wait":0.0,"time":0.2,"release":true,"query_string":null}]}]}
06-06 00:59:45.636 I/System.out(23987): }
06-06 00:59:45.641 W/ResourceType(23987): No package identifier when getting name for resource number 0x00000001
06-06 00:59:45.685 V/PhoneStatusBar( 1712): setLightsOn(true)
06-06 00:59:45.687 V/PhoneStatusBar( 1712): setLightsOn(true)
06-06 00:59:45.688 W/OpenGLRenderer( 2076): Incorrectly called buildLayer on View: ShortcutAndWidgetContainer, destroying layer...
06-06 00:59:45.701 I/WindowManager( 1631): Destroying surface Surface(name=com.android.launcher3/com.android.launcher3.Launcher) called by com.android.server.wm.WindowStateAnimator.destroySurface:2016 com.android.server.wm.WindowStateAnimator.destroySurfaceLocked:882 com.android.server.wm.WindowState.destroyOrSaveSurface:2100 com.android.server.wm.AppWindowToken.destroySurfaces:363 com.android.server.wm.AppWindowToken.notifyAppStopped:389 com.android.server.wm.WindowManagerService.notifyAppStopped:4463 com.android.server.am.ActivityStack.activityStoppedLocked:1252 com.android.server.am.ActivityManagerService.activityStopped:6903 
06-06 00:59:45.702 V/PhoneStatusBar( 1712): setLightsOn(true)
06-06 00:59:45.870 I/ActivityManager( 1631): START u0 {cmp=com.evancharlton.mileage/.charts.SouthChart (has extras)} from uid 10374 on display 0
06-06 00:59:45.875 V/PhoneStatusBar( 1712): setLightsOn(true)
06-06 00:59:45.878 V/PhoneStatusBar( 1712): setLightsOn(true)
06-06 00:59:45.922 I/System.out(23987): URI: //map
06-06 00:59:45.922 I/System.out(23987): params: {json={"query":"* {text CONTAINS[c] 'Farthest south fillup'}","operation":{"method_name":"query","arguments":[]}}
06-06 00:59:45.922 I/System.out(23987): }
06-06 00:59:45.969 I/calabash(23987): newActivity1
06-06 00:59:45.974 W/aiCharts(23987): License file is invalid or missing. 
06-06 00:59:45.974 W/aiCharts(23987): Please place proper license.lic to /assets folder.
06-06 00:59:46.003 V/PhoneStatusBar( 1712): setLightsOn(true)
06-06 00:59:46.033 V/PhoneStatusBar( 1712): setLightsOn(true)
06-06 00:59:46.041 I/WindowManager( 1631): Destroying surface Surface(name=Creating chart…) called by com.android.server.wm.WindowStateAnimator.destroySurface:2016 com.android.server.wm.WindowStateAnimator.destroySurfaceLocked:882 com.android.server.wm.WindowState.removeLocked:1456 com.android.server.wm.WindowManagerService.removeWindowInnerLocked:2484 com.android.server.wm.WindowManagerService.removeWindowLocked:2442 com.android.server.wm.WindowManagerService.removeWindowLocked:2311 com.android.server.wm.WindowManagerService.removeWindow:2306 com.android.server.wm.Session.remove:202 
06-06 00:59:46.045 D/gralloc_ranchu( 1347): gralloc_alloc: Creating ashmem region of size 9023488
06-06 00:59:46.050 V/PhoneStatusBar( 1712): setLightsOn(true)
06-06 00:59:46.082 I/ActivityManager( 1631): Displayed com.evancharlton.mileage/.charts.SouthChart: +119ms
06-06 00:59:46.087 V/PhoneStatusBar( 1712): setLightsOn(true)
06-06 00:59:46.117 V/PhoneStatusBar( 1712): setLightsOn(true)
06-06 00:59:46.133 V/PhoneStatusBar( 1712): setLightsOn(true)
06-06 00:59:46.317 V/PhoneStatusBar( 1712): setLightsOn(true)
06-06 00:59:46.326 I/System.out(23987): URI: //map
06-06 00:59:46.326 I/System.out(23987): params: {json={"query":"* {text CONTAINS[c] 'Farthest south fillup'}","operation":{"method_name":"query","arguments":[]}}
06-06 00:59:46.326 I/System.out(23987): }
06-06 00:59:46.341 I/System.out(23987): URI: //
06-06 00:59:46.341 I/System.out(23987): params: {json={"command":"press_key","arguments":["KEYCODE_BACK"]}
06-06 00:59:46.341 I/System.out(23987): }
06-06 00:59:46.341 I/System.out(23987): header: {content-type=application/json;charset=utf-8, date=Sat, 06 Jun 2020 05:59:46 GMT, accept=*/*, host=127.0.0.1:34777, content-length=52, user-agent=HTTPClient/1.0 (2.8.3, ruby 2.5.1 (2018-03-29))}
06-06 00:59:46.341 I/System.out(23987): params: {json={"command":"press_key","arguments":["KEYCODE_BACK"]}
06-06 00:59:46.341 I/System.out(23987): }
06-06 00:59:46.341 I/System.out(23987): ProP json = {"command":"press_key","arguments":["KEYCODE_BACK"]}
06-06 00:59:46.341 I/System.out(23987): files: {}
06-06 00:59:46.341 I/System.out(23987): command: {"command":"press_key","arguments":["KEYCODE_BACK"]}
06-06 00:59:46.342 I/InstrumentationBackend(23987): Got command:'Command:'Line:null,press_key', arguments:'[KEYCODE_BACK]'
06-06 00:59:46.345 V/PhoneStatusBar( 1712): setLightsOn(true)
06-06 00:59:46.348 V/PhoneStatusBar( 1712): setLightsOn(true)
06-06 00:59:46.349 I/art     (23987): Do partial code cache collection, code=60KB, data=62KB
06-06 00:59:46.349 I/art     (23987): After code cache collection, code=59KB, data=61KB
06-06 00:59:46.349 I/art     (23987): Increasing code cache capacity to 256KB
06-06 00:59:46.351 V/PhoneStatusBar( 1712): setLightsOn(true)
06-06 00:59:46.351 D/VehicleStatisticsActivity(23987): Checking recalculation ...
06-06 00:59:46.351 I/System.out(23987): result:{"bonusInformation":[],"message":"","success":true}
06-06 00:59:46.352 D/VehicleStatisticsActivity(23987): Recalculation not necessary.
06-06 00:59:46.354 I/System.out(23987): URI: //map
06-06 00:59:46.354 I/System.out(23987): params: {json={"query":"* {text CONTAINS[c] 'Statistics'}","operation":{"method_name":"query","arguments":[]}}
06-06 00:59:46.354 I/System.out(23987): }
06-06 00:59:46.366 V/PhoneStatusBar( 1712): setLightsOn(true)
06-06 00:59:46.383 D/gralloc_ranchu( 1347): gralloc_alloc: Creating ashmem region of size 9023488
06-06 00:59:46.383 V/PhoneStatusBar( 1712): setLightsOn(true)
06-06 00:59:46.400 V/PhoneStatusBar( 1712): setLightsOn(true)
06-06 00:59:46.433 V/PhoneStatusBar( 1712): setLightsOn(true)
