--------- beginning of main
06-05 23:01:16.266 V/PhoneStatusBar( 1712): setLightsOn(true)
06-05 23:01:16.269 D/gralloc_ranchu( 1347): gralloc_alloc: Creating ashmem region of size 3145728
06-05 23:01:16.276 E/EGL_emulation( 1347): tid 1347: eglCreateSyncKHR(1901): error 0x3004 (EGL_BAD_ATTRIBUTE)
--------- beginning of system
06-05 23:01:16.286 W/ActivityManager( 1631): Finishing task with all activities already finished
06-05 23:01:16.286 W/ActivityManager( 1631): Duplicate finish request for ActivityRecord{fa93d1f u0 com.evancharlton.mileage/.Mileage t9033 f}
06-05 23:01:16.286 W/ActivityManager( 1631): Finishing task with all activities already finished
06-05 23:01:16.286 W/ActivityManager( 1631): Duplicate finish request for ActivityRecord{fa93d1f u0 com.evancharlton.mileage/.Mileage t9033 f}
06-05 23:01:16.287 W/ActivityManager( 1631): Finishing task with all activities already finished
06-05 23:01:16.287 W/ActivityManager( 1631): Duplicate finish request for ActivityRecord{fa93d1f u0 com.evancharlton.mileage/.Mileage t9033 f}
06-05 23:01:16.287 W/ActivityManager( 1631): Finishing task with all activities already finished
06-05 23:01:16.287 W/ActivityManager( 1631): Duplicate finish request for ActivityRecord{fa93d1f u0 com.evancharlton.mileage/.Mileage t9033 f}
06-05 23:01:16.287 W/ActivityManager( 1631): Finishing task with all activities already finished
06-05 23:01:16.287 W/ActivityManager( 1631): Duplicate finish request for ActivityRecord{c98c391 u0 com.evancharlton.mileage/.charts.SouthChart t9033 f}
06-05 23:01:16.287 W/ActivityManager( 1631): Finishing task with all activities already finished
06-05 23:01:16.287 W/ActivityManager( 1631): Duplicate finish request for ActivityRecord{c98c391 u0 com.evancharlton.mileage/.charts.SouthChart t9033 f}
06-05 23:01:16.287 W/ActivityManager( 1631): Finishing task with all activities already finished
06-05 23:01:16.287 W/ActivityManager( 1631): Duplicate finish request for ActivityRecord{fa93d1f u0 com.evancharlton.mileage/.Mileage t9033 f}
06-05 23:01:16.287 W/ActivityManager( 1631): Finishing task with all activities already finished
06-05 23:01:16.287 W/ActivityManager( 1631): Duplicate finish request for ActivityRecord{fa93d1f u0 com.evancharlton.mileage/.Mileage t9033 f}
06-05 23:01:16.335 D/EGL_emulation( 2076): eglMakeCurrent: 0xb0685360: ver 2 0 (tinfo 0xb06836b0)
06-05 23:01:16.336 D/EGL_emulation( 1712): eglMakeCurrent: 0xb0685360: ver 2 0 (tinfo 0xb06836c0)
06-05 23:01:16.350 D/EGL_emulation( 1712): eglMakeCurrent: 0xb0685360: ver 2 0 (tinfo 0xb06836c0)
06-05 23:01:16.368 D/EGL_emulation( 1712): eglMakeCurrent: 0xb0685360: ver 2 0 (tinfo 0xb06836c0)
06-05 23:01:16.384 D/EGL_emulation( 1712): eglMakeCurrent: 0xb0685360: ver 2 0 (tinfo 0xb06836c0)
06-05 23:01:16.386 D/EGL_emulation( 1712): eglMakeCurrent: 0xb0685360: ver 2 0 (tinfo 0xb06836c0)
06-05 23:01:16.400 D/EGL_emulation( 1712): eglMakeCurrent: 0xb0685360: ver 2 0 (tinfo 0xb06836c0)
06-05 23:01:16.402 D/EGL_emulation( 1712): eglMakeCurrent: 0xb0685360: ver 2 0 (tinfo 0xb06836c0)
06-05 23:01:16.417 D/EGL_emulation( 1712): eglMakeCurrent: 0xb0685360: ver 2 0 (tinfo 0xb06836c0)
06-05 23:01:16.419 D/EGL_emulation( 1712): eglMakeCurrent: 0xb0685360: ver 2 0 (tinfo 0xb06836c0)
06-05 23:01:16.433 D/AndroidRuntime(13939): >>>>>> START com.android.internal.os.RuntimeInit uid 2000 <<<<<<
06-05 23:01:16.434 D/EGL_emulation( 1712): eglMakeCurrent: 0xb0685360: ver 2 0 (tinfo 0xb06836c0)
06-05 23:01:16.434 D/AndroidRuntime(13939): CheckJNI is ON
06-05 23:01:16.435 D/EGL_emulation( 1712): eglMakeCurrent: 0xb0685360: ver 2 0 (tinfo 0xb06836c0)
06-05 23:01:16.447 W/art     (13939): Unexpected CPU variant for X86 using defaults: x86
06-05 23:01:16.449 D/ICU     (13939): No timezone override file found: /data/misc/zoneinfo/current/icu/icu_tzdata.dat
06-05 23:01:16.450 D/EGL_emulation( 1712): eglMakeCurrent: 0xb0685360: ver 2 0 (tinfo 0xb06836c0)
06-05 23:01:16.452 D/EGL_emulation( 1712): eglMakeCurrent: 0xb0685360: ver 2 0 (tinfo 0xb06836c0)
06-05 23:01:16.457 E/memtrack(13939): Couldn't load memtrack module (No such file or directory)
06-05 23:01:16.457 E/android.os.Debug(13939): failed to load memtrack module: -2
06-05 23:01:16.458 I/Radio-JNI(13939): register_android_hardware_Radio DONE
06-05 23:01:16.462 D/AndroidRuntime(13939): Calling main entry com.android.commands.am.Am
06-05 23:01:16.463 I/ActivityManager( 1631): Force stopping com.evancharlton.mileage appid=10326 user=0: start instr
06-05 23:01:16.463 I/ActivityManager( 1631): Killing 13888:com.evancharlton.mileage/u0a326 (adj 0): stop com.evancharlton.mileage
06-05 23:01:16.463 D/ActivityManager( 1631): cleanUpApplicationRecord -- 13888
06-05 23:01:16.463 W/ActivityManager( 1631): Crash of app com.evancharlton.mileage running instrumentation ComponentInfo{com.evancharlton.mileage.test/sh.calaba.instrumentationbackend.CalabashInstrumentationTestRunner}
06-05 23:01:16.463 I/ActivityManager( 1631): Force stopping com.evancharlton.mileage appid=10326 user=0: finished inst
06-05 23:01:16.467 I/art     (13950): Not late-enabling -Xcheck:jni (already on)
06-05 23:01:16.468 D/EGL_emulation( 1712): eglMakeCurrent: 0xb0685360: ver 2 0 (tinfo 0xb06836c0)
06-05 23:01:16.468 W/art     (13950): Unexpected CPU variant for X86 using defaults: x86
06-05 23:01:16.470 D/EGL_emulation( 1712): eglMakeCurrent: 0xb0685360: ver 2 0 (tinfo 0xb06836c0)
06-05 23:01:16.475 I/ActivityManager( 1631): Start proc 13950:com.evancharlton.mileage/u0a326 for added application com.evancharlton.mileage
06-05 23:01:16.475 D/AndroidRuntime(13939): Shutting down VM
06-05 23:01:16.480 W/System  (13950): ClassLoader referenced unknown path: /data/app/com.evancharlton.mileage.test-1/lib/x86
06-05 23:01:16.480 W/System  (13950): ClassLoader referenced unknown path: /data/app/com.evancharlton.mileage-1/lib/x86
06-05 23:01:16.482 W/System  (13950): ClassLoader referenced unknown path: 
06-05 23:01:16.484 D/EGL_emulation( 1712): eglMakeCurrent: 0xb0685360: ver 2 0 (tinfo 0xb06836c0)
06-05 23:01:16.486 I/System.out(13950): Main activity name automatically set to: com.evancharlton.mileage.Mileage
06-05 23:01:16.486 D/EGL_emulation( 1712): eglMakeCurrent: 0xb0685360: ver 2 0 (tinfo 0xb06836c0)
06-05 23:01:16.486 I/System.out(13950): Calabash did not load Mono. This is only a problem if you are trying to test a Mono application
06-05 23:01:16.487 I/calabash(13950): Test server port: 7102
06-05 23:01:16.487 I/InstrumentationBackend(13950): Added:'GetPreferences', with key:'get_preferences'
06-05 23:01:16.492 I/InstrumentationBackend(13950): Added:'SetPreferences', with key:'set_preferences'
06-05 23:01:16.493 I/InstrumentationBackend(13950): Added:'ClearPreferences', with key:'clear_preferences'
06-05 23:01:16.493 I/InstrumentationBackend(13950): Added:'PressElement', with key:'press_l10n_element'
06-05 23:01:16.493 I/InstrumentationBackend(13950): Added:'WaitForElement', with key:'wait_for_l10n_element'
06-05 23:01:16.493 I/InstrumentationBackend(13950): Added:'NullAction', with key:'nullAction'
06-05 23:01:16.493 I/InstrumentationBackend(13950): Added:'PressKey', with key:'press_key'
06-05 23:01:16.493 I/InstrumentationBackend(13950): Added:'SetActivityOrientation', with key:'set_activity_orientation'
06-05 23:01:16.493 I/InstrumentationBackend(13950): Added:'GetActivityOrientation', with key:'get_activity_orientation'
06-05 23:01:16.493 I/InstrumentationBackend(13950): Added:'FakeGPSLocation', with key:'set_gps_coordinates'
06-05 23:01:16.493 I/InstrumentationBackend(13950): Added:'SetPropertyByCssSelector', with key:'set_property_by_css_selector'
06-05 23:01:16.493 I/InstrumentationBackend(13950): Added:'GetUrl', with key:'get_url'
06-05 23:01:16.493 I/InstrumentationBackend(13950): Added:'ScrollTo', with key:'scroll_to'
06-05 23:01:16.493 I/InstrumentationBackend(13950): Added:'GetLoadProgress', with key:'get_load_progress'
06-05 23:01:16.493 I/InstrumentationBackend(13950): Added:'DumpHtml', with key:'dump_html'
06-05 23:01:16.493 I/InstrumentationBackend(13950): Added:'DumpBodyHtml', with key:'dump_body_html'
06-05 23:01:16.493 I/InstrumentationBackend(13950): Added:'EnterTextByCssSelector', with key:'enter_text_by_selector'
06-05 23:01:16.494 I/InstrumentationBackend(13950): Added:'AndroidSDKVersion', with key:'android_sdk_version'
06-05 23:01:16.494 I/InstrumentationBackend(13950): Added:'Version', with key:'version'
06-05 23:01:16.494 I/InstrumentationBackend(13950): Added:'Drag', with key:'drag'
06-05 23:01:16.494 I/InstrumentationBackend(13950): Added:'TouchCoordinates', with key:'touch_coordinate'
06-05 23:01:16.494 I/InstrumentationBackend(13950): Added:'LongPressCoordinate', with key:'long_press_coordinate'
06-05 23:01:16.494 I/InstrumentationBackend(13950): Added:'DragCoordinates', with key:'drag_coordinates'
06-05 23:01:16.494 I/InstrumentationBackend(13950): Added:'ResumeApplication', with key:'resume_application'
06-05 23:01:16.494 I/InstrumentationBackend(13950): Added:'Swipe', with key:'swipe'
06-05 23:01:16.494 I/InstrumentationBackend(13950): Added:'DoubleTapCoordinate', with key:'double_tap_coordinate'
06-05 23:01:16.494 I/InstrumentationBackend(13950): Added:'ClickOnScreen', with key:'click_on_screen'
06-05 23:01:16.494 I/InstrumentationBackend(13950): Added:'GetActivityName', with key:'get_activity_name'
06-05 23:01:16.494 I/InstrumentationBackend(13950): Added:'ScrollToView', with key:'scroll_to_view'
06-05 23:01:16.494 I/InstrumentationBackend(13950): Added:'ViewConfiguration', with key:'view_configuration'
06-05 23:01:16.494 I/InstrumentationBackend(13950): Added:'IsCurrentActivityFocused', with key:'is_current_activity_focused'
06-05 23:01:16.494 I/InstrumentationBackend(13950): Added:'SendTcp', with key:'send_tcp'
06-05 23:01:16.494 I/InstrumentationBackend(13950): Added:'DpToDevicePixel', with key:'dp_to_device_pixel'
06-05 23:01:16.494 I/InstrumentationBackend(13950): Added:'KeyboardEnterText', with key:'keyboard_enter_text'
06-05 23:01:16.494 I/InstrumentationBackend(13950): Added:'DeleteSurroundingText', with key:'delete_surrounding_text'
06-05 23:01:16.494 I/InstrumentationBackend(13950): Added:'SetComposingRegion', with key:'set_composing_region'
06-05 23:01:16.494 I/InstrumentationBackend(13950): Added:'SetSelection', with key:'set_selection'
06-05 23:01:16.494 I/InstrumentationBackend(13950): Added:'KeyboardKeyEvent', with key:'keyboard_key_event'
06-05 23:01:16.494 I/InstrumentationBackend(13950): Added:'PressUserActionButton', with key:'press_user_action_button'
06-05 23:01:16.495 I/InstrumentationBackend(13950): Added:'HideSoftKeyboard', with key:'hide_soft_keyboard'
06-05 23:01:16.495 I/InstrumentationBackend(13950): Added:'ListActions', with key:'list_actions'
06-05 23:01:16.495 I/calabash(13950): Instantiating http server at 7102
06-05 23:01:16.495 I/System.out(13950): HTTP Daemon listening on: 7102
06-05 23:01:16.500 D/EGL_emulation( 1712): eglMakeCurrent: 0xb0685360: ver 2 0 (tinfo 0xb06836c0)
06-05 23:01:16.502 D/EGL_emulation( 1712): eglMakeCurrent: 0xb0685360: ver 2 0 (tinfo 0xb06836c0)
06-05 23:01:16.518 D/EGL_emulation( 1712): eglMakeCurrent: 0xb0685360: ver 2 0 (tinfo 0xb06836c0)
06-05 23:01:16.525 I/WindowManager( 1631): WIN DEATH: Window{c79b93 u0 com.evancharlton.mileage/com.evancharlton.mileage.charts.SouthChart}
06-05 23:01:16.525 W/InputDispatcher( 1631): channel 'd399c46 com.evancharlton.mileage/com.evancharlton.mileage.Mileage (server)' ~ Consumer closed input channel or an error occurred.  events=0x9
06-05 23:01:16.526 E/InputDispatcher( 1631): channel 'd399c46 com.evancharlton.mileage/com.evancharlton.mileage.Mileage (server)' ~ Channel is unrecoverably broken and will be disposed!
06-05 23:01:16.526 W/InputDispatcher( 1631): channel 'c79b93 com.evancharlton.mileage/com.evancharlton.mileage.charts.SouthChart (server)' ~ Consumer closed input channel or an error occurred.  events=0x9
06-05 23:01:16.526 E/InputDispatcher( 1631): channel 'c79b93 com.evancharlton.mileage/com.evancharlton.mileage.charts.SouthChart (server)' ~ Channel is unrecoverably broken and will be disposed!
06-05 23:01:16.526 W/InputDispatcher( 1631): Attempted to unregister already unregistered input channel 'c79b93 com.evancharlton.mileage/com.evancharlton.mileage.charts.SouthChart (server)'
06-05 23:01:16.526 I/WindowManager( 1631): Destroying surface Surface(name=com.evancharlton.mileage/com.evancharlton.mileage.charts.SouthChart) called by com.android.server.wm.WindowStateAnimator.destroySurface:2016 com.android.server.wm.WindowStateAnimator.destroySurfaceLocked:882 com.android.server.wm.WindowState.removeLocked:1456 com.android.server.wm.WindowManagerService.removeWindowInnerLocked:2484 com.android.server.wm.WindowManagerService.removeWindowLocked:2442 com.android.server.wm.WindowState$DeathRecipient.binderDied:1787 android.os.BinderProxy.sendDeathNotice:688 <bottom of call stack> 
06-05 23:01:16.530 I/WindowManager( 1631): WIN DEATH: Window{d399c46 u0 com.evancharlton.mileage/com.evancharlton.mileage.Mileage EXITING}
06-05 23:01:16.530 W/InputDispatcher( 1631): Attempted to unregister already unregistered input channel 'd399c46 com.evancharlton.mileage/com.evancharlton.mileage.Mileage (server)'
06-05 23:01:16.554 D/EGL_emulation( 1712): eglMakeCurrent: 0xb0685360: ver 2 0 (tinfo 0xb06836c0)
06-05 23:01:16.560 D/EGL_emulation( 1712): eglMakeCurrent: 0xb0685360: ver 2 0 (tinfo 0xb06836c0)
06-05 23:01:16.585 I/System.out(13950): URI: //ping
06-05 23:01:16.585 I/System.out(13950): params: {json={}
06-05 23:01:16.585 I/System.out(13950): }
06-05 23:01:16.588 I/System.out(13950): URI: //ping
06-05 23:01:16.588 I/System.out(13950): params: {json={}
06-05 23:01:16.588 I/System.out(13950): }
06-05 23:01:16.590 I/System.out(13950): URI: //ready
06-05 23:01:16.590 I/System.out(13950): params: {json={}
06-05 23:01:16.590 I/System.out(13950): }
06-05 23:01:16.592 I/System.out(13950): URI: //
06-05 23:01:16.592 I/System.out(13950): params: {json={"command":"version","arguments":[]}
06-05 23:01:16.592 I/System.out(13950): }
06-05 23:01:16.592 I/System.out(13950): header: {content-type=application/json;charset=utf-8, date=Sat, 06 Jun 2020 04:01:16 GMT, accept=*/*, host=127.0.0.1:34777, content-length=36, user-agent=HTTPClient/1.0 (2.8.3, ruby 2.5.1 (2018-03-29))}
06-05 23:01:16.592 I/System.out(13950): params: {json={"command":"version","arguments":[]}
06-05 23:01:16.592 I/System.out(13950): }
06-05 23:01:16.592 I/System.out(13950): ProP json = {"command":"version","arguments":[]}
06-05 23:01:16.592 I/System.out(13950): files: {}
06-05 23:01:16.592 I/System.out(13950): command: {"command":"version","arguments":[]}
06-05 23:01:16.595 I/InstrumentationBackend(13950): Got command:'Command:'Line:null,version', arguments:'[]'
06-05 23:01:16.604 I/System.out(13950): result:{"bonusInformation":[],"message":"0.9.8","success":true}
06-05 23:01:16.607 I/System.out(13950): URI: //start-application
06-05 23:01:16.607 I/System.out(13950): params: {json={"intent":null}
06-05 23:01:16.607 I/System.out(13950): }
06-05 23:01:16.617 I/ActivityManager( 1631): START u0 {act=android.intent.action.MAIN cat=[android.intent.category.LAUNCHER] flg=0x10200000 cmp=com.evancharlton.mileage/.Mileage} from uid 10326 on display 0
06-05 23:01:16.693 I/calabash(13950): newActivity1
06-05 23:01:16.700 D/gralloc_ranchu( 1347): gralloc_alloc: Creating ashmem region of size 9023488
06-05 23:01:16.706 I/calabash(13950): newActivity1
06-05 23:01:16.709 W/ActivityManager( 1631): Bad activity token: android.os.BinderProxy@cb0dfe2
06-05 23:01:16.709 W/ActivityManager( 1631): java.lang.ClassCastException: android.os.BinderProxy cannot be cast to com.android.server.am.ActivityRecord$Token
06-05 23:01:16.709 W/ActivityManager( 1631): 	at com.android.server.am.ActivityRecord.forTokenLocked(ActivityRecord.java:586)
06-05 23:01:16.709 W/ActivityManager( 1631): 	at com.android.server.am.ActivityRecord.isInStackLocked(ActivityRecord.java:1327)
06-05 23:01:16.709 W/ActivityManager( 1631): 	at com.android.server.am.ActivityRecord.getStackLocked(ActivityRecord.java:1332)
06-05 23:01:16.709 W/ActivityManager( 1631): 	at com.android.server.am.ActivityManagerService.getActivityDisplayId(ActivityManagerService.java:9806)
06-05 23:01:16.709 W/ActivityManager( 1631): 	at android.app.ActivityManagerNative.onTransact(ActivityManagerNative.java:2566)
06-05 23:01:16.709 W/ActivityManager( 1631): 	at com.android.server.am.ActivityManagerService.onTransact(ActivityManagerService.java:2757)
06-05 23:01:16.709 W/ActivityManager( 1631): 	at android.os.Binder.execTransact(Binder.java:565)
06-05 23:01:16.710 W/ActivityManager( 1631): Bad activity token: android.os.BinderProxy@cb0dfe2
06-05 23:01:16.710 W/ActivityManager( 1631): java.lang.ClassCastException: android.os.BinderProxy cannot be cast to com.android.server.am.ActivityRecord$Token
06-05 23:01:16.710 W/ActivityManager( 1631): 	at com.android.server.am.ActivityRecord.forTokenLocked(ActivityRecord.java:586)
06-05 23:01:16.710 W/ActivityManager( 1631): 	at com.android.server.am.ActivityRecord.isInStackLocked(ActivityRecord.java:1327)
06-05 23:01:16.710 W/ActivityManager( 1631): 	at com.android.server.am.ActivityManagerService.setTaskDescription(ActivityManagerService.java:9358)
06-05 23:01:16.710 W/ActivityManager( 1631): 	at android.app.ActivityManagerNative.onTransact(ActivityManagerNative.java:2639)
06-05 23:01:16.710 W/ActivityManager( 1631): 	at com.android.server.am.ActivityManagerService.onTransact(ActivityManagerService.java:2757)
06-05 23:01:16.710 W/ActivityManager( 1631): 	at android.os.Binder.execTransact(Binder.java:565)
06-05 23:01:16.711 W/ActivityManager( 1631): Bad activity token: android.os.BinderProxy@cb0dfe2
06-05 23:01:16.711 W/ActivityManager( 1631): java.lang.ClassCastException: android.os.BinderProxy cannot be cast to com.android.server.am.ActivityRecord$Token
06-05 23:01:16.711 W/ActivityManager( 1631): 	at com.android.server.am.ActivityRecord.forTokenLocked(ActivityRecord.java:586)
06-05 23:01:16.711 W/ActivityManager( 1631): 	at com.android.server.am.ActivityRecord.isInStackLocked(ActivityRecord.java:1327)
06-05 23:01:16.711 W/ActivityManager( 1631): 	at com.android.server.am.ActivityRecord.getStackLocked(ActivityRecord.java:1332)
06-05 23:01:16.711 W/ActivityManager( 1631): 	at com.android.server.am.ActivityManagerService.getActivityStackId(ActivityManagerService.java:9817)
06-05 23:01:16.711 W/ActivityManager( 1631): 	at android.app.ActivityManagerNative.onTransact(ActivityManagerNative.java:2856)
06-05 23:01:16.711 W/ActivityManager( 1631): 	at com.android.server.am.ActivityManagerService.onTransact(ActivityManagerService.java:2757)
06-05 23:01:16.711 W/ActivityManager( 1631): 	at android.os.Binder.execTransact(Binder.java:565)
06-05 23:01:16.725 V/PhoneStatusBar( 1712): setLightsOn(true)
06-05 23:01:16.725 W/ActivityManager( 1631): Bad activity token: android.os.BinderProxy@cb0dfe2
06-05 23:01:16.725 W/ActivityManager( 1631): java.lang.ClassCastException: android.os.BinderProxy cannot be cast to com.android.server.am.ActivityRecord$Token
06-05 23:01:16.725 W/ActivityManager( 1631): 	at com.android.server.am.ActivityRecord.forTokenLocked(ActivityRecord.java:586)
06-05 23:01:16.725 W/ActivityManager( 1631): 	at com.android.server.am.ActivityRecord.isInStackLocked(ActivityRecord.java:1327)
06-05 23:01:16.725 W/ActivityManager( 1631): 	at com.android.server.am.ActivityManagerService.getActivityOptions(ActivityManagerService.java:12559)
06-05 23:01:16.725 W/ActivityManager( 1631): 	at android.app.ActivityManagerNative.onTransact(ActivityManagerNative.java:1933)
06-05 23:01:16.725 W/ActivityManager( 1631): 	at com.android.server.am.ActivityManagerService.onTransact(ActivityManagerService.java:2757)
06-05 23:01:16.725 W/ActivityManager( 1631): 	at android.os.Binder.execTransact(Binder.java:565)
06-05 23:01:16.725 W/ActivityManager( 1631): Bad activity token: android.os.BinderProxy@cb0dfe2
06-05 23:01:16.725 W/ActivityManager( 1631): java.lang.ClassCastException: android.os.BinderProxy cannot be cast to com.android.server.am.ActivityRecord$Token
06-05 23:01:16.725 W/ActivityManager( 1631): 	at com.android.server.am.ActivityRecord.forTokenLocked(ActivityRecord.java:586)
06-05 23:01:16.725 W/ActivityManager( 1631): 	at com.android.server.am.ActivityRecord.isInStackLocked(ActivityRecord.java:1327)
06-05 23:01:16.725 W/ActivityManager( 1631): 	at com.android.server.am.ActivityManagerService.getActivityOptions(ActivityManagerService.java:12559)
06-05 23:01:16.725 W/ActivityManager( 1631): 	at android.app.ActivityManagerNative.onTransact(ActivityManagerNative.java:1933)
06-05 23:01:16.725 W/ActivityManager( 1631): 	at com.android.server.am.ActivityManagerService.onTransact(ActivityManagerService.java:2757)
06-05 23:01:16.725 W/ActivityManager( 1631): 	at android.os.Binder.execTransact(Binder.java:565)
06-05 23:01:16.734 D/EGL_emulation( 2076): eglMakeCurrent: 0xb0685360: ver 2 0 (tinfo 0xb06836b0)
06-05 23:01:16.735 D/EGL_emulation( 1712): eglMakeCurrent: 0xb0685360: ver 2 0 (tinfo 0xb06836c0)
06-05 23:01:16.750 D/gralloc_ranchu( 1347): gralloc_alloc: Creating ashmem region of size 9023488
06-05 23:01:16.750 D/EGL_emulation( 1712): eglMakeCurrent: 0xb0685360: ver 2 0 (tinfo 0xb06836c0)
06-05 23:01:16.754 D/        (13950): HostConnection::get() New Host Connection established 0xa122efc0, tid 13950
06-05 23:01:16.755 D/EGL_emulation( 1712): eglMakeCurrent: 0xb0685360: ver 2 0 (tinfo 0xb06836c0)
06-05 23:01:16.755 V/PhoneStatusBar( 1712): setLightsOn(true)
06-05 23:01:16.767 I/WindowManager( 1631): Destroying surface Surface(name=com.evancharlton.mileage/com.evancharlton.mileage.Mileage) called by com.android.server.wm.WindowStateAnimator.destroySurface:2016 com.android.server.wm.WindowStateAnimator.destroySurfaceLocked:882 com.android.server.wm.WindowState.removeLocked:1456 com.android.server.wm.WindowManagerService.removeWindowInnerLocked:2484 com.android.server.wm.AppWindowToken.destroySurfaces:365 com.android.server.wm.WindowStateAnimator.finishExit:565 com.android.server.wm.AppWindowAnimator.stepAnimationLocked:427 com.android.server.wm.WindowAnimator.updateAppWindowsLocked:196 
06-05 23:01:16.792 E/SurfaceFlinger( 1347): getLayerUser(name=0xb3f9f650) is dead
06-05 23:01:16.792 D/EGL_emulation( 1712): eglMakeCurrent: 0xb0685360: ver 2 0 (tinfo 0xb06836c0)
06-05 23:01:16.794 D/EGL_emulation( 1712): eglMakeCurrent: 0xb0685360: ver 2 0 (tinfo 0xb06836c0)
06-05 23:01:16.795 D/EGL_emulation( 1712): eglMakeCurrent: 0xb0685360: ver 2 0 (tinfo 0xb06836c0)
06-05 23:01:16.804 D/EGL_emulation( 1712): eglMakeCurrent: 0xb0685360: ver 2 0 (tinfo 0xb06836c0)
06-05 23:01:16.804 V/PhoneStatusBar( 1712): setLightsOn(true)
06-05 23:01:16.806 D/EGL_emulation( 1712): eglMakeCurrent: 0xb0685360: ver 2 0 (tinfo 0xb06836c0)
06-05 23:01:16.817 D/EGL_emulation( 1712): eglMakeCurrent: 0xb0685360: ver 2 0 (tinfo 0xb06836c0)
06-05 23:01:16.819 D/EGL_emulation( 1712): eglMakeCurrent: 0xb0685360: ver 2 0 (tinfo 0xb06836c0)
06-05 23:01:16.835 D/EGL_emulation( 1712): eglMakeCurrent: 0xb0685360: ver 2 0 (tinfo 0xb06836c0)
06-05 23:01:16.840 D/gralloc_ranchu( 1347): gralloc_alloc: Creating ashmem region of size 9023488
06-05 23:01:16.840 D/EGL_emulation( 1712): eglMakeCurrent: 0xb0685360: ver 2 0 (tinfo 0xb06836c0)
06-05 23:01:16.870 D/EGL_emulation( 1712): eglMakeCurrent: 0xb0685360: ver 2 0 (tinfo 0xb06836c0)
06-05 23:01:16.870 I/ActivityManager( 1631): Displayed com.evancharlton.mileage/.Mileage: +194ms
06-05 23:01:16.873 D/EGL_emulation( 1712): eglMakeCurrent: 0xb0685360: ver 2 0 (tinfo 0xb06836c0)
06-05 23:01:16.888 D/EGL_emulation( 1712): eglMakeCurrent: 0xb0685360: ver 2 0 (tinfo 0xb06836c0)
06-05 23:01:16.891 D/EGL_emulation( 1712): eglMakeCurrent: 0xb0685360: ver 2 0 (tinfo 0xb06836c0)
06-05 23:01:16.902 D/EGL_emulation( 1712): eglMakeCurrent: 0xb0685360: ver 2 0 (tinfo 0xb06836c0)
06-05 23:01:16.903 V/PhoneStatusBar( 1712): setLightsOn(true)
06-05 23:01:16.912 D/EGL_emulation( 1712): eglMakeCurrent: 0xb0685360: ver 2 0 (tinfo 0xb06836c0)
06-05 23:01:16.917 D/EGL_emulation( 1712): eglMakeCurrent: 0xb0685360: ver 2 0 (tinfo 0xb06836c0)
06-05 23:01:16.919 D/EGL_emulation( 1712): eglMakeCurrent: 0xb0685360: ver 2 0 (tinfo 0xb06836c0)
06-05 23:01:16.924 I/System.out(13950): URI: //map
06-05 23:01:16.924 I/System.out(13950): params: {json={"query":"* marked:'Statistics'","operation":{"method_name":"query","arguments":[]}}
06-05 23:01:16.924 I/System.out(13950): }
06-05 23:01:16.934 D/EGL_emulation( 1712): eglMakeCurrent: 0xb0685360: ver 2 0 (tinfo 0xb06836c0)
06-05 23:01:16.936 D/EGL_emulation( 1712): eglMakeCurrent: 0xb0685360: ver 2 0 (tinfo 0xb06836c0)
06-05 23:01:16.938 W/ResourceType(13950): No package identifier when getting name for resource number 0x00000001
06-05 23:01:16.950 D/EGL_emulation( 1712): eglMakeCurrent: 0xb0685360: ver 2 0 (tinfo 0xb06836c0)
06-05 23:01:16.952 D/EGL_emulation( 1712): eglMakeCurrent: 0xb0685360: ver 2 0 (tinfo 0xb06836c0)
06-05 23:01:16.953 I/System.out(13950): URI: //gesture
06-05 23:01:16.953 I/System.out(13950): params: {json={"query_timeout":5.0,"gestures":[{"query_string":"* marked:'Statistics'","touches":[{"x":50,"y":50,"offset_x":0,"offset_y":0,"wait":0.0,"time":0.2,"release":true,"query_string":null}]}]}
06-05 23:01:16.953 I/System.out(13950): }
06-05 23:01:16.958 W/ResourceType(13950): No package identifier when getting name for resource number 0x00000001
06-05 23:01:17.067 I/WindowManager( 1631): Destroying surface Surface(name=Starting com.evancharlton.mileage) called by com.android.server.wm.WindowStateAnimator.destroySurface:2016 com.android.server.wm.WindowStateAnimator.destroySurfaceLocked:882 com.android.server.wm.WindowState.destroyOrSaveSurface:2100 com.android.server.wm.AppWindowToken.destroySurfaces:363 com.android.server.wm.WindowStateAnimator.finishExit:565 com.android.server.wm.WindowStateAnimator.stepAnimationLocked:491 com.android.server.wm.WindowAnimator.updateWindowsLocked:303 com.android.server.wm.WindowAnimator.animateLocked:704 
06-05 23:01:17.068 V/PhoneStatusBar( 1712): setLightsOn(true)
06-05 23:01:17.083 V/PhoneStatusBar( 1712): setLightsOn(true)
06-05 23:01:17.185 I/calabash(13950): newActivity1
06-05 23:01:17.193 I/System.out(13950): URI: //map
06-05 23:01:17.193 I/System.out(13950): params: {json={"query":"android.widget.ScrollView index:0","operation":{"method_name":"query","arguments":[]}}
06-05 23:01:17.193 I/System.out(13950): }
06-05 23:01:17.196 W/ActivityManager( 1631): Bad activity token: android.os.BinderProxy@c393360
06-05 23:01:17.196 W/ActivityManager( 1631): java.lang.ClassCastException: android.os.BinderProxy cannot be cast to com.android.server.am.ActivityRecord$Token
06-05 23:01:17.196 W/ActivityManager( 1631): 	at com.android.server.am.ActivityRecord.forTokenLocked(ActivityRecord.java:586)
06-05 23:01:17.196 W/ActivityManager( 1631): 	at com.android.server.am.ActivityRecord.isInStackLocked(ActivityRecord.java:1327)
06-05 23:01:17.196 W/ActivityManager( 1631): 	at com.android.server.am.ActivityRecord.getStackLocked(ActivityRecord.java:1332)
06-05 23:01:17.196 W/ActivityManager( 1631): 	at com.android.server.am.ActivityManagerService.getActivityDisplayId(ActivityManagerService.java:9806)
06-05 23:01:17.196 W/ActivityManager( 1631): 	at android.app.ActivityManagerNative.onTransact(ActivityManagerNative.java:2566)
06-05 23:01:17.196 W/ActivityManager( 1631): 	at com.android.server.am.ActivityManagerService.onTransact(ActivityManagerService.java:2757)
06-05 23:01:17.196 W/ActivityManager( 1631): 	at android.os.Binder.execTransact(Binder.java:565)
06-05 23:01:17.197 W/ActivityManager( 1631): Bad activity token: android.os.BinderProxy@c393360
06-05 23:01:17.197 W/ActivityManager( 1631): java.lang.ClassCastException: android.os.BinderProxy cannot be cast to com.android.server.am.ActivityRecord$Token
06-05 23:01:17.197 W/ActivityManager( 1631): 	at com.android.server.am.ActivityRecord.forTokenLocked(ActivityRecord.java:586)
06-05 23:01:17.197 W/ActivityManager( 1631): 	at com.android.server.am.ActivityRecord.isInStackLocked(ActivityRecord.java:1327)
06-05 23:01:17.197 W/ActivityManager( 1631): 	at com.android.server.am.ActivityManagerService.setTaskDescription(ActivityManagerService.java:9358)
06-05 23:01:17.197 W/ActivityManager( 1631): 	at android.app.ActivityManagerNative.onTransact(ActivityManagerNative.java:2639)
06-05 23:01:17.197 W/ActivityManager( 1631): 	at com.android.server.am.ActivityManagerService.onTransact(ActivityManagerService.java:2757)
06-05 23:01:17.197 W/ActivityManager( 1631): 	at android.os.Binder.execTransact(Binder.java:565)
06-05 23:01:17.197 W/ActivityManager( 1631): Bad activity token: android.os.BinderProxy@c393360
06-05 23:01:17.197 W/ActivityManager( 1631): java.lang.ClassCastException: android.os.BinderProxy cannot be cast to com.android.server.am.ActivityRecord$Token
06-05 23:01:17.197 W/ActivityManager( 1631): 	at com.android.server.am.ActivityRecord.forTokenLocked(ActivityRecord.java:586)
06-05 23:01:17.197 W/ActivityManager( 1631): 	at com.android.server.am.ActivityRecord.isInStackLocked(ActivityRecord.java:1327)
06-05 23:01:17.197 W/ActivityManager( 1631): 	at com.android.server.am.ActivityRecord.getStackLocked(ActivityRecord.java:1332)
06-05 23:01:17.197 W/ActivityManager( 1631): 	at com.android.server.am.ActivityManagerService.getActivityStackId(ActivityManagerService.java:9817)
06-05 23:01:17.197 W/ActivityManager( 1631): 	at android.app.ActivityManagerNative.onTransact(ActivityManagerNative.java:2856)
06-05 23:01:17.197 W/ActivityManager( 1631): 	at com.android.server.am.ActivityManagerService.onTransact(ActivityManagerService.java:2757)
06-05 23:01:17.197 W/ActivityManager( 1631): 	at android.os.Binder.execTransact(Binder.java:565)
06-05 23:01:17.200 V/PhoneStatusBar( 1712): setLightsOn(true)
06-05 23:01:17.203 D/VehicleStatisticsActivity(13950): Checking recalculation ...
06-05 23:01:17.204 D/VehicleStatisticsActivity(13950): Recalculation not necessary.
06-05 23:01:17.217 W/ActivityManager( 1631): Bad activity token: android.os.BinderProxy@c393360
06-05 23:01:17.217 W/ActivityManager( 1631): java.lang.ClassCastException: android.os.BinderProxy cannot be cast to com.android.server.am.ActivityRecord$Token
06-05 23:01:17.217 W/ActivityManager( 1631): 	at com.android.server.am.ActivityRecord.forTokenLocked(ActivityRecord.java:586)
06-05 23:01:17.217 W/ActivityManager( 1631): 	at com.android.server.am.ActivityRecord.isInStackLocked(ActivityRecord.java:1327)
06-05 23:01:17.217 W/ActivityManager( 1631): 	at com.android.server.am.ActivityManagerService.getActivityOptions(ActivityManagerService.java:12559)
06-05 23:01:17.217 W/ActivityManager( 1631): 	at android.app.ActivityManagerNative.onTransact(ActivityManagerNative.java:1933)
06-05 23:01:17.217 W/ActivityManager( 1631): 	at com.android.server.am.ActivityManagerService.onTransact(ActivityManagerService.java:2757)
06-05 23:01:17.217 W/ActivityManager( 1631): 	at android.os.Binder.execTransact(Binder.java:565)
06-05 23:01:17.218 W/ActivityManager( 1631): Bad activity token: android.os.BinderProxy@c393360
06-05 23:01:17.218 W/ActivityManager( 1631): java.lang.ClassCastException: android.os.BinderProxy cannot be cast to com.android.server.am.ActivityRecord$Token
06-05 23:01:17.218 W/ActivityManager( 1631): 	at com.android.server.am.ActivityRecord.forTokenLocked(ActivityRecord.java:586)
06-05 23:01:17.218 W/ActivityManager( 1631): 	at com.android.server.am.ActivityRecord.isInStackLocked(ActivityRecord.java:1327)
06-05 23:01:17.218 W/ActivityManager( 1631): 	at com.android.server.am.ActivityManagerService.getActivityOptions(ActivityManagerService.java:12559)
06-05 23:01:17.218 W/ActivityManager( 1631): 	at android.app.ActivityManagerNative.onTransact(ActivityManagerNative.java:1933)
06-05 23:01:17.218 W/ActivityManager( 1631): 	at com.android.server.am.ActivityManagerService.onTransact(ActivityManagerService.java:2757)
06-05 23:01:17.218 W/ActivityManager( 1631): 	at android.os.Binder.execTransact(Binder.java:565)
06-05 23:01:17.219 D/VehicleStatisticsActivity(13950): Checking recalculation ...
06-05 23:01:17.219 D/VehicleStatisticsActivity(13950): Recalculation not necessary.
06-05 23:01:17.315 I/System.out(13950): URI: //map
06-05 23:01:17.316 I/System.out(13950): params: {json={"query":"android.widget.AbsListView index:0","operation":{"method_name":"query","arguments":[]}}
06-05 23:01:17.316 I/System.out(13950): }
06-05 23:01:17.320 I/art     (13950): Do partial code cache collection, code=30KB, data=29KB
06-05 23:01:17.320 I/art     (13950): After code cache collection, code=29KB, data=28KB
06-05 23:01:17.320 I/art     (13950): Increasing code cache capacity to 128KB
06-05 23:01:17.329 I/System.out(13950): URI: //map
06-05 23:01:17.329 I/System.out(13950): params: {json={"query":"android.widget.AbsListView index:0","operation":{"method_name":"query","arguments":[]}}
06-05 23:01:17.329 I/System.out(13950): }
06-05 23:01:17.343 I/System.out(13950): URI: //map
06-05 23:01:17.343 I/System.out(13950): params: {json={"query":"android.widget.AbsListView index:0","operation":{"method_name":"query","arguments":[]}}
06-05 23:01:17.343 I/System.out(13950): }
06-05 23:01:17.357 I/System.out(13950): URI: //map
06-05 23:01:17.357 I/System.out(13950): params: {json={"query":"android.widget.AbsListView index:0","operation":{"method_name":"query","arguments":["getFirstVisiblePosition"]}}
06-05 23:01:17.357 I/System.out(13950): }
06-05 23:01:17.368 I/System.out(13950): URI: //map
06-05 23:01:17.368 I/System.out(13950): params: {json={"query":"android.widget.AbsListView index:0","operation":{"method_name":"query","arguments":["getLastVisiblePosition"]}}
06-05 23:01:17.368 I/System.out(13950): }
06-05 23:01:17.379 I/System.out(13950): URI: //map
06-05 23:01:17.379 I/System.out(13950): params: {json={"query":"android.widget.AbsListView index:0","operation":{"method_name":"query","arguments":[{"method_name":"setSelection","arguments":[26]}]}}
06-05 23:01:17.379 I/System.out(13950): }
06-05 23:01:17.395 I/System.out(13950): URI: //map
06-05 23:01:17.395 I/System.out(13950): params: {json={"query":"* marked:'East'","operation":{"method_name":"query","arguments":[]}}
06-05 23:01:17.395 I/System.out(13950): }
06-05 23:01:17.440 D/gralloc_ranchu( 1347): gralloc_alloc: Creating ashmem region of size 9023488
06-05 23:01:17.484 V/PhoneStatusBar( 1712): setLightsOn(true)
06-05 23:01:17.485 V/PhoneStatusBar( 1712): setLightsOn(true)
06-05 23:01:17.486 W/OpenGLRenderer( 2076): Incorrectly called buildLayer on View: ShortcutAndWidgetContainer, destroying layer...
06-05 23:01:17.490 W/ResourceType(13950): No package identifier when getting name for resource number 0x00000001
06-05 23:01:17.500 I/WindowManager( 1631): Destroying surface Surface(name=com.android.launcher3/com.android.launcher3.Launcher) called by com.android.server.wm.WindowStateAnimator.destroySurface:2016 com.android.server.wm.WindowStateAnimator.destroySurfaceLocked:882 com.android.server.wm.WindowState.destroyOrSaveSurface:2100 com.android.server.wm.AppWindowToken.destroySurfaces:363 com.android.server.wm.AppWindowToken.notifyAppStopped:389 com.android.server.wm.WindowManagerService.notifyAppStopped:4463 com.android.server.am.ActivityStack.activityStoppedLocked:1252 com.android.server.am.ActivityManagerService.activityStopped:6903 
06-05 23:01:17.501 V/PhoneStatusBar( 1712): setLightsOn(true)
06-05 23:01:17.503 I/System.out(13950): URI: //gesture
06-05 23:01:17.503 I/System.out(13950): params: {json={"query_timeout":5.0,"gestures":[{"query_string":"* marked:'East'","touches":[{"x":50,"y":50,"offset_x":0,"offset_y":0,"wait":0.0,"time":0.2,"release":true,"query_string":null}]}]}
06-05 23:01:17.503 I/System.out(13950): }
06-05 23:01:17.507 W/ResourceType(13950): No package identifier when getting name for resource number 0x00000001
06-05 23:01:17.737 I/ActivityManager( 1631): START u0 {cmp=com.evancharlton.mileage/.charts.EastChart (has extras)} from uid 10326 on display 0
06-05 23:01:17.741 V/PhoneStatusBar( 1712): setLightsOn(true)
06-05 23:01:17.745 V/PhoneStatusBar( 1712): setLightsOn(true)
06-05 23:01:17.769 I/System.out(13950): URI: //map
06-05 23:01:17.769 I/System.out(13950): params: {json={"query":"* {text CONTAINS[c] 'Farthest east fillup'}","operation":{"method_name":"query","arguments":[]}}
06-05 23:01:17.769 I/System.out(13950): }
06-05 23:01:17.794 I/calabash(13950): newActivity1
06-05 23:01:17.797 W/aiCharts(13950): License file is invalid or missing. 
06-05 23:01:17.797 W/aiCharts(13950): Please place proper license.lic to /assets folder.
06-05 23:01:17.810 V/PhoneStatusBar( 1712): setLightsOn(true)
06-05 23:01:17.833 V/PhoneStatusBar( 1712): setLightsOn(true)
06-05 23:01:17.837 I/WindowManager( 1631): Destroying surface Surface(name=Creating chart…) called by com.android.server.wm.WindowStateAnimator.destroySurface:2016 com.android.server.wm.WindowStateAnimator.destroySurfaceLocked:882 com.android.server.wm.WindowState.removeLocked:1456 com.android.server.wm.WindowManagerService.removeWindowInnerLocked:2484 com.android.server.wm.WindowManagerService.removeWindowLocked:2442 com.android.server.wm.WindowManagerService.removeWindowLocked:2311 com.android.server.wm.WindowManagerService.removeWindow:2306 com.android.server.wm.Session.remove:202 
06-05 23:01:17.839 D/gralloc_ranchu( 1347): gralloc_alloc: Creating ashmem region of size 9023488
06-05 23:01:17.850 V/PhoneStatusBar( 1712): setLightsOn(true)
06-05 23:01:17.860 I/ActivityManager( 1631): Displayed com.evancharlton.mileage/.charts.EastChart: +69ms
06-05 23:01:17.867 V/PhoneStatusBar( 1712): setLightsOn(true)
06-05 23:01:17.901 V/PhoneStatusBar( 1712): setLightsOn(true)
06-05 23:01:17.918 V/PhoneStatusBar( 1712): setLightsOn(true)
06-05 23:01:18.101 V/PhoneStatusBar( 1712): setLightsOn(true)
06-05 23:01:18.123 I/System.out(13950): URI: //map
06-05 23:01:18.123 I/System.out(13950): params: {json={"query":"* {text CONTAINS[c] 'Farthest east fillup'}","operation":{"method_name":"query","arguments":[]}}
06-05 23:01:18.123 I/System.out(13950): }
06-05 23:01:18.138 I/System.out(13950): URI: //
06-05 23:01:18.138 I/System.out(13950): params: {json={"command":"press_key","arguments":["KEYCODE_BACK"]}
06-05 23:01:18.138 I/System.out(13950): }
06-05 23:01:18.138 I/System.out(13950): header: {content-type=application/json;charset=utf-8, date=Sat, 06 Jun 2020 04:01:18 GMT, accept=*/*, host=127.0.0.1:34777, content-length=52, user-agent=HTTPClient/1.0 (2.8.3, ruby 2.5.1 (2018-03-29))}
06-05 23:01:18.138 I/System.out(13950): params: {json={"command":"press_key","arguments":["KEYCODE_BACK"]}
06-05 23:01:18.138 I/System.out(13950): }
06-05 23:01:18.138 I/System.out(13950): ProP json = {"command":"press_key","arguments":["KEYCODE_BACK"]}
06-05 23:01:18.138 I/System.out(13950): files: {}
06-05 23:01:18.138 I/System.out(13950): command: {"command":"press_key","arguments":["KEYCODE_BACK"]}
06-05 23:01:18.139 I/InstrumentationBackend(13950): Got command:'Command:'Line:null,press_key', arguments:'[KEYCODE_BACK]'
06-05 23:01:18.142 V/PhoneStatusBar( 1712): setLightsOn(true)
06-05 23:01:18.143 V/PhoneStatusBar( 1712): setLightsOn(true)
06-05 23:01:18.145 D/VehicleStatisticsActivity(13950): Checking recalculation ...
06-05 23:01:18.146 I/art     (13950): Do partial code cache collection, code=60KB, data=62KB
06-05 23:01:18.146 I/art     (13950): After code cache collection, code=60KB, data=61KB
06-05 23:01:18.146 I/art     (13950): Increasing code cache capacity to 256KB
06-05 23:01:18.146 I/System.out(13950): result:{"bonusInformation":[],"message":"","success":true}
06-05 23:01:18.147 D/VehicleStatisticsActivity(13950): Recalculation not necessary.
06-05 23:01:18.150 V/PhoneStatusBar( 1712): setLightsOn(true)
06-05 23:01:18.151 I/System.out(13950): URI: //map
06-05 23:01:18.151 I/System.out(13950): params: {json={"query":"* {text CONTAINS[c] 'Statistics'}","operation":{"method_name":"query","arguments":[]}}
06-05 23:01:18.151 I/System.out(13950): }
06-05 23:01:18.166 D/gralloc_ranchu( 1347): gralloc_alloc: Creating ashmem region of size 9023488
06-05 23:01:18.167 V/PhoneStatusBar( 1712): setLightsOn(true)
06-05 23:01:18.183 V/PhoneStatusBar( 1712): setLightsOn(true)
06-05 23:01:18.203 V/PhoneStatusBar( 1712): setLightsOn(true)
