--------- beginning of main
06-06 00:59:42.607 V/PhoneStatusBar( 1712): setLightsOn(true)
06-06 00:59:42.608 V/PhoneStatusBar( 1712): setLightsOn(true)
06-06 00:59:42.618 D/gralloc_ranchu( 1347): gralloc_alloc: Creating ashmem region of size 3145728
06-06 00:59:42.624 E/EGL_emulation( 1347): tid 1347: eglCreateSyncKHR(1901): error 0x3004 (EGL_BAD_ATTRIBUTE)
--------- beginning of system
06-06 00:59:42.638 W/ActivityManager( 1631): Finishing task with all activities already finished
06-06 00:59:42.638 W/ActivityManager( 1631): Duplicate finish request for ActivityRecord{36b8907 u0 com.evancharlton.mileage/.Mileage t10855 f}
06-06 00:59:42.638 W/ActivityManager( 1631): Finishing task with all activities already finished
06-06 00:59:42.638 W/ActivityManager( 1631): Duplicate finish request for ActivityRecord{36b8907 u0 com.evancharlton.mileage/.Mileage t10855 f}
06-06 00:59:42.638 W/ActivityManager( 1631): Finishing task with all activities already finished
06-06 00:59:42.638 W/ActivityManager( 1631): Duplicate finish request for ActivityRecord{36b8907 u0 com.evancharlton.mileage/.Mileage t10855 f}
06-06 00:59:42.638 W/ActivityManager( 1631): Finishing task with all activities already finished
06-06 00:59:42.638 W/ActivityManager( 1631): Duplicate finish request for ActivityRecord{36b8907 u0 com.evancharlton.mileage/.Mileage t10855 f}
06-06 00:59:42.638 W/ActivityManager( 1631): Finishing task with all activities already finished
06-06 00:59:42.638 W/ActivityManager( 1631): Duplicate finish request for ActivityRecord{36b8907 u0 com.evancharlton.mileage/.Mileage t10855 f}
06-06 00:59:42.669 D/EGL_emulation( 1712): eglMakeCurrent: 0xb0685360: ver 2 0 (tinfo 0xb06836c0)
06-06 00:59:42.683 D/EGL_emulation( 1712): eglMakeCurrent: 0xb0685360: ver 2 0 (tinfo 0xb06836c0)
06-06 00:59:42.684 D/EGL_emulation( 2076): eglMakeCurrent: 0xb0685360: ver 2 0 (tinfo 0xb06836b0)
06-06 00:59:42.718 D/EGL_emulation( 1712): eglMakeCurrent: 0xb0685360: ver 2 0 (tinfo 0xb06836c0)
06-06 00:59:42.733 D/EGL_emulation( 1712): eglMakeCurrent: 0xb0685360: ver 2 0 (tinfo 0xb06836c0)
06-06 00:59:42.735 D/EGL_emulation( 1712): eglMakeCurrent: 0xb0685360: ver 2 0 (tinfo 0xb06836c0)
06-06 00:59:42.748 D/AndroidRuntime(23915): >>>>>> START com.android.internal.os.RuntimeInit uid 2000 <<<<<<
06-06 00:59:42.749 D/AndroidRuntime(23915): CheckJNI is ON
06-06 00:59:42.750 D/EGL_emulation( 1712): eglMakeCurrent: 0xb0685360: ver 2 0 (tinfo 0xb06836c0)
06-06 00:59:42.752 D/EGL_emulation( 1712): eglMakeCurrent: 0xb0685360: ver 2 0 (tinfo 0xb06836c0)
06-06 00:59:42.760 W/art     (23915): Unexpected CPU variant for X86 using defaults: x86
06-06 00:59:42.762 D/ICU     (23915): No timezone override file found: /data/misc/zoneinfo/current/icu/icu_tzdata.dat
06-06 00:59:42.766 D/EGL_emulation( 1712): eglMakeCurrent: 0xb0685360: ver 2 0 (tinfo 0xb06836c0)
06-06 00:59:42.768 D/EGL_emulation( 1712): eglMakeCurrent: 0xb0685360: ver 2 0 (tinfo 0xb06836c0)
06-06 00:59:42.771 E/memtrack(23915): Couldn't load memtrack module (No such file or directory)
06-06 00:59:42.771 E/android.os.Debug(23915): failed to load memtrack module: -2
06-06 00:59:42.771 I/Radio-JNI(23915): register_android_hardware_Radio DONE
06-06 00:59:42.775 D/AndroidRuntime(23915): Calling main entry com.android.commands.am.Am
06-06 00:59:42.777 I/ActivityManager( 1631): Force stopping com.evancharlton.mileage appid=10374 user=0: start instr
06-06 00:59:42.777 I/ActivityManager( 1631): Killing 23867:com.evancharlton.mileage/u0a374 (adj 0): stop com.evancharlton.mileage
06-06 00:59:42.777 D/ActivityManager( 1631): cleanUpApplicationRecord -- 23867
06-06 00:59:42.777 W/ActivityManager( 1631): Crash of app com.evancharlton.mileage running instrumentation ComponentInfo{com.evancharlton.mileage.test/sh.calaba.instrumentationbackend.CalabashInstrumentationTestRunner}
06-06 00:59:42.777 I/ActivityManager( 1631): Force stopping com.evancharlton.mileage appid=10374 user=0: finished inst
06-06 00:59:42.780 I/art     (23925): Not late-enabling -Xcheck:jni (already on)
06-06 00:59:42.780 W/art     (23925): Unexpected CPU variant for X86 using defaults: x86
06-06 00:59:42.783 D/EGL_emulation( 1712): eglMakeCurrent: 0xb0685360: ver 2 0 (tinfo 0xb06836c0)
06-06 00:59:42.787 D/EGL_emulation( 1712): eglMakeCurrent: 0xb0685360: ver 2 0 (tinfo 0xb06836c0)
06-06 00:59:42.788 I/ActivityManager( 1631): Start proc 23925:com.evancharlton.mileage/u0a374 for added application com.evancharlton.mileage
06-06 00:59:42.788 D/AndroidRuntime(23915): Shutting down VM
06-06 00:59:42.792 W/System  (23925): ClassLoader referenced unknown path: /data/app/com.evancharlton.mileage.test-1/lib/x86
06-06 00:59:42.792 W/System  (23925): ClassLoader referenced unknown path: /data/app/com.evancharlton.mileage-1/lib/x86
06-06 00:59:42.794 W/System  (23925): ClassLoader referenced unknown path: 
06-06 00:59:42.799 I/System.out(23925): Main activity name automatically set to: com.evancharlton.mileage.Mileage
06-06 00:59:42.799 I/System.out(23925): Calabash did not load Mono. This is only a problem if you are trying to test a Mono application
06-06 00:59:42.799 I/calabash(23925): Test server port: 7102
06-06 00:59:42.800 D/EGL_emulation( 1712): eglMakeCurrent: 0xb0685360: ver 2 0 (tinfo 0xb06836c0)
06-06 00:59:42.800 I/InstrumentationBackend(23925): Added:'GetPreferences', with key:'get_preferences'
06-06 00:59:42.803 D/EGL_emulation( 1712): eglMakeCurrent: 0xb0685360: ver 2 0 (tinfo 0xb06836c0)
06-06 00:59:42.805 I/InstrumentationBackend(23925): Added:'SetPreferences', with key:'set_preferences'
06-06 00:59:42.805 I/InstrumentationBackend(23925): Added:'ClearPreferences', with key:'clear_preferences'
06-06 00:59:42.805 I/InstrumentationBackend(23925): Added:'PressElement', with key:'press_l10n_element'
06-06 00:59:42.805 I/InstrumentationBackend(23925): Added:'WaitForElement', with key:'wait_for_l10n_element'
06-06 00:59:42.805 I/InstrumentationBackend(23925): Added:'NullAction', with key:'nullAction'
06-06 00:59:42.805 I/InstrumentationBackend(23925): Added:'PressKey', with key:'press_key'
06-06 00:59:42.805 I/InstrumentationBackend(23925): Added:'SetActivityOrientation', with key:'set_activity_orientation'
06-06 00:59:42.805 I/InstrumentationBackend(23925): Added:'GetActivityOrientation', with key:'get_activity_orientation'
06-06 00:59:42.805 I/InstrumentationBackend(23925): Added:'FakeGPSLocation', with key:'set_gps_coordinates'
06-06 00:59:42.805 I/InstrumentationBackend(23925): Added:'SetPropertyByCssSelector', with key:'set_property_by_css_selector'
06-06 00:59:42.805 I/InstrumentationBackend(23925): Added:'GetUrl', with key:'get_url'
06-06 00:59:42.805 I/InstrumentationBackend(23925): Added:'ScrollTo', with key:'scroll_to'
06-06 00:59:42.805 I/InstrumentationBackend(23925): Added:'GetLoadProgress', with key:'get_load_progress'
06-06 00:59:42.805 I/InstrumentationBackend(23925): Added:'DumpHtml', with key:'dump_html'
06-06 00:59:42.806 I/InstrumentationBackend(23925): Added:'DumpBodyHtml', with key:'dump_body_html'
06-06 00:59:42.806 I/InstrumentationBackend(23925): Added:'EnterTextByCssSelector', with key:'enter_text_by_selector'
06-06 00:59:42.806 I/InstrumentationBackend(23925): Added:'AndroidSDKVersion', with key:'android_sdk_version'
06-06 00:59:42.806 I/InstrumentationBackend(23925): Added:'Version', with key:'version'
06-06 00:59:42.806 I/InstrumentationBackend(23925): Added:'Drag', with key:'drag'
06-06 00:59:42.806 I/InstrumentationBackend(23925): Added:'TouchCoordinates', with key:'touch_coordinate'
06-06 00:59:42.806 I/InstrumentationBackend(23925): Added:'LongPressCoordinate', with key:'long_press_coordinate'
06-06 00:59:42.806 I/InstrumentationBackend(23925): Added:'DragCoordinates', with key:'drag_coordinates'
06-06 00:59:42.806 I/InstrumentationBackend(23925): Added:'ResumeApplication', with key:'resume_application'
06-06 00:59:42.806 I/InstrumentationBackend(23925): Added:'Swipe', with key:'swipe'
06-06 00:59:42.806 I/InstrumentationBackend(23925): Added:'DoubleTapCoordinate', with key:'double_tap_coordinate'
06-06 00:59:42.806 I/InstrumentationBackend(23925): Added:'ClickOnScreen', with key:'click_on_screen'
06-06 00:59:42.806 I/InstrumentationBackend(23925): Added:'GetActivityName', with key:'get_activity_name'
06-06 00:59:42.806 I/InstrumentationBackend(23925): Added:'ScrollToView', with key:'scroll_to_view'
06-06 00:59:42.806 I/InstrumentationBackend(23925): Added:'ViewConfiguration', with key:'view_configuration'
06-06 00:59:42.806 I/InstrumentationBackend(23925): Added:'IsCurrentActivityFocused', with key:'is_current_activity_focused'
06-06 00:59:42.806 I/InstrumentationBackend(23925): Added:'SendTcp', with key:'send_tcp'
06-06 00:59:42.806 I/InstrumentationBackend(23925): Added:'DpToDevicePixel', with key:'dp_to_device_pixel'
06-06 00:59:42.806 I/InstrumentationBackend(23925): Added:'KeyboardEnterText', with key:'keyboard_enter_text'
06-06 00:59:42.807 I/InstrumentationBackend(23925): Added:'DeleteSurroundingText', with key:'delete_surrounding_text'
06-06 00:59:42.807 I/InstrumentationBackend(23925): Added:'SetComposingRegion', with key:'set_composing_region'
06-06 00:59:42.807 I/InstrumentationBackend(23925): Added:'SetSelection', with key:'set_selection'
06-06 00:59:42.807 I/InstrumentationBackend(23925): Added:'KeyboardKeyEvent', with key:'keyboard_key_event'
06-06 00:59:42.807 I/InstrumentationBackend(23925): Added:'PressUserActionButton', with key:'press_user_action_button'
06-06 00:59:42.807 I/InstrumentationBackend(23925): Added:'HideSoftKeyboard', with key:'hide_soft_keyboard'
06-06 00:59:42.807 I/InstrumentationBackend(23925): Added:'ListActions', with key:'list_actions'
06-06 00:59:42.807 I/calabash(23925): Instantiating http server at 7102
06-06 00:59:42.807 I/System.out(23925): HTTP Daemon listening on: 7102
06-06 00:59:42.817 D/EGL_emulation( 1712): eglMakeCurrent: 0xb0685360: ver 2 0 (tinfo 0xb06836c0)
06-06 00:59:42.818 D/EGL_emulation( 1712): eglMakeCurrent: 0xb0685360: ver 2 0 (tinfo 0xb06836c0)
06-06 00:59:42.834 W/InputDispatcher( 1631): channel '6a3af82 com.evancharlton.mileage/com.evancharlton.mileage.Mileage (server)' ~ Consumer closed input channel or an error occurred.  events=0x9
06-06 00:59:42.834 E/InputDispatcher( 1631): channel '6a3af82 com.evancharlton.mileage/com.evancharlton.mileage.Mileage (server)' ~ Channel is unrecoverably broken and will be disposed!
06-06 00:59:42.834 W/InputDispatcher( 1631): channel '887ba7e Toast (server)' ~ Consumer closed input channel or an error occurred.  events=0x9
06-06 00:59:42.834 E/InputDispatcher( 1631): channel '887ba7e Toast (server)' ~ Channel is unrecoverably broken and will be disposed!
06-06 00:59:42.834 I/WindowManager( 1631): WIN DEATH: Window{6a3af82 u0 com.evancharlton.mileage/com.evancharlton.mileage.Mileage EXITING}
06-06 00:59:42.834 W/InputDispatcher( 1631): Attempted to unregister already unregistered input channel '6a3af82 com.evancharlton.mileage/com.evancharlton.mileage.Mileage (server)'
06-06 00:59:42.835 I/WindowManager( 1631): WIN DEATH: Window{887ba7e u0 Toast}
06-06 00:59:42.835 W/InputDispatcher( 1631): Attempted to unregister already unregistered input channel '887ba7e Toast (server)'
06-06 00:59:42.848 D/EGL_emulation( 1712): eglMakeCurrent: 0xb0685360: ver 2 0 (tinfo 0xb06836c0)
06-06 00:59:42.852 D/EGL_emulation( 1712): eglMakeCurrent: 0xb0685360: ver 2 0 (tinfo 0xb06836c0)
06-06 00:59:42.853 D/EGL_emulation( 1712): eglMakeCurrent: 0xb0685360: ver 2 0 (tinfo 0xb06836c0)
06-06 00:59:42.854 D/EGL_emulation( 1712): eglMakeCurrent: 0xb0685360: ver 2 0 (tinfo 0xb06836c0)
06-06 00:59:42.867 D/EGL_emulation( 1712): eglMakeCurrent: 0xb0685360: ver 2 0 (tinfo 0xb06836c0)
06-06 00:59:42.883 D/EGL_emulation( 1712): eglMakeCurrent: 0xb0685360: ver 2 0 (tinfo 0xb06836c0)
06-06 00:59:42.885 D/EGL_emulation( 1712): eglMakeCurrent: 0xb0685360: ver 2 0 (tinfo 0xb06836c0)
06-06 00:59:42.896 I/System.out(23925): URI: //ping
06-06 00:59:42.896 I/System.out(23925): params: {json={}
06-06 00:59:42.896 I/System.out(23925): }
06-06 00:59:42.899 I/System.out(23925): URI: //ping
06-06 00:59:42.899 I/System.out(23925): params: {json={}
06-06 00:59:42.899 I/System.out(23925): }
06-06 00:59:42.900 D/EGL_emulation( 1712): eglMakeCurrent: 0xb0685360: ver 2 0 (tinfo 0xb06836c0)
06-06 00:59:42.901 I/System.out(23925): URI: //ready
06-06 00:59:42.901 I/System.out(23925): params: {json={}
06-06 00:59:42.901 I/System.out(23925): }
06-06 00:59:42.901 D/EGL_emulation( 1712): eglMakeCurrent: 0xb0685360: ver 2 0 (tinfo 0xb06836c0)
06-06 00:59:42.903 I/System.out(23925): URI: //
06-06 00:59:42.903 I/System.out(23925): params: {json={"command":"version","arguments":[]}
06-06 00:59:42.903 I/System.out(23925): }
06-06 00:59:42.903 I/System.out(23925): header: {content-type=application/json;charset=utf-8, date=Sat, 06 Jun 2020 05:59:43 GMT, accept=*/*, host=127.0.0.1:34777, content-length=36, user-agent=HTTPClient/1.0 (2.8.3, ruby 2.5.1 (2018-03-29))}
06-06 00:59:42.903 I/System.out(23925): params: {json={"command":"version","arguments":[]}
06-06 00:59:42.903 I/System.out(23925): }
06-06 00:59:42.903 I/System.out(23925): ProP json = {"command":"version","arguments":[]}
06-06 00:59:42.903 I/System.out(23925): files: {}
06-06 00:59:42.903 I/System.out(23925): command: {"command":"version","arguments":[]}
06-06 00:59:42.906 I/InstrumentationBackend(23925): Got command:'Command:'Line:null,version', arguments:'[]'
06-06 00:59:42.911 I/System.out(23925): result:{"bonusInformation":[],"message":"0.9.8","success":true}
06-06 00:59:42.913 I/System.out(23925): URI: //start-application
06-06 00:59:42.913 I/System.out(23925): params: {json={"intent":null}
06-06 00:59:42.913 I/System.out(23925): }
06-06 00:59:42.917 D/EGL_emulation( 1712): eglMakeCurrent: 0xb0685360: ver 2 0 (tinfo 0xb06836c0)
06-06 00:59:42.918 D/EGL_emulation( 1712): eglMakeCurrent: 0xb0685360: ver 2 0 (tinfo 0xb06836c0)
06-06 00:59:42.926 I/ActivityManager( 1631): START u0 {act=android.intent.action.MAIN cat=[android.intent.category.LAUNCHER] flg=0x10200000 cmp=com.evancharlton.mileage/.Mileage} from uid 10374 on display 0
06-06 00:59:42.932 I/calabash(23925): newActivity1
06-06 00:59:42.940 I/calabash(23925): newActivity1
06-06 00:59:42.942 W/ActivityManager( 1631): Bad activity token: android.os.BinderProxy@6dc08e1
06-06 00:59:42.942 W/ActivityManager( 1631): java.lang.ClassCastException: android.os.BinderProxy cannot be cast to com.android.server.am.ActivityRecord$Token
06-06 00:59:42.942 W/ActivityManager( 1631): 	at com.android.server.am.ActivityRecord.forTokenLocked(ActivityRecord.java:586)
06-06 00:59:42.942 W/ActivityManager( 1631): 	at com.android.server.am.ActivityRecord.isInStackLocked(ActivityRecord.java:1327)
06-06 00:59:42.942 W/ActivityManager( 1631): 	at com.android.server.am.ActivityRecord.getStackLocked(ActivityRecord.java:1332)
06-06 00:59:42.942 W/ActivityManager( 1631): 	at com.android.server.am.ActivityManagerService.getActivityDisplayId(ActivityManagerService.java:9806)
06-06 00:59:42.942 W/ActivityManager( 1631): 	at android.app.ActivityManagerNative.onTransact(ActivityManagerNative.java:2566)
06-06 00:59:42.942 W/ActivityManager( 1631): 	at com.android.server.am.ActivityManagerService.onTransact(ActivityManagerService.java:2757)
06-06 00:59:42.942 W/ActivityManager( 1631): 	at android.os.Binder.execTransact(Binder.java:565)
06-06 00:59:42.943 W/ActivityManager( 1631): Bad activity token: android.os.BinderProxy@6dc08e1
06-06 00:59:42.943 W/ActivityManager( 1631): java.lang.ClassCastException: android.os.BinderProxy cannot be cast to com.android.server.am.ActivityRecord$Token
06-06 00:59:42.943 W/ActivityManager( 1631): 	at com.android.server.am.ActivityRecord.forTokenLocked(ActivityRecord.java:586)
06-06 00:59:42.943 W/ActivityManager( 1631): 	at com.android.server.am.ActivityRecord.isInStackLocked(ActivityRecord.java:1327)
06-06 00:59:42.943 W/ActivityManager( 1631): 	at com.android.server.am.ActivityManagerService.setTaskDescription(ActivityManagerService.java:9358)
06-06 00:59:42.943 W/ActivityManager( 1631): 	at android.app.ActivityManagerNative.onTransact(ActivityManagerNative.java:2639)
06-06 00:59:42.943 W/ActivityManager( 1631): 	at com.android.server.am.ActivityManagerService.onTransact(ActivityManagerService.java:2757)
06-06 00:59:42.943 W/ActivityManager( 1631): 	at android.os.Binder.execTransact(Binder.java:565)
06-06 00:59:42.943 W/ActivityManager( 1631): Bad activity token: android.os.BinderProxy@6dc08e1
06-06 00:59:42.943 W/ActivityManager( 1631): java.lang.ClassCastException: android.os.BinderProxy cannot be cast to com.android.server.am.ActivityRecord$Token
06-06 00:59:42.943 W/ActivityManager( 1631): 	at com.android.server.am.ActivityRecord.forTokenLocked(ActivityRecord.java:586)
06-06 00:59:42.943 W/ActivityManager( 1631): 	at com.android.server.am.ActivityRecord.isInStackLocked(ActivityRecord.java:1327)
06-06 00:59:42.943 W/ActivityManager( 1631): 	at com.android.server.am.ActivityRecord.getStackLocked(ActivityRecord.java:1332)
06-06 00:59:42.943 W/ActivityManager( 1631): 	at com.android.server.am.ActivityManagerService.getActivityStackId(ActivityManagerService.java:9817)
06-06 00:59:42.943 W/ActivityManager( 1631): 	at android.app.ActivityManagerNative.onTransact(ActivityManagerNative.java:2856)
06-06 00:59:42.943 W/ActivityManager( 1631): 	at com.android.server.am.ActivityManagerService.onTransact(ActivityManagerService.java:2757)
06-06 00:59:42.943 W/ActivityManager( 1631): 	at android.os.Binder.execTransact(Binder.java:565)
06-06 00:59:42.950 D/gralloc_ranchu( 1347): gralloc_alloc: Creating ashmem region of size 9023488
06-06 00:59:42.962 W/ActivityManager( 1631): Bad activity token: android.os.BinderProxy@6dc08e1
06-06 00:59:42.962 W/ActivityManager( 1631): java.lang.ClassCastException: android.os.BinderProxy cannot be cast to com.android.server.am.ActivityRecord$Token
06-06 00:59:42.962 W/ActivityManager( 1631): 	at com.android.server.am.ActivityRecord.forTokenLocked(ActivityRecord.java:586)
06-06 00:59:42.962 W/ActivityManager( 1631): 	at com.android.server.am.ActivityRecord.isInStackLocked(ActivityRecord.java:1327)
06-06 00:59:42.962 W/ActivityManager( 1631): 	at com.android.server.am.ActivityManagerService.getActivityOptions(ActivityManagerService.java:12559)
06-06 00:59:42.962 W/ActivityManager( 1631): 	at android.app.ActivityManagerNative.onTransact(ActivityManagerNative.java:1933)
06-06 00:59:42.962 W/ActivityManager( 1631): 	at com.android.server.am.ActivityManagerService.onTransact(ActivityManagerService.java:2757)
06-06 00:59:42.962 W/ActivityManager( 1631): 	at android.os.Binder.execTransact(Binder.java:565)
06-06 00:59:42.963 W/ActivityManager( 1631): Bad activity token: android.os.BinderProxy@6dc08e1
06-06 00:59:42.963 W/ActivityManager( 1631): java.lang.ClassCastException: android.os.BinderProxy cannot be cast to com.android.server.am.ActivityRecord$Token
06-06 00:59:42.963 W/ActivityManager( 1631): 	at com.android.server.am.ActivityRecord.forTokenLocked(ActivityRecord.java:586)
06-06 00:59:42.963 W/ActivityManager( 1631): 	at com.android.server.am.ActivityRecord.isInStackLocked(ActivityRecord.java:1327)
06-06 00:59:42.963 W/ActivityManager( 1631): 	at com.android.server.am.ActivityManagerService.getActivityOptions(ActivityManagerService.java:12559)
06-06 00:59:42.963 W/ActivityManager( 1631): 	at android.app.ActivityManagerNative.onTransact(ActivityManagerNative.java:1933)
06-06 00:59:42.963 W/ActivityManager( 1631): 	at com.android.server.am.ActivityManagerService.onTransact(ActivityManagerService.java:2757)
06-06 00:59:42.963 W/ActivityManager( 1631): 	at android.os.Binder.execTransact(Binder.java:565)
06-06 00:59:42.977 V/PhoneStatusBar( 1712): setLightsOn(true)
06-06 00:59:42.984 D/EGL_emulation( 2076): eglMakeCurrent: 0xb0685360: ver 2 0 (tinfo 0xb06836b0)
06-06 00:59:42.985 D/EGL_emulation( 1712): eglMakeCurrent: 0xb0685360: ver 2 0 (tinfo 0xb06836c0)
06-06 00:59:42.985 V/PhoneStatusBar( 1712): setLightsOn(true)
06-06 00:59:43.000 D/gralloc_ranchu( 1347): gralloc_alloc: Creating ashmem region of size 9023488
06-06 00:59:43.004 D/EGL_emulation( 1712): eglMakeCurrent: 0xb0685360: ver 2 0 (tinfo 0xb06836c0)
06-06 00:59:43.005 D/        (23925): HostConnection::get() New Host Connection established 0x942200c0, tid 23925
06-06 00:59:43.006 D/EGL_emulation( 1712): eglMakeCurrent: 0xb0685360: ver 2 0 (tinfo 0xb06836c0)
06-06 00:59:43.006 V/PhoneStatusBar( 1712): setLightsOn(true)
06-06 00:59:43.037 D/EGL_emulation( 1712): eglMakeCurrent: 0xb0685360: ver 2 0 (tinfo 0xb06836c0)
06-06 00:59:43.040 D/EGL_emulation( 1712): eglMakeCurrent: 0xb0685360: ver 2 0 (tinfo 0xb06836c0)
06-06 00:59:43.055 D/EGL_emulation( 1712): eglMakeCurrent: 0xb0685360: ver 2 0 (tinfo 0xb06836c0)
06-06 00:59:43.057 D/EGL_emulation( 1712): eglMakeCurrent: 0xb0685360: ver 2 0 (tinfo 0xb06836c0)
06-06 00:59:43.067 D/EGL_emulation( 1712): eglMakeCurrent: 0xb0685360: ver 2 0 (tinfo 0xb06836c0)
06-06 00:59:43.069 D/EGL_emulation( 1712): eglMakeCurrent: 0xb0685360: ver 2 0 (tinfo 0xb06836c0)
06-06 00:59:43.084 D/gralloc_ranchu( 1347): gralloc_alloc: Creating ashmem region of size 9023488
06-06 00:59:43.084 D/EGL_emulation( 1712): eglMakeCurrent: 0xb0685360: ver 2 0 (tinfo 0xb06836c0)
06-06 00:59:43.110 D/EGL_emulation( 1712): eglMakeCurrent: 0xb0685360: ver 2 0 (tinfo 0xb06836c0)
06-06 00:59:43.113 I/ActivityManager( 1631): Displayed com.evancharlton.mileage/.Mileage: +184ms
06-06 00:59:43.113 D/EGL_emulation( 1712): eglMakeCurrent: 0xb0685360: ver 2 0 (tinfo 0xb06836c0)
06-06 00:59:43.127 D/EGL_emulation( 1712): eglMakeCurrent: 0xb0685360: ver 2 0 (tinfo 0xb06836c0)
06-06 00:59:43.127 V/PhoneStatusBar( 1712): setLightsOn(true)
06-06 00:59:43.131 D/EGL_emulation( 1712): eglMakeCurrent: 0xb0685360: ver 2 0 (tinfo 0xb06836c0)
06-06 00:59:43.133 D/EGL_emulation( 1712): eglMakeCurrent: 0xb0685360: ver 2 0 (tinfo 0xb06836c0)
06-06 00:59:43.133 I/WindowManager( 1631): Destroying surface Surface(name=com.evancharlton.mileage/com.evancharlton.mileage.Mileage) called by com.android.server.wm.WindowStateAnimator.destroySurface:2016 com.android.server.wm.WindowStateAnimator.destroySurfaceLocked:882 com.android.server.wm.WindowState.removeLocked:1456 com.android.server.wm.WindowManagerService.removeWindowInnerLocked:2484 com.android.server.wm.AppWindowToken.destroySurfaces:365 com.android.server.wm.WindowStateAnimator.finishExit:565 com.android.server.wm.AppWindowAnimator.stepAnimationLocked:427 com.android.server.wm.WindowAnimator.updateAppWindowsLocked:196 
06-06 00:59:43.135 D/EGL_emulation( 1712): eglMakeCurrent: 0xb0685360: ver 2 0 (tinfo 0xb06836c0)
06-06 00:59:43.137 D/EGL_emulation( 1712): eglMakeCurrent: 0xb0685360: ver 2 0 (tinfo 0xb06836c0)
06-06 00:59:43.146 I/ProcessStatsService( 1631): Prepared write state in 1ms
06-06 00:59:43.150 D/EGL_emulation( 1712): eglMakeCurrent: 0xb0685360: ver 2 0 (tinfo 0xb06836c0)
06-06 00:59:43.152 D/EGL_emulation( 1712): eglMakeCurrent: 0xb0685360: ver 2 0 (tinfo 0xb06836c0)
06-06 00:59:43.152 I/System.out(23925): URI: //map
06-06 00:59:43.152 I/System.out(23925): params: {json={"query":"* marked:'Statistics'","operation":{"method_name":"query","arguments":[]}}
06-06 00:59:43.152 I/System.out(23925): }
06-06 00:59:43.153 V/PhoneStatusBar( 1712): setLightsOn(true)
06-06 00:59:43.167 D/EGL_emulation( 1712): eglMakeCurrent: 0xb0685360: ver 2 0 (tinfo 0xb06836c0)
06-06 00:59:43.168 W/ResourceType(23925): No package identifier when getting name for resource number 0x00000001
06-06 00:59:43.169 D/EGL_emulation( 1712): eglMakeCurrent: 0xb0685360: ver 2 0 (tinfo 0xb06836c0)
06-06 00:59:43.185 D/EGL_emulation( 1712): eglMakeCurrent: 0xb0685360: ver 2 0 (tinfo 0xb06836c0)
06-06 00:59:43.188 D/EGL_emulation( 1712): eglMakeCurrent: 0xb0685360: ver 2 0 (tinfo 0xb06836c0)
06-06 00:59:43.193 I/System.out(23925): URI: //gesture
06-06 00:59:43.193 I/System.out(23925): params: {json={"query_timeout":5.0,"gestures":[{"query_string":"* marked:'Statistics'","touches":[{"x":50,"y":50,"offset_x":0,"offset_y":0,"wait":0.0,"time":0.2,"release":true,"query_string":null}]}]}
06-06 00:59:43.193 I/System.out(23925): }
06-06 00:59:43.199 W/ResourceType(23925): No package identifier when getting name for resource number 0x00000001
06-06 00:59:43.200 D/EGL_emulation( 1712): eglMakeCurrent: 0xb0685360: ver 2 0 (tinfo 0xb06836c0)
06-06 00:59:43.316 I/WindowManager( 1631): Destroying surface Surface(name=Starting com.evancharlton.mileage) called by com.android.server.wm.WindowStateAnimator.destroySurface:2016 com.android.server.wm.WindowStateAnimator.destroySurfaceLocked:882 com.android.server.wm.WindowState.destroyOrSaveSurface:2100 com.android.server.wm.AppWindowToken.destroySurfaces:363 com.android.server.wm.WindowStateAnimator.finishExit:565 com.android.server.wm.WindowStateAnimator.stepAnimationLocked:491 com.android.server.wm.WindowAnimator.updateWindowsLocked:303 com.android.server.wm.WindowAnimator.animateLocked:704 
06-06 00:59:43.320 V/PhoneStatusBar( 1712): setLightsOn(true)
06-06 00:59:43.321 V/PhoneStatusBar( 1712): setLightsOn(true)
06-06 00:59:43.367 V/PhoneStatusBar( 1712): setLightsOn(true)
06-06 00:59:43.368 I/WindowManager( 1631): Destroying surface Surface(name=Toast) called by com.android.server.wm.WindowStateAnimator.destroySurface:2016 com.android.server.wm.WindowStateAnimator.destroySurfaceLocked:882 com.android.server.wm.WindowState.destroyOrSaveSurface:2100 com.android.server.wm.WindowSurfacePlacer.performSurfacePlacementInner:429 com.android.server.wm.WindowSurfacePlacer.performSurfacePlacementLoop:232 com.android.server.wm.WindowSurfacePlacer.performSurfacePlacement:180 com.android.server.wm.WindowManagerService$H.handleMessage:8086 android.os.Handler.dispatchMessage:102 
06-06 00:59:43.368 V/PhoneStatusBar( 1712): setLightsOn(true)
06-06 00:59:43.400 V/PhoneStatusBar( 1712): setLightsOn(true)
06-06 00:59:43.435 I/calabash(23925): newActivity1
06-06 00:59:43.444 I/System.out(23925): URI: //map
06-06 00:59:43.444 I/System.out(23925): params: {json={"query":"android.widget.ScrollView index:0","operation":{"method_name":"query","arguments":[]}}
06-06 00:59:43.444 I/System.out(23925): }
06-06 00:59:43.449 W/ActivityManager( 1631): Bad activity token: android.os.BinderProxy@3e6bdb7
06-06 00:59:43.449 W/ActivityManager( 1631): java.lang.ClassCastException: android.os.BinderProxy cannot be cast to com.android.server.am.ActivityRecord$Token
06-06 00:59:43.449 W/ActivityManager( 1631): 	at com.android.server.am.ActivityRecord.forTokenLocked(ActivityRecord.java:586)
06-06 00:59:43.449 W/ActivityManager( 1631): 	at com.android.server.am.ActivityRecord.isInStackLocked(ActivityRecord.java:1327)
06-06 00:59:43.449 W/ActivityManager( 1631): 	at com.android.server.am.ActivityRecord.getStackLocked(ActivityRecord.java:1332)
06-06 00:59:43.449 W/ActivityManager( 1631): 	at com.android.server.am.ActivityManagerService.getActivityDisplayId(ActivityManagerService.java:9806)
06-06 00:59:43.449 W/ActivityManager( 1631): 	at android.app.ActivityManagerNative.onTransact(ActivityManagerNative.java:2566)
06-06 00:59:43.449 W/ActivityManager( 1631): 	at com.android.server.am.ActivityManagerService.onTransact(ActivityManagerService.java:2757)
06-06 00:59:43.449 W/ActivityManager( 1631): 	at android.os.Binder.execTransact(Binder.java:565)
06-06 00:59:43.450 W/ActivityManager( 1631): Bad activity token: android.os.BinderProxy@3e6bdb7
06-06 00:59:43.450 W/ActivityManager( 1631): java.lang.ClassCastException: android.os.BinderProxy cannot be cast to com.android.server.am.ActivityRecord$Token
06-06 00:59:43.450 W/ActivityManager( 1631): 	at com.android.server.am.ActivityRecord.forTokenLocked(ActivityRecord.java:586)
06-06 00:59:43.450 W/ActivityManager( 1631): 	at com.android.server.am.ActivityRecord.isInStackLocked(ActivityRecord.java:1327)
06-06 00:59:43.450 W/ActivityManager( 1631): 	at com.android.server.am.ActivityManagerService.setTaskDescription(ActivityManagerService.java:9358)
06-06 00:59:43.450 W/ActivityManager( 1631): 	at android.app.ActivityManagerNative.onTransact(ActivityManagerNative.java:2639)
06-06 00:59:43.450 W/ActivityManager( 1631): 	at com.android.server.am.ActivityManagerService.onTransact(ActivityManagerService.java:2757)
06-06 00:59:43.450 W/ActivityManager( 1631): 	at android.os.Binder.execTransact(Binder.java:565)
06-06 00:59:43.450 W/ActivityManager( 1631): Bad activity token: android.os.BinderProxy@3e6bdb7
06-06 00:59:43.450 W/ActivityManager( 1631): java.lang.ClassCastException: android.os.BinderProxy cannot be cast to com.android.server.am.ActivityRecord$Token
06-06 00:59:43.450 W/ActivityManager( 1631): 	at com.android.server.am.ActivityRecord.forTokenLocked(ActivityRecord.java:586)
06-06 00:59:43.450 W/ActivityManager( 1631): 	at com.android.server.am.ActivityRecord.isInStackLocked(ActivityRecord.java:1327)
06-06 00:59:43.450 W/ActivityManager( 1631): 	at com.android.server.am.ActivityRecord.getStackLocked(ActivityRecord.java:1332)
06-06 00:59:43.450 W/ActivityManager( 1631): 	at com.android.server.am.ActivityManagerService.getActivityStackId(ActivityManagerService.java:9817)
06-06 00:59:43.450 W/ActivityManager( 1631): 	at android.app.ActivityManagerNative.onTransact(ActivityManagerNative.java:2856)
06-06 00:59:43.450 W/ActivityManager( 1631): 	at com.android.server.am.ActivityManagerService.onTransact(ActivityManagerService.java:2757)
06-06 00:59:43.450 W/ActivityManager( 1631): 	at android.os.Binder.execTransact(Binder.java:565)
06-06 00:59:43.457 D/VehicleStatisticsActivity(23925): Checking recalculation ...
06-06 00:59:43.458 D/VehicleStatisticsActivity(23925): Recalculation not necessary.
06-06 00:59:43.459 W/ActivityManager( 1631): Bad activity token: android.os.BinderProxy@3e6bdb7
06-06 00:59:43.459 W/ActivityManager( 1631): java.lang.ClassCastException: android.os.BinderProxy cannot be cast to com.android.server.am.ActivityRecord$Token
06-06 00:59:43.459 W/ActivityManager( 1631): 	at com.android.server.am.ActivityRecord.forTokenLocked(ActivityRecord.java:586)
06-06 00:59:43.459 W/ActivityManager( 1631): 	at com.android.server.am.ActivityRecord.isInStackLocked(ActivityRecord.java:1327)
06-06 00:59:43.459 W/ActivityManager( 1631): 	at com.android.server.am.ActivityManagerService.getActivityOptions(ActivityManagerService.java:12559)
06-06 00:59:43.459 W/ActivityManager( 1631): 	at android.app.ActivityManagerNative.onTransact(ActivityManagerNative.java:1933)
06-06 00:59:43.459 W/ActivityManager( 1631): 	at com.android.server.am.ActivityManagerService.onTransact(ActivityManagerService.java:2757)
06-06 00:59:43.459 W/ActivityManager( 1631): 	at android.os.Binder.execTransact(Binder.java:565)
06-06 00:59:43.459 W/ActivityManager( 1631): Bad activity token: android.os.BinderProxy@3e6bdb7
06-06 00:59:43.459 W/ActivityManager( 1631): java.lang.ClassCastException: android.os.BinderProxy cannot be cast to com.android.server.am.ActivityRecord$Token
06-06 00:59:43.459 W/ActivityManager( 1631): 	at com.android.server.am.ActivityRecord.forTokenLocked(ActivityRecord.java:586)
06-06 00:59:43.459 W/ActivityManager( 1631): 	at com.android.server.am.ActivityRecord.isInStackLocked(ActivityRecord.java:1327)
06-06 00:59:43.459 W/ActivityManager( 1631): 	at com.android.server.am.ActivityManagerService.getActivityOptions(ActivityManagerService.java:12559)
06-06 00:59:43.459 W/ActivityManager( 1631): 	at android.app.ActivityManagerNative.onTransact(ActivityManagerNative.java:1933)
06-06 00:59:43.459 W/ActivityManager( 1631): 	at com.android.server.am.ActivityManagerService.onTransact(ActivityManagerService.java:2757)
06-06 00:59:43.459 W/ActivityManager( 1631): 	at android.os.Binder.execTransact(Binder.java:565)
06-06 00:59:43.461 D/VehicleStatisticsActivity(23925): Checking recalculation ...
06-06 00:59:43.462 D/VehicleStatisticsActivity(23925): Recalculation not necessary.
06-06 00:59:43.537 I/System.out(23925): URI: //map
06-06 00:59:43.537 I/System.out(23925): params: {json={"query":"android.widget.AbsListView index:0","operation":{"method_name":"query","arguments":[]}}
06-06 00:59:43.537 I/System.out(23925): }
06-06 00:59:43.545 I/art     (23925): Do partial code cache collection, code=30KB, data=29KB
06-06 00:59:43.545 I/art     (23925): After code cache collection, code=29KB, data=28KB
06-06 00:59:43.545 I/art     (23925): Increasing code cache capacity to 128KB
06-06 00:59:43.563 I/System.out(23925): URI: //map
06-06 00:59:43.563 I/System.out(23925): params: {json={"query":"android.widget.AbsListView index:0","operation":{"method_name":"query","arguments":[]}}
06-06 00:59:43.563 I/System.out(23925): }
06-06 00:59:43.582 I/System.out(23925): URI: //map
06-06 00:59:43.582 I/System.out(23925): params: {json={"query":"android.widget.AbsListView index:0","operation":{"method_name":"query","arguments":[]}}
06-06 00:59:43.582 I/System.out(23925): }
06-06 00:59:43.598 I/System.out(23925): URI: //map
06-06 00:59:43.598 I/System.out(23925): params: {json={"query":"android.widget.AbsListView index:0","operation":{"method_name":"query","arguments":["getFirstVisiblePosition"]}}
06-06 00:59:43.598 I/System.out(23925): }
06-06 00:59:43.612 I/System.out(23925): URI: //map
06-06 00:59:43.612 I/System.out(23925): params: {json={"query":"android.widget.AbsListView index:0","operation":{"method_name":"query","arguments":["getLastVisiblePosition"]}}
06-06 00:59:43.612 I/System.out(23925): }
06-06 00:59:43.629 I/System.out(23925): URI: //map
06-06 00:59:43.629 I/System.out(23925): params: {json={"query":"android.widget.AbsListView index:0","operation":{"method_name":"query","arguments":[{"method_name":"setSelection","arguments":[26]}]}}
06-06 00:59:43.629 I/System.out(23925): }
06-06 00:59:43.652 I/System.out(23925): URI: //map
06-06 00:59:43.652 I/System.out(23925): params: {json={"query":"* marked:'North'","operation":{"method_name":"query","arguments":[]}}
06-06 00:59:43.652 I/System.out(23925): }
06-06 00:59:43.699 D/gralloc_ranchu( 1347): gralloc_alloc: Creating ashmem region of size 9023488
06-06 00:59:43.701 V/PhoneStatusBar( 1712): setLightsOn(true)
06-06 00:59:43.702 W/OpenGLRenderer( 2076): Incorrectly called buildLayer on View: ShortcutAndWidgetContainer, destroying layer...
06-06 00:59:43.703 V/PhoneStatusBar( 1712): setLightsOn(true)
06-06 00:59:43.719 V/PhoneStatusBar( 1712): setLightsOn(true)
06-06 00:59:43.721 I/WindowManager( 1631): Destroying surface Surface(name=com.android.launcher3/com.android.launcher3.Launcher) called by com.android.server.wm.WindowStateAnimator.destroySurface:2016 com.android.server.wm.WindowStateAnimator.destroySurfaceLocked:882 com.android.server.wm.WindowState.destroyOrSaveSurface:2100 com.android.server.wm.AppWindowToken.destroySurfaces:363 com.android.server.wm.AppWindowToken.notifyAppStopped:389 com.android.server.wm.WindowManagerService.notifyAppStopped:4463 com.android.server.am.ActivityStack.activityStoppedLocked:1252 com.android.server.am.ActivityManagerService.activityStopped:6903 
06-06 00:59:43.744 W/ResourceType(23925): No package identifier when getting name for resource number 0x00000001
06-06 00:59:43.759 I/System.out(23925): URI: //gesture
06-06 00:59:43.759 I/System.out(23925): params: {json={"query_timeout":5.0,"gestures":[{"query_string":"* marked:'North'","touches":[{"x":50,"y":50,"offset_x":0,"offset_y":0,"wait":0.0,"time":0.2,"release":true,"query_string":null}]}]}
06-06 00:59:43.759 I/System.out(23925): }
06-06 00:59:43.763 W/ResourceType(23925): No package identifier when getting name for resource number 0x00000001
06-06 00:59:44.001 I/ActivityManager( 1631): START u0 {cmp=com.evancharlton.mileage/.charts.NorthChart (has extras)} from uid 10374 on display 0
06-06 00:59:44.004 V/PhoneStatusBar( 1712): setLightsOn(true)
06-06 00:59:44.005 V/PhoneStatusBar( 1712): setLightsOn(true)
06-06 00:59:44.018 I/System.out(23925): URI: //map
06-06 00:59:44.018 I/System.out(23925): params: {json={"query":"* {text CONTAINS[c] 'Farthest north fillup'}","operation":{"method_name":"query","arguments":[]}}
06-06 00:59:44.018 I/System.out(23925): }
06-06 00:59:44.070 I/calabash(23925): newActivity1
06-06 00:59:44.074 W/aiCharts(23925): License file is invalid or missing. 
06-06 00:59:44.074 W/aiCharts(23925): Please place proper license.lic to /assets folder.
06-06 00:59:44.090 V/PhoneStatusBar( 1712): setLightsOn(true)
06-06 00:59:44.116 V/PhoneStatusBar( 1712): setLightsOn(true)
06-06 00:59:44.121 I/WindowManager( 1631): Destroying surface Surface(name=Creating chart…) called by com.android.server.wm.WindowStateAnimator.destroySurface:2016 com.android.server.wm.WindowStateAnimator.destroySurfaceLocked:882 com.android.server.wm.WindowState.removeLocked:1456 com.android.server.wm.WindowManagerService.removeWindowInnerLocked:2484 com.android.server.wm.WindowManagerService.removeWindowLocked:2442 com.android.server.wm.WindowManagerService.removeWindowLocked:2311 com.android.server.wm.WindowManagerService.removeWindow:2306 com.android.server.wm.Session.remove:202 
06-06 00:59:44.124 W/NotificationService( 1631): Object died trying to hide notification android.app.ITransientNotification$Stub$Proxy@8657f66 in package com.evancharlton.mileage
06-06 00:59:44.124 D/gralloc_ranchu( 1347): gralloc_alloc: Creating ashmem region of size 9023488
06-06 00:59:44.133 V/PhoneStatusBar( 1712): setLightsOn(true)
06-06 00:59:44.146 I/ActivityManager( 1631): Displayed com.evancharlton.mileage/.charts.NorthChart: +80ms
06-06 00:59:44.150 V/PhoneStatusBar( 1712): setLightsOn(true)
06-06 00:59:44.184 V/PhoneStatusBar( 1712): setLightsOn(true)
06-06 00:59:44.201 V/PhoneStatusBar( 1712): setLightsOn(true)
06-06 00:59:44.384 V/PhoneStatusBar( 1712): setLightsOn(true)
06-06 00:59:44.404 I/System.out(23925): URI: //map
06-06 00:59:44.404 I/System.out(23925): params: {json={"query":"* {text CONTAINS[c] 'Farthest north fillup'}","operation":{"method_name":"query","arguments":[]}}
06-06 00:59:44.404 I/System.out(23925): }
06-06 00:59:44.418 I/System.out(23925): URI: //
06-06 00:59:44.418 I/System.out(23925): params: {json={"command":"press_key","arguments":["KEYCODE_BACK"]}
06-06 00:59:44.418 I/System.out(23925): }
06-06 00:59:44.418 I/System.out(23925): header: {content-type=application/json;charset=utf-8, date=Sat, 06 Jun 2020 05:59:44 GMT, accept=*/*, host=127.0.0.1:34777, content-length=52, user-agent=HTTPClient/1.0 (2.8.3, ruby 2.5.1 (2018-03-29))}
06-06 00:59:44.418 I/System.out(23925): params: {json={"command":"press_key","arguments":["KEYCODE_BACK"]}
06-06 00:59:44.418 I/System.out(23925): }
06-06 00:59:44.418 I/System.out(23925): ProP json = {"command":"press_key","arguments":["KEYCODE_BACK"]}
06-06 00:59:44.418 I/System.out(23925): files: {}
06-06 00:59:44.418 I/System.out(23925): command: {"command":"press_key","arguments":["KEYCODE_BACK"]}
06-06 00:59:44.419 I/InstrumentationBackend(23925): Got command:'Command:'Line:null,press_key', arguments:'[KEYCODE_BACK]'
06-06 00:59:44.421 V/PhoneStatusBar( 1712): setLightsOn(true)
06-06 00:59:44.423 V/PhoneStatusBar( 1712): setLightsOn(true)
06-06 00:59:44.425 I/art     (23925): Do partial code cache collection, code=60KB, data=62KB
06-06 00:59:44.425 I/art     (23925): After code cache collection, code=59KB, data=61KB
06-06 00:59:44.425 I/art     (23925): Increasing code cache capacity to 256KB
06-06 00:59:44.425 I/System.out(23925): result:{"bonusInformation":[],"message":"","success":true}
06-06 00:59:44.425 D/VehicleStatisticsActivity(23925): Checking recalculation ...
06-06 00:59:44.426 D/VehicleStatisticsActivity(23925): Recalculation not necessary.
06-06 00:59:44.427 I/System.out(23925): URI: //map
06-06 00:59:44.427 I/System.out(23925): params: {json={"query":"* {text CONTAINS[c] 'Statistics'}","operation":{"method_name":"query","arguments":[]}}
06-06 00:59:44.427 I/System.out(23925): }
06-06 00:59:44.433 V/PhoneStatusBar( 1712): setLightsOn(true)
06-06 00:59:44.450 D/gralloc_ranchu( 1347): gralloc_alloc: Creating ashmem region of size 9023488
06-06 00:59:44.450 V/PhoneStatusBar( 1712): setLightsOn(true)
06-06 00:59:44.466 V/PhoneStatusBar( 1712): setLightsOn(true)
06-06 00:59:44.483 V/PhoneStatusBar( 1712): setLightsOn(true)
