--------- beginning of main
06-06 00:59:28.799 V/PhoneStatusBar( 1712): setLightsOn(true)
06-06 00:59:28.800 D/gralloc_ranchu( 1347): gralloc_alloc: Creating ashmem region of size 3145728
06-06 00:59:28.804 E/EGL_emulation( 1347): tid 1347: eglCreateSyncKHR(1901): error 0x3004 (EGL_BAD_ATTRIBUTE)
--------- beginning of system
06-06 00:59:28.818 W/ActivityManager( 1631): Finishing task with all activities already finished
06-06 00:59:28.818 W/ActivityManager( 1631): Duplicate finish request for ActivityRecord{ed0f863 u0 com.evancharlton.mileage/.Mileage t10848 f}
06-06 00:59:28.818 W/ActivityManager( 1631): Finishing task with all activities already finished
06-06 00:59:28.818 W/ActivityManager( 1631): Duplicate finish request for ActivityRecord{ed0f863 u0 com.evancharlton.mileage/.Mileage t10848 f}
06-06 00:59:28.818 W/ActivityManager( 1631): Finishing task with all activities already finished
06-06 00:59:28.818 W/ActivityManager( 1631): Duplicate finish request for ActivityRecord{ed0f863 u0 com.evancharlton.mileage/.Mileage t10848 f}
06-06 00:59:28.818 W/ActivityManager( 1631): Finishing task with all activities already finished
06-06 00:59:28.818 W/ActivityManager( 1631): Duplicate finish request for ActivityRecord{ed0f863 u0 com.evancharlton.mileage/.Mileage t10848 f}
06-06 00:59:28.818 W/ActivityManager( 1631): Finishing task with all activities already finished
06-06 00:59:28.818 W/ActivityManager( 1631): Duplicate finish request for ActivityRecord{ed0f863 u0 com.evancharlton.mileage/.Mileage t10848 f}
06-06 00:59:28.818 W/ActivityManager( 1631): Finishing task with all activities already finished
06-06 00:59:28.818 W/ActivityManager( 1631): Duplicate finish request for ActivityRecord{b8166b5 u0 com.evancharlton.mileage/.charts.AveragePriceChart t10848 f}
06-06 00:59:28.818 W/ActivityManager( 1631): Finishing task with all activities already finished
06-06 00:59:28.819 W/ActivityManager( 1631): Duplicate finish request for ActivityRecord{b8166b5 u0 com.evancharlton.mileage/.charts.AveragePriceChart t10848 f}
06-06 00:59:28.819 W/ActivityManager( 1631): Finishing task with all activities already finished
06-06 00:59:28.819 W/ActivityManager( 1631): Duplicate finish request for ActivityRecord{ed0f863 u0 com.evancharlton.mileage/.Mileage t10848 f}
06-06 00:59:28.819 W/ActivityManager( 1631): Finishing task with all activities already finished
06-06 00:59:28.819 W/ActivityManager( 1631): Duplicate finish request for ActivityRecord{ed0f863 u0 com.evancharlton.mileage/.Mileage t10848 f}
06-06 00:59:28.851 D/EGL_emulation( 1712): eglMakeCurrent: 0xb0685360: ver 2 0 (tinfo 0xb06836c0)
06-06 00:59:28.851 D/EGL_emulation( 2076): eglMakeCurrent: 0xb0685360: ver 2 0 (tinfo 0xb06836b0)
06-06 00:59:28.867 D/EGL_emulation( 1712): eglMakeCurrent: 0xb0685360: ver 2 0 (tinfo 0xb06836c0)
06-06 00:59:28.885 D/EGL_emulation( 1712): eglMakeCurrent: 0xb0685360: ver 2 0 (tinfo 0xb06836c0)
06-06 00:59:28.900 D/EGL_emulation( 1712): eglMakeCurrent: 0xb0685360: ver 2 0 (tinfo 0xb06836c0)
06-06 00:59:28.902 D/EGL_emulation( 1712): eglMakeCurrent: 0xb0685360: ver 2 0 (tinfo 0xb06836c0)
06-06 00:59:28.917 D/EGL_emulation( 1712): eglMakeCurrent: 0xb0685360: ver 2 0 (tinfo 0xb06836c0)
06-06 00:59:28.918 D/EGL_emulation( 1712): eglMakeCurrent: 0xb0685360: ver 2 0 (tinfo 0xb06836c0)
06-06 00:59:28.933 D/EGL_emulation( 1712): eglMakeCurrent: 0xb0685360: ver 2 0 (tinfo 0xb06836c0)
06-06 00:59:28.935 D/EGL_emulation( 1712): eglMakeCurrent: 0xb0685360: ver 2 0 (tinfo 0xb06836c0)
06-06 00:59:28.950 D/EGL_emulation( 1712): eglMakeCurrent: 0xb0685360: ver 2 0 (tinfo 0xb06836c0)
06-06 00:59:28.952 D/EGL_emulation( 1712): eglMakeCurrent: 0xb0685360: ver 2 0 (tinfo 0xb06836c0)
06-06 00:59:28.967 D/EGL_emulation( 1712): eglMakeCurrent: 0xb0685360: ver 2 0 (tinfo 0xb06836c0)
06-06 00:59:28.970 D/EGL_emulation( 1712): eglMakeCurrent: 0xb0685360: ver 2 0 (tinfo 0xb06836c0)
06-06 00:59:28.974 D/AndroidRuntime(23487): >>>>>> START com.android.internal.os.RuntimeInit uid 2000 <<<<<<
06-06 00:59:28.975 D/AndroidRuntime(23487): CheckJNI is ON
06-06 00:59:28.983 D/EGL_emulation( 1712): eglMakeCurrent: 0xb0685360: ver 2 0 (tinfo 0xb06836c0)
06-06 00:59:28.985 D/EGL_emulation( 1712): eglMakeCurrent: 0xb0685360: ver 2 0 (tinfo 0xb06836c0)
06-06 00:59:28.986 W/art     (23487): Unexpected CPU variant for X86 using defaults: x86
06-06 00:59:28.988 D/ICU     (23487): No timezone override file found: /data/misc/zoneinfo/current/icu/icu_tzdata.dat
06-06 00:59:28.995 E/memtrack(23487): Couldn't load memtrack module (No such file or directory)
06-06 00:59:28.995 E/android.os.Debug(23487): failed to load memtrack module: -2
06-06 00:59:28.995 I/Radio-JNI(23487): register_android_hardware_Radio DONE
06-06 00:59:28.999 D/AndroidRuntime(23487): Calling main entry com.android.commands.am.Am
06-06 00:59:29.000 D/EGL_emulation( 1712): eglMakeCurrent: 0xb0685360: ver 2 0 (tinfo 0xb06836c0)
06-06 00:59:29.001 I/ActivityManager( 1631): Force stopping com.evancharlton.mileage appid=10374 user=0: start instr
06-06 00:59:29.001 I/ActivityManager( 1631): Killing 23436:com.evancharlton.mileage/u0a374 (adj 0): stop com.evancharlton.mileage
06-06 00:59:29.001 D/ActivityManager( 1631): cleanUpApplicationRecord -- 23436
06-06 00:59:29.001 D/EGL_emulation( 1712): eglMakeCurrent: 0xb0685360: ver 2 0 (tinfo 0xb06836c0)
06-06 00:59:29.003 I/WindowManager( 1631): Destroying surface Surface(name=com.evancharlton.mileage/com.evancharlton.mileage.charts.AveragePriceChart) called by com.android.server.wm.WindowStateAnimator.destroySurface:2016 com.android.server.wm.WindowStateAnimator.destroySurfaceLocked:882 com.android.server.wm.WindowState.removeLocked:1456 com.android.server.wm.WindowManagerService.removeWindowInnerLocked:2484 com.android.server.wm.WindowManagerService.removeWindowLocked:2442 com.android.server.wm.WindowManagerService.removeWindowLocked:2311 com.android.server.wm.AppWindowToken.removeAllWindows:530 com.android.server.wm.AppWindowToken.removeAppFromTaskLocked:326 
06-06 00:59:29.005 W/ActivityManager( 1631): Crash of app com.evancharlton.mileage running instrumentation ComponentInfo{com.evancharlton.mileage.test/sh.calaba.instrumentationbackend.CalabashInstrumentationTestRunner}
06-06 00:59:29.005 I/ActivityManager( 1631): Force stopping com.evancharlton.mileage appid=10374 user=0: finished inst
06-06 00:59:29.007 I/art     (23497): Not late-enabling -Xcheck:jni (already on)
06-06 00:59:29.008 W/art     (23497): Unexpected CPU variant for X86 using defaults: x86
06-06 00:59:29.015 I/ActivityManager( 1631): Start proc 23497:com.evancharlton.mileage/u0a374 for added application com.evancharlton.mileage
06-06 00:59:29.015 D/AndroidRuntime(23487): Shutting down VM
06-06 00:59:29.017 D/EGL_emulation( 1712): eglMakeCurrent: 0xb0685360: ver 2 0 (tinfo 0xb06836c0)
06-06 00:59:29.019 D/EGL_emulation( 1712): eglMakeCurrent: 0xb0685360: ver 2 0 (tinfo 0xb06836c0)
06-06 00:59:29.020 W/System  (23497): ClassLoader referenced unknown path: /data/app/com.evancharlton.mileage.test-1/lib/x86
06-06 00:59:29.020 W/System  (23497): ClassLoader referenced unknown path: /data/app/com.evancharlton.mileage-1/lib/x86
06-06 00:59:29.022 W/System  (23497): ClassLoader referenced unknown path: 
06-06 00:59:29.027 I/System.out(23497): Main activity name automatically set to: com.evancharlton.mileage.Mileage
06-06 00:59:29.028 I/System.out(23497): Calabash did not load Mono. This is only a problem if you are trying to test a Mono application
06-06 00:59:29.028 I/calabash(23497): Test server port: 7102
06-06 00:59:29.029 I/InstrumentationBackend(23497): Added:'GetPreferences', with key:'get_preferences'
06-06 00:59:29.033 D/EGL_emulation( 1712): eglMakeCurrent: 0xb0685360: ver 2 0 (tinfo 0xb06836c0)
06-06 00:59:29.035 D/EGL_emulation( 1712): eglMakeCurrent: 0xb0685360: ver 2 0 (tinfo 0xb06836c0)
06-06 00:59:29.036 I/InstrumentationBackend(23497): Added:'SetPreferences', with key:'set_preferences'
06-06 00:59:29.036 I/InstrumentationBackend(23497): Added:'ClearPreferences', with key:'clear_preferences'
06-06 00:59:29.036 I/InstrumentationBackend(23497): Added:'PressElement', with key:'press_l10n_element'
06-06 00:59:29.036 I/InstrumentationBackend(23497): Added:'WaitForElement', with key:'wait_for_l10n_element'
06-06 00:59:29.036 I/InstrumentationBackend(23497): Added:'NullAction', with key:'nullAction'
06-06 00:59:29.036 I/InstrumentationBackend(23497): Added:'PressKey', with key:'press_key'
06-06 00:59:29.036 I/InstrumentationBackend(23497): Added:'SetActivityOrientation', with key:'set_activity_orientation'
06-06 00:59:29.036 I/InstrumentationBackend(23497): Added:'GetActivityOrientation', with key:'get_activity_orientation'
06-06 00:59:29.036 I/InstrumentationBackend(23497): Added:'FakeGPSLocation', with key:'set_gps_coordinates'
06-06 00:59:29.037 I/InstrumentationBackend(23497): Added:'SetPropertyByCssSelector', with key:'set_property_by_css_selector'
06-06 00:59:29.037 I/InstrumentationBackend(23497): Added:'GetUrl', with key:'get_url'
06-06 00:59:29.037 I/InstrumentationBackend(23497): Added:'ScrollTo', with key:'scroll_to'
06-06 00:59:29.037 I/InstrumentationBackend(23497): Added:'GetLoadProgress', with key:'get_load_progress'
06-06 00:59:29.037 I/InstrumentationBackend(23497): Added:'DumpHtml', with key:'dump_html'
06-06 00:59:29.037 I/InstrumentationBackend(23497): Added:'DumpBodyHtml', with key:'dump_body_html'
06-06 00:59:29.037 I/InstrumentationBackend(23497): Added:'EnterTextByCssSelector', with key:'enter_text_by_selector'
06-06 00:59:29.038 I/InstrumentationBackend(23497): Added:'AndroidSDKVersion', with key:'android_sdk_version'
06-06 00:59:29.038 I/InstrumentationBackend(23497): Added:'Version', with key:'version'
06-06 00:59:29.038 I/InstrumentationBackend(23497): Added:'Drag', with key:'drag'
06-06 00:59:29.038 I/InstrumentationBackend(23497): Added:'TouchCoordinates', with key:'touch_coordinate'
06-06 00:59:29.038 I/InstrumentationBackend(23497): Added:'LongPressCoordinate', with key:'long_press_coordinate'
06-06 00:59:29.038 I/InstrumentationBackend(23497): Added:'DragCoordinates', with key:'drag_coordinates'
06-06 00:59:29.038 I/InstrumentationBackend(23497): Added:'ResumeApplication', with key:'resume_application'
06-06 00:59:29.038 I/InstrumentationBackend(23497): Added:'Swipe', with key:'swipe'
06-06 00:59:29.038 I/InstrumentationBackend(23497): Added:'DoubleTapCoordinate', with key:'double_tap_coordinate'
06-06 00:59:29.038 I/InstrumentationBackend(23497): Added:'ClickOnScreen', with key:'click_on_screen'
06-06 00:59:29.038 I/InstrumentationBackend(23497): Added:'GetActivityName', with key:'get_activity_name'
06-06 00:59:29.038 I/InstrumentationBackend(23497): Added:'ScrollToView', with key:'scroll_to_view'
06-06 00:59:29.038 I/InstrumentationBackend(23497): Added:'ViewConfiguration', with key:'view_configuration'
06-06 00:59:29.039 I/InstrumentationBackend(23497): Added:'IsCurrentActivityFocused', with key:'is_current_activity_focused'
06-06 00:59:29.039 I/InstrumentationBackend(23497): Added:'SendTcp', with key:'send_tcp'
06-06 00:59:29.039 I/InstrumentationBackend(23497): Added:'DpToDevicePixel', with key:'dp_to_device_pixel'
06-06 00:59:29.039 I/InstrumentationBackend(23497): Added:'KeyboardEnterText', with key:'keyboard_enter_text'
06-06 00:59:29.039 I/InstrumentationBackend(23497): Added:'DeleteSurroundingText', with key:'delete_surrounding_text'
06-06 00:59:29.039 I/InstrumentationBackend(23497): Added:'SetComposingRegion', with key:'set_composing_region'
06-06 00:59:29.039 I/InstrumentationBackend(23497): Added:'SetSelection', with key:'set_selection'
06-06 00:59:29.039 I/InstrumentationBackend(23497): Added:'KeyboardKeyEvent', with key:'keyboard_key_event'
06-06 00:59:29.039 I/InstrumentationBackend(23497): Added:'PressUserActionButton', with key:'press_user_action_button'
06-06 00:59:29.039 I/InstrumentationBackend(23497): Added:'HideSoftKeyboard', with key:'hide_soft_keyboard'
06-06 00:59:29.039 I/InstrumentationBackend(23497): Added:'ListActions', with key:'list_actions'
06-06 00:59:29.039 I/calabash(23497): Instantiating http server at 7102
06-06 00:59:29.040 I/System.out(23497): HTTP Daemon listening on: 7102
06-06 00:59:29.050 D/EGL_emulation( 1712): eglMakeCurrent: 0xb0685360: ver 2 0 (tinfo 0xb06836c0)
06-06 00:59:29.051 D/EGL_emulation( 1712): eglMakeCurrent: 0xb0685360: ver 2 0 (tinfo 0xb06836c0)
06-06 00:59:29.067 D/EGL_emulation( 1712): eglMakeCurrent: 0xb0685360: ver 2 0 (tinfo 0xb06836c0)
06-06 00:59:29.073 W/InputDispatcher( 1631): channel '3f0168e com.evancharlton.mileage/com.evancharlton.mileage.Mileage (server)' ~ Consumer closed input channel or an error occurred.  events=0x9
06-06 00:59:29.073 E/InputDispatcher( 1631): channel '3f0168e com.evancharlton.mileage/com.evancharlton.mileage.Mileage (server)' ~ Channel is unrecoverably broken and will be disposed!
06-06 00:59:29.073 I/WindowManager( 1631): WIN DEATH: Window{3f0168e u0 com.evancharlton.mileage/com.evancharlton.mileage.Mileage EXITING}
06-06 00:59:29.073 W/InputDispatcher( 1631): Attempted to unregister already unregistered input channel '3f0168e com.evancharlton.mileage/com.evancharlton.mileage.Mileage (server)'
06-06 00:59:29.084 D/EGL_emulation( 1712): eglMakeCurrent: 0xb0685360: ver 2 0 (tinfo 0xb06836c0)
06-06 00:59:29.087 D/EGL_emulation( 1712): eglMakeCurrent: 0xb0685360: ver 2 0 (tinfo 0xb06836c0)
06-06 00:59:29.126 I/System.out(23497): URI: //ping
06-06 00:59:29.126 I/System.out(23497): params: {json={}
06-06 00:59:29.126 I/System.out(23497): }
06-06 00:59:29.130 I/System.out(23497): URI: //ping
06-06 00:59:29.130 I/System.out(23497): params: {json={}
06-06 00:59:29.130 I/System.out(23497): }
06-06 00:59:29.133 I/System.out(23497): URI: //ready
06-06 00:59:29.133 I/System.out(23497): params: {json={}
06-06 00:59:29.134 I/System.out(23497): }
06-06 00:59:29.137 I/System.out(23497): URI: //
06-06 00:59:29.137 I/System.out(23497): params: {json={"command":"version","arguments":[]}
06-06 00:59:29.137 I/System.out(23497): }
06-06 00:59:29.137 I/System.out(23497): header: {content-type=application/json;charset=utf-8, date=Sat, 06 Jun 2020 05:59:29 GMT, accept=*/*, host=127.0.0.1:34777, content-length=36, user-agent=HTTPClient/1.0 (2.8.3, ruby 2.5.1 (2018-03-29))}
06-06 00:59:29.137 I/System.out(23497): params: {json={"command":"version","arguments":[]}
06-06 00:59:29.137 I/System.out(23497): }
06-06 00:59:29.137 I/System.out(23497): ProP json = {"command":"version","arguments":[]}
06-06 00:59:29.137 I/System.out(23497): files: {}
06-06 00:59:29.137 I/System.out(23497): command: {"command":"version","arguments":[]}
06-06 00:59:29.140 I/InstrumentationBackend(23497): Got command:'Command:'Line:null,version', arguments:'[]'
06-06 00:59:29.147 I/System.out(23497): result:{"bonusInformation":[],"message":"0.9.8","success":true}
06-06 00:59:29.150 I/System.out(23497): URI: //start-application
06-06 00:59:29.150 I/System.out(23497): params: {json={"intent":null}
06-06 00:59:29.150 I/System.out(23497): }
06-06 00:59:29.160 I/ActivityManager( 1631): START u0 {act=android.intent.action.MAIN cat=[android.intent.category.LAUNCHER] flg=0x10200000 cmp=com.evancharlton.mileage/.Mileage} from uid 10374 on display 0
06-06 00:59:29.170 I/calabash(23497): newActivity1
06-06 00:59:29.178 I/calabash(23497): newActivity1
06-06 00:59:29.179 W/ActivityManager( 1631): Bad activity token: android.os.BinderProxy@fef9b77
06-06 00:59:29.179 W/ActivityManager( 1631): java.lang.ClassCastException: android.os.BinderProxy cannot be cast to com.android.server.am.ActivityRecord$Token
06-06 00:59:29.179 W/ActivityManager( 1631): 	at com.android.server.am.ActivityRecord.forTokenLocked(ActivityRecord.java:586)
06-06 00:59:29.179 W/ActivityManager( 1631): 	at com.android.server.am.ActivityRecord.isInStackLocked(ActivityRecord.java:1327)
06-06 00:59:29.179 W/ActivityManager( 1631): 	at com.android.server.am.ActivityRecord.getStackLocked(ActivityRecord.java:1332)
06-06 00:59:29.179 W/ActivityManager( 1631): 	at com.android.server.am.ActivityManagerService.getActivityDisplayId(ActivityManagerService.java:9806)
06-06 00:59:29.179 W/ActivityManager( 1631): 	at android.app.ActivityManagerNative.onTransact(ActivityManagerNative.java:2566)
06-06 00:59:29.179 W/ActivityManager( 1631): 	at com.android.server.am.ActivityManagerService.onTransact(ActivityManagerService.java:2757)
06-06 00:59:29.179 W/ActivityManager( 1631): 	at android.os.Binder.execTransact(Binder.java:565)
06-06 00:59:29.180 W/ActivityManager( 1631): Bad activity token: android.os.BinderProxy@fef9b77
06-06 00:59:29.180 W/ActivityManager( 1631): java.lang.ClassCastException: android.os.BinderProxy cannot be cast to com.android.server.am.ActivityRecord$Token
06-06 00:59:29.180 W/ActivityManager( 1631): 	at com.android.server.am.ActivityRecord.forTokenLocked(ActivityRecord.java:586)
06-06 00:59:29.180 W/ActivityManager( 1631): 	at com.android.server.am.ActivityRecord.isInStackLocked(ActivityRecord.java:1327)
06-06 00:59:29.180 W/ActivityManager( 1631): 	at com.android.server.am.ActivityManagerService.setTaskDescription(ActivityManagerService.java:9358)
06-06 00:59:29.180 W/ActivityManager( 1631): 	at android.app.ActivityManagerNative.onTransact(ActivityManagerNative.java:2639)
06-06 00:59:29.180 W/ActivityManager( 1631): 	at com.android.server.am.ActivityManagerService.onTransact(ActivityManagerService.java:2757)
06-06 00:59:29.180 W/ActivityManager( 1631): 	at android.os.Binder.execTransact(Binder.java:565)
06-06 00:59:29.181 W/ActivityManager( 1631): Bad activity token: android.os.BinderProxy@fef9b77
06-06 00:59:29.181 W/ActivityManager( 1631): java.lang.ClassCastException: android.os.BinderProxy cannot be cast to com.android.server.am.ActivityRecord$Token
06-06 00:59:29.181 W/ActivityManager( 1631): 	at com.android.server.am.ActivityRecord.forTokenLocked(ActivityRecord.java:586)
06-06 00:59:29.181 W/ActivityManager( 1631): 	at com.android.server.am.ActivityRecord.isInStackLocked(ActivityRecord.java:1327)
06-06 00:59:29.181 W/ActivityManager( 1631): 	at com.android.server.am.ActivityRecord.getStackLocked(ActivityRecord.java:1332)
06-06 00:59:29.181 W/ActivityManager( 1631): 	at com.android.server.am.ActivityManagerService.getActivityStackId(ActivityManagerService.java:9817)
06-06 00:59:29.181 W/ActivityManager( 1631): 	at android.app.ActivityManagerNative.onTransact(ActivityManagerNative.java:2856)
06-06 00:59:29.181 W/ActivityManager( 1631): 	at com.android.server.am.ActivityManagerService.onTransact(ActivityManagerService.java:2757)
06-06 00:59:29.181 W/ActivityManager( 1631): 	at android.os.Binder.execTransact(Binder.java:565)
06-06 00:59:29.183 D/gralloc_ranchu( 1347): gralloc_alloc: Creating ashmem region of size 9023488
06-06 00:59:29.197 W/ActivityManager( 1631): Bad activity token: android.os.BinderProxy@fef9b77
06-06 00:59:29.197 W/ActivityManager( 1631): java.lang.ClassCastException: android.os.BinderProxy cannot be cast to com.android.server.am.ActivityRecord$Token
06-06 00:59:29.197 W/ActivityManager( 1631): 	at com.android.server.am.ActivityRecord.forTokenLocked(ActivityRecord.java:586)
06-06 00:59:29.197 W/ActivityManager( 1631): 	at com.android.server.am.ActivityRecord.isInStackLocked(ActivityRecord.java:1327)
06-06 00:59:29.197 W/ActivityManager( 1631): 	at com.android.server.am.ActivityManagerService.getActivityOptions(ActivityManagerService.java:12559)
06-06 00:59:29.197 W/ActivityManager( 1631): 	at android.app.ActivityManagerNative.onTransact(ActivityManagerNative.java:1933)
06-06 00:59:29.197 W/ActivityManager( 1631): 	at com.android.server.am.ActivityManagerService.onTransact(ActivityManagerService.java:2757)
06-06 00:59:29.197 W/ActivityManager( 1631): 	at android.os.Binder.execTransact(Binder.java:565)
06-06 00:59:29.197 W/ActivityManager( 1631): Bad activity token: android.os.BinderProxy@fef9b77
06-06 00:59:29.197 W/ActivityManager( 1631): java.lang.ClassCastException: android.os.BinderProxy cannot be cast to com.android.server.am.ActivityRecord$Token
06-06 00:59:29.197 W/ActivityManager( 1631): 	at com.android.server.am.ActivityRecord.forTokenLocked(ActivityRecord.java:586)
06-06 00:59:29.197 W/ActivityManager( 1631): 	at com.android.server.am.ActivityRecord.isInStackLocked(ActivityRecord.java:1327)
06-06 00:59:29.197 W/ActivityManager( 1631): 	at com.android.server.am.ActivityManagerService.getActivityOptions(ActivityManagerService.java:12559)
06-06 00:59:29.197 W/ActivityManager( 1631): 	at android.app.ActivityManagerNative.onTransact(ActivityManagerNative.java:1933)
06-06 00:59:29.197 W/ActivityManager( 1631): 	at com.android.server.am.ActivityManagerService.onTransact(ActivityManagerService.java:2757)
06-06 00:59:29.197 W/ActivityManager( 1631): 	at android.os.Binder.execTransact(Binder.java:565)
06-06 00:59:29.209 V/PhoneStatusBar( 1712): setLightsOn(true)
06-06 00:59:29.217 D/EGL_emulation( 2076): eglMakeCurrent: 0xb0685360: ver 2 0 (tinfo 0xb06836b0)
06-06 00:59:29.218 D/EGL_emulation( 1712): eglMakeCurrent: 0xb0685360: ver 2 0 (tinfo 0xb06836c0)
06-06 00:59:29.233 D/gralloc_ranchu( 1347): gralloc_alloc: Creating ashmem region of size 9023488
06-06 00:59:29.234 D/EGL_emulation( 1712): eglMakeCurrent: 0xb0685360: ver 2 0 (tinfo 0xb06836c0)
06-06 00:59:29.238 D/        (23497): HostConnection::get() New Host Connection established 0x94019100, tid 23497
06-06 00:59:29.238 D/EGL_emulation( 1712): eglMakeCurrent: 0xb0685360: ver 2 0 (tinfo 0xb06836c0)
06-06 00:59:29.238 V/PhoneStatusBar( 1712): setLightsOn(true)
06-06 00:59:29.268 D/EGL_emulation( 1712): eglMakeCurrent: 0xb0685360: ver 2 0 (tinfo 0xb06836c0)
06-06 00:59:29.271 D/EGL_emulation( 1712): eglMakeCurrent: 0xb0685360: ver 2 0 (tinfo 0xb06836c0)
06-06 00:59:29.272 D/EGL_emulation( 1712): eglMakeCurrent: 0xb0685360: ver 2 0 (tinfo 0xb06836c0)
06-06 00:59:29.283 D/EGL_emulation( 1712): eglMakeCurrent: 0xb0685360: ver 2 0 (tinfo 0xb06836c0)
06-06 00:59:29.285 I/WindowManager( 1631): Destroying surface Surface(name=com.evancharlton.mileage/com.evancharlton.mileage.Mileage) called by com.android.server.wm.WindowStateAnimator.destroySurface:2016 com.android.server.wm.WindowStateAnimator.destroySurfaceLocked:882 com.android.server.wm.WindowState.removeLocked:1456 com.android.server.wm.WindowManagerService.removeWindowInnerLocked:2484 com.android.server.wm.AppWindowToken.destroySurfaces:365 com.android.server.wm.WindowStateAnimator.finishExit:565 com.android.server.wm.AppWindowAnimator.stepAnimationLocked:427 com.android.server.wm.WindowAnimator.updateAppWindowsLocked:196 
06-06 00:59:29.286 D/EGL_emulation( 1712): eglMakeCurrent: 0xb0685360: ver 2 0 (tinfo 0xb06836c0)
06-06 00:59:29.301 D/gralloc_ranchu( 1347): gralloc_alloc: Creating ashmem region of size 9023488
06-06 00:59:29.302 I/ActivityManager( 1631): Displayed com.evancharlton.mileage/.Mileage: +137ms
06-06 00:59:29.321 D/EGL_emulation( 1712): eglMakeCurrent: 0xb0685360: ver 2 0 (tinfo 0xb06836c0)
06-06 00:59:29.337 D/EGL_emulation( 1712): eglMakeCurrent: 0xb0685360: ver 2 0 (tinfo 0xb06836c0)
06-06 00:59:29.342 D/EGL_emulation( 1712): eglMakeCurrent: 0xb0685360: ver 2 0 (tinfo 0xb06836c0)
06-06 00:59:29.357 D/EGL_emulation( 1712): eglMakeCurrent: 0xb0685360: ver 2 0 (tinfo 0xb06836c0)
06-06 00:59:29.361 D/EGL_emulation( 1712): eglMakeCurrent: 0xb0685360: ver 2 0 (tinfo 0xb06836c0)
06-06 00:59:29.363 D/EGL_emulation( 1712): eglMakeCurrent: 0xb0685360: ver 2 0 (tinfo 0xb06836c0)
06-06 00:59:29.366 D/EGL_emulation( 1712): eglMakeCurrent: 0xb0685360: ver 2 0 (tinfo 0xb06836c0)
06-06 00:59:29.367 V/PhoneStatusBar( 1712): setLightsOn(true)
06-06 00:59:29.368 D/EGL_emulation( 1712): eglMakeCurrent: 0xb0685360: ver 2 0 (tinfo 0xb06836c0)
06-06 00:59:29.383 D/EGL_emulation( 1712): eglMakeCurrent: 0xb0685360: ver 2 0 (tinfo 0xb06836c0)
06-06 00:59:29.385 D/EGL_emulation( 1712): eglMakeCurrent: 0xb0685360: ver 2 0 (tinfo 0xb06836c0)
06-06 00:59:29.389 I/System.out(23497): URI: //map
06-06 00:59:29.389 I/System.out(23497): params: {json={"query":"* marked:'Statistics'","operation":{"method_name":"query","arguments":[]}}
06-06 00:59:29.389 I/System.out(23497): }
06-06 00:59:29.400 D/EGL_emulation( 1712): eglMakeCurrent: 0xb0685360: ver 2 0 (tinfo 0xb06836c0)
06-06 00:59:29.400 W/ResourceType(23497): No package identifier when getting name for resource number 0x00000001
06-06 00:59:29.401 D/EGL_emulation( 1712): eglMakeCurrent: 0xb0685360: ver 2 0 (tinfo 0xb06836c0)
06-06 00:59:29.413 I/System.out(23497): URI: //gesture
06-06 00:59:29.413 I/System.out(23497): params: {json={"query_timeout":5.0,"gestures":[{"query_string":"* marked:'Statistics'","touches":[{"x":50,"y":50,"offset_x":0,"offset_y":0,"wait":0.0,"time":0.2,"release":true,"query_string":null}]}]}
06-06 00:59:29.413 I/System.out(23497): }
06-06 00:59:29.416 D/EGL_emulation( 1712): eglMakeCurrent: 0xb0685360: ver 2 0 (tinfo 0xb06836c0)
06-06 00:59:29.418 D/EGL_emulation( 1712): eglMakeCurrent: 0xb0685360: ver 2 0 (tinfo 0xb06836c0)
06-06 00:59:29.418 W/ResourceType(23497): No package identifier when getting name for resource number 0x00000001
06-06 00:59:29.440 D/EGL_emulation( 1712): eglMakeCurrent: 0xb0685360: ver 2 0 (tinfo 0xb06836c0)
06-06 00:59:29.443 D/EGL_emulation( 1712): eglMakeCurrent: 0xb0685360: ver 2 0 (tinfo 0xb06836c0)
06-06 00:59:29.516 V/PhoneStatusBar( 1712): setLightsOn(true)
06-06 00:59:29.517 I/WindowManager( 1631): Destroying surface Surface(name=Starting com.evancharlton.mileage) called by com.android.server.wm.WindowStateAnimator.destroySurface:2016 com.android.server.wm.WindowStateAnimator.destroySurfaceLocked:882 com.android.server.wm.WindowState.destroyOrSaveSurface:2100 com.android.server.wm.AppWindowToken.destroySurfaces:363 com.android.server.wm.WindowStateAnimator.finishExit:565 com.android.server.wm.WindowStateAnimator.stepAnimationLocked:491 com.android.server.wm.WindowAnimator.updateWindowsLocked:303 com.android.server.wm.WindowAnimator.animateLocked:704 
06-06 00:59:29.519 V/PhoneStatusBar( 1712): setLightsOn(true)
06-06 00:59:29.533 V/PhoneStatusBar( 1712): setLightsOn(true)
06-06 00:59:29.652 I/calabash(23497): newActivity1
06-06 00:59:29.662 I/System.out(23497): URI: //map
06-06 00:59:29.662 I/System.out(23497): params: {json={"query":"android.widget.ScrollView index:0","operation":{"method_name":"query","arguments":[]}}
06-06 00:59:29.662 I/System.out(23497): }
06-06 00:59:29.666 W/ActivityManager( 1631): Bad activity token: android.os.BinderProxy@dcc51b9
06-06 00:59:29.666 W/ActivityManager( 1631): java.lang.ClassCastException: android.os.BinderProxy cannot be cast to com.android.server.am.ActivityRecord$Token
06-06 00:59:29.666 W/ActivityManager( 1631): 	at com.android.server.am.ActivityRecord.forTokenLocked(ActivityRecord.java:586)
06-06 00:59:29.666 W/ActivityManager( 1631): 	at com.android.server.am.ActivityRecord.isInStackLocked(ActivityRecord.java:1327)
06-06 00:59:29.666 W/ActivityManager( 1631): 	at com.android.server.am.ActivityRecord.getStackLocked(ActivityRecord.java:1332)
06-06 00:59:29.666 W/ActivityManager( 1631): 	at com.android.server.am.ActivityManagerService.getActivityDisplayId(ActivityManagerService.java:9806)
06-06 00:59:29.666 W/ActivityManager( 1631): 	at android.app.ActivityManagerNative.onTransact(ActivityManagerNative.java:2566)
06-06 00:59:29.666 W/ActivityManager( 1631): 	at com.android.server.am.ActivityManagerService.onTransact(ActivityManagerService.java:2757)
06-06 00:59:29.666 W/ActivityManager( 1631): 	at android.os.Binder.execTransact(Binder.java:565)
06-06 00:59:29.667 W/ActivityManager( 1631): Bad activity token: android.os.BinderProxy@dcc51b9
06-06 00:59:29.667 W/ActivityManager( 1631): java.lang.ClassCastException: android.os.BinderProxy cannot be cast to com.android.server.am.ActivityRecord$Token
06-06 00:59:29.667 W/ActivityManager( 1631): 	at com.android.server.am.ActivityRecord.forTokenLocked(ActivityRecord.java:586)
06-06 00:59:29.667 W/ActivityManager( 1631): 	at com.android.server.am.ActivityRecord.isInStackLocked(ActivityRecord.java:1327)
06-06 00:59:29.667 W/ActivityManager( 1631): 	at com.android.server.am.ActivityManagerService.setTaskDescription(ActivityManagerService.java:9358)
06-06 00:59:29.667 W/ActivityManager( 1631): 	at android.app.ActivityManagerNative.onTransact(ActivityManagerNative.java:2639)
06-06 00:59:29.667 W/ActivityManager( 1631): 	at com.android.server.am.ActivityManagerService.onTransact(ActivityManagerService.java:2757)
06-06 00:59:29.667 W/ActivityManager( 1631): 	at android.os.Binder.execTransact(Binder.java:565)
06-06 00:59:29.668 W/ActivityManager( 1631): Bad activity token: android.os.BinderProxy@dcc51b9
06-06 00:59:29.668 W/ActivityManager( 1631): java.lang.ClassCastException: android.os.BinderProxy cannot be cast to com.android.server.am.ActivityRecord$Token
06-06 00:59:29.668 W/ActivityManager( 1631): 	at com.android.server.am.ActivityRecord.forTokenLocked(ActivityRecord.java:586)
06-06 00:59:29.668 W/ActivityManager( 1631): 	at com.android.server.am.ActivityRecord.isInStackLocked(ActivityRecord.java:1327)
06-06 00:59:29.668 W/ActivityManager( 1631): 	at com.android.server.am.ActivityRecord.getStackLocked(ActivityRecord.java:1332)
06-06 00:59:29.668 W/ActivityManager( 1631): 	at com.android.server.am.ActivityManagerService.getActivityStackId(ActivityManagerService.java:9817)
06-06 00:59:29.668 W/ActivityManager( 1631): 	at android.app.ActivityManagerNative.onTransact(ActivityManagerNative.java:2856)
06-06 00:59:29.668 W/ActivityManager( 1631): 	at com.android.server.am.ActivityManagerService.onTransact(ActivityManagerService.java:2757)
06-06 00:59:29.668 W/ActivityManager( 1631): 	at android.os.Binder.execTransact(Binder.java:565)
06-06 00:59:29.672 D/VehicleStatisticsActivity(23497): Checking recalculation ...
06-06 00:59:29.673 D/VehicleStatisticsActivity(23497): Recalculation not necessary.
06-06 00:59:29.684 V/PhoneStatusBar( 1712): setLightsOn(true)
06-06 00:59:29.685 W/ActivityManager( 1631): Bad activity token: android.os.BinderProxy@dcc51b9
06-06 00:59:29.685 W/ActivityManager( 1631): java.lang.ClassCastException: android.os.BinderProxy cannot be cast to com.android.server.am.ActivityRecord$Token
06-06 00:59:29.685 W/ActivityManager( 1631): 	at com.android.server.am.ActivityRecord.forTokenLocked(ActivityRecord.java:586)
06-06 00:59:29.685 W/ActivityManager( 1631): 	at com.android.server.am.ActivityRecord.isInStackLocked(ActivityRecord.java:1327)
06-06 00:59:29.685 W/ActivityManager( 1631): 	at com.android.server.am.ActivityManagerService.getActivityOptions(ActivityManagerService.java:12559)
06-06 00:59:29.685 W/ActivityManager( 1631): 	at android.app.ActivityManagerNative.onTransact(ActivityManagerNative.java:1933)
06-06 00:59:29.685 W/ActivityManager( 1631): 	at com.android.server.am.ActivityManagerService.onTransact(ActivityManagerService.java:2757)
06-06 00:59:29.685 W/ActivityManager( 1631): 	at android.os.Binder.execTransact(Binder.java:565)
06-06 00:59:29.686 W/ActivityManager( 1631): Bad activity token: android.os.BinderProxy@dcc51b9
06-06 00:59:29.686 W/ActivityManager( 1631): java.lang.ClassCastException: android.os.BinderProxy cannot be cast to com.android.server.am.ActivityRecord$Token
06-06 00:59:29.686 W/ActivityManager( 1631): 	at com.android.server.am.ActivityRecord.forTokenLocked(ActivityRecord.java:586)
06-06 00:59:29.686 W/ActivityManager( 1631): 	at com.android.server.am.ActivityRecord.isInStackLocked(ActivityRecord.java:1327)
06-06 00:59:29.686 W/ActivityManager( 1631): 	at com.android.server.am.ActivityManagerService.getActivityOptions(ActivityManagerService.java:12559)
06-06 00:59:29.686 W/ActivityManager( 1631): 	at android.app.ActivityManagerNative.onTransact(ActivityManagerNative.java:1933)
06-06 00:59:29.686 W/ActivityManager( 1631): 	at com.android.server.am.ActivityManagerService.onTransact(ActivityManagerService.java:2757)
06-06 00:59:29.686 W/ActivityManager( 1631): 	at android.os.Binder.execTransact(Binder.java:565)
06-06 00:59:29.689 D/VehicleStatisticsActivity(23497): Checking recalculation ...
06-06 00:59:29.690 D/VehicleStatisticsActivity(23497): Recalculation not necessary.
06-06 00:59:29.786 I/System.out(23497): URI: //map
06-06 00:59:29.786 I/System.out(23497): params: {json={"query":"android.widget.AbsListView index:0","operation":{"method_name":"query","arguments":[]}}
06-06 00:59:29.786 I/System.out(23497): }
06-06 00:59:29.794 I/art     (23497): Do partial code cache collection, code=30KB, data=29KB
06-06 00:59:29.794 I/art     (23497): After code cache collection, code=29KB, data=28KB
06-06 00:59:29.794 I/art     (23497): Increasing code cache capacity to 128KB
06-06 00:59:29.809 I/System.out(23497): URI: //map
06-06 00:59:29.809 I/System.out(23497): params: {json={"query":"android.widget.AbsListView index:0","operation":{"method_name":"query","arguments":[]}}
06-06 00:59:29.809 I/System.out(23497): }
06-06 00:59:29.832 I/System.out(23497): URI: //map
06-06 00:59:29.832 I/System.out(23497): params: {json={"query":"android.widget.AbsListView index:0","operation":{"method_name":"query","arguments":[]}}
06-06 00:59:29.832 I/System.out(23497): }
06-06 00:59:29.847 I/System.out(23497): URI: //map
06-06 00:59:29.847 I/System.out(23497): params: {json={"query":"android.widget.AbsListView index:0","operation":{"method_name":"query","arguments":["getFirstVisiblePosition"]}}
06-06 00:59:29.847 I/System.out(23497): }
06-06 00:59:29.860 I/System.out(23497): URI: //map
06-06 00:59:29.860 I/System.out(23497): params: {json={"query":"android.widget.AbsListView index:0","operation":{"method_name":"query","arguments":["getLastVisiblePosition"]}}
06-06 00:59:29.860 I/System.out(23497): }
06-06 00:59:29.872 I/System.out(23497): URI: //map
06-06 00:59:29.872 I/System.out(23497): params: {json={"query":"android.widget.AbsListView index:0","operation":{"method_name":"query","arguments":[{"method_name":"setSelection","arguments":[26]}]}}
06-06 00:59:29.872 I/System.out(23497): }
06-06 00:59:29.889 I/System.out(23497): URI: //map
06-06 00:59:29.889 I/System.out(23497): params: {json={"query":"* marked:'Minimum price'","operation":{"method_name":"query","arguments":[]}}
06-06 00:59:29.889 I/System.out(23497): }
06-06 00:59:29.922 D/gralloc_ranchu( 1347): gralloc_alloc: Creating ashmem region of size 9023488
06-06 00:59:29.957 W/ResourceType(23497): No package identifier when getting name for resource number 0x00000001
06-06 00:59:29.966 V/PhoneStatusBar( 1712): setLightsOn(true)
06-06 00:59:29.968 V/PhoneStatusBar( 1712): setLightsOn(true)
06-06 00:59:29.968 I/System.out(23497): URI: //gesture
06-06 00:59:29.968 I/System.out(23497): params: {json={"query_timeout":5.0,"gestures":[{"query_string":"* marked:'Minimum price'","touches":[{"x":50,"y":50,"offset_x":0,"offset_y":0,"wait":0.0,"time":0.2,"release":true,"query_string":null}]}]}
06-06 00:59:29.968 I/System.out(23497): }
06-06 00:59:29.969 W/OpenGLRenderer( 2076): Incorrectly called buildLayer on View: ShortcutAndWidgetContainer, destroying layer...
06-06 00:59:29.972 W/ResourceType(23497): No package identifier when getting name for resource number 0x00000001
06-06 00:59:29.984 I/WindowManager( 1631): Destroying surface Surface(name=com.android.launcher3/com.android.launcher3.Launcher) called by com.android.server.wm.WindowStateAnimator.destroySurface:2016 com.android.server.wm.WindowStateAnimator.destroySurfaceLocked:882 com.android.server.wm.WindowState.destroyOrSaveSurface:2100 com.android.server.wm.AppWindowToken.destroySurfaces:363 com.android.server.wm.AppWindowToken.notifyAppStopped:389 com.android.server.wm.WindowManagerService.notifyAppStopped:4463 com.android.server.am.ActivityStack.activityStoppedLocked:1252 com.android.server.am.ActivityManagerService.activityStopped:6903 
06-06 00:59:29.984 V/PhoneStatusBar( 1712): setLightsOn(true)
06-06 00:59:30.201 I/ActivityManager( 1631): START u0 {cmp=com.evancharlton.mileage/.charts.MinimumPriceChart (has extras)} from uid 10374 on display 0
06-06 00:59:30.204 V/PhoneStatusBar( 1712): setLightsOn(true)
06-06 00:59:30.206 V/PhoneStatusBar( 1712): setLightsOn(true)
06-06 00:59:30.229 I/System.out(23497): URI: //map
06-06 00:59:30.229 I/System.out(23497): params: {json={"query":"* {text CONTAINS[c] 'Least expensive fuel'}","operation":{"method_name":"query","arguments":[]}}
06-06 00:59:30.229 I/System.out(23497): }
06-06 00:59:30.258 I/calabash(23497): newActivity1
06-06 00:59:30.261 W/aiCharts(23497): License file is invalid or missing. 
06-06 00:59:30.261 W/aiCharts(23497): Please place proper license.lic to /assets folder.
06-06 00:59:30.275 V/PhoneStatusBar( 1712): setLightsOn(true)
06-06 00:59:30.300 V/PhoneStatusBar( 1712): setLightsOn(true)
06-06 00:59:30.305 I/WindowManager( 1631): Destroying surface Surface(name=Creating chart…) called by com.android.server.wm.WindowStateAnimator.destroySurface:2016 com.android.server.wm.WindowStateAnimator.destroySurfaceLocked:882 com.android.server.wm.WindowState.removeLocked:1456 com.android.server.wm.WindowManagerService.removeWindowInnerLocked:2484 com.android.server.wm.WindowManagerService.removeWindowLocked:2442 com.android.server.wm.WindowManagerService.removeWindowLocked:2311 com.android.server.wm.WindowManagerService.removeWindow:2306 com.android.server.wm.Session.remove:202 
06-06 00:59:30.308 D/gralloc_ranchu( 1347): gralloc_alloc: Creating ashmem region of size 9023488
06-06 00:59:30.316 V/PhoneStatusBar( 1712): setLightsOn(true)
06-06 00:59:30.336 I/ActivityManager( 1631): Displayed com.evancharlton.mileage/.charts.MinimumPriceChart: +82ms
06-06 00:59:30.350 V/PhoneStatusBar( 1712): setLightsOn(true)
06-06 00:59:30.383 V/PhoneStatusBar( 1712): setLightsOn(true)
06-06 00:59:30.400 V/PhoneStatusBar( 1712): setLightsOn(true)
06-06 00:59:30.584 V/PhoneStatusBar( 1712): setLightsOn(true)
06-06 00:59:30.589 I/System.out(23497): URI: //map
06-06 00:59:30.589 I/System.out(23497): params: {json={"query":"* {text CONTAINS[c] 'Least expensive fuel'}","operation":{"method_name":"query","arguments":[]}}
06-06 00:59:30.589 I/System.out(23497): }
06-06 00:59:30.609 I/System.out(23497): URI: //
06-06 00:59:30.609 I/System.out(23497): params: {json={"command":"press_key","arguments":["KEYCODE_BACK"]}
06-06 00:59:30.609 I/System.out(23497): }
06-06 00:59:30.609 I/System.out(23497): header: {content-type=application/json;charset=utf-8, date=Sat, 06 Jun 2020 05:59:30 GMT, accept=*/*, host=127.0.0.1:34777, content-length=52, user-agent=HTTPClient/1.0 (2.8.3, ruby 2.5.1 (2018-03-29))}
06-06 00:59:30.609 I/System.out(23497): params: {json={"command":"press_key","arguments":["KEYCODE_BACK"]}
06-06 00:59:30.609 I/System.out(23497): }
06-06 00:59:30.609 I/System.out(23497): ProP json = {"command":"press_key","arguments":["KEYCODE_BACK"]}
06-06 00:59:30.609 I/System.out(23497): files: {}
06-06 00:59:30.609 I/System.out(23497): command: {"command":"press_key","arguments":["KEYCODE_BACK"]}
06-06 00:59:30.610 I/InstrumentationBackend(23497): Got command:'Command:'Line:null,press_key', arguments:'[KEYCODE_BACK]'
06-06 00:59:30.613 V/PhoneStatusBar( 1712): setLightsOn(true)
06-06 00:59:30.615 V/PhoneStatusBar( 1712): setLightsOn(true)
06-06 00:59:30.618 I/art     (23497): Do partial code cache collection, code=60KB, data=62KB
06-06 00:59:30.618 I/art     (23497): After code cache collection, code=59KB, data=61KB
06-06 00:59:30.618 I/art     (23497): Increasing code cache capacity to 256KB
06-06 00:59:30.620 I/System.out(23497): result:{"bonusInformation":[],"message":"","success":true}
06-06 00:59:30.620 D/VehicleStatisticsActivity(23497): Checking recalculation ...
06-06 00:59:30.621 D/VehicleStatisticsActivity(23497): Recalculation not necessary.
06-06 00:59:30.622 I/System.out(23497): URI: //map
06-06 00:59:30.622 I/System.out(23497): params: {json={"query":"* {text CONTAINS[c] 'Statistics'}","operation":{"method_name":"query","arguments":[]}}
06-06 00:59:30.622 I/System.out(23497): }
06-06 00:59:30.634 V/PhoneStatusBar( 1712): setLightsOn(true)
06-06 00:59:30.651 V/PhoneStatusBar( 1712): setLightsOn(true)
06-06 00:59:30.665 D/gralloc_ranchu( 1347): gralloc_alloc: Creating ashmem region of size 9023488
06-06 00:59:30.667 V/PhoneStatusBar( 1712): setLightsOn(true)
06-06 00:59:30.699 V/PhoneStatusBar( 1712): setLightsOn(true)
