--------- beginning of main
06-05 18:18:25.792 V/PhoneStatusBar( 1712): setLightsOn(true)
06-05 18:18:25.795 D/gralloc_ranchu( 1346): gralloc_alloc: Creating ashmem region of size 3145728
06-05 18:18:25.804 E/EGL_emulation( 1346): tid 1346: eglCreateSyncKHR(1901): error 0x3004 (EGL_BAD_ATTRIBUTE)
--------- beginning of system
06-05 18:18:25.822 W/ActivityManager( 1630): Finishing task with all activities already finished
06-05 18:18:25.823 W/ActivityManager( 1630): Duplicate finish request for ActivityRecord{2642bc2 u0 com.evancharlton.mileage/.Mileage t2745 f}
06-05 18:18:25.823 W/ActivityManager( 1630): Finishing task with all activities already finished
06-05 18:18:25.823 W/ActivityManager( 1630): Duplicate finish request for ActivityRecord{2642bc2 u0 com.evancharlton.mileage/.Mileage t2745 f}
06-05 18:18:25.824 W/ActivityManager( 1630): Finishing task with all activities already finished
06-05 18:18:25.824 W/ActivityManager( 1630): Duplicate finish request for ActivityRecord{2642bc2 u0 com.evancharlton.mileage/.Mileage t2745 f}
06-05 18:18:25.824 W/ActivityManager( 1630): Finishing task with all activities already finished
06-05 18:18:25.824 W/ActivityManager( 1630): Duplicate finish request for ActivityRecord{2642bc2 u0 com.evancharlton.mileage/.Mileage t2745 f}
06-05 18:18:25.824 W/ActivityManager( 1630): Finishing task with all activities already finished
06-05 18:18:25.824 W/ActivityManager( 1630): Duplicate finish request for ActivityRecord{2642bc2 u0 com.evancharlton.mileage/.Mileage t2745 f}
06-05 18:18:25.824 W/ActivityManager( 1630): Finishing task with all activities already finished
06-05 18:18:25.824 W/ActivityManager( 1630): Duplicate finish request for ActivityRecord{6380370 u0 com.evancharlton.mileage/.charts.SouthChart t2745 f}
06-05 18:18:25.824 W/ActivityManager( 1630): Finishing task with all activities already finished
06-05 18:18:25.824 W/ActivityManager( 1630): Duplicate finish request for ActivityRecord{6380370 u0 com.evancharlton.mileage/.charts.SouthChart t2745 f}
06-05 18:18:25.825 W/ActivityManager( 1630): Finishing task with all activities already finished
06-05 18:18:25.825 W/ActivityManager( 1630): Duplicate finish request for ActivityRecord{2642bc2 u0 com.evancharlton.mileage/.Mileage t2745 f}
06-05 18:18:25.825 W/ActivityManager( 1630): Finishing task with all activities already finished
06-05 18:18:25.825 W/ActivityManager( 1630): Duplicate finish request for ActivityRecord{2642bc2 u0 com.evancharlton.mileage/.Mileage t2745 f}
06-05 18:18:25.860 D/EGL_emulation( 2099): eglMakeCurrent: 0xb4085240: ver 2 0 (tinfo 0xb40832d0)
06-05 18:18:25.860 D/EGL_emulation( 1712): eglMakeCurrent: 0xb4085540: ver 2 0 (tinfo 0xb4083740)
06-05 18:18:25.876 D/EGL_emulation( 1712): eglMakeCurrent: 0xb4085540: ver 2 0 (tinfo 0xb4083740)
06-05 18:18:25.893 D/EGL_emulation( 1712): eglMakeCurrent: 0xb4085540: ver 2 0 (tinfo 0xb4083740)
06-05 18:18:25.909 D/EGL_emulation( 1712): eglMakeCurrent: 0xb4085540: ver 2 0 (tinfo 0xb4083740)
06-05 18:18:25.911 D/EGL_emulation( 1712): eglMakeCurrent: 0xb4085540: ver 2 0 (tinfo 0xb4083740)
06-05 18:18:25.925 D/AndroidRuntime( 5820): >>>>>> START com.android.internal.os.RuntimeInit uid 2000 <<<<<<
06-05 18:18:25.926 D/EGL_emulation( 1712): eglMakeCurrent: 0xb4085540: ver 2 0 (tinfo 0xb4083740)
06-05 18:18:25.927 D/AndroidRuntime( 5820): CheckJNI is ON
06-05 18:18:25.927 D/EGL_emulation( 1712): eglMakeCurrent: 0xb4085540: ver 2 0 (tinfo 0xb4083740)
06-05 18:18:25.939 W/art     ( 5820): Unexpected CPU variant for X86 using defaults: x86
06-05 18:18:25.941 D/ICU     ( 5820): No timezone override file found: /data/misc/zoneinfo/current/icu/icu_tzdata.dat
06-05 18:18:25.943 D/EGL_emulation( 1712): eglMakeCurrent: 0xb4085540: ver 2 0 (tinfo 0xb4083740)
06-05 18:18:25.944 D/EGL_emulation( 1712): eglMakeCurrent: 0xb4085540: ver 2 0 (tinfo 0xb4083740)
06-05 18:18:25.952 E/memtrack( 5820): Couldn't load memtrack module (No such file or directory)
06-05 18:18:25.952 E/android.os.Debug( 5820): failed to load memtrack module: -2
06-05 18:18:25.952 I/Radio-JNI( 5820): register_android_hardware_Radio DONE
06-05 18:18:25.957 D/AndroidRuntime( 5820): Calling main entry com.android.commands.am.Am
06-05 18:18:25.959 I/ActivityManager( 1630): Force stopping com.evancharlton.mileage appid=10150 user=0: start instr
06-05 18:18:25.959 I/ActivityManager( 1630): Killing 5768:com.evancharlton.mileage/u0a150 (adj 0): stop com.evancharlton.mileage
06-05 18:18:25.959 D/ActivityManager( 1630): cleanUpApplicationRecord -- 5768
06-05 18:18:25.959 D/EGL_emulation( 1712): eglMakeCurrent: 0xb4085540: ver 2 0 (tinfo 0xb4083740)
06-05 18:18:25.959 I/WindowManager( 1630): Destroying surface Surface(name=com.evancharlton.mileage/com.evancharlton.mileage.charts.SouthChart) called by com.android.server.wm.WindowStateAnimator.destroySurface:2016 com.android.server.wm.WindowStateAnimator.destroySurfaceLocked:882 com.android.server.wm.WindowState.removeLocked:1456 com.android.server.wm.WindowManagerService.removeWindowInnerLocked:2484 com.android.server.wm.WindowManagerService.removeWindowLocked:2442 com.android.server.wm.WindowManagerService.removeWindowLocked:2311 com.android.server.wm.AppWindowToken.removeAllWindows:530 com.android.server.wm.AppWindowToken.removeAppFromTaskLocked:326 
06-05 18:18:25.961 D/EGL_emulation( 1712): eglMakeCurrent: 0xb4085540: ver 2 0 (tinfo 0xb4083740)
06-05 18:18:25.961 W/ActivityManager( 1630): Crash of app com.evancharlton.mileage running instrumentation ComponentInfo{com.evancharlton.mileage.test/sh.calaba.instrumentationbackend.CalabashInstrumentationTestRunner}
06-05 18:18:25.961 I/ActivityManager( 1630): Force stopping com.evancharlton.mileage appid=10150 user=0: finished inst
06-05 18:18:25.964 I/art     ( 5830): Not late-enabling -Xcheck:jni (already on)
06-05 18:18:25.964 W/art     ( 5830): Unexpected CPU variant for X86 using defaults: x86
06-05 18:18:25.972 I/ActivityManager( 1630): Start proc 5830:com.evancharlton.mileage/u0a150 for added application com.evancharlton.mileage
06-05 18:18:25.972 D/AndroidRuntime( 5820): Shutting down VM
06-05 18:18:25.976 D/EGL_emulation( 1712): eglMakeCurrent: 0xb4085540: ver 2 0 (tinfo 0xb4083740)
06-05 18:18:25.977 W/System  ( 5830): ClassLoader referenced unknown path: /data/app/com.evancharlton.mileage.test-1/lib/x86
06-05 18:18:25.977 W/System  ( 5830): ClassLoader referenced unknown path: /data/app/com.evancharlton.mileage-1/lib/x86
06-05 18:18:25.979 W/System  ( 5830): ClassLoader referenced unknown path: 
06-05 18:18:25.979 D/EGL_emulation( 1712): eglMakeCurrent: 0xb4085540: ver 2 0 (tinfo 0xb4083740)
06-05 18:18:25.983 I/System.out( 5830): Main activity name automatically set to: com.evancharlton.mileage.Mileage
06-05 18:18:25.984 I/System.out( 5830): Calabash did not load Mono. This is only a problem if you are trying to test a Mono application
06-05 18:18:25.984 I/calabash( 5830): Test server port: 7102
06-05 18:18:25.984 I/InstrumentationBackend( 5830): Added:'GetPreferences', with key:'get_preferences'
06-05 18:18:25.988 I/InstrumentationBackend( 5830): Added:'SetPreferences', with key:'set_preferences'
06-05 18:18:25.988 I/InstrumentationBackend( 5830): Added:'ClearPreferences', with key:'clear_preferences'
06-05 18:18:25.988 I/InstrumentationBackend( 5830): Added:'PressElement', with key:'press_l10n_element'
06-05 18:18:25.988 I/InstrumentationBackend( 5830): Added:'WaitForElement', with key:'wait_for_l10n_element'
06-05 18:18:25.988 I/InstrumentationBackend( 5830): Added:'NullAction', with key:'nullAction'
06-05 18:18:25.988 I/InstrumentationBackend( 5830): Added:'PressKey', with key:'press_key'
06-05 18:18:25.988 I/InstrumentationBackend( 5830): Added:'SetActivityOrientation', with key:'set_activity_orientation'
06-05 18:18:25.988 I/InstrumentationBackend( 5830): Added:'GetActivityOrientation', with key:'get_activity_orientation'
06-05 18:18:25.989 I/InstrumentationBackend( 5830): Added:'FakeGPSLocation', with key:'set_gps_coordinates'
06-05 18:18:25.989 I/InstrumentationBackend( 5830): Added:'SetPropertyByCssSelector', with key:'set_property_by_css_selector'
06-05 18:18:25.989 I/InstrumentationBackend( 5830): Added:'GetUrl', with key:'get_url'
06-05 18:18:25.989 I/InstrumentationBackend( 5830): Added:'ScrollTo', with key:'scroll_to'
06-05 18:18:25.989 I/InstrumentationBackend( 5830): Added:'GetLoadProgress', with key:'get_load_progress'
06-05 18:18:25.989 I/InstrumentationBackend( 5830): Added:'DumpHtml', with key:'dump_html'
06-05 18:18:25.989 I/InstrumentationBackend( 5830): Added:'DumpBodyHtml', with key:'dump_body_html'
06-05 18:18:25.989 I/InstrumentationBackend( 5830): Added:'EnterTextByCssSelector', with key:'enter_text_by_selector'
06-05 18:18:25.989 I/InstrumentationBackend( 5830): Added:'AndroidSDKVersion', with key:'android_sdk_version'
06-05 18:18:25.989 I/InstrumentationBackend( 5830): Added:'Version', with key:'version'
06-05 18:18:25.989 I/InstrumentationBackend( 5830): Added:'Drag', with key:'drag'
06-05 18:18:25.989 I/InstrumentationBackend( 5830): Added:'TouchCoordinates', with key:'touch_coordinate'
06-05 18:18:25.989 I/InstrumentationBackend( 5830): Added:'LongPressCoordinate', with key:'long_press_coordinate'
06-05 18:18:25.989 I/InstrumentationBackend( 5830): Added:'DragCoordinates', with key:'drag_coordinates'
06-05 18:18:25.990 I/InstrumentationBackend( 5830): Added:'ResumeApplication', with key:'resume_application'
06-05 18:18:25.990 I/InstrumentationBackend( 5830): Added:'Swipe', with key:'swipe'
06-05 18:18:25.990 I/InstrumentationBackend( 5830): Added:'DoubleTapCoordinate', with key:'double_tap_coordinate'
06-05 18:18:25.990 I/InstrumentationBackend( 5830): Added:'ClickOnScreen', with key:'click_on_screen'
06-05 18:18:25.990 I/InstrumentationBackend( 5830): Added:'GetActivityName', with key:'get_activity_name'
06-05 18:18:25.990 I/InstrumentationBackend( 5830): Added:'ScrollToView', with key:'scroll_to_view'
06-05 18:18:25.990 I/InstrumentationBackend( 5830): Added:'ViewConfiguration', with key:'view_configuration'
06-05 18:18:25.990 I/InstrumentationBackend( 5830): Added:'IsCurrentActivityFocused', with key:'is_current_activity_focused'
06-05 18:18:25.990 I/InstrumentationBackend( 5830): Added:'SendTcp', with key:'send_tcp'
06-05 18:18:25.990 I/InstrumentationBackend( 5830): Added:'DpToDevicePixel', with key:'dp_to_device_pixel'
06-05 18:18:25.990 I/InstrumentationBackend( 5830): Added:'KeyboardEnterText', with key:'keyboard_enter_text'
06-05 18:18:25.990 I/InstrumentationBackend( 5830): Added:'DeleteSurroundingText', with key:'delete_surrounding_text'
06-05 18:18:25.990 I/InstrumentationBackend( 5830): Added:'SetComposingRegion', with key:'set_composing_region'
06-05 18:18:25.990 I/InstrumentationBackend( 5830): Added:'SetSelection', with key:'set_selection'
06-05 18:18:25.990 I/InstrumentationBackend( 5830): Added:'KeyboardKeyEvent', with key:'keyboard_key_event'
06-05 18:18:25.990 I/InstrumentationBackend( 5830): Added:'PressUserActionButton', with key:'press_user_action_button'
06-05 18:18:25.990 I/InstrumentationBackend( 5830): Added:'HideSoftKeyboard', with key:'hide_soft_keyboard'
06-05 18:18:25.990 I/InstrumentationBackend( 5830): Added:'ListActions', with key:'list_actions'
06-05 18:18:25.990 I/calabash( 5830): Instantiating http server at 7102
06-05 18:18:25.991 I/System.out( 5830): HTTP Daemon listening on: 7102
06-05 18:18:25.992 D/EGL_emulation( 1712): eglMakeCurrent: 0xb4085540: ver 2 0 (tinfo 0xb4083740)
06-05 18:18:25.994 D/EGL_emulation( 1712): eglMakeCurrent: 0xb4085540: ver 2 0 (tinfo 0xb4083740)
06-05 18:18:26.009 D/EGL_emulation( 1712): eglMakeCurrent: 0xb4085540: ver 2 0 (tinfo 0xb4083740)
06-05 18:18:26.011 D/EGL_emulation( 1712): eglMakeCurrent: 0xb4085540: ver 2 0 (tinfo 0xb4083740)
06-05 18:18:26.013 I/WindowManager( 1630): WIN DEATH: Window{8868835 u0 com.evancharlton.mileage/com.evancharlton.mileage.Mileage EXITING}
06-05 18:18:26.026 D/EGL_emulation( 1712): eglMakeCurrent: 0xb4085540: ver 2 0 (tinfo 0xb4083740)
06-05 18:18:26.030 D/EGL_emulation( 1712): eglMakeCurrent: 0xb4085540: ver 2 0 (tinfo 0xb4083740)
06-05 18:18:26.043 D/EGL_emulation( 1712): eglMakeCurrent: 0xb4085540: ver 2 0 (tinfo 0xb4083740)
06-05 18:18:26.044 D/EGL_emulation( 1712): eglMakeCurrent: 0xb4085540: ver 2 0 (tinfo 0xb4083740)
06-05 18:18:26.060 D/EGL_emulation( 1712): eglMakeCurrent: 0xb4085540: ver 2 0 (tinfo 0xb4083740)
06-05 18:18:26.076 D/EGL_emulation( 1712): eglMakeCurrent: 0xb4085540: ver 2 0 (tinfo 0xb4083740)
06-05 18:18:26.078 D/EGL_emulation( 1712): eglMakeCurrent: 0xb4085540: ver 2 0 (tinfo 0xb4083740)
06-05 18:18:26.082 I/System.out( 5830): URI: //ping
06-05 18:18:26.082 I/System.out( 5830): params: {json={}
06-05 18:18:26.082 I/System.out( 5830): }
06-05 18:18:26.085 I/System.out( 5830): URI: //ping
06-05 18:18:26.085 I/System.out( 5830): params: {json={}
06-05 18:18:26.085 I/System.out( 5830): }
06-05 18:18:26.087 I/System.out( 5830): URI: //ready
06-05 18:18:26.087 I/System.out( 5830): params: {json={}
06-05 18:18:26.087 I/System.out( 5830): }
06-05 18:18:26.089 I/System.out( 5830): URI: //
06-05 18:18:26.089 I/System.out( 5830): params: {json={"command":"version","arguments":[]}
06-05 18:18:26.089 I/System.out( 5830): }
06-05 18:18:26.089 I/System.out( 5830): header: {content-type=application/json;charset=utf-8, date=Fri, 05 Jun 2020 23:18:26 GMT, accept=*/*, host=127.0.0.1:34784, content-length=36, user-agent=HTTPClient/1.0 (2.8.3, ruby 2.5.1 (2018-03-29))}
06-05 18:18:26.089 I/System.out( 5830): params: {json={"command":"version","arguments":[]}
06-05 18:18:26.089 I/System.out( 5830): }
06-05 18:18:26.089 I/System.out( 5830): ProP json = {"command":"version","arguments":[]}
06-05 18:18:26.089 I/System.out( 5830): files: {}
06-05 18:18:26.089 I/System.out( 5830): command: {"command":"version","arguments":[]}
06-05 18:18:26.092 D/EGL_emulation( 1712): eglMakeCurrent: 0xb4085540: ver 2 0 (tinfo 0xb4083740)
06-05 18:18:26.093 I/InstrumentationBackend( 5830): Got command:'Command:'Line:null,version', arguments:'[]'
06-05 18:18:26.094 D/EGL_emulation( 1712): eglMakeCurrent: 0xb4085540: ver 2 0 (tinfo 0xb4083740)
06-05 18:18:26.101 I/System.out( 5830): result:{"bonusInformation":[],"message":"0.9.8","success":true}
06-05 18:18:26.104 I/System.out( 5830): URI: //start-application
06-05 18:18:26.104 I/System.out( 5830): params: {json={"intent":null}
06-05 18:18:26.104 I/System.out( 5830): }
06-05 18:18:26.116 I/ActivityManager( 1630): START u0 {act=android.intent.action.MAIN cat=[android.intent.category.LAUNCHER] flg=0x10200000 cmp=com.evancharlton.mileage/.Mileage} from uid 10150 on display 0
06-05 18:18:26.123 I/calabash( 5830): newActivity1
06-05 18:18:26.136 I/calabash( 5830): newActivity1
06-05 18:18:26.137 W/ActivityManager( 1630): Bad activity token: android.os.BinderProxy@bdd9d85
06-05 18:18:26.137 W/ActivityManager( 1630): java.lang.ClassCastException: android.os.BinderProxy cannot be cast to com.android.server.am.ActivityRecord$Token
06-05 18:18:26.137 W/ActivityManager( 1630): 	at com.android.server.am.ActivityRecord.forTokenLocked(ActivityRecord.java:586)
06-05 18:18:26.137 W/ActivityManager( 1630): 	at com.android.server.am.ActivityRecord.isInStackLocked(ActivityRecord.java:1327)
06-05 18:18:26.137 W/ActivityManager( 1630): 	at com.android.server.am.ActivityRecord.getStackLocked(ActivityRecord.java:1332)
06-05 18:18:26.137 W/ActivityManager( 1630): 	at com.android.server.am.ActivityManagerService.getActivityDisplayId(ActivityManagerService.java:9806)
06-05 18:18:26.137 W/ActivityManager( 1630): 	at android.app.ActivityManagerNative.onTransact(ActivityManagerNative.java:2566)
06-05 18:18:26.137 W/ActivityManager( 1630): 	at com.android.server.am.ActivityManagerService.onTransact(ActivityManagerService.java:2757)
06-05 18:18:26.137 W/ActivityManager( 1630): 	at android.os.Binder.execTransact(Binder.java:565)
06-05 18:18:26.138 W/ActivityManager( 1630): Bad activity token: android.os.BinderProxy@bdd9d85
06-05 18:18:26.138 W/ActivityManager( 1630): java.lang.ClassCastException: android.os.BinderProxy cannot be cast to com.android.server.am.ActivityRecord$Token
06-05 18:18:26.138 W/ActivityManager( 1630): 	at com.android.server.am.ActivityRecord.forTokenLocked(ActivityRecord.java:586)
06-05 18:18:26.138 W/ActivityManager( 1630): 	at com.android.server.am.ActivityRecord.isInStackLocked(ActivityRecord.java:1327)
06-05 18:18:26.138 W/ActivityManager( 1630): 	at com.android.server.am.ActivityManagerService.setTaskDescription(ActivityManagerService.java:9358)
06-05 18:18:26.138 W/ActivityManager( 1630): 	at android.app.ActivityManagerNative.onTransact(ActivityManagerNative.java:2639)
06-05 18:18:26.138 W/ActivityManager( 1630): 	at com.android.server.am.ActivityManagerService.onTransact(ActivityManagerService.java:2757)
06-05 18:18:26.138 W/ActivityManager( 1630): 	at android.os.Binder.execTransact(Binder.java:565)
06-05 18:18:26.139 W/ActivityManager( 1630): Bad activity token: android.os.BinderProxy@bdd9d85
06-05 18:18:26.139 W/ActivityManager( 1630): java.lang.ClassCastException: android.os.BinderProxy cannot be cast to com.android.server.am.ActivityRecord$Token
06-05 18:18:26.139 W/ActivityManager( 1630): 	at com.android.server.am.ActivityRecord.forTokenLocked(ActivityRecord.java:586)
06-05 18:18:26.139 W/ActivityManager( 1630): 	at com.android.server.am.ActivityRecord.isInStackLocked(ActivityRecord.java:1327)
06-05 18:18:26.139 W/ActivityManager( 1630): 	at com.android.server.am.ActivityRecord.getStackLocked(ActivityRecord.java:1332)
06-05 18:18:26.139 W/ActivityManager( 1630): 	at com.android.server.am.ActivityManagerService.getActivityStackId(ActivityManagerService.java:9817)
06-05 18:18:26.139 W/ActivityManager( 1630): 	at android.app.ActivityManagerNative.onTransact(ActivityManagerNative.java:2856)
06-05 18:18:26.139 W/ActivityManager( 1630): 	at com.android.server.am.ActivityManagerService.onTransact(ActivityManagerService.java:2757)
06-05 18:18:26.139 W/ActivityManager( 1630): 	at android.os.Binder.execTransact(Binder.java:565)
06-05 18:18:26.143 D/gralloc_ranchu( 1346): gralloc_alloc: Creating ashmem region of size 9023488
06-05 18:18:26.167 W/ActivityManager( 1630): Bad activity token: android.os.BinderProxy@bdd9d85
06-05 18:18:26.167 W/ActivityManager( 1630): java.lang.ClassCastException: android.os.BinderProxy cannot be cast to com.android.server.am.ActivityRecord$Token
06-05 18:18:26.167 W/ActivityManager( 1630): 	at com.android.server.am.ActivityRecord.forTokenLocked(ActivityRecord.java:586)
06-05 18:18:26.167 W/ActivityManager( 1630): 	at com.android.server.am.ActivityRecord.isInStackLocked(ActivityRecord.java:1327)
06-05 18:18:26.167 W/ActivityManager( 1630): 	at com.android.server.am.ActivityManagerService.getActivityOptions(ActivityManagerService.java:12559)
06-05 18:18:26.167 W/ActivityManager( 1630): 	at android.app.ActivityManagerNative.onTransact(ActivityManagerNative.java:1933)
06-05 18:18:26.167 W/ActivityManager( 1630): 	at com.android.server.am.ActivityManagerService.onTransact(ActivityManagerService.java:2757)
06-05 18:18:26.167 W/ActivityManager( 1630): 	at android.os.Binder.execTransact(Binder.java:565)
06-05 18:18:26.167 W/ActivityManager( 1630): Bad activity token: android.os.BinderProxy@bdd9d85
06-05 18:18:26.167 W/ActivityManager( 1630): java.lang.ClassCastException: android.os.BinderProxy cannot be cast to com.android.server.am.ActivityRecord$Token
06-05 18:18:26.167 W/ActivityManager( 1630): 	at com.android.server.am.ActivityRecord.forTokenLocked(ActivityRecord.java:586)
06-05 18:18:26.167 W/ActivityManager( 1630): 	at com.android.server.am.ActivityRecord.isInStackLocked(ActivityRecord.java:1327)
06-05 18:18:26.167 W/ActivityManager( 1630): 	at com.android.server.am.ActivityManagerService.getActivityOptions(ActivityManagerService.java:12559)
06-05 18:18:26.167 W/ActivityManager( 1630): 	at android.app.ActivityManagerNative.onTransact(ActivityManagerNative.java:1933)
06-05 18:18:26.167 W/ActivityManager( 1630): 	at com.android.server.am.ActivityManagerService.onTransact(ActivityManagerService.java:2757)
06-05 18:18:26.167 W/ActivityManager( 1630): 	at android.os.Binder.execTransact(Binder.java:565)
06-05 18:18:26.188 V/PhoneStatusBar( 1712): setLightsOn(true)
06-05 18:18:26.193 D/EGL_emulation( 2099): eglMakeCurrent: 0xb4085240: ver 2 0 (tinfo 0xb40832d0)
06-05 18:18:26.194 D/EGL_emulation( 1712): eglMakeCurrent: 0xb4085540: ver 2 0 (tinfo 0xb4083740)
06-05 18:18:26.209 D/gralloc_ranchu( 1346): gralloc_alloc: Creating ashmem region of size 9023488
06-05 18:18:26.209 D/EGL_emulation( 1712): eglMakeCurrent: 0xb4085540: ver 2 0 (tinfo 0xb4083740)
06-05 18:18:26.215 D/        ( 5830): HostConnection::get() New Host Connection established 0x97d254c0, tid 5830
06-05 18:18:26.215 D/EGL_emulation( 1712): eglMakeCurrent: 0xb4085540: ver 2 0 (tinfo 0xb4083740)
06-05 18:18:26.270 D/EGL_emulation( 1712): eglMakeCurrent: 0xb4085540: ver 2 0 (tinfo 0xb4083740)
06-05 18:18:26.273 D/EGL_emulation( 1712): eglMakeCurrent: 0xb4085540: ver 2 0 (tinfo 0xb4083740)
06-05 18:18:26.273 V/PhoneStatusBar( 1712): setLightsOn(true)
06-05 18:18:26.276 D/EGL_emulation( 1712): eglMakeCurrent: 0xb4085540: ver 2 0 (tinfo 0xb4083740)
06-05 18:18:26.278 D/EGL_emulation( 1712): eglMakeCurrent: 0xb4085540: ver 2 0 (tinfo 0xb4083740)
06-05 18:18:26.292 I/WindowManager( 1630): Destroying surface Surface(name=com.evancharlton.mileage/com.evancharlton.mileage.Mileage) called by com.android.server.wm.WindowStateAnimator.destroySurface:2016 com.android.server.wm.WindowStateAnimator.destroySurfaceLocked:882 com.android.server.wm.WindowState.removeLocked:1456 com.android.server.wm.WindowManagerService.removeWindowInnerLocked:2484 com.android.server.wm.AppWindowToken.destroySurfaces:365 com.android.server.wm.WindowStateAnimator.finishExit:565 com.android.server.wm.AppWindowAnimator.stepAnimationLocked:427 com.android.server.wm.WindowAnimator.updateAppWindowsLocked:196 
06-05 18:18:26.298 D/EGL_emulation( 1712): eglMakeCurrent: 0xb4085540: ver 2 0 (tinfo 0xb4083740)
06-05 18:18:26.300 D/EGL_emulation( 1712): eglMakeCurrent: 0xb4085540: ver 2 0 (tinfo 0xb4083740)
06-05 18:18:26.302 I/ActivityManager( 1630): Displayed com.evancharlton.mileage/.Mileage: +181ms
06-05 18:18:26.310 D/gralloc_ranchu( 1346): gralloc_alloc: Creating ashmem region of size 9023488
06-05 18:18:26.310 D/EGL_emulation( 1712): eglMakeCurrent: 0xb4085540: ver 2 0 (tinfo 0xb4083740)
06-05 18:18:26.331 D/EGL_emulation( 1712): eglMakeCurrent: 0xb4085540: ver 2 0 (tinfo 0xb4083740)
06-05 18:18:26.336 D/EGL_emulation( 1712): eglMakeCurrent: 0xb4085540: ver 2 0 (tinfo 0xb4083740)
06-05 18:18:26.350 D/EGL_emulation( 1712): eglMakeCurrent: 0xb4085540: ver 2 0 (tinfo 0xb4083740)
06-05 18:18:26.351 V/PhoneStatusBar( 1712): setLightsOn(true)
06-05 18:18:26.353 D/EGL_emulation( 1712): eglMakeCurrent: 0xb4085540: ver 2 0 (tinfo 0xb4083740)
06-05 18:18:26.357 D/EGL_emulation( 1712): eglMakeCurrent: 0xb4085540: ver 2 0 (tinfo 0xb4083740)
06-05 18:18:26.359 D/EGL_emulation( 1712): eglMakeCurrent: 0xb4085540: ver 2 0 (tinfo 0xb4083740)
06-05 18:18:26.362 D/EGL_emulation( 1712): eglMakeCurrent: 0xb4085540: ver 2 0 (tinfo 0xb4083740)
06-05 18:18:26.376 D/EGL_emulation( 1712): eglMakeCurrent: 0xb4085540: ver 2 0 (tinfo 0xb4083740)
06-05 18:18:26.378 D/EGL_emulation( 1712): eglMakeCurrent: 0xb4085540: ver 2 0 (tinfo 0xb4083740)
06-05 18:18:26.382 I/System.out( 5830): URI: //map
06-05 18:18:26.382 I/System.out( 5830): params: {json={"query":"* marked:'Statistics'","operation":{"method_name":"query","arguments":[]}}
06-05 18:18:26.382 I/System.out( 5830): }
06-05 18:18:26.393 D/EGL_emulation( 1712): eglMakeCurrent: 0xb4085540: ver 2 0 (tinfo 0xb4083740)
06-05 18:18:26.395 D/EGL_emulation( 1712): eglMakeCurrent: 0xb4085540: ver 2 0 (tinfo 0xb4083740)
06-05 18:18:26.399 W/ResourceType( 5830): No package identifier when getting name for resource number 0x00000001
06-05 18:18:26.409 D/EGL_emulation( 1712): eglMakeCurrent: 0xb4085540: ver 2 0 (tinfo 0xb4083740)
06-05 18:18:26.415 I/System.out( 5830): URI: //gesture
06-05 18:18:26.415 I/System.out( 5830): params: {json={"query_timeout":5.0,"gestures":[{"query_string":"* marked:'Statistics'","touches":[{"x":50,"y":50,"offset_x":0,"offset_y":0,"wait":0.0,"time":0.2,"release":true,"query_string":null}]}]}
06-05 18:18:26.415 I/System.out( 5830): }
06-05 18:18:26.420 W/ResourceType( 5830): No package identifier when getting name for resource number 0x00000001
06-05 18:18:26.492 I/WindowManager( 1630): Destroying surface Surface(name=Starting com.evancharlton.mileage) called by com.android.server.wm.WindowStateAnimator.destroySurface:2016 com.android.server.wm.WindowStateAnimator.destroySurfaceLocked:882 com.android.server.wm.WindowState.destroyOrSaveSurface:2100 com.android.server.wm.AppWindowToken.destroySurfaces:363 com.android.server.wm.WindowStateAnimator.finishExit:565 com.android.server.wm.WindowStateAnimator.stepAnimationLocked:491 com.android.server.wm.WindowAnimator.updateWindowsLocked:303 com.android.server.wm.WindowAnimator.animateLocked:704 
06-05 18:18:26.493 V/PhoneStatusBar( 1712): setLightsOn(true)
06-05 18:18:26.495 V/PhoneStatusBar( 1712): setLightsOn(true)
06-05 18:18:26.628 V/PhoneStatusBar( 1712): setLightsOn(true)
06-05 18:18:26.649 I/calabash( 5830): newActivity1
06-05 18:18:26.702 I/System.out( 5830): URI: //map
06-05 18:18:26.702 I/System.out( 5830): params: {json={"query":"android.widget.ScrollView index:0","operation":{"method_name":"query","arguments":[]}}
06-05 18:18:26.702 I/System.out( 5830): }
06-05 18:18:26.702 W/ActivityManager( 1630): Bad activity token: android.os.BinderProxy@a97b5fb
06-05 18:18:26.702 W/ActivityManager( 1630): java.lang.ClassCastException: android.os.BinderProxy cannot be cast to com.android.server.am.ActivityRecord$Token
06-05 18:18:26.702 W/ActivityManager( 1630): 	at com.android.server.am.ActivityRecord.forTokenLocked(ActivityRecord.java:586)
06-05 18:18:26.702 W/ActivityManager( 1630): 	at com.android.server.am.ActivityRecord.isInStackLocked(ActivityRecord.java:1327)
06-05 18:18:26.702 W/ActivityManager( 1630): 	at com.android.server.am.ActivityRecord.getStackLocked(ActivityRecord.java:1332)
06-05 18:18:26.702 W/ActivityManager( 1630): 	at com.android.server.am.ActivityManagerService.getActivityDisplayId(ActivityManagerService.java:9806)
06-05 18:18:26.702 W/ActivityManager( 1630): 	at android.app.ActivityManagerNative.onTransact(ActivityManagerNative.java:2566)
06-05 18:18:26.702 W/ActivityManager( 1630): 	at com.android.server.am.ActivityManagerService.onTransact(ActivityManagerService.java:2757)
06-05 18:18:26.702 W/ActivityManager( 1630): 	at android.os.Binder.execTransact(Binder.java:565)
06-05 18:18:26.705 W/ActivityManager( 1630): Bad activity token: android.os.BinderProxy@a97b5fb
06-05 18:18:26.705 W/ActivityManager( 1630): java.lang.ClassCastException: android.os.BinderProxy cannot be cast to com.android.server.am.ActivityRecord$Token
06-05 18:18:26.705 W/ActivityManager( 1630): 	at com.android.server.am.ActivityRecord.forTokenLocked(ActivityRecord.java:586)
06-05 18:18:26.705 W/ActivityManager( 1630): 	at com.android.server.am.ActivityRecord.isInStackLocked(ActivityRecord.java:1327)
06-05 18:18:26.705 W/ActivityManager( 1630): 	at com.android.server.am.ActivityManagerService.setTaskDescription(ActivityManagerService.java:9358)
06-05 18:18:26.705 W/ActivityManager( 1630): 	at android.app.ActivityManagerNative.onTransact(ActivityManagerNative.java:2639)
06-05 18:18:26.705 W/ActivityManager( 1630): 	at com.android.server.am.ActivityManagerService.onTransact(ActivityManagerService.java:2757)
06-05 18:18:26.705 W/ActivityManager( 1630): 	at android.os.Binder.execTransact(Binder.java:565)
06-05 18:18:26.706 W/ActivityManager( 1630): Bad activity token: android.os.BinderProxy@a97b5fb
06-05 18:18:26.706 W/ActivityManager( 1630): java.lang.ClassCastException: android.os.BinderProxy cannot be cast to com.android.server.am.ActivityRecord$Token
06-05 18:18:26.706 W/ActivityManager( 1630): 	at com.android.server.am.ActivityRecord.forTokenLocked(ActivityRecord.java:586)
06-05 18:18:26.706 W/ActivityManager( 1630): 	at com.android.server.am.ActivityRecord.isInStackLocked(ActivityRecord.java:1327)
06-05 18:18:26.706 W/ActivityManager( 1630): 	at com.android.server.am.ActivityRecord.getStackLocked(ActivityRecord.java:1332)
06-05 18:18:26.706 W/ActivityManager( 1630): 	at com.android.server.am.ActivityManagerService.getActivityStackId(ActivityManagerService.java:9817)
06-05 18:18:26.706 W/ActivityManager( 1630): 	at android.app.ActivityManagerNative.onTransact(ActivityManagerNative.java:2856)
06-05 18:18:26.706 W/ActivityManager( 1630): 	at com.android.server.am.ActivityManagerService.onTransact(ActivityManagerService.java:2757)
06-05 18:18:26.706 W/ActivityManager( 1630): 	at android.os.Binder.execTransact(Binder.java:565)
06-05 18:18:26.719 D/VehicleStatisticsActivity( 5830): Checking recalculation ...
06-05 18:18:26.720 D/VehicleStatisticsActivity( 5830): Recalculation not necessary.
06-05 18:18:26.722 W/ActivityManager( 1630): Bad activity token: android.os.BinderProxy@a97b5fb
06-05 18:18:26.722 W/ActivityManager( 1630): java.lang.ClassCastException: android.os.BinderProxy cannot be cast to com.android.server.am.ActivityRecord$Token
06-05 18:18:26.722 W/ActivityManager( 1630): 	at com.android.server.am.ActivityRecord.forTokenLocked(ActivityRecord.java:586)
06-05 18:18:26.722 W/ActivityManager( 1630): 	at com.android.server.am.ActivityRecord.isInStackLocked(ActivityRecord.java:1327)
06-05 18:18:26.722 W/ActivityManager( 1630): 	at com.android.server.am.ActivityManagerService.getActivityOptions(ActivityManagerService.java:12559)
06-05 18:18:26.722 W/ActivityManager( 1630): 	at android.app.ActivityManagerNative.onTransact(ActivityManagerNative.java:1933)
06-05 18:18:26.722 W/ActivityManager( 1630): 	at com.android.server.am.ActivityManagerService.onTransact(ActivityManagerService.java:2757)
06-05 18:18:26.722 W/ActivityManager( 1630): 	at android.os.Binder.execTransact(Binder.java:565)
06-05 18:18:26.722 W/ActivityManager( 1630): Bad activity token: android.os.BinderProxy@a97b5fb
06-05 18:18:26.722 W/ActivityManager( 1630): java.lang.ClassCastException: android.os.BinderProxy cannot be cast to com.android.server.am.ActivityRecord$Token
06-05 18:18:26.722 W/ActivityManager( 1630): 	at com.android.server.am.ActivityRecord.forTokenLocked(ActivityRecord.java:586)
06-05 18:18:26.722 W/ActivityManager( 1630): 	at com.android.server.am.ActivityRecord.isInStackLocked(ActivityRecord.java:1327)
06-05 18:18:26.722 W/ActivityManager( 1630): 	at com.android.server.am.ActivityManagerService.getActivityOptions(ActivityManagerService.java:12559)
06-05 18:18:26.722 W/ActivityManager( 1630): 	at android.app.ActivityManagerNative.onTransact(ActivityManagerNative.java:1933)
06-05 18:18:26.722 W/ActivityManager( 1630): 	at com.android.server.am.ActivityManagerService.onTransact(ActivityManagerService.java:2757)
06-05 18:18:26.722 W/ActivityManager( 1630): 	at android.os.Binder.execTransact(Binder.java:565)
06-05 18:18:26.724 D/VehicleStatisticsActivity( 5830): Checking recalculation ...
06-05 18:18:26.725 D/VehicleStatisticsActivity( 5830): Recalculation not necessary.
06-05 18:18:26.785 I/System.out( 5830): URI: //map
06-05 18:18:26.785 I/System.out( 5830): params: {json={"query":"android.widget.AbsListView index:0","operation":{"method_name":"query","arguments":[]}}
06-05 18:18:26.785 I/System.out( 5830): }
06-05 18:18:26.791 I/art     ( 5830): Do partial code cache collection, code=30KB, data=29KB
06-05 18:18:26.791 I/art     ( 5830): After code cache collection, code=29KB, data=28KB
06-05 18:18:26.791 I/art     ( 5830): Increasing code cache capacity to 128KB
06-05 18:18:26.804 I/System.out( 5830): URI: //map
06-05 18:18:26.804 I/System.out( 5830): params: {json={"query":"android.widget.AbsListView index:0","operation":{"method_name":"query","arguments":[]}}
06-05 18:18:26.804 I/System.out( 5830): }
06-05 18:18:26.820 I/System.out( 5830): URI: //map
06-05 18:18:26.820 I/System.out( 5830): params: {json={"query":"android.widget.AbsListView index:0","operation":{"method_name":"query","arguments":[]}}
06-05 18:18:26.820 I/System.out( 5830): }
06-05 18:18:26.835 I/System.out( 5830): URI: //map
06-05 18:18:26.835 I/System.out( 5830): params: {json={"query":"android.widget.AbsListView index:0","operation":{"method_name":"query","arguments":["getFirstVisiblePosition"]}}
06-05 18:18:26.835 I/System.out( 5830): }
06-05 18:18:26.849 I/System.out( 5830): URI: //map
06-05 18:18:26.849 I/System.out( 5830): params: {json={"query":"android.widget.AbsListView index:0","operation":{"method_name":"query","arguments":["getLastVisiblePosition"]}}
06-05 18:18:26.849 I/System.out( 5830): }
06-05 18:18:26.861 I/System.out( 5830): URI: //map
06-05 18:18:26.861 I/System.out( 5830): params: {json={"query":"android.widget.AbsListView index:0","operation":{"method_name":"query","arguments":[{"method_name":"setSelection","arguments":[26]}]}}
06-05 18:18:26.861 I/System.out( 5830): }
06-05 18:18:26.877 I/System.out( 5830): URI: //map
06-05 18:18:26.877 I/System.out( 5830): params: {json={"query":"* marked:'East'","operation":{"method_name":"query","arguments":[]}}
06-05 18:18:26.878 I/System.out( 5830): }
06-05 18:18:26.918 D/gralloc_ranchu( 1346): gralloc_alloc: Creating ashmem region of size 9023488
06-05 18:18:26.927 V/PhoneStatusBar( 1712): setLightsOn(true)
06-05 18:18:26.927 V/PhoneStatusBar( 1712): setLightsOn(true)
06-05 18:18:26.928 W/OpenGLRenderer( 2099): Incorrectly called buildLayer on View: ShortcutAndWidgetContainer, destroying layer...
06-05 18:18:26.943 I/WindowManager( 1630): Destroying surface Surface(name=com.android.launcher3/com.android.launcher3.Launcher) called by com.android.server.wm.WindowStateAnimator.destroySurface:2016 com.android.server.wm.WindowStateAnimator.destroySurfaceLocked:882 com.android.server.wm.WindowState.destroyOrSaveSurface:2100 com.android.server.wm.AppWindowToken.destroySurfaces:363 com.android.server.wm.AppWindowToken.notifyAppStopped:389 com.android.server.wm.WindowManagerService.notifyAppStopped:4463 com.android.server.am.ActivityStack.activityStoppedLocked:1252 com.android.server.am.ActivityManagerService.activityStopped:6903 
06-05 18:18:26.944 V/PhoneStatusBar( 1712): setLightsOn(true)
06-05 18:18:26.963 W/ResourceType( 5830): No package identifier when getting name for resource number 0x00000001
06-05 18:18:26.974 I/System.out( 5830): URI: //gesture
06-05 18:18:26.974 I/System.out( 5830): params: {json={"query_timeout":5.0,"gestures":[{"query_string":"* marked:'East'","touches":[{"x":50,"y":50,"offset_x":0,"offset_y":0,"wait":0.0,"time":0.2,"release":true,"query_string":null}]}]}
06-05 18:18:26.974 I/System.out( 5830): }
06-05 18:18:26.980 W/ResourceType( 5830): No package identifier when getting name for resource number 0x00000001
06-05 18:18:27.210 I/ActivityManager( 1630): START u0 {cmp=com.evancharlton.mileage/.charts.EastChart (has extras)} from uid 10150 on display 0
06-05 18:18:27.212 V/PhoneStatusBar( 1712): setLightsOn(true)
06-05 18:18:27.214 V/PhoneStatusBar( 1712): setLightsOn(true)
06-05 18:18:27.228 I/System.out( 5830): URI: //map
06-05 18:18:27.229 I/System.out( 5830): params: {json={"query":"* {text CONTAINS[c] 'Farthest east fillup'}","operation":{"method_name":"query","arguments":[]}}
06-05 18:18:27.229 I/System.out( 5830): }
06-05 18:18:27.268 I/calabash( 5830): newActivity1
06-05 18:18:27.272 W/aiCharts( 5830): License file is invalid or missing. 
06-05 18:18:27.272 W/aiCharts( 5830): Please place proper license.lic to /assets folder.
06-05 18:18:27.287 V/PhoneStatusBar( 1712): setLightsOn(true)
06-05 18:18:27.310 V/PhoneStatusBar( 1712): setLightsOn(true)
06-05 18:18:27.326 V/PhoneStatusBar( 1712): setLightsOn(true)
06-05 18:18:27.329 I/WindowManager( 1630): Destroying surface Surface(name=Creating chart…) called by com.android.server.wm.WindowStateAnimator.destroySurface:2016 com.android.server.wm.WindowStateAnimator.destroySurfaceLocked:882 com.android.server.wm.WindowState.removeLocked:1456 com.android.server.wm.WindowManagerService.removeWindowInnerLocked:2484 com.android.server.wm.WindowManagerService.removeWindowLocked:2442 com.android.server.wm.WindowManagerService.removeWindowLocked:2311 com.android.server.wm.WindowManagerService.removeWindow:2306 com.android.server.wm.Session.remove:202 
06-05 18:18:27.340 D/gralloc_ranchu( 1346): gralloc_alloc: Creating ashmem region of size 9023488
06-05 18:18:27.343 V/PhoneStatusBar( 1712): setLightsOn(true)
06-05 18:18:27.392 V/PhoneStatusBar( 1712): setLightsOn(true)
06-05 18:18:27.409 V/PhoneStatusBar( 1712): setLightsOn(true)
06-05 18:18:27.409 I/ActivityManager( 1630): Displayed com.evancharlton.mileage/.charts.EastChart: +143ms
06-05 18:18:27.425 V/PhoneStatusBar( 1712): setLightsOn(true)
06-05 18:18:27.442 V/PhoneStatusBar( 1712): setLightsOn(true)
06-05 18:18:27.600 I/System.out( 5830): URI: //map
06-05 18:18:27.600 I/System.out( 5830): params: {json={"query":"* {text CONTAINS[c] 'Farthest east fillup'}","operation":{"method_name":"query","arguments":[]}}
06-05 18:18:27.600 I/System.out( 5830): }
06-05 18:18:27.619 I/System.out( 5830): URI: //
06-05 18:18:27.619 I/System.out( 5830): params: {json={"command":"press_key","arguments":["KEYCODE_BACK"]}
06-05 18:18:27.619 I/System.out( 5830): }
06-05 18:18:27.619 I/System.out( 5830): header: {content-type=application/json;charset=utf-8, date=Fri, 05 Jun 2020 23:18:28 GMT, accept=*/*, host=127.0.0.1:34784, content-length=52, user-agent=HTTPClient/1.0 (2.8.3, ruby 2.5.1 (2018-03-29))}
06-05 18:18:27.619 I/System.out( 5830): params: {json={"command":"press_key","arguments":["KEYCODE_BACK"]}
06-05 18:18:27.619 I/System.out( 5830): }
06-05 18:18:27.619 I/System.out( 5830): ProP json = {"command":"press_key","arguments":["KEYCODE_BACK"]}
06-05 18:18:27.619 I/System.out( 5830): files: {}
06-05 18:18:27.619 I/System.out( 5830): command: {"command":"press_key","arguments":["KEYCODE_BACK"]}
06-05 18:18:27.620 I/InstrumentationBackend( 5830): Got command:'Command:'Line:null,press_key', arguments:'[KEYCODE_BACK]'
06-05 18:18:27.623 V/PhoneStatusBar( 1712): setLightsOn(true)
06-05 18:18:27.625 V/PhoneStatusBar( 1712): setLightsOn(true)
06-05 18:18:27.628 I/art     ( 5830): Do partial code cache collection, code=60KB, data=62KB
06-05 18:18:27.628 I/art     ( 5830): After code cache collection, code=59KB, data=61KB
06-05 18:18:27.628 I/art     ( 5830): Increasing code cache capacity to 256KB
06-05 18:18:27.630 I/System.out( 5830): result:{"bonusInformation":[],"message":"","success":true}
06-05 18:18:27.631 D/VehicleStatisticsActivity( 5830): Checking recalculation ...
06-05 18:18:27.631 D/VehicleStatisticsActivity( 5830): Recalculation not necessary.
06-05 18:18:27.633 I/System.out( 5830): URI: //map
06-05 18:18:27.633 I/System.out( 5830): params: {json={"query":"* {text CONTAINS[c] 'Statistics'}","operation":{"method_name":"query","arguments":[]}}
06-05 18:18:27.633 I/System.out( 5830): }
06-05 18:18:27.642 V/PhoneStatusBar( 1712): setLightsOn(true)
06-05 18:18:27.643 D/WindowManager( 1630): relayoutVisibleWindow: Window{4b87832 u0 com.evancharlton.mileage/com.evancharlton.mileage.Mileage EXITING} mAnimatingExit=true, mRemoveOnExit=false, mDestroying=false
06-05 18:18:27.659 D/gralloc_ranchu( 1346): gralloc_alloc: Creating ashmem region of size 9023488
06-05 18:18:27.660 V/PhoneStatusBar( 1712): setLightsOn(true)
06-05 18:18:27.676 V/PhoneStatusBar( 1712): setLightsOn(true)
06-05 18:18:27.692 V/PhoneStatusBar( 1712): setLightsOn(true)
