--------- beginning of main
06-05 23:00:55.995 E/EGL_emulation( 1347): tid 1347: eglCreateSyncKHR(1901): error 0x3004 (EGL_BAD_ATTRIBUTE)
--------- beginning of system
06-05 23:00:56.022 W/ActivityManager( 1631): Finishing task with all activities already finished
06-05 23:00:56.022 W/ActivityManager( 1631): Duplicate finish request for ActivityRecord{a1fad1c u0 com.evancharlton.mileage/.Mileage t9023 f}
06-05 23:00:56.023 W/ActivityManager( 1631): Finishing task with all activities already finished
06-05 23:00:56.023 W/ActivityManager( 1631): Duplicate finish request for ActivityRecord{a1fad1c u0 com.evancharlton.mileage/.Mileage t9023 f}
06-05 23:00:56.023 W/ActivityManager( 1631): Finishing task with all activities already finished
06-05 23:00:56.023 W/ActivityManager( 1631): Duplicate finish request for ActivityRecord{a1fad1c u0 com.evancharlton.mileage/.Mileage t9023 f}
06-05 23:00:56.024 W/ActivityManager( 1631): Finishing task with all activities already finished
06-05 23:00:56.024 W/ActivityManager( 1631): Duplicate finish request for ActivityRecord{a1fad1c u0 com.evancharlton.mileage/.Mileage t9023 f}
06-05 23:00:56.054 D/EGL_emulation( 1712): eglMakeCurrent: 0xb0685360: ver 2 0 (tinfo 0xb06836c0)
06-05 23:00:56.067 D/EGL_emulation( 1712): eglMakeCurrent: 0xb0685360: ver 2 0 (tinfo 0xb06836c0)
06-05 23:00:56.070 D/EGL_emulation( 2076): eglMakeCurrent: 0xb0685360: ver 2 0 (tinfo 0xb06836b0)
06-05 23:00:56.118 D/EGL_emulation( 1712): eglMakeCurrent: 0xb0685360: ver 2 0 (tinfo 0xb06836c0)
06-05 23:00:56.134 D/EGL_emulation( 1712): eglMakeCurrent: 0xb0685360: ver 2 0 (tinfo 0xb06836c0)
06-05 23:00:56.137 D/EGL_emulation( 1712): eglMakeCurrent: 0xb0685360: ver 2 0 (tinfo 0xb06836c0)
06-05 23:00:56.151 D/EGL_emulation( 1712): eglMakeCurrent: 0xb0685360: ver 2 0 (tinfo 0xb06836c0)
06-05 23:00:56.153 D/EGL_emulation( 1712): eglMakeCurrent: 0xb0685360: ver 2 0 (tinfo 0xb06836c0)
06-05 23:00:56.167 D/EGL_emulation( 1712): eglMakeCurrent: 0xb0685360: ver 2 0 (tinfo 0xb06836c0)
06-05 23:00:56.168 D/EGL_emulation( 1712): eglMakeCurrent: 0xb0685360: ver 2 0 (tinfo 0xb06836c0)
06-05 23:00:56.184 D/EGL_emulation( 1712): eglMakeCurrent: 0xb0685360: ver 2 0 (tinfo 0xb06836c0)
06-05 23:00:56.186 D/EGL_emulation( 1712): eglMakeCurrent: 0xb0685360: ver 2 0 (tinfo 0xb06836c0)
06-05 23:00:56.200 D/EGL_emulation( 1712): eglMakeCurrent: 0xb0685360: ver 2 0 (tinfo 0xb06836c0)
06-05 23:00:56.202 D/EGL_emulation( 1712): eglMakeCurrent: 0xb0685360: ver 2 0 (tinfo 0xb06836c0)
06-05 23:00:56.211 D/AndroidRuntime(13325): >>>>>> START com.android.internal.os.RuntimeInit uid 2000 <<<<<<
06-05 23:00:56.213 D/AndroidRuntime(13325): CheckJNI is ON
06-05 23:00:56.217 D/EGL_emulation( 1712): eglMakeCurrent: 0xb0685360: ver 2 0 (tinfo 0xb06836c0)
06-05 23:00:56.219 D/EGL_emulation( 1712): eglMakeCurrent: 0xb0685360: ver 2 0 (tinfo 0xb06836c0)
06-05 23:00:56.227 W/art     (13325): Unexpected CPU variant for X86 using defaults: x86
06-05 23:00:56.230 D/ICU     (13325): No timezone override file found: /data/misc/zoneinfo/current/icu/icu_tzdata.dat
06-05 23:00:56.234 D/EGL_emulation( 1712): eglMakeCurrent: 0xb0685360: ver 2 0 (tinfo 0xb06836c0)
06-05 23:00:56.235 D/EGL_emulation( 1712): eglMakeCurrent: 0xb0685360: ver 2 0 (tinfo 0xb06836c0)
06-05 23:00:56.239 E/memtrack(13325): Couldn't load memtrack module (No such file or directory)
06-05 23:00:56.239 E/android.os.Debug(13325): failed to load memtrack module: -2
06-05 23:00:56.240 I/Radio-JNI(13325): register_android_hardware_Radio DONE
06-05 23:00:56.246 D/AndroidRuntime(13325): Calling main entry com.android.commands.am.Am
06-05 23:00:56.247 I/ActivityManager( 1631): Force stopping com.evancharlton.mileage appid=10326 user=0: start instr
06-05 23:00:56.248 I/ActivityManager( 1631): Killing 13276:com.evancharlton.mileage/u0a326 (adj 0): stop com.evancharlton.mileage
06-05 23:00:56.248 D/ActivityManager( 1631): cleanUpApplicationRecord -- 13276
06-05 23:00:56.248 W/ActivityManager( 1631): Crash of app com.evancharlton.mileage running instrumentation ComponentInfo{com.evancharlton.mileage.test/sh.calaba.instrumentationbackend.CalabashInstrumentationTestRunner}
06-05 23:00:56.248 I/ActivityManager( 1631): Force stopping com.evancharlton.mileage appid=10326 user=0: finished inst
06-05 23:00:56.251 D/EGL_emulation( 1712): eglMakeCurrent: 0xb0685360: ver 2 0 (tinfo 0xb06836c0)
06-05 23:00:56.252 I/art     (13335): Not late-enabling -Xcheck:jni (already on)
06-05 23:00:56.252 D/EGL_emulation( 1712): eglMakeCurrent: 0xb0685360: ver 2 0 (tinfo 0xb06836c0)
06-05 23:00:56.252 W/art     (13335): Unexpected CPU variant for X86 using defaults: x86
06-05 23:00:56.259 I/ActivityManager( 1631): Start proc 13335:com.evancharlton.mileage/u0a326 for added application com.evancharlton.mileage
06-05 23:00:56.259 D/AndroidRuntime(13325): Shutting down VM
06-05 23:00:56.265 W/System  (13335): ClassLoader referenced unknown path: /data/app/com.evancharlton.mileage.test-1/lib/x86
06-05 23:00:56.265 W/System  (13335): ClassLoader referenced unknown path: /data/app/com.evancharlton.mileage-1/lib/x86
06-05 23:00:56.268 W/System  (13335): ClassLoader referenced unknown path: 
06-05 23:00:56.268 D/EGL_emulation( 1712): eglMakeCurrent: 0xb0685360: ver 2 0 (tinfo 0xb06836c0)
06-05 23:00:56.273 I/System.out(13335): Main activity name automatically set to: com.evancharlton.mileage.Mileage
06-05 23:00:56.274 I/System.out(13335): Calabash did not load Mono. This is only a problem if you are trying to test a Mono application
06-05 23:00:56.274 I/calabash(13335): Test server port: 7102
06-05 23:00:56.275 I/InstrumentationBackend(13335): Added:'GetPreferences', with key:'get_preferences'
06-05 23:00:56.281 I/InstrumentationBackend(13335): Added:'SetPreferences', with key:'set_preferences'
06-05 23:00:56.281 I/InstrumentationBackend(13335): Added:'ClearPreferences', with key:'clear_preferences'
06-05 23:00:56.281 I/InstrumentationBackend(13335): Added:'PressElement', with key:'press_l10n_element'
06-05 23:00:56.281 I/InstrumentationBackend(13335): Added:'WaitForElement', with key:'wait_for_l10n_element'
06-05 23:00:56.281 I/InstrumentationBackend(13335): Added:'NullAction', with key:'nullAction'
06-05 23:00:56.281 I/InstrumentationBackend(13335): Added:'PressKey', with key:'press_key'
06-05 23:00:56.281 I/InstrumentationBackend(13335): Added:'SetActivityOrientation', with key:'set_activity_orientation'
06-05 23:00:56.281 I/InstrumentationBackend(13335): Added:'GetActivityOrientation', with key:'get_activity_orientation'
06-05 23:00:56.282 I/InstrumentationBackend(13335): Added:'FakeGPSLocation', with key:'set_gps_coordinates'
06-05 23:00:56.282 I/InstrumentationBackend(13335): Added:'SetPropertyByCssSelector', with key:'set_property_by_css_selector'
06-05 23:00:56.282 I/InstrumentationBackend(13335): Added:'GetUrl', with key:'get_url'
06-05 23:00:56.282 I/InstrumentationBackend(13335): Added:'ScrollTo', with key:'scroll_to'
06-05 23:00:56.282 I/InstrumentationBackend(13335): Added:'GetLoadProgress', with key:'get_load_progress'
06-05 23:00:56.282 I/InstrumentationBackend(13335): Added:'DumpHtml', with key:'dump_html'
06-05 23:00:56.282 I/InstrumentationBackend(13335): Added:'DumpBodyHtml', with key:'dump_body_html'
06-05 23:00:56.282 I/InstrumentationBackend(13335): Added:'EnterTextByCssSelector', with key:'enter_text_by_selector'
06-05 23:00:56.283 I/InstrumentationBackend(13335): Added:'AndroidSDKVersion', with key:'android_sdk_version'
06-05 23:00:56.283 I/InstrumentationBackend(13335): Added:'Version', with key:'version'
06-05 23:00:56.283 I/InstrumentationBackend(13335): Added:'Drag', with key:'drag'
06-05 23:00:56.283 I/InstrumentationBackend(13335): Added:'TouchCoordinates', with key:'touch_coordinate'
06-05 23:00:56.283 I/InstrumentationBackend(13335): Added:'LongPressCoordinate', with key:'long_press_coordinate'
06-05 23:00:56.283 I/InstrumentationBackend(13335): Added:'DragCoordinates', with key:'drag_coordinates'
06-05 23:00:56.283 I/InstrumentationBackend(13335): Added:'ResumeApplication', with key:'resume_application'
06-05 23:00:56.283 I/InstrumentationBackend(13335): Added:'Swipe', with key:'swipe'
06-05 23:00:56.283 I/InstrumentationBackend(13335): Added:'DoubleTapCoordinate', with key:'double_tap_coordinate'
06-05 23:00:56.284 W/InputDispatcher( 1631): channel '8db869b com.evancharlton.mileage/com.evancharlton.mileage.Mileage (server)' ~ Consumer closed input channel or an error occurred.  events=0x9
06-05 23:00:56.284 E/InputDispatcher( 1631): channel '8db869b com.evancharlton.mileage/com.evancharlton.mileage.Mileage (server)' ~ Channel is unrecoverably broken and will be disposed!
06-05 23:00:56.284 W/InputDispatcher( 1631): channel 'a39ec14 Toast (server)' ~ Consumer closed input channel or an error occurred.  events=0x9
06-05 23:00:56.284 E/InputDispatcher( 1631): channel 'a39ec14 Toast (server)' ~ Channel is unrecoverably broken and will be disposed!
06-05 23:00:56.284 I/WindowManager( 1631): WIN DEATH: Window{8db869b u0 com.evancharlton.mileage/com.evancharlton.mileage.Mileage EXITING}
06-05 23:00:56.284 W/InputDispatcher( 1631): Attempted to unregister already unregistered input channel '8db869b com.evancharlton.mileage/com.evancharlton.mileage.Mileage (server)'
06-05 23:00:56.283 I/InstrumentationBackend(13335): Added:'ClickOnScreen', with key:'click_on_screen'
06-05 23:00:56.285 I/InstrumentationBackend(13335): Added:'GetActivityName', with key:'get_activity_name'
06-05 23:00:56.285 I/InstrumentationBackend(13335): Added:'ScrollToView', with key:'scroll_to_view'
06-05 23:00:56.285 I/InstrumentationBackend(13335): Added:'ViewConfiguration', with key:'view_configuration'
06-05 23:00:56.285 I/InstrumentationBackend(13335): Added:'IsCurrentActivityFocused', with key:'is_current_activity_focused'
06-05 23:00:56.285 I/InstrumentationBackend(13335): Added:'SendTcp', with key:'send_tcp'
06-05 23:00:56.285 I/InstrumentationBackend(13335): Added:'DpToDevicePixel', with key:'dp_to_device_pixel'
06-05 23:00:56.285 I/InstrumentationBackend(13335): Added:'KeyboardEnterText', with key:'keyboard_enter_text'
06-05 23:00:56.285 I/InstrumentationBackend(13335): Added:'DeleteSurroundingText', with key:'delete_surrounding_text'
06-05 23:00:56.285 I/InstrumentationBackend(13335): Added:'SetComposingRegion', with key:'set_composing_region'
06-05 23:00:56.285 I/WindowManager( 1631): WIN DEATH: Window{a39ec14 u0 Toast}
06-05 23:00:56.285 W/InputDispatcher( 1631): Attempted to unregister already unregistered input channel 'a39ec14 Toast (server)'
06-05 23:00:56.287 I/InstrumentationBackend(13335): Added:'SetSelection', with key:'set_selection'
06-05 23:00:56.287 I/InstrumentationBackend(13335): Added:'KeyboardKeyEvent', with key:'keyboard_key_event'
06-05 23:00:56.287 I/InstrumentationBackend(13335): Added:'PressUserActionButton', with key:'press_user_action_button'
06-05 23:00:56.287 I/InstrumentationBackend(13335): Added:'HideSoftKeyboard', with key:'hide_soft_keyboard'
06-05 23:00:56.287 I/InstrumentationBackend(13335): Added:'ListActions', with key:'list_actions'
06-05 23:00:56.287 I/calabash(13335): Instantiating http server at 7102
06-05 23:00:56.288 I/System.out(13335): HTTP Daemon listening on: 7102
06-05 23:00:56.297 D/EGL_emulation( 1712): eglMakeCurrent: 0xb0685360: ver 2 0 (tinfo 0xb06836c0)
06-05 23:00:56.300 D/EGL_emulation( 1712): eglMakeCurrent: 0xb0685360: ver 2 0 (tinfo 0xb06836c0)
06-05 23:00:56.302 D/EGL_emulation( 1712): eglMakeCurrent: 0xb0685360: ver 2 0 (tinfo 0xb06836c0)
06-05 23:00:56.304 D/EGL_emulation( 1712): eglMakeCurrent: 0xb0685360: ver 2 0 (tinfo 0xb06836c0)
06-05 23:00:56.371 I/System.out(13335): URI: //ping
06-05 23:00:56.371 I/System.out(13335): params: {json={}
06-05 23:00:56.371 I/System.out(13335): }
06-05 23:00:56.374 I/System.out(13335): URI: //ping
06-05 23:00:56.374 I/System.out(13335): params: {json={}
06-05 23:00:56.374 I/System.out(13335): }
06-05 23:00:56.375 I/System.out(13335): URI: //ready
06-05 23:00:56.375 I/System.out(13335): params: {json={}
06-05 23:00:56.375 I/System.out(13335): }
06-05 23:00:56.377 I/System.out(13335): URI: //
06-05 23:00:56.377 I/System.out(13335): params: {json={"command":"version","arguments":[]}
06-05 23:00:56.377 I/System.out(13335): }
06-05 23:00:56.377 I/System.out(13335): header: {content-type=application/json;charset=utf-8, date=Sat, 06 Jun 2020 04:00:56 GMT, accept=*/*, host=127.0.0.1:34777, content-length=36, user-agent=HTTPClient/1.0 (2.8.3, ruby 2.5.1 (2018-03-29))}
06-05 23:00:56.377 I/System.out(13335): params: {json={"command":"version","arguments":[]}
06-05 23:00:56.377 I/System.out(13335): }
06-05 23:00:56.377 I/System.out(13335): ProP json = {"command":"version","arguments":[]}
06-05 23:00:56.377 I/System.out(13335): files: {}
06-05 23:00:56.377 I/System.out(13335): command: {"command":"version","arguments":[]}
06-05 23:00:56.380 I/InstrumentationBackend(13335): Got command:'Command:'Line:null,version', arguments:'[]'
06-05 23:00:56.387 I/System.out(13335): result:{"bonusInformation":[],"message":"0.9.8","success":true}
06-05 23:00:56.389 I/System.out(13335): URI: //start-application
06-05 23:00:56.389 I/System.out(13335): params: {json={"intent":null}
06-05 23:00:56.389 I/System.out(13335): }
06-05 23:00:56.397 I/ActivityManager( 1631): START u0 {act=android.intent.action.MAIN cat=[android.intent.category.LAUNCHER] flg=0x10200000 cmp=com.evancharlton.mileage/.Mileage} from uid 10326 on display 0
06-05 23:00:56.403 I/calabash(13335): newActivity1
06-05 23:00:56.411 I/calabash(13335): newActivity1
06-05 23:00:56.412 W/ActivityManager( 1631): Bad activity token: android.os.BinderProxy@aa1fa4f
06-05 23:00:56.412 W/ActivityManager( 1631): java.lang.ClassCastException: android.os.BinderProxy cannot be cast to com.android.server.am.ActivityRecord$Token
06-05 23:00:56.412 W/ActivityManager( 1631): 	at com.android.server.am.ActivityRecord.forTokenLocked(ActivityRecord.java:586)
06-05 23:00:56.412 W/ActivityManager( 1631): 	at com.android.server.am.ActivityRecord.isInStackLocked(ActivityRecord.java:1327)
06-05 23:00:56.412 W/ActivityManager( 1631): 	at com.android.server.am.ActivityRecord.getStackLocked(ActivityRecord.java:1332)
06-05 23:00:56.412 W/ActivityManager( 1631): 	at com.android.server.am.ActivityManagerService.getActivityDisplayId(ActivityManagerService.java:9806)
06-05 23:00:56.412 W/ActivityManager( 1631): 	at android.app.ActivityManagerNative.onTransact(ActivityManagerNative.java:2566)
06-05 23:00:56.412 W/ActivityManager( 1631): 	at com.android.server.am.ActivityManagerService.onTransact(ActivityManagerService.java:2757)
06-05 23:00:56.412 W/ActivityManager( 1631): 	at android.os.Binder.execTransact(Binder.java:565)
06-05 23:00:56.413 W/ActivityManager( 1631): Bad activity token: android.os.BinderProxy@aa1fa4f
06-05 23:00:56.413 W/ActivityManager( 1631): java.lang.ClassCastException: android.os.BinderProxy cannot be cast to com.android.server.am.ActivityRecord$Token
06-05 23:00:56.413 W/ActivityManager( 1631): 	at com.android.server.am.ActivityRecord.forTokenLocked(ActivityRecord.java:586)
06-05 23:00:56.413 W/ActivityManager( 1631): 	at com.android.server.am.ActivityRecord.isInStackLocked(ActivityRecord.java:1327)
06-05 23:00:56.413 W/ActivityManager( 1631): 	at com.android.server.am.ActivityManagerService.setTaskDescription(ActivityManagerService.java:9358)
06-05 23:00:56.413 W/ActivityManager( 1631): 	at android.app.ActivityManagerNative.onTransact(ActivityManagerNative.java:2639)
06-05 23:00:56.413 W/ActivityManager( 1631): 	at com.android.server.am.ActivityManagerService.onTransact(ActivityManagerService.java:2757)
06-05 23:00:56.413 W/ActivityManager( 1631): 	at android.os.Binder.execTransact(Binder.java:565)
06-05 23:00:56.413 W/ActivityManager( 1631): Bad activity token: android.os.BinderProxy@aa1fa4f
06-05 23:00:56.413 W/ActivityManager( 1631): java.lang.ClassCastException: android.os.BinderProxy cannot be cast to com.android.server.am.ActivityRecord$Token
06-05 23:00:56.413 W/ActivityManager( 1631): 	at com.android.server.am.ActivityRecord.forTokenLocked(ActivityRecord.java:586)
06-05 23:00:56.413 W/ActivityManager( 1631): 	at com.android.server.am.ActivityRecord.isInStackLocked(ActivityRecord.java:1327)
06-05 23:00:56.413 W/ActivityManager( 1631): 	at com.android.server.am.ActivityRecord.getStackLocked(ActivityRecord.java:1332)
06-05 23:00:56.413 W/ActivityManager( 1631): 	at com.android.server.am.ActivityManagerService.getActivityStackId(ActivityManagerService.java:9817)
06-05 23:00:56.413 W/ActivityManager( 1631): 	at android.app.ActivityManagerNative.onTransact(ActivityManagerNative.java:2856)
06-05 23:00:56.413 W/ActivityManager( 1631): 	at com.android.server.am.ActivityManagerService.onTransact(ActivityManagerService.java:2757)
06-05 23:00:56.413 W/ActivityManager( 1631): 	at android.os.Binder.execTransact(Binder.java:565)
06-05 23:00:56.417 D/gralloc_ranchu( 1347): gralloc_alloc: Creating ashmem region of size 9023488
06-05 23:00:56.435 W/ActivityManager( 1631): Bad activity token: android.os.BinderProxy@aa1fa4f
06-05 23:00:56.435 W/ActivityManager( 1631): java.lang.ClassCastException: android.os.BinderProxy cannot be cast to com.android.server.am.ActivityRecord$Token
06-05 23:00:56.435 W/ActivityManager( 1631): 	at com.android.server.am.ActivityRecord.forTokenLocked(ActivityRecord.java:586)
06-05 23:00:56.435 W/ActivityManager( 1631): 	at com.android.server.am.ActivityRecord.isInStackLocked(ActivityRecord.java:1327)
06-05 23:00:56.435 W/ActivityManager( 1631): 	at com.android.server.am.ActivityManagerService.getActivityOptions(ActivityManagerService.java:12559)
06-05 23:00:56.435 W/ActivityManager( 1631): 	at android.app.ActivityManagerNative.onTransact(ActivityManagerNative.java:1933)
06-05 23:00:56.435 W/ActivityManager( 1631): 	at com.android.server.am.ActivityManagerService.onTransact(ActivityManagerService.java:2757)
06-05 23:00:56.435 W/ActivityManager( 1631): 	at android.os.Binder.execTransact(Binder.java:565)
06-05 23:00:56.435 W/ActivityManager( 1631): Bad activity token: android.os.BinderProxy@aa1fa4f
06-05 23:00:56.435 W/ActivityManager( 1631): java.lang.ClassCastException: android.os.BinderProxy cannot be cast to com.android.server.am.ActivityRecord$Token
06-05 23:00:56.435 W/ActivityManager( 1631): 	at com.android.server.am.ActivityRecord.forTokenLocked(ActivityRecord.java:586)
06-05 23:00:56.435 W/ActivityManager( 1631): 	at com.android.server.am.ActivityRecord.isInStackLocked(ActivityRecord.java:1327)
06-05 23:00:56.435 W/ActivityManager( 1631): 	at com.android.server.am.ActivityManagerService.getActivityOptions(ActivityManagerService.java:12559)
06-05 23:00:56.435 W/ActivityManager( 1631): 	at android.app.ActivityManagerNative.onTransact(ActivityManagerNative.java:1933)
06-05 23:00:56.435 W/ActivityManager( 1631): 	at com.android.server.am.ActivityManagerService.onTransact(ActivityManagerService.java:2757)
06-05 23:00:56.435 W/ActivityManager( 1631): 	at android.os.Binder.execTransact(Binder.java:565)
06-05 23:00:56.455 V/PhoneStatusBar( 1712): setLightsOn(true)
06-05 23:00:56.466 D/gralloc_ranchu( 1347): gralloc_alloc: Creating ashmem region of size 9023488
06-05 23:00:56.471 D/EGL_emulation( 2076): eglMakeCurrent: 0xb0685360: ver 2 0 (tinfo 0xb06836b0)
06-05 23:00:56.472 D/        (13335): HostConnection::get() New Host Connection established 0x941a00c0, tid 13335
06-05 23:00:56.473 D/EGL_emulation( 1712): eglMakeCurrent: 0xb0685360: ver 2 0 (tinfo 0xb06836c0)
06-05 23:00:56.509 I/WindowManager( 1631): Destroying surface Surface(name=com.evancharlton.mileage/com.evancharlton.mileage.Mileage) called by com.android.server.wm.WindowStateAnimator.destroySurface:2016 com.android.server.wm.WindowStateAnimator.destroySurfaceLocked:882 com.android.server.wm.WindowState.removeLocked:1456 com.android.server.wm.WindowManagerService.removeWindowInnerLocked:2484 com.android.server.wm.AppWindowToken.destroySurfaces:365 com.android.server.wm.WindowStateAnimator.finishExit:565 com.android.server.wm.AppWindowAnimator.stepAnimationLocked:427 com.android.server.wm.WindowAnimator.updateAppWindowsLocked:196 
06-05 23:00:56.509 D/EGL_emulation( 1712): eglMakeCurrent: 0xb0685360: ver 2 0 (tinfo 0xb06836c0)
06-05 23:00:56.512 D/EGL_emulation( 1712): eglMakeCurrent: 0xb0685360: ver 2 0 (tinfo 0xb06836c0)
06-05 23:00:56.513 D/EGL_emulation( 1712): eglMakeCurrent: 0xb0685360: ver 2 0 (tinfo 0xb06836c0)
06-05 23:00:56.523 D/EGL_emulation( 1712): eglMakeCurrent: 0xb0685360: ver 2 0 (tinfo 0xb06836c0)
06-05 23:00:56.526 V/PhoneStatusBar( 1712): setLightsOn(true)
06-05 23:00:56.527 D/EGL_emulation( 1712): eglMakeCurrent: 0xb0685360: ver 2 0 (tinfo 0xb06836c0)
06-05 23:00:56.534 D/EGL_emulation( 1712): eglMakeCurrent: 0xb0685360: ver 2 0 (tinfo 0xb06836c0)
06-05 23:00:56.535 D/EGL_emulation( 1712): eglMakeCurrent: 0xb0685360: ver 2 0 (tinfo 0xb06836c0)
06-05 23:00:56.551 D/EGL_emulation( 1712): eglMakeCurrent: 0xb0685360: ver 2 0 (tinfo 0xb06836c0)
06-05 23:00:56.552 D/gralloc_ranchu( 1347): gralloc_alloc: Creating ashmem region of size 9023488
06-05 23:00:56.562 D/EGL_emulation( 1712): eglMakeCurrent: 0xb0685360: ver 2 0 (tinfo 0xb06836c0)
06-05 23:00:56.577 D/EGL_emulation( 1712): eglMakeCurrent: 0xb0685360: ver 2 0 (tinfo 0xb06836c0)
06-05 23:00:56.577 I/ActivityManager( 1631): Displayed com.evancharlton.mileage/.Mileage: +176ms
06-05 23:00:56.578 D/EGL_emulation( 1712): eglMakeCurrent: 0xb0685360: ver 2 0 (tinfo 0xb06836c0)
06-05 23:00:56.591 D/EGL_emulation( 1712): eglMakeCurrent: 0xb0685360: ver 2 0 (tinfo 0xb06836c0)
06-05 23:00:56.594 D/EGL_emulation( 1712): eglMakeCurrent: 0xb0685360: ver 2 0 (tinfo 0xb06836c0)
06-05 23:00:56.601 D/EGL_emulation( 1712): eglMakeCurrent: 0xb0685360: ver 2 0 (tinfo 0xb06836c0)
06-05 23:00:56.603 D/EGL_emulation( 1712): eglMakeCurrent: 0xb0685360: ver 2 0 (tinfo 0xb06836c0)
06-05 23:00:56.617 D/EGL_emulation( 1712): eglMakeCurrent: 0xb0685360: ver 2 0 (tinfo 0xb06836c0)
06-05 23:00:56.617 V/PhoneStatusBar( 1712): setLightsOn(true)
06-05 23:00:56.619 D/EGL_emulation( 1712): eglMakeCurrent: 0xb0685360: ver 2 0 (tinfo 0xb06836c0)
06-05 23:00:56.625 I/System.out(13335): URI: //map
06-05 23:00:56.625 I/System.out(13335): params: {json={"query":"* marked:'Statistics'","operation":{"method_name":"query","arguments":[]}}
06-05 23:00:56.625 I/System.out(13335): }
06-05 23:00:56.634 D/EGL_emulation( 1712): eglMakeCurrent: 0xb0685360: ver 2 0 (tinfo 0xb06836c0)
06-05 23:00:56.636 D/EGL_emulation( 1712): eglMakeCurrent: 0xb0685360: ver 2 0 (tinfo 0xb06836c0)
06-05 23:00:56.642 W/ResourceType(13335): No package identifier when getting name for resource number 0x00000001
06-05 23:00:56.650 D/EGL_emulation( 1712): eglMakeCurrent: 0xb0685360: ver 2 0 (tinfo 0xb06836c0)
06-05 23:00:56.652 D/EGL_emulation( 1712): eglMakeCurrent: 0xb0685360: ver 2 0 (tinfo 0xb06836c0)
06-05 23:00:56.660 I/System.out(13335): URI: //gesture
06-05 23:00:56.660 I/System.out(13335): params: {json={"query_timeout":5.0,"gestures":[{"query_string":"* marked:'Statistics'","touches":[{"x":50,"y":50,"offset_x":0,"offset_y":0,"wait":0.0,"time":0.2,"release":true,"query_string":null}]}]}
06-05 23:00:56.660 I/System.out(13335): }
06-05 23:00:56.666 W/ResourceType(13335): No package identifier when getting name for resource number 0x00000001
06-05 23:00:56.668 D/EGL_emulation( 1712): eglMakeCurrent: 0xb0685360: ver 2 0 (tinfo 0xb06836c0)
06-05 23:00:56.670 D/EGL_emulation( 1712): eglMakeCurrent: 0xb0685360: ver 2 0 (tinfo 0xb06836c0)
06-05 23:00:56.684 D/EGL_emulation( 1712): eglMakeCurrent: 0xb0685360: ver 2 0 (tinfo 0xb06836c0)
06-05 23:00:56.698 D/EGL_emulation( 1712): eglMakeCurrent: 0xb0685360: ver 2 0 (tinfo 0xb06836c0)
06-05 23:00:56.750 V/PhoneStatusBar( 1712): setLightsOn(true)
06-05 23:00:56.767 I/WindowManager( 1631): Destroying surface Surface(name=Starting com.evancharlton.mileage) called by com.android.server.wm.WindowStateAnimator.destroySurface:2016 com.android.server.wm.WindowStateAnimator.destroySurfaceLocked:882 com.android.server.wm.WindowState.destroyOrSaveSurface:2100 com.android.server.wm.AppWindowToken.destroySurfaces:363 com.android.server.wm.WindowStateAnimator.finishExit:565 com.android.server.wm.WindowStateAnimator.stepAnimationLocked:491 com.android.server.wm.WindowAnimator.updateWindowsLocked:303 com.android.server.wm.WindowAnimator.animateLocked:704 
06-05 23:00:56.769 V/PhoneStatusBar( 1712): setLightsOn(true)
06-05 23:00:56.800 V/PhoneStatusBar( 1712): setLightsOn(true)
06-05 23:00:56.833 V/PhoneStatusBar( 1712): setLightsOn(true)
06-05 23:00:56.834 I/WindowManager( 1631): Destroying surface Surface(name=Toast) called by com.android.server.wm.WindowStateAnimator.destroySurface:2016 com.android.server.wm.WindowStateAnimator.destroySurfaceLocked:882 com.android.server.wm.WindowState.destroyOrSaveSurface:2100 com.android.server.wm.WindowSurfacePlacer.performSurfacePlacementInner:429 com.android.server.wm.WindowSurfacePlacer.performSurfacePlacementLoop:232 com.android.server.wm.WindowSurfacePlacer.performSurfacePlacement:180 com.android.server.wm.WindowManagerService$H.handleMessage:8086 android.os.Handler.dispatchMessage:102 
06-05 23:00:56.835 V/PhoneStatusBar( 1712): setLightsOn(true)
06-05 23:00:56.906 I/calabash(13335): newActivity1
06-05 23:00:56.935 V/PhoneStatusBar( 1712): setLightsOn(true)
06-05 23:00:56.942 I/System.out(13335): URI: //map
06-05 23:00:56.942 I/System.out(13335): params: {json={"query":"android.widget.ScrollView index:0","operation":{"method_name":"query","arguments":[]}}
06-05 23:00:56.942 I/System.out(13335): }
06-05 23:00:56.951 W/ActivityManager( 1631): Bad activity token: android.os.BinderProxy@dcc2fd1
06-05 23:00:56.951 W/ActivityManager( 1631): java.lang.ClassCastException: android.os.BinderProxy cannot be cast to com.android.server.am.ActivityRecord$Token
06-05 23:00:56.951 W/ActivityManager( 1631): 	at com.android.server.am.ActivityRecord.forTokenLocked(ActivityRecord.java:586)
06-05 23:00:56.951 W/ActivityManager( 1631): 	at com.android.server.am.ActivityRecord.isInStackLocked(ActivityRecord.java:1327)
06-05 23:00:56.951 W/ActivityManager( 1631): 	at com.android.server.am.ActivityRecord.getStackLocked(ActivityRecord.java:1332)
06-05 23:00:56.951 W/ActivityManager( 1631): 	at com.android.server.am.ActivityManagerService.getActivityDisplayId(ActivityManagerService.java:9806)
06-05 23:00:56.951 W/ActivityManager( 1631): 	at android.app.ActivityManagerNative.onTransact(ActivityManagerNative.java:2566)
06-05 23:00:56.951 W/ActivityManager( 1631): 	at com.android.server.am.ActivityManagerService.onTransact(ActivityManagerService.java:2757)
06-05 23:00:56.951 W/ActivityManager( 1631): 	at android.os.Binder.execTransact(Binder.java:565)
06-05 23:00:56.954 W/ActivityManager( 1631): Bad activity token: android.os.BinderProxy@dcc2fd1
06-05 23:00:56.954 W/ActivityManager( 1631): java.lang.ClassCastException: android.os.BinderProxy cannot be cast to com.android.server.am.ActivityRecord$Token
06-05 23:00:56.954 W/ActivityManager( 1631): 	at com.android.server.am.ActivityRecord.forTokenLocked(ActivityRecord.java:586)
06-05 23:00:56.954 W/ActivityManager( 1631): 	at com.android.server.am.ActivityRecord.isInStackLocked(ActivityRecord.java:1327)
06-05 23:00:56.954 W/ActivityManager( 1631): 	at com.android.server.am.ActivityManagerService.setTaskDescription(ActivityManagerService.java:9358)
06-05 23:00:56.954 W/ActivityManager( 1631): 	at android.app.ActivityManagerNative.onTransact(ActivityManagerNative.java:2639)
06-05 23:00:56.954 W/ActivityManager( 1631): 	at com.android.server.am.ActivityManagerService.onTransact(ActivityManagerService.java:2757)
06-05 23:00:56.954 W/ActivityManager( 1631): 	at android.os.Binder.execTransact(Binder.java:565)
06-05 23:00:56.955 W/ActivityManager( 1631): Bad activity token: android.os.BinderProxy@dcc2fd1
06-05 23:00:56.955 W/ActivityManager( 1631): java.lang.ClassCastException: android.os.BinderProxy cannot be cast to com.android.server.am.ActivityRecord$Token
06-05 23:00:56.955 W/ActivityManager( 1631): 	at com.android.server.am.ActivityRecord.forTokenLocked(ActivityRecord.java:586)
06-05 23:00:56.955 W/ActivityManager( 1631): 	at com.android.server.am.ActivityRecord.isInStackLocked(ActivityRecord.java:1327)
06-05 23:00:56.955 W/ActivityManager( 1631): 	at com.android.server.am.ActivityRecord.getStackLocked(ActivityRecord.java:1332)
06-05 23:00:56.955 W/ActivityManager( 1631): 	at com.android.server.am.ActivityManagerService.getActivityStackId(ActivityManagerService.java:9817)
06-05 23:00:56.955 W/ActivityManager( 1631): 	at android.app.ActivityManagerNative.onTransact(ActivityManagerNative.java:2856)
06-05 23:00:56.955 W/ActivityManager( 1631): 	at com.android.server.am.ActivityManagerService.onTransact(ActivityManagerService.java:2757)
06-05 23:00:56.955 W/ActivityManager( 1631): 	at android.os.Binder.execTransact(Binder.java:565)
06-05 23:00:56.973 D/VehicleStatisticsActivity(13335): Checking recalculation ...
06-05 23:00:56.975 D/VehicleStatisticsActivity(13335): Recalculation not necessary.
06-05 23:00:56.985 W/ActivityManager( 1631): Bad activity token: android.os.BinderProxy@dcc2fd1
06-05 23:00:56.985 W/ActivityManager( 1631): java.lang.ClassCastException: android.os.BinderProxy cannot be cast to com.android.server.am.ActivityRecord$Token
06-05 23:00:56.985 W/ActivityManager( 1631): 	at com.android.server.am.ActivityRecord.forTokenLocked(ActivityRecord.java:586)
06-05 23:00:56.985 W/ActivityManager( 1631): 	at com.android.server.am.ActivityRecord.isInStackLocked(ActivityRecord.java:1327)
06-05 23:00:56.985 W/ActivityManager( 1631): 	at com.android.server.am.ActivityManagerService.getActivityOptions(ActivityManagerService.java:12559)
06-05 23:00:56.985 W/ActivityManager( 1631): 	at android.app.ActivityManagerNative.onTransact(ActivityManagerNative.java:1933)
06-05 23:00:56.985 W/ActivityManager( 1631): 	at com.android.server.am.ActivityManagerService.onTransact(ActivityManagerService.java:2757)
06-05 23:00:56.985 W/ActivityManager( 1631): 	at android.os.Binder.execTransact(Binder.java:565)
06-05 23:00:56.986 W/ActivityManager( 1631): Bad activity token: android.os.BinderProxy@dcc2fd1
06-05 23:00:56.986 W/ActivityManager( 1631): java.lang.ClassCastException: android.os.BinderProxy cannot be cast to com.android.server.am.ActivityRecord$Token
06-05 23:00:56.986 W/ActivityManager( 1631): 	at com.android.server.am.ActivityRecord.forTokenLocked(ActivityRecord.java:586)
06-05 23:00:56.986 W/ActivityManager( 1631): 	at com.android.server.am.ActivityRecord.isInStackLocked(ActivityRecord.java:1327)
06-05 23:00:56.986 W/ActivityManager( 1631): 	at com.android.server.am.ActivityManagerService.getActivityOptions(ActivityManagerService.java:12559)
06-05 23:00:56.986 W/ActivityManager( 1631): 	at android.app.ActivityManagerNative.onTransact(ActivityManagerNative.java:1933)
06-05 23:00:56.986 W/ActivityManager( 1631): 	at com.android.server.am.ActivityManagerService.onTransact(ActivityManagerService.java:2757)
06-05 23:00:56.986 W/ActivityManager( 1631): 	at android.os.Binder.execTransact(Binder.java:565)
06-05 23:00:56.990 D/VehicleStatisticsActivity(13335): Checking recalculation ...
06-05 23:00:56.992 D/VehicleStatisticsActivity(13335): Recalculation not necessary.
06-05 23:00:57.091 I/System.out(13335): URI: //map
06-05 23:00:57.091 I/System.out(13335): params: {json={"query":"android.widget.AbsListView index:0","operation":{"method_name":"query","arguments":[]}}
06-05 23:00:57.091 I/System.out(13335): }
06-05 23:00:57.098 I/art     (13335): Do partial code cache collection, code=30KB, data=29KB
06-05 23:00:57.098 I/art     (13335): After code cache collection, code=29KB, data=28KB
06-05 23:00:57.098 I/art     (13335): Increasing code cache capacity to 128KB
06-05 23:00:57.112 I/System.out(13335): URI: //map
06-05 23:00:57.113 I/System.out(13335): params: {json={"query":"android.widget.AbsListView index:0","operation":{"method_name":"query","arguments":[]}}
06-05 23:00:57.113 I/System.out(13335): }
06-05 23:00:57.136 I/System.out(13335): URI: //map
06-05 23:00:57.136 I/System.out(13335): params: {json={"query":"android.widget.AbsListView index:0","operation":{"method_name":"query","arguments":[]}}
06-05 23:00:57.136 I/System.out(13335): }
06-05 23:00:57.156 I/System.out(13335): URI: //map
06-05 23:00:57.157 I/System.out(13335): params: {json={"query":"android.widget.AbsListView index:0","operation":{"method_name":"query","arguments":["getFirstVisiblePosition"]}}
06-05 23:00:57.157 I/System.out(13335): }
06-05 23:00:57.175 I/System.out(13335): URI: //map
06-05 23:00:57.175 I/System.out(13335): params: {json={"query":"android.widget.AbsListView index:0","operation":{"method_name":"query","arguments":["getLastVisiblePosition"]}}
06-05 23:00:57.175 I/System.out(13335): }
06-05 23:00:57.191 I/System.out(13335): URI: //map
06-05 23:00:57.191 I/System.out(13335): params: {json={"query":"android.widget.AbsListView index:0","operation":{"method_name":"query","arguments":[{"method_name":"setSelection","arguments":[26]}]}}
06-05 23:00:57.191 I/System.out(13335): }
06-05 23:00:57.217 V/PhoneStatusBar( 1712): setLightsOn(true)
06-05 23:00:57.218 V/PhoneStatusBar( 1712): setLightsOn(true)
06-05 23:00:57.218 I/System.out(13335): URI: //map
06-05 23:00:57.218 I/System.out(13335): params: {json={"query":"* marked:'Average price'","operation":{"method_name":"query","arguments":[]}}
06-05 23:00:57.218 I/System.out(13335): }
06-05 23:00:57.222 W/OpenGLRenderer( 2076): Incorrectly called buildLayer on View: ShortcutAndWidgetContainer, destroying layer...
06-05 23:00:57.234 V/PhoneStatusBar( 1712): setLightsOn(true)
06-05 23:00:57.234 I/WindowManager( 1631): Destroying surface Surface(name=com.android.launcher3/com.android.launcher3.Launcher) called by com.android.server.wm.WindowStateAnimator.destroySurface:2016 com.android.server.wm.WindowStateAnimator.destroySurfaceLocked:882 com.android.server.wm.WindowState.destroyOrSaveSurface:2100 com.android.server.wm.AppWindowToken.destroySurfaces:363 com.android.server.wm.AppWindowToken.notifyAppStopped:389 com.android.server.wm.WindowManagerService.notifyAppStopped:4463 com.android.server.am.ActivityStack.activityStoppedLocked:1252 com.android.server.am.ActivityManagerService.activityStopped:6903 
06-05 23:00:57.265 D/gralloc_ranchu( 1347): gralloc_alloc: Creating ashmem region of size 9023488
06-05 23:00:57.303 W/ResourceType(13335): No package identifier when getting name for resource number 0x00000001
06-05 23:00:57.317 I/System.out(13335): URI: //gesture
06-05 23:00:57.317 I/System.out(13335): params: {json={"query_timeout":5.0,"gestures":[{"query_string":"* marked:'Average price'","touches":[{"x":50,"y":50,"offset_x":0,"offset_y":0,"wait":0.0,"time":0.2,"release":true,"query_string":null}]}]}
06-05 23:00:57.317 I/System.out(13335): }
06-05 23:00:57.322 W/ResourceType(13335): No package identifier when getting name for resource number 0x00000001
06-05 23:00:57.552 I/ActivityManager( 1631): START u0 {cmp=com.evancharlton.mileage/.charts.AveragePriceChart (has extras)} from uid 10326 on display 0
06-05 23:00:57.556 V/PhoneStatusBar( 1712): setLightsOn(true)
06-05 23:00:57.558 V/PhoneStatusBar( 1712): setLightsOn(true)
06-05 23:00:57.585 I/System.out(13335): URI: //map
06-05 23:00:57.585 I/System.out(13335): params: {json={"query":"* {text CONTAINS[c] 'Average fuel price'}","operation":{"method_name":"query","arguments":[]}}
06-05 23:00:57.585 I/System.out(13335): }
06-05 23:00:57.637 I/calabash(13335): newActivity1
06-05 23:00:57.645 W/aiCharts(13335): License file is invalid or missing. 
06-05 23:00:57.645 W/aiCharts(13335): Please place proper license.lic to /assets folder.
06-05 23:00:57.674 V/PhoneStatusBar( 1712): setLightsOn(true)
06-05 23:00:57.700 V/PhoneStatusBar( 1712): setLightsOn(true)
06-05 23:00:57.717 V/PhoneStatusBar( 1712): setLightsOn(true)
06-05 23:00:57.734 I/WindowManager( 1631): Destroying surface Surface(name=Creating chart…) called by com.android.server.wm.WindowStateAnimator.destroySurface:2016 com.android.server.wm.WindowStateAnimator.destroySurfaceLocked:882 com.android.server.wm.WindowState.removeLocked:1456 com.android.server.wm.WindowManagerService.removeWindowInnerLocked:2484 com.android.server.wm.WindowManagerService.removeWindowLocked:2442 com.android.server.wm.WindowManagerService.removeWindowLocked:2311 com.android.server.wm.WindowManagerService.removeWindow:2306 com.android.server.wm.Session.remove:202 
06-05 23:00:57.737 D/gralloc_ranchu( 1347): gralloc_alloc: Creating ashmem region of size 9023488
06-05 23:00:57.743 W/NotificationService( 1631): Object died trying to hide notification android.app.ITransientNotification$Stub$Proxy@4b97628 in package com.evancharlton.mileage
06-05 23:00:57.750 V/PhoneStatusBar( 1712): setLightsOn(true)
06-05 23:00:57.758 I/ActivityManager( 1631): Displayed com.evancharlton.mileage/.charts.AveragePriceChart: +127ms
06-05 23:00:57.767 V/PhoneStatusBar( 1712): setLightsOn(true)
06-05 23:00:57.800 V/PhoneStatusBar( 1712): setLightsOn(true)
06-05 23:00:57.816 V/PhoneStatusBar( 1712): setLightsOn(true)
06-05 23:00:57.989 I/System.out(13335): URI: //map
06-05 23:00:57.989 I/System.out(13335): params: {json={"query":"* {text CONTAINS[c] 'Average fuel price'}","operation":{"method_name":"query","arguments":[]}}
06-05 23:00:57.989 I/System.out(13335): }
06-05 23:00:58.000 V/PhoneStatusBar( 1712): setLightsOn(true)
06-05 23:00:58.005 I/System.out(13335): URI: //
06-05 23:00:58.005 I/System.out(13335): params: {json={"command":"press_key","arguments":["KEYCODE_BACK"]}
06-05 23:00:58.005 I/System.out(13335): }
06-05 23:00:58.005 I/System.out(13335): header: {content-type=application/json;charset=utf-8, date=Sat, 06 Jun 2020 04:00:58 GMT, accept=*/*, host=127.0.0.1:34777, content-length=52, user-agent=HTTPClient/1.0 (2.8.3, ruby 2.5.1 (2018-03-29))}
06-05 23:00:58.005 I/System.out(13335): params: {json={"command":"press_key","arguments":["KEYCODE_BACK"]}
06-05 23:00:58.005 I/System.out(13335): }
06-05 23:00:58.005 I/System.out(13335): ProP json = {"command":"press_key","arguments":["KEYCODE_BACK"]}
06-05 23:00:58.005 I/System.out(13335): files: {}
06-05 23:00:58.005 I/System.out(13335): command: {"command":"press_key","arguments":["KEYCODE_BACK"]}
06-05 23:00:58.006 I/InstrumentationBackend(13335): Got command:'Command:'Line:null,press_key', arguments:'[KEYCODE_BACK]'
06-05 23:00:58.008 V/PhoneStatusBar( 1712): setLightsOn(true)
06-05 23:00:58.010 V/PhoneStatusBar( 1712): setLightsOn(true)
06-05 23:00:58.012 D/VehicleStatisticsActivity(13335): Checking recalculation ...
06-05 23:00:58.013 D/VehicleStatisticsActivity(13335): Recalculation not necessary.
06-05 23:00:58.013 I/art     (13335): Do partial code cache collection, code=60KB, data=62KB
06-05 23:00:58.013 I/art     (13335): After code cache collection, code=60KB, data=62KB
06-05 23:00:58.013 I/art     (13335): Increasing code cache capacity to 256KB
06-05 23:00:58.013 I/System.out(13335): result:{"bonusInformation":[],"message":"","success":true}
06-05 23:00:58.016 I/System.out(13335): URI: //map
06-05 23:00:58.016 I/System.out(13335): params: {json={"query":"* {text CONTAINS[c] 'Statistics'}","operation":{"method_name":"query","arguments":[]}}
06-05 23:00:58.016 I/System.out(13335): }
06-05 23:00:58.017 V/PhoneStatusBar( 1712): setLightsOn(true)
06-05 23:00:58.033 D/gralloc_ranchu( 1347): gralloc_alloc: Creating ashmem region of size 9023488
06-05 23:00:58.034 V/PhoneStatusBar( 1712): setLightsOn(true)
06-05 23:00:58.083 V/PhoneStatusBar( 1712): setLightsOn(true)
