--------- beginning of system
06-05 18:18:27.796 W/ActivityManager( 1630): Finishing task with all activities already finished
06-05 18:18:27.796 W/ActivityManager( 1630): Duplicate finish request for ActivityRecord{10870f7 u0 com.evancharlton.mileage/.Mileage t2746 f}
--------- beginning of main
06-05 18:18:27.809 V/PhoneStatusBar( 1712): setLightsOn(true)
06-05 18:18:27.812 D/gralloc_ranchu( 1346): gralloc_alloc: Creating ashmem region of size 3145728
06-05 18:18:27.818 E/EGL_emulation( 1346): tid 1346: eglCreateSyncKHR(1901): error 0x3004 (EGL_BAD_ATTRIBUTE)
06-05 18:18:27.832 W/ActivityManager( 1630): Finishing task with all activities already finished
06-05 18:18:27.832 W/ActivityManager( 1630): Duplicate finish request for ActivityRecord{10870f7 u0 com.evancharlton.mileage/.Mileage t2746 f}
06-05 18:18:27.833 W/ActivityManager( 1630): Finishing task with all activities already finished
06-05 18:18:27.833 W/ActivityManager( 1630): Duplicate finish request for ActivityRecord{10870f7 u0 com.evancharlton.mileage/.Mileage t2746 f}
06-05 18:18:27.833 W/ActivityManager( 1630): Finishing task with all activities already finished
06-05 18:18:27.833 W/ActivityManager( 1630): Duplicate finish request for ActivityRecord{10870f7 u0 com.evancharlton.mileage/.Mileage t2746 f}
06-05 18:18:27.833 W/ActivityManager( 1630): Finishing task with all activities already finished
06-05 18:18:27.833 W/ActivityManager( 1630): Duplicate finish request for ActivityRecord{10870f7 u0 com.evancharlton.mileage/.Mileage t2746 f}
06-05 18:18:27.833 W/ActivityManager( 1630): Finishing task with all activities already finished
06-05 18:18:27.833 W/ActivityManager( 1630): Duplicate finish request for ActivityRecord{33b6aad u0 com.evancharlton.mileage/.charts.EastChart t2746 f}
06-05 18:18:27.833 W/ActivityManager( 1630): Finishing task with all activities already finished
06-05 18:18:27.833 W/ActivityManager( 1630): Duplicate finish request for ActivityRecord{33b6aad u0 com.evancharlton.mileage/.charts.EastChart t2746 f}
06-05 18:18:27.833 W/ActivityManager( 1630): Finishing task with all activities already finished
06-05 18:18:27.833 W/ActivityManager( 1630): Duplicate finish request for ActivityRecord{10870f7 u0 com.evancharlton.mileage/.Mileage t2746 f}
06-05 18:18:27.833 W/ActivityManager( 1630): Finishing task with all activities already finished
06-05 18:18:27.833 W/ActivityManager( 1630): Duplicate finish request for ActivityRecord{10870f7 u0 com.evancharlton.mileage/.Mileage t2746 f}
06-05 18:18:27.878 D/EGL_emulation( 2099): eglMakeCurrent: 0xb4085240: ver 2 0 (tinfo 0xb40832d0)
06-05 18:18:27.879 D/EGL_emulation( 1712): eglMakeCurrent: 0xb4085540: ver 2 0 (tinfo 0xb4083740)
06-05 18:18:27.893 D/EGL_emulation( 1712): eglMakeCurrent: 0xb4085540: ver 2 0 (tinfo 0xb4083740)
06-05 18:18:27.896 D/AndroidRuntime( 5883): >>>>>> START com.android.internal.os.RuntimeInit uid 2000 <<<<<<
06-05 18:18:27.897 D/AndroidRuntime( 5883): CheckJNI is ON
06-05 18:18:27.911 D/EGL_emulation( 1712): eglMakeCurrent: 0xb4085540: ver 2 0 (tinfo 0xb4083740)
06-05 18:18:27.911 W/art     ( 5883): Unexpected CPU variant for X86 using defaults: x86
06-05 18:18:27.914 D/ICU     ( 5883): No timezone override file found: /data/misc/zoneinfo/current/icu/icu_tzdata.dat
06-05 18:18:27.924 E/memtrack( 5883): Couldn't load memtrack module (No such file or directory)
06-05 18:18:27.924 E/android.os.Debug( 5883): failed to load memtrack module: -2
06-05 18:18:27.925 I/Radio-JNI( 5883): register_android_hardware_Radio DONE
06-05 18:18:27.926 D/EGL_emulation( 1712): eglMakeCurrent: 0xb4085540: ver 2 0 (tinfo 0xb4083740)
06-05 18:18:27.929 D/EGL_emulation( 1712): eglMakeCurrent: 0xb4085540: ver 2 0 (tinfo 0xb4083740)
06-05 18:18:27.930 D/AndroidRuntime( 5883): Calling main entry com.android.commands.am.Am
06-05 18:18:27.931 I/ActivityManager( 1630): Force stopping com.evancharlton.mileage appid=10150 user=0: start instr
06-05 18:18:27.931 I/ActivityManager( 1630): Killing 5830:com.evancharlton.mileage/u0a150 (adj 0): stop com.evancharlton.mileage
06-05 18:18:27.931 D/ActivityManager( 1630): cleanUpApplicationRecord -- 5830
06-05 18:18:27.931 I/WindowManager( 1630): Destroying surface Surface(name=com.evancharlton.mileage/com.evancharlton.mileage.charts.EastChart) called by com.android.server.wm.WindowStateAnimator.destroySurface:2016 com.android.server.wm.WindowStateAnimator.destroySurfaceLocked:882 com.android.server.wm.WindowState.removeLocked:1456 com.android.server.wm.WindowManagerService.removeWindowInnerLocked:2484 com.android.server.wm.WindowManagerService.removeWindowLocked:2442 com.android.server.wm.WindowManagerService.removeWindowLocked:2311 com.android.server.wm.AppWindowToken.removeAllWindows:530 com.android.server.wm.AppWindowToken.removeAppFromTaskLocked:326 
06-05 18:18:27.933 W/ActivityManager( 1630): Crash of app com.evancharlton.mileage running instrumentation ComponentInfo{com.evancharlton.mileage.test/sh.calaba.instrumentationbackend.CalabashInstrumentationTestRunner}
06-05 18:18:27.933 I/ActivityManager( 1630): Force stopping com.evancharlton.mileage appid=10150 user=0: finished inst
06-05 18:18:27.935 I/art     ( 5893): Not late-enabling -Xcheck:jni (already on)
06-05 18:18:27.935 W/art     ( 5893): Unexpected CPU variant for X86 using defaults: x86
06-05 18:18:27.942 D/EGL_emulation( 1712): eglMakeCurrent: 0xb4085540: ver 2 0 (tinfo 0xb4083740)
06-05 18:18:27.943 I/ActivityManager( 1630): Start proc 5893:com.evancharlton.mileage/u0a150 for added application com.evancharlton.mileage
06-05 18:18:27.943 D/AndroidRuntime( 5883): Shutting down VM
06-05 18:18:27.944 D/EGL_emulation( 1712): eglMakeCurrent: 0xb4085540: ver 2 0 (tinfo 0xb4083740)
06-05 18:18:27.948 W/System  ( 5893): ClassLoader referenced unknown path: /data/app/com.evancharlton.mileage.test-1/lib/x86
06-05 18:18:27.949 W/System  ( 5893): ClassLoader referenced unknown path: /data/app/com.evancharlton.mileage-1/lib/x86
06-05 18:18:27.950 W/System  ( 5893): ClassLoader referenced unknown path: 
06-05 18:18:27.954 I/System.out( 5893): Main activity name automatically set to: com.evancharlton.mileage.Mileage
06-05 18:18:27.954 I/System.out( 5893): Calabash did not load Mono. This is only a problem if you are trying to test a Mono application
06-05 18:18:27.954 I/calabash( 5893): Test server port: 7102
06-05 18:18:27.955 I/InstrumentationBackend( 5893): Added:'GetPreferences', with key:'get_preferences'
06-05 18:18:27.959 I/InstrumentationBackend( 5893): Added:'SetPreferences', with key:'set_preferences'
06-05 18:18:27.959 I/InstrumentationBackend( 5893): Added:'ClearPreferences', with key:'clear_preferences'
06-05 18:18:27.959 I/InstrumentationBackend( 5893): Added:'PressElement', with key:'press_l10n_element'
06-05 18:18:27.959 I/InstrumentationBackend( 5893): Added:'WaitForElement', with key:'wait_for_l10n_element'
06-05 18:18:27.959 I/InstrumentationBackend( 5893): Added:'NullAction', with key:'nullAction'
06-05 18:18:27.959 I/InstrumentationBackend( 5893): Added:'PressKey', with key:'press_key'
06-05 18:18:27.959 I/InstrumentationBackend( 5893): Added:'SetActivityOrientation', with key:'set_activity_orientation'
06-05 18:18:27.959 I/InstrumentationBackend( 5893): Added:'GetActivityOrientation', with key:'get_activity_orientation'
06-05 18:18:27.959 I/InstrumentationBackend( 5893): Added:'FakeGPSLocation', with key:'set_gps_coordinates'
06-05 18:18:27.959 I/InstrumentationBackend( 5893): Added:'SetPropertyByCssSelector', with key:'set_property_by_css_selector'
06-05 18:18:27.959 I/InstrumentationBackend( 5893): Added:'GetUrl', with key:'get_url'
06-05 18:18:27.959 D/EGL_emulation( 1712): eglMakeCurrent: 0xb4085540: ver 2 0 (tinfo 0xb4083740)
06-05 18:18:27.959 I/InstrumentationBackend( 5893): Added:'ScrollTo', with key:'scroll_to'
06-05 18:18:27.959 I/InstrumentationBackend( 5893): Added:'GetLoadProgress', with key:'get_load_progress'
06-05 18:18:27.960 I/InstrumentationBackend( 5893): Added:'DumpHtml', with key:'dump_html'
06-05 18:18:27.960 I/InstrumentationBackend( 5893): Added:'DumpBodyHtml', with key:'dump_body_html'
06-05 18:18:27.960 I/InstrumentationBackend( 5893): Added:'EnterTextByCssSelector', with key:'enter_text_by_selector'
06-05 18:18:27.960 I/InstrumentationBackend( 5893): Added:'AndroidSDKVersion', with key:'android_sdk_version'
06-05 18:18:27.960 I/InstrumentationBackend( 5893): Added:'Version', with key:'version'
06-05 18:18:27.960 I/InstrumentationBackend( 5893): Added:'Drag', with key:'drag'
06-05 18:18:27.960 I/InstrumentationBackend( 5893): Added:'TouchCoordinates', with key:'touch_coordinate'
06-05 18:18:27.960 I/InstrumentationBackend( 5893): Added:'LongPressCoordinate', with key:'long_press_coordinate'
06-05 18:18:27.960 I/InstrumentationBackend( 5893): Added:'DragCoordinates', with key:'drag_coordinates'
06-05 18:18:27.960 I/InstrumentationBackend( 5893): Added:'ResumeApplication', with key:'resume_application'
06-05 18:18:27.960 I/InstrumentationBackend( 5893): Added:'Swipe', with key:'swipe'
06-05 18:18:27.960 I/InstrumentationBackend( 5893): Added:'DoubleTapCoordinate', with key:'double_tap_coordinate'
06-05 18:18:27.960 I/InstrumentationBackend( 5893): Added:'ClickOnScreen', with key:'click_on_screen'
06-05 18:18:27.960 I/InstrumentationBackend( 5893): Added:'GetActivityName', with key:'get_activity_name'
06-05 18:18:27.960 I/InstrumentationBackend( 5893): Added:'ScrollToView', with key:'scroll_to_view'
06-05 18:18:27.960 I/InstrumentationBackend( 5893): Added:'ViewConfiguration', with key:'view_configuration'
06-05 18:18:27.960 I/InstrumentationBackend( 5893): Added:'IsCurrentActivityFocused', with key:'is_current_activity_focused'
06-05 18:18:27.960 I/InstrumentationBackend( 5893): Added:'SendTcp', with key:'send_tcp'
06-05 18:18:27.961 I/InstrumentationBackend( 5893): Added:'DpToDevicePixel', with key:'dp_to_device_pixel'
06-05 18:18:27.961 D/EGL_emulation( 1712): eglMakeCurrent: 0xb4085540: ver 2 0 (tinfo 0xb4083740)
06-05 18:18:27.961 I/InstrumentationBackend( 5893): Added:'KeyboardEnterText', with key:'keyboard_enter_text'
06-05 18:18:27.961 I/InstrumentationBackend( 5893): Added:'DeleteSurroundingText', with key:'delete_surrounding_text'
06-05 18:18:27.961 I/InstrumentationBackend( 5893): Added:'SetComposingRegion', with key:'set_composing_region'
06-05 18:18:27.961 I/InstrumentationBackend( 5893): Added:'SetSelection', with key:'set_selection'
06-05 18:18:27.961 I/InstrumentationBackend( 5893): Added:'KeyboardKeyEvent', with key:'keyboard_key_event'
06-05 18:18:27.961 I/InstrumentationBackend( 5893): Added:'PressUserActionButton', with key:'press_user_action_button'
06-05 18:18:27.961 I/InstrumentationBackend( 5893): Added:'HideSoftKeyboard', with key:'hide_soft_keyboard'
06-05 18:18:27.961 I/InstrumentationBackend( 5893): Added:'ListActions', with key:'list_actions'
06-05 18:18:27.961 I/calabash( 5893): Instantiating http server at 7102
06-05 18:18:27.962 I/System.out( 5893): HTTP Daemon listening on: 7102
06-05 18:18:27.976 D/EGL_emulation( 1712): eglMakeCurrent: 0xb4085540: ver 2 0 (tinfo 0xb4083740)
06-05 18:18:27.978 D/EGL_emulation( 1712): eglMakeCurrent: 0xb4085540: ver 2 0 (tinfo 0xb4083740)
06-05 18:18:27.983 W/InputDispatcher( 1630): channel '4b87832 com.evancharlton.mileage/com.evancharlton.mileage.Mileage (server)' ~ Consumer closed input channel or an error occurred.  events=0x9
06-05 18:18:27.983 E/InputDispatcher( 1630): channel '4b87832 com.evancharlton.mileage/com.evancharlton.mileage.Mileage (server)' ~ Channel is unrecoverably broken and will be disposed!
06-05 18:18:27.983 I/WindowManager( 1630): WIN DEATH: Window{4b87832 u0 com.evancharlton.mileage/com.evancharlton.mileage.Mileage EXITING}
06-05 18:18:27.983 W/InputDispatcher( 1630): Attempted to unregister already unregistered input channel '4b87832 com.evancharlton.mileage/com.evancharlton.mileage.Mileage (server)'
06-05 18:18:27.995 D/EGL_emulation( 1712): eglMakeCurrent: 0xb4085540: ver 2 0 (tinfo 0xb4083740)
06-05 18:18:27.999 D/EGL_emulation( 1712): eglMakeCurrent: 0xb4085540: ver 2 0 (tinfo 0xb4083740)
06-05 18:18:28.009 D/EGL_emulation( 1712): eglMakeCurrent: 0xb4085540: ver 2 0 (tinfo 0xb4083740)
06-05 18:18:28.011 D/EGL_emulation( 1712): eglMakeCurrent: 0xb4085540: ver 2 0 (tinfo 0xb4083740)
06-05 18:18:28.026 D/EGL_emulation( 1712): eglMakeCurrent: 0xb4085540: ver 2 0 (tinfo 0xb4083740)
06-05 18:18:28.027 D/EGL_emulation( 1712): eglMakeCurrent: 0xb4085540: ver 2 0 (tinfo 0xb4083740)
06-05 18:18:28.043 D/EGL_emulation( 1712): eglMakeCurrent: 0xb4085540: ver 2 0 (tinfo 0xb4083740)
06-05 18:18:28.044 D/EGL_emulation( 1712): eglMakeCurrent: 0xb4085540: ver 2 0 (tinfo 0xb4083740)
06-05 18:18:28.053 I/System.out( 5893): URI: //ping
06-05 18:18:28.053 I/System.out( 5893): params: {json={}
06-05 18:18:28.053 I/System.out( 5893): }
06-05 18:18:28.056 I/System.out( 5893): URI: //ping
06-05 18:18:28.056 I/System.out( 5893): params: {json={}
06-05 18:18:28.056 I/System.out( 5893): }
06-05 18:18:28.057 I/System.out( 5893): URI: //ready
06-05 18:18:28.057 I/System.out( 5893): params: {json={}
06-05 18:18:28.057 I/System.out( 5893): }
06-05 18:18:28.059 D/EGL_emulation( 1712): eglMakeCurrent: 0xb4085540: ver 2 0 (tinfo 0xb4083740)
06-05 18:18:28.059 I/System.out( 5893): URI: //
06-05 18:18:28.059 I/System.out( 5893): params: {json={"command":"version","arguments":[]}
06-05 18:18:28.059 I/System.out( 5893): }
06-05 18:18:28.059 I/System.out( 5893): header: {content-type=application/json;charset=utf-8, date=Fri, 05 Jun 2020 23:18:28 GMT, accept=*/*, host=127.0.0.1:34784, content-length=36, user-agent=HTTPClient/1.0 (2.8.3, ruby 2.5.1 (2018-03-29))}
06-05 18:18:28.059 I/System.out( 5893): params: {json={"command":"version","arguments":[]}
06-05 18:18:28.059 I/System.out( 5893): }
06-05 18:18:28.059 I/System.out( 5893): ProP json = {"command":"version","arguments":[]}
06-05 18:18:28.059 I/System.out( 5893): files: {}
06-05 18:18:28.059 I/System.out( 5893): command: {"command":"version","arguments":[]}
06-05 18:18:28.061 D/EGL_emulation( 1712): eglMakeCurrent: 0xb4085540: ver 2 0 (tinfo 0xb4083740)
06-05 18:18:28.063 I/InstrumentationBackend( 5893): Got command:'Command:'Line:null,version', arguments:'[]'
06-05 18:18:28.069 I/System.out( 5893): result:{"bonusInformation":[],"message":"0.9.8","success":true}
06-05 18:18:28.071 I/System.out( 5893): URI: //start-application
06-05 18:18:28.071 I/System.out( 5893): params: {json={"intent":null}
06-05 18:18:28.071 I/System.out( 5893): }
06-05 18:18:28.076 D/EGL_emulation( 1712): eglMakeCurrent: 0xb4085540: ver 2 0 (tinfo 0xb4083740)
06-05 18:18:28.080 I/ActivityManager( 1630): START u0 {act=android.intent.action.MAIN cat=[android.intent.category.LAUNCHER] flg=0x10200000 cmp=com.evancharlton.mileage/.Mileage} from uid 10150 on display 0
06-05 18:18:28.084 I/calabash( 5893): newActivity1
06-05 18:18:28.091 I/calabash( 5893): newActivity1
06-05 18:18:28.092 W/ActivityManager( 1630): Bad activity token: android.os.BinderProxy@eb0d78e
06-05 18:18:28.092 W/ActivityManager( 1630): java.lang.ClassCastException: android.os.BinderProxy cannot be cast to com.android.server.am.ActivityRecord$Token
06-05 18:18:28.092 W/ActivityManager( 1630): 	at com.android.server.am.ActivityRecord.forTokenLocked(ActivityRecord.java:586)
06-05 18:18:28.092 W/ActivityManager( 1630): 	at com.android.server.am.ActivityRecord.isInStackLocked(ActivityRecord.java:1327)
06-05 18:18:28.092 W/ActivityManager( 1630): 	at com.android.server.am.ActivityRecord.getStackLocked(ActivityRecord.java:1332)
06-05 18:18:28.092 W/ActivityManager( 1630): 	at com.android.server.am.ActivityManagerService.getActivityDisplayId(ActivityManagerService.java:9806)
06-05 18:18:28.092 W/ActivityManager( 1630): 	at android.app.ActivityManagerNative.onTransact(ActivityManagerNative.java:2566)
06-05 18:18:28.092 W/ActivityManager( 1630): 	at com.android.server.am.ActivityManagerService.onTransact(ActivityManagerService.java:2757)
06-05 18:18:28.092 W/ActivityManager( 1630): 	at android.os.Binder.execTransact(Binder.java:565)
06-05 18:18:28.092 D/EGL_emulation( 1712): eglMakeCurrent: 0xb4085540: ver 2 0 (tinfo 0xb4083740)
06-05 18:18:28.093 W/ActivityManager( 1630): Bad activity token: android.os.BinderProxy@eb0d78e
06-05 18:18:28.093 W/ActivityManager( 1630): java.lang.ClassCastException: android.os.BinderProxy cannot be cast to com.android.server.am.ActivityRecord$Token
06-05 18:18:28.093 W/ActivityManager( 1630): 	at com.android.server.am.ActivityRecord.forTokenLocked(ActivityRecord.java:586)
06-05 18:18:28.093 W/ActivityManager( 1630): 	at com.android.server.am.ActivityRecord.isInStackLocked(ActivityRecord.java:1327)
06-05 18:18:28.093 W/ActivityManager( 1630): 	at com.android.server.am.ActivityManagerService.setTaskDescription(ActivityManagerService.java:9358)
06-05 18:18:28.093 W/ActivityManager( 1630): 	at android.app.ActivityManagerNative.onTransact(ActivityManagerNative.java:2639)
06-05 18:18:28.093 W/ActivityManager( 1630): 	at com.android.server.am.ActivityManagerService.onTransact(ActivityManagerService.java:2757)
06-05 18:18:28.093 W/ActivityManager( 1630): 	at android.os.Binder.execTransact(Binder.java:565)
06-05 18:18:28.094 W/ActivityManager( 1630): Bad activity token: android.os.BinderProxy@eb0d78e
06-05 18:18:28.094 W/ActivityManager( 1630): java.lang.ClassCastException: android.os.BinderProxy cannot be cast to com.android.server.am.ActivityRecord$Token
06-05 18:18:28.094 W/ActivityManager( 1630): 	at com.android.server.am.ActivityRecord.forTokenLocked(ActivityRecord.java:586)
06-05 18:18:28.094 W/ActivityManager( 1630): 	at com.android.server.am.ActivityRecord.isInStackLocked(ActivityRecord.java:1327)
06-05 18:18:28.094 W/ActivityManager( 1630): 	at com.android.server.am.ActivityRecord.getStackLocked(ActivityRecord.java:1332)
06-05 18:18:28.094 W/ActivityManager( 1630): 	at com.android.server.am.ActivityManagerService.getActivityStackId(ActivityManagerService.java:9817)
06-05 18:18:28.094 W/ActivityManager( 1630): 	at android.app.ActivityManagerNative.onTransact(ActivityManagerNative.java:2856)
06-05 18:18:28.094 W/ActivityManager( 1630): 	at com.android.server.am.ActivityManagerService.onTransact(ActivityManagerService.java:2757)
06-05 18:18:28.094 W/ActivityManager( 1630): 	at android.os.Binder.execTransact(Binder.java:565)
06-05 18:18:28.094 D/EGL_emulation( 1712): eglMakeCurrent: 0xb4085540: ver 2 0 (tinfo 0xb4083740)
06-05 18:18:28.109 D/EGL_emulation( 1712): eglMakeCurrent: 0xb4085540: ver 2 0 (tinfo 0xb4083740)
06-05 18:18:28.109 D/gralloc_ranchu( 1346): gralloc_alloc: Creating ashmem region of size 9023488
06-05 18:18:28.110 W/ActivityManager( 1630): Bad activity token: android.os.BinderProxy@eb0d78e
06-05 18:18:28.110 W/ActivityManager( 1630): java.lang.ClassCastException: android.os.BinderProxy cannot be cast to com.android.server.am.ActivityRecord$Token
06-05 18:18:28.110 W/ActivityManager( 1630): 	at com.android.server.am.ActivityRecord.forTokenLocked(ActivityRecord.java:586)
06-05 18:18:28.110 W/ActivityManager( 1630): 	at com.android.server.am.ActivityRecord.isInStackLocked(ActivityRecord.java:1327)
06-05 18:18:28.110 W/ActivityManager( 1630): 	at com.android.server.am.ActivityManagerService.getActivityOptions(ActivityManagerService.java:12559)
06-05 18:18:28.110 W/ActivityManager( 1630): 	at android.app.ActivityManagerNative.onTransact(ActivityManagerNative.java:1933)
06-05 18:18:28.110 W/ActivityManager( 1630): 	at com.android.server.am.ActivityManagerService.onTransact(ActivityManagerService.java:2757)
06-05 18:18:28.110 W/ActivityManager( 1630): 	at android.os.Binder.execTransact(Binder.java:565)
06-05 18:18:28.110 W/ActivityManager( 1630): Bad activity token: android.os.BinderProxy@eb0d78e
06-05 18:18:28.110 W/ActivityManager( 1630): java.lang.ClassCastException: android.os.BinderProxy cannot be cast to com.android.server.am.ActivityRecord$Token
06-05 18:18:28.110 W/ActivityManager( 1630): 	at com.android.server.am.ActivityRecord.forTokenLocked(ActivityRecord.java:586)
06-05 18:18:28.110 W/ActivityManager( 1630): 	at com.android.server.am.ActivityRecord.isInStackLocked(ActivityRecord.java:1327)
06-05 18:18:28.110 W/ActivityManager( 1630): 	at com.android.server.am.ActivityManagerService.getActivityOptions(ActivityManagerService.java:12559)
06-05 18:18:28.110 W/ActivityManager( 1630): 	at android.app.ActivityManagerNative.onTransact(ActivityManagerNative.java:1933)
06-05 18:18:28.110 W/ActivityManager( 1630): 	at com.android.server.am.ActivityManagerService.onTransact(ActivityManagerService.java:2757)
06-05 18:18:28.110 W/ActivityManager( 1630): 	at android.os.Binder.execTransact(Binder.java:565)
06-05 18:18:28.116 D/EGL_emulation( 1712): eglMakeCurrent: 0xb4085540: ver 2 0 (tinfo 0xb4083740)
06-05 18:18:28.132 V/PhoneStatusBar( 1712): setLightsOn(true)
06-05 18:18:28.143 D/EGL_emulation( 1712): eglMakeCurrent: 0xb4085540: ver 2 0 (tinfo 0xb4083740)
06-05 18:18:28.144 D/EGL_emulation( 1712): eglMakeCurrent: 0xb4085540: ver 2 0 (tinfo 0xb4083740)
06-05 18:18:28.145 V/PhoneStatusBar( 1712): setLightsOn(true)
06-05 18:18:28.145 V/PhoneStatusBar( 1712): setLightsOn(true)
06-05 18:18:28.146 D/gralloc_ranchu( 1346): gralloc_alloc: Creating ashmem region of size 9023488
06-05 18:18:28.147 V/PhoneStatusBar( 1712): setLightsOn(true)
06-05 18:18:28.153 D/        ( 5893): HostConnection::get() New Host Connection established 0x97d25540, tid 5893
06-05 18:18:28.183 D/EGL_emulation( 2099): eglMakeCurrent: 0xb4085240: ver 2 0 (tinfo 0xb40832d0)
06-05 18:18:28.185 D/EGL_emulation( 1712): eglMakeCurrent: 0xb4085540: ver 2 0 (tinfo 0xb4083740)
06-05 18:18:28.186 D/EGL_emulation( 1712): eglMakeCurrent: 0xb4085540: ver 2 0 (tinfo 0xb4083740)
06-05 18:18:28.188 D/EGL_emulation( 1712): eglMakeCurrent: 0xb4085540: ver 2 0 (tinfo 0xb4083740)
06-05 18:18:28.192 D/EGL_emulation( 1712): eglMakeCurrent: 0xb4085540: ver 2 0 (tinfo 0xb4083740)
06-05 18:18:28.194 D/EGL_emulation( 1712): eglMakeCurrent: 0xb4085540: ver 2 0 (tinfo 0xb4083740)
06-05 18:18:28.194 V/PhoneStatusBar( 1712): setLightsOn(true)
06-05 18:18:28.202 I/ActivityManager( 1630): Displayed com.evancharlton.mileage/.Mileage: +119ms
06-05 18:18:28.209 D/gralloc_ranchu( 1346): gralloc_alloc: Creating ashmem region of size 9023488
06-05 18:18:28.209 D/EGL_emulation( 1712): eglMakeCurrent: 0xb4085540: ver 2 0 (tinfo 0xb4083740)
06-05 18:18:28.224 D/EGL_emulation( 1712): eglMakeCurrent: 0xb4085540: ver 2 0 (tinfo 0xb4083740)
06-05 18:18:28.226 D/EGL_emulation( 1712): eglMakeCurrent: 0xb4085540: ver 2 0 (tinfo 0xb4083740)
06-05 18:18:28.234 D/EGL_emulation( 1712): eglMakeCurrent: 0xb4085540: ver 2 0 (tinfo 0xb4083740)
06-05 18:18:28.235 V/PhoneStatusBar( 1712): setLightsOn(true)
06-05 18:18:28.243 D/EGL_emulation( 1712): eglMakeCurrent: 0xb4085540: ver 2 0 (tinfo 0xb4083740)
06-05 18:18:28.249 D/EGL_emulation( 1712): eglMakeCurrent: 0xb4085540: ver 2 0 (tinfo 0xb4083740)
06-05 18:18:28.254 I/System.out( 5893): URI: //map
06-05 18:18:28.254 I/System.out( 5893): params: {json={"query":"* marked:'Statistics'","operation":{"method_name":"query","arguments":[]}}
06-05 18:18:28.254 I/System.out( 5893): }
06-05 18:18:28.259 D/EGL_emulation( 1712): eglMakeCurrent: 0xb4085540: ver 2 0 (tinfo 0xb4083740)
06-05 18:18:28.261 D/EGL_emulation( 1712): eglMakeCurrent: 0xb4085540: ver 2 0 (tinfo 0xb4083740)
06-05 18:18:28.268 W/ResourceType( 5893): No package identifier when getting name for resource number 0x00000001
06-05 18:18:28.276 D/EGL_emulation( 1712): eglMakeCurrent: 0xb4085540: ver 2 0 (tinfo 0xb4083740)
06-05 18:18:28.277 D/EGL_emulation( 1712): eglMakeCurrent: 0xb4085540: ver 2 0 (tinfo 0xb4083740)
06-05 18:18:28.281 I/System.out( 5893): URI: //gesture
06-05 18:18:28.281 I/System.out( 5893): params: {json={"query_timeout":5.0,"gestures":[{"query_string":"* marked:'Statistics'","touches":[{"x":50,"y":50,"offset_x":0,"offset_y":0,"wait":0.0,"time":0.2,"release":true,"query_string":null}]}]}
06-05 18:18:28.281 I/System.out( 5893): }
06-05 18:18:28.286 W/ResourceType( 5893): No package identifier when getting name for resource number 0x00000001
06-05 18:18:28.292 D/EGL_emulation( 1712): eglMakeCurrent: 0xb4085540: ver 2 0 (tinfo 0xb4083740)
06-05 18:18:28.301 D/EGL_emulation( 1712): eglMakeCurrent: 0xb4085540: ver 2 0 (tinfo 0xb4083740)
06-05 18:18:28.309 I/WindowManager( 1630): Destroying surface Surface(name=com.evancharlton.mileage/com.evancharlton.mileage.Mileage) called by com.android.server.wm.WindowStateAnimator.destroySurface:2016 com.android.server.wm.WindowStateAnimator.destroySurfaceLocked:882 com.android.server.wm.WindowState.removeLocked:1456 com.android.server.wm.WindowManagerService.removeWindowInnerLocked:2484 com.android.server.wm.AppWindowToken.destroySurfaces:365 com.android.server.wm.WindowStateAnimator.finishExit:565 com.android.server.wm.AppWindowAnimator.stepAnimationLocked:427 com.android.server.wm.WindowAnimator.updateAppWindowsLocked:196 
06-05 18:18:28.310 D/EGL_emulation( 1712): eglMakeCurrent: 0xb4085540: ver 2 0 (tinfo 0xb4083740)
06-05 18:18:28.315 D/EGL_emulation( 1712): eglMakeCurrent: 0xb4085540: ver 2 0 (tinfo 0xb4083740)
06-05 18:18:28.327 D/EGL_emulation( 1712): eglMakeCurrent: 0xb4085540: ver 2 0 (tinfo 0xb4083740)
06-05 18:18:28.335 D/EGL_emulation( 1712): eglMakeCurrent: 0xb4085540: ver 2 0 (tinfo 0xb4083740)
06-05 18:18:28.336 V/PhoneStatusBar( 1712): setLightsOn(true)
06-05 18:18:28.344 D/EGL_emulation( 1712): eglMakeCurrent: 0xb4085540: ver 2 0 (tinfo 0xb4083740)
06-05 18:18:28.350 D/EGL_emulation( 1712): eglMakeCurrent: 0xb4085540: ver 2 0 (tinfo 0xb4083740)
06-05 18:18:28.361 D/EGL_emulation( 1712): eglMakeCurrent: 0xb4085540: ver 2 0 (tinfo 0xb4083740)
06-05 18:18:28.366 D/EGL_emulation( 1712): eglMakeCurrent: 0xb4085540: ver 2 0 (tinfo 0xb4083740)
06-05 18:18:28.378 D/EGL_emulation( 1712): eglMakeCurrent: 0xb4085540: ver 2 0 (tinfo 0xb4083740)
06-05 18:18:28.393 I/WindowManager( 1630): Destroying surface Surface(name=Starting com.evancharlton.mileage) called by com.android.server.wm.WindowStateAnimator.destroySurface:2016 com.android.server.wm.WindowStateAnimator.destroySurfaceLocked:882 com.android.server.wm.WindowState.destroyOrSaveSurface:2100 com.android.server.wm.AppWindowToken.destroySurfaces:363 com.android.server.wm.WindowStateAnimator.finishExit:565 com.android.server.wm.WindowStateAnimator.stepAnimationLocked:491 com.android.server.wm.WindowAnimator.updateWindowsLocked:303 com.android.server.wm.WindowAnimator.animateLocked:704 
06-05 18:18:28.398 V/PhoneStatusBar( 1712): setLightsOn(true)
06-05 18:18:28.405 V/PhoneStatusBar( 1712): setLightsOn(true)
06-05 18:18:28.516 I/calabash( 5893): newActivity1
06-05 18:18:28.565 I/System.out( 5893): URI: //map
06-05 18:18:28.565 I/System.out( 5893): params: {json={"query":"android.widget.ScrollView index:0","operation":{"method_name":"query","arguments":[]}}
06-05 18:18:28.565 I/System.out( 5893): }
06-05 18:18:28.571 W/ActivityManager( 1630): Bad activity token: android.os.BinderProxy@2dfbbec
06-05 18:18:28.571 W/ActivityManager( 1630): java.lang.ClassCastException: android.os.BinderProxy cannot be cast to com.android.server.am.ActivityRecord$Token
06-05 18:18:28.571 W/ActivityManager( 1630): 	at com.android.server.am.ActivityRecord.forTokenLocked(ActivityRecord.java:586)
06-05 18:18:28.571 W/ActivityManager( 1630): 	at com.android.server.am.ActivityRecord.isInStackLocked(ActivityRecord.java:1327)
06-05 18:18:28.571 W/ActivityManager( 1630): 	at com.android.server.am.ActivityRecord.getStackLocked(ActivityRecord.java:1332)
06-05 18:18:28.571 W/ActivityManager( 1630): 	at com.android.server.am.ActivityManagerService.getActivityDisplayId(ActivityManagerService.java:9806)
06-05 18:18:28.571 W/ActivityManager( 1630): 	at android.app.ActivityManagerNative.onTransact(ActivityManagerNative.java:2566)
06-05 18:18:28.571 W/ActivityManager( 1630): 	at com.android.server.am.ActivityManagerService.onTransact(ActivityManagerService.java:2757)
06-05 18:18:28.571 W/ActivityManager( 1630): 	at android.os.Binder.execTransact(Binder.java:565)
06-05 18:18:28.572 W/ActivityManager( 1630): Bad activity token: android.os.BinderProxy@2dfbbec
06-05 18:18:28.572 W/ActivityManager( 1630): java.lang.ClassCastException: android.os.BinderProxy cannot be cast to com.android.server.am.ActivityRecord$Token
06-05 18:18:28.572 W/ActivityManager( 1630): 	at com.android.server.am.ActivityRecord.forTokenLocked(ActivityRecord.java:586)
06-05 18:18:28.572 W/ActivityManager( 1630): 	at com.android.server.am.ActivityRecord.isInStackLocked(ActivityRecord.java:1327)
06-05 18:18:28.572 W/ActivityManager( 1630): 	at com.android.server.am.ActivityManagerService.setTaskDescription(ActivityManagerService.java:9358)
06-05 18:18:28.572 W/ActivityManager( 1630): 	at android.app.ActivityManagerNative.onTransact(ActivityManagerNative.java:2639)
06-05 18:18:28.572 W/ActivityManager( 1630): 	at com.android.server.am.ActivityManagerService.onTransact(ActivityManagerService.java:2757)
06-05 18:18:28.572 W/ActivityManager( 1630): 	at android.os.Binder.execTransact(Binder.java:565)
06-05 18:18:28.573 W/ActivityManager( 1630): Bad activity token: android.os.BinderProxy@2dfbbec
06-05 18:18:28.573 W/ActivityManager( 1630): java.lang.ClassCastException: android.os.BinderProxy cannot be cast to com.android.server.am.ActivityRecord$Token
06-05 18:18:28.573 W/ActivityManager( 1630): 	at com.android.server.am.ActivityRecord.forTokenLocked(ActivityRecord.java:586)
06-05 18:18:28.573 W/ActivityManager( 1630): 	at com.android.server.am.ActivityRecord.isInStackLocked(ActivityRecord.java:1327)
06-05 18:18:28.573 W/ActivityManager( 1630): 	at com.android.server.am.ActivityRecord.getStackLocked(ActivityRecord.java:1332)
06-05 18:18:28.573 W/ActivityManager( 1630): 	at com.android.server.am.ActivityManagerService.getActivityStackId(ActivityManagerService.java:9817)
06-05 18:18:28.573 W/ActivityManager( 1630): 	at android.app.ActivityManagerNative.onTransact(ActivityManagerNative.java:2856)
06-05 18:18:28.573 W/ActivityManager( 1630): 	at com.android.server.am.ActivityManagerService.onTransact(ActivityManagerService.java:2757)
06-05 18:18:28.573 W/ActivityManager( 1630): 	at android.os.Binder.execTransact(Binder.java:565)
06-05 18:18:28.580 D/VehicleStatisticsActivity( 5893): Checking recalculation ...
06-05 18:18:28.581 D/VehicleStatisticsActivity( 5893): Recalculation not necessary.
06-05 18:18:28.583 W/ActivityManager( 1630): Bad activity token: android.os.BinderProxy@2dfbbec
06-05 18:18:28.583 W/ActivityManager( 1630): java.lang.ClassCastException: android.os.BinderProxy cannot be cast to com.android.server.am.ActivityRecord$Token
06-05 18:18:28.583 W/ActivityManager( 1630): 	at com.android.server.am.ActivityRecord.forTokenLocked(ActivityRecord.java:586)
06-05 18:18:28.583 W/ActivityManager( 1630): 	at com.android.server.am.ActivityRecord.isInStackLocked(ActivityRecord.java:1327)
06-05 18:18:28.583 W/ActivityManager( 1630): 	at com.android.server.am.ActivityManagerService.getActivityOptions(ActivityManagerService.java:12559)
06-05 18:18:28.583 W/ActivityManager( 1630): 	at android.app.ActivityManagerNative.onTransact(ActivityManagerNative.java:1933)
06-05 18:18:28.583 W/ActivityManager( 1630): 	at com.android.server.am.ActivityManagerService.onTransact(ActivityManagerService.java:2757)
06-05 18:18:28.583 W/ActivityManager( 1630): 	at android.os.Binder.execTransact(Binder.java:565)
06-05 18:18:28.583 W/ActivityManager( 1630): Bad activity token: android.os.BinderProxy@2dfbbec
06-05 18:18:28.583 W/ActivityManager( 1630): java.lang.ClassCastException: android.os.BinderProxy cannot be cast to com.android.server.am.ActivityRecord$Token
06-05 18:18:28.583 W/ActivityManager( 1630): 	at com.android.server.am.ActivityRecord.forTokenLocked(ActivityRecord.java:586)
06-05 18:18:28.583 W/ActivityManager( 1630): 	at com.android.server.am.ActivityRecord.isInStackLocked(ActivityRecord.java:1327)
06-05 18:18:28.583 W/ActivityManager( 1630): 	at com.android.server.am.ActivityManagerService.getActivityOptions(ActivityManagerService.java:12559)
06-05 18:18:28.583 W/ActivityManager( 1630): 	at android.app.ActivityManagerNative.onTransact(ActivityManagerNative.java:1933)
06-05 18:18:28.583 W/ActivityManager( 1630): 	at com.android.server.am.ActivityManagerService.onTransact(ActivityManagerService.java:2757)
06-05 18:18:28.583 W/ActivityManager( 1630): 	at android.os.Binder.execTransact(Binder.java:565)
06-05 18:18:28.584 D/VehicleStatisticsActivity( 5893): Checking recalculation ...
06-05 18:18:28.585 D/VehicleStatisticsActivity( 5893): Recalculation not necessary.
06-05 18:18:28.593 V/PhoneStatusBar( 1712): setLightsOn(true)
06-05 18:18:28.648 I/System.out( 5893): URI: //map
06-05 18:18:28.648 I/System.out( 5893): params: {json={"query":"android.widget.AbsListView index:0","operation":{"method_name":"query","arguments":[]}}
06-05 18:18:28.648 I/System.out( 5893): }
06-05 18:18:28.653 I/art     ( 5893): Do partial code cache collection, code=30KB, data=29KB
06-05 18:18:28.653 I/art     ( 5893): After code cache collection, code=29KB, data=28KB
06-05 18:18:28.653 I/art     ( 5893): Increasing code cache capacity to 128KB
06-05 18:18:28.665 I/System.out( 5893): URI: //map
06-05 18:18:28.665 I/System.out( 5893): params: {json={"query":"android.widget.AbsListView index:0","operation":{"method_name":"query","arguments":[]}}
06-05 18:18:28.665 I/System.out( 5893): }
06-05 18:18:28.680 I/System.out( 5893): URI: //map
06-05 18:18:28.680 I/System.out( 5893): params: {json={"query":"android.widget.AbsListView index:0","operation":{"method_name":"query","arguments":[]}}
06-05 18:18:28.680 I/System.out( 5893): }
06-05 18:18:28.701 I/System.out( 5893): URI: //map
06-05 18:18:28.701 I/System.out( 5893): params: {json={"query":"android.widget.AbsListView index:0","operation":{"method_name":"query","arguments":["getFirstVisiblePosition"]}}
06-05 18:18:28.701 I/System.out( 5893): }
06-05 18:18:28.717 I/System.out( 5893): URI: //map
06-05 18:18:28.718 I/System.out( 5893): params: {json={"query":"android.widget.AbsListView index:0","operation":{"method_name":"query","arguments":["getLastVisiblePosition"]}}
06-05 18:18:28.718 I/System.out( 5893): }
06-05 18:18:28.730 I/System.out( 5893): URI: //map
06-05 18:18:28.730 I/System.out( 5893): params: {json={"query":"android.widget.AbsListView index:0","operation":{"method_name":"query","arguments":[{"method_name":"setSelection","arguments":[26]}]}}
06-05 18:18:28.730 I/System.out( 5893): }
06-05 18:18:28.748 I/System.out( 5893): URI: //map
06-05 18:18:28.748 I/System.out( 5893): params: {json={"query":"* marked:'West'","operation":{"method_name":"query","arguments":[]}}
06-05 18:18:28.748 I/System.out( 5893): }
06-05 18:18:28.780 D/gralloc_ranchu( 1346): gralloc_alloc: Creating ashmem region of size 9023488
06-05 18:18:28.816 W/ResourceType( 5893): No package identifier when getting name for resource number 0x00000001
06-05 18:18:28.827 I/System.out( 5893): URI: //gesture
06-05 18:18:28.827 I/System.out( 5893): params: {json={"query_timeout":5.0,"gestures":[{"query_string":"* marked:'West'","touches":[{"x":50,"y":50,"offset_x":0,"offset_y":0,"wait":0.0,"time":0.2,"release":true,"query_string":null}]}]}
06-05 18:18:28.827 I/System.out( 5893): }
06-05 18:18:28.831 W/ResourceType( 5893): No package identifier when getting name for resource number 0x00000001
06-05 18:18:28.893 V/PhoneStatusBar( 1712): setLightsOn(true)
06-05 18:18:28.894 V/PhoneStatusBar( 1712): setLightsOn(true)
06-05 18:18:28.895 W/OpenGLRenderer( 2099): Incorrectly called buildLayer on View: ShortcutAndWidgetContainer, destroying layer...
06-05 18:18:28.909 V/PhoneStatusBar( 1712): setLightsOn(true)
06-05 18:18:28.910 I/WindowManager( 1630): Destroying surface Surface(name=com.android.launcher3/com.android.launcher3.Launcher) called by com.android.server.wm.WindowStateAnimator.destroySurface:2016 com.android.server.wm.WindowStateAnimator.destroySurfaceLocked:882 com.android.server.wm.WindowState.destroyOrSaveSurface:2100 com.android.server.wm.AppWindowToken.destroySurfaces:363 com.android.server.wm.AppWindowToken.notifyAppStopped:389 com.android.server.wm.WindowManagerService.notifyAppStopped:4463 com.android.server.am.ActivityStack.activityStoppedLocked:1252 com.android.server.am.ActivityManagerService.activityStopped:6903 
06-05 18:18:29.060 I/ActivityManager( 1630): START u0 {cmp=com.evancharlton.mileage/.charts.WestChart (has extras)} from uid 10150 on display 0
06-05 18:18:29.061 V/PhoneStatusBar( 1712): setLightsOn(true)
06-05 18:18:29.062 V/PhoneStatusBar( 1712): setLightsOn(true)
06-05 18:18:29.071 I/System.out( 5893): URI: //map
06-05 18:18:29.072 I/System.out( 5893): params: {json={"query":"* {text CONTAINS[c] 'Farthest west fillup'}","operation":{"method_name":"query","arguments":[]}}
06-05 18:18:29.072 I/System.out( 5893): }
06-05 18:18:29.136 I/calabash( 5893): newActivity1
06-05 18:18:29.139 W/aiCharts( 5893): License file is invalid or missing. 
06-05 18:18:29.139 W/aiCharts( 5893): Please place proper license.lic to /assets folder.
06-05 18:18:29.153 V/PhoneStatusBar( 1712): setLightsOn(true)
06-05 18:18:29.176 V/PhoneStatusBar( 1712): setLightsOn(true)
06-05 18:18:29.182 I/WindowManager( 1630): Destroying surface Surface(name=Creating chart…) called by com.android.server.wm.WindowStateAnimator.destroySurface:2016 com.android.server.wm.WindowStateAnimator.destroySurfaceLocked:882 com.android.server.wm.WindowState.removeLocked:1456 com.android.server.wm.WindowManagerService.removeWindowInnerLocked:2484 com.android.server.wm.WindowManagerService.removeWindowLocked:2442 com.android.server.wm.WindowManagerService.removeWindowLocked:2311 com.android.server.wm.WindowManagerService.removeWindow:2306 com.android.server.wm.Session.remove:202 
06-05 18:18:29.184 D/gralloc_ranchu( 1346): gralloc_alloc: Creating ashmem region of size 9023488
06-05 18:18:29.192 V/PhoneStatusBar( 1712): setLightsOn(true)
06-05 18:18:29.214 I/ActivityManager( 1630): Displayed com.evancharlton.mileage/.charts.WestChart: +80ms
06-05 18:18:29.226 V/PhoneStatusBar( 1712): setLightsOn(true)
06-05 18:18:29.259 V/PhoneStatusBar( 1712): setLightsOn(true)
06-05 18:18:29.276 V/PhoneStatusBar( 1712): setLightsOn(true)
06-05 18:18:29.460 V/PhoneStatusBar( 1712): setLightsOn(true)
06-05 18:18:29.470 I/System.out( 5893): URI: //map
06-05 18:18:29.470 I/System.out( 5893): params: {json={"query":"* {text CONTAINS[c] 'Farthest west fillup'}","operation":{"method_name":"query","arguments":[]}}
06-05 18:18:29.470 I/System.out( 5893): }
06-05 18:18:29.490 I/System.out( 5893): URI: //
06-05 18:18:29.490 I/System.out( 5893): params: {json={"command":"press_key","arguments":["KEYCODE_BACK"]}
06-05 18:18:29.490 I/System.out( 5893): }
06-05 18:18:29.490 I/System.out( 5893): header: {content-type=application/json;charset=utf-8, date=Fri, 05 Jun 2020 23:18:30 GMT, accept=*/*, host=127.0.0.1:34784, content-length=52, user-agent=HTTPClient/1.0 (2.8.3, ruby 2.5.1 (2018-03-29))}
06-05 18:18:29.490 I/System.out( 5893): params: {json={"command":"press_key","arguments":["KEYCODE_BACK"]}
06-05 18:18:29.490 I/System.out( 5893): }
06-05 18:18:29.490 I/System.out( 5893): ProP json = {"command":"press_key","arguments":["KEYCODE_BACK"]}
06-05 18:18:29.490 I/System.out( 5893): files: {}
06-05 18:18:29.490 I/System.out( 5893): command: {"command":"press_key","arguments":["KEYCODE_BACK"]}
06-05 18:18:29.491 I/InstrumentationBackend( 5893): Got command:'Command:'Line:null,press_key', arguments:'[KEYCODE_BACK]'
06-05 18:18:29.496 V/PhoneStatusBar( 1712): setLightsOn(true)
06-05 18:18:29.501 I/System.out( 5893): result:{"bonusInformation":[],"message":"","success":true}
06-05 18:18:29.503 I/art     ( 5893): Do partial code cache collection, code=60KB, data=62KB
06-05 18:18:29.503 I/art     ( 5893): After code cache collection, code=59KB, data=61KB
06-05 18:18:29.503 I/art     ( 5893): Increasing code cache capacity to 256KB
06-05 18:18:29.504 I/System.out( 5893): URI: //map
06-05 18:18:29.505 I/System.out( 5893): params: {json={"query":"* {text CONTAINS[c] 'Statistics'}","operation":{"method_name":"query","arguments":[]}}
06-05 18:18:29.505 I/System.out( 5893): }
06-05 18:18:29.505 D/VehicleStatisticsActivity( 5893): Checking recalculation ...
06-05 18:18:29.506 D/VehicleStatisticsActivity( 5893): Recalculation not necessary.
06-05 18:18:29.509 V/PhoneStatusBar( 1712): setLightsOn(true)
06-05 18:18:29.525 D/gralloc_ranchu( 1346): gralloc_alloc: Creating ashmem region of size 9023488
06-05 18:18:29.527 V/PhoneStatusBar( 1712): setLightsOn(true)
06-05 18:18:29.551 V/PhoneStatusBar( 1712): setLightsOn(true)
06-05 18:18:29.594 V/PhoneStatusBar( 1712): setLightsOn(true)
