--------- beginning of main
06-05 21:21:47.397 V/PhoneStatusBar( 1711): setLightsOn(true)
06-05 21:21:47.398 V/PhoneStatusBar( 1711): setLightsOn(true)
06-05 21:21:47.413 D/gralloc_ranchu( 1347): gralloc_alloc: Creating ashmem region of size 3145728
06-05 21:21:47.417 E/EGL_emulation( 1347): tid 1347: eglCreateSyncKHR(1901): error 0x3004 (EGL_BAD_ATTRIBUTE)
--------- beginning of system
06-05 21:21:47.426 W/ActivityManager( 1630): Finishing task with all activities already finished
06-05 21:21:47.426 W/ActivityManager( 1630): Duplicate finish request for ActivityRecord{673b990 u0 com.evancharlton.mileage/.Mileage t7509 f}
06-05 21:21:47.427 W/ActivityManager( 1630): Finishing task with all activities already finished
06-05 21:21:47.427 W/ActivityManager( 1630): Duplicate finish request for ActivityRecord{673b990 u0 com.evancharlton.mileage/.Mileage t7509 f}
06-05 21:21:47.427 W/ActivityManager( 1630): Finishing task with all activities already finished
06-05 21:21:47.427 W/ActivityManager( 1630): Duplicate finish request for ActivityRecord{673b990 u0 com.evancharlton.mileage/.Mileage t7509 f}
06-05 21:21:47.428 W/ActivityManager( 1630): Finishing task with all activities already finished
06-05 21:21:47.428 W/ActivityManager( 1630): Duplicate finish request for ActivityRecord{673b990 u0 com.evancharlton.mileage/.Mileage t7509 f}
06-05 21:21:47.428 W/ActivityManager( 1630): Finishing task with all activities already finished
06-05 21:21:47.428 W/ActivityManager( 1630): Duplicate finish request for ActivityRecord{673b990 u0 com.evancharlton.mileage/.Mileage t7509 f}
06-05 21:21:47.448 D/EGL_emulation( 1711): eglMakeCurrent: 0xb0f853c0: ver 2 0 (tinfo 0xb0f833e0)
06-05 21:21:47.463 D/EGL_emulation( 2083): eglMakeCurrent: 0xb0f85240: ver 2 0 (tinfo 0xb0f832d0)
06-05 21:21:47.464 D/EGL_emulation( 1711): eglMakeCurrent: 0xb0f853c0: ver 2 0 (tinfo 0xb0f833e0)
06-05 21:21:47.503 D/AndroidRuntime(10259): >>>>>> START com.android.internal.os.RuntimeInit uid 2000 <<<<<<
06-05 21:21:47.504 D/AndroidRuntime(10259): CheckJNI is ON
06-05 21:21:47.512 D/EGL_emulation( 1711): eglMakeCurrent: 0xb0f853c0: ver 2 0 (tinfo 0xb0f833e0)
06-05 21:21:47.515 W/art     (10259): Unexpected CPU variant for X86 using defaults: x86
06-05 21:21:47.517 D/ICU     (10259): No timezone override file found: /data/misc/zoneinfo/current/icu/icu_tzdata.dat
06-05 21:21:47.523 E/memtrack(10259): Couldn't load memtrack module (No such file or directory)
06-05 21:21:47.523 E/android.os.Debug(10259): failed to load memtrack module: -2
06-05 21:21:47.524 I/Radio-JNI(10259): register_android_hardware_Radio DONE
06-05 21:21:47.528 D/EGL_emulation( 1711): eglMakeCurrent: 0xb0f853c0: ver 2 0 (tinfo 0xb0f833e0)
06-05 21:21:47.528 D/AndroidRuntime(10259): Calling main entry com.android.commands.am.Am
06-05 21:21:47.529 I/ActivityManager( 1630): Force stopping com.evancharlton.mileage appid=10286 user=0: start instr
06-05 21:21:47.529 I/ActivityManager( 1630): Killing 10211:com.evancharlton.mileage/u0a286 (adj 0): stop com.evancharlton.mileage
06-05 21:21:47.529 D/ActivityManager( 1630): cleanUpApplicationRecord -- 10211
06-05 21:21:47.530 D/EGL_emulation( 1711): eglMakeCurrent: 0xb0f853c0: ver 2 0 (tinfo 0xb0f833e0)
06-05 21:21:47.531 W/ActivityManager( 1630): Crash of app com.evancharlton.mileage running instrumentation ComponentInfo{com.evancharlton.mileage.test/sh.calaba.instrumentationbackend.CalabashInstrumentationTestRunner}
06-05 21:21:47.531 I/ActivityManager( 1630): Force stopping com.evancharlton.mileage appid=10286 user=0: finished inst
06-05 21:21:47.534 I/art     (10269): Not late-enabling -Xcheck:jni (already on)
06-05 21:21:47.534 W/art     (10269): Unexpected CPU variant for X86 using defaults: x86
06-05 21:21:47.541 I/ActivityManager( 1630): Start proc 10269:com.evancharlton.mileage/u0a286 for added application com.evancharlton.mileage
06-05 21:21:47.542 D/AndroidRuntime(10259): Shutting down VM
06-05 21:21:47.544 D/EGL_emulation( 1711): eglMakeCurrent: 0xb0f853c0: ver 2 0 (tinfo 0xb0f833e0)
06-05 21:21:47.546 W/System  (10269): ClassLoader referenced unknown path: /data/app/com.evancharlton.mileage.test-1/lib/x86
06-05 21:21:47.546 W/System  (10269): ClassLoader referenced unknown path: /data/app/com.evancharlton.mileage-1/lib/x86
06-05 21:21:47.546 D/EGL_emulation( 1711): eglMakeCurrent: 0xb0f853c0: ver 2 0 (tinfo 0xb0f833e0)
06-05 21:21:47.548 W/System  (10269): ClassLoader referenced unknown path: 
06-05 21:21:47.552 I/System.out(10269): Main activity name automatically set to: com.evancharlton.mileage.Mileage
06-05 21:21:47.552 I/System.out(10269): Calabash did not load Mono. This is only a problem if you are trying to test a Mono application
06-05 21:21:47.552 I/calabash(10269): Test server port: 7102
06-05 21:21:47.553 I/InstrumentationBackend(10269): Added:'GetPreferences', with key:'get_preferences'
06-05 21:21:47.557 I/InstrumentationBackend(10269): Added:'SetPreferences', with key:'set_preferences'
06-05 21:21:47.557 I/InstrumentationBackend(10269): Added:'ClearPreferences', with key:'clear_preferences'
06-05 21:21:47.557 I/InstrumentationBackend(10269): Added:'PressElement', with key:'press_l10n_element'
06-05 21:21:47.557 I/InstrumentationBackend(10269): Added:'WaitForElement', with key:'wait_for_l10n_element'
06-05 21:21:47.557 I/InstrumentationBackend(10269): Added:'NullAction', with key:'nullAction'
06-05 21:21:47.558 I/InstrumentationBackend(10269): Added:'PressKey', with key:'press_key'
06-05 21:21:47.558 I/InstrumentationBackend(10269): Added:'SetActivityOrientation', with key:'set_activity_orientation'
06-05 21:21:47.558 I/InstrumentationBackend(10269): Added:'GetActivityOrientation', with key:'get_activity_orientation'
06-05 21:21:47.558 I/InstrumentationBackend(10269): Added:'FakeGPSLocation', with key:'set_gps_coordinates'
06-05 21:21:47.558 I/InstrumentationBackend(10269): Added:'SetPropertyByCssSelector', with key:'set_property_by_css_selector'
06-05 21:21:47.558 I/InstrumentationBackend(10269): Added:'GetUrl', with key:'get_url'
06-05 21:21:47.558 I/InstrumentationBackend(10269): Added:'ScrollTo', with key:'scroll_to'
06-05 21:21:47.558 I/InstrumentationBackend(10269): Added:'GetLoadProgress', with key:'get_load_progress'
06-05 21:21:47.558 I/InstrumentationBackend(10269): Added:'DumpHtml', with key:'dump_html'
06-05 21:21:47.559 I/InstrumentationBackend(10269): Added:'DumpBodyHtml', with key:'dump_body_html'
06-05 21:21:47.559 I/InstrumentationBackend(10269): Added:'EnterTextByCssSelector', with key:'enter_text_by_selector'
06-05 21:21:47.559 I/InstrumentationBackend(10269): Added:'AndroidSDKVersion', with key:'android_sdk_version'
06-05 21:21:47.559 I/InstrumentationBackend(10269): Added:'Version', with key:'version'
06-05 21:21:47.559 I/InstrumentationBackend(10269): Added:'Drag', with key:'drag'
06-05 21:21:47.559 I/InstrumentationBackend(10269): Added:'TouchCoordinates', with key:'touch_coordinate'
06-05 21:21:47.559 I/InstrumentationBackend(10269): Added:'LongPressCoordinate', with key:'long_press_coordinate'
06-05 21:21:47.559 I/InstrumentationBackend(10269): Added:'DragCoordinates', with key:'drag_coordinates'
06-05 21:21:47.559 I/InstrumentationBackend(10269): Added:'ResumeApplication', with key:'resume_application'
06-05 21:21:47.559 I/InstrumentationBackend(10269): Added:'Swipe', with key:'swipe'
06-05 21:21:47.559 I/InstrumentationBackend(10269): Added:'DoubleTapCoordinate', with key:'double_tap_coordinate'
06-05 21:21:47.559 I/InstrumentationBackend(10269): Added:'ClickOnScreen', with key:'click_on_screen'
06-05 21:21:47.559 I/InstrumentationBackend(10269): Added:'GetActivityName', with key:'get_activity_name'
06-05 21:21:47.559 I/InstrumentationBackend(10269): Added:'ScrollToView', with key:'scroll_to_view'
06-05 21:21:47.559 I/InstrumentationBackend(10269): Added:'ViewConfiguration', with key:'view_configuration'
06-05 21:21:47.560 I/InstrumentationBackend(10269): Added:'IsCurrentActivityFocused', with key:'is_current_activity_focused'
06-05 21:21:47.560 I/InstrumentationBackend(10269): Added:'SendTcp', with key:'send_tcp'
06-05 21:21:47.560 I/InstrumentationBackend(10269): Added:'DpToDevicePixel', with key:'dp_to_device_pixel'
06-05 21:21:47.560 I/InstrumentationBackend(10269): Added:'KeyboardEnterText', with key:'keyboard_enter_text'
06-05 21:21:47.560 I/InstrumentationBackend(10269): Added:'DeleteSurroundingText', with key:'delete_surrounding_text'
06-05 21:21:47.560 I/InstrumentationBackend(10269): Added:'SetComposingRegion', with key:'set_composing_region'
06-05 21:21:47.560 I/InstrumentationBackend(10269): Added:'SetSelection', with key:'set_selection'
06-05 21:21:47.560 I/InstrumentationBackend(10269): Added:'KeyboardKeyEvent', with key:'keyboard_key_event'
06-05 21:21:47.560 I/InstrumentationBackend(10269): Added:'PressUserActionButton', with key:'press_user_action_button'
06-05 21:21:47.560 I/InstrumentationBackend(10269): Added:'HideSoftKeyboard', with key:'hide_soft_keyboard'
06-05 21:21:47.560 I/InstrumentationBackend(10269): Added:'ListActions', with key:'list_actions'
06-05 21:21:47.561 I/calabash(10269): Instantiating http server at 7102
06-05 21:21:47.561 I/System.out(10269): HTTP Daemon listening on: 7102
06-05 21:21:47.561 D/EGL_emulation( 1711): eglMakeCurrent: 0xb0f853c0: ver 2 0 (tinfo 0xb0f833e0)
06-05 21:21:47.563 D/EGL_emulation( 1711): eglMakeCurrent: 0xb0f853c0: ver 2 0 (tinfo 0xb0f833e0)
06-05 21:21:47.578 D/EGL_emulation( 1711): eglMakeCurrent: 0xb0f853c0: ver 2 0 (tinfo 0xb0f833e0)
06-05 21:21:47.579 D/EGL_emulation( 1711): eglMakeCurrent: 0xb0f853c0: ver 2 0 (tinfo 0xb0f833e0)
06-05 21:21:47.588 W/InputDispatcher( 1630): channel 'c5f0d9f com.evancharlton.mileage/com.evancharlton.mileage.Mileage (server)' ~ Consumer closed input channel or an error occurred.  events=0x9
06-05 21:21:47.588 E/InputDispatcher( 1630): channel 'c5f0d9f com.evancharlton.mileage/com.evancharlton.mileage.Mileage (server)' ~ Channel is unrecoverably broken and will be disposed!
06-05 21:21:47.588 I/WindowManager( 1630): WIN DEATH: Window{c5f0d9f u0 com.evancharlton.mileage/com.evancharlton.mileage.Mileage EXITING}
06-05 21:21:47.588 W/InputDispatcher( 1630): Attempted to unregister already unregistered input channel 'c5f0d9f com.evancharlton.mileage/com.evancharlton.mileage.Mileage (server)'
06-05 21:21:47.588 W/InputDispatcher( 1630): channel '36072ab Toast (server)' ~ Consumer closed input channel or an error occurred.  events=0x9
06-05 21:21:47.588 E/InputDispatcher( 1630): channel '36072ab Toast (server)' ~ Channel is unrecoverably broken and will be disposed!
06-05 21:21:47.589 I/WindowManager( 1630): WIN DEATH: Window{36072ab u0 Toast}
06-05 21:21:47.589 W/InputDispatcher( 1630): Attempted to unregister already unregistered input channel '36072ab Toast (server)'
06-05 21:21:47.598 D/EGL_emulation( 1711): eglMakeCurrent: 0xb0f853c0: ver 2 0 (tinfo 0xb0f833e0)
06-05 21:21:47.601 D/EGL_emulation( 1711): eglMakeCurrent: 0xb0f853c0: ver 2 0 (tinfo 0xb0f833e0)
06-05 21:21:47.611 D/EGL_emulation( 1711): eglMakeCurrent: 0xb0f853c0: ver 2 0 (tinfo 0xb0f833e0)
06-05 21:21:47.613 D/EGL_emulation( 1711): eglMakeCurrent: 0xb0f853c0: ver 2 0 (tinfo 0xb0f833e0)
06-05 21:21:47.628 D/EGL_emulation( 1711): eglMakeCurrent: 0xb0f853c0: ver 2 0 (tinfo 0xb0f833e0)
06-05 21:21:47.629 D/EGL_emulation( 1711): eglMakeCurrent: 0xb0f853c0: ver 2 0 (tinfo 0xb0f833e0)
06-05 21:21:47.645 D/EGL_emulation( 1711): eglMakeCurrent: 0xb0f853c0: ver 2 0 (tinfo 0xb0f833e0)
06-05 21:21:47.647 D/EGL_emulation( 1711): eglMakeCurrent: 0xb0f853c0: ver 2 0 (tinfo 0xb0f833e0)
06-05 21:21:47.652 I/System.out(10269): URI: //ping
06-05 21:21:47.652 I/System.out(10269): params: {json={}
06-05 21:21:47.652 I/System.out(10269): }
06-05 21:21:47.656 I/System.out(10269): URI: //ping
06-05 21:21:47.657 I/System.out(10269): params: {json={}
06-05 21:21:47.657 I/System.out(10269): }
06-05 21:21:47.659 I/System.out(10269): URI: //ready
06-05 21:21:47.659 I/System.out(10269): params: {json={}
06-05 21:21:47.659 I/System.out(10269): }
06-05 21:21:47.663 I/System.out(10269): URI: //
06-05 21:21:47.663 D/EGL_emulation( 1711): eglMakeCurrent: 0xb0f853c0: ver 2 0 (tinfo 0xb0f833e0)
06-05 21:21:47.663 I/System.out(10269): params: {json={"command":"version","arguments":[]}
06-05 21:21:47.663 I/System.out(10269): }
06-05 21:21:47.663 I/System.out(10269): header: {content-type=application/json;charset=utf-8, date=Sat, 06 Jun 2020 02:21:48 GMT, accept=*/*, host=127.0.0.1:34777, content-length=36, user-agent=HTTPClient/1.0 (2.8.3, ruby 2.5.1 (2018-03-29))}
06-05 21:21:47.663 I/System.out(10269): params: {json={"command":"version","arguments":[]}
06-05 21:21:47.663 I/System.out(10269): }
06-05 21:21:47.663 I/System.out(10269): ProP json = {"command":"version","arguments":[]}
06-05 21:21:47.663 I/System.out(10269): files: {}
06-05 21:21:47.663 I/System.out(10269): command: {"command":"version","arguments":[]}
06-05 21:21:47.669 I/InstrumentationBackend(10269): Got command:'Command:'Line:null,version', arguments:'[]'
06-05 21:21:47.678 D/EGL_emulation( 1711): eglMakeCurrent: 0xb0f853c0: ver 2 0 (tinfo 0xb0f833e0)
06-05 21:21:47.681 D/EGL_emulation( 1711): eglMakeCurrent: 0xb0f853c0: ver 2 0 (tinfo 0xb0f833e0)
06-05 21:21:47.682 I/System.out(10269): result:{"bonusInformation":[],"message":"0.9.8","success":true}
06-05 21:21:47.685 I/System.out(10269): URI: //start-application
06-05 21:21:47.686 I/System.out(10269): params: {json={"intent":null}
06-05 21:21:47.686 I/System.out(10269): }
06-05 21:21:47.694 D/EGL_emulation( 1711): eglMakeCurrent: 0xb0f853c0: ver 2 0 (tinfo 0xb0f833e0)
06-05 21:21:47.696 D/EGL_emulation( 1711): eglMakeCurrent: 0xb0f853c0: ver 2 0 (tinfo 0xb0f833e0)
06-05 21:21:47.698 I/ActivityManager( 1630): START u0 {act=android.intent.action.MAIN cat=[android.intent.category.LAUNCHER] flg=0x10200000 cmp=com.evancharlton.mileage/.Mileage} from uid 10286 on display 0
06-05 21:21:47.704 I/calabash(10269): newActivity1
06-05 21:21:47.712 I/calabash(10269): newActivity1
06-05 21:21:47.713 W/ActivityManager( 1630): Bad activity token: android.os.BinderProxy@12f7302
06-05 21:21:47.713 W/ActivityManager( 1630): java.lang.ClassCastException: android.os.BinderProxy cannot be cast to com.android.server.am.ActivityRecord$Token
06-05 21:21:47.713 W/ActivityManager( 1630): 	at com.android.server.am.ActivityRecord.forTokenLocked(ActivityRecord.java:586)
06-05 21:21:47.713 W/ActivityManager( 1630): 	at com.android.server.am.ActivityRecord.isInStackLocked(ActivityRecord.java:1327)
06-05 21:21:47.713 W/ActivityManager( 1630): 	at com.android.server.am.ActivityRecord.getStackLocked(ActivityRecord.java:1332)
06-05 21:21:47.713 W/ActivityManager( 1630): 	at com.android.server.am.ActivityManagerService.getActivityDisplayId(ActivityManagerService.java:9806)
06-05 21:21:47.713 W/ActivityManager( 1630): 	at android.app.ActivityManagerNative.onTransact(ActivityManagerNative.java:2566)
06-05 21:21:47.713 W/ActivityManager( 1630): 	at com.android.server.am.ActivityManagerService.onTransact(ActivityManagerService.java:2757)
06-05 21:21:47.713 W/ActivityManager( 1630): 	at android.os.Binder.execTransact(Binder.java:565)
06-05 21:21:47.713 W/ActivityManager( 1630): Bad activity token: android.os.BinderProxy@12f7302
06-05 21:21:47.713 W/ActivityManager( 1630): java.lang.ClassCastException: android.os.BinderProxy cannot be cast to com.android.server.am.ActivityRecord$Token
06-05 21:21:47.713 W/ActivityManager( 1630): 	at com.android.server.am.ActivityRecord.forTokenLocked(ActivityRecord.java:586)
06-05 21:21:47.713 W/ActivityManager( 1630): 	at com.android.server.am.ActivityRecord.isInStackLocked(ActivityRecord.java:1327)
06-05 21:21:47.713 W/ActivityManager( 1630): 	at com.android.server.am.ActivityManagerService.setTaskDescription(ActivityManagerService.java:9358)
06-05 21:21:47.713 W/ActivityManager( 1630): 	at android.app.ActivityManagerNative.onTransact(ActivityManagerNative.java:2639)
06-05 21:21:47.713 W/ActivityManager( 1630): 	at com.android.server.am.ActivityManagerService.onTransact(ActivityManagerService.java:2757)
06-05 21:21:47.713 W/ActivityManager( 1630): 	at android.os.Binder.execTransact(Binder.java:565)
06-05 21:21:47.714 W/ActivityManager( 1630): Bad activity token: android.os.BinderProxy@12f7302
06-05 21:21:47.714 W/ActivityManager( 1630): java.lang.ClassCastException: android.os.BinderProxy cannot be cast to com.android.server.am.ActivityRecord$Token
06-05 21:21:47.714 W/ActivityManager( 1630): 	at com.android.server.am.ActivityRecord.forTokenLocked(ActivityRecord.java:586)
06-05 21:21:47.714 W/ActivityManager( 1630): 	at com.android.server.am.ActivityRecord.isInStackLocked(ActivityRecord.java:1327)
06-05 21:21:47.714 W/ActivityManager( 1630): 	at com.android.server.am.ActivityRecord.getStackLocked(ActivityRecord.java:1332)
06-05 21:21:47.714 W/ActivityManager( 1630): 	at com.android.server.am.ActivityManagerService.getActivityStackId(ActivityManagerService.java:9817)
06-05 21:21:47.714 W/ActivityManager( 1630): 	at android.app.ActivityManagerNative.onTransact(ActivityManagerNative.java:2856)
06-05 21:21:47.714 W/ActivityManager( 1630): 	at com.android.server.am.ActivityManagerService.onTransact(ActivityManagerService.java:2757)
06-05 21:21:47.714 W/ActivityManager( 1630): 	at android.os.Binder.execTransact(Binder.java:565)
06-05 21:21:47.727 W/ActivityManager( 1630): Bad activity token: android.os.BinderProxy@12f7302
06-05 21:21:47.727 W/ActivityManager( 1630): java.lang.ClassCastException: android.os.BinderProxy cannot be cast to com.android.server.am.ActivityRecord$Token
06-05 21:21:47.727 W/ActivityManager( 1630): 	at com.android.server.am.ActivityRecord.forTokenLocked(ActivityRecord.java:586)
06-05 21:21:47.727 W/ActivityManager( 1630): 	at com.android.server.am.ActivityRecord.isInStackLocked(ActivityRecord.java:1327)
06-05 21:21:47.727 W/ActivityManager( 1630): 	at com.android.server.am.ActivityManagerService.getActivityOptions(ActivityManagerService.java:12559)
06-05 21:21:47.727 W/ActivityManager( 1630): 	at android.app.ActivityManagerNative.onTransact(ActivityManagerNative.java:1933)
06-05 21:21:47.727 W/ActivityManager( 1630): 	at com.android.server.am.ActivityManagerService.onTransact(ActivityManagerService.java:2757)
06-05 21:21:47.727 W/ActivityManager( 1630): 	at android.os.Binder.execTransact(Binder.java:565)
06-05 21:21:47.728 W/ActivityManager( 1630): Bad activity token: android.os.BinderProxy@12f7302
06-05 21:21:47.728 W/ActivityManager( 1630): java.lang.ClassCastException: android.os.BinderProxy cannot be cast to com.android.server.am.ActivityRecord$Token
06-05 21:21:47.728 W/ActivityManager( 1630): 	at com.android.server.am.ActivityRecord.forTokenLocked(ActivityRecord.java:586)
06-05 21:21:47.728 W/ActivityManager( 1630): 	at com.android.server.am.ActivityRecord.isInStackLocked(ActivityRecord.java:1327)
06-05 21:21:47.728 W/ActivityManager( 1630): 	at com.android.server.am.ActivityManagerService.getActivityOptions(ActivityManagerService.java:12559)
06-05 21:21:47.728 W/ActivityManager( 1630): 	at android.app.ActivityManagerNative.onTransact(ActivityManagerNative.java:1933)
06-05 21:21:47.728 W/ActivityManager( 1630): 	at com.android.server.am.ActivityManagerService.onTransact(ActivityManagerService.java:2757)
06-05 21:21:47.728 W/ActivityManager( 1630): 	at android.os.Binder.execTransact(Binder.java:565)
06-05 21:21:47.728 D/gralloc_ranchu( 1347): gralloc_alloc: Creating ashmem region of size 9023488
06-05 21:21:47.753 V/PhoneStatusBar( 1711): setLightsOn(true)
06-05 21:21:47.761 D/EGL_emulation( 1711): eglMakeCurrent: 0xb0f853c0: ver 2 0 (tinfo 0xb0f833e0)
06-05 21:21:47.762 V/PhoneStatusBar( 1711): setLightsOn(true)
06-05 21:21:47.764 V/PhoneStatusBar( 1711): setLightsOn(true)
06-05 21:21:47.764 D/gralloc_ranchu( 1347): gralloc_alloc: Creating ashmem region of size 9023488
06-05 21:21:47.767 V/PhoneStatusBar( 1711): setLightsOn(true)
06-05 21:21:47.769 D/        (10269): HostConnection::get() New Host Connection established 0xa4a944c0, tid 10269
06-05 21:21:47.800 D/EGL_emulation( 1711): eglMakeCurrent: 0xb0f853c0: ver 2 0 (tinfo 0xb0f833e0)
06-05 21:21:47.800 D/EGL_emulation( 2083): eglMakeCurrent: 0xb0f85240: ver 2 0 (tinfo 0xb0f832d0)
06-05 21:21:47.803 D/EGL_emulation( 1711): eglMakeCurrent: 0xb0f853c0: ver 2 0 (tinfo 0xb0f833e0)
06-05 21:21:47.806 D/EGL_emulation( 1711): eglMakeCurrent: 0xb0f853c0: ver 2 0 (tinfo 0xb0f833e0)
06-05 21:21:47.808 D/EGL_emulation( 1711): eglMakeCurrent: 0xb0f853c0: ver 2 0 (tinfo 0xb0f833e0)
06-05 21:21:47.818 D/EGL_emulation( 1711): eglMakeCurrent: 0xb0f853c0: ver 2 0 (tinfo 0xb0f833e0)
06-05 21:21:47.819 D/EGL_emulation( 1711): eglMakeCurrent: 0xb0f853c0: ver 2 0 (tinfo 0xb0f833e0)
06-05 21:21:47.821 I/ActivityManager( 1630): Displayed com.evancharlton.mileage/.Mileage: +119ms
06-05 21:21:47.828 D/gralloc_ranchu( 1347): gralloc_alloc: Creating ashmem region of size 9023488
06-05 21:21:47.828 D/EGL_emulation( 1711): eglMakeCurrent: 0xb0f853c0: ver 2 0 (tinfo 0xb0f833e0)
06-05 21:21:47.841 D/EGL_emulation( 1711): eglMakeCurrent: 0xb0f853c0: ver 2 0 (tinfo 0xb0f833e0)
06-05 21:21:47.851 D/EGL_emulation( 1711): eglMakeCurrent: 0xb0f853c0: ver 2 0 (tinfo 0xb0f833e0)
06-05 21:21:47.855 D/EGL_emulation( 1711): eglMakeCurrent: 0xb0f853c0: ver 2 0 (tinfo 0xb0f833e0)
06-05 21:21:47.855 V/PhoneStatusBar( 1711): setLightsOn(true)
06-05 21:21:47.869 D/EGL_emulation( 1711): eglMakeCurrent: 0xb0f853c0: ver 2 0 (tinfo 0xb0f833e0)
06-05 21:21:47.871 D/EGL_emulation( 1711): eglMakeCurrent: 0xb0f853c0: ver 2 0 (tinfo 0xb0f833e0)
06-05 21:21:47.877 I/System.out(10269): URI: //map
06-05 21:21:47.877 I/System.out(10269): params: {json={"query":"* marked:'Statistics'","operation":{"method_name":"query","arguments":[]}}
06-05 21:21:47.877 I/System.out(10269): }
06-05 21:21:47.878 D/EGL_emulation( 1711): eglMakeCurrent: 0xb0f853c0: ver 2 0 (tinfo 0xb0f833e0)
06-05 21:21:47.879 D/EGL_emulation( 1711): eglMakeCurrent: 0xb0f853c0: ver 2 0 (tinfo 0xb0f833e0)
06-05 21:21:47.888 W/ResourceType(10269): No package identifier when getting name for resource number 0x00000001
06-05 21:21:47.894 I/WindowManager( 1630): Destroying surface Surface(name=com.evancharlton.mileage/com.evancharlton.mileage.Mileage) called by com.android.server.wm.WindowStateAnimator.destroySurface:2016 com.android.server.wm.WindowStateAnimator.destroySurfaceLocked:882 com.android.server.wm.WindowState.removeLocked:1456 com.android.server.wm.WindowManagerService.removeWindowInnerLocked:2484 com.android.server.wm.AppWindowToken.destroySurfaces:365 com.android.server.wm.WindowStateAnimator.finishExit:565 com.android.server.wm.AppWindowAnimator.stepAnimationLocked:427 com.android.server.wm.WindowAnimator.updateAppWindowsLocked:196 
06-05 21:21:47.895 D/EGL_emulation( 1711): eglMakeCurrent: 0xb0f853c0: ver 2 0 (tinfo 0xb0f833e0)
06-05 21:21:47.897 D/EGL_emulation( 1711): eglMakeCurrent: 0xb0f853c0: ver 2 0 (tinfo 0xb0f833e0)
06-05 21:21:47.904 I/System.out(10269): URI: //gesture
06-05 21:21:47.904 I/System.out(10269): params: {json={"query_timeout":5.0,"gestures":[{"query_string":"* marked:'Statistics'","touches":[{"x":50,"y":50,"offset_x":0,"offset_y":0,"wait":0.0,"time":0.2,"release":true,"query_string":null}]}]}
06-05 21:21:47.904 I/System.out(10269): }
06-05 21:21:47.908 W/ResourceType(10269): No package identifier when getting name for resource number 0x00000001
06-05 21:21:47.911 D/EGL_emulation( 1711): eglMakeCurrent: 0xb0f853c0: ver 2 0 (tinfo 0xb0f833e0)
06-05 21:21:47.913 D/EGL_emulation( 1711): eglMakeCurrent: 0xb0f853c0: ver 2 0 (tinfo 0xb0f833e0)
06-05 21:21:47.914 V/PhoneStatusBar( 1711): setLightsOn(true)
06-05 21:21:47.930 D/EGL_emulation( 1711): eglMakeCurrent: 0xb0f853c0: ver 2 0 (tinfo 0xb0f833e0)
06-05 21:21:47.947 D/EGL_emulation( 1711): eglMakeCurrent: 0xb0f853c0: ver 2 0 (tinfo 0xb0f833e0)
06-05 21:21:47.960 D/EGL_emulation( 1711): eglMakeCurrent: 0xb0f853c0: ver 2 0 (tinfo 0xb0f833e0)
06-05 21:21:47.977 D/EGL_emulation( 1711): eglMakeCurrent: 0xb0f853c0: ver 2 0 (tinfo 0xb0f833e0)
06-05 21:21:47.986 D/EGL_emulation( 1711): eglMakeCurrent: 0xb0f853c0: ver 2 0 (tinfo 0xb0f833e0)
06-05 21:21:47.989 D/EGL_emulation( 1711): eglMakeCurrent: 0xb0f853c0: ver 2 0 (tinfo 0xb0f833e0)
06-05 21:21:47.995 D/EGL_emulation( 1711): eglMakeCurrent: 0xb0f853c0: ver 2 0 (tinfo 0xb0f833e0)
06-05 21:21:48.011 I/WindowManager( 1630): Destroying surface Surface(name=Starting com.evancharlton.mileage) called by com.android.server.wm.WindowStateAnimator.destroySurface:2016 com.android.server.wm.WindowStateAnimator.destroySurfaceLocked:882 com.android.server.wm.WindowState.destroyOrSaveSurface:2100 com.android.server.wm.AppWindowToken.destroySurfaces:363 com.android.server.wm.WindowStateAnimator.finishExit:565 com.android.server.wm.WindowStateAnimator.stepAnimationLocked:491 com.android.server.wm.WindowAnimator.updateWindowsLocked:303 com.android.server.wm.WindowAnimator.animateLocked:704 
06-05 21:21:48.017 V/PhoneStatusBar( 1711): setLightsOn(true)
06-05 21:21:48.046 V/PhoneStatusBar( 1711): setLightsOn(true)
06-05 21:21:48.127 V/PhoneStatusBar( 1711): setLightsOn(true)
06-05 21:21:48.128 I/WindowManager( 1630): Destroying surface Surface(name=Toast) called by com.android.server.wm.WindowStateAnimator.destroySurface:2016 com.android.server.wm.WindowStateAnimator.destroySurfaceLocked:882 com.android.server.wm.WindowState.destroyOrSaveSurface:2100 com.android.server.wm.WindowSurfacePlacer.performSurfacePlacementInner:429 com.android.server.wm.WindowSurfacePlacer.performSurfacePlacementLoop:232 com.android.server.wm.WindowSurfacePlacer.performSurfacePlacement:180 com.android.server.wm.WindowManagerService$H.handleMessage:8086 android.os.Handler.dispatchMessage:102 
06-05 21:21:48.129 I/calabash(10269): newActivity1
06-05 21:21:48.130 V/PhoneStatusBar( 1711): setLightsOn(true)
06-05 21:21:48.140 I/System.out(10269): URI: //map
06-05 21:21:48.140 I/System.out(10269): params: {json={"query":"android.widget.ScrollView index:0","operation":{"method_name":"query","arguments":[]}}
06-05 21:21:48.140 I/System.out(10269): }
06-05 21:21:48.141 W/ActivityManager( 1630): Bad activity token: android.os.BinderProxy@f8b1380
06-05 21:21:48.141 W/ActivityManager( 1630): java.lang.ClassCastException: android.os.BinderProxy cannot be cast to com.android.server.am.ActivityRecord$Token
06-05 21:21:48.141 W/ActivityManager( 1630): 	at com.android.server.am.ActivityRecord.forTokenLocked(ActivityRecord.java:586)
06-05 21:21:48.141 W/ActivityManager( 1630): 	at com.android.server.am.ActivityRecord.isInStackLocked(ActivityRecord.java:1327)
06-05 21:21:48.141 W/ActivityManager( 1630): 	at com.android.server.am.ActivityRecord.getStackLocked(ActivityRecord.java:1332)
06-05 21:21:48.141 W/ActivityManager( 1630): 	at com.android.server.am.ActivityManagerService.getActivityDisplayId(ActivityManagerService.java:9806)
06-05 21:21:48.141 W/ActivityManager( 1630): 	at android.app.ActivityManagerNative.onTransact(ActivityManagerNative.java:2566)
06-05 21:21:48.141 W/ActivityManager( 1630): 	at com.android.server.am.ActivityManagerService.onTransact(ActivityManagerService.java:2757)
06-05 21:21:48.141 W/ActivityManager( 1630): 	at android.os.Binder.execTransact(Binder.java:565)
06-05 21:21:48.142 W/ActivityManager( 1630): Bad activity token: android.os.BinderProxy@f8b1380
06-05 21:21:48.142 W/ActivityManager( 1630): java.lang.ClassCastException: android.os.BinderProxy cannot be cast to com.android.server.am.ActivityRecord$Token
06-05 21:21:48.142 W/ActivityManager( 1630): 	at com.android.server.am.ActivityRecord.forTokenLocked(ActivityRecord.java:586)
06-05 21:21:48.142 W/ActivityManager( 1630): 	at com.android.server.am.ActivityRecord.isInStackLocked(ActivityRecord.java:1327)
06-05 21:21:48.142 W/ActivityManager( 1630): 	at com.android.server.am.ActivityManagerService.setTaskDescription(ActivityManagerService.java:9358)
06-05 21:21:48.142 W/ActivityManager( 1630): 	at android.app.ActivityManagerNative.onTransact(ActivityManagerNative.java:2639)
06-05 21:21:48.142 W/ActivityManager( 1630): 	at com.android.server.am.ActivityManagerService.onTransact(ActivityManagerService.java:2757)
06-05 21:21:48.142 W/ActivityManager( 1630): 	at android.os.Binder.execTransact(Binder.java:565)
06-05 21:21:48.142 W/ActivityManager( 1630): Bad activity token: android.os.BinderProxy@f8b1380
06-05 21:21:48.142 W/ActivityManager( 1630): java.lang.ClassCastException: android.os.BinderProxy cannot be cast to com.android.server.am.ActivityRecord$Token
06-05 21:21:48.142 W/ActivityManager( 1630): 	at com.android.server.am.ActivityRecord.forTokenLocked(ActivityRecord.java:586)
06-05 21:21:48.142 W/ActivityManager( 1630): 	at com.android.server.am.ActivityRecord.isInStackLocked(ActivityRecord.java:1327)
06-05 21:21:48.142 W/ActivityManager( 1630): 	at com.android.server.am.ActivityRecord.getStackLocked(ActivityRecord.java:1332)
06-05 21:21:48.142 W/ActivityManager( 1630): 	at com.android.server.am.ActivityManagerService.getActivityStackId(ActivityManagerService.java:9817)
06-05 21:21:48.142 W/ActivityManager( 1630): 	at android.app.ActivityManagerNative.onTransact(ActivityManagerNative.java:2856)
06-05 21:21:48.142 W/ActivityManager( 1630): 	at com.android.server.am.ActivityManagerService.onTransact(ActivityManagerService.java:2757)
06-05 21:21:48.142 W/ActivityManager( 1630): 	at android.os.Binder.execTransact(Binder.java:565)
06-05 21:21:48.148 D/VehicleStatisticsActivity(10269): Checking recalculation ...
06-05 21:21:48.149 D/VehicleStatisticsActivity(10269): Recalculation not necessary.
06-05 21:21:48.161 W/ActivityManager( 1630): Bad activity token: android.os.BinderProxy@f8b1380
06-05 21:21:48.161 W/ActivityManager( 1630): java.lang.ClassCastException: android.os.BinderProxy cannot be cast to com.android.server.am.ActivityRecord$Token
06-05 21:21:48.161 W/ActivityManager( 1630): 	at com.android.server.am.ActivityRecord.forTokenLocked(ActivityRecord.java:586)
06-05 21:21:48.161 W/ActivityManager( 1630): 	at com.android.server.am.ActivityRecord.isInStackLocked(ActivityRecord.java:1327)
06-05 21:21:48.161 W/ActivityManager( 1630): 	at com.android.server.am.ActivityManagerService.getActivityOptions(ActivityManagerService.java:12559)
06-05 21:21:48.161 W/ActivityManager( 1630): 	at android.app.ActivityManagerNative.onTransact(ActivityManagerNative.java:1933)
06-05 21:21:48.161 W/ActivityManager( 1630): 	at com.android.server.am.ActivityManagerService.onTransact(ActivityManagerService.java:2757)
06-05 21:21:48.161 W/ActivityManager( 1630): 	at android.os.Binder.execTransact(Binder.java:565)
06-05 21:21:48.162 W/ActivityManager( 1630): Bad activity token: android.os.BinderProxy@f8b1380
06-05 21:21:48.162 W/ActivityManager( 1630): java.lang.ClassCastException: android.os.BinderProxy cannot be cast to com.android.server.am.ActivityRecord$Token
06-05 21:21:48.162 W/ActivityManager( 1630): 	at com.android.server.am.ActivityRecord.forTokenLocked(ActivityRecord.java:586)
06-05 21:21:48.162 W/ActivityManager( 1630): 	at com.android.server.am.ActivityRecord.isInStackLocked(ActivityRecord.java:1327)
06-05 21:21:48.162 W/ActivityManager( 1630): 	at com.android.server.am.ActivityManagerService.getActivityOptions(ActivityManagerService.java:12559)
06-05 21:21:48.162 W/ActivityManager( 1630): 	at android.app.ActivityManagerNative.onTransact(ActivityManagerNative.java:1933)
06-05 21:21:48.162 W/ActivityManager( 1630): 	at com.android.server.am.ActivityManagerService.onTransact(ActivityManagerService.java:2757)
06-05 21:21:48.162 W/ActivityManager( 1630): 	at android.os.Binder.execTransact(Binder.java:565)
06-05 21:21:48.163 D/VehicleStatisticsActivity(10269): Checking recalculation ...
06-05 21:21:48.164 D/VehicleStatisticsActivity(10269): Recalculation not necessary.
06-05 21:21:48.245 V/PhoneStatusBar( 1711): setLightsOn(true)
06-05 21:21:48.259 I/System.out(10269): URI: //map
06-05 21:21:48.259 I/System.out(10269): params: {json={"query":"android.widget.AbsListView index:0","operation":{"method_name":"query","arguments":[]}}
06-05 21:21:48.259 I/System.out(10269): }
06-05 21:21:48.266 I/art     (10269): Do partial code cache collection, code=30KB, data=29KB
06-05 21:21:48.266 I/art     (10269): After code cache collection, code=29KB, data=28KB
06-05 21:21:48.266 I/art     (10269): Increasing code cache capacity to 128KB
06-05 21:21:48.281 I/System.out(10269): URI: //map
06-05 21:21:48.281 I/System.out(10269): params: {json={"query":"android.widget.AbsListView index:0","operation":{"method_name":"query","arguments":[]}}
06-05 21:21:48.281 I/System.out(10269): }
06-05 21:21:48.300 I/System.out(10269): URI: //map
06-05 21:21:48.300 I/System.out(10269): params: {json={"query":"android.widget.AbsListView index:0","operation":{"method_name":"query","arguments":[]}}
06-05 21:21:48.300 I/System.out(10269): }
06-05 21:21:48.315 I/System.out(10269): URI: //map
06-05 21:21:48.315 I/System.out(10269): params: {json={"query":"android.widget.AbsListView index:0","operation":{"method_name":"query","arguments":["getFirstVisiblePosition"]}}
06-05 21:21:48.315 I/System.out(10269): }
06-05 21:21:48.331 I/System.out(10269): URI: //map
06-05 21:21:48.331 I/System.out(10269): params: {json={"query":"android.widget.AbsListView index:0","operation":{"method_name":"query","arguments":["getLastVisiblePosition"]}}
06-05 21:21:48.331 I/System.out(10269): }
06-05 21:21:48.348 I/System.out(10269): URI: //map
06-05 21:21:48.348 I/System.out(10269): params: {json={"query":"android.widget.AbsListView index:0","operation":{"method_name":"query","arguments":[{"method_name":"setSelection","arguments":[26]}]}}
06-05 21:21:48.348 I/System.out(10269): }
06-05 21:21:48.369 I/System.out(10269): URI: //map
06-05 21:21:48.369 I/System.out(10269): params: {json={"query":"* marked:'North'","operation":{"method_name":"query","arguments":[]}}
06-05 21:21:48.369 I/System.out(10269): }
06-05 21:21:48.442 W/ResourceType(10269): No package identifier when getting name for resource number 0x00000001
06-05 21:21:48.455 I/System.out(10269): URI: //gesture
06-05 21:21:48.455 I/System.out(10269): params: {json={"query_timeout":5.0,"gestures":[{"query_string":"* marked:'North'","touches":[{"x":50,"y":50,"offset_x":0,"offset_y":0,"wait":0.0,"time":0.2,"release":true,"query_string":null}]}]}
06-05 21:21:48.455 I/System.out(10269): }
06-05 21:21:48.459 W/ResourceType(10269): No package identifier when getting name for resource number 0x00000001
06-05 21:21:48.527 V/PhoneStatusBar( 1711): setLightsOn(true)
06-05 21:21:48.528 V/PhoneStatusBar( 1711): setLightsOn(true)
06-05 21:21:48.529 W/OpenGLRenderer( 2083): Incorrectly called buildLayer on View: ShortcutAndWidgetContainer, destroying layer...
06-05 21:21:48.544 I/WindowManager( 1630): Destroying surface Surface(name=com.android.launcher3/com.android.launcher3.Launcher) called by com.android.server.wm.WindowStateAnimator.destroySurface:2016 com.android.server.wm.WindowStateAnimator.destroySurfaceLocked:882 com.android.server.wm.WindowState.destroyOrSaveSurface:2100 com.android.server.wm.AppWindowToken.destroySurfaces:363 com.android.server.wm.AppWindowToken.notifyAppStopped:389 com.android.server.wm.WindowManagerService.notifyAppStopped:4463 com.android.server.am.ActivityStack.activityStoppedLocked:1252 com.android.server.am.ActivityManagerService.activityStopped:6903 
06-05 21:21:48.545 V/PhoneStatusBar( 1711): setLightsOn(true)
06-05 21:21:48.695 I/ActivityManager( 1630): START u0 {cmp=com.evancharlton.mileage/.charts.NorthChart (has extras)} from uid 10286 on display 0
06-05 21:21:48.696 V/PhoneStatusBar( 1711): setLightsOn(true)
06-05 21:21:48.696 V/PhoneStatusBar( 1711): setLightsOn(true)
06-05 21:21:48.705 I/System.out(10269): URI: //map
06-05 21:21:48.705 I/System.out(10269): params: {json={"query":"* {text CONTAINS[c] 'Farthest north fillup'}","operation":{"method_name":"query","arguments":[]}}
06-05 21:21:48.705 I/System.out(10269): }
06-05 21:21:48.748 I/calabash(10269): newActivity1
06-05 21:21:48.752 W/aiCharts(10269): License file is invalid or missing. 
06-05 21:21:48.752 W/aiCharts(10269): Please place proper license.lic to /assets folder.
06-05 21:21:48.765 V/PhoneStatusBar( 1711): setLightsOn(true)
06-05 21:21:48.795 V/PhoneStatusBar( 1711): setLightsOn(true)
06-05 21:21:48.811 V/PhoneStatusBar( 1711): setLightsOn(true)
06-05 21:21:48.815 I/WindowManager( 1630): Destroying surface Surface(name=Creating chart…) called by com.android.server.wm.WindowStateAnimator.destroySurface:2016 com.android.server.wm.WindowStateAnimator.destroySurfaceLocked:882 com.android.server.wm.WindowState.removeLocked:1456 com.android.server.wm.WindowManagerService.removeWindowInnerLocked:2484 com.android.server.wm.WindowManagerService.removeWindowLocked:2442 com.android.server.wm.WindowManagerService.removeWindowLocked:2311 com.android.server.wm.WindowManagerService.removeWindow:2306 com.android.server.wm.Session.remove:202 
06-05 21:21:48.825 D/gralloc_ranchu( 1347): gralloc_alloc: Creating ashmem region of size 9023488
06-05 21:21:48.828 V/PhoneStatusBar( 1711): setLightsOn(true)
06-05 21:21:48.866 I/ActivityManager( 1630): Displayed com.evancharlton.mileage/.charts.NorthChart: +120ms
06-05 21:21:48.878 V/PhoneStatusBar( 1711): setLightsOn(true)
06-05 21:21:48.897 W/NotificationService( 1630): Object died trying to hide notification android.app.ITransientNotification$Stub$Proxy@87093dc in package com.evancharlton.mileage
06-05 21:21:48.911 V/PhoneStatusBar( 1711): setLightsOn(true)
06-05 21:21:48.929 V/PhoneStatusBar( 1711): setLightsOn(true)
06-05 21:21:49.081 I/System.out(10269): URI: //map
06-05 21:21:49.081 I/System.out(10269): params: {json={"query":"* {text CONTAINS[c] 'Farthest north fillup'}","operation":{"method_name":"query","arguments":[]}}
06-05 21:21:49.081 I/System.out(10269): }
06-05 21:21:49.095 I/System.out(10269): URI: //
06-05 21:21:49.095 I/System.out(10269): params: {json={"command":"press_key","arguments":["KEYCODE_BACK"]}
06-05 21:21:49.095 I/System.out(10269): }
06-05 21:21:49.095 I/System.out(10269): header: {content-type=application/json;charset=utf-8, date=Sat, 06 Jun 2020 02:21:49 GMT, accept=*/*, host=127.0.0.1:34777, content-length=52, user-agent=HTTPClient/1.0 (2.8.3, ruby 2.5.1 (2018-03-29))}
06-05 21:21:49.095 I/System.out(10269): params: {json={"command":"press_key","arguments":["KEYCODE_BACK"]}
06-05 21:21:49.095 I/System.out(10269): }
06-05 21:21:49.095 I/System.out(10269): ProP json = {"command":"press_key","arguments":["KEYCODE_BACK"]}
06-05 21:21:49.095 I/System.out(10269): files: {}
06-05 21:21:49.095 I/System.out(10269): command: {"command":"press_key","arguments":["KEYCODE_BACK"]}
06-05 21:21:49.096 I/InstrumentationBackend(10269): Got command:'Command:'Line:null,press_key', arguments:'[KEYCODE_BACK]'
06-05 21:21:49.098 V/PhoneStatusBar( 1711): setLightsOn(true)
06-05 21:21:49.100 V/PhoneStatusBar( 1711): setLightsOn(true)
06-05 21:21:49.102 I/art     (10269): Do partial code cache collection, code=60KB, data=62KB
06-05 21:21:49.102 I/System.out(10269): result:{"bonusInformation":[],"message":"","success":true}
06-05 21:21:49.102 I/art     (10269): After code cache collection, code=59KB, data=61KB
06-05 21:21:49.102 I/art     (10269): Increasing code cache capacity to 256KB
06-05 21:21:49.103 D/VehicleStatisticsActivity(10269): Checking recalculation ...
06-05 21:21:49.103 D/VehicleStatisticsActivity(10269): Recalculation not necessary.
06-05 21:21:49.104 I/System.out(10269): URI: //map
06-05 21:21:49.104 I/System.out(10269): params: {json={"query":"* {text CONTAINS[c] 'Statistics'}","operation":{"method_name":"query","arguments":[]}}
06-05 21:21:49.104 I/System.out(10269): }
06-05 21:21:49.111 V/PhoneStatusBar( 1711): setLightsOn(true)
06-05 21:21:49.112 D/WindowManager( 1630): relayoutVisibleWindow: Window{474a28b u0 com.evancharlton.mileage/com.evancharlton.mileage.Mileage EXITING} mAnimatingExit=true, mRemoveOnExit=false, mDestroying=false
06-05 21:21:49.128 V/PhoneStatusBar( 1711): setLightsOn(true)
06-05 21:21:49.140 D/gralloc_ranchu( 1347): gralloc_alloc: Creating ashmem region of size 9023488
06-05 21:21:49.144 V/PhoneStatusBar( 1711): setLightsOn(true)
06-05 21:21:49.177 V/PhoneStatusBar( 1711): setLightsOn(true)
