--------- beginning of main
06-05 21:21:41.661 V/PhoneStatusBar( 1711): setLightsOn(true)
06-05 21:21:41.714 D/gralloc_ranchu( 1347): gralloc_alloc: Creating ashmem region of size 3145728
06-05 21:21:41.719 E/EGL_emulation( 1347): tid 1347: eglCreateSyncKHR(1901): error 0x3004 (EGL_BAD_ATTRIBUTE)
--------- beginning of system
06-05 21:21:41.733 W/ActivityManager( 1630): Finishing task with all activities already finished
06-05 21:21:41.733 W/ActivityManager( 1630): Duplicate finish request for ActivityRecord{71f8881 u0 com.evancharlton.mileage/.Mileage t7506 f}
06-05 21:21:41.733 W/ActivityManager( 1630): Finishing task with all activities already finished
06-05 21:21:41.733 W/ActivityManager( 1630): Duplicate finish request for ActivityRecord{71f8881 u0 com.evancharlton.mileage/.Mileage t7506 f}
06-05 21:21:41.733 W/ActivityManager( 1630): Finishing task with all activities already finished
06-05 21:21:41.733 W/ActivityManager( 1630): Duplicate finish request for ActivityRecord{71f8881 u0 com.evancharlton.mileage/.Mileage t7506 f}
06-05 21:21:41.734 W/ActivityManager( 1630): Finishing task with all activities already finished
06-05 21:21:41.734 W/ActivityManager( 1630): Duplicate finish request for ActivityRecord{71f8881 u0 com.evancharlton.mileage/.Mileage t7506 f}
06-05 21:21:41.734 W/ActivityManager( 1630): Finishing task with all activities already finished
06-05 21:21:41.734 W/ActivityManager( 1630): Duplicate finish request for ActivityRecord{71f8881 u0 com.evancharlton.mileage/.Mileage t7506 f}
06-05 21:21:41.734 W/ActivityManager( 1630): Finishing task with all activities already finished
06-05 21:21:41.734 W/ActivityManager( 1630): Duplicate finish request for ActivityRecord{1aeb47 u0 com.evancharlton.mileage/.charts.MaximumVolumeChart t7506 f}
06-05 21:21:41.734 W/ActivityManager( 1630): Finishing task with all activities already finished
06-05 21:21:41.734 W/ActivityManager( 1630): Duplicate finish request for ActivityRecord{1aeb47 u0 com.evancharlton.mileage/.charts.MaximumVolumeChart t7506 f}
06-05 21:21:41.734 W/ActivityManager( 1630): Finishing task with all activities already finished
06-05 21:21:41.734 W/ActivityManager( 1630): Duplicate finish request for ActivityRecord{71f8881 u0 com.evancharlton.mileage/.Mileage t7506 f}
06-05 21:21:41.734 W/ActivityManager( 1630): Finishing task with all activities already finished
06-05 21:21:41.734 W/ActivityManager( 1630): Duplicate finish request for ActivityRecord{71f8881 u0 com.evancharlton.mileage/.Mileage t7506 f}
06-05 21:21:41.779 D/EGL_emulation( 2083): eglMakeCurrent: 0xb0f85240: ver 2 0 (tinfo 0xb0f832d0)
06-05 21:21:41.795 D/EGL_emulation( 1711): eglMakeCurrent: 0xb0f853c0: ver 2 0 (tinfo 0xb0f833e0)
06-05 21:21:41.797 D/EGL_emulation( 1711): eglMakeCurrent: 0xb0f853c0: ver 2 0 (tinfo 0xb0f833e0)
06-05 21:21:41.817 D/AndroidRuntime(10077): >>>>>> START com.android.internal.os.RuntimeInit uid 2000 <<<<<<
06-05 21:21:41.818 D/AndroidRuntime(10077): CheckJNI is ON
06-05 21:21:41.828 D/EGL_emulation( 1711): eglMakeCurrent: 0xb0f853c0: ver 2 0 (tinfo 0xb0f833e0)
06-05 21:21:41.829 D/EGL_emulation( 1711): eglMakeCurrent: 0xb0f853c0: ver 2 0 (tinfo 0xb0f833e0)
06-05 21:21:41.831 W/art     (10077): Unexpected CPU variant for X86 using defaults: x86
06-05 21:21:41.833 D/ICU     (10077): No timezone override file found: /data/misc/zoneinfo/current/icu/icu_tzdata.dat
06-05 21:21:41.841 E/memtrack(10077): Couldn't load memtrack module (No such file or directory)
06-05 21:21:41.841 E/android.os.Debug(10077): failed to load memtrack module: -2
06-05 21:21:41.841 I/Radio-JNI(10077): register_android_hardware_Radio DONE
06-05 21:21:41.844 D/EGL_emulation( 1711): eglMakeCurrent: 0xb0f853c0: ver 2 0 (tinfo 0xb0f833e0)
06-05 21:21:41.846 D/EGL_emulation( 1711): eglMakeCurrent: 0xb0f853c0: ver 2 0 (tinfo 0xb0f833e0)
06-05 21:21:41.846 D/AndroidRuntime(10077): Calling main entry com.android.commands.am.Am
06-05 21:21:41.847 I/ActivityManager( 1630): Force stopping com.evancharlton.mileage appid=10286 user=0: start instr
06-05 21:21:41.847 I/ActivityManager( 1630): Killing 10025:com.evancharlton.mileage/u0a286 (adj 0): stop com.evancharlton.mileage
06-05 21:21:41.848 D/ActivityManager( 1630): cleanUpApplicationRecord -- 10025
06-05 21:21:41.848 I/WindowManager( 1630): Destroying surface Surface(name=com.evancharlton.mileage/com.evancharlton.mileage.charts.MaximumVolumeChart) called by com.android.server.wm.WindowStateAnimator.destroySurface:2016 com.android.server.wm.WindowStateAnimator.destroySurfaceLocked:882 com.android.server.wm.WindowState.removeLocked:1456 com.android.server.wm.WindowManagerService.removeWindowInnerLocked:2484 com.android.server.wm.WindowManagerService.removeWindowLocked:2442 com.android.server.wm.WindowManagerService.removeWindowLocked:2311 com.android.server.wm.AppWindowToken.removeAllWindows:530 com.android.server.wm.AppWindowToken.removeAppFromTaskLocked:326 
06-05 21:21:41.850 W/ActivityManager( 1630): Crash of app com.evancharlton.mileage running instrumentation ComponentInfo{com.evancharlton.mileage.test/sh.calaba.instrumentationbackend.CalabashInstrumentationTestRunner}
06-05 21:21:41.850 I/ActivityManager( 1630): Force stopping com.evancharlton.mileage appid=10286 user=0: finished inst
06-05 21:21:41.853 I/art     (10087): Not late-enabling -Xcheck:jni (already on)
06-05 21:21:41.853 W/art     (10087): Unexpected CPU variant for X86 using defaults: x86
06-05 21:21:41.861 I/ActivityManager( 1630): Start proc 10087:com.evancharlton.mileage/u0a286 for added application com.evancharlton.mileage
06-05 21:21:41.861 D/AndroidRuntime(10077): Shutting down VM
06-05 21:21:41.862 D/EGL_emulation( 1711): eglMakeCurrent: 0xb0f853c0: ver 2 0 (tinfo 0xb0f833e0)
06-05 21:21:41.864 D/EGL_emulation( 1711): eglMakeCurrent: 0xb0f853c0: ver 2 0 (tinfo 0xb0f833e0)
06-05 21:21:41.867 W/System  (10087): ClassLoader referenced unknown path: /data/app/com.evancharlton.mileage.test-1/lib/x86
06-05 21:21:41.867 W/System  (10087): ClassLoader referenced unknown path: /data/app/com.evancharlton.mileage-1/lib/x86
06-05 21:21:41.870 W/System  (10087): ClassLoader referenced unknown path: 
06-05 21:21:41.874 I/System.out(10087): Main activity name automatically set to: com.evancharlton.mileage.Mileage
06-05 21:21:41.874 I/System.out(10087): Calabash did not load Mono. This is only a problem if you are trying to test a Mono application
06-05 21:21:41.874 I/calabash(10087): Test server port: 7102
06-05 21:21:41.875 I/InstrumentationBackend(10087): Added:'GetPreferences', with key:'get_preferences'
06-05 21:21:41.877 D/EGL_emulation( 1711): eglMakeCurrent: 0xb0f853c0: ver 2 0 (tinfo 0xb0f833e0)
06-05 21:21:41.880 D/EGL_emulation( 1711): eglMakeCurrent: 0xb0f853c0: ver 2 0 (tinfo 0xb0f833e0)
06-05 21:21:41.880 I/InstrumentationBackend(10087): Added:'SetPreferences', with key:'set_preferences'
06-05 21:21:41.881 I/InstrumentationBackend(10087): Added:'ClearPreferences', with key:'clear_preferences'
06-05 21:21:41.881 I/InstrumentationBackend(10087): Added:'PressElement', with key:'press_l10n_element'
06-05 21:21:41.881 I/InstrumentationBackend(10087): Added:'WaitForElement', with key:'wait_for_l10n_element'
06-05 21:21:41.881 I/InstrumentationBackend(10087): Added:'NullAction', with key:'nullAction'
06-05 21:21:41.881 I/InstrumentationBackend(10087): Added:'PressKey', with key:'press_key'
06-05 21:21:41.881 I/InstrumentationBackend(10087): Added:'SetActivityOrientation', with key:'set_activity_orientation'
06-05 21:21:41.881 I/InstrumentationBackend(10087): Added:'GetActivityOrientation', with key:'get_activity_orientation'
06-05 21:21:41.881 I/InstrumentationBackend(10087): Added:'FakeGPSLocation', with key:'set_gps_coordinates'
06-05 21:21:41.881 I/InstrumentationBackend(10087): Added:'SetPropertyByCssSelector', with key:'set_property_by_css_selector'
06-05 21:21:41.882 I/InstrumentationBackend(10087): Added:'GetUrl', with key:'get_url'
06-05 21:21:41.882 I/InstrumentationBackend(10087): Added:'ScrollTo', with key:'scroll_to'
06-05 21:21:41.882 I/InstrumentationBackend(10087): Added:'GetLoadProgress', with key:'get_load_progress'
06-05 21:21:41.883 I/InstrumentationBackend(10087): Added:'DumpHtml', with key:'dump_html'
06-05 21:21:41.883 I/InstrumentationBackend(10087): Added:'DumpBodyHtml', with key:'dump_body_html'
06-05 21:21:41.883 I/InstrumentationBackend(10087): Added:'EnterTextByCssSelector', with key:'enter_text_by_selector'
06-05 21:21:41.883 I/InstrumentationBackend(10087): Added:'AndroidSDKVersion', with key:'android_sdk_version'
06-05 21:21:41.883 I/InstrumentationBackend(10087): Added:'Version', with key:'version'
06-05 21:21:41.883 I/InstrumentationBackend(10087): Added:'Drag', with key:'drag'
06-05 21:21:41.883 I/InstrumentationBackend(10087): Added:'TouchCoordinates', with key:'touch_coordinate'
06-05 21:21:41.883 I/InstrumentationBackend(10087): Added:'LongPressCoordinate', with key:'long_press_coordinate'
06-05 21:21:41.884 I/InstrumentationBackend(10087): Added:'DragCoordinates', with key:'drag_coordinates'
06-05 21:21:41.884 I/InstrumentationBackend(10087): Added:'ResumeApplication', with key:'resume_application'
06-05 21:21:41.884 I/InstrumentationBackend(10087): Added:'Swipe', with key:'swipe'
06-05 21:21:41.884 I/InstrumentationBackend(10087): Added:'DoubleTapCoordinate', with key:'double_tap_coordinate'
06-05 21:21:41.884 I/InstrumentationBackend(10087): Added:'ClickOnScreen', with key:'click_on_screen'
06-05 21:21:41.884 I/InstrumentationBackend(10087): Added:'GetActivityName', with key:'get_activity_name'
06-05 21:21:41.884 I/InstrumentationBackend(10087): Added:'ScrollToView', with key:'scroll_to_view'
06-05 21:21:41.884 I/InstrumentationBackend(10087): Added:'ViewConfiguration', with key:'view_configuration'
06-05 21:21:41.884 I/InstrumentationBackend(10087): Added:'IsCurrentActivityFocused', with key:'is_current_activity_focused'
06-05 21:21:41.884 I/InstrumentationBackend(10087): Added:'SendTcp', with key:'send_tcp'
06-05 21:21:41.884 I/InstrumentationBackend(10087): Added:'DpToDevicePixel', with key:'dp_to_device_pixel'
06-05 21:21:41.885 I/InstrumentationBackend(10087): Added:'KeyboardEnterText', with key:'keyboard_enter_text'
06-05 21:21:41.885 I/InstrumentationBackend(10087): Added:'DeleteSurroundingText', with key:'delete_surrounding_text'
06-05 21:21:41.885 I/InstrumentationBackend(10087): Added:'SetComposingRegion', with key:'set_composing_region'
06-05 21:21:41.885 I/InstrumentationBackend(10087): Added:'SetSelection', with key:'set_selection'
06-05 21:21:41.885 I/InstrumentationBackend(10087): Added:'KeyboardKeyEvent', with key:'keyboard_key_event'
06-05 21:21:41.885 I/InstrumentationBackend(10087): Added:'PressUserActionButton', with key:'press_user_action_button'
06-05 21:21:41.885 I/InstrumentationBackend(10087): Added:'HideSoftKeyboard', with key:'hide_soft_keyboard'
06-05 21:21:41.885 I/InstrumentationBackend(10087): Added:'ListActions', with key:'list_actions'
06-05 21:21:41.886 I/calabash(10087): Instantiating http server at 7102
06-05 21:21:41.886 I/System.out(10087): HTTP Daemon listening on: 7102
06-05 21:21:41.894 D/EGL_emulation( 1711): eglMakeCurrent: 0xb0f853c0: ver 2 0 (tinfo 0xb0f833e0)
06-05 21:21:41.897 D/EGL_emulation( 1711): eglMakeCurrent: 0xb0f853c0: ver 2 0 (tinfo 0xb0f833e0)
06-05 21:21:41.908 I/WindowManager( 1630): WIN DEATH: Window{2e0bd44 u0 com.evancharlton.mileage/com.evancharlton.mileage.Mileage EXITING}
06-05 21:21:41.921 D/EGL_emulation( 1711): eglMakeCurrent: 0xb0f853c0: ver 2 0 (tinfo 0xb0f833e0)
06-05 21:21:41.924 D/EGL_emulation( 1711): eglMakeCurrent: 0xb0f853c0: ver 2 0 (tinfo 0xb0f833e0)
06-05 21:21:41.927 D/EGL_emulation( 1711): eglMakeCurrent: 0xb0f853c0: ver 2 0 (tinfo 0xb0f833e0)
06-05 21:21:41.928 D/EGL_emulation( 1711): eglMakeCurrent: 0xb0f853c0: ver 2 0 (tinfo 0xb0f833e0)
06-05 21:21:41.944 D/EGL_emulation( 1711): eglMakeCurrent: 0xb0f853c0: ver 2 0 (tinfo 0xb0f833e0)
06-05 21:21:41.946 D/EGL_emulation( 1711): eglMakeCurrent: 0xb0f853c0: ver 2 0 (tinfo 0xb0f833e0)
06-05 21:21:41.961 D/EGL_emulation( 1711): eglMakeCurrent: 0xb0f853c0: ver 2 0 (tinfo 0xb0f833e0)
06-05 21:21:41.963 D/EGL_emulation( 1711): eglMakeCurrent: 0xb0f853c0: ver 2 0 (tinfo 0xb0f833e0)
06-05 21:21:41.972 I/System.out(10087): URI: //ping
06-05 21:21:41.972 I/System.out(10087): params: {json={}
06-05 21:21:41.972 I/System.out(10087): }
06-05 21:21:41.975 I/System.out(10087): URI: //ping
06-05 21:21:41.975 I/System.out(10087): params: {json={}
06-05 21:21:41.975 I/System.out(10087): }
06-05 21:21:41.977 I/System.out(10087): URI: //ready
06-05 21:21:41.977 I/System.out(10087): params: {json={}
06-05 21:21:41.977 I/System.out(10087): }
06-05 21:21:41.977 D/EGL_emulation( 1711): eglMakeCurrent: 0xb0f853c0: ver 2 0 (tinfo 0xb0f833e0)
06-05 21:21:41.979 I/System.out(10087): URI: //
06-05 21:21:41.979 I/System.out(10087): params: {json={"command":"version","arguments":[]}
06-05 21:21:41.979 I/System.out(10087): }
06-05 21:21:41.979 I/System.out(10087): header: {content-type=application/json;charset=utf-8, date=Sat, 06 Jun 2020 02:21:42 GMT, accept=*/*, host=127.0.0.1:34777, content-length=36, user-agent=HTTPClient/1.0 (2.8.3, ruby 2.5.1 (2018-03-29))}
06-05 21:21:41.979 I/System.out(10087): params: {json={"command":"version","arguments":[]}
06-05 21:21:41.979 I/System.out(10087): }
06-05 21:21:41.980 I/System.out(10087): ProP json = {"command":"version","arguments":[]}
06-05 21:21:41.980 I/System.out(10087): files: {}
06-05 21:21:41.980 I/System.out(10087): command: {"command":"version","arguments":[]}
06-05 21:21:41.983 I/InstrumentationBackend(10087): Got command:'Command:'Line:null,version', arguments:'[]'
06-05 21:21:41.991 I/System.out(10087): result:{"bonusInformation":[],"message":"0.9.8","success":true}
06-05 21:21:41.994 D/EGL_emulation( 1711): eglMakeCurrent: 0xb0f853c0: ver 2 0 (tinfo 0xb0f833e0)
06-05 21:21:41.995 I/System.out(10087): URI: //start-application
06-05 21:21:41.995 I/System.out(10087): params: {json={"intent":null}
06-05 21:21:41.995 I/System.out(10087): }
06-05 21:21:41.996 D/EGL_emulation( 1711): eglMakeCurrent: 0xb0f853c0: ver 2 0 (tinfo 0xb0f833e0)
06-05 21:21:42.006 I/ActivityManager( 1630): START u0 {act=android.intent.action.MAIN cat=[android.intent.category.LAUNCHER] flg=0x10200000 cmp=com.evancharlton.mileage/.Mileage} from uid 10286 on display 0
06-05 21:21:42.011 D/EGL_emulation( 1711): eglMakeCurrent: 0xb0f853c0: ver 2 0 (tinfo 0xb0f833e0)
06-05 21:21:42.013 D/EGL_emulation( 1711): eglMakeCurrent: 0xb0f853c0: ver 2 0 (tinfo 0xb0f833e0)
06-05 21:21:42.017 I/calabash(10087): newActivity1
06-05 21:21:42.028 D/EGL_emulation( 1711): eglMakeCurrent: 0xb0f853c0: ver 2 0 (tinfo 0xb0f833e0)
06-05 21:21:42.028 D/gralloc_ranchu( 1347): gralloc_alloc: Creating ashmem region of size 9023488
06-05 21:21:42.029 I/calabash(10087): newActivity1
06-05 21:21:42.031 W/ActivityManager( 1630): Bad activity token: android.os.BinderProxy@78c0d40
06-05 21:21:42.031 W/ActivityManager( 1630): java.lang.ClassCastException: android.os.BinderProxy cannot be cast to com.android.server.am.ActivityRecord$Token
06-05 21:21:42.031 W/ActivityManager( 1630): 	at com.android.server.am.ActivityRecord.forTokenLocked(ActivityRecord.java:586)
06-05 21:21:42.031 W/ActivityManager( 1630): 	at com.android.server.am.ActivityRecord.isInStackLocked(ActivityRecord.java:1327)
06-05 21:21:42.031 W/ActivityManager( 1630): 	at com.android.server.am.ActivityRecord.getStackLocked(ActivityRecord.java:1332)
06-05 21:21:42.031 W/ActivityManager( 1630): 	at com.android.server.am.ActivityManagerService.getActivityDisplayId(ActivityManagerService.java:9806)
06-05 21:21:42.031 W/ActivityManager( 1630): 	at android.app.ActivityManagerNative.onTransact(ActivityManagerNative.java:2566)
06-05 21:21:42.031 W/ActivityManager( 1630): 	at com.android.server.am.ActivityManagerService.onTransact(ActivityManagerService.java:2757)
06-05 21:21:42.031 W/ActivityManager( 1630): 	at android.os.Binder.execTransact(Binder.java:565)
06-05 21:21:42.032 W/ActivityManager( 1630): Bad activity token: android.os.BinderProxy@78c0d40
06-05 21:21:42.032 W/ActivityManager( 1630): java.lang.ClassCastException: android.os.BinderProxy cannot be cast to com.android.server.am.ActivityRecord$Token
06-05 21:21:42.032 W/ActivityManager( 1630): 	at com.android.server.am.ActivityRecord.forTokenLocked(ActivityRecord.java:586)
06-05 21:21:42.032 W/ActivityManager( 1630): 	at com.android.server.am.ActivityRecord.isInStackLocked(ActivityRecord.java:1327)
06-05 21:21:42.032 W/ActivityManager( 1630): 	at com.android.server.am.ActivityManagerService.setTaskDescription(ActivityManagerService.java:9358)
06-05 21:21:42.032 W/ActivityManager( 1630): 	at android.app.ActivityManagerNative.onTransact(ActivityManagerNative.java:2639)
06-05 21:21:42.032 W/ActivityManager( 1630): 	at com.android.server.am.ActivityManagerService.onTransact(ActivityManagerService.java:2757)
06-05 21:21:42.032 W/ActivityManager( 1630): 	at android.os.Binder.execTransact(Binder.java:565)
06-05 21:21:42.032 W/ActivityManager( 1630): Bad activity token: android.os.BinderProxy@78c0d40
06-05 21:21:42.032 W/ActivityManager( 1630): java.lang.ClassCastException: android.os.BinderProxy cannot be cast to com.android.server.am.ActivityRecord$Token
06-05 21:21:42.032 W/ActivityManager( 1630): 	at com.android.server.am.ActivityRecord.forTokenLocked(ActivityRecord.java:586)
06-05 21:21:42.032 W/ActivityManager( 1630): 	at com.android.server.am.ActivityRecord.isInStackLocked(ActivityRecord.java:1327)
06-05 21:21:42.032 W/ActivityManager( 1630): 	at com.android.server.am.ActivityRecord.getStackLocked(ActivityRecord.java:1332)
06-05 21:21:42.032 W/ActivityManager( 1630): 	at com.android.server.am.ActivityManagerService.getActivityStackId(ActivityManagerService.java:9817)
06-05 21:21:42.032 W/ActivityManager( 1630): 	at android.app.ActivityManagerNative.onTransact(ActivityManagerNative.java:2856)
06-05 21:21:42.032 W/ActivityManager( 1630): 	at com.android.server.am.ActivityManagerService.onTransact(ActivityManagerService.java:2757)
06-05 21:21:42.032 W/ActivityManager( 1630): 	at android.os.Binder.execTransact(Binder.java:565)
06-05 21:21:42.055 W/ActivityManager( 1630): Bad activity token: android.os.BinderProxy@78c0d40
06-05 21:21:42.055 W/ActivityManager( 1630): java.lang.ClassCastException: android.os.BinderProxy cannot be cast to com.android.server.am.ActivityRecord$Token
06-05 21:21:42.055 W/ActivityManager( 1630): 	at com.android.server.am.ActivityRecord.forTokenLocked(ActivityRecord.java:586)
06-05 21:21:42.055 W/ActivityManager( 1630): 	at com.android.server.am.ActivityRecord.isInStackLocked(ActivityRecord.java:1327)
06-05 21:21:42.055 W/ActivityManager( 1630): 	at com.android.server.am.ActivityManagerService.getActivityOptions(ActivityManagerService.java:12559)
06-05 21:21:42.055 W/ActivityManager( 1630): 	at android.app.ActivityManagerNative.onTransact(ActivityManagerNative.java:1933)
06-05 21:21:42.055 W/ActivityManager( 1630): 	at com.android.server.am.ActivityManagerService.onTransact(ActivityManagerService.java:2757)
06-05 21:21:42.055 W/ActivityManager( 1630): 	at android.os.Binder.execTransact(Binder.java:565)
06-05 21:21:42.055 W/ActivityManager( 1630): Bad activity token: android.os.BinderProxy@78c0d40
06-05 21:21:42.055 W/ActivityManager( 1630): java.lang.ClassCastException: android.os.BinderProxy cannot be cast to com.android.server.am.ActivityRecord$Token
06-05 21:21:42.055 W/ActivityManager( 1630): 	at com.android.server.am.ActivityRecord.forTokenLocked(ActivityRecord.java:586)
06-05 21:21:42.055 W/ActivityManager( 1630): 	at com.android.server.am.ActivityRecord.isInStackLocked(ActivityRecord.java:1327)
06-05 21:21:42.055 W/ActivityManager( 1630): 	at com.android.server.am.ActivityManagerService.getActivityOptions(ActivityManagerService.java:12559)
06-05 21:21:42.055 W/ActivityManager( 1630): 	at android.app.ActivityManagerNative.onTransact(ActivityManagerNative.java:1933)
06-05 21:21:42.055 W/ActivityManager( 1630): 	at com.android.server.am.ActivityManagerService.onTransact(ActivityManagerService.java:2757)
06-05 21:21:42.055 W/ActivityManager( 1630): 	at android.os.Binder.execTransact(Binder.java:565)
06-05 21:21:42.075 V/PhoneStatusBar( 1711): setLightsOn(true)
06-05 21:21:42.078 D/EGL_emulation( 2083): eglMakeCurrent: 0xb0f85240: ver 2 0 (tinfo 0xb0f832d0)
06-05 21:21:42.094 D/gralloc_ranchu( 1347): gralloc_alloc: Creating ashmem region of size 9023488
06-05 21:21:42.094 D/EGL_emulation( 1711): eglMakeCurrent: 0xb0f853c0: ver 2 0 (tinfo 0xb0f833e0)
06-05 21:21:42.100 D/        (10087): HostConnection::get() New Host Connection established 0xa4a94380, tid 10087
06-05 21:21:42.100 D/EGL_emulation( 1711): eglMakeCurrent: 0xb0f853c0: ver 2 0 (tinfo 0xb0f833e0)
06-05 21:21:42.150 D/EGL_emulation( 1711): eglMakeCurrent: 0xb0f853c0: ver 2 0 (tinfo 0xb0f833e0)
06-05 21:21:42.151 V/PhoneStatusBar( 1711): setLightsOn(true)
06-05 21:21:42.153 D/EGL_emulation( 1711): eglMakeCurrent: 0xb0f853c0: ver 2 0 (tinfo 0xb0f833e0)
06-05 21:21:42.155 D/EGL_emulation( 1711): eglMakeCurrent: 0xb0f853c0: ver 2 0 (tinfo 0xb0f833e0)
06-05 21:21:42.165 D/EGL_emulation( 1711): eglMakeCurrent: 0xb0f853c0: ver 2 0 (tinfo 0xb0f833e0)
06-05 21:21:42.167 D/EGL_emulation( 1711): eglMakeCurrent: 0xb0f853c0: ver 2 0 (tinfo 0xb0f833e0)
06-05 21:21:42.178 D/EGL_emulation( 1711): eglMakeCurrent: 0xb0f853c0: ver 2 0 (tinfo 0xb0f833e0)
06-05 21:21:42.179 D/EGL_emulation( 1711): eglMakeCurrent: 0xb0f853c0: ver 2 0 (tinfo 0xb0f833e0)
06-05 21:21:42.194 D/EGL_emulation( 1711): eglMakeCurrent: 0xb0f853c0: ver 2 0 (tinfo 0xb0f833e0)
06-05 21:21:42.196 D/EGL_emulation( 1711): eglMakeCurrent: 0xb0f853c0: ver 2 0 (tinfo 0xb0f833e0)
06-05 21:21:42.211 D/EGL_emulation( 1711): eglMakeCurrent: 0xb0f853c0: ver 2 0 (tinfo 0xb0f833e0)
06-05 21:21:42.212 D/gralloc_ranchu( 1347): gralloc_alloc: Creating ashmem region of size 9023488
06-05 21:21:42.213 I/WindowManager( 1630): Destroying surface Surface(name=com.evancharlton.mileage/com.evancharlton.mileage.Mileage) called by com.android.server.wm.WindowStateAnimator.destroySurface:2016 com.android.server.wm.WindowStateAnimator.destroySurfaceLocked:882 com.android.server.wm.WindowState.removeLocked:1456 com.android.server.wm.WindowManagerService.removeWindowInnerLocked:2484 com.android.server.wm.AppWindowToken.destroySurfaces:365 com.android.server.wm.WindowStateAnimator.finishExit:565 com.android.server.wm.AppWindowAnimator.stepAnimationLocked:427 com.android.server.wm.WindowAnimator.updateAppWindowsLocked:196 
06-05 21:21:42.224 D/EGL_emulation( 1711): eglMakeCurrent: 0xb0f853c0: ver 2 0 (tinfo 0xb0f833e0)
06-05 21:21:42.228 D/EGL_emulation( 1711): eglMakeCurrent: 0xb0f853c0: ver 2 0 (tinfo 0xb0f833e0)
06-05 21:21:42.228 I/ActivityManager( 1630): Displayed com.evancharlton.mileage/.Mileage: +218ms
06-05 21:21:42.239 D/EGL_emulation( 1711): eglMakeCurrent: 0xb0f853c0: ver 2 0 (tinfo 0xb0f833e0)
06-05 21:21:42.245 D/EGL_emulation( 1711): eglMakeCurrent: 0xb0f853c0: ver 2 0 (tinfo 0xb0f833e0)
06-05 21:21:42.247 D/EGL_emulation( 1711): eglMakeCurrent: 0xb0f853c0: ver 2 0 (tinfo 0xb0f833e0)
06-05 21:21:42.261 D/EGL_emulation( 1711): eglMakeCurrent: 0xb0f853c0: ver 2 0 (tinfo 0xb0f833e0)
06-05 21:21:42.263 D/EGL_emulation( 1711): eglMakeCurrent: 0xb0f853c0: ver 2 0 (tinfo 0xb0f833e0)
06-05 21:21:42.263 V/PhoneStatusBar( 1711): setLightsOn(true)
06-05 21:21:42.268 I/System.out(10087): URI: //map
06-05 21:21:42.268 I/System.out(10087): params: {json={"query":"* marked:'Statistics'","operation":{"method_name":"query","arguments":[]}}
06-05 21:21:42.268 I/System.out(10087): }
06-05 21:21:42.278 D/EGL_emulation( 1711): eglMakeCurrent: 0xb0f853c0: ver 2 0 (tinfo 0xb0f833e0)
06-05 21:21:42.279 D/EGL_emulation( 1711): eglMakeCurrent: 0xb0f853c0: ver 2 0 (tinfo 0xb0f833e0)
06-05 21:21:42.281 W/ResourceType(10087): No package identifier when getting name for resource number 0x00000001
06-05 21:21:42.294 D/EGL_emulation( 1711): eglMakeCurrent: 0xb0f853c0: ver 2 0 (tinfo 0xb0f833e0)
06-05 21:21:42.295 I/System.out(10087): URI: //gesture
06-05 21:21:42.295 I/System.out(10087): params: {json={"query_timeout":5.0,"gestures":[{"query_string":"* marked:'Statistics'","touches":[{"x":50,"y":50,"offset_x":0,"offset_y":0,"wait":0.0,"time":0.2,"release":true,"query_string":null}]}]}
06-05 21:21:42.295 I/System.out(10087): }
06-05 21:21:42.300 W/ResourceType(10087): No package identifier when getting name for resource number 0x00000001
06-05 21:21:42.427 I/WindowManager( 1630): Destroying surface Surface(name=Starting com.evancharlton.mileage) called by com.android.server.wm.WindowStateAnimator.destroySurface:2016 com.android.server.wm.WindowStateAnimator.destroySurfaceLocked:882 com.android.server.wm.WindowState.destroyOrSaveSurface:2100 com.android.server.wm.AppWindowToken.destroySurfaces:363 com.android.server.wm.WindowStateAnimator.finishExit:565 com.android.server.wm.WindowStateAnimator.stepAnimationLocked:491 com.android.server.wm.WindowAnimator.updateWindowsLocked:303 com.android.server.wm.WindowAnimator.animateLocked:704 
06-05 21:21:42.429 V/PhoneStatusBar( 1711): setLightsOn(true)
06-05 21:21:42.461 V/PhoneStatusBar( 1711): setLightsOn(true)
06-05 21:21:42.529 V/PhoneStatusBar( 1711): setLightsOn(true)
06-05 21:21:42.537 I/calabash(10087): newActivity1
06-05 21:21:42.565 I/System.out(10087): URI: //map
06-05 21:21:42.565 I/System.out(10087): params: {json={"query":"android.widget.ScrollView index:0","operation":{"method_name":"query","arguments":[]}}
06-05 21:21:42.566 I/System.out(10087): }
06-05 21:21:42.577 W/ActivityManager( 1630): Bad activity token: android.os.BinderProxy@5d5a6e
06-05 21:21:42.577 W/ActivityManager( 1630): java.lang.ClassCastException: android.os.BinderProxy cannot be cast to com.android.server.am.ActivityRecord$Token
06-05 21:21:42.577 W/ActivityManager( 1630): 	at com.android.server.am.ActivityRecord.forTokenLocked(ActivityRecord.java:586)
06-05 21:21:42.577 W/ActivityManager( 1630): 	at com.android.server.am.ActivityRecord.isInStackLocked(ActivityRecord.java:1327)
06-05 21:21:42.577 W/ActivityManager( 1630): 	at com.android.server.am.ActivityRecord.getStackLocked(ActivityRecord.java:1332)
06-05 21:21:42.577 W/ActivityManager( 1630): 	at com.android.server.am.ActivityManagerService.getActivityDisplayId(ActivityManagerService.java:9806)
06-05 21:21:42.577 W/ActivityManager( 1630): 	at android.app.ActivityManagerNative.onTransact(ActivityManagerNative.java:2566)
06-05 21:21:42.577 W/ActivityManager( 1630): 	at com.android.server.am.ActivityManagerService.onTransact(ActivityManagerService.java:2757)
06-05 21:21:42.577 W/ActivityManager( 1630): 	at android.os.Binder.execTransact(Binder.java:565)
06-05 21:21:42.578 W/ActivityManager( 1630): Bad activity token: android.os.BinderProxy@5d5a6e
06-05 21:21:42.578 W/ActivityManager( 1630): java.lang.ClassCastException: android.os.BinderProxy cannot be cast to com.android.server.am.ActivityRecord$Token
06-05 21:21:42.578 W/ActivityManager( 1630): 	at com.android.server.am.ActivityRecord.forTokenLocked(ActivityRecord.java:586)
06-05 21:21:42.578 W/ActivityManager( 1630): 	at com.android.server.am.ActivityRecord.isInStackLocked(ActivityRecord.java:1327)
06-05 21:21:42.578 W/ActivityManager( 1630): 	at com.android.server.am.ActivityManagerService.setTaskDescription(ActivityManagerService.java:9358)
06-05 21:21:42.578 W/ActivityManager( 1630): 	at android.app.ActivityManagerNative.onTransact(ActivityManagerNative.java:2639)
06-05 21:21:42.578 W/ActivityManager( 1630): 	at com.android.server.am.ActivityManagerService.onTransact(ActivityManagerService.java:2757)
06-05 21:21:42.578 W/ActivityManager( 1630): 	at android.os.Binder.execTransact(Binder.java:565)
06-05 21:21:42.579 W/ActivityManager( 1630): Bad activity token: android.os.BinderProxy@5d5a6e
06-05 21:21:42.579 W/ActivityManager( 1630): java.lang.ClassCastException: android.os.BinderProxy cannot be cast to com.android.server.am.ActivityRecord$Token
06-05 21:21:42.579 W/ActivityManager( 1630): 	at com.android.server.am.ActivityRecord.forTokenLocked(ActivityRecord.java:586)
06-05 21:21:42.579 W/ActivityManager( 1630): 	at com.android.server.am.ActivityRecord.isInStackLocked(ActivityRecord.java:1327)
06-05 21:21:42.579 W/ActivityManager( 1630): 	at com.android.server.am.ActivityRecord.getStackLocked(ActivityRecord.java:1332)
06-05 21:21:42.579 W/ActivityManager( 1630): 	at com.android.server.am.ActivityManagerService.getActivityStackId(ActivityManagerService.java:9817)
06-05 21:21:42.579 W/ActivityManager( 1630): 	at android.app.ActivityManagerNative.onTransact(ActivityManagerNative.java:2856)
06-05 21:21:42.579 W/ActivityManager( 1630): 	at com.android.server.am.ActivityManagerService.onTransact(ActivityManagerService.java:2757)
06-05 21:21:42.579 W/ActivityManager( 1630): 	at android.os.Binder.execTransact(Binder.java:565)
06-05 21:21:42.586 D/VehicleStatisticsActivity(10087): Checking recalculation ...
06-05 21:21:42.587 D/VehicleStatisticsActivity(10087): Recalculation not necessary.
06-05 21:21:42.594 W/ActivityManager( 1630): Bad activity token: android.os.BinderProxy@5d5a6e
06-05 21:21:42.594 W/ActivityManager( 1630): java.lang.ClassCastException: android.os.BinderProxy cannot be cast to com.android.server.am.ActivityRecord$Token
06-05 21:21:42.594 W/ActivityManager( 1630): 	at com.android.server.am.ActivityRecord.forTokenLocked(ActivityRecord.java:586)
06-05 21:21:42.594 W/ActivityManager( 1630): 	at com.android.server.am.ActivityRecord.isInStackLocked(ActivityRecord.java:1327)
06-05 21:21:42.594 W/ActivityManager( 1630): 	at com.android.server.am.ActivityManagerService.getActivityOptions(ActivityManagerService.java:12559)
06-05 21:21:42.594 W/ActivityManager( 1630): 	at android.app.ActivityManagerNative.onTransact(ActivityManagerNative.java:1933)
06-05 21:21:42.594 W/ActivityManager( 1630): 	at com.android.server.am.ActivityManagerService.onTransact(ActivityManagerService.java:2757)
06-05 21:21:42.594 W/ActivityManager( 1630): 	at android.os.Binder.execTransact(Binder.java:565)
06-05 21:21:42.595 W/ActivityManager( 1630): Bad activity token: android.os.BinderProxy@5d5a6e
06-05 21:21:42.595 W/ActivityManager( 1630): java.lang.ClassCastException: android.os.BinderProxy cannot be cast to com.android.server.am.ActivityRecord$Token
06-05 21:21:42.595 W/ActivityManager( 1630): 	at com.android.server.am.ActivityRecord.forTokenLocked(ActivityRecord.java:586)
06-05 21:21:42.595 W/ActivityManager( 1630): 	at com.android.server.am.ActivityRecord.isInStackLocked(ActivityRecord.java:1327)
06-05 21:21:42.595 W/ActivityManager( 1630): 	at com.android.server.am.ActivityManagerService.getActivityOptions(ActivityManagerService.java:12559)
06-05 21:21:42.595 W/ActivityManager( 1630): 	at android.app.ActivityManagerNative.onTransact(ActivityManagerNative.java:1933)
06-05 21:21:42.595 W/ActivityManager( 1630): 	at com.android.server.am.ActivityManagerService.onTransact(ActivityManagerService.java:2757)
06-05 21:21:42.595 W/ActivityManager( 1630): 	at android.os.Binder.execTransact(Binder.java:565)
06-05 21:21:42.597 D/VehicleStatisticsActivity(10087): Checking recalculation ...
06-05 21:21:42.598 D/VehicleStatisticsActivity(10087): Recalculation not necessary.
06-05 21:21:42.683 I/System.out(10087): URI: //map
06-05 21:21:42.684 I/System.out(10087): params: {json={"query":"android.widget.AbsListView index:0","operation":{"method_name":"query","arguments":[]}}
06-05 21:21:42.684 I/System.out(10087): }
06-05 21:21:42.689 I/art     (10087): Do partial code cache collection, code=30KB, data=29KB
06-05 21:21:42.690 I/art     (10087): After code cache collection, code=29KB, data=28KB
06-05 21:21:42.690 I/art     (10087): Increasing code cache capacity to 128KB
06-05 21:21:42.703 I/System.out(10087): URI: //map
06-05 21:21:42.703 I/System.out(10087): params: {json={"query":"android.widget.AbsListView index:0","operation":{"method_name":"query","arguments":[]}}
06-05 21:21:42.703 I/System.out(10087): }
06-05 21:21:42.722 I/System.out(10087): URI: //map
06-05 21:21:42.722 I/System.out(10087): params: {json={"query":"android.widget.AbsListView index:0","operation":{"method_name":"query","arguments":[]}}
06-05 21:21:42.722 I/System.out(10087): }
06-05 21:21:42.735 I/System.out(10087): URI: //map
06-05 21:21:42.735 I/System.out(10087): params: {json={"query":"android.widget.AbsListView index:0","operation":{"method_name":"query","arguments":["getFirstVisiblePosition"]}}
06-05 21:21:42.735 I/System.out(10087): }
06-05 21:21:42.745 I/System.out(10087): URI: //map
06-05 21:21:42.745 I/System.out(10087): params: {json={"query":"android.widget.AbsListView index:0","operation":{"method_name":"query","arguments":["getLastVisiblePosition"]}}
06-05 21:21:42.745 I/System.out(10087): }
06-05 21:21:42.761 I/System.out(10087): URI: //map
06-05 21:21:42.761 I/System.out(10087): params: {json={"query":"android.widget.AbsListView index:0","operation":{"method_name":"query","arguments":[{"method_name":"setSelection","arguments":[26]}]}}
06-05 21:21:42.761 I/System.out(10087): }
06-05 21:21:42.777 I/System.out(10087): URI: //map
06-05 21:21:42.777 I/System.out(10087): params: {json={"query":"* marked:'Average fillup'","operation":{"method_name":"query","arguments":[]}}
06-05 21:21:42.777 I/System.out(10087): }
06-05 21:21:42.811 W/OpenGLRenderer( 2083): Incorrectly called buildLayer on View: ShortcutAndWidgetContainer, destroying layer...
06-05 21:21:42.811 V/PhoneStatusBar( 1711): setLightsOn(true)
06-05 21:21:42.812 V/PhoneStatusBar( 1711): setLightsOn(true)
06-05 21:21:42.829 I/WindowManager( 1630): Destroying surface Surface(name=com.android.launcher3/com.android.launcher3.Launcher) called by com.android.server.wm.WindowStateAnimator.destroySurface:2016 com.android.server.wm.WindowStateAnimator.destroySurfaceLocked:882 com.android.server.wm.WindowState.destroyOrSaveSurface:2100 com.android.server.wm.AppWindowToken.destroySurfaces:363 com.android.server.wm.AppWindowToken.notifyAppStopped:389 com.android.server.wm.WindowManagerService.notifyAppStopped:4463 com.android.server.am.ActivityStack.activityStoppedLocked:1252 com.android.server.am.ActivityManagerService.activityStopped:6903 
06-05 21:21:42.830 V/PhoneStatusBar( 1711): setLightsOn(true)
06-05 21:21:42.840 W/ResourceType(10087): No package identifier when getting name for resource number 0x00000001
06-05 21:21:42.850 I/System.out(10087): URI: //gesture
06-05 21:21:42.850 I/System.out(10087): params: {json={"query_timeout":5.0,"gestures":[{"query_string":"* marked:'Average fillup'","touches":[{"x":50,"y":50,"offset_x":0,"offset_y":0,"wait":0.0,"time":0.2,"release":true,"query_string":null}]}]}
06-05 21:21:42.850 I/System.out(10087): }
06-05 21:21:42.854 W/ResourceType(10087): No package identifier when getting name for resource number 0x00000001
06-05 21:21:43.078 I/ActivityManager( 1630): START u0 {cmp=com.evancharlton.mileage/.charts.AverageVolumeChart (has extras)} from uid 10286 on display 0
06-05 21:21:43.079 V/PhoneStatusBar( 1711): setLightsOn(true)
06-05 21:21:43.080 V/PhoneStatusBar( 1711): setLightsOn(true)
06-05 21:21:43.092 I/System.out(10087): URI: //map
06-05 21:21:43.092 I/System.out(10087): params: {json={"query":"* {text CONTAINS[c] 'Average fillup size'}","operation":{"method_name":"query","arguments":[]}}
06-05 21:21:43.092 I/System.out(10087): }
06-05 21:21:43.139 I/calabash(10087): newActivity1
06-05 21:21:43.142 W/aiCharts(10087): License file is invalid or missing. 
06-05 21:21:43.142 W/aiCharts(10087): Please place proper license.lic to /assets folder.
06-05 21:21:43.155 V/PhoneStatusBar( 1711): setLightsOn(true)
06-05 21:21:43.177 V/PhoneStatusBar( 1711): setLightsOn(true)
06-05 21:21:43.184 I/WindowManager( 1630): Destroying surface Surface(name=Creating chart…) called by com.android.server.wm.WindowStateAnimator.destroySurface:2016 com.android.server.wm.WindowStateAnimator.destroySurfaceLocked:882 com.android.server.wm.WindowState.removeLocked:1456 com.android.server.wm.WindowManagerService.removeWindowInnerLocked:2484 com.android.server.wm.WindowManagerService.removeWindowLocked:2442 com.android.server.wm.WindowManagerService.removeWindowLocked:2311 com.android.server.wm.WindowManagerService.removeWindow:2306 com.android.server.wm.Session.remove:202 
06-05 21:21:43.188 D/gralloc_ranchu( 1347): gralloc_alloc: Creating ashmem region of size 9023488
06-05 21:21:43.194 V/PhoneStatusBar( 1711): setLightsOn(true)
06-05 21:21:43.218 I/ActivityManager( 1630): Displayed com.evancharlton.mileage/.charts.AverageVolumeChart: +82ms
06-05 21:21:43.228 V/PhoneStatusBar( 1711): setLightsOn(true)
06-05 21:21:43.262 V/PhoneStatusBar( 1711): setLightsOn(true)
06-05 21:21:43.278 V/PhoneStatusBar( 1711): setLightsOn(true)
06-05 21:21:43.461 V/PhoneStatusBar( 1711): setLightsOn(true)
06-05 21:21:43.470 I/System.out(10087): URI: //map
06-05 21:21:43.470 I/System.out(10087): params: {json={"query":"* {text CONTAINS[c] 'Average fillup size'}","operation":{"method_name":"query","arguments":[]}}
06-05 21:21:43.470 I/System.out(10087): }
06-05 21:21:43.485 I/System.out(10087): URI: //
06-05 21:21:43.485 I/System.out(10087): params: {json={"command":"press_key","arguments":["KEYCODE_BACK"]}
06-05 21:21:43.485 I/System.out(10087): }
06-05 21:21:43.485 I/System.out(10087): header: {content-type=application/json;charset=utf-8, date=Sat, 06 Jun 2020 02:21:44 GMT, accept=*/*, host=127.0.0.1:34777, content-length=52, user-agent=HTTPClient/1.0 (2.8.3, ruby 2.5.1 (2018-03-29))}
06-05 21:21:43.485 I/System.out(10087): params: {json={"command":"press_key","arguments":["KEYCODE_BACK"]}
06-05 21:21:43.485 I/System.out(10087): }
06-05 21:21:43.485 I/System.out(10087): ProP json = {"command":"press_key","arguments":["KEYCODE_BACK"]}
06-05 21:21:43.485 I/System.out(10087): files: {}
06-05 21:21:43.485 I/System.out(10087): command: {"command":"press_key","arguments":["KEYCODE_BACK"]}
06-05 21:21:43.486 I/InstrumentationBackend(10087): Got command:'Command:'Line:null,press_key', arguments:'[KEYCODE_BACK]'
06-05 21:21:43.488 V/PhoneStatusBar( 1711): setLightsOn(true)
06-05 21:21:43.489 V/PhoneStatusBar( 1711): setLightsOn(true)
06-05 21:21:43.491 I/art     (10087): Do partial code cache collection, code=60KB, data=62KB
06-05 21:21:43.491 I/art     (10087): After code cache collection, code=59KB, data=61KB
06-05 21:21:43.491 I/art     (10087): Increasing code cache capacity to 256KB
06-05 21:21:43.492 I/System.out(10087): result:{"bonusInformation":[],"message":"","success":true}
06-05 21:21:43.493 D/VehicleStatisticsActivity(10087): Checking recalculation ...
06-05 21:21:43.494 V/PhoneStatusBar( 1711): setLightsOn(true)
06-05 21:21:43.494 D/VehicleStatisticsActivity(10087): Recalculation not necessary.
06-05 21:21:43.495 I/System.out(10087): URI: //map
06-05 21:21:43.495 I/System.out(10087): params: {json={"query":"* {text CONTAINS[c] 'Statistics'}","operation":{"method_name":"query","arguments":[]}}
06-05 21:21:43.495 I/System.out(10087): }
06-05 21:21:43.511 D/gralloc_ranchu( 1347): gralloc_alloc: Creating ashmem region of size 9023488
06-05 21:21:43.512 V/PhoneStatusBar( 1711): setLightsOn(true)
06-05 21:21:43.528 V/PhoneStatusBar( 1711): setLightsOn(true)
06-05 21:21:43.561 V/PhoneStatusBar( 1711): setLightsOn(true)
