--------- beginning of system
06-05 18:34:44.448 W/ActivityManager( 1629): Finishing task with all activities already finished
06-05 18:34:44.448 W/ActivityManager( 1629): Duplicate finish request for ActivityRecord{ccf133e u0 com.evancharlton.mileage/.Mileage t3090 f}
--------- beginning of main
06-05 18:34:44.454 V/PhoneStatusBar( 1711): setLightsOn(true)
06-05 18:34:44.456 D/gralloc_ranchu( 1346): gralloc_alloc: Creating ashmem region of size 3145728
06-05 18:34:44.460 E/EGL_emulation( 1346): tid 1346: eglCreateSyncKHR(1901): error 0x3004 (EGL_BAD_ATTRIBUTE)
06-05 18:34:44.469 W/ActivityManager( 1629): Finishing task with all activities already finished
06-05 18:34:44.469 W/ActivityManager( 1629): Duplicate finish request for ActivityRecord{ccf133e u0 com.evancharlton.mileage/.Mileage t3090 f}
06-05 18:34:44.470 W/ActivityManager( 1629): Finishing task with all activities already finished
06-05 18:34:44.470 W/ActivityManager( 1629): Duplicate finish request for ActivityRecord{ccf133e u0 com.evancharlton.mileage/.Mileage t3090 f}
06-05 18:34:44.470 W/ActivityManager( 1629): Finishing task with all activities already finished
06-05 18:34:44.470 W/ActivityManager( 1629): Duplicate finish request for ActivityRecord{ccf133e u0 com.evancharlton.mileage/.Mileage t3090 f}
06-05 18:34:44.470 W/ActivityManager( 1629): Finishing task with all activities already finished
06-05 18:34:44.470 W/ActivityManager( 1629): Duplicate finish request for ActivityRecord{ccf133e u0 com.evancharlton.mileage/.Mileage t3090 f}
06-05 18:34:44.471 W/ActivityManager( 1629): Finishing task with all activities already finished
06-05 18:34:44.471 W/ActivityManager( 1629): Duplicate finish request for ActivityRecord{dbab4c u0 com.evancharlton.mileage/.charts.MaximumPriceChart t3090 f}
06-05 18:34:44.471 W/ActivityManager( 1629): Finishing task with all activities already finished
06-05 18:34:44.471 W/ActivityManager( 1629): Duplicate finish request for ActivityRecord{dbab4c u0 com.evancharlton.mileage/.charts.MaximumPriceChart t3090 f}
06-05 18:34:44.471 W/ActivityManager( 1629): Finishing task with all activities already finished
06-05 18:34:44.471 W/ActivityManager( 1629): Duplicate finish request for ActivityRecord{ccf133e u0 com.evancharlton.mileage/.Mileage t3090 f}
06-05 18:34:44.471 W/ActivityManager( 1629): Finishing task with all activities already finished
06-05 18:34:44.471 W/ActivityManager( 1629): Duplicate finish request for ActivityRecord{ccf133e u0 com.evancharlton.mileage/.Mileage t3090 f}
06-05 18:34:44.505 D/EGL_emulation( 2150): eglMakeCurrent: 0xb4f852a0: ver 2 0 (tinfo 0xb4f832e0)
06-05 18:34:44.506 D/EGL_emulation( 1711): eglMakeCurrent: 0xa5b6bd80: ver 2 0 (tinfo 0xb1367140)
06-05 18:34:44.522 D/EGL_emulation( 1711): eglMakeCurrent: 0xa5b6bd80: ver 2 0 (tinfo 0xb1367140)
06-05 18:34:44.539 D/EGL_emulation( 1711): eglMakeCurrent: 0xa5b6bd80: ver 2 0 (tinfo 0xb1367140)
06-05 18:34:44.554 D/EGL_emulation( 1711): eglMakeCurrent: 0xa5b6bd80: ver 2 0 (tinfo 0xb1367140)
06-05 18:34:44.556 D/EGL_emulation( 1711): eglMakeCurrent: 0xa5b6bd80: ver 2 0 (tinfo 0xb1367140)
06-05 18:34:44.571 D/EGL_emulation( 1711): eglMakeCurrent: 0xa5b6bd80: ver 2 0 (tinfo 0xb1367140)
06-05 18:34:44.572 D/EGL_emulation( 1711): eglMakeCurrent: 0xa5b6bd80: ver 2 0 (tinfo 0xb1367140)
06-05 18:34:44.579 D/AndroidRuntime( 6339): >>>>>> START com.android.internal.os.RuntimeInit uid 2000 <<<<<<
06-05 18:34:44.580 D/AndroidRuntime( 6339): CheckJNI is ON
06-05 18:34:44.587 D/EGL_emulation( 1711): eglMakeCurrent: 0xa5b6bd80: ver 2 0 (tinfo 0xb1367140)
06-05 18:34:44.589 D/EGL_emulation( 1711): eglMakeCurrent: 0xa5b6bd80: ver 2 0 (tinfo 0xb1367140)
06-05 18:34:44.591 W/art     ( 6339): Unexpected CPU variant for X86 using defaults: x86
06-05 18:34:44.593 D/ICU     ( 6339): No timezone override file found: /data/misc/zoneinfo/current/icu/icu_tzdata.dat
06-05 18:34:44.601 E/memtrack( 6339): Couldn't load memtrack module (No such file or directory)
06-05 18:34:44.601 E/android.os.Debug( 6339): failed to load memtrack module: -2
06-05 18:34:44.601 I/Radio-JNI( 6339): register_android_hardware_Radio DONE
06-05 18:34:44.604 D/EGL_emulation( 1711): eglMakeCurrent: 0xa5b6bd80: ver 2 0 (tinfo 0xb1367140)
06-05 18:34:44.605 D/EGL_emulation( 1711): eglMakeCurrent: 0xa5b6bd80: ver 2 0 (tinfo 0xb1367140)
06-05 18:34:44.606 D/AndroidRuntime( 6339): Calling main entry com.android.commands.am.Am
06-05 18:34:44.607 I/ActivityManager( 1629): Force stopping com.evancharlton.mileage appid=10160 user=0: start instr
06-05 18:34:44.607 I/ActivityManager( 1629): Killing 6287:com.evancharlton.mileage/u0a160 (adj 0): stop com.evancharlton.mileage
06-05 18:34:44.607 D/ActivityManager( 1629): cleanUpApplicationRecord -- 6287
06-05 18:34:44.607 I/WindowManager( 1629): Destroying surface Surface(name=com.evancharlton.mileage/com.evancharlton.mileage.charts.MaximumPriceChart) called by com.android.server.wm.WindowStateAnimator.destroySurface:2016 com.android.server.wm.WindowStateAnimator.destroySurfaceLocked:882 com.android.server.wm.WindowState.removeLocked:1456 com.android.server.wm.WindowManagerService.removeWindowInnerLocked:2484 com.android.server.wm.WindowManagerService.removeWindowLocked:2442 com.android.server.wm.WindowManagerService.removeWindowLocked:2311 com.android.server.wm.AppWindowToken.removeAllWindows:530 com.android.server.wm.AppWindowToken.removeAppFromTaskLocked:326 
06-05 18:34:44.608 W/ActivityManager( 1629): Crash of app com.evancharlton.mileage running instrumentation ComponentInfo{com.evancharlton.mileage.test/sh.calaba.instrumentationbackend.CalabashInstrumentationTestRunner}
06-05 18:34:44.608 I/ActivityManager( 1629): Force stopping com.evancharlton.mileage appid=10160 user=0: finished inst
06-05 18:34:44.609 W/InputDispatcher( 1629): channel '9ee4b25 com.evancharlton.mileage/com.evancharlton.mileage.Mileage (server)' ~ Consumer closed input channel or an error occurred.  events=0x9
06-05 18:34:44.609 E/InputDispatcher( 1629): channel '9ee4b25 com.evancharlton.mileage/com.evancharlton.mileage.Mileage (server)' ~ Channel is unrecoverably broken and will be disposed!
06-05 18:34:44.609 I/WindowManager( 1629): WIN DEATH: Window{9ee4b25 u0 com.evancharlton.mileage/com.evancharlton.mileage.Mileage EXITING}
06-05 18:34:44.609 W/InputDispatcher( 1629): Attempted to unregister already unregistered input channel '9ee4b25 com.evancharlton.mileage/com.evancharlton.mileage.Mileage (server)'
06-05 18:34:44.612 I/art     ( 6349): Not late-enabling -Xcheck:jni (already on)
06-05 18:34:44.612 W/art     ( 6349): Unexpected CPU variant for X86 using defaults: x86
06-05 18:34:44.619 I/ActivityManager( 1629): Start proc 6349:com.evancharlton.mileage/u0a160 for added application com.evancharlton.mileage
06-05 18:34:44.619 D/AndroidRuntime( 6339): Shutting down VM
06-05 18:34:44.621 D/EGL_emulation( 1711): eglMakeCurrent: 0xa5b6bd80: ver 2 0 (tinfo 0xb1367140)
06-05 18:34:44.625 W/System  ( 6349): ClassLoader referenced unknown path: /data/app/com.evancharlton.mileage.test-1/lib/x86
06-05 18:34:44.625 W/System  ( 6349): ClassLoader referenced unknown path: /data/app/com.evancharlton.mileage-1/lib/x86
06-05 18:34:44.625 D/EGL_emulation( 1711): eglMakeCurrent: 0xa5b6bd80: ver 2 0 (tinfo 0xb1367140)
06-05 18:34:44.627 W/System  ( 6349): ClassLoader referenced unknown path: 
06-05 18:34:44.631 I/System.out( 6349): Main activity name automatically set to: com.evancharlton.mileage.Mileage
06-05 18:34:44.632 I/System.out( 6349): Calabash did not load Mono. This is only a problem if you are trying to test a Mono application
06-05 18:34:44.632 I/calabash( 6349): Test server port: 7102
06-05 18:34:44.633 I/InstrumentationBackend( 6349): Added:'GetPreferences', with key:'get_preferences'
06-05 18:34:44.637 D/EGL_emulation( 1711): eglMakeCurrent: 0xa5b6bd80: ver 2 0 (tinfo 0xb1367140)
06-05 18:34:44.638 I/InstrumentationBackend( 6349): Added:'SetPreferences', with key:'set_preferences'
06-05 18:34:44.638 I/InstrumentationBackend( 6349): Added:'ClearPreferences', with key:'clear_preferences'
06-05 18:34:44.638 I/InstrumentationBackend( 6349): Added:'PressElement', with key:'press_l10n_element'
06-05 18:34:44.638 I/InstrumentationBackend( 6349): Added:'WaitForElement', with key:'wait_for_l10n_element'
06-05 18:34:44.638 I/InstrumentationBackend( 6349): Added:'NullAction', with key:'nullAction'
06-05 18:34:44.638 I/InstrumentationBackend( 6349): Added:'PressKey', with key:'press_key'
06-05 18:34:44.638 I/InstrumentationBackend( 6349): Added:'SetActivityOrientation', with key:'set_activity_orientation'
06-05 18:34:44.638 I/InstrumentationBackend( 6349): Added:'GetActivityOrientation', with key:'get_activity_orientation'
06-05 18:34:44.638 I/InstrumentationBackend( 6349): Added:'FakeGPSLocation', with key:'set_gps_coordinates'
06-05 18:34:44.638 I/InstrumentationBackend( 6349): Added:'SetPropertyByCssSelector', with key:'set_property_by_css_selector'
06-05 18:34:44.638 I/InstrumentationBackend( 6349): Added:'GetUrl', with key:'get_url'
06-05 18:34:44.638 I/InstrumentationBackend( 6349): Added:'ScrollTo', with key:'scroll_to'
06-05 18:34:44.638 I/InstrumentationBackend( 6349): Added:'GetLoadProgress', with key:'get_load_progress'
06-05 18:34:44.638 I/InstrumentationBackend( 6349): Added:'DumpHtml', with key:'dump_html'
06-05 18:34:44.638 I/InstrumentationBackend( 6349): Added:'DumpBodyHtml', with key:'dump_body_html'
06-05 18:34:44.638 I/InstrumentationBackend( 6349): Added:'EnterTextByCssSelector', with key:'enter_text_by_selector'
06-05 18:34:44.639 D/EGL_emulation( 1711): eglMakeCurrent: 0xa5b6bd80: ver 2 0 (tinfo 0xb1367140)
06-05 18:34:44.639 I/InstrumentationBackend( 6349): Added:'AndroidSDKVersion', with key:'android_sdk_version'
06-05 18:34:44.639 I/InstrumentationBackend( 6349): Added:'Version', with key:'version'
06-05 18:34:44.639 I/InstrumentationBackend( 6349): Added:'Drag', with key:'drag'
06-05 18:34:44.639 I/InstrumentationBackend( 6349): Added:'TouchCoordinates', with key:'touch_coordinate'
06-05 18:34:44.639 I/InstrumentationBackend( 6349): Added:'LongPressCoordinate', with key:'long_press_coordinate'
06-05 18:34:44.639 I/InstrumentationBackend( 6349): Added:'DragCoordinates', with key:'drag_coordinates'
06-05 18:34:44.639 I/InstrumentationBackend( 6349): Added:'ResumeApplication', with key:'resume_application'
06-05 18:34:44.639 I/InstrumentationBackend( 6349): Added:'Swipe', with key:'swipe'
06-05 18:34:44.639 I/InstrumentationBackend( 6349): Added:'DoubleTapCoordinate', with key:'double_tap_coordinate'
06-05 18:34:44.639 I/InstrumentationBackend( 6349): Added:'ClickOnScreen', with key:'click_on_screen'
06-05 18:34:44.639 I/InstrumentationBackend( 6349): Added:'GetActivityName', with key:'get_activity_name'
06-05 18:34:44.639 I/InstrumentationBackend( 6349): Added:'ScrollToView', with key:'scroll_to_view'
06-05 18:34:44.639 I/InstrumentationBackend( 6349): Added:'ViewConfiguration', with key:'view_configuration'
06-05 18:34:44.640 I/InstrumentationBackend( 6349): Added:'IsCurrentActivityFocused', with key:'is_current_activity_focused'
06-05 18:34:44.640 I/InstrumentationBackend( 6349): Added:'SendTcp', with key:'send_tcp'
06-05 18:34:44.640 I/InstrumentationBackend( 6349): Added:'DpToDevicePixel', with key:'dp_to_device_pixel'
06-05 18:34:44.640 I/InstrumentationBackend( 6349): Added:'KeyboardEnterText', with key:'keyboard_enter_text'
06-05 18:34:44.640 I/InstrumentationBackend( 6349): Added:'DeleteSurroundingText', with key:'delete_surrounding_text'
06-05 18:34:44.640 I/InstrumentationBackend( 6349): Added:'SetComposingRegion', with key:'set_composing_region'
06-05 18:34:44.640 I/InstrumentationBackend( 6349): Added:'SetSelection', with key:'set_selection'
06-05 18:34:44.640 I/InstrumentationBackend( 6349): Added:'KeyboardKeyEvent', with key:'keyboard_key_event'
06-05 18:34:44.640 I/InstrumentationBackend( 6349): Added:'PressUserActionButton', with key:'press_user_action_button'
06-05 18:34:44.640 I/InstrumentationBackend( 6349): Added:'HideSoftKeyboard', with key:'hide_soft_keyboard'
06-05 18:34:44.640 I/InstrumentationBackend( 6349): Added:'ListActions', with key:'list_actions'
06-05 18:34:44.640 I/calabash( 6349): Instantiating http server at 7102
06-05 18:34:44.641 I/System.out( 6349): HTTP Daemon listening on: 7102
06-05 18:34:44.654 D/EGL_emulation( 1711): eglMakeCurrent: 0xa5b6bd80: ver 2 0 (tinfo 0xb1367140)
06-05 18:34:44.656 D/EGL_emulation( 1711): eglMakeCurrent: 0xa5b6bd80: ver 2 0 (tinfo 0xb1367140)
06-05 18:34:44.671 D/EGL_emulation( 1711): eglMakeCurrent: 0xa5b6bd80: ver 2 0 (tinfo 0xb1367140)
06-05 18:34:44.672 D/EGL_emulation( 1711): eglMakeCurrent: 0xa5b6bd80: ver 2 0 (tinfo 0xb1367140)
06-05 18:34:44.687 D/EGL_emulation( 1711): eglMakeCurrent: 0xa5b6bd80: ver 2 0 (tinfo 0xb1367140)
06-05 18:34:44.689 D/EGL_emulation( 1711): eglMakeCurrent: 0xa5b6bd80: ver 2 0 (tinfo 0xb1367140)
06-05 18:34:44.707 D/EGL_emulation( 1711): eglMakeCurrent: 0xa5b6bd80: ver 2 0 (tinfo 0xb1367140)
06-05 18:34:44.721 D/EGL_emulation( 1711): eglMakeCurrent: 0xa5b6bd80: ver 2 0 (tinfo 0xb1367140)
06-05 18:34:44.722 D/EGL_emulation( 1711): eglMakeCurrent: 0xa5b6bd80: ver 2 0 (tinfo 0xb1367140)
06-05 18:34:44.730 I/System.out( 6349): URI: //ping
06-05 18:34:44.730 I/System.out( 6349): params: {json={}
06-05 18:34:44.730 I/System.out( 6349): }
06-05 18:34:44.733 I/System.out( 6349): URI: //ping
06-05 18:34:44.733 I/System.out( 6349): params: {json={}
06-05 18:34:44.733 I/System.out( 6349): }
06-05 18:34:44.735 I/System.out( 6349): URI: //ready
06-05 18:34:44.735 I/System.out( 6349): params: {json={}
06-05 18:34:44.735 I/System.out( 6349): }
06-05 18:34:44.737 I/System.out( 6349): URI: //
06-05 18:34:44.737 I/System.out( 6349): params: {json={"command":"version","arguments":[]}
06-05 18:34:44.737 I/System.out( 6349): }
06-05 18:34:44.737 I/System.out( 6349): header: {content-type=application/json;charset=utf-8, date=Fri, 05 Jun 2020 23:34:45 GMT, accept=*/*, host=127.0.0.1:34783, content-length=36, user-agent=HTTPClient/1.0 (2.8.3, ruby 2.5.1 (2018-03-29))}
06-05 18:34:44.737 I/System.out( 6349): params: {json={"command":"version","arguments":[]}
06-05 18:34:44.737 I/System.out( 6349): }
06-05 18:34:44.737 I/System.out( 6349): ProP json = {"command":"version","arguments":[]}
06-05 18:34:44.737 I/System.out( 6349): files: {}
06-05 18:34:44.737 I/System.out( 6349): command: {"command":"version","arguments":[]}
06-05 18:34:44.737 D/EGL_emulation( 1711): eglMakeCurrent: 0xa5b6bd80: ver 2 0 (tinfo 0xb1367140)
06-05 18:34:44.739 D/EGL_emulation( 1711): eglMakeCurrent: 0xa5b6bd80: ver 2 0 (tinfo 0xb1367140)
06-05 18:34:44.740 I/InstrumentationBackend( 6349): Got command:'Command:'Line:null,version', arguments:'[]'
06-05 18:34:44.746 I/System.out( 6349): result:{"bonusInformation":[],"message":"0.9.8","success":true}
06-05 18:34:44.749 I/System.out( 6349): URI: //start-application
06-05 18:34:44.749 I/System.out( 6349): params: {json={"intent":null}
06-05 18:34:44.749 I/System.out( 6349): }
06-05 18:34:44.758 I/ActivityManager( 1629): START u0 {act=android.intent.action.MAIN cat=[android.intent.category.LAUNCHER] flg=0x10200000 cmp=com.evancharlton.mileage/.Mileage} from uid 10160 on display 0
06-05 18:34:44.766 I/calabash( 6349): newActivity1
06-05 18:34:44.777 I/calabash( 6349): newActivity1
06-05 18:34:44.779 W/ActivityManager( 1629): Bad activity token: android.os.BinderProxy@4baa2f1
06-05 18:34:44.779 W/ActivityManager( 1629): java.lang.ClassCastException: android.os.BinderProxy cannot be cast to com.android.server.am.ActivityRecord$Token
06-05 18:34:44.779 W/ActivityManager( 1629): 	at com.android.server.am.ActivityRecord.forTokenLocked(ActivityRecord.java:586)
06-05 18:34:44.779 W/ActivityManager( 1629): 	at com.android.server.am.ActivityRecord.isInStackLocked(ActivityRecord.java:1327)
06-05 18:34:44.779 W/ActivityManager( 1629): 	at com.android.server.am.ActivityRecord.getStackLocked(ActivityRecord.java:1332)
06-05 18:34:44.779 W/ActivityManager( 1629): 	at com.android.server.am.ActivityManagerService.getActivityDisplayId(ActivityManagerService.java:9806)
06-05 18:34:44.779 W/ActivityManager( 1629): 	at android.app.ActivityManagerNative.onTransact(ActivityManagerNative.java:2566)
06-05 18:34:44.779 W/ActivityManager( 1629): 	at com.android.server.am.ActivityManagerService.onTransact(ActivityManagerService.java:2757)
06-05 18:34:44.779 W/ActivityManager( 1629): 	at android.os.Binder.execTransact(Binder.java:565)
06-05 18:34:44.780 W/ActivityManager( 1629): Bad activity token: android.os.BinderProxy@4baa2f1
06-05 18:34:44.780 W/ActivityManager( 1629): java.lang.ClassCastException: android.os.BinderProxy cannot be cast to com.android.server.am.ActivityRecord$Token
06-05 18:34:44.780 W/ActivityManager( 1629): 	at com.android.server.am.ActivityRecord.forTokenLocked(ActivityRecord.java:586)
06-05 18:34:44.780 W/ActivityManager( 1629): 	at com.android.server.am.ActivityRecord.isInStackLocked(ActivityRecord.java:1327)
06-05 18:34:44.780 W/ActivityManager( 1629): 	at com.android.server.am.ActivityManagerService.setTaskDescription(ActivityManagerService.java:9358)
06-05 18:34:44.780 W/ActivityManager( 1629): 	at android.app.ActivityManagerNative.onTransact(ActivityManagerNative.java:2639)
06-05 18:34:44.780 W/ActivityManager( 1629): 	at com.android.server.am.ActivityManagerService.onTransact(ActivityManagerService.java:2757)
06-05 18:34:44.780 W/ActivityManager( 1629): 	at android.os.Binder.execTransact(Binder.java:565)
06-05 18:34:44.781 W/ActivityManager( 1629): Bad activity token: android.os.BinderProxy@4baa2f1
06-05 18:34:44.781 W/ActivityManager( 1629): java.lang.ClassCastException: android.os.BinderProxy cannot be cast to com.android.server.am.ActivityRecord$Token
06-05 18:34:44.781 W/ActivityManager( 1629): 	at com.android.server.am.ActivityRecord.forTokenLocked(ActivityRecord.java:586)
06-05 18:34:44.781 W/ActivityManager( 1629): 	at com.android.server.am.ActivityRecord.isInStackLocked(ActivityRecord.java:1327)
06-05 18:34:44.781 W/ActivityManager( 1629): 	at com.android.server.am.ActivityRecord.getStackLocked(ActivityRecord.java:1332)
06-05 18:34:44.781 W/ActivityManager( 1629): 	at com.android.server.am.ActivityManagerService.getActivityStackId(ActivityManagerService.java:9817)
06-05 18:34:44.781 W/ActivityManager( 1629): 	at android.app.ActivityManagerNative.onTransact(ActivityManagerNative.java:2856)
06-05 18:34:44.781 W/ActivityManager( 1629): 	at com.android.server.am.ActivityManagerService.onTransact(ActivityManagerService.java:2757)
06-05 18:34:44.781 W/ActivityManager( 1629): 	at android.os.Binder.execTransact(Binder.java:565)
06-05 18:34:44.788 D/gralloc_ranchu( 1346): gralloc_alloc: Creating ashmem region of size 9023488
06-05 18:34:44.809 W/ActivityManager( 1629): Bad activity token: android.os.BinderProxy@4baa2f1
06-05 18:34:44.809 W/ActivityManager( 1629): java.lang.ClassCastException: android.os.BinderProxy cannot be cast to com.android.server.am.ActivityRecord$Token
06-05 18:34:44.809 W/ActivityManager( 1629): 	at com.android.server.am.ActivityRecord.forTokenLocked(ActivityRecord.java:586)
06-05 18:34:44.809 W/ActivityManager( 1629): 	at com.android.server.am.ActivityRecord.isInStackLocked(ActivityRecord.java:1327)
06-05 18:34:44.809 W/ActivityManager( 1629): 	at com.android.server.am.ActivityManagerService.getActivityOptions(ActivityManagerService.java:12559)
06-05 18:34:44.809 W/ActivityManager( 1629): 	at android.app.ActivityManagerNative.onTransact(ActivityManagerNative.java:1933)
06-05 18:34:44.809 W/ActivityManager( 1629): 	at com.android.server.am.ActivityManagerService.onTransact(ActivityManagerService.java:2757)
06-05 18:34:44.809 W/ActivityManager( 1629): 	at android.os.Binder.execTransact(Binder.java:565)
06-05 18:34:44.810 W/ActivityManager( 1629): Bad activity token: android.os.BinderProxy@4baa2f1
06-05 18:34:44.810 W/ActivityManager( 1629): java.lang.ClassCastException: android.os.BinderProxy cannot be cast to com.android.server.am.ActivityRecord$Token
06-05 18:34:44.810 W/ActivityManager( 1629): 	at com.android.server.am.ActivityRecord.forTokenLocked(ActivityRecord.java:586)
06-05 18:34:44.810 W/ActivityManager( 1629): 	at com.android.server.am.ActivityRecord.isInStackLocked(ActivityRecord.java:1327)
06-05 18:34:44.810 W/ActivityManager( 1629): 	at com.android.server.am.ActivityManagerService.getActivityOptions(ActivityManagerService.java:12559)
06-05 18:34:44.810 W/ActivityManager( 1629): 	at android.app.ActivityManagerNative.onTransact(ActivityManagerNative.java:1933)
06-05 18:34:44.810 W/ActivityManager( 1629): 	at com.android.server.am.ActivityManagerService.onTransact(ActivityManagerService.java:2757)
06-05 18:34:44.810 W/ActivityManager( 1629): 	at android.os.Binder.execTransact(Binder.java:565)
06-05 18:34:44.835 V/PhoneStatusBar( 1711): setLightsOn(true)
06-05 18:34:44.838 D/EGL_emulation( 2150): eglMakeCurrent: 0xb4f852a0: ver 2 0 (tinfo 0xb4f832e0)
06-05 18:34:44.840 D/EGL_emulation( 1711): eglMakeCurrent: 0xa5b6bd80: ver 2 0 (tinfo 0xb1367140)
06-05 18:34:44.854 D/gralloc_ranchu( 1346): gralloc_alloc: Creating ashmem region of size 9023488
06-05 18:34:44.854 D/EGL_emulation( 1711): eglMakeCurrent: 0xa5b6bd80: ver 2 0 (tinfo 0xb1367140)
06-05 18:34:44.862 D/        ( 6349): HostConnection::get() New Host Connection established 0x98c27480, tid 6349
06-05 18:34:44.864 D/EGL_emulation( 1711): eglMakeCurrent: 0xa5b6bd80: ver 2 0 (tinfo 0xb1367140)
06-05 18:34:44.864 V/PhoneStatusBar( 1711): setLightsOn(true)
06-05 18:34:44.929 D/EGL_emulation( 1711): eglMakeCurrent: 0xa5b6bd80: ver 2 0 (tinfo 0xb1367140)
06-05 18:34:44.932 D/EGL_emulation( 1711): eglMakeCurrent: 0xa5b6bd80: ver 2 0 (tinfo 0xb1367140)
06-05 18:34:44.935 D/EGL_emulation( 1711): eglMakeCurrent: 0xa5b6bd80: ver 2 0 (tinfo 0xb1367140)
06-05 18:34:44.937 I/WindowManager( 1629): Destroying surface Surface(name=com.evancharlton.mileage/com.evancharlton.mileage.Mileage) called by com.android.server.wm.WindowStateAnimator.destroySurface:2016 com.android.server.wm.WindowStateAnimator.destroySurfaceLocked:882 com.android.server.wm.WindowState.removeLocked:1456 com.android.server.wm.WindowManagerService.removeWindowInnerLocked:2484 com.android.server.wm.AppWindowToken.destroySurfaces:365 com.android.server.wm.WindowStateAnimator.finishExit:565 com.android.server.wm.AppWindowAnimator.stepAnimationLocked:427 com.android.server.wm.WindowAnimator.updateAppWindowsLocked:196 
06-05 18:34:44.938 D/EGL_emulation( 1711): eglMakeCurrent: 0xa5b6bd80: ver 2 0 (tinfo 0xb1367140)
06-05 18:34:44.940 D/EGL_emulation( 1711): eglMakeCurrent: 0xa5b6bd80: ver 2 0 (tinfo 0xb1367140)
06-05 18:34:44.955 D/EGL_emulation( 1711): eglMakeCurrent: 0xa5b6bd80: ver 2 0 (tinfo 0xb1367140)
06-05 18:34:44.955 V/PhoneStatusBar( 1711): setLightsOn(true)
06-05 18:34:44.956 D/EGL_emulation( 1711): eglMakeCurrent: 0xa5b6bd80: ver 2 0 (tinfo 0xb1367140)
06-05 18:34:44.971 D/EGL_emulation( 1711): eglMakeCurrent: 0xa5b6bd80: ver 2 0 (tinfo 0xb1367140)
06-05 18:34:44.972 D/gralloc_ranchu( 1346): gralloc_alloc: Creating ashmem region of size 9023488
06-05 18:34:44.986 D/EGL_emulation( 1711): eglMakeCurrent: 0xa5b6bd80: ver 2 0 (tinfo 0xb1367140)
06-05 18:34:45.005 D/EGL_emulation( 1711): eglMakeCurrent: 0xa5b6bd80: ver 2 0 (tinfo 0xb1367140)
06-05 18:34:45.006 I/ActivityManager( 1629): Displayed com.evancharlton.mileage/.Mileage: +244ms
06-05 18:34:45.008 D/EGL_emulation( 1711): eglMakeCurrent: 0xa5b6bd80: ver 2 0 (tinfo 0xb1367140)
06-05 18:34:45.026 D/EGL_emulation( 1711): eglMakeCurrent: 0xa5b6bd80: ver 2 0 (tinfo 0xb1367140)
06-05 18:34:45.029 D/EGL_emulation( 1711): eglMakeCurrent: 0xa5b6bd80: ver 2 0 (tinfo 0xb1367140)
06-05 18:34:45.037 D/EGL_emulation( 1711): eglMakeCurrent: 0xa5b6bd80: ver 2 0 (tinfo 0xb1367140)
06-05 18:34:45.038 V/PhoneStatusBar( 1711): setLightsOn(true)
06-05 18:34:45.049 D/EGL_emulation( 1711): eglMakeCurrent: 0xa5b6bd80: ver 2 0 (tinfo 0xb1367140)
06-05 18:34:45.054 D/EGL_emulation( 1711): eglMakeCurrent: 0xa5b6bd80: ver 2 0 (tinfo 0xb1367140)
06-05 18:34:45.056 D/EGL_emulation( 1711): eglMakeCurrent: 0xa5b6bd80: ver 2 0 (tinfo 0xb1367140)
06-05 18:34:45.063 I/System.out( 6349): URI: //map
06-05 18:34:45.063 I/System.out( 6349): params: {json={"query":"* marked:'Statistics'","operation":{"method_name":"query","arguments":[]}}
06-05 18:34:45.063 I/System.out( 6349): }
06-05 18:34:45.078 W/ResourceType( 6349): No package identifier when getting name for resource number 0x00000001
06-05 18:34:45.095 I/System.out( 6349): URI: //gesture
06-05 18:34:45.095 I/System.out( 6349): params: {json={"query_timeout":5.0,"gestures":[{"query_string":"* marked:'Statistics'","touches":[{"x":50,"y":50,"offset_x":0,"offset_y":0,"wait":0.0,"time":0.2,"release":true,"query_string":null}]}]}
06-05 18:34:45.095 I/System.out( 6349): }
06-05 18:34:45.100 W/ResourceType( 6349): No package identifier when getting name for resource number 0x00000001
06-05 18:34:45.204 I/WindowManager( 1629): Destroying surface Surface(name=Starting com.evancharlton.mileage) called by com.android.server.wm.WindowStateAnimator.destroySurface:2016 com.android.server.wm.WindowStateAnimator.destroySurfaceLocked:882 com.android.server.wm.WindowState.destroyOrSaveSurface:2100 com.android.server.wm.AppWindowToken.destroySurfaces:363 com.android.server.wm.WindowStateAnimator.finishExit:565 com.android.server.wm.WindowStateAnimator.stepAnimationLocked:491 com.android.server.wm.WindowAnimator.updateWindowsLocked:303 com.android.server.wm.WindowAnimator.animateLocked:704 
06-05 18:34:45.205 V/PhoneStatusBar( 1711): setLightsOn(true)
06-05 18:34:45.221 V/PhoneStatusBar( 1711): setLightsOn(true)
06-05 18:34:45.289 V/PhoneStatusBar( 1711): setLightsOn(true)
06-05 18:34:45.326 I/calabash( 6349): newActivity1
06-05 18:34:45.387 I/System.out( 6349): URI: //map
06-05 18:34:45.387 I/System.out( 6349): params: {json={"query":"android.widget.ScrollView index:0","operation":{"method_name":"query","arguments":[]}}
06-05 18:34:45.387 I/System.out( 6349): }
06-05 18:34:45.388 W/ActivityManager( 1629): Bad activity token: android.os.BinderProxy@f2c4be3
06-05 18:34:45.388 W/ActivityManager( 1629): java.lang.ClassCastException: android.os.BinderProxy cannot be cast to com.android.server.am.ActivityRecord$Token
06-05 18:34:45.388 W/ActivityManager( 1629): 	at com.android.server.am.ActivityRecord.forTokenLocked(ActivityRecord.java:586)
06-05 18:34:45.388 W/ActivityManager( 1629): 	at com.android.server.am.ActivityRecord.isInStackLocked(ActivityRecord.java:1327)
06-05 18:34:45.388 W/ActivityManager( 1629): 	at com.android.server.am.ActivityRecord.getStackLocked(ActivityRecord.java:1332)
06-05 18:34:45.388 W/ActivityManager( 1629): 	at com.android.server.am.ActivityManagerService.getActivityDisplayId(ActivityManagerService.java:9806)
06-05 18:34:45.388 W/ActivityManager( 1629): 	at android.app.ActivityManagerNative.onTransact(ActivityManagerNative.java:2566)
06-05 18:34:45.388 W/ActivityManager( 1629): 	at com.android.server.am.ActivityManagerService.onTransact(ActivityManagerService.java:2757)
06-05 18:34:45.388 W/ActivityManager( 1629): 	at android.os.Binder.execTransact(Binder.java:565)
06-05 18:34:45.392 W/ActivityManager( 1629): Bad activity token: android.os.BinderProxy@f2c4be3
06-05 18:34:45.392 W/ActivityManager( 1629): java.lang.ClassCastException: android.os.BinderProxy cannot be cast to com.android.server.am.ActivityRecord$Token
06-05 18:34:45.392 W/ActivityManager( 1629): 	at com.android.server.am.ActivityRecord.forTokenLocked(ActivityRecord.java:586)
06-05 18:34:45.392 W/ActivityManager( 1629): 	at com.android.server.am.ActivityRecord.isInStackLocked(ActivityRecord.java:1327)
06-05 18:34:45.392 W/ActivityManager( 1629): 	at com.android.server.am.ActivityManagerService.setTaskDescription(ActivityManagerService.java:9358)
06-05 18:34:45.392 W/ActivityManager( 1629): 	at android.app.ActivityManagerNative.onTransact(ActivityManagerNative.java:2639)
06-05 18:34:45.392 W/ActivityManager( 1629): 	at com.android.server.am.ActivityManagerService.onTransact(ActivityManagerService.java:2757)
06-05 18:34:45.392 W/ActivityManager( 1629): 	at android.os.Binder.execTransact(Binder.java:565)
06-05 18:34:45.394 W/ActivityManager( 1629): Bad activity token: android.os.BinderProxy@f2c4be3
06-05 18:34:45.394 W/ActivityManager( 1629): java.lang.ClassCastException: android.os.BinderProxy cannot be cast to com.android.server.am.ActivityRecord$Token
06-05 18:34:45.394 W/ActivityManager( 1629): 	at com.android.server.am.ActivityRecord.forTokenLocked(ActivityRecord.java:586)
06-05 18:34:45.394 W/ActivityManager( 1629): 	at com.android.server.am.ActivityRecord.isInStackLocked(ActivityRecord.java:1327)
06-05 18:34:45.394 W/ActivityManager( 1629): 	at com.android.server.am.ActivityRecord.getStackLocked(ActivityRecord.java:1332)
06-05 18:34:45.394 W/ActivityManager( 1629): 	at com.android.server.am.ActivityManagerService.getActivityStackId(ActivityManagerService.java:9817)
06-05 18:34:45.394 W/ActivityManager( 1629): 	at android.app.ActivityManagerNative.onTransact(ActivityManagerNative.java:2856)
06-05 18:34:45.394 W/ActivityManager( 1629): 	at com.android.server.am.ActivityManagerService.onTransact(ActivityManagerService.java:2757)
06-05 18:34:45.394 W/ActivityManager( 1629): 	at android.os.Binder.execTransact(Binder.java:565)
06-05 18:34:45.416 D/VehicleStatisticsActivity( 6349): Checking recalculation ...
06-05 18:34:45.418 D/VehicleStatisticsActivity( 6349): Recalculation not necessary.
06-05 18:34:45.421 W/ActivityManager( 1629): Bad activity token: android.os.BinderProxy@f2c4be3
06-05 18:34:45.421 W/ActivityManager( 1629): java.lang.ClassCastException: android.os.BinderProxy cannot be cast to com.android.server.am.ActivityRecord$Token
06-05 18:34:45.421 W/ActivityManager( 1629): 	at com.android.server.am.ActivityRecord.forTokenLocked(ActivityRecord.java:586)
06-05 18:34:45.421 W/ActivityManager( 1629): 	at com.android.server.am.ActivityRecord.isInStackLocked(ActivityRecord.java:1327)
06-05 18:34:45.421 W/ActivityManager( 1629): 	at com.android.server.am.ActivityManagerService.getActivityOptions(ActivityManagerService.java:12559)
06-05 18:34:45.421 W/ActivityManager( 1629): 	at android.app.ActivityManagerNative.onTransact(ActivityManagerNative.java:1933)
06-05 18:34:45.421 W/ActivityManager( 1629): 	at com.android.server.am.ActivityManagerService.onTransact(ActivityManagerService.java:2757)
06-05 18:34:45.421 W/ActivityManager( 1629): 	at android.os.Binder.execTransact(Binder.java:565)
06-05 18:34:45.422 W/ActivityManager( 1629): Bad activity token: android.os.BinderProxy@f2c4be3
06-05 18:34:45.422 W/ActivityManager( 1629): java.lang.ClassCastException: android.os.BinderProxy cannot be cast to com.android.server.am.ActivityRecord$Token
06-05 18:34:45.422 W/ActivityManager( 1629): 	at com.android.server.am.ActivityRecord.forTokenLocked(ActivityRecord.java:586)
06-05 18:34:45.422 W/ActivityManager( 1629): 	at com.android.server.am.ActivityRecord.isInStackLocked(ActivityRecord.java:1327)
06-05 18:34:45.422 W/ActivityManager( 1629): 	at com.android.server.am.ActivityManagerService.getActivityOptions(ActivityManagerService.java:12559)
06-05 18:34:45.422 W/ActivityManager( 1629): 	at android.app.ActivityManagerNative.onTransact(ActivityManagerNative.java:1933)
06-05 18:34:45.422 W/ActivityManager( 1629): 	at com.android.server.am.ActivityManagerService.onTransact(ActivityManagerService.java:2757)
06-05 18:34:45.422 W/ActivityManager( 1629): 	at android.os.Binder.execTransact(Binder.java:565)
06-05 18:34:45.424 D/VehicleStatisticsActivity( 6349): Checking recalculation ...
06-05 18:34:45.426 D/VehicleStatisticsActivity( 6349): Recalculation not necessary.
06-05 18:34:45.535 I/System.out( 6349): URI: //map
06-05 18:34:45.535 I/System.out( 6349): params: {json={"query":"android.widget.AbsListView index:0","operation":{"method_name":"query","arguments":[]}}
06-05 18:34:45.535 I/System.out( 6349): }
06-05 18:34:45.544 I/art     ( 6349): Do partial code cache collection, code=30KB, data=29KB
06-05 18:34:45.544 I/art     ( 6349): After code cache collection, code=29KB, data=28KB
06-05 18:34:45.544 I/art     ( 6349): Increasing code cache capacity to 128KB
06-05 18:34:45.564 I/System.out( 6349): URI: //map
06-05 18:34:45.564 I/System.out( 6349): params: {json={"query":"android.widget.AbsListView index:0","operation":{"method_name":"query","arguments":[]}}
06-05 18:34:45.564 I/System.out( 6349): }
06-05 18:34:45.587 V/PhoneStatusBar( 1711): setLightsOn(true)
06-05 18:34:45.591 V/PhoneStatusBar( 1711): setLightsOn(true)
06-05 18:34:45.598 W/OpenGLRenderer( 2150): Incorrectly called buildLayer on View: ShortcutAndWidgetContainer, destroying layer...
06-05 18:34:45.598 I/System.out( 6349): URI: //map
06-05 18:34:45.598 I/System.out( 6349): params: {json={"query":"android.widget.AbsListView index:0","operation":{"method_name":"query","arguments":[]}}
06-05 18:34:45.598 I/System.out( 6349): }
06-05 18:34:45.605 I/WindowManager( 1629): Destroying surface Surface(name=com.android.launcher3/com.android.launcher3.Launcher) called by com.android.server.wm.WindowStateAnimator.destroySurface:2016 com.android.server.wm.WindowStateAnimator.destroySurfaceLocked:882 com.android.server.wm.WindowState.destroyOrSaveSurface:2100 com.android.server.wm.AppWindowToken.destroySurfaces:363 com.android.server.wm.AppWindowToken.notifyAppStopped:389 com.android.server.wm.WindowManagerService.notifyAppStopped:4463 com.android.server.am.ActivityStack.activityStoppedLocked:1252 com.android.server.am.ActivityManagerService.activityStopped:6903 
06-05 18:34:45.606 V/PhoneStatusBar( 1711): setLightsOn(true)
06-05 18:34:45.632 I/System.out( 6349): URI: //map
06-05 18:34:45.632 I/System.out( 6349): params: {json={"query":"android.widget.AbsListView index:0","operation":{"method_name":"query","arguments":["getFirstVisiblePosition"]}}
06-05 18:34:45.632 I/System.out( 6349): }
06-05 18:34:45.651 I/System.out( 6349): URI: //map
06-05 18:34:45.651 I/System.out( 6349): params: {json={"query":"android.widget.AbsListView index:0","operation":{"method_name":"query","arguments":["getLastVisiblePosition"]}}
06-05 18:34:45.651 I/System.out( 6349): }
06-05 18:34:45.664 I/System.out( 6349): URI: //map
06-05 18:34:45.664 I/System.out( 6349): params: {json={"query":"android.widget.AbsListView index:0","operation":{"method_name":"query","arguments":[{"method_name":"setSelection","arguments":[26]}]}}
06-05 18:34:45.664 I/System.out( 6349): }
06-05 18:34:45.682 I/System.out( 6349): URI: //map
06-05 18:34:45.682 I/System.out( 6349): params: {json={"query":"* marked:'Smallest fillup'","operation":{"method_name":"query","arguments":[]}}
06-05 18:34:45.682 I/System.out( 6349): }
06-05 18:34:45.733 D/gralloc_ranchu( 1346): gralloc_alloc: Creating ashmem region of size 9023488
06-05 18:34:45.782 W/ResourceType( 6349): No package identifier when getting name for resource number 0x00000001
06-05 18:34:45.793 I/System.out( 6349): URI: //gesture
06-05 18:34:45.793 I/System.out( 6349): params: {json={"query_timeout":5.0,"gestures":[{"query_string":"* marked:'Smallest fillup'","touches":[{"x":50,"y":50,"offset_x":0,"offset_y":0,"wait":0.0,"time":0.2,"release":true,"query_string":null}]}]}
06-05 18:34:45.793 I/System.out( 6349): }
06-05 18:34:45.797 W/ResourceType( 6349): No package identifier when getting name for resource number 0x00000001
06-05 18:34:46.021 I/ActivityManager( 1629): START u0 {cmp=com.evancharlton.mileage/.charts.MinimumVolumeChart (has extras)} from uid 10160 on display 0
06-05 18:34:46.022 V/PhoneStatusBar( 1711): setLightsOn(true)
06-05 18:34:46.023 V/PhoneStatusBar( 1711): setLightsOn(true)
06-05 18:34:46.035 I/System.out( 6349): URI: //map
06-05 18:34:46.035 I/System.out( 6349): params: {json={"query":"* {text CONTAINS[c] 'Smallest fillup size'}","operation":{"method_name":"query","arguments":[]}}
06-05 18:34:46.035 I/System.out( 6349): }
06-05 18:34:46.085 I/calabash( 6349): newActivity1
06-05 18:34:46.090 W/aiCharts( 6349): License file is invalid or missing. 
06-05 18:34:46.090 W/aiCharts( 6349): Please place proper license.lic to /assets folder.
06-05 18:34:46.109 V/PhoneStatusBar( 1711): setLightsOn(true)
06-05 18:34:46.171 V/PhoneStatusBar( 1711): setLightsOn(true)
06-05 18:34:46.182 I/WindowManager( 1629): Destroying surface Surface(name=Creating chart…) called by com.android.server.wm.WindowStateAnimator.destroySurface:2016 com.android.server.wm.WindowStateAnimator.destroySurfaceLocked:882 com.android.server.wm.WindowState.removeLocked:1456 com.android.server.wm.WindowManagerService.removeWindowInnerLocked:2484 com.android.server.wm.WindowManagerService.removeWindowLocked:2442 com.android.server.wm.WindowManagerService.removeWindowLocked:2311 com.android.server.wm.WindowManagerService.removeWindow:2306 com.android.server.wm.Session.remove:202 
06-05 18:34:46.186 D/gralloc_ranchu( 1346): gralloc_alloc: Creating ashmem region of size 9023488
06-05 18:34:46.189 V/PhoneStatusBar( 1711): setLightsOn(true)
06-05 18:34:46.216 I/ActivityManager( 1629): Displayed com.evancharlton.mileage/.charts.MinimumVolumeChart: +135ms
06-05 18:34:46.220 V/PhoneStatusBar( 1711): setLightsOn(true)
06-05 18:34:46.254 V/PhoneStatusBar( 1711): setLightsOn(true)
06-05 18:34:46.271 V/PhoneStatusBar( 1711): setLightsOn(true)
06-05 18:34:46.457 V/PhoneStatusBar( 1711): setLightsOn(true)
06-05 18:34:46.494 I/System.out( 6349): URI: //map
06-05 18:34:46.494 I/System.out( 6349): params: {json={"query":"* {text CONTAINS[c] 'Smallest fillup size'}","operation":{"method_name":"query","arguments":[]}}
06-05 18:34:46.494 I/System.out( 6349): }
06-05 18:34:46.561 I/System.out( 6349): URI: //
06-05 18:34:46.561 I/System.out( 6349): params: {json={"command":"press_key","arguments":["KEYCODE_BACK"]}
06-05 18:34:46.561 I/System.out( 6349): }
06-05 18:34:46.561 I/System.out( 6349): header: {content-type=application/json;charset=utf-8, date=Fri, 05 Jun 2020 23:34:46 GMT, accept=*/*, host=127.0.0.1:34783, content-length=52, user-agent=HTTPClient/1.0 (2.8.3, ruby 2.5.1 (2018-03-29))}
06-05 18:34:46.561 I/System.out( 6349): params: {json={"command":"press_key","arguments":["KEYCODE_BACK"]}
06-05 18:34:46.561 I/System.out( 6349): }
06-05 18:34:46.561 I/System.out( 6349): ProP json = {"command":"press_key","arguments":["KEYCODE_BACK"]}
06-05 18:34:46.561 I/System.out( 6349): files: {}
06-05 18:34:46.561 I/System.out( 6349): command: {"command":"press_key","arguments":["KEYCODE_BACK"]}
06-05 18:34:46.564 I/InstrumentationBackend( 6349): Got command:'Command:'Line:null,press_key', arguments:'[KEYCODE_BACK]'
06-05 18:34:46.570 V/PhoneStatusBar( 1711): setLightsOn(true)
06-05 18:34:46.574 V/PhoneStatusBar( 1711): setLightsOn(true)
06-05 18:34:46.580 I/System.out( 6349): result:{"bonusInformation":[],"message":"","success":true}
06-05 18:34:46.580 I/art     ( 6349): Do partial code cache collection, code=60KB, data=62KB
06-05 18:34:46.581 I/art     ( 6349): After code cache collection, code=59KB, data=61KB
06-05 18:34:46.581 I/art     ( 6349): Increasing code cache capacity to 256KB
06-05 18:34:46.582 D/VehicleStatisticsActivity( 6349): Checking recalculation ...
06-05 18:34:46.583 D/VehicleStatisticsActivity( 6349): Recalculation not necessary.
06-05 18:34:46.585 I/System.out( 6349): URI: //map
06-05 18:34:46.585 I/System.out( 6349): params: {json={"query":"* {text CONTAINS[c] 'Statistics'}","operation":{"method_name":"query","arguments":[]}}
06-05 18:34:46.585 I/System.out( 6349): }
06-05 18:34:46.587 V/PhoneStatusBar( 1711): setLightsOn(true)
06-05 18:34:46.604 V/PhoneStatusBar( 1711): setLightsOn(true)
06-05 18:34:46.613 D/gralloc_ranchu( 1346): gralloc_alloc: Creating ashmem region of size 9023488
06-05 18:34:46.621 V/PhoneStatusBar( 1711): setLightsOn(true)
06-05 18:34:46.671 V/PhoneStatusBar( 1711): setLightsOn(true)
