--------- beginning of main
06-05 19:59:31.434 V/PhoneStatusBar( 1711): setLightsOn(true)
06-05 19:59:31.435 D/gralloc_ranchu( 1348): gralloc_alloc: Creating ashmem region of size 3145728
06-05 19:59:31.439 E/EGL_emulation( 1348): tid 1348: eglCreateSyncKHR(1901): error 0x3004 (EGL_BAD_ATTRIBUTE)
--------- beginning of system
06-05 19:59:31.449 W/ActivityManager( 1629): Finishing task with all activities already finished
06-05 19:59:31.449 W/ActivityManager( 1629): Duplicate finish request for ActivityRecord{85b64f1 u0 com.evancharlton.mileage/.Mileage t4459 f}
06-05 19:59:31.449 W/ActivityManager( 1629): Finishing task with all activities already finished
06-05 19:59:31.449 W/ActivityManager( 1629): Duplicate finish request for ActivityRecord{85b64f1 u0 com.evancharlton.mileage/.Mileage t4459 f}
06-05 19:59:31.450 W/ActivityManager( 1629): Finishing task with all activities already finished
06-05 19:59:31.450 W/ActivityManager( 1629): Duplicate finish request for ActivityRecord{85b64f1 u0 com.evancharlton.mileage/.Mileage t4459 f}
06-05 19:59:31.450 W/ActivityManager( 1629): Finishing task with all activities already finished
06-05 19:59:31.450 W/ActivityManager( 1629): Duplicate finish request for ActivityRecord{85b64f1 u0 com.evancharlton.mileage/.Mileage t4459 f}
06-05 19:59:31.450 W/ActivityManager( 1629): Finishing task with all activities already finished
06-05 19:59:31.450 W/ActivityManager( 1629): Duplicate finish request for ActivityRecord{85b64f1 u0 com.evancharlton.mileage/.Mileage t4459 f}
06-05 19:59:31.450 W/ActivityManager( 1629): Finishing task with all activities already finished
06-05 19:59:31.450 W/ActivityManager( 1629): Duplicate finish request for ActivityRecord{643a5d3 u0 com.evancharlton.mileage/.charts.MinimumPriceChart t4459 f}
06-05 19:59:31.450 W/ActivityManager( 1629): Finishing task with all activities already finished
06-05 19:59:31.450 W/ActivityManager( 1629): Duplicate finish request for ActivityRecord{643a5d3 u0 com.evancharlton.mileage/.charts.MinimumPriceChart t4459 f}
06-05 19:59:31.450 W/ActivityManager( 1629): Finishing task with all activities already finished
06-05 19:59:31.450 W/ActivityManager( 1629): Duplicate finish request for ActivityRecord{85b64f1 u0 com.evancharlton.mileage/.Mileage t4459 f}
06-05 19:59:31.450 W/ActivityManager( 1629): Finishing task with all activities already finished
06-05 19:59:31.450 W/ActivityManager( 1629): Duplicate finish request for ActivityRecord{85b64f1 u0 com.evancharlton.mileage/.Mileage t4459 f}
06-05 19:59:31.486 D/EGL_emulation( 2147): eglMakeCurrent: 0xa3805360: ver 2 0 (tinfo 0xa3803630)
06-05 19:59:31.487 D/EGL_emulation( 1711): eglMakeCurrent: 0x9f1709c0: ver 2 0 (tinfo 0xa0e61d00)
06-05 19:59:31.501 D/EGL_emulation( 1711): eglMakeCurrent: 0x9f1709c0: ver 2 0 (tinfo 0xa0e61d00)
06-05 19:59:31.520 D/EGL_emulation( 1711): eglMakeCurrent: 0x9f1709c0: ver 2 0 (tinfo 0xa0e61d00)
06-05 19:59:31.535 D/EGL_emulation( 1711): eglMakeCurrent: 0x9f1709c0: ver 2 0 (tinfo 0xa0e61d00)
06-05 19:59:31.538 D/EGL_emulation( 1711): eglMakeCurrent: 0x9f1709c0: ver 2 0 (tinfo 0xa0e61d00)
06-05 19:59:31.552 D/EGL_emulation( 1711): eglMakeCurrent: 0x9f1709c0: ver 2 0 (tinfo 0xa0e61d00)
06-05 19:59:31.554 D/EGL_emulation( 1711): eglMakeCurrent: 0x9f1709c0: ver 2 0 (tinfo 0xa0e61d00)
06-05 19:59:31.568 D/EGL_emulation( 1711): eglMakeCurrent: 0x9f1709c0: ver 2 0 (tinfo 0xa0e61d00)
06-05 19:59:31.570 D/EGL_emulation( 1711): eglMakeCurrent: 0x9f1709c0: ver 2 0 (tinfo 0xa0e61d00)
06-05 19:59:31.585 D/EGL_emulation( 1711): eglMakeCurrent: 0x9f1709c0: ver 2 0 (tinfo 0xa0e61d00)
06-05 19:59:31.586 D/EGL_emulation( 1711): eglMakeCurrent: 0x9f1709c0: ver 2 0 (tinfo 0xa0e61d00)
06-05 19:59:31.601 D/EGL_emulation( 1711): eglMakeCurrent: 0x9f1709c0: ver 2 0 (tinfo 0xa0e61d00)
06-05 19:59:31.603 D/EGL_emulation( 1711): eglMakeCurrent: 0x9f1709c0: ver 2 0 (tinfo 0xa0e61d00)
06-05 19:59:31.615 D/AndroidRuntime(20486): >>>>>> START com.android.internal.os.RuntimeInit uid 2000 <<<<<<
06-05 19:59:31.616 D/AndroidRuntime(20486): CheckJNI is ON
06-05 19:59:31.618 D/EGL_emulation( 1711): eglMakeCurrent: 0x9f1709c0: ver 2 0 (tinfo 0xa0e61d00)
06-05 19:59:31.621 D/EGL_emulation( 1711): eglMakeCurrent: 0x9f1709c0: ver 2 0 (tinfo 0xa0e61d00)
06-05 19:59:31.627 W/art     (20486): Unexpected CPU variant for X86 using defaults: x86
06-05 19:59:31.629 D/ICU     (20486): No timezone override file found: /data/misc/zoneinfo/current/icu/icu_tzdata.dat
06-05 19:59:31.634 D/EGL_emulation( 1711): eglMakeCurrent: 0x9f1709c0: ver 2 0 (tinfo 0xa0e61d00)
06-05 19:59:31.636 D/EGL_emulation( 1711): eglMakeCurrent: 0x9f1709c0: ver 2 0 (tinfo 0xa0e61d00)
06-05 19:59:31.638 E/memtrack(20486): Couldn't load memtrack module (No such file or directory)
06-05 19:59:31.638 E/android.os.Debug(20486): failed to load memtrack module: -2
06-05 19:59:31.638 I/Radio-JNI(20486): register_android_hardware_Radio DONE
06-05 19:59:31.642 D/AndroidRuntime(20486): Calling main entry com.android.commands.am.Am
06-05 19:59:31.644 I/ActivityManager( 1629): Force stopping com.evancharlton.mileage appid=10196 user=0: start instr
06-05 19:59:31.644 I/ActivityManager( 1629): Killing 20435:com.evancharlton.mileage/u0a196 (adj 0): stop com.evancharlton.mileage
06-05 19:59:31.644 D/ActivityManager( 1629): cleanUpApplicationRecord -- 20435
06-05 19:59:31.645 I/WindowManager( 1629): Destroying surface Surface(name=com.evancharlton.mileage/com.evancharlton.mileage.charts.MinimumPriceChart) called by com.android.server.wm.WindowStateAnimator.destroySurface:2016 com.android.server.wm.WindowStateAnimator.destroySurfaceLocked:882 com.android.server.wm.WindowState.removeLocked:1456 com.android.server.wm.WindowManagerService.removeWindowInnerLocked:2484 com.android.server.wm.WindowManagerService.removeWindowLocked:2442 com.android.server.wm.WindowManagerService.removeWindowLocked:2311 com.android.server.wm.AppWindowToken.removeAllWindows:530 com.android.server.wm.AppWindowToken.removeAppFromTaskLocked:326 
06-05 19:59:31.646 W/ActivityManager( 1629): Crash of app com.evancharlton.mileage running instrumentation ComponentInfo{com.evancharlton.mileage.test/sh.calaba.instrumentationbackend.CalabashInstrumentationTestRunner}
06-05 19:59:31.646 I/ActivityManager( 1629): Force stopping com.evancharlton.mileage appid=10196 user=0: finished inst
06-05 19:59:31.649 I/art     (20497): Not late-enabling -Xcheck:jni (already on)
06-05 19:59:31.649 W/art     (20497): Unexpected CPU variant for X86 using defaults: x86
06-05 19:59:31.651 D/EGL_emulation( 1711): eglMakeCurrent: 0x9f1709c0: ver 2 0 (tinfo 0xa0e61d00)
06-05 19:59:31.653 D/EGL_emulation( 1711): eglMakeCurrent: 0x9f1709c0: ver 2 0 (tinfo 0xa0e61d00)
06-05 19:59:31.657 I/ActivityManager( 1629): Start proc 20497:com.evancharlton.mileage/u0a196 for added application com.evancharlton.mileage
06-05 19:59:31.658 D/AndroidRuntime(20486): Shutting down VM
06-05 19:59:31.669 D/EGL_emulation( 1711): eglMakeCurrent: 0x9f1709c0: ver 2 0 (tinfo 0xa0e61d00)
06-05 19:59:31.676 D/EGL_emulation( 1711): eglMakeCurrent: 0x9f1709c0: ver 2 0 (tinfo 0xa0e61d00)
06-05 19:59:31.677 W/System  (20497): ClassLoader referenced unknown path: /data/app/com.evancharlton.mileage.test-1/lib/x86
06-05 19:59:31.677 W/System  (20497): ClassLoader referenced unknown path: /data/app/com.evancharlton.mileage-1/lib/x86
06-05 19:59:31.682 I/WindowManager( 1629): WIN DEATH: Window{79df3e0 u0 com.evancharlton.mileage/com.evancharlton.mileage.Mileage EXITING}
06-05 19:59:31.687 W/System  (20497): ClassLoader referenced unknown path: 
06-05 19:59:31.701 I/System.out(20497): Main activity name automatically set to: com.evancharlton.mileage.Mileage
06-05 19:59:31.702 I/System.out(20497): Calabash did not load Mono. This is only a problem if you are trying to test a Mono application
06-05 19:59:31.703 I/calabash(20497): Test server port: 7102
06-05 19:59:31.705 I/InstrumentationBackend(20497): Added:'GetPreferences', with key:'get_preferences'
06-05 19:59:31.723 I/InstrumentationBackend(20497): Added:'SetPreferences', with key:'set_preferences'
06-05 19:59:31.724 I/InstrumentationBackend(20497): Added:'ClearPreferences', with key:'clear_preferences'
06-05 19:59:31.724 I/InstrumentationBackend(20497): Added:'PressElement', with key:'press_l10n_element'
06-05 19:59:31.724 I/InstrumentationBackend(20497): Added:'WaitForElement', with key:'wait_for_l10n_element'
06-05 19:59:31.725 I/InstrumentationBackend(20497): Added:'NullAction', with key:'nullAction'
06-05 19:59:31.725 I/InstrumentationBackend(20497): Added:'PressKey', with key:'press_key'
06-05 19:59:31.726 I/InstrumentationBackend(20497): Added:'SetActivityOrientation', with key:'set_activity_orientation'
06-05 19:59:31.726 I/InstrumentationBackend(20497): Added:'GetActivityOrientation', with key:'get_activity_orientation'
06-05 19:59:31.726 I/InstrumentationBackend(20497): Added:'FakeGPSLocation', with key:'set_gps_coordinates'
06-05 19:59:31.726 I/InstrumentationBackend(20497): Added:'SetPropertyByCssSelector', with key:'set_property_by_css_selector'
06-05 19:59:31.726 I/InstrumentationBackend(20497): Added:'GetUrl', with key:'get_url'
06-05 19:59:31.727 I/InstrumentationBackend(20497): Added:'ScrollTo', with key:'scroll_to'
06-05 19:59:31.728 I/InstrumentationBackend(20497): Added:'GetLoadProgress', with key:'get_load_progress'
06-05 19:59:31.728 I/InstrumentationBackend(20497): Added:'DumpHtml', with key:'dump_html'
06-05 19:59:31.728 I/InstrumentationBackend(20497): Added:'DumpBodyHtml', with key:'dump_body_html'
06-05 19:59:31.728 I/InstrumentationBackend(20497): Added:'EnterTextByCssSelector', with key:'enter_text_by_selector'
06-05 19:59:31.729 D/EGL_emulation( 1711): eglMakeCurrent: 0x9f1709c0: ver 2 0 (tinfo 0xa0e61d00)
06-05 19:59:31.732 I/InstrumentationBackend(20497): Added:'AndroidSDKVersion', with key:'android_sdk_version'
06-05 19:59:31.732 I/InstrumentationBackend(20497): Added:'Version', with key:'version'
06-05 19:59:31.732 I/InstrumentationBackend(20497): Added:'Drag', with key:'drag'
06-05 19:59:31.733 I/InstrumentationBackend(20497): Added:'TouchCoordinates', with key:'touch_coordinate'
06-05 19:59:31.733 I/InstrumentationBackend(20497): Added:'LongPressCoordinate', with key:'long_press_coordinate'
06-05 19:59:31.733 I/InstrumentationBackend(20497): Added:'DragCoordinates', with key:'drag_coordinates'
06-05 19:59:31.733 I/InstrumentationBackend(20497): Added:'ResumeApplication', with key:'resume_application'
06-05 19:59:31.733 I/InstrumentationBackend(20497): Added:'Swipe', with key:'swipe'
06-05 19:59:31.734 I/InstrumentationBackend(20497): Added:'DoubleTapCoordinate', with key:'double_tap_coordinate'
06-05 19:59:31.734 I/InstrumentationBackend(20497): Added:'ClickOnScreen', with key:'click_on_screen'
06-05 19:59:31.734 I/InstrumentationBackend(20497): Added:'GetActivityName', with key:'get_activity_name'
06-05 19:59:31.735 I/InstrumentationBackend(20497): Added:'ScrollToView', with key:'scroll_to_view'
06-05 19:59:31.735 I/InstrumentationBackend(20497): Added:'ViewConfiguration', with key:'view_configuration'
06-05 19:59:31.736 I/InstrumentationBackend(20497): Added:'IsCurrentActivityFocused', with key:'is_current_activity_focused'
06-05 19:59:31.736 I/InstrumentationBackend(20497): Added:'SendTcp', with key:'send_tcp'
06-05 19:59:31.736 I/InstrumentationBackend(20497): Added:'DpToDevicePixel', with key:'dp_to_device_pixel'
06-05 19:59:31.736 I/InstrumentationBackend(20497): Added:'KeyboardEnterText', with key:'keyboard_enter_text'
06-05 19:59:31.737 I/InstrumentationBackend(20497): Added:'DeleteSurroundingText', with key:'delete_surrounding_text'
06-05 19:59:31.737 D/EGL_emulation( 1711): eglMakeCurrent: 0x9f1709c0: ver 2 0 (tinfo 0xa0e61d00)
06-05 19:59:31.737 I/InstrumentationBackend(20497): Added:'SetComposingRegion', with key:'set_composing_region'
06-05 19:59:31.737 I/InstrumentationBackend(20497): Added:'SetSelection', with key:'set_selection'
06-05 19:59:31.737 I/InstrumentationBackend(20497): Added:'KeyboardKeyEvent', with key:'keyboard_key_event'
06-05 19:59:31.738 I/InstrumentationBackend(20497): Added:'PressUserActionButton', with key:'press_user_action_button'
06-05 19:59:31.738 I/InstrumentationBackend(20497): Added:'HideSoftKeyboard', with key:'hide_soft_keyboard'
06-05 19:59:31.738 I/InstrumentationBackend(20497): Added:'ListActions', with key:'list_actions'
06-05 19:59:31.739 I/calabash(20497): Instantiating http server at 7102
06-05 19:59:31.742 D/EGL_emulation( 1711): eglMakeCurrent: 0x9f1709c0: ver 2 0 (tinfo 0xa0e61d00)
06-05 19:59:31.742 I/System.out(20497): HTTP Daemon listening on: 7102
06-05 19:59:31.795 I/System.out(20497): URI: //ping
06-05 19:59:31.795 I/System.out(20497): params: {json={}
06-05 19:59:31.795 I/System.out(20497): }
06-05 19:59:31.802 I/System.out(20497): URI: //ping
06-05 19:59:31.802 I/System.out(20497): params: {json={}
06-05 19:59:31.802 I/System.out(20497): }
06-05 19:59:31.807 I/System.out(20497): URI: //ready
06-05 19:59:31.808 I/System.out(20497): params: {json={}
06-05 19:59:31.808 I/System.out(20497): }
06-05 19:59:31.812 I/System.out(20497): URI: //
06-05 19:59:31.812 I/System.out(20497): params: {json={"command":"version","arguments":[]}
06-05 19:59:31.812 I/System.out(20497): }
06-05 19:59:31.812 I/System.out(20497): header: {content-type=application/json;charset=utf-8, date=Sat, 06 Jun 2020 00:59:32 GMT, accept=*/*, host=127.0.0.1:34783, content-length=36, user-agent=HTTPClient/1.0 (2.8.3, ruby 2.5.1 (2018-03-29))}
06-05 19:59:31.812 I/System.out(20497): params: {json={"command":"version","arguments":[]}
06-05 19:59:31.812 I/System.out(20497): }
06-05 19:59:31.812 I/System.out(20497): ProP json = {"command":"version","arguments":[]}
06-05 19:59:31.812 I/System.out(20497): files: {}
06-05 19:59:31.812 I/System.out(20497): command: {"command":"version","arguments":[]}
06-05 19:59:31.820 I/InstrumentationBackend(20497): Got command:'Command:'Line:null,version', arguments:'[]'
06-05 19:59:31.833 I/System.out(20497): result:{"bonusInformation":[],"message":"0.9.8","success":true}
06-05 19:59:31.837 I/System.out(20497): URI: //start-application
06-05 19:59:31.837 I/System.out(20497): params: {json={"intent":null}
06-05 19:59:31.837 I/System.out(20497): }
06-05 19:59:31.852 I/ActivityManager( 1629): START u0 {act=android.intent.action.MAIN cat=[android.intent.category.LAUNCHER] flg=0x10200000 cmp=com.evancharlton.mileage/.Mileage} from uid 10196 on display 0
06-05 19:59:31.919 I/WindowManager( 1629): Destroying surface Surface(name=com.evancharlton.mileage/com.evancharlton.mileage.Mileage) called by com.android.server.wm.WindowStateAnimator.destroySurface:2016 com.android.server.wm.WindowStateAnimator.destroySurfaceLocked:882 com.android.server.wm.WindowState.removeLocked:1456 com.android.server.wm.WindowManagerService.removeWindowInnerLocked:2484 com.android.server.wm.AppWindowToken.destroySurfaces:365 com.android.server.wm.WindowStateAnimator.finishExit:565 com.android.server.wm.AppWindowAnimator.stepAnimationLocked:427 com.android.server.wm.WindowAnimator.updateAppWindowsLocked:196 
06-05 19:59:31.942 I/calabash(20497): newActivity1
06-05 19:59:31.958 I/calabash(20497): newActivity1
06-05 19:59:31.959 W/ActivityManager( 1629): Bad activity token: android.os.BinderProxy@b8be9c
06-05 19:59:31.959 W/ActivityManager( 1629): java.lang.ClassCastException: android.os.BinderProxy cannot be cast to com.android.server.am.ActivityRecord$Token
06-05 19:59:31.959 W/ActivityManager( 1629): 	at com.android.server.am.ActivityRecord.forTokenLocked(ActivityRecord.java:586)
06-05 19:59:31.959 W/ActivityManager( 1629): 	at com.android.server.am.ActivityRecord.isInStackLocked(ActivityRecord.java:1327)
06-05 19:59:31.959 W/ActivityManager( 1629): 	at com.android.server.am.ActivityRecord.getStackLocked(ActivityRecord.java:1332)
06-05 19:59:31.959 W/ActivityManager( 1629): 	at com.android.server.am.ActivityManagerService.getActivityDisplayId(ActivityManagerService.java:9806)
06-05 19:59:31.959 W/ActivityManager( 1629): 	at android.app.ActivityManagerNative.onTransact(ActivityManagerNative.java:2566)
06-05 19:59:31.959 W/ActivityManager( 1629): 	at com.android.server.am.ActivityManagerService.onTransact(ActivityManagerService.java:2757)
06-05 19:59:31.959 W/ActivityManager( 1629): 	at android.os.Binder.execTransact(Binder.java:565)
06-05 19:59:31.961 W/ActivityManager( 1629): Bad activity token: android.os.BinderProxy@b8be9c
06-05 19:59:31.961 W/ActivityManager( 1629): java.lang.ClassCastException: android.os.BinderProxy cannot be cast to com.android.server.am.ActivityRecord$Token
06-05 19:59:31.961 W/ActivityManager( 1629): 	at com.android.server.am.ActivityRecord.forTokenLocked(ActivityRecord.java:586)
06-05 19:59:31.961 W/ActivityManager( 1629): 	at com.android.server.am.ActivityRecord.isInStackLocked(ActivityRecord.java:1327)
06-05 19:59:31.961 W/ActivityManager( 1629): 	at com.android.server.am.ActivityManagerService.setTaskDescription(ActivityManagerService.java:9358)
06-05 19:59:31.961 W/ActivityManager( 1629): 	at android.app.ActivityManagerNative.onTransact(ActivityManagerNative.java:2639)
06-05 19:59:31.961 W/ActivityManager( 1629): 	at com.android.server.am.ActivityManagerService.onTransact(ActivityManagerService.java:2757)
06-05 19:59:31.961 W/ActivityManager( 1629): 	at android.os.Binder.execTransact(Binder.java:565)
06-05 19:59:31.962 W/ActivityManager( 1629): Bad activity token: android.os.BinderProxy@b8be9c
06-05 19:59:31.962 W/ActivityManager( 1629): java.lang.ClassCastException: android.os.BinderProxy cannot be cast to com.android.server.am.ActivityRecord$Token
06-05 19:59:31.962 W/ActivityManager( 1629): 	at com.android.server.am.ActivityRecord.forTokenLocked(ActivityRecord.java:586)
06-05 19:59:31.962 W/ActivityManager( 1629): 	at com.android.server.am.ActivityRecord.isInStackLocked(ActivityRecord.java:1327)
06-05 19:59:31.962 W/ActivityManager( 1629): 	at com.android.server.am.ActivityRecord.getStackLocked(ActivityRecord.java:1332)
06-05 19:59:31.962 W/ActivityManager( 1629): 	at com.android.server.am.ActivityManagerService.getActivityStackId(ActivityManagerService.java:9817)
06-05 19:59:31.962 W/ActivityManager( 1629): 	at android.app.ActivityManagerNative.onTransact(ActivityManagerNative.java:2856)
06-05 19:59:31.962 W/ActivityManager( 1629): 	at com.android.server.am.ActivityManagerService.onTransact(ActivityManagerService.java:2757)
06-05 19:59:31.962 W/ActivityManager( 1629): 	at android.os.Binder.execTransact(Binder.java:565)
06-05 19:59:31.970 D/gralloc_ranchu( 1348): gralloc_alloc: Creating ashmem region of size 9023488
06-05 19:59:31.993 W/ActivityManager( 1629): Bad activity token: android.os.BinderProxy@b8be9c
06-05 19:59:31.993 W/ActivityManager( 1629): java.lang.ClassCastException: android.os.BinderProxy cannot be cast to com.android.server.am.ActivityRecord$Token
06-05 19:59:31.993 W/ActivityManager( 1629): 	at com.android.server.am.ActivityRecord.forTokenLocked(ActivityRecord.java:586)
06-05 19:59:31.993 W/ActivityManager( 1629): 	at com.android.server.am.ActivityRecord.isInStackLocked(ActivityRecord.java:1327)
06-05 19:59:31.993 W/ActivityManager( 1629): 	at com.android.server.am.ActivityManagerService.getActivityOptions(ActivityManagerService.java:12559)
06-05 19:59:31.993 W/ActivityManager( 1629): 	at android.app.ActivityManagerNative.onTransact(ActivityManagerNative.java:1933)
06-05 19:59:31.993 W/ActivityManager( 1629): 	at com.android.server.am.ActivityManagerService.onTransact(ActivityManagerService.java:2757)
06-05 19:59:31.993 W/ActivityManager( 1629): 	at android.os.Binder.execTransact(Binder.java:565)
06-05 19:59:31.993 W/ActivityManager( 1629): Bad activity token: android.os.BinderProxy@b8be9c
06-05 19:59:31.993 W/ActivityManager( 1629): java.lang.ClassCastException: android.os.BinderProxy cannot be cast to com.android.server.am.ActivityRecord$Token
06-05 19:59:31.993 W/ActivityManager( 1629): 	at com.android.server.am.ActivityRecord.forTokenLocked(ActivityRecord.java:586)
06-05 19:59:31.993 W/ActivityManager( 1629): 	at com.android.server.am.ActivityRecord.isInStackLocked(ActivityRecord.java:1327)
06-05 19:59:31.993 W/ActivityManager( 1629): 	at com.android.server.am.ActivityManagerService.getActivityOptions(ActivityManagerService.java:12559)
06-05 19:59:31.993 W/ActivityManager( 1629): 	at android.app.ActivityManagerNative.onTransact(ActivityManagerNative.java:1933)
06-05 19:59:31.993 W/ActivityManager( 1629): 	at com.android.server.am.ActivityManagerService.onTransact(ActivityManagerService.java:2757)
06-05 19:59:31.993 W/ActivityManager( 1629): 	at android.os.Binder.execTransact(Binder.java:565)
06-05 19:59:32.001 W/OpenGLRenderer( 2147): Incorrectly called buildLayer on View: ShortcutAndWidgetContainer, destroying layer...
06-05 19:59:32.009 V/PhoneStatusBar( 1711): setLightsOn(true)
06-05 19:59:32.019 D/EGL_emulation( 2147): eglMakeCurrent: 0xa3805360: ver 2 0 (tinfo 0xa3803630)
06-05 19:59:32.022 D/EGL_emulation( 1711): eglMakeCurrent: 0x9f1709c0: ver 2 0 (tinfo 0xa0e61d00)
06-05 19:59:32.034 D/gralloc_ranchu( 1348): gralloc_alloc: Creating ashmem region of size 9023488
06-05 19:59:32.035 D/EGL_emulation( 1711): eglMakeCurrent: 0x9f1709c0: ver 2 0 (tinfo 0xa0e61d00)
06-05 19:59:32.042 D/        (20497): HostConnection::get() New Host Connection established 0x921a6040, tid 20497
06-05 19:59:32.043 D/EGL_emulation( 1711): eglMakeCurrent: 0x9f1709c0: ver 2 0 (tinfo 0xa0e61d00)
06-05 19:59:32.044 V/PhoneStatusBar( 1711): setLightsOn(true)
06-05 19:59:32.108 D/EGL_emulation( 1711): eglMakeCurrent: 0x9f1709c0: ver 2 0 (tinfo 0xa0e61d00)
06-05 19:59:32.112 D/EGL_emulation( 1711): eglMakeCurrent: 0x9f1709c0: ver 2 0 (tinfo 0xa0e61d00)
06-05 19:59:32.116 D/EGL_emulation( 1711): eglMakeCurrent: 0x9f1709c0: ver 2 0 (tinfo 0xa0e61d00)
06-05 19:59:32.119 D/EGL_emulation( 1711): eglMakeCurrent: 0x9f1709c0: ver 2 0 (tinfo 0xa0e61d00)
06-05 19:59:32.121 D/EGL_emulation( 1711): eglMakeCurrent: 0x9f1709c0: ver 2 0 (tinfo 0xa0e61d00)
06-05 19:59:32.139 D/EGL_emulation( 1711): eglMakeCurrent: 0x9f1709c0: ver 2 0 (tinfo 0xa0e61d00)
06-05 19:59:32.141 D/EGL_emulation( 1711): eglMakeCurrent: 0x9f1709c0: ver 2 0 (tinfo 0xa0e61d00)
06-05 19:59:32.152 D/EGL_emulation( 1711): eglMakeCurrent: 0x9f1709c0: ver 2 0 (tinfo 0xa0e61d00)
06-05 19:59:32.155 D/EGL_emulation( 1711): eglMakeCurrent: 0x9f1709c0: ver 2 0 (tinfo 0xa0e61d00)
06-05 19:59:32.168 D/EGL_emulation( 1711): eglMakeCurrent: 0x9f1709c0: ver 2 0 (tinfo 0xa0e61d00)
06-05 19:59:32.171 D/gralloc_ranchu( 1348): gralloc_alloc: Creating ashmem region of size 9023488
06-05 19:59:32.171 D/EGL_emulation( 1711): eglMakeCurrent: 0x9f1709c0: ver 2 0 (tinfo 0xa0e61d00)
06-05 19:59:32.185 I/ActivityManager( 1629): Displayed com.evancharlton.mileage/.Mileage: +246ms
06-05 19:59:32.187 D/EGL_emulation( 1711): eglMakeCurrent: 0x9f1709c0: ver 2 0 (tinfo 0xa0e61d00)
06-05 19:59:32.190 D/EGL_emulation( 1711): eglMakeCurrent: 0x9f1709c0: ver 2 0 (tinfo 0xa0e61d00)
06-05 19:59:32.203 D/EGL_emulation( 1711): eglMakeCurrent: 0x9f1709c0: ver 2 0 (tinfo 0xa0e61d00)
06-05 19:59:32.206 D/EGL_emulation( 1711): eglMakeCurrent: 0x9f1709c0: ver 2 0 (tinfo 0xa0e61d00)
06-05 19:59:32.218 D/EGL_emulation( 1711): eglMakeCurrent: 0x9f1709c0: ver 2 0 (tinfo 0xa0e61d00)
06-05 19:59:32.218 V/PhoneStatusBar( 1711): setLightsOn(true)
06-05 19:59:32.234 D/EGL_emulation( 1711): eglMakeCurrent: 0x9f1709c0: ver 2 0 (tinfo 0xa0e61d00)
06-05 19:59:32.236 D/EGL_emulation( 1711): eglMakeCurrent: 0x9f1709c0: ver 2 0 (tinfo 0xa0e61d00)
06-05 19:59:32.238 D/EGL_emulation( 1711): eglMakeCurrent: 0x9f1709c0: ver 2 0 (tinfo 0xa0e61d00)
06-05 19:59:32.246 I/System.out(20497): URI: //map
06-05 19:59:32.246 I/System.out(20497): params: {json={"query":"* marked:'Statistics'","operation":{"method_name":"query","arguments":[]}}
06-05 19:59:32.246 I/System.out(20497): }
06-05 19:59:32.260 W/ResourceType(20497): No package identifier when getting name for resource number 0x00000001
06-05 19:59:32.273 I/System.out(20497): URI: //gesture
06-05 19:59:32.273 I/System.out(20497): params: {json={"query_timeout":5.0,"gestures":[{"query_string":"* marked:'Statistics'","touches":[{"x":50,"y":50,"offset_x":0,"offset_y":0,"wait":0.0,"time":0.2,"release":true,"query_string":null}]}]}
06-05 19:59:32.273 I/System.out(20497): }
06-05 19:59:32.278 W/ResourceType(20497): No package identifier when getting name for resource number 0x00000001
06-05 19:59:32.384 I/WindowManager( 1629): Destroying surface Surface(name=Starting com.evancharlton.mileage) called by com.android.server.wm.WindowStateAnimator.destroySurface:2016 com.android.server.wm.WindowStateAnimator.destroySurfaceLocked:882 com.android.server.wm.WindowState.destroyOrSaveSurface:2100 com.android.server.wm.AppWindowToken.destroySurfaces:363 com.android.server.wm.WindowStateAnimator.finishExit:565 com.android.server.wm.WindowStateAnimator.stepAnimationLocked:491 com.android.server.wm.WindowAnimator.updateWindowsLocked:303 com.android.server.wm.WindowAnimator.animateLocked:704 
06-05 19:59:32.386 V/PhoneStatusBar( 1711): setLightsOn(true)
06-05 19:59:32.418 V/PhoneStatusBar( 1711): setLightsOn(true)
06-05 19:59:32.468 V/PhoneStatusBar( 1711): setLightsOn(true)
06-05 19:59:32.504 I/calabash(20497): newActivity1
06-05 19:59:32.520 I/System.out(20497): URI: //map
06-05 19:59:32.522 I/System.out(20497): params: {json={"query":"android.widget.ScrollView index:0","operation":{"method_name":"query","arguments":[]}}
06-05 19:59:32.522 I/System.out(20497): }
06-05 19:59:32.529 W/ActivityManager( 1629): Bad activity token: android.os.BinderProxy@3840cf6
06-05 19:59:32.529 W/ActivityManager( 1629): java.lang.ClassCastException: android.os.BinderProxy cannot be cast to com.android.server.am.ActivityRecord$Token
06-05 19:59:32.529 W/ActivityManager( 1629): 	at com.android.server.am.ActivityRecord.forTokenLocked(ActivityRecord.java:586)
06-05 19:59:32.529 W/ActivityManager( 1629): 	at com.android.server.am.ActivityRecord.isInStackLocked(ActivityRecord.java:1327)
06-05 19:59:32.529 W/ActivityManager( 1629): 	at com.android.server.am.ActivityRecord.getStackLocked(ActivityRecord.java:1332)
06-05 19:59:32.529 W/ActivityManager( 1629): 	at com.android.server.am.ActivityManagerService.getActivityDisplayId(ActivityManagerService.java:9806)
06-05 19:59:32.529 W/ActivityManager( 1629): 	at android.app.ActivityManagerNative.onTransact(ActivityManagerNative.java:2566)
06-05 19:59:32.529 W/ActivityManager( 1629): 	at com.android.server.am.ActivityManagerService.onTransact(ActivityManagerService.java:2757)
06-05 19:59:32.529 W/ActivityManager( 1629): 	at android.os.Binder.execTransact(Binder.java:565)
06-05 19:59:32.532 W/ActivityManager( 1629): Bad activity token: android.os.BinderProxy@3840cf6
06-05 19:59:32.532 W/ActivityManager( 1629): java.lang.ClassCastException: android.os.BinderProxy cannot be cast to com.android.server.am.ActivityRecord$Token
06-05 19:59:32.532 W/ActivityManager( 1629): 	at com.android.server.am.ActivityRecord.forTokenLocked(ActivityRecord.java:586)
06-05 19:59:32.532 W/ActivityManager( 1629): 	at com.android.server.am.ActivityRecord.isInStackLocked(ActivityRecord.java:1327)
06-05 19:59:32.532 W/ActivityManager( 1629): 	at com.android.server.am.ActivityManagerService.setTaskDescription(ActivityManagerService.java:9358)
06-05 19:59:32.532 W/ActivityManager( 1629): 	at android.app.ActivityManagerNative.onTransact(ActivityManagerNative.java:2639)
06-05 19:59:32.532 W/ActivityManager( 1629): 	at com.android.server.am.ActivityManagerService.onTransact(ActivityManagerService.java:2757)
06-05 19:59:32.532 W/ActivityManager( 1629): 	at android.os.Binder.execTransact(Binder.java:565)
06-05 19:59:32.533 W/ActivityManager( 1629): Bad activity token: android.os.BinderProxy@3840cf6
06-05 19:59:32.533 W/ActivityManager( 1629): java.lang.ClassCastException: android.os.BinderProxy cannot be cast to com.android.server.am.ActivityRecord$Token
06-05 19:59:32.533 W/ActivityManager( 1629): 	at com.android.server.am.ActivityRecord.forTokenLocked(ActivityRecord.java:586)
06-05 19:59:32.533 W/ActivityManager( 1629): 	at com.android.server.am.ActivityRecord.isInStackLocked(ActivityRecord.java:1327)
06-05 19:59:32.533 W/ActivityManager( 1629): 	at com.android.server.am.ActivityRecord.getStackLocked(ActivityRecord.java:1332)
06-05 19:59:32.533 W/ActivityManager( 1629): 	at com.android.server.am.ActivityManagerService.getActivityStackId(ActivityManagerService.java:9817)
06-05 19:59:32.533 W/ActivityManager( 1629): 	at android.app.ActivityManagerNative.onTransact(ActivityManagerNative.java:2856)
06-05 19:59:32.533 W/ActivityManager( 1629): 	at com.android.server.am.ActivityManagerService.onTransact(ActivityManagerService.java:2757)
06-05 19:59:32.533 W/ActivityManager( 1629): 	at android.os.Binder.execTransact(Binder.java:565)
06-05 19:59:32.542 D/VehicleStatisticsActivity(20497): Checking recalculation ...
06-05 19:59:32.544 D/VehicleStatisticsActivity(20497): Recalculation not necessary.
06-05 19:59:32.552 W/ActivityManager( 1629): Bad activity token: android.os.BinderProxy@3840cf6
06-05 19:59:32.552 W/ActivityManager( 1629): java.lang.ClassCastException: android.os.BinderProxy cannot be cast to com.android.server.am.ActivityRecord$Token
06-05 19:59:32.552 W/ActivityManager( 1629): 	at com.android.server.am.ActivityRecord.forTokenLocked(ActivityRecord.java:586)
06-05 19:59:32.552 W/ActivityManager( 1629): 	at com.android.server.am.ActivityRecord.isInStackLocked(ActivityRecord.java:1327)
06-05 19:59:32.552 W/ActivityManager( 1629): 	at com.android.server.am.ActivityManagerService.getActivityOptions(ActivityManagerService.java:12559)
06-05 19:59:32.552 W/ActivityManager( 1629): 	at android.app.ActivityManagerNative.onTransact(ActivityManagerNative.java:1933)
06-05 19:59:32.552 W/ActivityManager( 1629): 	at com.android.server.am.ActivityManagerService.onTransact(ActivityManagerService.java:2757)
06-05 19:59:32.552 W/ActivityManager( 1629): 	at android.os.Binder.execTransact(Binder.java:565)
06-05 19:59:32.552 W/ActivityManager( 1629): Bad activity token: android.os.BinderProxy@3840cf6
06-05 19:59:32.552 W/ActivityManager( 1629): java.lang.ClassCastException: android.os.BinderProxy cannot be cast to com.android.server.am.ActivityRecord$Token
06-05 19:59:32.552 W/ActivityManager( 1629): 	at com.android.server.am.ActivityRecord.forTokenLocked(ActivityRecord.java:586)
06-05 19:59:32.552 W/ActivityManager( 1629): 	at com.android.server.am.ActivityRecord.isInStackLocked(ActivityRecord.java:1327)
06-05 19:59:32.552 W/ActivityManager( 1629): 	at com.android.server.am.ActivityManagerService.getActivityOptions(ActivityManagerService.java:12559)
06-05 19:59:32.552 W/ActivityManager( 1629): 	at android.app.ActivityManagerNative.onTransact(ActivityManagerNative.java:1933)
06-05 19:59:32.552 W/ActivityManager( 1629): 	at com.android.server.am.ActivityManagerService.onTransact(ActivityManagerService.java:2757)
06-05 19:59:32.552 W/ActivityManager( 1629): 	at android.os.Binder.execTransact(Binder.java:565)
06-05 19:59:32.554 D/VehicleStatisticsActivity(20497): Checking recalculation ...
06-05 19:59:32.555 D/VehicleStatisticsActivity(20497): Recalculation not necessary.
06-05 19:59:32.634 I/System.out(20497): URI: //map
06-05 19:59:32.634 I/System.out(20497): params: {json={"query":"android.widget.AbsListView index:0","operation":{"method_name":"query","arguments":[]}}
06-05 19:59:32.634 I/System.out(20497): }
06-05 19:59:32.639 I/art     (20497): Do partial code cache collection, code=30KB, data=29KB
06-05 19:59:32.639 I/art     (20497): After code cache collection, code=29KB, data=28KB
06-05 19:59:32.639 I/art     (20497): Increasing code cache capacity to 128KB
06-05 19:59:32.649 I/System.out(20497): URI: //map
06-05 19:59:32.649 I/System.out(20497): params: {json={"query":"android.widget.AbsListView index:0","operation":{"method_name":"query","arguments":[]}}
06-05 19:59:32.649 I/System.out(20497): }
06-05 19:59:32.666 I/System.out(20497): URI: //map
06-05 19:59:32.666 I/System.out(20497): params: {json={"query":"android.widget.AbsListView index:0","operation":{"method_name":"query","arguments":[]}}
06-05 19:59:32.666 I/System.out(20497): }
06-05 19:59:32.680 I/System.out(20497): URI: //map
06-05 19:59:32.680 I/System.out(20497): params: {json={"query":"android.widget.AbsListView index:0","operation":{"method_name":"query","arguments":["getFirstVisiblePosition"]}}
06-05 19:59:32.680 I/System.out(20497): }
06-05 19:59:32.692 I/System.out(20497): URI: //map
06-05 19:59:32.692 I/System.out(20497): params: {json={"query":"android.widget.AbsListView index:0","operation":{"method_name":"query","arguments":["getLastVisiblePosition"]}}
06-05 19:59:32.692 I/System.out(20497): }
06-05 19:59:32.709 I/System.out(20497): URI: //map
06-05 19:59:32.709 I/System.out(20497): params: {json={"query":"android.widget.AbsListView index:0","operation":{"method_name":"query","arguments":[{"method_name":"setSelection","arguments":[26]}]}}
06-05 19:59:32.709 I/System.out(20497): }
06-05 19:59:32.727 I/System.out(20497): URI: //map
06-05 19:59:32.727 I/System.out(20497): params: {json={"query":"* marked:'Maximum price'","operation":{"method_name":"query","arguments":[]}}
06-05 19:59:32.727 I/System.out(20497): }
06-05 19:59:32.769 V/PhoneStatusBar( 1711): setLightsOn(true)
06-05 19:59:32.769 V/PhoneStatusBar( 1711): setLightsOn(true)
06-05 19:59:32.783 D/gralloc_ranchu( 1348): gralloc_alloc: Creating ashmem region of size 9023488
06-05 19:59:32.785 V/PhoneStatusBar( 1711): setLightsOn(true)
06-05 19:59:32.785 I/WindowManager( 1629): Destroying surface Surface(name=com.android.launcher3/com.android.launcher3.Launcher) called by com.android.server.wm.WindowStateAnimator.destroySurface:2016 com.android.server.wm.WindowStateAnimator.destroySurfaceLocked:882 com.android.server.wm.WindowState.destroyOrSaveSurface:2100 com.android.server.wm.AppWindowToken.destroySurfaces:363 com.android.server.wm.AppWindowToken.notifyAppStopped:389 com.android.server.wm.WindowManagerService.notifyAppStopped:4463 com.android.server.am.ActivityStack.activityStoppedLocked:1252 com.android.server.am.ActivityManagerService.activityStopped:6903 
06-05 19:59:32.819 W/ResourceType(20497): No package identifier when getting name for resource number 0x00000001
06-05 19:59:32.831 I/System.out(20497): URI: //gesture
06-05 19:59:32.831 I/System.out(20497): params: {json={"query_timeout":5.0,"gestures":[{"query_string":"* marked:'Maximum price'","touches":[{"x":50,"y":50,"offset_x":0,"offset_y":0,"wait":0.0,"time":0.2,"release":true,"query_string":null}]}]}
06-05 19:59:32.831 I/System.out(20497): }
06-05 19:59:32.835 W/ResourceType(20497): No package identifier when getting name for resource number 0x00000001
06-05 19:59:33.069 I/ActivityManager( 1629): START u0 {cmp=com.evancharlton.mileage/.charts.MaximumPriceChart (has extras)} from uid 10196 on display 0
06-05 19:59:33.070 V/PhoneStatusBar( 1711): setLightsOn(true)
06-05 19:59:33.074 V/PhoneStatusBar( 1711): setLightsOn(true)
06-05 19:59:33.085 I/System.out(20497): URI: //map
06-05 19:59:33.085 I/System.out(20497): params: {json={"query":"* {text CONTAINS[c] 'Most expensive fuel'}","operation":{"method_name":"query","arguments":[]}}
06-05 19:59:33.085 I/System.out(20497): }
06-05 19:59:33.127 I/calabash(20497): newActivity1
06-05 19:59:33.131 W/aiCharts(20497): License file is invalid or missing. 
06-05 19:59:33.131 W/aiCharts(20497): Please place proper license.lic to /assets folder.
06-05 19:59:33.145 V/PhoneStatusBar( 1711): setLightsOn(true)
06-05 19:59:33.168 V/PhoneStatusBar( 1711): setLightsOn(true)
06-05 19:59:33.172 I/WindowManager( 1629): Destroying surface Surface(name=Creating chart…) called by com.android.server.wm.WindowStateAnimator.destroySurface:2016 com.android.server.wm.WindowStateAnimator.destroySurfaceLocked:882 com.android.server.wm.WindowState.removeLocked:1456 com.android.server.wm.WindowManagerService.removeWindowInnerLocked:2484 com.android.server.wm.WindowManagerService.removeWindowLocked:2442 com.android.server.wm.WindowManagerService.removeWindowLocked:2311 com.android.server.wm.WindowManagerService.removeWindow:2306 com.android.server.wm.Session.remove:202 
06-05 19:59:33.174 D/gralloc_ranchu( 1348): gralloc_alloc: Creating ashmem region of size 9023488
06-05 19:59:33.185 V/PhoneStatusBar( 1711): setLightsOn(true)
06-05 19:59:33.209 I/ActivityManager( 1629): Displayed com.evancharlton.mileage/.charts.MaximumPriceChart: +84ms
06-05 19:59:33.218 V/PhoneStatusBar( 1711): setLightsOn(true)
06-05 19:59:33.251 V/PhoneStatusBar( 1711): setLightsOn(true)
06-05 19:59:33.268 V/PhoneStatusBar( 1711): setLightsOn(true)
06-05 19:59:33.452 V/PhoneStatusBar( 1711): setLightsOn(true)
06-05 19:59:33.462 I/System.out(20497): URI: //map
06-05 19:59:33.462 I/System.out(20497): params: {json={"query":"* {text CONTAINS[c] 'Most expensive fuel'}","operation":{"method_name":"query","arguments":[]}}
06-05 19:59:33.462 I/System.out(20497): }
06-05 19:59:33.478 I/System.out(20497): URI: //
06-05 19:59:33.478 I/System.out(20497): params: {json={"command":"press_key","arguments":["KEYCODE_BACK"]}
06-05 19:59:33.478 I/System.out(20497): }
06-05 19:59:33.478 I/System.out(20497): header: {content-type=application/json;charset=utf-8, date=Sat, 06 Jun 2020 00:59:34 GMT, accept=*/*, host=127.0.0.1:34783, content-length=52, user-agent=HTTPClient/1.0 (2.8.3, ruby 2.5.1 (2018-03-29))}
06-05 19:59:33.478 I/System.out(20497): params: {json={"command":"press_key","arguments":["KEYCODE_BACK"]}
06-05 19:59:33.478 I/System.out(20497): }
06-05 19:59:33.478 I/System.out(20497): ProP json = {"command":"press_key","arguments":["KEYCODE_BACK"]}
06-05 19:59:33.478 I/System.out(20497): files: {}
06-05 19:59:33.478 I/System.out(20497): command: {"command":"press_key","arguments":["KEYCODE_BACK"]}
06-05 19:59:33.479 I/InstrumentationBackend(20497): Got command:'Command:'Line:null,press_key', arguments:'[KEYCODE_BACK]'
06-05 19:59:33.481 V/PhoneStatusBar( 1711): setLightsOn(true)
06-05 19:59:33.482 V/PhoneStatusBar( 1711): setLightsOn(true)
06-05 19:59:33.484 V/PhoneStatusBar( 1711): setLightsOn(true)
06-05 19:59:33.484 I/System.out(20497): result:{"bonusInformation":[],"message":"","success":true}
06-05 19:59:33.485 D/VehicleStatisticsActivity(20497): Checking recalculation ...
06-05 19:59:33.486 D/VehicleStatisticsActivity(20497): Recalculation not necessary.
06-05 19:59:33.486 I/art     (20497): Do partial code cache collection, code=60KB, data=62KB
06-05 19:59:33.487 I/art     (20497): After code cache collection, code=59KB, data=61KB
06-05 19:59:33.487 I/art     (20497): Increasing code cache capacity to 256KB
06-05 19:59:33.488 I/System.out(20497): URI: //map
06-05 19:59:33.488 I/System.out(20497): params: {json={"query":"* {text CONTAINS[c] 'Statistics'}","operation":{"method_name":"query","arguments":[]}}
06-05 19:59:33.488 I/System.out(20497): }
06-05 19:59:33.501 D/gralloc_ranchu( 1348): gralloc_alloc: Creating ashmem region of size 9023488
06-05 19:59:33.502 V/PhoneStatusBar( 1711): setLightsOn(true)
06-05 19:59:33.518 V/PhoneStatusBar( 1711): setLightsOn(true)
06-05 19:59:33.534 V/PhoneStatusBar( 1711): setLightsOn(true)
