--------- beginning of system
06-05 21:21:51.091 W/ActivityManager( 1630): Finishing task with all activities already finished
06-05 21:21:51.092 W/ActivityManager( 1630): Duplicate finish request for ActivityRecord{1346b5e u0 com.evancharlton.mileage/.Mileage t7511 f}
--------- beginning of main
06-05 21:21:51.094 V/PhoneStatusBar( 1711): setLightsOn(true)
06-05 21:21:51.097 D/gralloc_ranchu( 1347): gralloc_alloc: Creating ashmem region of size 3145728
06-05 21:21:51.102 E/EGL_emulation( 1347): tid 1347: eglCreateSyncKHR(1901): error 0x3004 (EGL_BAD_ATTRIBUTE)
06-05 21:21:51.115 W/ActivityManager( 1630): Finishing task with all activities already finished
06-05 21:21:51.115 W/ActivityManager( 1630): Duplicate finish request for ActivityRecord{1346b5e u0 com.evancharlton.mileage/.Mileage t7511 f}
06-05 21:21:51.115 W/ActivityManager( 1630): Finishing task with all activities already finished
06-05 21:21:51.115 W/ActivityManager( 1630): Duplicate finish request for ActivityRecord{1346b5e u0 com.evancharlton.mileage/.Mileage t7511 f}
06-05 21:21:51.115 W/ActivityManager( 1630): Finishing task with all activities already finished
06-05 21:21:51.115 W/ActivityManager( 1630): Duplicate finish request for ActivityRecord{1346b5e u0 com.evancharlton.mileage/.Mileage t7511 f}
06-05 21:21:51.115 W/ActivityManager( 1630): Finishing task with all activities already finished
06-05 21:21:51.115 W/ActivityManager( 1630): Duplicate finish request for ActivityRecord{1346b5e u0 com.evancharlton.mileage/.Mileage t7511 f}
06-05 21:21:51.116 W/ActivityManager( 1630): Finishing task with all activities already finished
06-05 21:21:51.116 W/ActivityManager( 1630): Duplicate finish request for ActivityRecord{81dd758 u0 com.evancharlton.mileage/.charts.SouthChart t7511 f}
06-05 21:21:51.116 W/ActivityManager( 1630): Finishing task with all activities already finished
06-05 21:21:51.116 W/ActivityManager( 1630): Duplicate finish request for ActivityRecord{81dd758 u0 com.evancharlton.mileage/.charts.SouthChart t7511 f}
06-05 21:21:51.116 W/ActivityManager( 1630): Finishing task with all activities already finished
06-05 21:21:51.116 W/ActivityManager( 1630): Duplicate finish request for ActivityRecord{1346b5e u0 com.evancharlton.mileage/.Mileage t7511 f}
06-05 21:21:51.116 W/ActivityManager( 1630): Finishing task with all activities already finished
06-05 21:21:51.116 W/ActivityManager( 1630): Duplicate finish request for ActivityRecord{1346b5e u0 com.evancharlton.mileage/.Mileage t7511 f}
06-05 21:21:51.163 D/EGL_emulation( 2083): eglMakeCurrent: 0xb0f85240: ver 2 0 (tinfo 0xb0f832d0)
06-05 21:21:51.163 D/EGL_emulation( 1711): eglMakeCurrent: 0xb0f853c0: ver 2 0 (tinfo 0xb0f833e0)
06-05 21:21:51.178 D/EGL_emulation( 1711): eglMakeCurrent: 0xb0f853c0: ver 2 0 (tinfo 0xb0f833e0)
06-05 21:21:51.195 D/EGL_emulation( 1711): eglMakeCurrent: 0xb0f853c0: ver 2 0 (tinfo 0xb0f833e0)
06-05 21:21:51.211 D/EGL_emulation( 1711): eglMakeCurrent: 0xb0f853c0: ver 2 0 (tinfo 0xb0f833e0)
06-05 21:21:51.213 D/EGL_emulation( 1711): eglMakeCurrent: 0xb0f853c0: ver 2 0 (tinfo 0xb0f833e0)
06-05 21:21:51.227 D/EGL_emulation( 1711): eglMakeCurrent: 0xb0f853c0: ver 2 0 (tinfo 0xb0f833e0)
06-05 21:21:51.229 D/EGL_emulation( 1711): eglMakeCurrent: 0xb0f853c0: ver 2 0 (tinfo 0xb0f833e0)
06-05 21:21:51.244 D/EGL_emulation( 1711): eglMakeCurrent: 0xb0f853c0: ver 2 0 (tinfo 0xb0f833e0)
06-05 21:21:51.245 D/AndroidRuntime(10383): >>>>>> START com.android.internal.os.RuntimeInit uid 2000 <<<<<<
06-05 21:21:51.246 D/AndroidRuntime(10383): CheckJNI is ON
06-05 21:21:51.246 D/EGL_emulation( 1711): eglMakeCurrent: 0xb0f853c0: ver 2 0 (tinfo 0xb0f833e0)
06-05 21:21:51.256 W/art     (10383): Unexpected CPU variant for X86 using defaults: x86
06-05 21:21:51.258 D/ICU     (10383): No timezone override file found: /data/misc/zoneinfo/current/icu/icu_tzdata.dat
06-05 21:21:51.261 D/EGL_emulation( 1711): eglMakeCurrent: 0xb0f853c0: ver 2 0 (tinfo 0xb0f833e0)
06-05 21:21:51.262 D/EGL_emulation( 1711): eglMakeCurrent: 0xb0f853c0: ver 2 0 (tinfo 0xb0f833e0)
06-05 21:21:51.267 E/memtrack(10383): Couldn't load memtrack module (No such file or directory)
06-05 21:21:51.267 E/android.os.Debug(10383): failed to load memtrack module: -2
06-05 21:21:51.267 I/Radio-JNI(10383): register_android_hardware_Radio DONE
06-05 21:21:51.271 D/AndroidRuntime(10383): Calling main entry com.android.commands.am.Am
06-05 21:21:51.272 I/ActivityManager( 1630): Force stopping com.evancharlton.mileage appid=10286 user=0: start instr
06-05 21:21:51.273 I/ActivityManager( 1630): Killing 10331:com.evancharlton.mileage/u0a286 (adj 0): stop com.evancharlton.mileage
06-05 21:21:51.273 D/ActivityManager( 1630): cleanUpApplicationRecord -- 10331
06-05 21:21:51.273 I/WindowManager( 1630): Destroying surface Surface(name=com.evancharlton.mileage/com.evancharlton.mileage.charts.SouthChart) called by com.android.server.wm.WindowStateAnimator.destroySurface:2016 com.android.server.wm.WindowStateAnimator.destroySurfaceLocked:882 com.android.server.wm.WindowState.removeLocked:1456 com.android.server.wm.WindowManagerService.removeWindowInnerLocked:2484 com.android.server.wm.WindowManagerService.removeWindowLocked:2442 com.android.server.wm.WindowManagerService.removeWindowLocked:2311 com.android.server.wm.AppWindowToken.removeAllWindows:530 com.android.server.wm.AppWindowToken.removeAppFromTaskLocked:326 
06-05 21:21:51.275 W/ActivityManager( 1630): Crash of app com.evancharlton.mileage running instrumentation ComponentInfo{com.evancharlton.mileage.test/sh.calaba.instrumentationbackend.CalabashInstrumentationTestRunner}
06-05 21:21:51.275 I/ActivityManager( 1630): Force stopping com.evancharlton.mileage appid=10286 user=0: finished inst
06-05 21:21:51.277 D/EGL_emulation( 1711): eglMakeCurrent: 0xb0f853c0: ver 2 0 (tinfo 0xb0f833e0)
06-05 21:21:51.279 D/EGL_emulation( 1711): eglMakeCurrent: 0xb0f853c0: ver 2 0 (tinfo 0xb0f833e0)
06-05 21:21:51.279 I/art     (10393): Not late-enabling -Xcheck:jni (already on)
06-05 21:21:51.280 W/art     (10393): Unexpected CPU variant for X86 using defaults: x86
06-05 21:21:51.286 I/ActivityManager( 1630): Start proc 10393:com.evancharlton.mileage/u0a286 for added application com.evancharlton.mileage
06-05 21:21:51.286 D/AndroidRuntime(10383): Shutting down VM
06-05 21:21:51.290 W/System  (10393): ClassLoader referenced unknown path: /data/app/com.evancharlton.mileage.test-1/lib/x86
06-05 21:21:51.290 W/System  (10393): ClassLoader referenced unknown path: /data/app/com.evancharlton.mileage-1/lib/x86
06-05 21:21:51.292 W/System  (10393): ClassLoader referenced unknown path: 
06-05 21:21:51.294 D/EGL_emulation( 1711): eglMakeCurrent: 0xb0f853c0: ver 2 0 (tinfo 0xb0f833e0)
06-05 21:21:51.296 D/EGL_emulation( 1711): eglMakeCurrent: 0xb0f853c0: ver 2 0 (tinfo 0xb0f833e0)
06-05 21:21:51.297 I/System.out(10393): Main activity name automatically set to: com.evancharlton.mileage.Mileage
06-05 21:21:51.297 I/System.out(10393): Calabash did not load Mono. This is only a problem if you are trying to test a Mono application
06-05 21:21:51.297 I/calabash(10393): Test server port: 7102
06-05 21:21:51.298 I/InstrumentationBackend(10393): Added:'GetPreferences', with key:'get_preferences'
06-05 21:21:51.302 I/InstrumentationBackend(10393): Added:'SetPreferences', with key:'set_preferences'
06-05 21:21:51.302 I/InstrumentationBackend(10393): Added:'ClearPreferences', with key:'clear_preferences'
06-05 21:21:51.302 I/InstrumentationBackend(10393): Added:'PressElement', with key:'press_l10n_element'
06-05 21:21:51.303 I/InstrumentationBackend(10393): Added:'WaitForElement', with key:'wait_for_l10n_element'
06-05 21:21:51.303 I/InstrumentationBackend(10393): Added:'NullAction', with key:'nullAction'
06-05 21:21:51.303 I/InstrumentationBackend(10393): Added:'PressKey', with key:'press_key'
06-05 21:21:51.303 I/InstrumentationBackend(10393): Added:'SetActivityOrientation', with key:'set_activity_orientation'
06-05 21:21:51.303 I/InstrumentationBackend(10393): Added:'GetActivityOrientation', with key:'get_activity_orientation'
06-05 21:21:51.303 I/InstrumentationBackend(10393): Added:'FakeGPSLocation', with key:'set_gps_coordinates'
06-05 21:21:51.303 I/InstrumentationBackend(10393): Added:'SetPropertyByCssSelector', with key:'set_property_by_css_selector'
06-05 21:21:51.303 I/InstrumentationBackend(10393): Added:'GetUrl', with key:'get_url'
06-05 21:21:51.303 I/InstrumentationBackend(10393): Added:'ScrollTo', with key:'scroll_to'
06-05 21:21:51.303 I/InstrumentationBackend(10393): Added:'GetLoadProgress', with key:'get_load_progress'
06-05 21:21:51.303 I/InstrumentationBackend(10393): Added:'DumpHtml', with key:'dump_html'
06-05 21:21:51.303 I/InstrumentationBackend(10393): Added:'DumpBodyHtml', with key:'dump_body_html'
06-05 21:21:51.303 I/InstrumentationBackend(10393): Added:'EnterTextByCssSelector', with key:'enter_text_by_selector'
06-05 21:21:51.304 I/InstrumentationBackend(10393): Added:'AndroidSDKVersion', with key:'android_sdk_version'
06-05 21:21:51.304 I/InstrumentationBackend(10393): Added:'Version', with key:'version'
06-05 21:21:51.304 I/InstrumentationBackend(10393): Added:'Drag', with key:'drag'
06-05 21:21:51.304 I/InstrumentationBackend(10393): Added:'TouchCoordinates', with key:'touch_coordinate'
06-05 21:21:51.304 I/InstrumentationBackend(10393): Added:'LongPressCoordinate', with key:'long_press_coordinate'
06-05 21:21:51.304 I/InstrumentationBackend(10393): Added:'DragCoordinates', with key:'drag_coordinates'
06-05 21:21:51.304 I/InstrumentationBackend(10393): Added:'ResumeApplication', with key:'resume_application'
06-05 21:21:51.304 I/InstrumentationBackend(10393): Added:'Swipe', with key:'swipe'
06-05 21:21:51.304 I/InstrumentationBackend(10393): Added:'DoubleTapCoordinate', with key:'double_tap_coordinate'
06-05 21:21:51.304 I/InstrumentationBackend(10393): Added:'ClickOnScreen', with key:'click_on_screen'
06-05 21:21:51.305 I/InstrumentationBackend(10393): Added:'GetActivityName', with key:'get_activity_name'
06-05 21:21:51.305 I/InstrumentationBackend(10393): Added:'ScrollToView', with key:'scroll_to_view'
06-05 21:21:51.305 I/InstrumentationBackend(10393): Added:'ViewConfiguration', with key:'view_configuration'
06-05 21:21:51.305 I/InstrumentationBackend(10393): Added:'IsCurrentActivityFocused', with key:'is_current_activity_focused'
06-05 21:21:51.305 I/InstrumentationBackend(10393): Added:'SendTcp', with key:'send_tcp'
06-05 21:21:51.305 I/InstrumentationBackend(10393): Added:'DpToDevicePixel', with key:'dp_to_device_pixel'
06-05 21:21:51.305 I/InstrumentationBackend(10393): Added:'KeyboardEnterText', with key:'keyboard_enter_text'
06-05 21:21:51.305 I/InstrumentationBackend(10393): Added:'DeleteSurroundingText', with key:'delete_surrounding_text'
06-05 21:21:51.305 I/InstrumentationBackend(10393): Added:'SetComposingRegion', with key:'set_composing_region'
06-05 21:21:51.305 I/InstrumentationBackend(10393): Added:'SetSelection', with key:'set_selection'
06-05 21:21:51.305 I/InstrumentationBackend(10393): Added:'KeyboardKeyEvent', with key:'keyboard_key_event'
06-05 21:21:51.305 I/InstrumentationBackend(10393): Added:'PressUserActionButton', with key:'press_user_action_button'
06-05 21:21:51.305 I/InstrumentationBackend(10393): Added:'HideSoftKeyboard', with key:'hide_soft_keyboard'
06-05 21:21:51.305 I/InstrumentationBackend(10393): Added:'ListActions', with key:'list_actions'
06-05 21:21:51.306 I/calabash(10393): Instantiating http server at 7102
06-05 21:21:51.306 I/System.out(10393): HTTP Daemon listening on: 7102
06-05 21:21:51.311 D/EGL_emulation( 1711): eglMakeCurrent: 0xb0f853c0: ver 2 0 (tinfo 0xb0f833e0)
06-05 21:21:51.312 D/EGL_emulation( 1711): eglMakeCurrent: 0xb0f853c0: ver 2 0 (tinfo 0xb0f833e0)
06-05 21:21:51.328 D/EGL_emulation( 1711): eglMakeCurrent: 0xb0f853c0: ver 2 0 (tinfo 0xb0f833e0)
06-05 21:21:51.329 D/EGL_emulation( 1711): eglMakeCurrent: 0xb0f853c0: ver 2 0 (tinfo 0xb0f833e0)
06-05 21:21:51.338 W/InputDispatcher( 1630): channel 'f0e01c5 com.evancharlton.mileage/com.evancharlton.mileage.Mileage (server)' ~ Consumer closed input channel or an error occurred.  events=0x9
06-05 21:21:51.338 E/InputDispatcher( 1630): channel 'f0e01c5 com.evancharlton.mileage/com.evancharlton.mileage.Mileage (server)' ~ Channel is unrecoverably broken and will be disposed!
06-05 21:21:51.338 I/WindowManager( 1630): WIN DEATH: Window{f0e01c5 u0 com.evancharlton.mileage/com.evancharlton.mileage.Mileage EXITING}
06-05 21:21:51.338 W/InputDispatcher( 1630): Attempted to unregister already unregistered input channel 'f0e01c5 com.evancharlton.mileage/com.evancharlton.mileage.Mileage (server)'
06-05 21:21:51.349 D/EGL_emulation( 1711): eglMakeCurrent: 0xb0f853c0: ver 2 0 (tinfo 0xb0f833e0)
06-05 21:21:51.352 D/EGL_emulation( 1711): eglMakeCurrent: 0xb0f853c0: ver 2 0 (tinfo 0xb0f833e0)
06-05 21:21:51.365 D/EGL_emulation( 1711): eglMakeCurrent: 0xb0f853c0: ver 2 0 (tinfo 0xb0f833e0)
06-05 21:21:51.379 D/EGL_emulation( 1711): eglMakeCurrent: 0xb0f853c0: ver 2 0 (tinfo 0xb0f833e0)
06-05 21:21:51.384 D/EGL_emulation( 1711): eglMakeCurrent: 0xb0f853c0: ver 2 0 (tinfo 0xb0f833e0)
06-05 21:21:51.398 I/System.out(10393): URI: //ping
06-05 21:21:51.398 I/System.out(10393): params: {json={}
06-05 21:21:51.398 I/System.out(10393): }
06-05 21:21:51.404 I/System.out(10393): URI: //ping
06-05 21:21:51.404 I/System.out(10393): params: {json={}
06-05 21:21:51.404 I/System.out(10393): }
06-05 21:21:51.407 I/System.out(10393): URI: //ready
06-05 21:21:51.407 I/System.out(10393): params: {json={}
06-05 21:21:51.407 I/System.out(10393): }
06-05 21:21:51.410 I/System.out(10393): URI: //
06-05 21:21:51.410 I/System.out(10393): params: {json={"command":"version","arguments":[]}
06-05 21:21:51.410 I/System.out(10393): }
06-05 21:21:51.411 I/System.out(10393): header: {content-type=application/json;charset=utf-8, date=Sat, 06 Jun 2020 02:21:51 GMT, accept=*/*, host=127.0.0.1:34777, content-length=36, user-agent=HTTPClient/1.0 (2.8.3, ruby 2.5.1 (2018-03-29))}
06-05 21:21:51.411 I/System.out(10393): params: {json={"command":"version","arguments":[]}
06-05 21:21:51.411 I/System.out(10393): }
06-05 21:21:51.411 I/System.out(10393): ProP json = {"command":"version","arguments":[]}
06-05 21:21:51.411 I/System.out(10393): files: {}
06-05 21:21:51.411 I/System.out(10393): command: {"command":"version","arguments":[]}
06-05 21:21:51.415 I/InstrumentationBackend(10393): Got command:'Command:'Line:null,version', arguments:'[]'
06-05 21:21:51.422 I/System.out(10393): result:{"bonusInformation":[],"message":"0.9.8","success":true}
06-05 21:21:51.424 I/System.out(10393): URI: //start-application
06-05 21:21:51.425 I/System.out(10393): params: {json={"intent":null}
06-05 21:21:51.425 I/System.out(10393): }
06-05 21:21:51.434 I/ActivityManager( 1630): START u0 {act=android.intent.action.MAIN cat=[android.intent.category.LAUNCHER] flg=0x10200000 cmp=com.evancharlton.mileage/.Mileage} from uid 10286 on display 0
06-05 21:21:51.440 I/calabash(10393): newActivity1
06-05 21:21:51.451 I/calabash(10393): newActivity1
06-05 21:21:51.452 W/ActivityManager( 1630): Bad activity token: android.os.BinderProxy@a4f1fcd
06-05 21:21:51.452 W/ActivityManager( 1630): java.lang.ClassCastException: android.os.BinderProxy cannot be cast to com.android.server.am.ActivityRecord$Token
06-05 21:21:51.452 W/ActivityManager( 1630): 	at com.android.server.am.ActivityRecord.forTokenLocked(ActivityRecord.java:586)
06-05 21:21:51.452 W/ActivityManager( 1630): 	at com.android.server.am.ActivityRecord.isInStackLocked(ActivityRecord.java:1327)
06-05 21:21:51.452 W/ActivityManager( 1630): 	at com.android.server.am.ActivityRecord.getStackLocked(ActivityRecord.java:1332)
06-05 21:21:51.452 W/ActivityManager( 1630): 	at com.android.server.am.ActivityManagerService.getActivityDisplayId(ActivityManagerService.java:9806)
06-05 21:21:51.452 W/ActivityManager( 1630): 	at android.app.ActivityManagerNative.onTransact(ActivityManagerNative.java:2566)
06-05 21:21:51.452 W/ActivityManager( 1630): 	at com.android.server.am.ActivityManagerService.onTransact(ActivityManagerService.java:2757)
06-05 21:21:51.452 W/ActivityManager( 1630): 	at android.os.Binder.execTransact(Binder.java:565)
06-05 21:21:51.453 W/ActivityManager( 1630): Bad activity token: android.os.BinderProxy@a4f1fcd
06-05 21:21:51.453 W/ActivityManager( 1630): java.lang.ClassCastException: android.os.BinderProxy cannot be cast to com.android.server.am.ActivityRecord$Token
06-05 21:21:51.453 W/ActivityManager( 1630): 	at com.android.server.am.ActivityRecord.forTokenLocked(ActivityRecord.java:586)
06-05 21:21:51.453 W/ActivityManager( 1630): 	at com.android.server.am.ActivityRecord.isInStackLocked(ActivityRecord.java:1327)
06-05 21:21:51.453 W/ActivityManager( 1630): 	at com.android.server.am.ActivityManagerService.setTaskDescription(ActivityManagerService.java:9358)
06-05 21:21:51.453 W/ActivityManager( 1630): 	at android.app.ActivityManagerNative.onTransact(ActivityManagerNative.java:2639)
06-05 21:21:51.453 W/ActivityManager( 1630): 	at com.android.server.am.ActivityManagerService.onTransact(ActivityManagerService.java:2757)
06-05 21:21:51.453 W/ActivityManager( 1630): 	at android.os.Binder.execTransact(Binder.java:565)
06-05 21:21:51.453 W/ActivityManager( 1630): Bad activity token: android.os.BinderProxy@a4f1fcd
06-05 21:21:51.453 W/ActivityManager( 1630): java.lang.ClassCastException: android.os.BinderProxy cannot be cast to com.android.server.am.ActivityRecord$Token
06-05 21:21:51.453 W/ActivityManager( 1630): 	at com.android.server.am.ActivityRecord.forTokenLocked(ActivityRecord.java:586)
06-05 21:21:51.453 W/ActivityManager( 1630): 	at com.android.server.am.ActivityRecord.isInStackLocked(ActivityRecord.java:1327)
06-05 21:21:51.453 W/ActivityManager( 1630): 	at com.android.server.am.ActivityRecord.getStackLocked(ActivityRecord.java:1332)
06-05 21:21:51.453 W/ActivityManager( 1630): 	at com.android.server.am.ActivityManagerService.getActivityStackId(ActivityManagerService.java:9817)
06-05 21:21:51.453 W/ActivityManager( 1630): 	at android.app.ActivityManagerNative.onTransact(ActivityManagerNative.java:2856)
06-05 21:21:51.453 W/ActivityManager( 1630): 	at com.android.server.am.ActivityManagerService.onTransact(ActivityManagerService.java:2757)
06-05 21:21:51.453 W/ActivityManager( 1630): 	at android.os.Binder.execTransact(Binder.java:565)
06-05 21:21:51.461 D/gralloc_ranchu( 1347): gralloc_alloc: Creating ashmem region of size 9023488
06-05 21:21:51.472 W/ActivityManager( 1630): Bad activity token: android.os.BinderProxy@a4f1fcd
06-05 21:21:51.472 W/ActivityManager( 1630): java.lang.ClassCastException: android.os.BinderProxy cannot be cast to com.android.server.am.ActivityRecord$Token
06-05 21:21:51.472 W/ActivityManager( 1630): 	at com.android.server.am.ActivityRecord.forTokenLocked(ActivityRecord.java:586)
06-05 21:21:51.472 W/ActivityManager( 1630): 	at com.android.server.am.ActivityRecord.isInStackLocked(ActivityRecord.java:1327)
06-05 21:21:51.472 W/ActivityManager( 1630): 	at com.android.server.am.ActivityManagerService.getActivityOptions(ActivityManagerService.java:12559)
06-05 21:21:51.472 W/ActivityManager( 1630): 	at android.app.ActivityManagerNative.onTransact(ActivityManagerNative.java:1933)
06-05 21:21:51.472 W/ActivityManager( 1630): 	at com.android.server.am.ActivityManagerService.onTransact(ActivityManagerService.java:2757)
06-05 21:21:51.472 W/ActivityManager( 1630): 	at android.os.Binder.execTransact(Binder.java:565)
06-05 21:21:51.472 W/ActivityManager( 1630): Bad activity token: android.os.BinderProxy@a4f1fcd
06-05 21:21:51.472 W/ActivityManager( 1630): java.lang.ClassCastException: android.os.BinderProxy cannot be cast to com.android.server.am.ActivityRecord$Token
06-05 21:21:51.472 W/ActivityManager( 1630): 	at com.android.server.am.ActivityRecord.forTokenLocked(ActivityRecord.java:586)
06-05 21:21:51.472 W/ActivityManager( 1630): 	at com.android.server.am.ActivityRecord.isInStackLocked(ActivityRecord.java:1327)
06-05 21:21:51.472 W/ActivityManager( 1630): 	at com.android.server.am.ActivityManagerService.getActivityOptions(ActivityManagerService.java:12559)
06-05 21:21:51.472 W/ActivityManager( 1630): 	at android.app.ActivityManagerNative.onTransact(ActivityManagerNative.java:1933)
06-05 21:21:51.472 W/ActivityManager( 1630): 	at com.android.server.am.ActivityManagerService.onTransact(ActivityManagerService.java:2757)
06-05 21:21:51.472 W/ActivityManager( 1630): 	at android.os.Binder.execTransact(Binder.java:565)
06-05 21:21:51.490 V/PhoneStatusBar( 1711): setLightsOn(true)
06-05 21:21:51.494 D/EGL_emulation( 2083): eglMakeCurrent: 0xb0f85240: ver 2 0 (tinfo 0xb0f832d0)
06-05 21:21:51.496 D/EGL_emulation( 1711): eglMakeCurrent: 0xb0f853c0: ver 2 0 (tinfo 0xb0f833e0)
06-05 21:21:51.510 D/gralloc_ranchu( 1347): gralloc_alloc: Creating ashmem region of size 9023488
06-05 21:21:51.511 D/EGL_emulation( 1711): eglMakeCurrent: 0xb0f853c0: ver 2 0 (tinfo 0xb0f833e0)
06-05 21:21:51.515 D/        (10393): HostConnection::get() New Host Connection established 0xa4a94500, tid 10393
06-05 21:21:51.516 D/EGL_emulation( 1711): eglMakeCurrent: 0xb0f853c0: ver 2 0 (tinfo 0xb0f833e0)
06-05 21:21:51.516 V/PhoneStatusBar( 1711): setLightsOn(true)
06-05 21:21:51.546 D/EGL_emulation( 1711): eglMakeCurrent: 0xb0f853c0: ver 2 0 (tinfo 0xb0f833e0)
06-05 21:21:51.548 D/EGL_emulation( 1711): eglMakeCurrent: 0xb0f853c0: ver 2 0 (tinfo 0xb0f833e0)
06-05 21:21:51.550 D/EGL_emulation( 1711): eglMakeCurrent: 0xb0f853c0: ver 2 0 (tinfo 0xb0f833e0)
06-05 21:21:51.562 D/EGL_emulation( 1711): eglMakeCurrent: 0xb0f853c0: ver 2 0 (tinfo 0xb0f833e0)
06-05 21:21:51.565 D/EGL_emulation( 1711): eglMakeCurrent: 0xb0f853c0: ver 2 0 (tinfo 0xb0f833e0)
06-05 21:21:51.578 D/EGL_emulation( 1711): eglMakeCurrent: 0xb0f853c0: ver 2 0 (tinfo 0xb0f833e0)
06-05 21:21:51.579 D/EGL_emulation( 1711): eglMakeCurrent: 0xb0f853c0: ver 2 0 (tinfo 0xb0f833e0)
06-05 21:21:51.594 D/gralloc_ranchu( 1347): gralloc_alloc: Creating ashmem region of size 9023488
06-05 21:21:51.594 D/EGL_emulation( 1711): eglMakeCurrent: 0xb0f853c0: ver 2 0 (tinfo 0xb0f833e0)
06-05 21:21:51.595 I/ActivityManager( 1630): Displayed com.evancharlton.mileage/.Mileage: +157ms
06-05 21:21:51.595 I/WindowManager( 1630): Destroying surface Surface(name=com.evancharlton.mileage/com.evancharlton.mileage.Mileage) called by com.android.server.wm.WindowStateAnimator.destroySurface:2016 com.android.server.wm.WindowStateAnimator.destroySurfaceLocked:882 com.android.server.wm.WindowState.removeLocked:1456 com.android.server.wm.WindowManagerService.removeWindowInnerLocked:2484 com.android.server.wm.AppWindowToken.destroySurfaces:365 com.android.server.wm.WindowStateAnimator.finishExit:565 com.android.server.wm.AppWindowAnimator.stepAnimationLocked:427 com.android.server.wm.WindowAnimator.updateAppWindowsLocked:196 
06-05 21:21:51.607 D/EGL_emulation( 1711): eglMakeCurrent: 0xb0f853c0: ver 2 0 (tinfo 0xb0f833e0)
06-05 21:21:51.612 D/EGL_emulation( 1711): eglMakeCurrent: 0xb0f853c0: ver 2 0 (tinfo 0xb0f833e0)
06-05 21:21:51.619 D/EGL_emulation( 1711): eglMakeCurrent: 0xb0f853c0: ver 2 0 (tinfo 0xb0f833e0)
06-05 21:21:51.627 D/EGL_emulation( 1711): eglMakeCurrent: 0xb0f853c0: ver 2 0 (tinfo 0xb0f833e0)
06-05 21:21:51.628 V/PhoneStatusBar( 1711): setLightsOn(true)
06-05 21:21:51.629 D/EGL_emulation( 1711): eglMakeCurrent: 0xb0f853c0: ver 2 0 (tinfo 0xb0f833e0)
06-05 21:21:51.644 D/EGL_emulation( 1711): eglMakeCurrent: 0xb0f853c0: ver 2 0 (tinfo 0xb0f833e0)
06-05 21:21:51.646 D/EGL_emulation( 1711): eglMakeCurrent: 0xb0f853c0: ver 2 0 (tinfo 0xb0f833e0)
06-05 21:21:51.651 I/System.out(10393): URI: //map
06-05 21:21:51.651 I/System.out(10393): params: {json={"query":"* marked:'Statistics'","operation":{"method_name":"query","arguments":[]}}
06-05 21:21:51.651 I/System.out(10393): }
06-05 21:21:51.661 D/EGL_emulation( 1711): eglMakeCurrent: 0xb0f853c0: ver 2 0 (tinfo 0xb0f833e0)
06-05 21:21:51.662 D/EGL_emulation( 1711): eglMakeCurrent: 0xb0f853c0: ver 2 0 (tinfo 0xb0f833e0)
06-05 21:21:51.664 W/ResourceType(10393): No package identifier when getting name for resource number 0x00000001
06-05 21:21:51.677 I/System.out(10393): URI: //gesture
06-05 21:21:51.677 I/System.out(10393): params: {json={"query_timeout":5.0,"gestures":[{"query_string":"* marked:'Statistics'","touches":[{"x":50,"y":50,"offset_x":0,"offset_y":0,"wait":0.0,"time":0.2,"release":true,"query_string":null}]}]}
06-05 21:21:51.677 I/System.out(10393): }
06-05 21:21:51.677 D/EGL_emulation( 1711): eglMakeCurrent: 0xb0f853c0: ver 2 0 (tinfo 0xb0f833e0)
06-05 21:21:51.679 D/EGL_emulation( 1711): eglMakeCurrent: 0xb0f853c0: ver 2 0 (tinfo 0xb0f833e0)
06-05 21:21:51.682 W/ResourceType(10393): No package identifier when getting name for resource number 0x00000001
06-05 21:21:51.694 D/EGL_emulation( 1711): eglMakeCurrent: 0xb0f853c0: ver 2 0 (tinfo 0xb0f833e0)
06-05 21:21:51.703 D/EGL_emulation( 1711): eglMakeCurrent: 0xb0f853c0: ver 2 0 (tinfo 0xb0f833e0)
06-05 21:21:51.713 D/EGL_emulation( 1711): eglMakeCurrent: 0xb0f853c0: ver 2 0 (tinfo 0xb0f833e0)
06-05 21:21:51.718 D/EGL_emulation( 1711): eglMakeCurrent: 0xb0f853c0: ver 2 0 (tinfo 0xb0f833e0)
06-05 21:21:51.794 I/WindowManager( 1630): Destroying surface Surface(name=Starting com.evancharlton.mileage) called by com.android.server.wm.WindowStateAnimator.destroySurface:2016 com.android.server.wm.WindowStateAnimator.destroySurfaceLocked:882 com.android.server.wm.WindowState.destroyOrSaveSurface:2100 com.android.server.wm.AppWindowToken.destroySurfaces:363 com.android.server.wm.WindowStateAnimator.finishExit:565 com.android.server.wm.WindowStateAnimator.stepAnimationLocked:491 com.android.server.wm.WindowAnimator.updateWindowsLocked:303 com.android.server.wm.WindowAnimator.animateLocked:704 
06-05 21:21:51.795 V/PhoneStatusBar( 1711): setLightsOn(true)
06-05 21:21:51.828 V/PhoneStatusBar( 1711): setLightsOn(true)
06-05 21:21:51.916 I/calabash(10393): newActivity1
06-05 21:21:51.946 I/System.out(10393): URI: //map
06-05 21:21:51.946 I/System.out(10393): params: {json={"query":"android.widget.ScrollView index:0","operation":{"method_name":"query","arguments":[]}}
06-05 21:21:51.946 I/System.out(10393): }
06-05 21:21:51.950 W/ActivityManager( 1630): Bad activity token: android.os.BinderProxy@d686783
06-05 21:21:51.950 W/ActivityManager( 1630): java.lang.ClassCastException: android.os.BinderProxy cannot be cast to com.android.server.am.ActivityRecord$Token
06-05 21:21:51.950 W/ActivityManager( 1630): 	at com.android.server.am.ActivityRecord.forTokenLocked(ActivityRecord.java:586)
06-05 21:21:51.950 W/ActivityManager( 1630): 	at com.android.server.am.ActivityRecord.isInStackLocked(ActivityRecord.java:1327)
06-05 21:21:51.950 W/ActivityManager( 1630): 	at com.android.server.am.ActivityRecord.getStackLocked(ActivityRecord.java:1332)
06-05 21:21:51.950 W/ActivityManager( 1630): 	at com.android.server.am.ActivityManagerService.getActivityDisplayId(ActivityManagerService.java:9806)
06-05 21:21:51.950 W/ActivityManager( 1630): 	at android.app.ActivityManagerNative.onTransact(ActivityManagerNative.java:2566)
06-05 21:21:51.950 W/ActivityManager( 1630): 	at com.android.server.am.ActivityManagerService.onTransact(ActivityManagerService.java:2757)
06-05 21:21:51.950 W/ActivityManager( 1630): 	at android.os.Binder.execTransact(Binder.java:565)
06-05 21:21:51.952 W/ActivityManager( 1630): Bad activity token: android.os.BinderProxy@d686783
06-05 21:21:51.952 W/ActivityManager( 1630): java.lang.ClassCastException: android.os.BinderProxy cannot be cast to com.android.server.am.ActivityRecord$Token
06-05 21:21:51.952 W/ActivityManager( 1630): 	at com.android.server.am.ActivityRecord.forTokenLocked(ActivityRecord.java:586)
06-05 21:21:51.952 W/ActivityManager( 1630): 	at com.android.server.am.ActivityRecord.isInStackLocked(ActivityRecord.java:1327)
06-05 21:21:51.952 W/ActivityManager( 1630): 	at com.android.server.am.ActivityManagerService.setTaskDescription(ActivityManagerService.java:9358)
06-05 21:21:51.952 W/ActivityManager( 1630): 	at android.app.ActivityManagerNative.onTransact(ActivityManagerNative.java:2639)
06-05 21:21:51.952 W/ActivityManager( 1630): 	at com.android.server.am.ActivityManagerService.onTransact(ActivityManagerService.java:2757)
06-05 21:21:51.952 W/ActivityManager( 1630): 	at android.os.Binder.execTransact(Binder.java:565)
06-05 21:21:51.952 W/ActivityManager( 1630): Bad activity token: android.os.BinderProxy@d686783
06-05 21:21:51.952 W/ActivityManager( 1630): java.lang.ClassCastException: android.os.BinderProxy cannot be cast to com.android.server.am.ActivityRecord$Token
06-05 21:21:51.952 W/ActivityManager( 1630): 	at com.android.server.am.ActivityRecord.forTokenLocked(ActivityRecord.java:586)
06-05 21:21:51.952 W/ActivityManager( 1630): 	at com.android.server.am.ActivityRecord.isInStackLocked(ActivityRecord.java:1327)
06-05 21:21:51.952 W/ActivityManager( 1630): 	at com.android.server.am.ActivityRecord.getStackLocked(ActivityRecord.java:1332)
06-05 21:21:51.952 W/ActivityManager( 1630): 	at com.android.server.am.ActivityManagerService.getActivityStackId(ActivityManagerService.java:9817)
06-05 21:21:51.952 W/ActivityManager( 1630): 	at android.app.ActivityManagerNative.onTransact(ActivityManagerNative.java:2856)
06-05 21:21:51.952 W/ActivityManager( 1630): 	at com.android.server.am.ActivityManagerService.onTransact(ActivityManagerService.java:2757)
06-05 21:21:51.952 W/ActivityManager( 1630): 	at android.os.Binder.execTransact(Binder.java:565)
06-05 21:21:51.958 D/VehicleStatisticsActivity(10393): Checking recalculation ...
06-05 21:21:51.959 D/VehicleStatisticsActivity(10393): Recalculation not necessary.
06-05 21:21:51.961 V/PhoneStatusBar( 1711): setLightsOn(true)
06-05 21:21:51.962 V/PhoneStatusBar( 1711): setLightsOn(true)
06-05 21:21:51.978 W/ActivityManager( 1630): Bad activity token: android.os.BinderProxy@d686783
06-05 21:21:51.978 W/ActivityManager( 1630): java.lang.ClassCastException: android.os.BinderProxy cannot be cast to com.android.server.am.ActivityRecord$Token
06-05 21:21:51.978 W/ActivityManager( 1630): 	at com.android.server.am.ActivityRecord.forTokenLocked(ActivityRecord.java:586)
06-05 21:21:51.978 W/ActivityManager( 1630): 	at com.android.server.am.ActivityRecord.isInStackLocked(ActivityRecord.java:1327)
06-05 21:21:51.978 W/ActivityManager( 1630): 	at com.android.server.am.ActivityManagerService.getActivityOptions(ActivityManagerService.java:12559)
06-05 21:21:51.978 W/ActivityManager( 1630): 	at android.app.ActivityManagerNative.onTransact(ActivityManagerNative.java:1933)
06-05 21:21:51.978 W/ActivityManager( 1630): 	at com.android.server.am.ActivityManagerService.onTransact(ActivityManagerService.java:2757)
06-05 21:21:51.978 W/ActivityManager( 1630): 	at android.os.Binder.execTransact(Binder.java:565)
06-05 21:21:51.978 W/ActivityManager( 1630): Bad activity token: android.os.BinderProxy@d686783
06-05 21:21:51.978 W/ActivityManager( 1630): java.lang.ClassCastException: android.os.BinderProxy cannot be cast to com.android.server.am.ActivityRecord$Token
06-05 21:21:51.978 W/ActivityManager( 1630): 	at com.android.server.am.ActivityRecord.forTokenLocked(ActivityRecord.java:586)
06-05 21:21:51.978 W/ActivityManager( 1630): 	at com.android.server.am.ActivityRecord.isInStackLocked(ActivityRecord.java:1327)
06-05 21:21:51.978 W/ActivityManager( 1630): 	at com.android.server.am.ActivityManagerService.getActivityOptions(ActivityManagerService.java:12559)
06-05 21:21:51.978 W/ActivityManager( 1630): 	at android.app.ActivityManagerNative.onTransact(ActivityManagerNative.java:1933)
06-05 21:21:51.978 W/ActivityManager( 1630): 	at com.android.server.am.ActivityManagerService.onTransact(ActivityManagerService.java:2757)
06-05 21:21:51.978 W/ActivityManager( 1630): 	at android.os.Binder.execTransact(Binder.java:565)
06-05 21:21:51.979 D/VehicleStatisticsActivity(10393): Checking recalculation ...
06-05 21:21:51.980 D/VehicleStatisticsActivity(10393): Recalculation not necessary.
06-05 21:21:52.074 I/System.out(10393): URI: //map
06-05 21:21:52.074 I/System.out(10393): params: {json={"query":"android.widget.AbsListView index:0","operation":{"method_name":"query","arguments":[]}}
06-05 21:21:52.074 I/System.out(10393): }
06-05 21:21:52.079 I/art     (10393): Do partial code cache collection, code=30KB, data=29KB
06-05 21:21:52.079 I/art     (10393): After code cache collection, code=29KB, data=28KB
06-05 21:21:52.079 I/art     (10393): Increasing code cache capacity to 128KB
06-05 21:21:52.095 I/System.out(10393): URI: //map
06-05 21:21:52.095 I/System.out(10393): params: {json={"query":"android.widget.AbsListView index:0","operation":{"method_name":"query","arguments":[]}}
06-05 21:21:52.095 I/System.out(10393): }
06-05 21:21:52.113 I/System.out(10393): URI: //map
06-05 21:21:52.113 I/System.out(10393): params: {json={"query":"android.widget.AbsListView index:0","operation":{"method_name":"query","arguments":[]}}
06-05 21:21:52.113 I/System.out(10393): }
06-05 21:21:52.128 I/System.out(10393): URI: //map
06-05 21:21:52.128 I/System.out(10393): params: {json={"query":"android.widget.AbsListView index:0","operation":{"method_name":"query","arguments":["getFirstVisiblePosition"]}}
06-05 21:21:52.128 I/System.out(10393): }
06-05 21:21:52.142 I/System.out(10393): URI: //map
06-05 21:21:52.142 I/System.out(10393): params: {json={"query":"android.widget.AbsListView index:0","operation":{"method_name":"query","arguments":["getLastVisiblePosition"]}}
06-05 21:21:52.142 I/System.out(10393): }
06-05 21:21:52.155 I/System.out(10393): URI: //map
06-05 21:21:52.155 I/System.out(10393): params: {json={"query":"android.widget.AbsListView index:0","operation":{"method_name":"query","arguments":[{"method_name":"setSelection","arguments":[26]}]}}
06-05 21:21:52.155 I/System.out(10393): }
06-05 21:21:52.171 I/System.out(10393): URI: //map
06-05 21:21:52.172 I/System.out(10393): params: {json={"query":"* marked:'East'","operation":{"method_name":"query","arguments":[]}}
06-05 21:21:52.172 I/System.out(10393): }
06-05 21:21:52.227 D/gralloc_ranchu( 1347): gralloc_alloc: Creating ashmem region of size 9023488
06-05 21:21:52.246 V/PhoneStatusBar( 1711): setLightsOn(true)
06-05 21:21:52.247 V/PhoneStatusBar( 1711): setLightsOn(true)
06-05 21:21:52.249 W/OpenGLRenderer( 2083): Incorrectly called buildLayer on View: ShortcutAndWidgetContainer, destroying layer...
06-05 21:21:52.262 V/PhoneStatusBar( 1711): setLightsOn(true)
06-05 21:21:52.263 I/WindowManager( 1630): Destroying surface Surface(name=com.android.launcher3/com.android.launcher3.Launcher) called by com.android.server.wm.WindowStateAnimator.destroySurface:2016 com.android.server.wm.WindowStateAnimator.destroySurfaceLocked:882 com.android.server.wm.WindowState.destroyOrSaveSurface:2100 com.android.server.wm.AppWindowToken.destroySurfaces:363 com.android.server.wm.AppWindowToken.notifyAppStopped:389 com.android.server.wm.WindowManagerService.notifyAppStopped:4463 com.android.server.am.ActivityStack.activityStoppedLocked:1252 com.android.server.am.ActivityManagerService.activityStopped:6903 
06-05 21:21:52.279 W/ResourceType(10393): No package identifier when getting name for resource number 0x00000001
06-05 21:21:52.291 I/System.out(10393): URI: //gesture
06-05 21:21:52.291 I/System.out(10393): params: {json={"query_timeout":5.0,"gestures":[{"query_string":"* marked:'East'","touches":[{"x":50,"y":50,"offset_x":0,"offset_y":0,"wait":0.0,"time":0.2,"release":true,"query_string":null}]}]}
06-05 21:21:52.291 I/System.out(10393): }
06-05 21:21:52.295 W/ResourceType(10393): No package identifier when getting name for resource number 0x00000001
06-05 21:21:52.528 I/ActivityManager( 1630): START u0 {cmp=com.evancharlton.mileage/.charts.EastChart (has extras)} from uid 10286 on display 0
06-05 21:21:52.530 V/PhoneStatusBar( 1711): setLightsOn(true)
06-05 21:21:52.530 V/PhoneStatusBar( 1711): setLightsOn(true)
06-05 21:21:52.539 I/System.out(10393): URI: //map
06-05 21:21:52.539 I/System.out(10393): params: {json={"query":"* {text CONTAINS[c] 'Farthest east fillup'}","operation":{"method_name":"query","arguments":[]}}
06-05 21:21:52.539 I/System.out(10393): }
06-05 21:21:52.594 I/calabash(10393): newActivity1
06-05 21:21:52.598 W/aiCharts(10393): License file is invalid or missing. 
06-05 21:21:52.598 W/aiCharts(10393): Please place proper license.lic to /assets folder.
06-05 21:21:52.615 V/PhoneStatusBar( 1711): setLightsOn(true)
06-05 21:21:52.644 V/PhoneStatusBar( 1711): setLightsOn(true)
06-05 21:21:52.649 I/WindowManager( 1630): Destroying surface Surface(name=Creating chart…) called by com.android.server.wm.WindowStateAnimator.destroySurface:2016 com.android.server.wm.WindowStateAnimator.destroySurfaceLocked:882 com.android.server.wm.WindowState.removeLocked:1456 com.android.server.wm.WindowManagerService.removeWindowInnerLocked:2484 com.android.server.wm.WindowManagerService.removeWindowLocked:2442 com.android.server.wm.WindowManagerService.removeWindowLocked:2311 com.android.server.wm.WindowManagerService.removeWindow:2306 com.android.server.wm.Session.remove:202 
06-05 21:21:52.652 D/gralloc_ranchu( 1347): gralloc_alloc: Creating ashmem region of size 9023488
06-05 21:21:52.661 V/PhoneStatusBar( 1711): setLightsOn(true)
06-05 21:21:52.686 I/ActivityManager( 1630): Displayed com.evancharlton.mileage/.charts.EastChart: +95ms
06-05 21:21:52.694 V/PhoneStatusBar( 1711): setLightsOn(true)
06-05 21:21:52.727 V/PhoneStatusBar( 1711): setLightsOn(true)
06-05 21:21:52.744 V/PhoneStatusBar( 1711): setLightsOn(true)
06-05 21:21:52.928 V/PhoneStatusBar( 1711): setLightsOn(true)
06-05 21:21:52.930 I/System.out(10393): URI: //map
06-05 21:21:52.930 I/System.out(10393): params: {json={"query":"* {text CONTAINS[c] 'Farthest east fillup'}","operation":{"method_name":"query","arguments":[]}}
06-05 21:21:52.930 I/System.out(10393): }
06-05 21:21:52.944 I/System.out(10393): URI: //
06-05 21:21:52.944 I/System.out(10393): params: {json={"command":"press_key","arguments":["KEYCODE_BACK"]}
06-05 21:21:52.944 I/System.out(10393): }
06-05 21:21:52.944 I/System.out(10393): header: {content-type=application/json;charset=utf-8, date=Sat, 06 Jun 2020 02:21:53 GMT, accept=*/*, host=127.0.0.1:34777, content-length=52, user-agent=HTTPClient/1.0 (2.8.3, ruby 2.5.1 (2018-03-29))}
06-05 21:21:52.944 I/System.out(10393): params: {json={"command":"press_key","arguments":["KEYCODE_BACK"]}
06-05 21:21:52.944 I/System.out(10393): }
06-05 21:21:52.944 I/System.out(10393): ProP json = {"command":"press_key","arguments":["KEYCODE_BACK"]}
06-05 21:21:52.944 I/System.out(10393): files: {}
06-05 21:21:52.944 I/System.out(10393): command: {"command":"press_key","arguments":["KEYCODE_BACK"]}
06-05 21:21:52.945 I/InstrumentationBackend(10393): Got command:'Command:'Line:null,press_key', arguments:'[KEYCODE_BACK]'
06-05 21:21:52.948 V/PhoneStatusBar( 1711): setLightsOn(true)
06-05 21:21:52.950 V/PhoneStatusBar( 1711): setLightsOn(true)
06-05 21:21:52.952 I/art     (10393): Do partial code cache collection, code=60KB, data=62KB
06-05 21:21:52.952 I/System.out(10393): result:{"bonusInformation":[],"message":"","success":true}
06-05 21:21:52.952 I/art     (10393): After code cache collection, code=59KB, data=61KB
06-05 21:21:52.952 I/art     (10393): Increasing code cache capacity to 256KB
06-05 21:21:52.953 D/VehicleStatisticsActivity(10393): Checking recalculation ...
06-05 21:21:52.954 D/VehicleStatisticsActivity(10393): Recalculation not necessary.
06-05 21:21:52.955 I/System.out(10393): URI: //map
06-05 21:21:52.955 I/System.out(10393): params: {json={"query":"* {text CONTAINS[c] 'Statistics'}","operation":{"method_name":"query","arguments":[]}}
06-05 21:21:52.955 I/System.out(10393): }
06-05 21:21:52.961 V/PhoneStatusBar( 1711): setLightsOn(true)
06-05 21:21:52.977 D/gralloc_ranchu( 1347): gralloc_alloc: Creating ashmem region of size 9023488
06-05 21:21:52.978 V/PhoneStatusBar( 1711): setLightsOn(true)
06-05 21:21:52.994 V/PhoneStatusBar( 1711): setLightsOn(true)
06-05 21:21:53.011 V/PhoneStatusBar( 1711): setLightsOn(true)
