--------- beginning of main
06-05 19:59:37.452 V/PhoneStatusBar( 1711): setLightsOn(true)
06-05 19:59:37.470 D/gralloc_ranchu( 1348): gralloc_alloc: Creating ashmem region of size 3145728
06-05 19:59:37.477 E/EGL_emulation( 1348): tid 1348: eglCreateSyncKHR(1901): error 0x3004 (EGL_BAD_ATTRIBUTE)
--------- beginning of system
06-05 19:59:37.492 W/ActivityManager( 1629): Finishing task with all activities already finished
06-05 19:59:37.492 W/ActivityManager( 1629): Duplicate finish request for ActivityRecord{ec902d8 u0 com.evancharlton.mileage/.Mileage t4462 f}
06-05 19:59:37.492 W/ActivityManager( 1629): Finishing task with all activities already finished
06-05 19:59:37.492 W/ActivityManager( 1629): Duplicate finish request for ActivityRecord{ec902d8 u0 com.evancharlton.mileage/.Mileage t4462 f}
06-05 19:59:37.493 W/ActivityManager( 1629): Finishing task with all activities already finished
06-05 19:59:37.493 W/ActivityManager( 1629): Duplicate finish request for ActivityRecord{ec902d8 u0 com.evancharlton.mileage/.Mileage t4462 f}
06-05 19:59:37.493 W/ActivityManager( 1629): Finishing task with all activities already finished
06-05 19:59:37.493 W/ActivityManager( 1629): Duplicate finish request for ActivityRecord{ec902d8 u0 com.evancharlton.mileage/.Mileage t4462 f}
06-05 19:59:37.493 W/ActivityManager( 1629): Finishing task with all activities already finished
06-05 19:59:37.493 W/ActivityManager( 1629): Duplicate finish request for ActivityRecord{ec902d8 u0 com.evancharlton.mileage/.Mileage t4462 f}
06-05 19:59:37.493 W/ActivityManager( 1629): Finishing task with all activities already finished
06-05 19:59:37.493 W/ActivityManager( 1629): Duplicate finish request for ActivityRecord{f52c002 u0 com.evancharlton.mileage/.charts.MaximumVolumeChart t4462 f}
06-05 19:59:37.493 W/ActivityManager( 1629): Finishing task with all activities already finished
06-05 19:59:37.493 W/ActivityManager( 1629): Duplicate finish request for ActivityRecord{f52c002 u0 com.evancharlton.mileage/.charts.MaximumVolumeChart t4462 f}
06-05 19:59:37.493 W/ActivityManager( 1629): Finishing task with all activities already finished
06-05 19:59:37.493 W/ActivityManager( 1629): Duplicate finish request for ActivityRecord{ec902d8 u0 com.evancharlton.mileage/.Mileage t4462 f}
06-05 19:59:37.493 W/ActivityManager( 1629): Finishing task with all activities already finished
06-05 19:59:37.493 W/ActivityManager( 1629): Duplicate finish request for ActivityRecord{ec902d8 u0 com.evancharlton.mileage/.Mileage t4462 f}
06-05 19:59:37.536 D/EGL_emulation( 2147): eglMakeCurrent: 0xa3805360: ver 2 0 (tinfo 0xa3803630)
06-05 19:59:37.536 D/EGL_emulation( 1711): eglMakeCurrent: 0x9f1709c0: ver 2 0 (tinfo 0xa0e61d00)
06-05 19:59:37.553 D/EGL_emulation( 1711): eglMakeCurrent: 0x9f1709c0: ver 2 0 (tinfo 0xa0e61d00)
06-05 19:59:37.567 D/AndroidRuntime(20674): >>>>>> START com.android.internal.os.RuntimeInit uid 2000 <<<<<<
06-05 19:59:37.568 D/AndroidRuntime(20674): CheckJNI is ON
06-05 19:59:37.569 D/EGL_emulation( 1711): eglMakeCurrent: 0x9f1709c0: ver 2 0 (tinfo 0xa0e61d00)
06-05 19:59:37.582 W/art     (20674): Unexpected CPU variant for X86 using defaults: x86
06-05 19:59:37.590 D/EGL_emulation( 1711): eglMakeCurrent: 0x9f1709c0: ver 2 0 (tinfo 0xa0e61d00)
06-05 19:59:37.591 D/ICU     (20674): No timezone override file found: /data/misc/zoneinfo/current/icu/icu_tzdata.dat
06-05 19:59:37.592 D/EGL_emulation( 1711): eglMakeCurrent: 0x9f1709c0: ver 2 0 (tinfo 0xa0e61d00)
06-05 19:59:37.600 E/memtrack(20674): Couldn't load memtrack module (No such file or directory)
06-05 19:59:37.600 E/android.os.Debug(20674): failed to load memtrack module: -2
06-05 19:59:37.600 I/Radio-JNI(20674): register_android_hardware_Radio DONE
06-05 19:59:37.601 D/EGL_emulation( 1711): eglMakeCurrent: 0x9f1709c0: ver 2 0 (tinfo 0xa0e61d00)
06-05 19:59:37.603 D/EGL_emulation( 1711): eglMakeCurrent: 0x9f1709c0: ver 2 0 (tinfo 0xa0e61d00)
06-05 19:59:37.606 D/AndroidRuntime(20674): Calling main entry com.android.commands.am.Am
06-05 19:59:37.608 I/ActivityManager( 1629): Force stopping com.evancharlton.mileage appid=10196 user=0: start instr
06-05 19:59:37.608 I/ActivityManager( 1629): Killing 20622:com.evancharlton.mileage/u0a196 (adj 0): stop com.evancharlton.mileage
06-05 19:59:37.608 D/ActivityManager( 1629): cleanUpApplicationRecord -- 20622
06-05 19:59:37.608 I/WindowManager( 1629): Destroying surface Surface(name=com.evancharlton.mileage/com.evancharlton.mileage.charts.MaximumVolumeChart) called by com.android.server.wm.WindowStateAnimator.destroySurface:2016 com.android.server.wm.WindowStateAnimator.destroySurfaceLocked:882 com.android.server.wm.WindowState.removeLocked:1456 com.android.server.wm.WindowManagerService.removeWindowInnerLocked:2484 com.android.server.wm.WindowManagerService.removeWindowLocked:2442 com.android.server.wm.WindowManagerService.removeWindowLocked:2311 com.android.server.wm.AppWindowToken.removeAllWindows:530 com.android.server.wm.AppWindowToken.removeAppFromTaskLocked:326 
06-05 19:59:37.609 W/ActivityManager( 1629): Crash of app com.evancharlton.mileage running instrumentation ComponentInfo{com.evancharlton.mileage.test/sh.calaba.instrumentationbackend.CalabashInstrumentationTestRunner}
06-05 19:59:37.609 I/ActivityManager( 1629): Force stopping com.evancharlton.mileage appid=10196 user=0: finished inst
06-05 19:59:37.613 I/art     (20684): Not late-enabling -Xcheck:jni (already on)
06-05 19:59:37.613 W/art     (20684): Unexpected CPU variant for X86 using defaults: x86
06-05 19:59:37.618 D/EGL_emulation( 1711): eglMakeCurrent: 0x9f1709c0: ver 2 0 (tinfo 0xa0e61d00)
06-05 19:59:37.620 I/ActivityManager( 1629): Start proc 20684:com.evancharlton.mileage/u0a196 for added application com.evancharlton.mileage
06-05 19:59:37.621 D/AndroidRuntime(20674): Shutting down VM
06-05 19:59:37.621 D/EGL_emulation( 1711): eglMakeCurrent: 0x9f1709c0: ver 2 0 (tinfo 0xa0e61d00)
06-05 19:59:37.628 W/System  (20684): ClassLoader referenced unknown path: /data/app/com.evancharlton.mileage.test-1/lib/x86
06-05 19:59:37.628 W/System  (20684): ClassLoader referenced unknown path: /data/app/com.evancharlton.mileage-1/lib/x86
06-05 19:59:37.630 W/System  (20684): ClassLoader referenced unknown path: 
06-05 19:59:37.635 D/EGL_emulation( 1711): eglMakeCurrent: 0x9f1709c0: ver 2 0 (tinfo 0xa0e61d00)
06-05 19:59:37.636 I/System.out(20684): Main activity name automatically set to: com.evancharlton.mileage.Mileage
06-05 19:59:37.636 I/System.out(20684): Calabash did not load Mono. This is only a problem if you are trying to test a Mono application
06-05 19:59:37.637 I/calabash(20684): Test server port: 7102
06-05 19:59:37.638 I/InstrumentationBackend(20684): Added:'GetPreferences', with key:'get_preferences'
06-05 19:59:37.639 D/EGL_emulation( 1711): eglMakeCurrent: 0x9f1709c0: ver 2 0 (tinfo 0xa0e61d00)
06-05 19:59:37.645 I/InstrumentationBackend(20684): Added:'SetPreferences', with key:'set_preferences'
06-05 19:59:37.645 I/InstrumentationBackend(20684): Added:'ClearPreferences', with key:'clear_preferences'
06-05 19:59:37.645 I/InstrumentationBackend(20684): Added:'PressElement', with key:'press_l10n_element'
06-05 19:59:37.645 I/InstrumentationBackend(20684): Added:'WaitForElement', with key:'wait_for_l10n_element'
06-05 19:59:37.645 I/InstrumentationBackend(20684): Added:'NullAction', with key:'nullAction'
06-05 19:59:37.645 I/InstrumentationBackend(20684): Added:'PressKey', with key:'press_key'
06-05 19:59:37.645 I/InstrumentationBackend(20684): Added:'SetActivityOrientation', with key:'set_activity_orientation'
06-05 19:59:37.645 I/InstrumentationBackend(20684): Added:'GetActivityOrientation', with key:'get_activity_orientation'
06-05 19:59:37.645 I/InstrumentationBackend(20684): Added:'FakeGPSLocation', with key:'set_gps_coordinates'
06-05 19:59:37.645 I/InstrumentationBackend(20684): Added:'SetPropertyByCssSelector', with key:'set_property_by_css_selector'
06-05 19:59:37.645 I/InstrumentationBackend(20684): Added:'GetUrl', with key:'get_url'
06-05 19:59:37.646 I/InstrumentationBackend(20684): Added:'ScrollTo', with key:'scroll_to'
06-05 19:59:37.646 I/InstrumentationBackend(20684): Added:'GetLoadProgress', with key:'get_load_progress'
06-05 19:59:37.646 I/InstrumentationBackend(20684): Added:'DumpHtml', with key:'dump_html'
06-05 19:59:37.646 I/InstrumentationBackend(20684): Added:'DumpBodyHtml', with key:'dump_body_html'
06-05 19:59:37.646 I/InstrumentationBackend(20684): Added:'EnterTextByCssSelector', with key:'enter_text_by_selector'
06-05 19:59:37.647 I/InstrumentationBackend(20684): Added:'AndroidSDKVersion', with key:'android_sdk_version'
06-05 19:59:37.647 I/InstrumentationBackend(20684): Added:'Version', with key:'version'
06-05 19:59:37.647 I/InstrumentationBackend(20684): Added:'Drag', with key:'drag'
06-05 19:59:37.647 I/InstrumentationBackend(20684): Added:'TouchCoordinates', with key:'touch_coordinate'
06-05 19:59:37.647 I/InstrumentationBackend(20684): Added:'LongPressCoordinate', with key:'long_press_coordinate'
06-05 19:59:37.647 I/InstrumentationBackend(20684): Added:'DragCoordinates', with key:'drag_coordinates'
06-05 19:59:37.647 I/InstrumentationBackend(20684): Added:'ResumeApplication', with key:'resume_application'
06-05 19:59:37.647 I/InstrumentationBackend(20684): Added:'Swipe', with key:'swipe'
06-05 19:59:37.647 I/InstrumentationBackend(20684): Added:'DoubleTapCoordinate', with key:'double_tap_coordinate'
06-05 19:59:37.647 I/InstrumentationBackend(20684): Added:'ClickOnScreen', with key:'click_on_screen'
06-05 19:59:37.647 I/InstrumentationBackend(20684): Added:'GetActivityName', with key:'get_activity_name'
06-05 19:59:37.647 I/InstrumentationBackend(20684): Added:'ScrollToView', with key:'scroll_to_view'
06-05 19:59:37.647 I/InstrumentationBackend(20684): Added:'ViewConfiguration', with key:'view_configuration'
06-05 19:59:37.648 I/InstrumentationBackend(20684): Added:'IsCurrentActivityFocused', with key:'is_current_activity_focused'
06-05 19:59:37.648 I/InstrumentationBackend(20684): Added:'SendTcp', with key:'send_tcp'
06-05 19:59:37.648 I/InstrumentationBackend(20684): Added:'DpToDevicePixel', with key:'dp_to_device_pixel'
06-05 19:59:37.648 I/InstrumentationBackend(20684): Added:'KeyboardEnterText', with key:'keyboard_enter_text'
06-05 19:59:37.648 I/InstrumentationBackend(20684): Added:'DeleteSurroundingText', with key:'delete_surrounding_text'
06-05 19:59:37.648 I/InstrumentationBackend(20684): Added:'SetComposingRegion', with key:'set_composing_region'
06-05 19:59:37.648 I/InstrumentationBackend(20684): Added:'SetSelection', with key:'set_selection'
06-05 19:59:37.648 I/InstrumentationBackend(20684): Added:'KeyboardKeyEvent', with key:'keyboard_key_event'
06-05 19:59:37.648 I/InstrumentationBackend(20684): Added:'PressUserActionButton', with key:'press_user_action_button'
06-05 19:59:37.648 I/InstrumentationBackend(20684): Added:'HideSoftKeyboard', with key:'hide_soft_keyboard'
06-05 19:59:37.648 I/InstrumentationBackend(20684): Added:'ListActions', with key:'list_actions'
06-05 19:59:37.648 I/calabash(20684): Instantiating http server at 7102
06-05 19:59:37.649 I/System.out(20684): HTTP Daemon listening on: 7102
06-05 19:59:37.658 I/WindowManager( 1629): WIN DEATH: Window{c848787 u0 com.evancharlton.mileage/com.evancharlton.mileage.Mileage EXITING}
06-05 19:59:37.659 D/EGL_emulation( 1711): eglMakeCurrent: 0x9f1709c0: ver 2 0 (tinfo 0xa0e61d00)
06-05 19:59:37.669 D/EGL_emulation( 1711): eglMakeCurrent: 0x9f1709c0: ver 2 0 (tinfo 0xa0e61d00)
06-05 19:59:37.671 D/EGL_emulation( 1711): eglMakeCurrent: 0x9f1709c0: ver 2 0 (tinfo 0xa0e61d00)
06-05 19:59:37.673 D/EGL_emulation( 1711): eglMakeCurrent: 0x9f1709c0: ver 2 0 (tinfo 0xa0e61d00)
06-05 19:59:37.685 D/EGL_emulation( 1711): eglMakeCurrent: 0x9f1709c0: ver 2 0 (tinfo 0xa0e61d00)
06-05 19:59:37.687 D/EGL_emulation( 1711): eglMakeCurrent: 0x9f1709c0: ver 2 0 (tinfo 0xa0e61d00)
06-05 19:59:37.702 D/EGL_emulation( 1711): eglMakeCurrent: 0x9f1709c0: ver 2 0 (tinfo 0xa0e61d00)
06-05 19:59:37.705 D/EGL_emulation( 1711): eglMakeCurrent: 0x9f1709c0: ver 2 0 (tinfo 0xa0e61d00)
06-05 19:59:37.718 D/EGL_emulation( 1711): eglMakeCurrent: 0x9f1709c0: ver 2 0 (tinfo 0xa0e61d00)
06-05 19:59:37.720 D/EGL_emulation( 1711): eglMakeCurrent: 0x9f1709c0: ver 2 0 (tinfo 0xa0e61d00)
06-05 19:59:37.731 I/System.out(20684): URI: //ping
06-05 19:59:37.731 I/System.out(20684): params: {json={}
06-05 19:59:37.731 I/System.out(20684): }
06-05 19:59:37.733 I/System.out(20684): URI: //ping
06-05 19:59:37.733 I/System.out(20684): params: {json={}
06-05 19:59:37.733 I/System.out(20684): }
06-05 19:59:37.736 I/System.out(20684): URI: //ready
06-05 19:59:37.736 I/System.out(20684): params: {json={}
06-05 19:59:37.736 I/System.out(20684): }
06-05 19:59:37.737 I/System.out(20684): URI: //
06-05 19:59:37.737 I/System.out(20684): params: {json={"command":"version","arguments":[]}
06-05 19:59:37.737 I/System.out(20684): }
06-05 19:59:37.738 I/System.out(20684): header: {content-type=application/json;charset=utf-8, date=Sat, 06 Jun 2020 00:59:38 GMT, accept=*/*, host=127.0.0.1:34783, content-length=36, user-agent=HTTPClient/1.0 (2.8.3, ruby 2.5.1 (2018-03-29))}
06-05 19:59:37.738 I/System.out(20684): params: {json={"command":"version","arguments":[]}
06-05 19:59:37.738 I/System.out(20684): }
06-05 19:59:37.738 I/System.out(20684): ProP json = {"command":"version","arguments":[]}
06-05 19:59:37.738 I/System.out(20684): files: {}
06-05 19:59:37.738 I/System.out(20684): command: {"command":"version","arguments":[]}
06-05 19:59:37.740 I/InstrumentationBackend(20684): Got command:'Command:'Line:null,version', arguments:'[]'
06-05 19:59:37.745 I/System.out(20684): result:{"bonusInformation":[],"message":"0.9.8","success":true}
06-05 19:59:37.747 I/System.out(20684): URI: //start-application
06-05 19:59:37.747 I/System.out(20684): params: {json={"intent":null}
06-05 19:59:37.747 I/System.out(20684): }
06-05 19:59:37.751 D/EGL_emulation( 1711): eglMakeCurrent: 0x9f1709c0: ver 2 0 (tinfo 0xa0e61d00)
06-05 19:59:37.753 D/EGL_emulation( 1711): eglMakeCurrent: 0x9f1709c0: ver 2 0 (tinfo 0xa0e61d00)
06-05 19:59:37.757 I/ActivityManager( 1629): START u0 {act=android.intent.action.MAIN cat=[android.intent.category.LAUNCHER] flg=0x10200000 cmp=com.evancharlton.mileage/.Mileage} from uid 10196 on display 0
06-05 19:59:37.761 I/calabash(20684): newActivity1
06-05 19:59:37.768 D/EGL_emulation( 1711): eglMakeCurrent: 0x9f1709c0: ver 2 0 (tinfo 0xa0e61d00)
06-05 19:59:37.770 D/EGL_emulation( 1711): eglMakeCurrent: 0x9f1709c0: ver 2 0 (tinfo 0xa0e61d00)
06-05 19:59:37.771 I/calabash(20684): newActivity1
06-05 19:59:37.772 W/ActivityManager( 1629): Bad activity token: android.os.BinderProxy@54ac94f
06-05 19:59:37.772 W/ActivityManager( 1629): java.lang.ClassCastException: android.os.BinderProxy cannot be cast to com.android.server.am.ActivityRecord$Token
06-05 19:59:37.772 W/ActivityManager( 1629): 	at com.android.server.am.ActivityRecord.forTokenLocked(ActivityRecord.java:586)
06-05 19:59:37.772 W/ActivityManager( 1629): 	at com.android.server.am.ActivityRecord.isInStackLocked(ActivityRecord.java:1327)
06-05 19:59:37.772 W/ActivityManager( 1629): 	at com.android.server.am.ActivityRecord.getStackLocked(ActivityRecord.java:1332)
06-05 19:59:37.772 W/ActivityManager( 1629): 	at com.android.server.am.ActivityManagerService.getActivityDisplayId(ActivityManagerService.java:9806)
06-05 19:59:37.772 W/ActivityManager( 1629): 	at android.app.ActivityManagerNative.onTransact(ActivityManagerNative.java:2566)
06-05 19:59:37.772 W/ActivityManager( 1629): 	at com.android.server.am.ActivityManagerService.onTransact(ActivityManagerService.java:2757)
06-05 19:59:37.772 W/ActivityManager( 1629): 	at android.os.Binder.execTransact(Binder.java:565)
06-05 19:59:37.773 W/ActivityManager( 1629): Bad activity token: android.os.BinderProxy@54ac94f
06-05 19:59:37.773 W/ActivityManager( 1629): java.lang.ClassCastException: android.os.BinderProxy cannot be cast to com.android.server.am.ActivityRecord$Token
06-05 19:59:37.773 W/ActivityManager( 1629): 	at com.android.server.am.ActivityRecord.forTokenLocked(ActivityRecord.java:586)
06-05 19:59:37.773 W/ActivityManager( 1629): 	at com.android.server.am.ActivityRecord.isInStackLocked(ActivityRecord.java:1327)
06-05 19:59:37.773 W/ActivityManager( 1629): 	at com.android.server.am.ActivityManagerService.setTaskDescription(ActivityManagerService.java:9358)
06-05 19:59:37.773 W/ActivityManager( 1629): 	at android.app.ActivityManagerNative.onTransact(ActivityManagerNative.java:2639)
06-05 19:59:37.773 W/ActivityManager( 1629): 	at com.android.server.am.ActivityManagerService.onTransact(ActivityManagerService.java:2757)
06-05 19:59:37.773 W/ActivityManager( 1629): 	at android.os.Binder.execTransact(Binder.java:565)
06-05 19:59:37.773 W/ActivityManager( 1629): Bad activity token: android.os.BinderProxy@54ac94f
06-05 19:59:37.773 W/ActivityManager( 1629): java.lang.ClassCastException: android.os.BinderProxy cannot be cast to com.android.server.am.ActivityRecord$Token
06-05 19:59:37.773 W/ActivityManager( 1629): 	at com.android.server.am.ActivityRecord.forTokenLocked(ActivityRecord.java:586)
06-05 19:59:37.773 W/ActivityManager( 1629): 	at com.android.server.am.ActivityRecord.isInStackLocked(ActivityRecord.java:1327)
06-05 19:59:37.773 W/ActivityManager( 1629): 	at com.android.server.am.ActivityRecord.getStackLocked(ActivityRecord.java:1332)
06-05 19:59:37.773 W/ActivityManager( 1629): 	at com.android.server.am.ActivityManagerService.getActivityStackId(ActivityManagerService.java:9817)
06-05 19:59:37.773 W/ActivityManager( 1629): 	at android.app.ActivityManagerNative.onTransact(ActivityManagerNative.java:2856)
06-05 19:59:37.773 W/ActivityManager( 1629): 	at com.android.server.am.ActivityManagerService.onTransact(ActivityManagerService.java:2757)
06-05 19:59:37.773 W/ActivityManager( 1629): 	at android.os.Binder.execTransact(Binder.java:565)
06-05 19:59:37.784 D/gralloc_ranchu( 1348): gralloc_alloc: Creating ashmem region of size 9023488
06-05 19:59:37.785 D/EGL_emulation( 1711): eglMakeCurrent: 0x9f1709c0: ver 2 0 (tinfo 0xa0e61d00)
06-05 19:59:37.789 W/ActivityManager( 1629): Bad activity token: android.os.BinderProxy@54ac94f
06-05 19:59:37.789 W/ActivityManager( 1629): java.lang.ClassCastException: android.os.BinderProxy cannot be cast to com.android.server.am.ActivityRecord$Token
06-05 19:59:37.789 W/ActivityManager( 1629): 	at com.android.server.am.ActivityRecord.forTokenLocked(ActivityRecord.java:586)
06-05 19:59:37.789 W/ActivityManager( 1629): 	at com.android.server.am.ActivityRecord.isInStackLocked(ActivityRecord.java:1327)
06-05 19:59:37.789 W/ActivityManager( 1629): 	at com.android.server.am.ActivityManagerService.getActivityOptions(ActivityManagerService.java:12559)
06-05 19:59:37.789 W/ActivityManager( 1629): 	at android.app.ActivityManagerNative.onTransact(ActivityManagerNative.java:1933)
06-05 19:59:37.789 W/ActivityManager( 1629): 	at com.android.server.am.ActivityManagerService.onTransact(ActivityManagerService.java:2757)
06-05 19:59:37.789 W/ActivityManager( 1629): 	at android.os.Binder.execTransact(Binder.java:565)
06-05 19:59:37.789 W/ActivityManager( 1629): Bad activity token: android.os.BinderProxy@54ac94f
06-05 19:59:37.789 W/ActivityManager( 1629): java.lang.ClassCastException: android.os.BinderProxy cannot be cast to com.android.server.am.ActivityRecord$Token
06-05 19:59:37.789 W/ActivityManager( 1629): 	at com.android.server.am.ActivityRecord.forTokenLocked(ActivityRecord.java:586)
06-05 19:59:37.789 W/ActivityManager( 1629): 	at com.android.server.am.ActivityRecord.isInStackLocked(ActivityRecord.java:1327)
06-05 19:59:37.789 W/ActivityManager( 1629): 	at com.android.server.am.ActivityManagerService.getActivityOptions(ActivityManagerService.java:12559)
06-05 19:59:37.789 W/ActivityManager( 1629): 	at android.app.ActivityManagerNative.onTransact(ActivityManagerNative.java:1933)
06-05 19:59:37.789 W/ActivityManager( 1629): 	at com.android.server.am.ActivityManagerService.onTransact(ActivityManagerService.java:2757)
06-05 19:59:37.789 W/ActivityManager( 1629): 	at android.os.Binder.execTransact(Binder.java:565)
06-05 19:59:37.811 V/PhoneStatusBar( 1711): setLightsOn(true)
06-05 19:59:37.818 D/EGL_emulation( 2147): eglMakeCurrent: 0xa3805360: ver 2 0 (tinfo 0xa3803630)
06-05 19:59:37.834 D/gralloc_ranchu( 1348): gralloc_alloc: Creating ashmem region of size 9023488
06-05 19:59:37.834 D/EGL_emulation( 1711): eglMakeCurrent: 0x9f1709c0: ver 2 0 (tinfo 0xa0e61d00)
06-05 19:59:37.841 D/        (20684): HostConnection::get() New Host Connection established 0x9f13cfc0, tid 20684
06-05 19:59:37.842 D/EGL_emulation( 1711): eglMakeCurrent: 0x9f1709c0: ver 2 0 (tinfo 0xa0e61d00)
06-05 19:59:37.875 D/EGL_emulation( 1711): eglMakeCurrent: 0x9f1709c0: ver 2 0 (tinfo 0xa0e61d00)
06-05 19:59:37.876 V/PhoneStatusBar( 1711): setLightsOn(true)
06-05 19:59:37.877 D/EGL_emulation( 1711): eglMakeCurrent: 0x9f1709c0: ver 2 0 (tinfo 0xa0e61d00)
06-05 19:59:37.887 D/EGL_emulation( 1711): eglMakeCurrent: 0x9f1709c0: ver 2 0 (tinfo 0xa0e61d00)
06-05 19:59:37.889 D/EGL_emulation( 1711): eglMakeCurrent: 0x9f1709c0: ver 2 0 (tinfo 0xa0e61d00)
06-05 19:59:37.901 D/EGL_emulation( 1711): eglMakeCurrent: 0x9f1709c0: ver 2 0 (tinfo 0xa0e61d00)
06-05 19:59:37.903 D/EGL_emulation( 1711): eglMakeCurrent: 0x9f1709c0: ver 2 0 (tinfo 0xa0e61d00)
06-05 19:59:37.918 D/EGL_emulation( 1711): eglMakeCurrent: 0x9f1709c0: ver 2 0 (tinfo 0xa0e61d00)
06-05 19:59:37.919 D/gralloc_ranchu( 1348): gralloc_alloc: Creating ashmem region of size 9023488
06-05 19:59:37.933 D/EGL_emulation( 1711): eglMakeCurrent: 0x9f1709c0: ver 2 0 (tinfo 0xa0e61d00)
06-05 19:59:37.935 I/ActivityManager( 1629): Displayed com.evancharlton.mileage/.Mileage: +174ms
06-05 19:59:37.935 D/EGL_emulation( 1711): eglMakeCurrent: 0x9f1709c0: ver 2 0 (tinfo 0xa0e61d00)
06-05 19:59:37.944 D/EGL_emulation( 1711): eglMakeCurrent: 0x9f1709c0: ver 2 0 (tinfo 0xa0e61d00)
06-05 19:59:37.951 D/EGL_emulation( 1711): eglMakeCurrent: 0x9f1709c0: ver 2 0 (tinfo 0xa0e61d00)
06-05 19:59:37.959 D/EGL_emulation( 1711): eglMakeCurrent: 0x9f1709c0: ver 2 0 (tinfo 0xa0e61d00)
06-05 19:59:37.968 I/WindowManager( 1629): Destroying surface Surface(name=com.evancharlton.mileage/com.evancharlton.mileage.Mileage) called by com.android.server.wm.WindowStateAnimator.destroySurface:2016 com.android.server.wm.WindowStateAnimator.destroySurfaceLocked:882 com.android.server.wm.WindowState.removeLocked:1456 com.android.server.wm.WindowManagerService.removeWindowInnerLocked:2484 com.android.server.wm.AppWindowToken.destroySurfaces:365 com.android.server.wm.WindowStateAnimator.finishExit:565 com.android.server.wm.AppWindowAnimator.stepAnimationLocked:427 com.android.server.wm.WindowAnimator.updateAppWindowsLocked:196 
06-05 19:59:37.968 D/EGL_emulation( 1711): eglMakeCurrent: 0x9f1709c0: ver 2 0 (tinfo 0xa0e61d00)
06-05 19:59:37.970 D/EGL_emulation( 1711): eglMakeCurrent: 0x9f1709c0: ver 2 0 (tinfo 0xa0e61d00)
06-05 19:59:37.976 I/System.out(20684): URI: //map
06-05 19:59:37.976 I/System.out(20684): params: {json={"query":"* marked:'Statistics'","operation":{"method_name":"query","arguments":[]}}
06-05 19:59:37.976 I/System.out(20684): }
06-05 19:59:37.985 D/EGL_emulation( 1711): eglMakeCurrent: 0x9f1709c0: ver 2 0 (tinfo 0xa0e61d00)
06-05 19:59:37.986 V/PhoneStatusBar( 1711): setLightsOn(true)
06-05 19:59:37.988 D/EGL_emulation( 1711): eglMakeCurrent: 0x9f1709c0: ver 2 0 (tinfo 0xa0e61d00)
06-05 19:59:37.995 W/ResourceType(20684): No package identifier when getting name for resource number 0x00000001
06-05 19:59:38.001 D/EGL_emulation( 1711): eglMakeCurrent: 0x9f1709c0: ver 2 0 (tinfo 0xa0e61d00)
06-05 19:59:38.004 D/EGL_emulation( 1711): eglMakeCurrent: 0x9f1709c0: ver 2 0 (tinfo 0xa0e61d00)
06-05 19:59:38.012 I/System.out(20684): URI: //gesture
06-05 19:59:38.012 I/System.out(20684): params: {json={"query_timeout":5.0,"gestures":[{"query_string":"* marked:'Statistics'","touches":[{"x":50,"y":50,"offset_x":0,"offset_y":0,"wait":0.0,"time":0.2,"release":true,"query_string":null}]}]}
06-05 19:59:38.012 I/System.out(20684): }
06-05 19:59:38.018 W/ResourceType(20684): No package identifier when getting name for resource number 0x00000001
06-05 19:59:38.018 D/EGL_emulation( 1711): eglMakeCurrent: 0x9f1709c0: ver 2 0 (tinfo 0xa0e61d00)
06-05 19:59:38.019 D/EGL_emulation( 1711): eglMakeCurrent: 0x9f1709c0: ver 2 0 (tinfo 0xa0e61d00)
06-05 19:59:38.034 D/EGL_emulation( 1711): eglMakeCurrent: 0x9f1709c0: ver 2 0 (tinfo 0xa0e61d00)
06-05 19:59:38.042 D/EGL_emulation( 1711): eglMakeCurrent: 0x9f1709c0: ver 2 0 (tinfo 0xa0e61d00)
06-05 19:59:38.135 I/WindowManager( 1629): Destroying surface Surface(name=Starting com.evancharlton.mileage) called by com.android.server.wm.WindowStateAnimator.destroySurface:2016 com.android.server.wm.WindowStateAnimator.destroySurfaceLocked:882 com.android.server.wm.WindowState.destroyOrSaveSurface:2100 com.android.server.wm.AppWindowToken.destroySurfaces:363 com.android.server.wm.WindowStateAnimator.finishExit:565 com.android.server.wm.WindowStateAnimator.stepAnimationLocked:491 com.android.server.wm.WindowAnimator.updateWindowsLocked:303 com.android.server.wm.WindowAnimator.animateLocked:704 
06-05 19:59:38.141 V/PhoneStatusBar( 1711): setLightsOn(true)
06-05 19:59:38.169 V/PhoneStatusBar( 1711): setLightsOn(true)
06-05 19:59:38.258 I/calabash(20684): newActivity1
06-05 19:59:38.270 V/PhoneStatusBar( 1711): setLightsOn(true)
06-05 19:59:38.310 W/ActivityManager( 1629): Bad activity token: android.os.BinderProxy@9d15a55
06-05 19:59:38.310 W/ActivityManager( 1629): java.lang.ClassCastException: android.os.BinderProxy cannot be cast to com.android.server.am.ActivityRecord$Token
06-05 19:59:38.310 W/ActivityManager( 1629): 	at com.android.server.am.ActivityRecord.forTokenLocked(ActivityRecord.java:586)
06-05 19:59:38.310 W/ActivityManager( 1629): 	at com.android.server.am.ActivityRecord.isInStackLocked(ActivityRecord.java:1327)
06-05 19:59:38.310 W/ActivityManager( 1629): 	at com.android.server.am.ActivityRecord.getStackLocked(ActivityRecord.java:1332)
06-05 19:59:38.310 W/ActivityManager( 1629): 	at com.android.server.am.ActivityManagerService.getActivityDisplayId(ActivityManagerService.java:9806)
06-05 19:59:38.310 W/ActivityManager( 1629): 	at android.app.ActivityManagerNative.onTransact(ActivityManagerNative.java:2566)
06-05 19:59:38.310 W/ActivityManager( 1629): 	at com.android.server.am.ActivityManagerService.onTransact(ActivityManagerService.java:2757)
06-05 19:59:38.310 W/ActivityManager( 1629): 	at android.os.Binder.execTransact(Binder.java:565)
06-05 19:59:38.311 I/System.out(20684): URI: //map
06-05 19:59:38.311 I/System.out(20684): params: {json={"query":"android.widget.ScrollView index:0","operation":{"method_name":"query","arguments":[]}}
06-05 19:59:38.311 I/System.out(20684): }
06-05 19:59:38.313 W/ActivityManager( 1629): Bad activity token: android.os.BinderProxy@9d15a55
06-05 19:59:38.313 W/ActivityManager( 1629): java.lang.ClassCastException: android.os.BinderProxy cannot be cast to com.android.server.am.ActivityRecord$Token
06-05 19:59:38.313 W/ActivityManager( 1629): 	at com.android.server.am.ActivityRecord.forTokenLocked(ActivityRecord.java:586)
06-05 19:59:38.313 W/ActivityManager( 1629): 	at com.android.server.am.ActivityRecord.isInStackLocked(ActivityRecord.java:1327)
06-05 19:59:38.313 W/ActivityManager( 1629): 	at com.android.server.am.ActivityManagerService.setTaskDescription(ActivityManagerService.java:9358)
06-05 19:59:38.313 W/ActivityManager( 1629): 	at android.app.ActivityManagerNative.onTransact(ActivityManagerNative.java:2639)
06-05 19:59:38.313 W/ActivityManager( 1629): 	at com.android.server.am.ActivityManagerService.onTransact(ActivityManagerService.java:2757)
06-05 19:59:38.313 W/ActivityManager( 1629): 	at android.os.Binder.execTransact(Binder.java:565)
06-05 19:59:38.314 W/ActivityManager( 1629): Bad activity token: android.os.BinderProxy@9d15a55
06-05 19:59:38.314 W/ActivityManager( 1629): java.lang.ClassCastException: android.os.BinderProxy cannot be cast to com.android.server.am.ActivityRecord$Token
06-05 19:59:38.314 W/ActivityManager( 1629): 	at com.android.server.am.ActivityRecord.forTokenLocked(ActivityRecord.java:586)
06-05 19:59:38.314 W/ActivityManager( 1629): 	at com.android.server.am.ActivityRecord.isInStackLocked(ActivityRecord.java:1327)
06-05 19:59:38.314 W/ActivityManager( 1629): 	at com.android.server.am.ActivityRecord.getStackLocked(ActivityRecord.java:1332)
06-05 19:59:38.314 W/ActivityManager( 1629): 	at com.android.server.am.ActivityManagerService.getActivityStackId(ActivityManagerService.java:9817)
06-05 19:59:38.314 W/ActivityManager( 1629): 	at android.app.ActivityManagerNative.onTransact(ActivityManagerNative.java:2856)
06-05 19:59:38.314 W/ActivityManager( 1629): 	at com.android.server.am.ActivityManagerService.onTransact(ActivityManagerService.java:2757)
06-05 19:59:38.314 W/ActivityManager( 1629): 	at android.os.Binder.execTransact(Binder.java:565)
06-05 19:59:38.326 D/VehicleStatisticsActivity(20684): Checking recalculation ...
06-05 19:59:38.327 D/VehicleStatisticsActivity(20684): Recalculation not necessary.
06-05 19:59:38.335 W/ActivityManager( 1629): Bad activity token: android.os.BinderProxy@9d15a55
06-05 19:59:38.335 W/ActivityManager( 1629): java.lang.ClassCastException: android.os.BinderProxy cannot be cast to com.android.server.am.ActivityRecord$Token
06-05 19:59:38.335 W/ActivityManager( 1629): 	at com.android.server.am.ActivityRecord.forTokenLocked(ActivityRecord.java:586)
06-05 19:59:38.335 W/ActivityManager( 1629): 	at com.android.server.am.ActivityRecord.isInStackLocked(ActivityRecord.java:1327)
06-05 19:59:38.335 W/ActivityManager( 1629): 	at com.android.server.am.ActivityManagerService.getActivityOptions(ActivityManagerService.java:12559)
06-05 19:59:38.335 W/ActivityManager( 1629): 	at android.app.ActivityManagerNative.onTransact(ActivityManagerNative.java:1933)
06-05 19:59:38.335 W/ActivityManager( 1629): 	at com.android.server.am.ActivityManagerService.onTransact(ActivityManagerService.java:2757)
06-05 19:59:38.335 W/ActivityManager( 1629): 	at android.os.Binder.execTransact(Binder.java:565)
06-05 19:59:38.335 W/ActivityManager( 1629): Bad activity token: android.os.BinderProxy@9d15a55
06-05 19:59:38.335 W/ActivityManager( 1629): java.lang.ClassCastException: android.os.BinderProxy cannot be cast to com.android.server.am.ActivityRecord$Token
06-05 19:59:38.335 W/ActivityManager( 1629): 	at com.android.server.am.ActivityRecord.forTokenLocked(ActivityRecord.java:586)
06-05 19:59:38.335 W/ActivityManager( 1629): 	at com.android.server.am.ActivityRecord.isInStackLocked(ActivityRecord.java:1327)
06-05 19:59:38.335 W/ActivityManager( 1629): 	at com.android.server.am.ActivityManagerService.getActivityOptions(ActivityManagerService.java:12559)
06-05 19:59:38.335 W/ActivityManager( 1629): 	at android.app.ActivityManagerNative.onTransact(ActivityManagerNative.java:1933)
06-05 19:59:38.335 W/ActivityManager( 1629): 	at com.android.server.am.ActivityManagerService.onTransact(ActivityManagerService.java:2757)
06-05 19:59:38.335 W/ActivityManager( 1629): 	at android.os.Binder.execTransact(Binder.java:565)
06-05 19:59:38.336 D/VehicleStatisticsActivity(20684): Checking recalculation ...
06-05 19:59:38.337 D/VehicleStatisticsActivity(20684): Recalculation not necessary.
06-05 19:59:38.434 I/System.out(20684): URI: //map
06-05 19:59:38.434 I/System.out(20684): params: {json={"query":"android.widget.AbsListView index:0","operation":{"method_name":"query","arguments":[]}}
06-05 19:59:38.434 I/System.out(20684): }
06-05 19:59:38.439 I/art     (20684): Do partial code cache collection, code=30KB, data=29KB
06-05 19:59:38.439 I/art     (20684): After code cache collection, code=29KB, data=28KB
06-05 19:59:38.439 I/art     (20684): Increasing code cache capacity to 128KB
06-05 19:59:38.451 I/System.out(20684): URI: //map
06-05 19:59:38.451 I/System.out(20684): params: {json={"query":"android.widget.AbsListView index:0","operation":{"method_name":"query","arguments":[]}}
06-05 19:59:38.451 I/System.out(20684): }
06-05 19:59:38.471 I/System.out(20684): URI: //map
06-05 19:59:38.471 I/System.out(20684): params: {json={"query":"android.widget.AbsListView index:0","operation":{"method_name":"query","arguments":[]}}
06-05 19:59:38.471 I/System.out(20684): }
06-05 19:59:38.486 I/System.out(20684): URI: //map
06-05 19:59:38.486 I/System.out(20684): params: {json={"query":"android.widget.AbsListView index:0","operation":{"method_name":"query","arguments":["getFirstVisiblePosition"]}}
06-05 19:59:38.486 I/System.out(20684): }
06-05 19:59:38.501 I/System.out(20684): URI: //map
06-05 19:59:38.501 I/System.out(20684): params: {json={"query":"android.widget.AbsListView index:0","operation":{"method_name":"query","arguments":["getLastVisiblePosition"]}}
06-05 19:59:38.501 I/System.out(20684): }
06-05 19:59:38.515 I/System.out(20684): URI: //map
06-05 19:59:38.515 I/System.out(20684): params: {json={"query":"android.widget.AbsListView index:0","operation":{"method_name":"query","arguments":[{"method_name":"setSelection","arguments":[26]}]}}
06-05 19:59:38.515 I/System.out(20684): }
06-05 19:59:38.538 I/System.out(20684): URI: //map
06-05 19:59:38.538 I/System.out(20684): params: {json={"query":"* marked:'Average fillup'","operation":{"method_name":"query","arguments":[]}}
06-05 19:59:38.538 I/System.out(20684): }
06-05 19:59:38.551 V/PhoneStatusBar( 1711): setLightsOn(true)
06-05 19:59:38.552 V/PhoneStatusBar( 1711): setLightsOn(true)
06-05 19:59:38.554 W/OpenGLRenderer( 2147): Incorrectly called buildLayer on View: ShortcutAndWidgetContainer, destroying layer...
06-05 19:59:38.568 I/WindowManager( 1629): Destroying surface Surface(name=com.android.launcher3/com.android.launcher3.Launcher) called by com.android.server.wm.WindowStateAnimator.destroySurface:2016 com.android.server.wm.WindowStateAnimator.destroySurfaceLocked:882 com.android.server.wm.WindowState.destroyOrSaveSurface:2100 com.android.server.wm.AppWindowToken.destroySurfaces:363 com.android.server.wm.AppWindowToken.notifyAppStopped:389 com.android.server.wm.WindowManagerService.notifyAppStopped:4463 com.android.server.am.ActivityStack.activityStoppedLocked:1252 com.android.server.am.ActivityManagerService.activityStopped:6903 
06-05 19:59:38.569 V/PhoneStatusBar( 1711): setLightsOn(true)
06-05 19:59:38.573 D/gralloc_ranchu( 1348): gralloc_alloc: Creating ashmem region of size 9023488
06-05 19:59:38.617 W/ResourceType(20684): No package identifier when getting name for resource number 0x00000001
06-05 19:59:38.629 I/System.out(20684): URI: //gesture
06-05 19:59:38.629 I/System.out(20684): params: {json={"query_timeout":5.0,"gestures":[{"query_string":"* marked:'Average fillup'","touches":[{"x":50,"y":50,"offset_x":0,"offset_y":0,"wait":0.0,"time":0.2,"release":true,"query_string":null}]}]}
06-05 19:59:38.629 I/System.out(20684): }
06-05 19:59:38.632 W/ResourceType(20684): No package identifier when getting name for resource number 0x00000001
06-05 19:59:38.868 I/ActivityManager( 1629): START u0 {cmp=com.evancharlton.mileage/.charts.AverageVolumeChart (has extras)} from uid 10196 on display 0
06-05 19:59:38.869 V/PhoneStatusBar( 1711): setLightsOn(true)
06-05 19:59:38.870 V/PhoneStatusBar( 1711): setLightsOn(true)
06-05 19:59:38.878 I/System.out(20684): URI: //map
06-05 19:59:38.878 I/System.out(20684): params: {json={"query":"* {text CONTAINS[c] 'Average fillup size'}","operation":{"method_name":"query","arguments":[]}}
06-05 19:59:38.878 I/System.out(20684): }
06-05 19:59:38.920 I/calabash(20684): newActivity1
06-05 19:59:38.924 W/aiCharts(20684): License file is invalid or missing. 
06-05 19:59:38.924 W/aiCharts(20684): Please place proper license.lic to /assets folder.
06-05 19:59:38.943 V/PhoneStatusBar( 1711): setLightsOn(true)
06-05 19:59:38.968 V/PhoneStatusBar( 1711): setLightsOn(true)
06-05 19:59:38.973 I/WindowManager( 1629): Destroying surface Surface(name=Creating chart…) called by com.android.server.wm.WindowStateAnimator.destroySurface:2016 com.android.server.wm.WindowStateAnimator.destroySurfaceLocked:882 com.android.server.wm.WindowState.removeLocked:1456 com.android.server.wm.WindowManagerService.removeWindowInnerLocked:2484 com.android.server.wm.WindowManagerService.removeWindowLocked:2442 com.android.server.wm.WindowManagerService.removeWindowLocked:2311 com.android.server.wm.WindowManagerService.removeWindow:2306 com.android.server.wm.Session.remove:202 
06-05 19:59:38.975 D/gralloc_ranchu( 1348): gralloc_alloc: Creating ashmem region of size 9023488
06-05 19:59:38.985 V/PhoneStatusBar( 1711): setLightsOn(true)
06-05 19:59:39.000 I/ActivityManager( 1629): Displayed com.evancharlton.mileage/.charts.AverageVolumeChart: +83ms
06-05 19:59:39.001 V/PhoneStatusBar( 1711): setLightsOn(true)
06-05 19:59:39.034 V/PhoneStatusBar( 1711): setLightsOn(true)
06-05 19:59:39.051 V/PhoneStatusBar( 1711): setLightsOn(true)
06-05 19:59:39.238 V/PhoneStatusBar( 1711): setLightsOn(true)
06-05 19:59:39.261 I/System.out(20684): URI: //map
06-05 19:59:39.261 I/System.out(20684): params: {json={"query":"* {text CONTAINS[c] 'Average fillup size'}","operation":{"method_name":"query","arguments":[]}}
06-05 19:59:39.261 I/System.out(20684): }
06-05 19:59:39.279 I/System.out(20684): URI: //
06-05 19:59:39.279 I/System.out(20684): params: {json={"command":"press_key","arguments":["KEYCODE_BACK"]}
06-05 19:59:39.279 I/System.out(20684): }
06-05 19:59:39.279 I/System.out(20684): header: {content-type=application/json;charset=utf-8, date=Sat, 06 Jun 2020 00:59:40 GMT, accept=*/*, host=127.0.0.1:34783, content-length=52, user-agent=HTTPClient/1.0 (2.8.3, ruby 2.5.1 (2018-03-29))}
06-05 19:59:39.279 I/System.out(20684): params: {json={"command":"press_key","arguments":["KEYCODE_BACK"]}
06-05 19:59:39.279 I/System.out(20684): }
06-05 19:59:39.279 I/System.out(20684): ProP json = {"command":"press_key","arguments":["KEYCODE_BACK"]}
06-05 19:59:39.279 I/System.out(20684): files: {}
06-05 19:59:39.279 I/System.out(20684): command: {"command":"press_key","arguments":["KEYCODE_BACK"]}
06-05 19:59:39.280 I/InstrumentationBackend(20684): Got command:'Command:'Line:null,press_key', arguments:'[KEYCODE_BACK]'
06-05 19:59:39.283 V/PhoneStatusBar( 1711): setLightsOn(true)
06-05 19:59:39.285 V/PhoneStatusBar( 1711): setLightsOn(true)
06-05 19:59:39.286 I/art     (20684): Do partial code cache collection, code=60KB, data=62KB
06-05 19:59:39.288 D/VehicleStatisticsActivity(20684): Checking recalculation ...
06-05 19:59:39.289 D/VehicleStatisticsActivity(20684): Recalculation not necessary.
06-05 19:59:39.289 I/System.out(20684): result:{"bonusInformation":[],"message":"","success":true}
06-05 19:59:39.289 I/art     (20684): After code cache collection, code=59KB, data=61KB
06-05 19:59:39.289 I/art     (20684): Increasing code cache capacity to 256KB
06-05 19:59:39.291 I/System.out(20684): URI: //map
06-05 19:59:39.291 I/System.out(20684): params: {json={"query":"* {text CONTAINS[c] 'Statistics'}","operation":{"method_name":"query","arguments":[]}}
06-05 19:59:39.291 I/System.out(20684): }
06-05 19:59:39.318 D/gralloc_ranchu( 1348): gralloc_alloc: Creating ashmem region of size 9023488
06-05 19:59:39.318 V/PhoneStatusBar( 1711): setLightsOn(true)
06-05 19:59:39.335 V/PhoneStatusBar( 1711): setLightsOn(true)
06-05 19:59:39.351 V/PhoneStatusBar( 1711): setLightsOn(true)
