--------- beginning of system
06-05 23:01:02.654 W/ActivityManager( 1631): Finishing task with all activities already finished
06-05 23:01:02.654 W/ActivityManager( 1631): Duplicate finish request for ActivityRecord{46063c4 u0 com.evancharlton.mileage/.Mileage t9026 f}
--------- beginning of main
06-05 23:01:02.667 V/PhoneStatusBar( 1712): setLightsOn(true)
06-05 23:01:02.669 D/gralloc_ranchu( 1347): gralloc_alloc: Creating ashmem region of size 3145728
06-05 23:01:02.673 E/EGL_emulation( 1347): tid 1347: eglCreateSyncKHR(1901): error 0x3004 (EGL_BAD_ATTRIBUTE)
06-05 23:01:02.686 W/ActivityManager( 1631): Finishing task with all activities already finished
06-05 23:01:02.686 W/ActivityManager( 1631): Duplicate finish request for ActivityRecord{46063c4 u0 com.evancharlton.mileage/.Mileage t9026 f}
06-05 23:01:02.686 W/ActivityManager( 1631): Finishing task with all activities already finished
06-05 23:01:02.686 W/ActivityManager( 1631): Duplicate finish request for ActivityRecord{46063c4 u0 com.evancharlton.mileage/.Mileage t9026 f}
06-05 23:01:02.686 W/ActivityManager( 1631): Finishing task with all activities already finished
06-05 23:01:02.686 W/ActivityManager( 1631): Duplicate finish request for ActivityRecord{46063c4 u0 com.evancharlton.mileage/.Mileage t9026 f}
06-05 23:01:02.686 W/ActivityManager( 1631): Finishing task with all activities already finished
06-05 23:01:02.686 W/ActivityManager( 1631): Duplicate finish request for ActivityRecord{46063c4 u0 com.evancharlton.mileage/.Mileage t9026 f}
06-05 23:01:02.686 W/ActivityManager( 1631): Finishing task with all activities already finished
06-05 23:01:02.686 W/ActivityManager( 1631): Duplicate finish request for ActivityRecord{7b3ef8e u0 com.evancharlton.mileage/.charts.MaximumPriceChart t9026 f}
06-05 23:01:02.686 W/ActivityManager( 1631): Finishing task with all activities already finished
06-05 23:01:02.686 W/ActivityManager( 1631): Duplicate finish request for ActivityRecord{7b3ef8e u0 com.evancharlton.mileage/.charts.MaximumPriceChart t9026 f}
06-05 23:01:02.687 W/ActivityManager( 1631): Finishing task with all activities already finished
06-05 23:01:02.687 W/ActivityManager( 1631): Duplicate finish request for ActivityRecord{46063c4 u0 com.evancharlton.mileage/.Mileage t9026 f}
06-05 23:01:02.687 W/ActivityManager( 1631): Finishing task with all activities already finished
06-05 23:01:02.687 W/ActivityManager( 1631): Duplicate finish request for ActivityRecord{46063c4 u0 com.evancharlton.mileage/.Mileage t9026 f}
06-05 23:01:02.736 D/EGL_emulation( 2076): eglMakeCurrent: 0xb0685360: ver 2 0 (tinfo 0xb06836b0)
06-05 23:01:02.736 D/EGL_emulation( 1712): eglMakeCurrent: 0xb0685360: ver 2 0 (tinfo 0xb06836c0)
06-05 23:01:02.750 D/EGL_emulation( 1712): eglMakeCurrent: 0xb0685360: ver 2 0 (tinfo 0xb06836c0)
06-05 23:01:02.771 D/EGL_emulation( 1712): eglMakeCurrent: 0xb0685360: ver 2 0 (tinfo 0xb06836c0)
06-05 23:01:02.784 D/EGL_emulation( 1712): eglMakeCurrent: 0xb0685360: ver 2 0 (tinfo 0xb06836c0)
06-05 23:01:02.786 D/EGL_emulation( 1712): eglMakeCurrent: 0xb0685360: ver 2 0 (tinfo 0xb06836c0)
06-05 23:01:02.801 D/EGL_emulation( 1712): eglMakeCurrent: 0xb0685360: ver 2 0 (tinfo 0xb06836c0)
06-05 23:01:02.805 D/EGL_emulation( 1712): eglMakeCurrent: 0xb0685360: ver 2 0 (tinfo 0xb06836c0)
06-05 23:01:02.817 D/EGL_emulation( 1712): eglMakeCurrent: 0xb0685360: ver 2 0 (tinfo 0xb06836c0)
06-05 23:01:02.819 D/EGL_emulation( 1712): eglMakeCurrent: 0xb0685360: ver 2 0 (tinfo 0xb06836c0)
06-05 23:01:02.834 D/EGL_emulation( 1712): eglMakeCurrent: 0xb0685360: ver 2 0 (tinfo 0xb06836c0)
06-05 23:01:02.835 D/EGL_emulation( 1712): eglMakeCurrent: 0xb0685360: ver 2 0 (tinfo 0xb06836c0)
06-05 23:01:02.850 D/EGL_emulation( 1712): eglMakeCurrent: 0xb0685360: ver 2 0 (tinfo 0xb06836c0)
06-05 23:01:02.854 D/EGL_emulation( 1712): eglMakeCurrent: 0xb0685360: ver 2 0 (tinfo 0xb06836c0)
06-05 23:01:02.862 D/AndroidRuntime(13511): >>>>>> START com.android.internal.os.RuntimeInit uid 2000 <<<<<<
06-05 23:01:02.863 D/AndroidRuntime(13511): CheckJNI is ON
06-05 23:01:02.867 D/EGL_emulation( 1712): eglMakeCurrent: 0xb0685360: ver 2 0 (tinfo 0xb06836c0)
06-05 23:01:02.869 D/EGL_emulation( 1712): eglMakeCurrent: 0xb0685360: ver 2 0 (tinfo 0xb06836c0)
06-05 23:01:02.876 W/art     (13511): Unexpected CPU variant for X86 using defaults: x86
06-05 23:01:02.878 D/ICU     (13511): No timezone override file found: /data/misc/zoneinfo/current/icu/icu_tzdata.dat
06-05 23:01:02.884 D/EGL_emulation( 1712): eglMakeCurrent: 0xb0685360: ver 2 0 (tinfo 0xb06836c0)
06-05 23:01:02.885 D/EGL_emulation( 1712): eglMakeCurrent: 0xb0685360: ver 2 0 (tinfo 0xb06836c0)
06-05 23:01:02.886 E/memtrack(13511): Couldn't load memtrack module (No such file or directory)
06-05 23:01:02.886 E/android.os.Debug(13511): failed to load memtrack module: -2
06-05 23:01:02.887 I/Radio-JNI(13511): register_android_hardware_Radio DONE
06-05 23:01:02.892 D/AndroidRuntime(13511): Calling main entry com.android.commands.am.Am
06-05 23:01:02.894 I/ActivityManager( 1631): Force stopping com.evancharlton.mileage appid=10326 user=0: start instr
06-05 23:01:02.894 I/ActivityManager( 1631): Killing 13459:com.evancharlton.mileage/u0a326 (adj 0): stop com.evancharlton.mileage
06-05 23:01:02.894 D/ActivityManager( 1631): cleanUpApplicationRecord -- 13459
06-05 23:01:02.894 I/WindowManager( 1631): Destroying surface Surface(name=com.evancharlton.mileage/com.evancharlton.mileage.charts.MaximumPriceChart) called by com.android.server.wm.WindowStateAnimator.destroySurface:2016 com.android.server.wm.WindowStateAnimator.destroySurfaceLocked:882 com.android.server.wm.WindowState.removeLocked:1456 com.android.server.wm.WindowManagerService.removeWindowInnerLocked:2484 com.android.server.wm.WindowManagerService.removeWindowLocked:2442 com.android.server.wm.WindowManagerService.removeWindowLocked:2311 com.android.server.wm.AppWindowToken.removeAllWindows:530 com.android.server.wm.AppWindowToken.removeAppFromTaskLocked:326 
06-05 23:01:02.896 W/ActivityManager( 1631): Crash of app com.evancharlton.mileage running instrumentation ComponentInfo{com.evancharlton.mileage.test/sh.calaba.instrumentationbackend.CalabashInstrumentationTestRunner}
06-05 23:01:02.896 I/ActivityManager( 1631): Force stopping com.evancharlton.mileage appid=10326 user=0: finished inst
06-05 23:01:02.901 D/EGL_emulation( 1712): eglMakeCurrent: 0xb0685360: ver 2 0 (tinfo 0xb06836c0)
06-05 23:01:02.901 I/art     (13521): Not late-enabling -Xcheck:jni (already on)
06-05 23:01:02.901 W/art     (13521): Unexpected CPU variant for X86 using defaults: x86
06-05 23:01:02.903 D/EGL_emulation( 1712): eglMakeCurrent: 0xb0685360: ver 2 0 (tinfo 0xb06836c0)
06-05 23:01:02.908 I/ActivityManager( 1631): Start proc 13521:com.evancharlton.mileage/u0a326 for added application com.evancharlton.mileage
06-05 23:01:02.908 D/AndroidRuntime(13511): Shutting down VM
06-05 23:01:02.913 W/System  (13521): ClassLoader referenced unknown path: /data/app/com.evancharlton.mileage.test-1/lib/x86
06-05 23:01:02.913 W/System  (13521): ClassLoader referenced unknown path: /data/app/com.evancharlton.mileage-1/lib/x86
06-05 23:01:02.915 W/System  (13521): ClassLoader referenced unknown path: 
06-05 23:01:02.917 D/EGL_emulation( 1712): eglMakeCurrent: 0xb0685360: ver 2 0 (tinfo 0xb06836c0)
06-05 23:01:02.918 D/EGL_emulation( 1712): eglMakeCurrent: 0xb0685360: ver 2 0 (tinfo 0xb06836c0)
06-05 23:01:02.921 I/System.out(13521): Main activity name automatically set to: com.evancharlton.mileage.Mileage
06-05 23:01:02.921 I/System.out(13521): Calabash did not load Mono. This is only a problem if you are trying to test a Mono application
06-05 23:01:02.921 I/calabash(13521): Test server port: 7102
06-05 23:01:02.922 I/InstrumentationBackend(13521): Added:'GetPreferences', with key:'get_preferences'
06-05 23:01:02.929 I/InstrumentationBackend(13521): Added:'SetPreferences', with key:'set_preferences'
06-05 23:01:02.929 I/InstrumentationBackend(13521): Added:'ClearPreferences', with key:'clear_preferences'
06-05 23:01:02.929 I/InstrumentationBackend(13521): Added:'PressElement', with key:'press_l10n_element'
06-05 23:01:02.929 I/InstrumentationBackend(13521): Added:'WaitForElement', with key:'wait_for_l10n_element'
06-05 23:01:02.929 I/InstrumentationBackend(13521): Added:'NullAction', with key:'nullAction'
06-05 23:01:02.929 I/InstrumentationBackend(13521): Added:'PressKey', with key:'press_key'
06-05 23:01:02.929 I/InstrumentationBackend(13521): Added:'SetActivityOrientation', with key:'set_activity_orientation'
06-05 23:01:02.929 I/InstrumentationBackend(13521): Added:'GetActivityOrientation', with key:'get_activity_orientation'
06-05 23:01:02.929 I/InstrumentationBackend(13521): Added:'FakeGPSLocation', with key:'set_gps_coordinates'
06-05 23:01:02.930 I/InstrumentationBackend(13521): Added:'SetPropertyByCssSelector', with key:'set_property_by_css_selector'
06-05 23:01:02.930 I/InstrumentationBackend(13521): Added:'GetUrl', with key:'get_url'
06-05 23:01:02.930 I/InstrumentationBackend(13521): Added:'ScrollTo', with key:'scroll_to'
06-05 23:01:02.930 I/InstrumentationBackend(13521): Added:'GetLoadProgress', with key:'get_load_progress'
06-05 23:01:02.930 I/InstrumentationBackend(13521): Added:'DumpHtml', with key:'dump_html'
06-05 23:01:02.930 I/InstrumentationBackend(13521): Added:'DumpBodyHtml', with key:'dump_body_html'
06-05 23:01:02.930 I/InstrumentationBackend(13521): Added:'EnterTextByCssSelector', with key:'enter_text_by_selector'
06-05 23:01:02.931 I/InstrumentationBackend(13521): Added:'AndroidSDKVersion', with key:'android_sdk_version'
06-05 23:01:02.931 I/InstrumentationBackend(13521): Added:'Version', with key:'version'
06-05 23:01:02.931 I/InstrumentationBackend(13521): Added:'Drag', with key:'drag'
06-05 23:01:02.931 I/InstrumentationBackend(13521): Added:'TouchCoordinates', with key:'touch_coordinate'
06-05 23:01:02.931 I/InstrumentationBackend(13521): Added:'LongPressCoordinate', with key:'long_press_coordinate'
06-05 23:01:02.931 I/InstrumentationBackend(13521): Added:'DragCoordinates', with key:'drag_coordinates'
06-05 23:01:02.931 I/InstrumentationBackend(13521): Added:'ResumeApplication', with key:'resume_application'
06-05 23:01:02.931 I/InstrumentationBackend(13521): Added:'Swipe', with key:'swipe'
06-05 23:01:02.931 I/InstrumentationBackend(13521): Added:'DoubleTapCoordinate', with key:'double_tap_coordinate'
06-05 23:01:02.931 I/InstrumentationBackend(13521): Added:'ClickOnScreen', with key:'click_on_screen'
06-05 23:01:02.932 I/InstrumentationBackend(13521): Added:'GetActivityName', with key:'get_activity_name'
06-05 23:01:02.932 I/InstrumentationBackend(13521): Added:'ScrollToView', with key:'scroll_to_view'
06-05 23:01:02.932 I/InstrumentationBackend(13521): Added:'ViewConfiguration', with key:'view_configuration'
06-05 23:01:02.932 I/InstrumentationBackend(13521): Added:'IsCurrentActivityFocused', with key:'is_current_activity_focused'
06-05 23:01:02.932 I/InstrumentationBackend(13521): Added:'SendTcp', with key:'send_tcp'
06-05 23:01:02.932 I/InstrumentationBackend(13521): Added:'DpToDevicePixel', with key:'dp_to_device_pixel'
06-05 23:01:02.932 I/InstrumentationBackend(13521): Added:'KeyboardEnterText', with key:'keyboard_enter_text'
06-05 23:01:02.932 I/InstrumentationBackend(13521): Added:'DeleteSurroundingText', with key:'delete_surrounding_text'
06-05 23:01:02.932 I/InstrumentationBackend(13521): Added:'SetComposingRegion', with key:'set_composing_region'
06-05 23:01:02.932 I/InstrumentationBackend(13521): Added:'SetSelection', with key:'set_selection'
06-05 23:01:02.932 I/InstrumentationBackend(13521): Added:'KeyboardKeyEvent', with key:'keyboard_key_event'
06-05 23:01:02.932 I/InstrumentationBackend(13521): Added:'PressUserActionButton', with key:'press_user_action_button'
06-05 23:01:02.933 I/InstrumentationBackend(13521): Added:'HideSoftKeyboard', with key:'hide_soft_keyboard'
06-05 23:01:02.933 I/InstrumentationBackend(13521): Added:'ListActions', with key:'list_actions'
06-05 23:01:02.933 I/calabash(13521): Instantiating http server at 7102
06-05 23:01:02.934 I/System.out(13521): HTTP Daemon listening on: 7102
06-05 23:01:02.934 D/EGL_emulation( 1712): eglMakeCurrent: 0xb0685360: ver 2 0 (tinfo 0xb06836c0)
06-05 23:01:02.950 D/EGL_emulation( 1712): eglMakeCurrent: 0xb0685360: ver 2 0 (tinfo 0xb06836c0)
06-05 23:01:02.951 D/EGL_emulation( 1712): eglMakeCurrent: 0xb0685360: ver 2 0 (tinfo 0xb06836c0)
06-05 23:01:02.953 W/InputDispatcher( 1631): channel '7fedcbf com.evancharlton.mileage/com.evancharlton.mileage.Mileage (server)' ~ Consumer closed input channel or an error occurred.  events=0x9
06-05 23:01:02.953 E/InputDispatcher( 1631): channel '7fedcbf com.evancharlton.mileage/com.evancharlton.mileage.Mileage (server)' ~ Channel is unrecoverably broken and will be disposed!
06-05 23:01:02.953 I/WindowManager( 1631): WIN DEATH: Window{7fedcbf u0 com.evancharlton.mileage/com.evancharlton.mileage.Mileage EXITING}
06-05 23:01:02.953 W/InputDispatcher( 1631): Attempted to unregister already unregistered input channel '7fedcbf com.evancharlton.mileage/com.evancharlton.mileage.Mileage (server)'
06-05 23:01:02.967 D/EGL_emulation( 1712): eglMakeCurrent: 0xb0685360: ver 2 0 (tinfo 0xb06836c0)
06-05 23:01:02.971 D/EGL_emulation( 1712): eglMakeCurrent: 0xb0685360: ver 2 0 (tinfo 0xb06836c0)
06-05 23:01:03.025 I/System.out(13521): URI: //ping
06-05 23:01:03.025 I/System.out(13521): params: {json={}
06-05 23:01:03.025 I/System.out(13521): }
06-05 23:01:03.033 I/System.out(13521): URI: //ping
06-05 23:01:03.035 I/System.out(13521): params: {json={}
06-05 23:01:03.035 I/System.out(13521): }
06-05 23:01:03.040 I/System.out(13521): URI: //ready
06-05 23:01:03.040 I/System.out(13521): params: {json={}
06-05 23:01:03.040 I/System.out(13521): }
06-05 23:01:03.047 I/System.out(13521): URI: //
06-05 23:01:03.047 I/System.out(13521): params: {json={"command":"version","arguments":[]}
06-05 23:01:03.047 I/System.out(13521): }
06-05 23:01:03.047 I/System.out(13521): header: {content-type=application/json;charset=utf-8, date=Sat, 06 Jun 2020 04:01:03 GMT, accept=*/*, host=127.0.0.1:34777, content-length=36, user-agent=HTTPClient/1.0 (2.8.3, ruby 2.5.1 (2018-03-29))}
06-05 23:01:03.047 I/System.out(13521): params: {json={"command":"version","arguments":[]}
06-05 23:01:03.047 I/System.out(13521): }
06-05 23:01:03.047 I/System.out(13521): ProP json = {"command":"version","arguments":[]}
06-05 23:01:03.047 I/System.out(13521): files: {}
06-05 23:01:03.048 I/System.out(13521): command: {"command":"version","arguments":[]}
06-05 23:01:03.068 I/InstrumentationBackend(13521): Got command:'Command:'Line:null,version', arguments:'[]'
06-05 23:01:03.155 I/System.out(13521): result:{"bonusInformation":[],"message":"0.9.8","success":true}
06-05 23:01:03.163 I/System.out(13521): URI: //start-application
06-05 23:01:03.163 I/System.out(13521): params: {json={"intent":null}
06-05 23:01:03.163 I/System.out(13521): }
06-05 23:01:03.167 I/WindowManager( 1631): Destroying surface Surface(name=com.evancharlton.mileage/com.evancharlton.mileage.Mileage) called by com.android.server.wm.WindowStateAnimator.destroySurface:2016 com.android.server.wm.WindowStateAnimator.destroySurfaceLocked:882 com.android.server.wm.WindowState.removeLocked:1456 com.android.server.wm.WindowManagerService.removeWindowInnerLocked:2484 com.android.server.wm.AppWindowToken.destroySurfaces:365 com.android.server.wm.WindowStateAnimator.finishExit:565 com.android.server.wm.AppWindowAnimator.stepAnimationLocked:427 com.android.server.wm.WindowAnimator.updateAppWindowsLocked:196 
06-05 23:01:03.175 I/ActivityManager( 1631): START u0 {act=android.intent.action.MAIN cat=[android.intent.category.LAUNCHER] flg=0x10200000 cmp=com.evancharlton.mileage/.Mileage} from uid 10326 on display 0
06-05 23:01:03.183 I/calabash(13521): newActivity1
06-05 23:01:03.194 I/calabash(13521): newActivity1
06-05 23:01:03.195 W/ActivityManager( 1631): Bad activity token: android.os.BinderProxy@557dbab
06-05 23:01:03.195 W/ActivityManager( 1631): java.lang.ClassCastException: android.os.BinderProxy cannot be cast to com.android.server.am.ActivityRecord$Token
06-05 23:01:03.195 W/ActivityManager( 1631): 	at com.android.server.am.ActivityRecord.forTokenLocked(ActivityRecord.java:586)
06-05 23:01:03.195 W/ActivityManager( 1631): 	at com.android.server.am.ActivityRecord.isInStackLocked(ActivityRecord.java:1327)
06-05 23:01:03.195 W/ActivityManager( 1631): 	at com.android.server.am.ActivityRecord.getStackLocked(ActivityRecord.java:1332)
06-05 23:01:03.195 W/ActivityManager( 1631): 	at com.android.server.am.ActivityManagerService.getActivityDisplayId(ActivityManagerService.java:9806)
06-05 23:01:03.195 W/ActivityManager( 1631): 	at android.app.ActivityManagerNative.onTransact(ActivityManagerNative.java:2566)
06-05 23:01:03.195 W/ActivityManager( 1631): 	at com.android.server.am.ActivityManagerService.onTransact(ActivityManagerService.java:2757)
06-05 23:01:03.195 W/ActivityManager( 1631): 	at android.os.Binder.execTransact(Binder.java:565)
06-05 23:01:03.197 W/ActivityManager( 1631): Bad activity token: android.os.BinderProxy@557dbab
06-05 23:01:03.197 W/ActivityManager( 1631): java.lang.ClassCastException: android.os.BinderProxy cannot be cast to com.android.server.am.ActivityRecord$Token
06-05 23:01:03.197 W/ActivityManager( 1631): 	at com.android.server.am.ActivityRecord.forTokenLocked(ActivityRecord.java:586)
06-05 23:01:03.197 W/ActivityManager( 1631): 	at com.android.server.am.ActivityRecord.isInStackLocked(ActivityRecord.java:1327)
06-05 23:01:03.197 W/ActivityManager( 1631): 	at com.android.server.am.ActivityManagerService.setTaskDescription(ActivityManagerService.java:9358)
06-05 23:01:03.197 W/ActivityManager( 1631): 	at android.app.ActivityManagerNative.onTransact(ActivityManagerNative.java:2639)
06-05 23:01:03.197 W/ActivityManager( 1631): 	at com.android.server.am.ActivityManagerService.onTransact(ActivityManagerService.java:2757)
06-05 23:01:03.197 W/ActivityManager( 1631): 	at android.os.Binder.execTransact(Binder.java:565)
06-05 23:01:03.197 W/ActivityManager( 1631): Bad activity token: android.os.BinderProxy@557dbab
06-05 23:01:03.197 W/ActivityManager( 1631): java.lang.ClassCastException: android.os.BinderProxy cannot be cast to com.android.server.am.ActivityRecord$Token
06-05 23:01:03.197 W/ActivityManager( 1631): 	at com.android.server.am.ActivityRecord.forTokenLocked(ActivityRecord.java:586)
06-05 23:01:03.197 W/ActivityManager( 1631): 	at com.android.server.am.ActivityRecord.isInStackLocked(ActivityRecord.java:1327)
06-05 23:01:03.197 W/ActivityManager( 1631): 	at com.android.server.am.ActivityRecord.getStackLocked(ActivityRecord.java:1332)
06-05 23:01:03.197 W/ActivityManager( 1631): 	at com.android.server.am.ActivityManagerService.getActivityStackId(ActivityManagerService.java:9817)
06-05 23:01:03.197 W/ActivityManager( 1631): 	at android.app.ActivityManagerNative.onTransact(ActivityManagerNative.java:2856)
06-05 23:01:03.197 W/ActivityManager( 1631): 	at com.android.server.am.ActivityManagerService.onTransact(ActivityManagerService.java:2757)
06-05 23:01:03.197 W/ActivityManager( 1631): 	at android.os.Binder.execTransact(Binder.java:565)
06-05 23:01:03.202 D/gralloc_ranchu( 1347): gralloc_alloc: Creating ashmem region of size 9023488
06-05 23:01:03.219 W/ActivityManager( 1631): Bad activity token: android.os.BinderProxy@557dbab
06-05 23:01:03.219 W/ActivityManager( 1631): java.lang.ClassCastException: android.os.BinderProxy cannot be cast to com.android.server.am.ActivityRecord$Token
06-05 23:01:03.219 W/ActivityManager( 1631): 	at com.android.server.am.ActivityRecord.forTokenLocked(ActivityRecord.java:586)
06-05 23:01:03.219 W/ActivityManager( 1631): 	at com.android.server.am.ActivityRecord.isInStackLocked(ActivityRecord.java:1327)
06-05 23:01:03.219 W/ActivityManager( 1631): 	at com.android.server.am.ActivityManagerService.getActivityOptions(ActivityManagerService.java:12559)
06-05 23:01:03.219 W/ActivityManager( 1631): 	at android.app.ActivityManagerNative.onTransact(ActivityManagerNative.java:1933)
06-05 23:01:03.219 W/ActivityManager( 1631): 	at com.android.server.am.ActivityManagerService.onTransact(ActivityManagerService.java:2757)
06-05 23:01:03.219 W/ActivityManager( 1631): 	at android.os.Binder.execTransact(Binder.java:565)
06-05 23:01:03.219 W/ActivityManager( 1631): Bad activity token: android.os.BinderProxy@557dbab
06-05 23:01:03.219 W/ActivityManager( 1631): java.lang.ClassCastException: android.os.BinderProxy cannot be cast to com.android.server.am.ActivityRecord$Token
06-05 23:01:03.219 W/ActivityManager( 1631): 	at com.android.server.am.ActivityRecord.forTokenLocked(ActivityRecord.java:586)
06-05 23:01:03.219 W/ActivityManager( 1631): 	at com.android.server.am.ActivityRecord.isInStackLocked(ActivityRecord.java:1327)
06-05 23:01:03.219 W/ActivityManager( 1631): 	at com.android.server.am.ActivityManagerService.getActivityOptions(ActivityManagerService.java:12559)
06-05 23:01:03.219 W/ActivityManager( 1631): 	at android.app.ActivityManagerNative.onTransact(ActivityManagerNative.java:1933)
06-05 23:01:03.219 W/ActivityManager( 1631): 	at com.android.server.am.ActivityManagerService.onTransact(ActivityManagerService.java:2757)
06-05 23:01:03.219 W/ActivityManager( 1631): 	at android.os.Binder.execTransact(Binder.java:565)
06-05 23:01:03.244 V/PhoneStatusBar( 1712): setLightsOn(true)
06-05 23:01:03.250 W/OpenGLRenderer( 2076): Incorrectly called buildLayer on View: ShortcutAndWidgetContainer, destroying layer...
06-05 23:01:03.250 D/EGL_emulation( 1712): eglMakeCurrent: 0xb0685360: ver 2 0 (tinfo 0xb06836c0)
06-05 23:01:03.251 V/PhoneStatusBar( 1712): setLightsOn(true)
06-05 23:01:03.252 V/PhoneStatusBar( 1712): setLightsOn(true)
06-05 23:01:03.253 D/gralloc_ranchu( 1347): gralloc_alloc: Creating ashmem region of size 9023488
06-05 23:01:03.255 V/PhoneStatusBar( 1712): setLightsOn(true)
06-05 23:01:03.258 D/        (13521): HostConnection::get() New Host Connection established 0x9421f100, tid 13521
06-05 23:01:03.287 D/EGL_emulation( 1712): eglMakeCurrent: 0xb0685360: ver 2 0 (tinfo 0xb06836c0)
06-05 23:01:03.288 D/EGL_emulation( 2076): eglMakeCurrent: 0xb0685360: ver 2 0 (tinfo 0xb06836b0)
06-05 23:01:03.291 D/EGL_emulation( 1712): eglMakeCurrent: 0xb0685360: ver 2 0 (tinfo 0xb06836c0)
06-05 23:01:03.292 D/EGL_emulation( 1712): eglMakeCurrent: 0xb0685360: ver 2 0 (tinfo 0xb06836c0)
06-05 23:01:03.295 D/EGL_emulation( 1712): eglMakeCurrent: 0xb0685360: ver 2 0 (tinfo 0xb06836c0)
06-05 23:01:03.300 D/EGL_emulation( 1712): eglMakeCurrent: 0xb0685360: ver 2 0 (tinfo 0xb06836c0)
06-05 23:01:03.302 D/EGL_emulation( 1712): eglMakeCurrent: 0xb0685360: ver 2 0 (tinfo 0xb06836c0)
06-05 23:01:03.302 V/PhoneStatusBar( 1712): setLightsOn(true)
06-05 23:01:03.310 I/ActivityManager( 1631): Displayed com.evancharlton.mileage/.Mileage: +131ms
06-05 23:01:03.319 D/gralloc_ranchu( 1347): gralloc_alloc: Creating ashmem region of size 9023488
06-05 23:01:03.320 D/EGL_emulation( 1712): eglMakeCurrent: 0xb0685360: ver 2 0 (tinfo 0xb06836c0)
06-05 23:01:03.353 D/EGL_emulation( 1712): eglMakeCurrent: 0xb0685360: ver 2 0 (tinfo 0xb06836c0)
06-05 23:01:03.358 D/EGL_emulation( 1712): eglMakeCurrent: 0xb0685360: ver 2 0 (tinfo 0xb06836c0)
06-05 23:01:03.361 D/EGL_emulation( 1712): eglMakeCurrent: 0xb0685360: ver 2 0 (tinfo 0xb06836c0)
06-05 23:01:03.362 V/PhoneStatusBar( 1712): setLightsOn(true)
06-05 23:01:03.372 D/EGL_emulation( 1712): eglMakeCurrent: 0xb0685360: ver 2 0 (tinfo 0xb06836c0)
06-05 23:01:03.376 D/EGL_emulation( 1712): eglMakeCurrent: 0xb0685360: ver 2 0 (tinfo 0xb06836c0)
06-05 23:01:03.384 D/EGL_emulation( 1712): eglMakeCurrent: 0xb0685360: ver 2 0 (tinfo 0xb06836c0)
06-05 23:01:03.387 D/EGL_emulation( 1712): eglMakeCurrent: 0xb0685360: ver 2 0 (tinfo 0xb06836c0)
06-05 23:01:03.402 D/EGL_emulation( 1712): eglMakeCurrent: 0xb0685360: ver 2 0 (tinfo 0xb06836c0)
06-05 23:01:03.404 D/EGL_emulation( 1712): eglMakeCurrent: 0xb0685360: ver 2 0 (tinfo 0xb06836c0)
06-05 23:01:03.418 D/EGL_emulation( 1712): eglMakeCurrent: 0xb0685360: ver 2 0 (tinfo 0xb06836c0)
06-05 23:01:03.420 D/EGL_emulation( 1712): eglMakeCurrent: 0xb0685360: ver 2 0 (tinfo 0xb06836c0)
06-05 23:01:03.424 I/System.out(13521): URI: //map
06-05 23:01:03.424 I/System.out(13521): params: {json={"query":"* marked:'Statistics'","operation":{"method_name":"query","arguments":[]}}
06-05 23:01:03.424 I/System.out(13521): }
06-05 23:01:03.434 D/EGL_emulation( 1712): eglMakeCurrent: 0xb0685360: ver 2 0 (tinfo 0xb06836c0)
06-05 23:01:03.436 D/EGL_emulation( 1712): eglMakeCurrent: 0xb0685360: ver 2 0 (tinfo 0xb06836c0)
06-05 23:01:03.441 W/ResourceType(13521): No package identifier when getting name for resource number 0x00000001
06-05 23:01:03.451 D/EGL_emulation( 1712): eglMakeCurrent: 0xb0685360: ver 2 0 (tinfo 0xb06836c0)
06-05 23:01:03.453 D/EGL_emulation( 1712): eglMakeCurrent: 0xb0685360: ver 2 0 (tinfo 0xb06836c0)
06-05 23:01:03.457 I/System.out(13521): URI: //gesture
06-05 23:01:03.457 I/System.out(13521): params: {json={"query_timeout":5.0,"gestures":[{"query_string":"* marked:'Statistics'","touches":[{"x":50,"y":50,"offset_x":0,"offset_y":0,"wait":0.0,"time":0.2,"release":true,"query_string":null}]}]}
06-05 23:01:03.457 I/System.out(13521): }
06-05 23:01:03.462 W/ResourceType(13521): No package identifier when getting name for resource number 0x00000001
06-05 23:01:03.467 D/EGL_emulation( 1712): eglMakeCurrent: 0xb0685360: ver 2 0 (tinfo 0xb06836c0)
06-05 23:01:03.469 D/EGL_emulation( 1712): eglMakeCurrent: 0xb0685360: ver 2 0 (tinfo 0xb06836c0)
06-05 23:01:03.490 D/EGL_emulation( 1712): eglMakeCurrent: 0xb0685360: ver 2 0 (tinfo 0xb06836c0)
06-05 23:01:03.500 I/WindowManager( 1631): Destroying surface Surface(name=Starting com.evancharlton.mileage) called by com.android.server.wm.WindowStateAnimator.destroySurface:2016 com.android.server.wm.WindowStateAnimator.destroySurfaceLocked:882 com.android.server.wm.WindowState.destroyOrSaveSurface:2100 com.android.server.wm.AppWindowToken.destroySurfaces:363 com.android.server.wm.WindowStateAnimator.finishExit:565 com.android.server.wm.WindowStateAnimator.stepAnimationLocked:491 com.android.server.wm.WindowAnimator.updateWindowsLocked:303 com.android.server.wm.WindowAnimator.animateLocked:704 
06-05 23:01:03.503 V/PhoneStatusBar( 1712): setLightsOn(true)
06-05 23:01:03.533 V/PhoneStatusBar( 1712): setLightsOn(true)
06-05 23:01:03.689 I/calabash(13521): newActivity1
06-05 23:01:03.722 I/System.out(13521): URI: //map
06-05 23:01:03.722 I/System.out(13521): params: {json={"query":"android.widget.ScrollView index:0","operation":{"method_name":"query","arguments":[]}}
06-05 23:01:03.722 I/System.out(13521): }
06-05 23:01:03.722 W/ActivityManager( 1631): Bad activity token: android.os.BinderProxy@7533d4d
06-05 23:01:03.722 W/ActivityManager( 1631): java.lang.ClassCastException: android.os.BinderProxy cannot be cast to com.android.server.am.ActivityRecord$Token
06-05 23:01:03.722 W/ActivityManager( 1631): 	at com.android.server.am.ActivityRecord.forTokenLocked(ActivityRecord.java:586)
06-05 23:01:03.722 W/ActivityManager( 1631): 	at com.android.server.am.ActivityRecord.isInStackLocked(ActivityRecord.java:1327)
06-05 23:01:03.722 W/ActivityManager( 1631): 	at com.android.server.am.ActivityRecord.getStackLocked(ActivityRecord.java:1332)
06-05 23:01:03.722 W/ActivityManager( 1631): 	at com.android.server.am.ActivityManagerService.getActivityDisplayId(ActivityManagerService.java:9806)
06-05 23:01:03.722 W/ActivityManager( 1631): 	at android.app.ActivityManagerNative.onTransact(ActivityManagerNative.java:2566)
06-05 23:01:03.722 W/ActivityManager( 1631): 	at com.android.server.am.ActivityManagerService.onTransact(ActivityManagerService.java:2757)
06-05 23:01:03.722 W/ActivityManager( 1631): 	at android.os.Binder.execTransact(Binder.java:565)
06-05 23:01:03.723 W/ActivityManager( 1631): Bad activity token: android.os.BinderProxy@7533d4d
06-05 23:01:03.723 W/ActivityManager( 1631): java.lang.ClassCastException: android.os.BinderProxy cannot be cast to com.android.server.am.ActivityRecord$Token
06-05 23:01:03.723 W/ActivityManager( 1631): 	at com.android.server.am.ActivityRecord.forTokenLocked(ActivityRecord.java:586)
06-05 23:01:03.723 W/ActivityManager( 1631): 	at com.android.server.am.ActivityRecord.isInStackLocked(ActivityRecord.java:1327)
06-05 23:01:03.723 W/ActivityManager( 1631): 	at com.android.server.am.ActivityManagerService.setTaskDescription(ActivityManagerService.java:9358)
06-05 23:01:03.723 W/ActivityManager( 1631): 	at android.app.ActivityManagerNative.onTransact(ActivityManagerNative.java:2639)
06-05 23:01:03.723 W/ActivityManager( 1631): 	at com.android.server.am.ActivityManagerService.onTransact(ActivityManagerService.java:2757)
06-05 23:01:03.723 W/ActivityManager( 1631): 	at android.os.Binder.execTransact(Binder.java:565)
06-05 23:01:03.724 W/ActivityManager( 1631): Bad activity token: android.os.BinderProxy@7533d4d
06-05 23:01:03.724 W/ActivityManager( 1631): java.lang.ClassCastException: android.os.BinderProxy cannot be cast to com.android.server.am.ActivityRecord$Token
06-05 23:01:03.724 W/ActivityManager( 1631): 	at com.android.server.am.ActivityRecord.forTokenLocked(ActivityRecord.java:586)
06-05 23:01:03.724 W/ActivityManager( 1631): 	at com.android.server.am.ActivityRecord.isInStackLocked(ActivityRecord.java:1327)
06-05 23:01:03.724 W/ActivityManager( 1631): 	at com.android.server.am.ActivityRecord.getStackLocked(ActivityRecord.java:1332)
06-05 23:01:03.724 W/ActivityManager( 1631): 	at com.android.server.am.ActivityManagerService.getActivityStackId(ActivityManagerService.java:9817)
06-05 23:01:03.724 W/ActivityManager( 1631): 	at android.app.ActivityManagerNative.onTransact(ActivityManagerNative.java:2856)
06-05 23:01:03.724 W/ActivityManager( 1631): 	at com.android.server.am.ActivityManagerService.onTransact(ActivityManagerService.java:2757)
06-05 23:01:03.724 W/ActivityManager( 1631): 	at android.os.Binder.execTransact(Binder.java:565)
06-05 23:01:03.733 D/VehicleStatisticsActivity(13521): Checking recalculation ...
06-05 23:01:03.733 V/PhoneStatusBar( 1712): setLightsOn(true)
06-05 23:01:03.734 D/VehicleStatisticsActivity(13521): Recalculation not necessary.
06-05 23:01:03.750 W/ActivityManager( 1631): Bad activity token: android.os.BinderProxy@7533d4d
06-05 23:01:03.750 W/ActivityManager( 1631): java.lang.ClassCastException: android.os.BinderProxy cannot be cast to com.android.server.am.ActivityRecord$Token
06-05 23:01:03.750 W/ActivityManager( 1631): 	at com.android.server.am.ActivityRecord.forTokenLocked(ActivityRecord.java:586)
06-05 23:01:03.750 W/ActivityManager( 1631): 	at com.android.server.am.ActivityRecord.isInStackLocked(ActivityRecord.java:1327)
06-05 23:01:03.750 W/ActivityManager( 1631): 	at com.android.server.am.ActivityManagerService.getActivityOptions(ActivityManagerService.java:12559)
06-05 23:01:03.750 W/ActivityManager( 1631): 	at android.app.ActivityManagerNative.onTransact(ActivityManagerNative.java:1933)
06-05 23:01:03.750 W/ActivityManager( 1631): 	at com.android.server.am.ActivityManagerService.onTransact(ActivityManagerService.java:2757)
06-05 23:01:03.750 W/ActivityManager( 1631): 	at android.os.Binder.execTransact(Binder.java:565)
06-05 23:01:03.750 W/ActivityManager( 1631): Bad activity token: android.os.BinderProxy@7533d4d
06-05 23:01:03.750 W/ActivityManager( 1631): java.lang.ClassCastException: android.os.BinderProxy cannot be cast to com.android.server.am.ActivityRecord$Token
06-05 23:01:03.750 W/ActivityManager( 1631): 	at com.android.server.am.ActivityRecord.forTokenLocked(ActivityRecord.java:586)
06-05 23:01:03.750 W/ActivityManager( 1631): 	at com.android.server.am.ActivityRecord.isInStackLocked(ActivityRecord.java:1327)
06-05 23:01:03.750 W/ActivityManager( 1631): 	at com.android.server.am.ActivityManagerService.getActivityOptions(ActivityManagerService.java:12559)
06-05 23:01:03.750 W/ActivityManager( 1631): 	at android.app.ActivityManagerNative.onTransact(ActivityManagerNative.java:1933)
06-05 23:01:03.750 W/ActivityManager( 1631): 	at com.android.server.am.ActivityManagerService.onTransact(ActivityManagerService.java:2757)
06-05 23:01:03.750 W/ActivityManager( 1631): 	at android.os.Binder.execTransact(Binder.java:565)
06-05 23:01:03.752 D/VehicleStatisticsActivity(13521): Checking recalculation ...
06-05 23:01:03.753 D/VehicleStatisticsActivity(13521): Recalculation not necessary.
06-05 23:01:03.832 I/System.out(13521): URI: //map
06-05 23:01:03.832 I/System.out(13521): params: {json={"query":"android.widget.AbsListView index:0","operation":{"method_name":"query","arguments":[]}}
06-05 23:01:03.832 I/System.out(13521): }
06-05 23:01:03.837 I/art     (13521): Do partial code cache collection, code=30KB, data=29KB
06-05 23:01:03.837 I/art     (13521): After code cache collection, code=29KB, data=28KB
06-05 23:01:03.837 I/art     (13521): Increasing code cache capacity to 128KB
06-05 23:01:03.846 I/System.out(13521): URI: //map
06-05 23:01:03.846 I/System.out(13521): params: {json={"query":"android.widget.AbsListView index:0","operation":{"method_name":"query","arguments":[]}}
06-05 23:01:03.846 I/System.out(13521): }
06-05 23:01:03.860 I/System.out(13521): URI: //map
06-05 23:01:03.860 I/System.out(13521): params: {json={"query":"android.widget.AbsListView index:0","operation":{"method_name":"query","arguments":[]}}
06-05 23:01:03.860 I/System.out(13521): }
06-05 23:01:03.874 I/System.out(13521): URI: //map
06-05 23:01:03.874 I/System.out(13521): params: {json={"query":"android.widget.AbsListView index:0","operation":{"method_name":"query","arguments":["getFirstVisiblePosition"]}}
06-05 23:01:03.874 I/System.out(13521): }
06-05 23:01:03.886 I/System.out(13521): URI: //map
06-05 23:01:03.886 I/System.out(13521): params: {json={"query":"android.widget.AbsListView index:0","operation":{"method_name":"query","arguments":["getLastVisiblePosition"]}}
06-05 23:01:03.886 I/System.out(13521): }
06-05 23:01:03.898 I/System.out(13521): URI: //map
06-05 23:01:03.898 I/System.out(13521): params: {json={"query":"android.widget.AbsListView index:0","operation":{"method_name":"query","arguments":[{"method_name":"setSelection","arguments":[26]}]}}
06-05 23:01:03.898 I/System.out(13521): }
06-05 23:01:03.916 I/System.out(13521): URI: //map
06-05 23:01:03.916 I/System.out(13521): params: {json={"query":"* marked:'Smallest fillup'","operation":{"method_name":"query","arguments":[]}}
06-05 23:01:03.916 I/System.out(13521): }
06-05 23:01:03.967 D/gralloc_ranchu( 1347): gralloc_alloc: Creating ashmem region of size 9023488
06-05 23:01:04.017 V/PhoneStatusBar( 1712): setLightsOn(true)
06-05 23:01:04.018 V/PhoneStatusBar( 1712): setLightsOn(true)
06-05 23:01:04.021 W/ResourceType(13521): No package identifier when getting name for resource number 0x00000001
06-05 23:01:04.032 I/System.out(13521): URI: //gesture
06-05 23:01:04.032 I/System.out(13521): params: {json={"query_timeout":5.0,"gestures":[{"query_string":"* marked:'Smallest fillup'","touches":[{"x":50,"y":50,"offset_x":0,"offset_y":0,"wait":0.0,"time":0.2,"release":true,"query_string":null}]}]}
06-05 23:01:04.032 I/System.out(13521): }
06-05 23:01:04.033 I/WindowManager( 1631): Destroying surface Surface(name=com.android.launcher3/com.android.launcher3.Launcher) called by com.android.server.wm.WindowStateAnimator.destroySurface:2016 com.android.server.wm.WindowStateAnimator.destroySurfaceLocked:882 com.android.server.wm.WindowState.destroyOrSaveSurface:2100 com.android.server.wm.AppWindowToken.destroySurfaces:363 com.android.server.wm.AppWindowToken.notifyAppStopped:389 com.android.server.wm.WindowManagerService.notifyAppStopped:4463 com.android.server.am.ActivityStack.activityStoppedLocked:1252 com.android.server.am.ActivityManagerService.activityStopped:6903 
06-05 23:01:04.034 V/PhoneStatusBar( 1712): setLightsOn(true)
06-05 23:01:04.036 W/ResourceType(13521): No package identifier when getting name for resource number 0x00000001
06-05 23:01:04.267 I/ActivityManager( 1631): START u0 {cmp=com.evancharlton.mileage/.charts.MinimumVolumeChart (has extras)} from uid 10326 on display 0
06-05 23:01:04.269 V/PhoneStatusBar( 1712): setLightsOn(true)
06-05 23:01:04.269 V/PhoneStatusBar( 1712): setLightsOn(true)
06-05 23:01:04.277 I/System.out(13521): URI: //map
06-05 23:01:04.277 I/System.out(13521): params: {json={"query":"* {text CONTAINS[c] 'Smallest fillup size'}","operation":{"method_name":"query","arguments":[]}}
06-05 23:01:04.277 I/System.out(13521): }
06-05 23:01:04.316 I/calabash(13521): newActivity1
06-05 23:01:04.319 W/aiCharts(13521): License file is invalid or missing. 
06-05 23:01:04.319 W/aiCharts(13521): Please place proper license.lic to /assets folder.
06-05 23:01:04.331 V/PhoneStatusBar( 1712): setLightsOn(true)
06-05 23:01:04.350 V/PhoneStatusBar( 1712): setLightsOn(true)
06-05 23:01:04.354 I/WindowManager( 1631): Destroying surface Surface(name=Creating chart…) called by com.android.server.wm.WindowStateAnimator.destroySurface:2016 com.android.server.wm.WindowStateAnimator.destroySurfaceLocked:882 com.android.server.wm.WindowState.removeLocked:1456 com.android.server.wm.WindowManagerService.removeWindowInnerLocked:2484 com.android.server.wm.WindowManagerService.removeWindowLocked:2442 com.android.server.wm.WindowManagerService.removeWindowLocked:2311 com.android.server.wm.WindowManagerService.removeWindow:2306 com.android.server.wm.Session.remove:202 
06-05 23:01:04.357 D/gralloc_ranchu( 1347): gralloc_alloc: Creating ashmem region of size 9023488
06-05 23:01:04.367 V/PhoneStatusBar( 1712): setLightsOn(true)
06-05 23:01:04.382 I/ActivityManager( 1631): Displayed com.evancharlton.mileage/.charts.MinimumVolumeChart: +67ms
06-05 23:01:04.383 V/PhoneStatusBar( 1712): setLightsOn(true)
06-05 23:01:04.417 V/PhoneStatusBar( 1712): setLightsOn(true)
06-05 23:01:04.435 V/PhoneStatusBar( 1712): setLightsOn(true)
06-05 23:01:04.617 V/PhoneStatusBar( 1712): setLightsOn(true)
06-05 23:01:04.649 I/System.out(13521): URI: //map
06-05 23:01:04.649 I/System.out(13521): params: {json={"query":"* {text CONTAINS[c] 'Smallest fillup size'}","operation":{"method_name":"query","arguments":[]}}
06-05 23:01:04.649 I/System.out(13521): }
06-05 23:01:04.697 I/System.out(13521): URI: //
06-05 23:01:04.697 I/System.out(13521): params: {json={"command":"press_key","arguments":["KEYCODE_BACK"]}
06-05 23:01:04.697 I/System.out(13521): }
06-05 23:01:04.697 I/System.out(13521): header: {content-type=application/json;charset=utf-8, date=Sat, 06 Jun 2020 04:01:04 GMT, accept=*/*, host=127.0.0.1:34777, content-length=52, user-agent=HTTPClient/1.0 (2.8.3, ruby 2.5.1 (2018-03-29))}
06-05 23:01:04.697 I/System.out(13521): params: {json={"command":"press_key","arguments":["KEYCODE_BACK"]}
06-05 23:01:04.697 I/System.out(13521): }
06-05 23:01:04.697 I/System.out(13521): ProP json = {"command":"press_key","arguments":["KEYCODE_BACK"]}
06-05 23:01:04.697 I/System.out(13521): files: {}
06-05 23:01:04.697 I/System.out(13521): command: {"command":"press_key","arguments":["KEYCODE_BACK"]}
06-05 23:01:04.699 I/InstrumentationBackend(13521): Got command:'Command:'Line:null,press_key', arguments:'[KEYCODE_BACK]'
06-05 23:01:04.702 V/PhoneStatusBar( 1712): setLightsOn(true)
06-05 23:01:04.704 V/PhoneStatusBar( 1712): setLightsOn(true)
06-05 23:01:04.707 I/art     (13521): Do partial code cache collection, code=60KB, data=62KB
06-05 23:01:04.707 I/art     (13521): After code cache collection, code=59KB, data=61KB
06-05 23:01:04.707 I/art     (13521): Increasing code cache capacity to 256KB
06-05 23:01:04.707 D/VehicleStatisticsActivity(13521): Checking recalculation ...
06-05 23:01:04.708 D/VehicleStatisticsActivity(13521): Recalculation not necessary.
06-05 23:01:04.709 I/System.out(13521): result:{"bonusInformation":[],"message":"","success":true}
06-05 23:01:04.712 I/System.out(13521): URI: //map
06-05 23:01:04.712 I/System.out(13521): params: {json={"query":"* {text CONTAINS[c] 'Statistics'}","operation":{"method_name":"query","arguments":[]}}
06-05 23:01:04.712 I/System.out(13521): }
06-05 23:01:04.717 V/PhoneStatusBar( 1712): setLightsOn(true)
06-05 23:01:04.733 D/gralloc_ranchu( 1347): gralloc_alloc: Creating ashmem region of size 9023488
06-05 23:01:04.734 V/PhoneStatusBar( 1712): setLightsOn(true)
06-05 23:01:04.750 V/PhoneStatusBar( 1712): setLightsOn(true)
06-05 23:01:04.783 V/PhoneStatusBar( 1712): setLightsOn(true)
