--------- beginning of system
06-05 23:00:58.193 W/ActivityManager( 1631): Finishing task with all activities already finished
06-05 23:00:58.194 W/ActivityManager( 1631): Duplicate finish request for ActivityRecord{bd64f1 u0 com.evancharlton.mileage/.Mileage t9024 f}
--------- beginning of main
06-05 23:00:58.200 V/PhoneStatusBar( 1712): setLightsOn(true)
06-05 23:00:58.200 D/gralloc_ranchu( 1347): gralloc_alloc: Creating ashmem region of size 3145728
06-05 23:00:58.204 E/EGL_emulation( 1347): tid 1347: eglCreateSyncKHR(1901): error 0x3004 (EGL_BAD_ATTRIBUTE)
06-05 23:00:58.216 W/ActivityManager( 1631): Finishing task with all activities already finished
06-05 23:00:58.216 W/ActivityManager( 1631): Duplicate finish request for ActivityRecord{bd64f1 u0 com.evancharlton.mileage/.Mileage t9024 f}
06-05 23:00:58.216 W/ActivityManager( 1631): Finishing task with all activities already finished
06-05 23:00:58.216 W/ActivityManager( 1631): Duplicate finish request for ActivityRecord{bd64f1 u0 com.evancharlton.mileage/.Mileage t9024 f}
06-05 23:00:58.217 W/ActivityManager( 1631): Finishing task with all activities already finished
06-05 23:00:58.217 W/ActivityManager( 1631): Duplicate finish request for ActivityRecord{bd64f1 u0 com.evancharlton.mileage/.Mileage t9024 f}
06-05 23:00:58.217 W/ActivityManager( 1631): Finishing task with all activities already finished
06-05 23:00:58.217 W/ActivityManager( 1631): Duplicate finish request for ActivityRecord{bd64f1 u0 com.evancharlton.mileage/.Mileage t9024 f}
06-05 23:00:58.217 W/ActivityManager( 1631): Finishing task with all activities already finished
06-05 23:00:58.217 W/ActivityManager( 1631): Duplicate finish request for ActivityRecord{c95a5d3 u0 com.evancharlton.mileage/.charts.AveragePriceChart t9024 f}
06-05 23:00:58.217 W/ActivityManager( 1631): Finishing task with all activities already finished
06-05 23:00:58.217 W/ActivityManager( 1631): Duplicate finish request for ActivityRecord{c95a5d3 u0 com.evancharlton.mileage/.charts.AveragePriceChart t9024 f}
06-05 23:00:58.218 W/ActivityManager( 1631): Finishing task with all activities already finished
06-05 23:00:58.218 W/ActivityManager( 1631): Duplicate finish request for ActivityRecord{bd64f1 u0 com.evancharlton.mileage/.Mileage t9024 f}
06-05 23:00:58.218 W/ActivityManager( 1631): Finishing task with all activities already finished
06-05 23:00:58.218 W/ActivityManager( 1631): Duplicate finish request for ActivityRecord{bd64f1 u0 com.evancharlton.mileage/.Mileage t9024 f}
06-05 23:00:58.251 D/EGL_emulation( 2076): eglMakeCurrent: 0xb0685360: ver 2 0 (tinfo 0xb06836b0)
06-05 23:00:58.253 D/EGL_emulation( 1712): eglMakeCurrent: 0xb0685360: ver 2 0 (tinfo 0xb06836c0)
06-05 23:00:58.267 D/EGL_emulation( 1712): eglMakeCurrent: 0xb0685360: ver 2 0 (tinfo 0xb06836c0)
06-05 23:00:58.285 D/EGL_emulation( 1712): eglMakeCurrent: 0xb0685360: ver 2 0 (tinfo 0xb06836c0)
06-05 23:00:58.300 D/AndroidRuntime(13387): >>>>>> START com.android.internal.os.RuntimeInit uid 2000 <<<<<<
06-05 23:00:58.300 D/EGL_emulation( 1712): eglMakeCurrent: 0xb0685360: ver 2 0 (tinfo 0xb06836c0)
06-05 23:00:58.301 D/AndroidRuntime(13387): CheckJNI is ON
06-05 23:00:58.303 D/EGL_emulation( 1712): eglMakeCurrent: 0xb0685360: ver 2 0 (tinfo 0xb06836c0)
06-05 23:00:58.314 W/art     (13387): Unexpected CPU variant for X86 using defaults: x86
06-05 23:00:58.316 D/ICU     (13387): No timezone override file found: /data/misc/zoneinfo/current/icu/icu_tzdata.dat
06-05 23:00:58.317 D/EGL_emulation( 1712): eglMakeCurrent: 0xb0685360: ver 2 0 (tinfo 0xb06836c0)
06-05 23:00:58.319 D/EGL_emulation( 1712): eglMakeCurrent: 0xb0685360: ver 2 0 (tinfo 0xb06836c0)
06-05 23:00:58.326 E/memtrack(13387): Couldn't load memtrack module (No such file or directory)
06-05 23:00:58.326 E/android.os.Debug(13387): failed to load memtrack module: -2
06-05 23:00:58.327 I/Radio-JNI(13387): register_android_hardware_Radio DONE
06-05 23:00:58.333 D/AndroidRuntime(13387): Calling main entry com.android.commands.am.Am
06-05 23:00:58.334 D/EGL_emulation( 1712): eglMakeCurrent: 0xb0685360: ver 2 0 (tinfo 0xb06836c0)
06-05 23:00:58.334 I/ActivityManager( 1631): Force stopping com.evancharlton.mileage appid=10326 user=0: start instr
06-05 23:00:58.334 I/ActivityManager( 1631): Killing 13335:com.evancharlton.mileage/u0a326 (adj 0): stop com.evancharlton.mileage
06-05 23:00:58.335 D/ActivityManager( 1631): cleanUpApplicationRecord -- 13335
06-05 23:00:58.335 I/WindowManager( 1631): Destroying surface Surface(name=com.evancharlton.mileage/com.evancharlton.mileage.charts.AveragePriceChart) called by com.android.server.wm.WindowStateAnimator.destroySurface:2016 com.android.server.wm.WindowStateAnimator.destroySurfaceLocked:882 com.android.server.wm.WindowState.removeLocked:1456 com.android.server.wm.WindowManagerService.removeWindowInnerLocked:2484 com.android.server.wm.WindowManagerService.removeWindowLocked:2442 com.android.server.wm.WindowManagerService.removeWindowLocked:2311 com.android.server.wm.AppWindowToken.removeAllWindows:530 com.android.server.wm.AppWindowToken.removeAppFromTaskLocked:326 
06-05 23:00:58.336 D/EGL_emulation( 1712): eglMakeCurrent: 0xb0685360: ver 2 0 (tinfo 0xb06836c0)
06-05 23:00:58.337 W/ActivityManager( 1631): Crash of app com.evancharlton.mileage running instrumentation ComponentInfo{com.evancharlton.mileage.test/sh.calaba.instrumentationbackend.CalabashInstrumentationTestRunner}
06-05 23:00:58.337 I/ActivityManager( 1631): Force stopping com.evancharlton.mileage appid=10326 user=0: finished inst
06-05 23:00:58.341 I/art     (13397): Not late-enabling -Xcheck:jni (already on)
06-05 23:00:58.341 W/art     (13397): Unexpected CPU variant for X86 using defaults: x86
06-05 23:00:58.348 I/ActivityManager( 1631): Start proc 13397:com.evancharlton.mileage/u0a326 for added application com.evancharlton.mileage
06-05 23:00:58.348 D/AndroidRuntime(13387): Shutting down VM
06-05 23:00:58.350 D/EGL_emulation( 1712): eglMakeCurrent: 0xb0685360: ver 2 0 (tinfo 0xb06836c0)
06-05 23:00:58.352 D/EGL_emulation( 1712): eglMakeCurrent: 0xb0685360: ver 2 0 (tinfo 0xb06836c0)
06-05 23:00:58.354 W/System  (13397): ClassLoader referenced unknown path: /data/app/com.evancharlton.mileage.test-1/lib/x86
06-05 23:00:58.354 W/System  (13397): ClassLoader referenced unknown path: /data/app/com.evancharlton.mileage-1/lib/x86
06-05 23:00:58.357 W/System  (13397): ClassLoader referenced unknown path: 
06-05 23:00:58.362 I/System.out(13397): Main activity name automatically set to: com.evancharlton.mileage.Mileage
06-05 23:00:58.362 I/System.out(13397): Calabash did not load Mono. This is only a problem if you are trying to test a Mono application
06-05 23:00:58.362 I/calabash(13397): Test server port: 7102
06-05 23:00:58.363 I/InstrumentationBackend(13397): Added:'GetPreferences', with key:'get_preferences'
06-05 23:00:58.367 D/EGL_emulation( 1712): eglMakeCurrent: 0xb0685360: ver 2 0 (tinfo 0xb06836c0)
06-05 23:00:58.369 D/EGL_emulation( 1712): eglMakeCurrent: 0xb0685360: ver 2 0 (tinfo 0xb06836c0)
06-05 23:00:58.369 I/InstrumentationBackend(13397): Added:'SetPreferences', with key:'set_preferences'
06-05 23:00:58.369 I/InstrumentationBackend(13397): Added:'ClearPreferences', with key:'clear_preferences'
06-05 23:00:58.369 I/InstrumentationBackend(13397): Added:'PressElement', with key:'press_l10n_element'
06-05 23:00:58.369 I/InstrumentationBackend(13397): Added:'WaitForElement', with key:'wait_for_l10n_element'
06-05 23:00:58.369 I/InstrumentationBackend(13397): Added:'NullAction', with key:'nullAction'
06-05 23:00:58.369 I/InstrumentationBackend(13397): Added:'PressKey', with key:'press_key'
06-05 23:00:58.369 I/InstrumentationBackend(13397): Added:'SetActivityOrientation', with key:'set_activity_orientation'
06-05 23:00:58.369 I/InstrumentationBackend(13397): Added:'GetActivityOrientation', with key:'get_activity_orientation'
06-05 23:00:58.369 I/InstrumentationBackend(13397): Added:'FakeGPSLocation', with key:'set_gps_coordinates'
06-05 23:00:58.369 I/InstrumentationBackend(13397): Added:'SetPropertyByCssSelector', with key:'set_property_by_css_selector'
06-05 23:00:58.369 I/InstrumentationBackend(13397): Added:'GetUrl', with key:'get_url'
06-05 23:00:58.370 I/InstrumentationBackend(13397): Added:'ScrollTo', with key:'scroll_to'
06-05 23:00:58.370 I/InstrumentationBackend(13397): Added:'GetLoadProgress', with key:'get_load_progress'
06-05 23:00:58.370 I/InstrumentationBackend(13397): Added:'DumpHtml', with key:'dump_html'
06-05 23:00:58.370 I/InstrumentationBackend(13397): Added:'DumpBodyHtml', with key:'dump_body_html'
06-05 23:00:58.370 I/InstrumentationBackend(13397): Added:'EnterTextByCssSelector', with key:'enter_text_by_selector'
06-05 23:00:58.370 I/InstrumentationBackend(13397): Added:'AndroidSDKVersion', with key:'android_sdk_version'
06-05 23:00:58.370 I/InstrumentationBackend(13397): Added:'Version', with key:'version'
06-05 23:00:58.370 I/InstrumentationBackend(13397): Added:'Drag', with key:'drag'
06-05 23:00:58.370 I/InstrumentationBackend(13397): Added:'TouchCoordinates', with key:'touch_coordinate'
06-05 23:00:58.370 I/InstrumentationBackend(13397): Added:'LongPressCoordinate', with key:'long_press_coordinate'
06-05 23:00:58.371 I/InstrumentationBackend(13397): Added:'DragCoordinates', with key:'drag_coordinates'
06-05 23:00:58.371 I/InstrumentationBackend(13397): Added:'ResumeApplication', with key:'resume_application'
06-05 23:00:58.371 I/InstrumentationBackend(13397): Added:'Swipe', with key:'swipe'
06-05 23:00:58.371 I/InstrumentationBackend(13397): Added:'DoubleTapCoordinate', with key:'double_tap_coordinate'
06-05 23:00:58.371 I/InstrumentationBackend(13397): Added:'ClickOnScreen', with key:'click_on_screen'
06-05 23:00:58.371 I/InstrumentationBackend(13397): Added:'GetActivityName', with key:'get_activity_name'
06-05 23:00:58.371 I/InstrumentationBackend(13397): Added:'ScrollToView', with key:'scroll_to_view'
06-05 23:00:58.371 I/InstrumentationBackend(13397): Added:'ViewConfiguration', with key:'view_configuration'
06-05 23:00:58.371 I/InstrumentationBackend(13397): Added:'IsCurrentActivityFocused', with key:'is_current_activity_focused'
06-05 23:00:58.371 I/InstrumentationBackend(13397): Added:'SendTcp', with key:'send_tcp'
06-05 23:00:58.371 I/InstrumentationBackend(13397): Added:'DpToDevicePixel', with key:'dp_to_device_pixel'
06-05 23:00:58.371 I/InstrumentationBackend(13397): Added:'KeyboardEnterText', with key:'keyboard_enter_text'
06-05 23:00:58.371 I/InstrumentationBackend(13397): Added:'DeleteSurroundingText', with key:'delete_surrounding_text'
06-05 23:00:58.371 I/InstrumentationBackend(13397): Added:'SetComposingRegion', with key:'set_composing_region'
06-05 23:00:58.371 I/InstrumentationBackend(13397): Added:'SetSelection', with key:'set_selection'
06-05 23:00:58.371 I/InstrumentationBackend(13397): Added:'KeyboardKeyEvent', with key:'keyboard_key_event'
06-05 23:00:58.371 I/InstrumentationBackend(13397): Added:'PressUserActionButton', with key:'press_user_action_button'
06-05 23:00:58.371 I/InstrumentationBackend(13397): Added:'HideSoftKeyboard', with key:'hide_soft_keyboard'
06-05 23:00:58.371 I/InstrumentationBackend(13397): Added:'ListActions', with key:'list_actions'
06-05 23:00:58.372 I/calabash(13397): Instantiating http server at 7102
06-05 23:00:58.373 I/System.out(13397): HTTP Daemon listening on: 7102
06-05 23:00:58.373 I/WindowManager( 1631): WIN DEATH: Window{9650474 u0 com.evancharlton.mileage/com.evancharlton.mileage.Mileage EXITING}
06-05 23:00:58.384 D/EGL_emulation( 1712): eglMakeCurrent: 0xb0685360: ver 2 0 (tinfo 0xb06836c0)
06-05 23:00:58.388 D/EGL_emulation( 1712): eglMakeCurrent: 0xb0685360: ver 2 0 (tinfo 0xb06836c0)
06-05 23:00:58.400 D/EGL_emulation( 1712): eglMakeCurrent: 0xb0685360: ver 2 0 (tinfo 0xb06836c0)
06-05 23:00:58.402 D/EGL_emulation( 1712): eglMakeCurrent: 0xb0685360: ver 2 0 (tinfo 0xb06836c0)
06-05 23:00:58.417 D/EGL_emulation( 1712): eglMakeCurrent: 0xb0685360: ver 2 0 (tinfo 0xb06836c0)
06-05 23:00:58.419 D/EGL_emulation( 1712): eglMakeCurrent: 0xb0685360: ver 2 0 (tinfo 0xb06836c0)
06-05 23:00:58.434 D/EGL_emulation( 1712): eglMakeCurrent: 0xb0685360: ver 2 0 (tinfo 0xb06836c0)
06-05 23:00:58.436 D/EGL_emulation( 1712): eglMakeCurrent: 0xb0685360: ver 2 0 (tinfo 0xb06836c0)
06-05 23:00:58.451 D/EGL_emulation( 1712): eglMakeCurrent: 0xb0685360: ver 2 0 (tinfo 0xb06836c0)
06-05 23:00:58.461 I/System.out(13397): URI: //ping
06-05 23:00:58.461 I/System.out(13397): params: {json={}
06-05 23:00:58.461 I/System.out(13397): }
06-05 23:00:58.464 I/System.out(13397): URI: //ping
06-05 23:00:58.464 I/System.out(13397): params: {json={}
06-05 23:00:58.464 I/System.out(13397): }
06-05 23:00:58.467 D/EGL_emulation( 1712): eglMakeCurrent: 0xb0685360: ver 2 0 (tinfo 0xb06836c0)
06-05 23:00:58.467 I/System.out(13397): URI: //ready
06-05 23:00:58.467 I/System.out(13397): params: {json={}
06-05 23:00:58.467 I/System.out(13397): }
06-05 23:00:58.470 D/EGL_emulation( 1712): eglMakeCurrent: 0xb0685360: ver 2 0 (tinfo 0xb06836c0)
06-05 23:00:58.470 I/System.out(13397): URI: //
06-05 23:00:58.470 I/System.out(13397): params: {json={"command":"version","arguments":[]}
06-05 23:00:58.470 I/System.out(13397): }
06-05 23:00:58.470 I/System.out(13397): header: {content-type=application/json;charset=utf-8, date=Sat, 06 Jun 2020 04:00:58 GMT, accept=*/*, host=127.0.0.1:34777, content-length=36, user-agent=HTTPClient/1.0 (2.8.3, ruby 2.5.1 (2018-03-29))}
06-05 23:00:58.470 I/System.out(13397): params: {json={"command":"version","arguments":[]}
06-05 23:00:58.470 I/System.out(13397): }
06-05 23:00:58.471 I/System.out(13397): ProP json = {"command":"version","arguments":[]}
06-05 23:00:58.471 I/System.out(13397): files: {}
06-05 23:00:58.471 I/System.out(13397): command: {"command":"version","arguments":[]}
06-05 23:00:58.476 I/InstrumentationBackend(13397): Got command:'Command:'Line:null,version', arguments:'[]'
06-05 23:00:58.484 D/EGL_emulation( 1712): eglMakeCurrent: 0xb0685360: ver 2 0 (tinfo 0xb06836c0)
06-05 23:00:58.486 D/EGL_emulation( 1712): eglMakeCurrent: 0xb0685360: ver 2 0 (tinfo 0xb06836c0)
06-05 23:00:58.487 I/System.out(13397): result:{"bonusInformation":[],"message":"0.9.8","success":true}
06-05 23:00:58.491 I/System.out(13397): URI: //start-application
06-05 23:00:58.491 I/System.out(13397): params: {json={"intent":null}
06-05 23:00:58.491 I/System.out(13397): }
06-05 23:00:58.509 I/ActivityManager( 1631): START u0 {act=android.intent.action.MAIN cat=[android.intent.category.LAUNCHER] flg=0x10200000 cmp=com.evancharlton.mileage/.Mileage} from uid 10326 on display 0
06-05 23:00:58.519 I/calabash(13397): newActivity1
06-05 23:00:58.534 D/gralloc_ranchu( 1347): gralloc_alloc: Creating ashmem region of size 9023488
06-05 23:00:58.538 I/calabash(13397): newActivity1
06-05 23:00:58.540 W/ActivityManager( 1631): Bad activity token: android.os.BinderProxy@e26e0a5
06-05 23:00:58.540 W/ActivityManager( 1631): java.lang.ClassCastException: android.os.BinderProxy cannot be cast to com.android.server.am.ActivityRecord$Token
06-05 23:00:58.540 W/ActivityManager( 1631): 	at com.android.server.am.ActivityRecord.forTokenLocked(ActivityRecord.java:586)
06-05 23:00:58.540 W/ActivityManager( 1631): 	at com.android.server.am.ActivityRecord.isInStackLocked(ActivityRecord.java:1327)
06-05 23:00:58.540 W/ActivityManager( 1631): 	at com.android.server.am.ActivityRecord.getStackLocked(ActivityRecord.java:1332)
06-05 23:00:58.540 W/ActivityManager( 1631): 	at com.android.server.am.ActivityManagerService.getActivityDisplayId(ActivityManagerService.java:9806)
06-05 23:00:58.540 W/ActivityManager( 1631): 	at android.app.ActivityManagerNative.onTransact(ActivityManagerNative.java:2566)
06-05 23:00:58.540 W/ActivityManager( 1631): 	at com.android.server.am.ActivityManagerService.onTransact(ActivityManagerService.java:2757)
06-05 23:00:58.540 W/ActivityManager( 1631): 	at android.os.Binder.execTransact(Binder.java:565)
06-05 23:00:58.542 W/ActivityManager( 1631): Bad activity token: android.os.BinderProxy@e26e0a5
06-05 23:00:58.542 W/ActivityManager( 1631): java.lang.ClassCastException: android.os.BinderProxy cannot be cast to com.android.server.am.ActivityRecord$Token
06-05 23:00:58.542 W/ActivityManager( 1631): 	at com.android.server.am.ActivityRecord.forTokenLocked(ActivityRecord.java:586)
06-05 23:00:58.542 W/ActivityManager( 1631): 	at com.android.server.am.ActivityRecord.isInStackLocked(ActivityRecord.java:1327)
06-05 23:00:58.542 W/ActivityManager( 1631): 	at com.android.server.am.ActivityManagerService.setTaskDescription(ActivityManagerService.java:9358)
06-05 23:00:58.542 W/ActivityManager( 1631): 	at android.app.ActivityManagerNative.onTransact(ActivityManagerNative.java:2639)
06-05 23:00:58.542 W/ActivityManager( 1631): 	at com.android.server.am.ActivityManagerService.onTransact(ActivityManagerService.java:2757)
06-05 23:00:58.542 W/ActivityManager( 1631): 	at android.os.Binder.execTransact(Binder.java:565)
06-05 23:00:58.542 W/ActivityManager( 1631): Bad activity token: android.os.BinderProxy@e26e0a5
06-05 23:00:58.542 W/ActivityManager( 1631): java.lang.ClassCastException: android.os.BinderProxy cannot be cast to com.android.server.am.ActivityRecord$Token
06-05 23:00:58.542 W/ActivityManager( 1631): 	at com.android.server.am.ActivityRecord.forTokenLocked(ActivityRecord.java:586)
06-05 23:00:58.542 W/ActivityManager( 1631): 	at com.android.server.am.ActivityRecord.isInStackLocked(ActivityRecord.java:1327)
06-05 23:00:58.542 W/ActivityManager( 1631): 	at com.android.server.am.ActivityRecord.getStackLocked(ActivityRecord.java:1332)
06-05 23:00:58.542 W/ActivityManager( 1631): 	at com.android.server.am.ActivityManagerService.getActivityStackId(ActivityManagerService.java:9817)
06-05 23:00:58.542 W/ActivityManager( 1631): 	at android.app.ActivityManagerNative.onTransact(ActivityManagerNative.java:2856)
06-05 23:00:58.542 W/ActivityManager( 1631): 	at com.android.server.am.ActivityManagerService.onTransact(ActivityManagerService.java:2757)
06-05 23:00:58.542 W/ActivityManager( 1631): 	at android.os.Binder.execTransact(Binder.java:565)
06-05 23:00:58.571 V/PhoneStatusBar( 1712): setLightsOn(true)
06-05 23:00:58.577 W/ActivityManager( 1631): Bad activity token: android.os.BinderProxy@e26e0a5
06-05 23:00:58.577 W/ActivityManager( 1631): java.lang.ClassCastException: android.os.BinderProxy cannot be cast to com.android.server.am.ActivityRecord$Token
06-05 23:00:58.577 W/ActivityManager( 1631): 	at com.android.server.am.ActivityRecord.forTokenLocked(ActivityRecord.java:586)
06-05 23:00:58.577 W/ActivityManager( 1631): 	at com.android.server.am.ActivityRecord.isInStackLocked(ActivityRecord.java:1327)
06-05 23:00:58.577 W/ActivityManager( 1631): 	at com.android.server.am.ActivityManagerService.getActivityOptions(ActivityManagerService.java:12559)
06-05 23:00:58.577 W/ActivityManager( 1631): 	at android.app.ActivityManagerNative.onTransact(ActivityManagerNative.java:1933)
06-05 23:00:58.577 W/ActivityManager( 1631): 	at com.android.server.am.ActivityManagerService.onTransact(ActivityManagerService.java:2757)
06-05 23:00:58.577 W/ActivityManager( 1631): 	at android.os.Binder.execTransact(Binder.java:565)
06-05 23:00:58.577 W/ActivityManager( 1631): Bad activity token: android.os.BinderProxy@e26e0a5
06-05 23:00:58.577 W/ActivityManager( 1631): java.lang.ClassCastException: android.os.BinderProxy cannot be cast to com.android.server.am.ActivityRecord$Token
06-05 23:00:58.577 W/ActivityManager( 1631): 	at com.android.server.am.ActivityRecord.forTokenLocked(ActivityRecord.java:586)
06-05 23:00:58.577 W/ActivityManager( 1631): 	at com.android.server.am.ActivityRecord.isInStackLocked(ActivityRecord.java:1327)
06-05 23:00:58.577 W/ActivityManager( 1631): 	at com.android.server.am.ActivityManagerService.getActivityOptions(ActivityManagerService.java:12559)
06-05 23:00:58.577 W/ActivityManager( 1631): 	at android.app.ActivityManagerNative.onTransact(ActivityManagerNative.java:1933)
06-05 23:00:58.577 W/ActivityManager( 1631): 	at com.android.server.am.ActivityManagerService.onTransact(ActivityManagerService.java:2757)
06-05 23:00:58.577 W/ActivityManager( 1631): 	at android.os.Binder.execTransact(Binder.java:565)
06-05 23:00:58.584 D/EGL_emulation( 2076): eglMakeCurrent: 0xb0685360: ver 2 0 (tinfo 0xb06836b0)
06-05 23:00:58.587 D/EGL_emulation( 1712): eglMakeCurrent: 0xb0685360: ver 2 0 (tinfo 0xb06836c0)
06-05 23:00:58.601 D/EGL_emulation( 1712): eglMakeCurrent: 0xb0685360: ver 2 0 (tinfo 0xb06836c0)
06-05 23:00:58.605 D/EGL_emulation( 1712): eglMakeCurrent: 0xb0685360: ver 2 0 (tinfo 0xb06836c0)
06-05 23:00:58.617 D/EGL_emulation( 1712): eglMakeCurrent: 0xb0685360: ver 2 0 (tinfo 0xb06836c0)
06-05 23:00:58.618 D/gralloc_ranchu( 1347): gralloc_alloc: Creating ashmem region of size 9023488
06-05 23:00:58.627 D/        (13397): HostConnection::get() New Host Connection established 0x94220080, tid 13397
06-05 23:00:58.627 D/EGL_emulation( 1712): eglMakeCurrent: 0xb0685360: ver 2 0 (tinfo 0xb06836c0)
06-05 23:00:58.627 V/PhoneStatusBar( 1712): setLightsOn(true)
06-05 23:00:58.694 D/EGL_emulation( 1712): eglMakeCurrent: 0xb0685360: ver 2 0 (tinfo 0xb06836c0)
06-05 23:00:58.700 D/EGL_emulation( 1712): eglMakeCurrent: 0xb0685360: ver 2 0 (tinfo 0xb06836c0)
06-05 23:00:58.702 I/WindowManager( 1631): Destroying surface Surface(name=com.evancharlton.mileage/com.evancharlton.mileage.Mileage) called by com.android.server.wm.WindowStateAnimator.destroySurface:2016 com.android.server.wm.WindowStateAnimator.destroySurfaceLocked:882 com.android.server.wm.WindowState.removeLocked:1456 com.android.server.wm.WindowManagerService.removeWindowInnerLocked:2484 com.android.server.wm.AppWindowToken.destroySurfaces:365 com.android.server.wm.WindowStateAnimator.finishExit:565 com.android.server.wm.AppWindowAnimator.stepAnimationLocked:427 com.android.server.wm.WindowAnimator.updateAppWindowsLocked:196 
06-05 23:00:58.704 D/EGL_emulation( 1712): eglMakeCurrent: 0xb0685360: ver 2 0 (tinfo 0xb06836c0)
06-05 23:00:58.707 D/EGL_emulation( 1712): eglMakeCurrent: 0xb0685360: ver 2 0 (tinfo 0xb06836c0)
06-05 23:00:58.723 D/EGL_emulation( 1712): eglMakeCurrent: 0xb0685360: ver 2 0 (tinfo 0xb06836c0)
06-05 23:00:58.726 D/EGL_emulation( 1712): eglMakeCurrent: 0xb0685360: ver 2 0 (tinfo 0xb06836c0)
06-05 23:00:58.727 V/PhoneStatusBar( 1712): setLightsOn(true)
06-05 23:00:58.735 D/EGL_emulation( 1712): eglMakeCurrent: 0xb0685360: ver 2 0 (tinfo 0xb06836c0)
06-05 23:00:58.738 D/EGL_emulation( 1712): eglMakeCurrent: 0xb0685360: ver 2 0 (tinfo 0xb06836c0)
06-05 23:00:58.752 D/EGL_emulation( 1712): eglMakeCurrent: 0xb0685360: ver 2 0 (tinfo 0xb06836c0)
06-05 23:00:58.755 D/EGL_emulation( 1712): eglMakeCurrent: 0xb0685360: ver 2 0 (tinfo 0xb06836c0)
06-05 23:00:58.768 I/ActivityManager( 1631): Displayed com.evancharlton.mileage/.Mileage: +253ms
06-05 23:00:58.769 D/gralloc_ranchu( 1347): gralloc_alloc: Creating ashmem region of size 9023488
06-05 23:00:58.786 D/EGL_emulation( 1712): eglMakeCurrent: 0xb0685360: ver 2 0 (tinfo 0xb06836c0)
06-05 23:00:58.801 D/EGL_emulation( 1712): eglMakeCurrent: 0xb0685360: ver 2 0 (tinfo 0xb06836c0)
06-05 23:00:58.802 V/PhoneStatusBar( 1712): setLightsOn(true)
06-05 23:00:58.805 D/EGL_emulation( 1712): eglMakeCurrent: 0xb0685360: ver 2 0 (tinfo 0xb06836c0)
06-05 23:00:58.806 V/PhoneStatusBar( 1712): setLightsOn(true)
06-05 23:00:58.862 I/System.out(13397): URI: //map
06-05 23:00:58.862 I/System.out(13397): params: {json={"query":"* marked:'Statistics'","operation":{"method_name":"query","arguments":[]}}
06-05 23:00:58.862 I/System.out(13397): }
06-05 23:00:58.891 W/ResourceType(13397): No package identifier when getting name for resource number 0x00000001
06-05 23:00:58.918 I/System.out(13397): URI: //gesture
06-05 23:00:58.918 I/System.out(13397): params: {json={"query_timeout":5.0,"gestures":[{"query_string":"* marked:'Statistics'","touches":[{"x":50,"y":50,"offset_x":0,"offset_y":0,"wait":0.0,"time":0.2,"release":true,"query_string":null}]}]}
06-05 23:00:58.918 I/System.out(13397): }
06-05 23:00:58.929 W/ResourceType(13397): No package identifier when getting name for resource number 0x00000001
06-05 23:00:58.984 I/WindowManager( 1631): Destroying surface Surface(name=Starting com.evancharlton.mileage) called by com.android.server.wm.WindowStateAnimator.destroySurface:2016 com.android.server.wm.WindowStateAnimator.destroySurfaceLocked:882 com.android.server.wm.WindowState.destroyOrSaveSurface:2100 com.android.server.wm.AppWindowToken.destroySurfaces:363 com.android.server.wm.WindowStateAnimator.finishExit:565 com.android.server.wm.WindowStateAnimator.stepAnimationLocked:491 com.android.server.wm.WindowAnimator.updateWindowsLocked:303 com.android.server.wm.WindowAnimator.animateLocked:704 
06-05 23:00:58.986 V/PhoneStatusBar( 1712): setLightsOn(true)
06-05 23:00:59.000 V/PhoneStatusBar( 1712): setLightsOn(true)
06-05 23:00:59.054 V/PhoneStatusBar( 1712): setLightsOn(true)
06-05 23:00:59.175 I/calabash(13397): newActivity1
06-05 23:00:59.230 I/System.out(13397): URI: //map
06-05 23:00:59.230 I/System.out(13397): params: {json={"query":"android.widget.ScrollView index:0","operation":{"method_name":"query","arguments":[]}}
06-05 23:00:59.230 I/System.out(13397): }
06-05 23:00:59.245 W/ActivityManager( 1631): Bad activity token: android.os.BinderProxy@ea2a8f7
06-05 23:00:59.245 W/ActivityManager( 1631): java.lang.ClassCastException: android.os.BinderProxy cannot be cast to com.android.server.am.ActivityRecord$Token
06-05 23:00:59.245 W/ActivityManager( 1631): 	at com.android.server.am.ActivityRecord.forTokenLocked(ActivityRecord.java:586)
06-05 23:00:59.245 W/ActivityManager( 1631): 	at com.android.server.am.ActivityRecord.isInStackLocked(ActivityRecord.java:1327)
06-05 23:00:59.245 W/ActivityManager( 1631): 	at com.android.server.am.ActivityRecord.getStackLocked(ActivityRecord.java:1332)
06-05 23:00:59.245 W/ActivityManager( 1631): 	at com.android.server.am.ActivityManagerService.getActivityDisplayId(ActivityManagerService.java:9806)
06-05 23:00:59.245 W/ActivityManager( 1631): 	at android.app.ActivityManagerNative.onTransact(ActivityManagerNative.java:2566)
06-05 23:00:59.245 W/ActivityManager( 1631): 	at com.android.server.am.ActivityManagerService.onTransact(ActivityManagerService.java:2757)
06-05 23:00:59.245 W/ActivityManager( 1631): 	at android.os.Binder.execTransact(Binder.java:565)
06-05 23:00:59.249 W/ActivityManager( 1631): Bad activity token: android.os.BinderProxy@ea2a8f7
06-05 23:00:59.249 W/ActivityManager( 1631): java.lang.ClassCastException: android.os.BinderProxy cannot be cast to com.android.server.am.ActivityRecord$Token
06-05 23:00:59.249 W/ActivityManager( 1631): 	at com.android.server.am.ActivityRecord.forTokenLocked(ActivityRecord.java:586)
06-05 23:00:59.249 W/ActivityManager( 1631): 	at com.android.server.am.ActivityRecord.isInStackLocked(ActivityRecord.java:1327)
06-05 23:00:59.249 W/ActivityManager( 1631): 	at com.android.server.am.ActivityManagerService.setTaskDescription(ActivityManagerService.java:9358)
06-05 23:00:59.249 W/ActivityManager( 1631): 	at android.app.ActivityManagerNative.onTransact(ActivityManagerNative.java:2639)
06-05 23:00:59.249 W/ActivityManager( 1631): 	at com.android.server.am.ActivityManagerService.onTransact(ActivityManagerService.java:2757)
06-05 23:00:59.249 W/ActivityManager( 1631): 	at android.os.Binder.execTransact(Binder.java:565)
06-05 23:00:59.250 W/ActivityManager( 1631): Bad activity token: android.os.BinderProxy@ea2a8f7
06-05 23:00:59.250 W/ActivityManager( 1631): java.lang.ClassCastException: android.os.BinderProxy cannot be cast to com.android.server.am.ActivityRecord$Token
06-05 23:00:59.250 W/ActivityManager( 1631): 	at com.android.server.am.ActivityRecord.forTokenLocked(ActivityRecord.java:586)
06-05 23:00:59.250 W/ActivityManager( 1631): 	at com.android.server.am.ActivityRecord.isInStackLocked(ActivityRecord.java:1327)
06-05 23:00:59.250 W/ActivityManager( 1631): 	at com.android.server.am.ActivityRecord.getStackLocked(ActivityRecord.java:1332)
06-05 23:00:59.250 W/ActivityManager( 1631): 	at com.android.server.am.ActivityManagerService.getActivityStackId(ActivityManagerService.java:9817)
06-05 23:00:59.250 W/ActivityManager( 1631): 	at android.app.ActivityManagerNative.onTransact(ActivityManagerNative.java:2856)
06-05 23:00:59.250 W/ActivityManager( 1631): 	at com.android.server.am.ActivityManagerService.onTransact(ActivityManagerService.java:2757)
06-05 23:00:59.250 W/ActivityManager( 1631): 	at android.os.Binder.execTransact(Binder.java:565)
06-05 23:00:59.274 D/VehicleStatisticsActivity(13397): Checking recalculation ...
06-05 23:00:59.277 D/VehicleStatisticsActivity(13397): Recalculation not necessary.
06-05 23:00:59.285 W/ActivityManager( 1631): Bad activity token: android.os.BinderProxy@ea2a8f7
06-05 23:00:59.285 W/ActivityManager( 1631): java.lang.ClassCastException: android.os.BinderProxy cannot be cast to com.android.server.am.ActivityRecord$Token
06-05 23:00:59.285 W/ActivityManager( 1631): 	at com.android.server.am.ActivityRecord.forTokenLocked(ActivityRecord.java:586)
06-05 23:00:59.285 W/ActivityManager( 1631): 	at com.android.server.am.ActivityRecord.isInStackLocked(ActivityRecord.java:1327)
06-05 23:00:59.285 W/ActivityManager( 1631): 	at com.android.server.am.ActivityManagerService.getActivityOptions(ActivityManagerService.java:12559)
06-05 23:00:59.285 W/ActivityManager( 1631): 	at android.app.ActivityManagerNative.onTransact(ActivityManagerNative.java:1933)
06-05 23:00:59.285 W/ActivityManager( 1631): 	at com.android.server.am.ActivityManagerService.onTransact(ActivityManagerService.java:2757)
06-05 23:00:59.285 W/ActivityManager( 1631): 	at android.os.Binder.execTransact(Binder.java:565)
06-05 23:00:59.287 W/ActivityManager( 1631): Bad activity token: android.os.BinderProxy@ea2a8f7
06-05 23:00:59.287 W/ActivityManager( 1631): java.lang.ClassCastException: android.os.BinderProxy cannot be cast to com.android.server.am.ActivityRecord$Token
06-05 23:00:59.287 W/ActivityManager( 1631): 	at com.android.server.am.ActivityRecord.forTokenLocked(ActivityRecord.java:586)
06-05 23:00:59.287 W/ActivityManager( 1631): 	at com.android.server.am.ActivityRecord.isInStackLocked(ActivityRecord.java:1327)
06-05 23:00:59.287 W/ActivityManager( 1631): 	at com.android.server.am.ActivityManagerService.getActivityOptions(ActivityManagerService.java:12559)
06-05 23:00:59.287 W/ActivityManager( 1631): 	at android.app.ActivityManagerNative.onTransact(ActivityManagerNative.java:1933)
06-05 23:00:59.287 W/ActivityManager( 1631): 	at com.android.server.am.ActivityManagerService.onTransact(ActivityManagerService.java:2757)
06-05 23:00:59.287 W/ActivityManager( 1631): 	at android.os.Binder.execTransact(Binder.java:565)
06-05 23:00:59.292 D/VehicleStatisticsActivity(13397): Checking recalculation ...
06-05 23:00:59.295 D/VehicleStatisticsActivity(13397): Recalculation not necessary.
06-05 23:00:59.335 V/PhoneStatusBar( 1712): setLightsOn(true)
06-05 23:00:59.338 V/PhoneStatusBar( 1712): setLightsOn(true)
06-05 23:00:59.342 W/OpenGLRenderer( 2076): Incorrectly called buildLayer on View: ShortcutAndWidgetContainer, destroying layer...
06-05 23:00:59.351 V/PhoneStatusBar( 1712): setLightsOn(true)
06-05 23:00:59.353 I/WindowManager( 1631): Destroying surface Surface(name=com.android.launcher3/com.android.launcher3.Launcher) called by com.android.server.wm.WindowStateAnimator.destroySurface:2016 com.android.server.wm.WindowStateAnimator.destroySurfaceLocked:882 com.android.server.wm.WindowState.destroyOrSaveSurface:2100 com.android.server.wm.AppWindowToken.destroySurfaces:363 com.android.server.wm.AppWindowToken.notifyAppStopped:389 com.android.server.wm.WindowManagerService.notifyAppStopped:4463 com.android.server.am.ActivityStack.activityStoppedLocked:1252 com.android.server.am.ActivityManagerService.activityStopped:6903 
06-05 23:00:59.500 I/System.out(13397): URI: //map
06-05 23:00:59.500 I/System.out(13397): params: {json={"query":"android.widget.AbsListView index:0","operation":{"method_name":"query","arguments":[]}}
06-05 23:00:59.500 I/System.out(13397): }
06-05 23:00:59.523 I/art     (13397): Do partial code cache collection, code=30KB, data=29KB
06-05 23:00:59.523 I/art     (13397): After code cache collection, code=29KB, data=28KB
06-05 23:00:59.523 I/art     (13397): Increasing code cache capacity to 128KB
06-05 23:00:59.556 I/System.out(13397): URI: //map
06-05 23:00:59.557 I/System.out(13397): params: {json={"query":"android.widget.AbsListView index:0","operation":{"method_name":"query","arguments":[]}}
06-05 23:00:59.557 I/System.out(13397): }
06-05 23:00:59.587 I/System.out(13397): URI: //map
06-05 23:00:59.587 I/System.out(13397): params: {json={"query":"android.widget.AbsListView index:0","operation":{"method_name":"query","arguments":[]}}
06-05 23:00:59.587 I/System.out(13397): }
06-05 23:00:59.615 I/System.out(13397): URI: //map
06-05 23:00:59.615 I/System.out(13397): params: {json={"query":"android.widget.AbsListView index:0","operation":{"method_name":"query","arguments":["getFirstVisiblePosition"]}}
06-05 23:00:59.615 I/System.out(13397): }
06-05 23:00:59.639 I/System.out(13397): URI: //map
06-05 23:00:59.639 I/System.out(13397): params: {json={"query":"android.widget.AbsListView index:0","operation":{"method_name":"query","arguments":["getLastVisiblePosition"]}}
06-05 23:00:59.639 I/System.out(13397): }
06-05 23:00:59.657 I/System.out(13397): URI: //map
06-05 23:00:59.657 I/System.out(13397): params: {json={"query":"android.widget.AbsListView index:0","operation":{"method_name":"query","arguments":[{"method_name":"setSelection","arguments":[26]}]}}
06-05 23:00:59.657 I/System.out(13397): }
06-05 23:00:59.689 I/System.out(13397): URI: //map
06-05 23:00:59.689 I/System.out(13397): params: {json={"query":"* marked:'Minimum price'","operation":{"method_name":"query","arguments":[]}}
06-05 23:00:59.689 I/System.out(13397): }
06-05 23:00:59.731 D/gralloc_ranchu( 1347): gralloc_alloc: Creating ashmem region of size 9023488
06-05 23:00:59.770 W/ResourceType(13397): No package identifier when getting name for resource number 0x00000001
06-05 23:00:59.781 I/System.out(13397): URI: //gesture
06-05 23:00:59.781 I/System.out(13397): params: {json={"query_timeout":5.0,"gestures":[{"query_string":"* marked:'Minimum price'","touches":[{"x":50,"y":50,"offset_x":0,"offset_y":0,"wait":0.0,"time":0.2,"release":true,"query_string":null}]}]}
06-05 23:00:59.781 I/System.out(13397): }
06-05 23:00:59.786 W/ResourceType(13397): No package identifier when getting name for resource number 0x00000001
06-05 23:01:00.018 I/ActivityManager( 1631): START u0 {cmp=com.evancharlton.mileage/.charts.MinimumPriceChart (has extras)} from uid 10326 on display 0
06-05 23:01:00.019 V/PhoneStatusBar( 1712): setLightsOn(true)
06-05 23:01:00.020 V/PhoneStatusBar( 1712): setLightsOn(true)
06-05 23:01:00.034 I/System.out(13397): URI: //map
06-05 23:01:00.034 I/System.out(13397): params: {json={"query":"* {text CONTAINS[c] 'Least expensive fuel'}","operation":{"method_name":"query","arguments":[]}}
06-05 23:01:00.034 I/System.out(13397): }
06-05 23:01:00.112 I/calabash(13397): newActivity1
06-05 23:01:00.117 W/aiCharts(13397): License file is invalid or missing. 
06-05 23:01:00.117 W/aiCharts(13397): Please place proper license.lic to /assets folder.
06-05 23:01:00.134 V/PhoneStatusBar( 1712): setLightsOn(true)
06-05 23:01:00.167 V/PhoneStatusBar( 1712): setLightsOn(true)
06-05 23:01:00.173 I/WindowManager( 1631): Destroying surface Surface(name=Creating chart…) called by com.android.server.wm.WindowStateAnimator.destroySurface:2016 com.android.server.wm.WindowStateAnimator.destroySurfaceLocked:882 com.android.server.wm.WindowState.removeLocked:1456 com.android.server.wm.WindowManagerService.removeWindowInnerLocked:2484 com.android.server.wm.WindowManagerService.removeWindowLocked:2442 com.android.server.wm.WindowManagerService.removeWindowLocked:2311 com.android.server.wm.WindowManagerService.removeWindow:2306 com.android.server.wm.Session.remove:202 
06-05 23:01:00.175 D/gralloc_ranchu( 1347): gralloc_alloc: Creating ashmem region of size 9023488
06-05 23:01:00.183 V/PhoneStatusBar( 1712): setLightsOn(true)
06-05 23:01:00.207 I/ActivityManager( 1631): Displayed com.evancharlton.mileage/.charts.MinimumPriceChart: +98ms
06-05 23:01:00.217 V/PhoneStatusBar( 1712): setLightsOn(true)
06-05 23:01:00.250 V/PhoneStatusBar( 1712): setLightsOn(true)
06-05 23:01:00.267 V/PhoneStatusBar( 1712): setLightsOn(true)
06-05 23:01:00.452 V/PhoneStatusBar( 1712): setLightsOn(true)
06-05 23:01:00.454 I/System.out(13397): URI: //map
06-05 23:01:00.455 I/System.out(13397): params: {json={"query":"* {text CONTAINS[c] 'Least expensive fuel'}","operation":{"method_name":"query","arguments":[]}}
06-05 23:01:00.455 I/System.out(13397): }
06-05 23:01:00.520 I/System.out(13397): URI: //
06-05 23:01:00.520 I/System.out(13397): params: {json={"command":"press_key","arguments":["KEYCODE_BACK"]}
06-05 23:01:00.520 I/System.out(13397): }
06-05 23:01:00.520 I/System.out(13397): header: {content-type=application/json;charset=utf-8, date=Sat, 06 Jun 2020 04:01:00 GMT, accept=*/*, host=127.0.0.1:34777, content-length=52, user-agent=HTTPClient/1.0 (2.8.3, ruby 2.5.1 (2018-03-29))}
06-05 23:01:00.520 I/System.out(13397): params: {json={"command":"press_key","arguments":["KEYCODE_BACK"]}
06-05 23:01:00.520 I/System.out(13397): }
06-05 23:01:00.520 I/System.out(13397): ProP json = {"command":"press_key","arguments":["KEYCODE_BACK"]}
06-05 23:01:00.520 I/System.out(13397): files: {}
06-05 23:01:00.520 I/System.out(13397): command: {"command":"press_key","arguments":["KEYCODE_BACK"]}
06-05 23:01:00.524 I/InstrumentationBackend(13397): Got command:'Command:'Line:null,press_key', arguments:'[KEYCODE_BACK]'
06-05 23:01:00.534 V/PhoneStatusBar( 1712): setLightsOn(true)
06-05 23:01:00.542 V/PhoneStatusBar( 1712): setLightsOn(true)
06-05 23:01:00.549 I/art     (13397): Do partial code cache collection, code=60KB, data=62KB
06-05 23:01:00.550 I/art     (13397): After code cache collection, code=59KB, data=61KB
06-05 23:01:00.550 I/art     (13397): Increasing code cache capacity to 256KB
06-05 23:01:00.556 V/PhoneStatusBar( 1712): setLightsOn(true)
06-05 23:01:00.560 I/System.out(13397): result:{"bonusInformation":[],"message":"","success":true}
06-05 23:01:00.561 D/VehicleStatisticsActivity(13397): Checking recalculation ...
06-05 23:01:00.564 D/VehicleStatisticsActivity(13397): Recalculation not necessary.
06-05 23:01:00.570 I/System.out(13397): URI: //map
06-05 23:01:00.570 I/System.out(13397): params: {json={"query":"* {text CONTAINS[c] 'Statistics'}","operation":{"method_name":"query","arguments":[]}}
06-05 23:01:00.570 I/System.out(13397): }
06-05 23:01:00.584 V/PhoneStatusBar( 1712): setLightsOn(true)
06-05 23:01:00.591 D/gralloc_ranchu( 1347): gralloc_alloc: Creating ashmem region of size 9023488
06-05 23:01:00.635 V/PhoneStatusBar( 1712): setLightsOn(true)
