--------- beginning of main
06-06 17:45:27.415 D/gralloc_ranchu( 1348): gralloc_alloc: Creating ashmem region of size 3145728
06-06 17:45:27.419 E/EGL_emulation( 1348): tid 1348: eglCreateSyncKHR(1901): error 0x3004 (EGL_BAD_ATTRIBUTE)
--------- beginning of system
06-06 17:45:27.429 W/ActivityManager( 1631): Finishing task with all activities already finished
06-06 17:45:27.429 W/ActivityManager( 1631): Duplicate finish request for ActivityRecord{290809c u0 com.evancharlton.mileage/.Mileage t24712 f}
06-06 17:45:27.429 W/ActivityManager( 1631): Finishing task with all activities already finished
06-06 17:45:27.429 W/ActivityManager( 1631): Duplicate finish request for ActivityRecord{290809c u0 com.evancharlton.mileage/.Mileage t24712 f}
06-06 17:45:27.430 W/ActivityManager( 1631): Finishing task with all activities already finished
06-06 17:45:27.430 W/ActivityManager( 1631): Duplicate finish request for ActivityRecord{290809c u0 com.evancharlton.mileage/.Mileage t24712 f}
06-06 17:45:27.430 W/ActivityManager( 1631): Finishing task with all activities already finished
06-06 17:45:27.430 W/ActivityManager( 1631): Duplicate finish request for ActivityRecord{290809c u0 com.evancharlton.mileage/.Mileage t24712 f}
06-06 17:45:27.430 W/ActivityManager( 1631): Finishing task with all activities already finished
06-06 17:45:27.430 W/ActivityManager( 1631): Duplicate finish request for ActivityRecord{290809c u0 com.evancharlton.mileage/.Mileage t24712 f}
06-06 17:45:27.430 W/ActivityManager( 1631): Finishing task with all activities already finished
06-06 17:45:27.430 W/ActivityManager( 1631): Duplicate finish request for ActivityRecord{a3251a6 u0 com.evancharlton.mileage/.charts.MaximumVolumeChart t24712 f}
06-06 17:45:27.430 W/ActivityManager( 1631): Finishing task with all activities already finished
06-06 17:45:27.430 W/ActivityManager( 1631): Duplicate finish request for ActivityRecord{a3251a6 u0 com.evancharlton.mileage/.charts.MaximumVolumeChart t24712 f}
06-06 17:45:27.430 W/ActivityManager( 1631): Finishing task with all activities already finished
06-06 17:45:27.430 W/ActivityManager( 1631): Duplicate finish request for ActivityRecord{290809c u0 com.evancharlton.mileage/.Mileage t24712 f}
06-06 17:45:27.430 W/ActivityManager( 1631): Finishing task with all activities already finished
06-06 17:45:27.430 W/ActivityManager( 1631): Duplicate finish request for ActivityRecord{290809c u0 com.evancharlton.mileage/.Mileage t24712 f}
06-06 17:45:27.449 D/EGL_emulation( 2106): eglMakeCurrent: 0xa6a85300: ver 2 0 (tinfo 0xa6a83220)
06-06 17:45:27.483 D/EGL_emulation( 1713): eglMakeCurrent: 0xa6a85780: ver 2 0 (tinfo 0xa6a83640)
06-06 17:45:27.498 D/EGL_emulation( 1713): eglMakeCurrent: 0xa6a85780: ver 2 0 (tinfo 0xa6a83640)
06-06 17:45:27.500 D/EGL_emulation( 1713): eglMakeCurrent: 0xa6a85780: ver 2 0 (tinfo 0xa6a83640)
06-06 17:45:27.515 D/EGL_emulation( 1713): eglMakeCurrent: 0xa6a85780: ver 2 0 (tinfo 0xa6a83640)
06-06 17:45:27.517 D/EGL_emulation( 1713): eglMakeCurrent: 0xa6a85780: ver 2 0 (tinfo 0xa6a83640)
06-06 17:45:27.532 D/EGL_emulation( 1713): eglMakeCurrent: 0xa6a85780: ver 2 0 (tinfo 0xa6a83640)
06-06 17:45:27.534 D/EGL_emulation( 1713): eglMakeCurrent: 0xa6a85780: ver 2 0 (tinfo 0xa6a83640)
06-06 17:45:27.548 D/EGL_emulation( 1713): eglMakeCurrent: 0xa6a85780: ver 2 0 (tinfo 0xa6a83640)
06-06 17:45:27.550 D/EGL_emulation( 1713): eglMakeCurrent: 0xa6a85780: ver 2 0 (tinfo 0xa6a83640)
06-06 17:45:27.565 D/EGL_emulation( 1713): eglMakeCurrent: 0xa6a85780: ver 2 0 (tinfo 0xa6a83640)
06-06 17:45:27.571 D/EGL_emulation( 1713): eglMakeCurrent: 0xa6a85780: ver 2 0 (tinfo 0xa6a83640)
06-06 17:45:27.582 D/EGL_emulation( 1713): eglMakeCurrent: 0xa6a85780: ver 2 0 (tinfo 0xa6a83640)
06-06 17:45:27.584 D/EGL_emulation( 1713): eglMakeCurrent: 0xa6a85780: ver 2 0 (tinfo 0xa6a83640)
06-06 17:45:27.599 D/EGL_emulation( 1713): eglMakeCurrent: 0xa6a85780: ver 2 0 (tinfo 0xa6a83640)
06-06 17:45:27.601 D/EGL_emulation( 1713): eglMakeCurrent: 0xa6a85780: ver 2 0 (tinfo 0xa6a83640)
06-06 17:45:27.601 D/AndroidRuntime(17011): >>>>>> START com.android.internal.os.RuntimeInit uid 2000 <<<<<<
06-06 17:45:27.602 D/AndroidRuntime(17011): CheckJNI is ON
06-06 17:45:27.615 D/EGL_emulation( 1713): eglMakeCurrent: 0xa6a85780: ver 2 0 (tinfo 0xa6a83640)
06-06 17:45:27.616 W/art     (17011): Unexpected CPU variant for X86 using defaults: x86
06-06 17:45:27.618 D/EGL_emulation( 1713): eglMakeCurrent: 0xa6a85780: ver 2 0 (tinfo 0xa6a83640)
06-06 17:45:27.618 D/ICU     (17011): No timezone override file found: /data/misc/zoneinfo/current/icu/icu_tzdata.dat
06-06 17:45:27.626 E/memtrack(17011): Couldn't load memtrack module (No such file or directory)
06-06 17:45:27.627 E/android.os.Debug(17011): failed to load memtrack module: -2
06-06 17:45:27.627 I/Radio-JNI(17011): register_android_hardware_Radio DONE
06-06 17:45:27.632 D/EGL_emulation( 1713): eglMakeCurrent: 0xa6a85780: ver 2 0 (tinfo 0xa6a83640)
06-06 17:45:27.632 D/AndroidRuntime(17011): Calling main entry com.android.commands.am.Am
06-06 17:45:27.633 D/EGL_emulation( 1713): eglMakeCurrent: 0xa6a85780: ver 2 0 (tinfo 0xa6a83640)
06-06 17:45:27.634 I/ActivityManager( 1631): Force stopping com.evancharlton.mileage appid=10728 user=0: start instr
06-06 17:45:27.634 I/ActivityManager( 1631): Killing 16960:com.evancharlton.mileage/u0a728 (adj 0): stop com.evancharlton.mileage
06-06 17:45:27.634 D/ActivityManager( 1631): cleanUpApplicationRecord -- 16960
06-06 17:45:27.634 I/WindowManager( 1631): Destroying surface Surface(name=com.evancharlton.mileage/com.evancharlton.mileage.charts.MaximumVolumeChart) called by com.android.server.wm.WindowStateAnimator.destroySurface:2016 com.android.server.wm.WindowStateAnimator.destroySurfaceLocked:882 com.android.server.wm.WindowState.removeLocked:1456 com.android.server.wm.WindowManagerService.removeWindowInnerLocked:2484 com.android.server.wm.WindowManagerService.removeWindowLocked:2442 com.android.server.wm.WindowManagerService.removeWindowLocked:2311 com.android.server.wm.AppWindowToken.removeAllWindows:530 com.android.server.wm.AppWindowToken.removeAppFromTaskLocked:326 
06-06 17:45:27.636 W/ActivityManager( 1631): Crash of app com.evancharlton.mileage running instrumentation ComponentInfo{com.evancharlton.mileage.test/sh.calaba.instrumentationbackend.CalabashInstrumentationTestRunner}
06-06 17:45:27.636 I/ActivityManager( 1631): Force stopping com.evancharlton.mileage appid=10728 user=0: finished inst
06-06 17:45:27.639 I/art     (17021): Not late-enabling -Xcheck:jni (already on)
06-06 17:45:27.639 W/art     (17021): Unexpected CPU variant for X86 using defaults: x86
06-06 17:45:27.647 I/ActivityManager( 1631): Start proc 17021:com.evancharlton.mileage/u0a728 for added application com.evancharlton.mileage
06-06 17:45:27.647 D/AndroidRuntime(17011): Shutting down VM
06-06 17:45:27.648 D/EGL_emulation( 1713): eglMakeCurrent: 0xa6a85780: ver 2 0 (tinfo 0xa6a83640)
06-06 17:45:27.650 D/EGL_emulation( 1713): eglMakeCurrent: 0xa6a85780: ver 2 0 (tinfo 0xa6a83640)
06-06 17:45:27.653 W/System  (17021): ClassLoader referenced unknown path: /data/app/com.evancharlton.mileage.test-1/lib/x86
06-06 17:45:27.653 W/System  (17021): ClassLoader referenced unknown path: /data/app/com.evancharlton.mileage-1/lib/x86
06-06 17:45:27.655 W/System  (17021): ClassLoader referenced unknown path: 
06-06 17:45:27.659 I/System.out(17021): Main activity name automatically set to: com.evancharlton.mileage.Mileage
06-06 17:45:27.659 I/System.out(17021): Calabash did not load Mono. This is only a problem if you are trying to test a Mono application
06-06 17:45:27.659 I/calabash(17021): Test server port: 7102
06-06 17:45:27.660 I/InstrumentationBackend(17021): Added:'GetPreferences', with key:'get_preferences'
06-06 17:45:27.665 I/InstrumentationBackend(17021): Added:'SetPreferences', with key:'set_preferences'
06-06 17:45:27.665 I/InstrumentationBackend(17021): Added:'ClearPreferences', with key:'clear_preferences'
06-06 17:45:27.665 I/InstrumentationBackend(17021): Added:'PressElement', with key:'press_l10n_element'
06-06 17:45:27.665 I/InstrumentationBackend(17021): Added:'WaitForElement', with key:'wait_for_l10n_element'
06-06 17:45:27.665 I/InstrumentationBackend(17021): Added:'NullAction', with key:'nullAction'
06-06 17:45:27.665 D/EGL_emulation( 1713): eglMakeCurrent: 0xa6a85780: ver 2 0 (tinfo 0xa6a83640)
06-06 17:45:27.665 I/InstrumentationBackend(17021): Added:'PressKey', with key:'press_key'
06-06 17:45:27.665 I/InstrumentationBackend(17021): Added:'SetActivityOrientation', with key:'set_activity_orientation'
06-06 17:45:27.665 I/InstrumentationBackend(17021): Added:'GetActivityOrientation', with key:'get_activity_orientation'
06-06 17:45:27.665 I/InstrumentationBackend(17021): Added:'FakeGPSLocation', with key:'set_gps_coordinates'
06-06 17:45:27.665 I/InstrumentationBackend(17021): Added:'SetPropertyByCssSelector', with key:'set_property_by_css_selector'
06-06 17:45:27.666 I/InstrumentationBackend(17021): Added:'GetUrl', with key:'get_url'
06-06 17:45:27.666 I/InstrumentationBackend(17021): Added:'ScrollTo', with key:'scroll_to'
06-06 17:45:27.666 I/InstrumentationBackend(17021): Added:'GetLoadProgress', with key:'get_load_progress'
06-06 17:45:27.666 I/InstrumentationBackend(17021): Added:'DumpHtml', with key:'dump_html'
06-06 17:45:27.666 I/InstrumentationBackend(17021): Added:'DumpBodyHtml', with key:'dump_body_html'
06-06 17:45:27.666 I/InstrumentationBackend(17021): Added:'EnterTextByCssSelector', with key:'enter_text_by_selector'
06-06 17:45:27.666 D/EGL_emulation( 1713): eglMakeCurrent: 0xa6a85780: ver 2 0 (tinfo 0xa6a83640)
06-06 17:45:27.667 I/InstrumentationBackend(17021): Added:'AndroidSDKVersion', with key:'android_sdk_version'
06-06 17:45:27.667 I/InstrumentationBackend(17021): Added:'Version', with key:'version'
06-06 17:45:27.667 I/InstrumentationBackend(17021): Added:'Drag', with key:'drag'
06-06 17:45:27.667 I/InstrumentationBackend(17021): Added:'TouchCoordinates', with key:'touch_coordinate'
06-06 17:45:27.667 I/InstrumentationBackend(17021): Added:'LongPressCoordinate', with key:'long_press_coordinate'
06-06 17:45:27.667 I/InstrumentationBackend(17021): Added:'DragCoordinates', with key:'drag_coordinates'
06-06 17:45:27.667 I/InstrumentationBackend(17021): Added:'ResumeApplication', with key:'resume_application'
06-06 17:45:27.667 I/InstrumentationBackend(17021): Added:'Swipe', with key:'swipe'
06-06 17:45:27.667 I/InstrumentationBackend(17021): Added:'DoubleTapCoordinate', with key:'double_tap_coordinate'
06-06 17:45:27.667 I/InstrumentationBackend(17021): Added:'ClickOnScreen', with key:'click_on_screen'
06-06 17:45:27.667 I/InstrumentationBackend(17021): Added:'GetActivityName', with key:'get_activity_name'
06-06 17:45:27.667 I/InstrumentationBackend(17021): Added:'ScrollToView', with key:'scroll_to_view'
06-06 17:45:27.667 I/InstrumentationBackend(17021): Added:'ViewConfiguration', with key:'view_configuration'
06-06 17:45:27.667 I/InstrumentationBackend(17021): Added:'IsCurrentActivityFocused', with key:'is_current_activity_focused'
06-06 17:45:27.667 I/InstrumentationBackend(17021): Added:'SendTcp', with key:'send_tcp'
06-06 17:45:27.667 I/InstrumentationBackend(17021): Added:'DpToDevicePixel', with key:'dp_to_device_pixel'
06-06 17:45:27.667 I/InstrumentationBackend(17021): Added:'KeyboardEnterText', with key:'keyboard_enter_text'
06-06 17:45:27.667 I/InstrumentationBackend(17021): Added:'DeleteSurroundingText', with key:'delete_surrounding_text'
06-06 17:45:27.667 I/InstrumentationBackend(17021): Added:'SetComposingRegion', with key:'set_composing_region'
06-06 17:45:27.667 I/InstrumentationBackend(17021): Added:'SetSelection', with key:'set_selection'
06-06 17:45:27.667 I/InstrumentationBackend(17021): Added:'KeyboardKeyEvent', with key:'keyboard_key_event'
06-06 17:45:27.667 I/InstrumentationBackend(17021): Added:'PressUserActionButton', with key:'press_user_action_button'
06-06 17:45:27.667 I/InstrumentationBackend(17021): Added:'HideSoftKeyboard', with key:'hide_soft_keyboard'
06-06 17:45:27.667 I/InstrumentationBackend(17021): Added:'ListActions', with key:'list_actions'
06-06 17:45:27.668 I/calabash(17021): Instantiating http server at 7102
06-06 17:45:27.668 I/System.out(17021): HTTP Daemon listening on: 7102
06-06 17:45:27.678 W/InputDispatcher( 1631): channel 'c53f2f7 com.evancharlton.mileage/com.evancharlton.mileage.Mileage (server)' ~ Consumer closed input channel or an error occurred.  events=0x9
06-06 17:45:27.678 E/InputDispatcher( 1631): channel 'c53f2f7 com.evancharlton.mileage/com.evancharlton.mileage.Mileage (server)' ~ Channel is unrecoverably broken and will be disposed!
06-06 17:45:27.678 I/WindowManager( 1631): WIN DEATH: Window{c53f2f7 u0 com.evancharlton.mileage/com.evancharlton.mileage.Mileage EXITING}
06-06 17:45:27.678 W/InputDispatcher( 1631): Attempted to unregister already unregistered input channel 'c53f2f7 com.evancharlton.mileage/com.evancharlton.mileage.Mileage (server)'
06-06 17:45:27.691 D/EGL_emulation( 1713): eglMakeCurrent: 0xa6a85780: ver 2 0 (tinfo 0xa6a83640)
06-06 17:45:27.758 I/System.out(17021): URI: //ping
06-06 17:45:27.758 I/System.out(17021): params: {json={}
06-06 17:45:27.758 I/System.out(17021): }
06-06 17:45:27.761 I/System.out(17021): URI: //ping
06-06 17:45:27.761 I/System.out(17021): params: {json={}
06-06 17:45:27.761 I/System.out(17021): }
06-06 17:45:27.763 I/System.out(17021): URI: //ready
06-06 17:45:27.763 I/System.out(17021): params: {json={}
06-06 17:45:27.763 I/System.out(17021): }
06-06 17:45:27.765 I/System.out(17021): URI: //
06-06 17:45:27.765 I/System.out(17021): params: {json={"command":"version","arguments":[]}
06-06 17:45:27.765 I/System.out(17021): }
06-06 17:45:27.765 I/System.out(17021): header: {content-type=application/json;charset=utf-8, date=Sat, 06 Jun 2020 22:45:28 GMT, accept=*/*, host=127.0.0.1:34784, content-length=36, user-agent=HTTPClient/1.0 (2.8.3, ruby 2.5.1 (2018-03-29))}
06-06 17:45:27.765 I/System.out(17021): params: {json={"command":"version","arguments":[]}
06-06 17:45:27.765 I/System.out(17021): }
06-06 17:45:27.765 I/System.out(17021): ProP json = {"command":"version","arguments":[]}
06-06 17:45:27.765 I/System.out(17021): files: {}
06-06 17:45:27.766 I/System.out(17021): command: {"command":"version","arguments":[]}
06-06 17:45:27.768 I/InstrumentationBackend(17021): Got command:'Command:'Line:null,version', arguments:'[]'
06-06 17:45:27.773 I/System.out(17021): result:{"bonusInformation":[],"message":"0.9.8","success":true}
06-06 17:45:27.776 I/System.out(17021): URI: //start-application
06-06 17:45:27.776 I/System.out(17021): params: {json={"intent":null}
06-06 17:45:27.776 I/System.out(17021): }
06-06 17:45:27.783 I/ActivityManager( 1631): START u0 {act=android.intent.action.MAIN cat=[android.intent.category.LAUNCHER] flg=0x10200000 cmp=com.evancharlton.mileage/.Mileage} from uid 10728 on display 0
06-06 17:45:27.790 I/calabash(17021): newActivity1
06-06 17:45:27.798 I/calabash(17021): newActivity1
06-06 17:45:27.799 W/ActivityManager( 1631): Bad activity token: android.os.BinderProxy@5be3763
06-06 17:45:27.799 W/ActivityManager( 1631): java.lang.ClassCastException: android.os.BinderProxy cannot be cast to com.android.server.am.ActivityRecord$Token
06-06 17:45:27.799 W/ActivityManager( 1631): 	at com.android.server.am.ActivityRecord.forTokenLocked(ActivityRecord.java:586)
06-06 17:45:27.799 W/ActivityManager( 1631): 	at com.android.server.am.ActivityRecord.isInStackLocked(ActivityRecord.java:1327)
06-06 17:45:27.799 W/ActivityManager( 1631): 	at com.android.server.am.ActivityRecord.getStackLocked(ActivityRecord.java:1332)
06-06 17:45:27.799 W/ActivityManager( 1631): 	at com.android.server.am.ActivityManagerService.getActivityDisplayId(ActivityManagerService.java:9806)
06-06 17:45:27.799 W/ActivityManager( 1631): 	at android.app.ActivityManagerNative.onTransact(ActivityManagerNative.java:2566)
06-06 17:45:27.799 W/ActivityManager( 1631): 	at com.android.server.am.ActivityManagerService.onTransact(ActivityManagerService.java:2757)
06-06 17:45:27.799 W/ActivityManager( 1631): 	at android.os.Binder.execTransact(Binder.java:565)
06-06 17:45:27.800 W/ActivityManager( 1631): Bad activity token: android.os.BinderProxy@5be3763
06-06 17:45:27.800 W/ActivityManager( 1631): java.lang.ClassCastException: android.os.BinderProxy cannot be cast to com.android.server.am.ActivityRecord$Token
06-06 17:45:27.800 W/ActivityManager( 1631): 	at com.android.server.am.ActivityRecord.forTokenLocked(ActivityRecord.java:586)
06-06 17:45:27.800 W/ActivityManager( 1631): 	at com.android.server.am.ActivityRecord.isInStackLocked(ActivityRecord.java:1327)
06-06 17:45:27.800 W/ActivityManager( 1631): 	at com.android.server.am.ActivityManagerService.setTaskDescription(ActivityManagerService.java:9358)
06-06 17:45:27.800 W/ActivityManager( 1631): 	at android.app.ActivityManagerNative.onTransact(ActivityManagerNative.java:2639)
06-06 17:45:27.800 W/ActivityManager( 1631): 	at com.android.server.am.ActivityManagerService.onTransact(ActivityManagerService.java:2757)
06-06 17:45:27.800 W/ActivityManager( 1631): 	at android.os.Binder.execTransact(Binder.java:565)
06-06 17:45:27.801 W/ActivityManager( 1631): Bad activity token: android.os.BinderProxy@5be3763
06-06 17:45:27.801 W/ActivityManager( 1631): java.lang.ClassCastException: android.os.BinderProxy cannot be cast to com.android.server.am.ActivityRecord$Token
06-06 17:45:27.801 W/ActivityManager( 1631): 	at com.android.server.am.ActivityRecord.forTokenLocked(ActivityRecord.java:586)
06-06 17:45:27.801 W/ActivityManager( 1631): 	at com.android.server.am.ActivityRecord.isInStackLocked(ActivityRecord.java:1327)
06-06 17:45:27.801 W/ActivityManager( 1631): 	at com.android.server.am.ActivityRecord.getStackLocked(ActivityRecord.java:1332)
06-06 17:45:27.801 W/ActivityManager( 1631): 	at com.android.server.am.ActivityManagerService.getActivityStackId(ActivityManagerService.java:9817)
06-06 17:45:27.801 W/ActivityManager( 1631): 	at android.app.ActivityManagerNative.onTransact(ActivityManagerNative.java:2856)
06-06 17:45:27.801 W/ActivityManager( 1631): 	at com.android.server.am.ActivityManagerService.onTransact(ActivityManagerService.java:2757)
06-06 17:45:27.801 W/ActivityManager( 1631): 	at android.os.Binder.execTransact(Binder.java:565)
06-06 17:45:27.815 D/gralloc_ranchu( 1348): gralloc_alloc: Creating ashmem region of size 9023488
06-06 17:45:27.818 W/ActivityManager( 1631): Bad activity token: android.os.BinderProxy@5be3763
06-06 17:45:27.818 W/ActivityManager( 1631): java.lang.ClassCastException: android.os.BinderProxy cannot be cast to com.android.server.am.ActivityRecord$Token
06-06 17:45:27.818 W/ActivityManager( 1631): 	at com.android.server.am.ActivityRecord.forTokenLocked(ActivityRecord.java:586)
06-06 17:45:27.818 W/ActivityManager( 1631): 	at com.android.server.am.ActivityRecord.isInStackLocked(ActivityRecord.java:1327)
06-06 17:45:27.818 W/ActivityManager( 1631): 	at com.android.server.am.ActivityManagerService.getActivityOptions(ActivityManagerService.java:12559)
06-06 17:45:27.818 W/ActivityManager( 1631): 	at android.app.ActivityManagerNative.onTransact(ActivityManagerNative.java:1933)
06-06 17:45:27.818 W/ActivityManager( 1631): 	at com.android.server.am.ActivityManagerService.onTransact(ActivityManagerService.java:2757)
06-06 17:45:27.818 W/ActivityManager( 1631): 	at android.os.Binder.execTransact(Binder.java:565)
06-06 17:45:27.818 W/ActivityManager( 1631): Bad activity token: android.os.BinderProxy@5be3763
06-06 17:45:27.818 W/ActivityManager( 1631): java.lang.ClassCastException: android.os.BinderProxy cannot be cast to com.android.server.am.ActivityRecord$Token
06-06 17:45:27.818 W/ActivityManager( 1631): 	at com.android.server.am.ActivityRecord.forTokenLocked(ActivityRecord.java:586)
06-06 17:45:27.818 W/ActivityManager( 1631): 	at com.android.server.am.ActivityRecord.isInStackLocked(ActivityRecord.java:1327)
06-06 17:45:27.818 W/ActivityManager( 1631): 	at com.android.server.am.ActivityManagerService.getActivityOptions(ActivityManagerService.java:12559)
06-06 17:45:27.818 W/ActivityManager( 1631): 	at android.app.ActivityManagerNative.onTransact(ActivityManagerNative.java:1933)
06-06 17:45:27.818 W/ActivityManager( 1631): 	at com.android.server.am.ActivityManagerService.onTransact(ActivityManagerService.java:2757)
06-06 17:45:27.818 W/ActivityManager( 1631): 	at android.os.Binder.execTransact(Binder.java:565)
06-06 17:45:27.839 V/PhoneStatusBar( 1713): setLightsOn(true)
06-06 17:45:27.848 D/EGL_emulation( 1713): eglMakeCurrent: 0xa6a85780: ver 2 0 (tinfo 0xa6a83640)
06-06 17:45:27.848 V/PhoneStatusBar( 1713): setLightsOn(true)
06-06 17:45:27.850 V/PhoneStatusBar( 1713): setLightsOn(true)
06-06 17:45:27.851 D/gralloc_ranchu( 1348): gralloc_alloc: Creating ashmem region of size 9023488
06-06 17:45:27.853 V/PhoneStatusBar( 1713): setLightsOn(true)
06-06 17:45:27.856 D/        (17021): HostConnection::get() New Host Connection established 0x954b54c0, tid 17021
06-06 17:45:27.881 I/WindowManager( 1631): Destroying surface Surface(name=com.evancharlton.mileage/com.evancharlton.mileage.Mileage) called by com.android.server.wm.WindowStateAnimator.destroySurface:2016 com.android.server.wm.WindowStateAnimator.destroySurfaceLocked:882 com.android.server.wm.WindowState.removeLocked:1456 com.android.server.wm.WindowManagerService.removeWindowInnerLocked:2484 com.android.server.wm.AppWindowToken.destroySurfaces:365 com.android.server.wm.WindowStateAnimator.finishExit:565 com.android.server.wm.AppWindowAnimator.stepAnimationLocked:427 com.android.server.wm.WindowAnimator.updateAppWindowsLocked:196 
06-06 17:45:27.888 D/EGL_emulation( 1713): eglMakeCurrent: 0xa6a85780: ver 2 0 (tinfo 0xa6a83640)
06-06 17:45:27.888 D/EGL_emulation( 2106): eglMakeCurrent: 0xa6a85300: ver 2 0 (tinfo 0xa6a83220)
06-06 17:45:27.891 D/EGL_emulation( 1713): eglMakeCurrent: 0xa6a85780: ver 2 0 (tinfo 0xa6a83640)
06-06 17:45:27.893 D/EGL_emulation( 1713): eglMakeCurrent: 0xa6a85780: ver 2 0 (tinfo 0xa6a83640)
06-06 17:45:27.894 D/EGL_emulation( 1713): eglMakeCurrent: 0xa6a85780: ver 2 0 (tinfo 0xa6a83640)
06-06 17:45:27.902 D/EGL_emulation( 1713): eglMakeCurrent: 0xa6a85780: ver 2 0 (tinfo 0xa6a83640)
06-06 17:45:27.904 D/EGL_emulation( 1713): eglMakeCurrent: 0xa6a85780: ver 2 0 (tinfo 0xa6a83640)
06-06 17:45:27.904 I/ActivityManager( 1631): Displayed com.evancharlton.mileage/.Mileage: +117ms
06-06 17:45:27.915 D/gralloc_ranchu( 1348): gralloc_alloc: Creating ashmem region of size 9023488
06-06 17:45:27.915 D/EGL_emulation( 1713): eglMakeCurrent: 0xa6a85780: ver 2 0 (tinfo 0xa6a83640)
06-06 17:45:27.927 D/EGL_emulation( 1713): eglMakeCurrent: 0xa6a85780: ver 2 0 (tinfo 0xa6a83640)
06-06 17:45:27.937 D/EGL_emulation( 1713): eglMakeCurrent: 0xa6a85780: ver 2 0 (tinfo 0xa6a83640)
06-06 17:45:27.940 D/EGL_emulation( 1713): eglMakeCurrent: 0xa6a85780: ver 2 0 (tinfo 0xa6a83640)
06-06 17:45:27.940 V/PhoneStatusBar( 1713): setLightsOn(true)
06-06 17:45:27.950 D/EGL_emulation( 1713): eglMakeCurrent: 0xa6a85780: ver 2 0 (tinfo 0xa6a83640)
06-06 17:45:27.952 D/EGL_emulation( 1713): eglMakeCurrent: 0xa6a85780: ver 2 0 (tinfo 0xa6a83640)
06-06 17:45:27.957 I/System.out(17021): URI: //map
06-06 17:45:27.957 I/System.out(17021): params: {json={"query":"* marked:'Statistics'","operation":{"method_name":"query","arguments":[]}}
06-06 17:45:27.957 I/System.out(17021): }
06-06 17:45:27.965 D/EGL_emulation( 1713): eglMakeCurrent: 0xa6a85780: ver 2 0 (tinfo 0xa6a83640)
06-06 17:45:27.966 D/EGL_emulation( 1713): eglMakeCurrent: 0xa6a85780: ver 2 0 (tinfo 0xa6a83640)
06-06 17:45:27.970 W/ResourceType(17021): No package identifier when getting name for resource number 0x00000001
06-06 17:45:27.981 D/EGL_emulation( 1713): eglMakeCurrent: 0xa6a85780: ver 2 0 (tinfo 0xa6a83640)
06-06 17:45:27.983 I/System.out(17021): URI: //gesture
06-06 17:45:27.983 I/System.out(17021): params: {json={"query_timeout":5.0,"gestures":[{"query_string":"* marked:'Statistics'","touches":[{"x":50,"y":50,"offset_x":0,"offset_y":0,"wait":0.0,"time":0.2,"release":true,"query_string":null}]}]}
06-06 17:45:27.983 I/System.out(17021): }
06-06 17:45:27.983 D/EGL_emulation( 1713): eglMakeCurrent: 0xa6a85780: ver 2 0 (tinfo 0xa6a83640)
06-06 17:45:27.988 W/ResourceType(17021): No package identifier when getting name for resource number 0x00000001
06-06 17:45:27.999 D/EGL_emulation( 1713): eglMakeCurrent: 0xa6a85780: ver 2 0 (tinfo 0xa6a83640)
06-06 17:45:28.006 D/EGL_emulation( 1713): eglMakeCurrent: 0xa6a85780: ver 2 0 (tinfo 0xa6a83640)
06-06 17:45:28.016 D/EGL_emulation( 1713): eglMakeCurrent: 0xa6a85780: ver 2 0 (tinfo 0xa6a83640)
06-06 17:45:28.020 D/EGL_emulation( 1713): eglMakeCurrent: 0xa6a85780: ver 2 0 (tinfo 0xa6a83640)
06-06 17:45:28.032 D/EGL_emulation( 1713): eglMakeCurrent: 0xa6a85780: ver 2 0 (tinfo 0xa6a83640)
06-06 17:45:28.033 D/EGL_emulation( 1713): eglMakeCurrent: 0xa6a85780: ver 2 0 (tinfo 0xa6a83640)
06-06 17:45:28.049 D/EGL_emulation( 1713): eglMakeCurrent: 0xa6a85780: ver 2 0 (tinfo 0xa6a83640)
06-06 17:45:28.050 D/EGL_emulation( 1713): eglMakeCurrent: 0xa6a85780: ver 2 0 (tinfo 0xa6a83640)
06-06 17:45:28.065 D/EGL_emulation( 1713): eglMakeCurrent: 0xa6a85780: ver 2 0 (tinfo 0xa6a83640)
06-06 17:45:28.067 D/EGL_emulation( 1713): eglMakeCurrent: 0xa6a85780: ver 2 0 (tinfo 0xa6a83640)
06-06 17:45:28.082 D/EGL_emulation( 1713): eglMakeCurrent: 0xa6a85780: ver 2 0 (tinfo 0xa6a83640)
06-06 17:45:28.098 I/WindowManager( 1631): Destroying surface Surface(name=Starting com.evancharlton.mileage) called by com.android.server.wm.WindowStateAnimator.destroySurface:2016 com.android.server.wm.WindowStateAnimator.destroySurfaceLocked:882 com.android.server.wm.WindowState.destroyOrSaveSurface:2100 com.android.server.wm.AppWindowToken.destroySurfaces:363 com.android.server.wm.WindowStateAnimator.finishExit:565 com.android.server.wm.WindowStateAnimator.stepAnimationLocked:491 com.android.server.wm.WindowAnimator.updateWindowsLocked:303 com.android.server.wm.WindowAnimator.animateLocked:704 
06-06 17:45:28.100 V/PhoneStatusBar( 1713): setLightsOn(true)
06-06 17:45:28.103 V/PhoneStatusBar( 1713): setLightsOn(true)
06-06 17:45:28.217 I/calabash(17021): newActivity1
06-06 17:45:28.226 I/System.out(17021): URI: //map
06-06 17:45:28.226 I/System.out(17021): params: {json={"query":"android.widget.ScrollView index:0","operation":{"method_name":"query","arguments":[]}}
06-06 17:45:28.226 I/System.out(17021): }
06-06 17:45:28.230 W/ActivityManager( 1631): Bad activity token: android.os.BinderProxy@5b56945
06-06 17:45:28.230 W/ActivityManager( 1631): java.lang.ClassCastException: android.os.BinderProxy cannot be cast to com.android.server.am.ActivityRecord$Token
06-06 17:45:28.230 W/ActivityManager( 1631): 	at com.android.server.am.ActivityRecord.forTokenLocked(ActivityRecord.java:586)
06-06 17:45:28.230 W/ActivityManager( 1631): 	at com.android.server.am.ActivityRecord.isInStackLocked(ActivityRecord.java:1327)
06-06 17:45:28.230 W/ActivityManager( 1631): 	at com.android.server.am.ActivityRecord.getStackLocked(ActivityRecord.java:1332)
06-06 17:45:28.230 W/ActivityManager( 1631): 	at com.android.server.am.ActivityManagerService.getActivityDisplayId(ActivityManagerService.java:9806)
06-06 17:45:28.230 W/ActivityManager( 1631): 	at android.app.ActivityManagerNative.onTransact(ActivityManagerNative.java:2566)
06-06 17:45:28.230 W/ActivityManager( 1631): 	at com.android.server.am.ActivityManagerService.onTransact(ActivityManagerService.java:2757)
06-06 17:45:28.230 W/ActivityManager( 1631): 	at android.os.Binder.execTransact(Binder.java:565)
06-06 17:45:28.231 W/ActivityManager( 1631): Bad activity token: android.os.BinderProxy@5b56945
06-06 17:45:28.231 W/ActivityManager( 1631): java.lang.ClassCastException: android.os.BinderProxy cannot be cast to com.android.server.am.ActivityRecord$Token
06-06 17:45:28.231 W/ActivityManager( 1631): 	at com.android.server.am.ActivityRecord.forTokenLocked(ActivityRecord.java:586)
06-06 17:45:28.231 W/ActivityManager( 1631): 	at com.android.server.am.ActivityRecord.isInStackLocked(ActivityRecord.java:1327)
06-06 17:45:28.231 W/ActivityManager( 1631): 	at com.android.server.am.ActivityManagerService.setTaskDescription(ActivityManagerService.java:9358)
06-06 17:45:28.231 W/ActivityManager( 1631): 	at android.app.ActivityManagerNative.onTransact(ActivityManagerNative.java:2639)
06-06 17:45:28.231 W/ActivityManager( 1631): 	at com.android.server.am.ActivityManagerService.onTransact(ActivityManagerService.java:2757)
06-06 17:45:28.231 W/ActivityManager( 1631): 	at android.os.Binder.execTransact(Binder.java:565)
06-06 17:45:28.231 W/ActivityManager( 1631): Bad activity token: android.os.BinderProxy@5b56945
06-06 17:45:28.231 W/ActivityManager( 1631): java.lang.ClassCastException: android.os.BinderProxy cannot be cast to com.android.server.am.ActivityRecord$Token
06-06 17:45:28.231 W/ActivityManager( 1631): 	at com.android.server.am.ActivityRecord.forTokenLocked(ActivityRecord.java:586)
06-06 17:45:28.231 W/ActivityManager( 1631): 	at com.android.server.am.ActivityRecord.isInStackLocked(ActivityRecord.java:1327)
06-06 17:45:28.231 W/ActivityManager( 1631): 	at com.android.server.am.ActivityRecord.getStackLocked(ActivityRecord.java:1332)
06-06 17:45:28.231 W/ActivityManager( 1631): 	at com.android.server.am.ActivityManagerService.getActivityStackId(ActivityManagerService.java:9817)
06-06 17:45:28.231 W/ActivityManager( 1631): 	at android.app.ActivityManagerNative.onTransact(ActivityManagerNative.java:2856)
06-06 17:45:28.231 W/ActivityManager( 1631): 	at com.android.server.am.ActivityManagerService.onTransact(ActivityManagerService.java:2757)
06-06 17:45:28.231 W/ActivityManager( 1631): 	at android.os.Binder.execTransact(Binder.java:565)
06-06 17:45:28.237 D/VehicleStatisticsActivity(17021): Checking recalculation ...
06-06 17:45:28.238 D/VehicleStatisticsActivity(17021): Recalculation not necessary.
06-06 17:45:28.239 W/ActivityManager( 1631): Bad activity token: android.os.BinderProxy@5b56945
06-06 17:45:28.239 W/ActivityManager( 1631): java.lang.ClassCastException: android.os.BinderProxy cannot be cast to com.android.server.am.ActivityRecord$Token
06-06 17:45:28.239 W/ActivityManager( 1631): 	at com.android.server.am.ActivityRecord.forTokenLocked(ActivityRecord.java:586)
06-06 17:45:28.239 W/ActivityManager( 1631): 	at com.android.server.am.ActivityRecord.isInStackLocked(ActivityRecord.java:1327)
06-06 17:45:28.239 W/ActivityManager( 1631): 	at com.android.server.am.ActivityManagerService.getActivityOptions(ActivityManagerService.java:12559)
06-06 17:45:28.239 W/ActivityManager( 1631): 	at android.app.ActivityManagerNative.onTransact(ActivityManagerNative.java:1933)
06-06 17:45:28.239 W/ActivityManager( 1631): 	at com.android.server.am.ActivityManagerService.onTransact(ActivityManagerService.java:2757)
06-06 17:45:28.239 W/ActivityManager( 1631): 	at android.os.Binder.execTransact(Binder.java:565)
06-06 17:45:28.239 W/ActivityManager( 1631): Bad activity token: android.os.BinderProxy@5b56945
06-06 17:45:28.239 W/ActivityManager( 1631): java.lang.ClassCastException: android.os.BinderProxy cannot be cast to com.android.server.am.ActivityRecord$Token
06-06 17:45:28.239 W/ActivityManager( 1631): 	at com.android.server.am.ActivityRecord.forTokenLocked(ActivityRecord.java:586)
06-06 17:45:28.239 W/ActivityManager( 1631): 	at com.android.server.am.ActivityRecord.isInStackLocked(ActivityRecord.java:1327)
06-06 17:45:28.239 W/ActivityManager( 1631): 	at com.android.server.am.ActivityManagerService.getActivityOptions(ActivityManagerService.java:12559)
06-06 17:45:28.239 W/ActivityManager( 1631): 	at android.app.ActivityManagerNative.onTransact(ActivityManagerNative.java:1933)
06-06 17:45:28.239 W/ActivityManager( 1631): 	at com.android.server.am.ActivityManagerService.onTransact(ActivityManagerService.java:2757)
06-06 17:45:28.239 W/ActivityManager( 1631): 	at android.os.Binder.execTransact(Binder.java:565)
06-06 17:45:28.240 D/VehicleStatisticsActivity(17021): Checking recalculation ...
06-06 17:45:28.241 D/VehicleStatisticsActivity(17021): Recalculation not necessary.
06-06 17:45:28.295 I/System.out(17021): URI: //map
06-06 17:45:28.295 I/System.out(17021): params: {json={"query":"android.widget.AbsListView index:0","operation":{"method_name":"query","arguments":[]}}
06-06 17:45:28.295 I/System.out(17021): }
06-06 17:45:28.299 V/PhoneStatusBar( 1713): setLightsOn(true)
06-06 17:45:28.300 I/art     (17021): Do partial code cache collection, code=30KB, data=29KB
06-06 17:45:28.300 I/art     (17021): After code cache collection, code=29KB, data=28KB
06-06 17:45:28.300 I/art     (17021): Increasing code cache capacity to 128KB
06-06 17:45:28.311 I/System.out(17021): URI: //map
06-06 17:45:28.311 I/System.out(17021): params: {json={"query":"android.widget.AbsListView index:0","operation":{"method_name":"query","arguments":[]}}
06-06 17:45:28.311 I/System.out(17021): }
06-06 17:45:28.328 I/System.out(17021): URI: //map
06-06 17:45:28.328 I/System.out(17021): params: {json={"query":"android.widget.AbsListView index:0","operation":{"method_name":"query","arguments":[]}}
06-06 17:45:28.328 I/System.out(17021): }
06-06 17:45:28.343 I/System.out(17021): URI: //map
06-06 17:45:28.343 I/System.out(17021): params: {json={"query":"android.widget.AbsListView index:0","operation":{"method_name":"query","arguments":["getFirstVisiblePosition"]}}
06-06 17:45:28.343 I/System.out(17021): }
06-06 17:45:28.356 I/System.out(17021): URI: //map
06-06 17:45:28.356 I/System.out(17021): params: {json={"query":"android.widget.AbsListView index:0","operation":{"method_name":"query","arguments":["getLastVisiblePosition"]}}
06-06 17:45:28.356 I/System.out(17021): }
06-06 17:45:28.369 I/System.out(17021): URI: //map
06-06 17:45:28.369 I/System.out(17021): params: {json={"query":"android.widget.AbsListView index:0","operation":{"method_name":"query","arguments":[{"method_name":"setSelection","arguments":[26]}]}}
06-06 17:45:28.369 I/System.out(17021): }
06-06 17:45:28.389 I/System.out(17021): URI: //map
06-06 17:45:28.389 I/System.out(17021): params: {json={"query":"* marked:'Average fillup'","operation":{"method_name":"query","arguments":[]}}
06-06 17:45:28.389 I/System.out(17021): }
06-06 17:45:28.462 W/ResourceType(17021): No package identifier when getting name for resource number 0x00000001
06-06 17:45:28.474 I/System.out(17021): URI: //gesture
06-06 17:45:28.474 I/System.out(17021): params: {json={"query_timeout":5.0,"gestures":[{"query_string":"* marked:'Average fillup'","touches":[{"x":50,"y":50,"offset_x":0,"offset_y":0,"wait":0.0,"time":0.2,"release":true,"query_string":null}]}]}
06-06 17:45:28.474 I/System.out(17021): }
06-06 17:45:28.478 W/ResourceType(17021): No package identifier when getting name for resource number 0x00000001
06-06 17:45:28.598 V/PhoneStatusBar( 1713): setLightsOn(true)
06-06 17:45:28.599 V/PhoneStatusBar( 1713): setLightsOn(true)
06-06 17:45:28.600 W/OpenGLRenderer( 2106): Incorrectly called buildLayer on View: ShortcutAndWidgetContainer, destroying layer...
06-06 17:45:28.624 I/WindowManager( 1631): Destroying surface Surface(name=com.android.launcher3/com.android.launcher3.Launcher) called by com.android.server.wm.WindowStateAnimator.destroySurface:2016 com.android.server.wm.WindowStateAnimator.destroySurfaceLocked:882 com.android.server.wm.WindowState.destroyOrSaveSurface:2100 com.android.server.wm.AppWindowToken.destroySurfaces:363 com.android.server.wm.AppWindowToken.notifyAppStopped:389 com.android.server.wm.WindowManagerService.notifyAppStopped:4463 com.android.server.am.ActivityStack.activityStoppedLocked:1252 com.android.server.am.ActivityManagerService.activityStopped:6903 
06-06 17:45:28.625 V/PhoneStatusBar( 1713): setLightsOn(true)
06-06 17:45:28.715 I/ActivityManager( 1631): START u0 {cmp=com.evancharlton.mileage/.charts.AverageVolumeChart (has extras)} from uid 10728 on display 0
06-06 17:45:28.716 V/PhoneStatusBar( 1713): setLightsOn(true)
06-06 17:45:28.717 V/PhoneStatusBar( 1713): setLightsOn(true)
06-06 17:45:28.726 I/System.out(17021): URI: //map
06-06 17:45:28.726 I/System.out(17021): params: {json={"query":"* {text CONTAINS[c] 'Average fillup size'}","operation":{"method_name":"query","arguments":[]}}
06-06 17:45:28.726 I/System.out(17021): }
06-06 17:45:28.774 I/calabash(17021): newActivity1
06-06 17:45:28.777 W/aiCharts(17021): License file is invalid or missing. 
06-06 17:45:28.777 W/aiCharts(17021): Please place proper license.lic to /assets folder.
06-06 17:45:28.789 V/PhoneStatusBar( 1713): setLightsOn(true)
06-06 17:45:28.815 V/PhoneStatusBar( 1713): setLightsOn(true)
06-06 17:45:28.819 I/WindowManager( 1631): Destroying surface Surface(name=Creating chart…) called by com.android.server.wm.WindowStateAnimator.destroySurface:2016 com.android.server.wm.WindowStateAnimator.destroySurfaceLocked:882 com.android.server.wm.WindowState.removeLocked:1456 com.android.server.wm.WindowManagerService.removeWindowInnerLocked:2484 com.android.server.wm.WindowManagerService.removeWindowLocked:2442 com.android.server.wm.WindowManagerService.removeWindowLocked:2311 com.android.server.wm.WindowManagerService.removeWindow:2306 com.android.server.wm.Session.remove:202 
06-06 17:45:28.821 D/gralloc_ranchu( 1348): gralloc_alloc: Creating ashmem region of size 9023488
06-06 17:45:28.831 V/PhoneStatusBar( 1713): setLightsOn(true)
06-06 17:45:28.843 I/ActivityManager( 1631): Displayed com.evancharlton.mileage/.charts.AverageVolumeChart: +70ms
06-06 17:45:28.848 V/PhoneStatusBar( 1713): setLightsOn(true)
06-06 17:45:28.882 V/PhoneStatusBar( 1713): setLightsOn(true)
06-06 17:45:28.899 V/PhoneStatusBar( 1713): setLightsOn(true)
06-06 17:45:29.082 V/PhoneStatusBar( 1713): setLightsOn(true)
06-06 17:45:29.103 I/System.out(17021): URI: //map
06-06 17:45:29.103 I/System.out(17021): params: {json={"query":"* {text CONTAINS[c] 'Average fillup size'}","operation":{"method_name":"query","arguments":[]}}
06-06 17:45:29.103 I/System.out(17021): }
06-06 17:45:29.123 I/System.out(17021): URI: //
06-06 17:45:29.123 I/System.out(17021): params: {json={"command":"press_key","arguments":["KEYCODE_BACK"]}
06-06 17:45:29.123 I/System.out(17021): }
06-06 17:45:29.123 I/System.out(17021): header: {content-type=application/json;charset=utf-8, date=Sat, 06 Jun 2020 22:45:29 GMT, accept=*/*, host=127.0.0.1:34784, content-length=52, user-agent=HTTPClient/1.0 (2.8.3, ruby 2.5.1 (2018-03-29))}
06-06 17:45:29.123 I/System.out(17021): params: {json={"command":"press_key","arguments":["KEYCODE_BACK"]}
06-06 17:45:29.123 I/System.out(17021): }
06-06 17:45:29.123 I/System.out(17021): ProP json = {"command":"press_key","arguments":["KEYCODE_BACK"]}
06-06 17:45:29.123 I/System.out(17021): files: {}
06-06 17:45:29.123 I/System.out(17021): command: {"command":"press_key","arguments":["KEYCODE_BACK"]}
06-06 17:45:29.124 I/InstrumentationBackend(17021): Got command:'Command:'Line:null,press_key', arguments:'[KEYCODE_BACK]'
06-06 17:45:29.127 V/PhoneStatusBar( 1713): setLightsOn(true)
06-06 17:45:29.129 V/PhoneStatusBar( 1713): setLightsOn(true)
06-06 17:45:29.130 I/art     (17021): Do partial code cache collection, code=60KB, data=62KB
06-06 17:45:29.130 I/art     (17021): After code cache collection, code=59KB, data=61KB
06-06 17:45:29.130 I/art     (17021): Increasing code cache capacity to 256KB
06-06 17:45:29.132 V/PhoneStatusBar( 1713): setLightsOn(true)
06-06 17:45:29.132 I/System.out(17021): result:{"bonusInformation":[],"message":"","success":true}
06-06 17:45:29.133 D/VehicleStatisticsActivity(17021): Checking recalculation ...
06-06 17:45:29.134 D/VehicleStatisticsActivity(17021): Recalculation not necessary.
06-06 17:45:29.137 I/System.out(17021): URI: //map
06-06 17:45:29.137 I/System.out(17021): params: {json={"query":"* {text CONTAINS[c] 'Statistics'}","operation":{"method_name":"query","arguments":[]}}
06-06 17:45:29.137 I/System.out(17021): }
06-06 17:45:29.165 D/gralloc_ranchu( 1348): gralloc_alloc: Creating ashmem region of size 9023488
06-06 17:45:29.166 V/PhoneStatusBar( 1713): setLightsOn(true)
06-06 17:45:29.181 V/PhoneStatusBar( 1713): setLightsOn(true)
06-06 17:45:29.215 V/PhoneStatusBar( 1713): setLightsOn(true)
