--------- beginning of main
06-05 23:01:08.584 V/PhoneStatusBar( 1712): setLightsOn(true)
06-05 23:01:08.587 D/gralloc_ranchu( 1347): gralloc_alloc: Creating ashmem region of size 3145728
06-05 23:01:08.592 E/EGL_emulation( 1347): tid 1347: eglCreateSyncKHR(1901): error 0x3004 (EGL_BAD_ATTRIBUTE)
--------- beginning of system
06-05 23:01:08.605 W/ActivityManager( 1631): Finishing task with all activities already finished
06-05 23:01:08.605 W/ActivityManager( 1631): Duplicate finish request for ActivityRecord{9a568b3 u0 com.evancharlton.mileage/.Mileage t9029 f}
06-05 23:01:08.606 W/ActivityManager( 1631): Finishing task with all activities already finished
06-05 23:01:08.606 W/ActivityManager( 1631): Duplicate finish request for ActivityRecord{9a568b3 u0 com.evancharlton.mileage/.Mileage t9029 f}
06-05 23:01:08.606 W/ActivityManager( 1631): Finishing task with all activities already finished
06-05 23:01:08.606 W/ActivityManager( 1631): Duplicate finish request for ActivityRecord{9a568b3 u0 com.evancharlton.mileage/.Mileage t9029 f}
06-05 23:01:08.606 W/ActivityManager( 1631): Finishing task with all activities already finished
06-05 23:01:08.606 W/ActivityManager( 1631): Duplicate finish request for ActivityRecord{9a568b3 u0 com.evancharlton.mileage/.Mileage t9029 f}
06-05 23:01:08.606 W/ActivityManager( 1631): Finishing task with all activities already finished
06-05 23:01:08.606 W/ActivityManager( 1631): Duplicate finish request for ActivityRecord{9a568b3 u0 com.evancharlton.mileage/.Mileage t9029 f}
06-05 23:01:08.606 W/ActivityManager( 1631): Finishing task with all activities already finished
06-05 23:01:08.606 W/ActivityManager( 1631): Duplicate finish request for ActivityRecord{5105cc9 u0 com.evancharlton.mileage/.charts.AverageVolumeChart t9029 f}
06-05 23:01:08.607 W/ActivityManager( 1631): Finishing task with all activities already finished
06-05 23:01:08.607 W/ActivityManager( 1631): Duplicate finish request for ActivityRecord{5105cc9 u0 com.evancharlton.mileage/.charts.AverageVolumeChart t9029 f}
06-05 23:01:08.607 W/ActivityManager( 1631): Finishing task with all activities already finished
06-05 23:01:08.607 W/ActivityManager( 1631): Duplicate finish request for ActivityRecord{9a568b3 u0 com.evancharlton.mileage/.Mileage t9029 f}
06-05 23:01:08.607 W/ActivityManager( 1631): Finishing task with all activities already finished
06-05 23:01:08.607 W/ActivityManager( 1631): Duplicate finish request for ActivityRecord{9a568b3 u0 com.evancharlton.mileage/.Mileage t9029 f}
06-05 23:01:08.651 D/EGL_emulation( 2076): eglMakeCurrent: 0xb0685360: ver 2 0 (tinfo 0xb06836b0)
06-05 23:01:08.652 D/EGL_emulation( 1712): eglMakeCurrent: 0xb0685360: ver 2 0 (tinfo 0xb06836c0)
06-05 23:01:08.667 D/EGL_emulation( 1712): eglMakeCurrent: 0xb0685360: ver 2 0 (tinfo 0xb06836c0)
06-05 23:01:08.684 D/EGL_emulation( 1712): eglMakeCurrent: 0xb0685360: ver 2 0 (tinfo 0xb06836c0)
06-05 23:01:08.700 D/EGL_emulation( 1712): eglMakeCurrent: 0xb0685360: ver 2 0 (tinfo 0xb06836c0)
06-05 23:01:08.702 D/EGL_emulation( 1712): eglMakeCurrent: 0xb0685360: ver 2 0 (tinfo 0xb06836c0)
06-05 23:01:08.708 D/AndroidRuntime(13696): >>>>>> START com.android.internal.os.RuntimeInit uid 2000 <<<<<<
06-05 23:01:08.709 D/AndroidRuntime(13696): CheckJNI is ON
06-05 23:01:08.717 D/EGL_emulation( 1712): eglMakeCurrent: 0xb0685360: ver 2 0 (tinfo 0xb06836c0)
06-05 23:01:08.719 D/EGL_emulation( 1712): eglMakeCurrent: 0xb0685360: ver 2 0 (tinfo 0xb06836c0)
06-05 23:01:08.721 W/art     (13696): Unexpected CPU variant for X86 using defaults: x86
06-05 23:01:08.723 D/ICU     (13696): No timezone override file found: /data/misc/zoneinfo/current/icu/icu_tzdata.dat
06-05 23:01:08.731 E/memtrack(13696): Couldn't load memtrack module (No such file or directory)
06-05 23:01:08.731 E/android.os.Debug(13696): failed to load memtrack module: -2
06-05 23:01:08.731 I/Radio-JNI(13696): register_android_hardware_Radio DONE
06-05 23:01:08.734 D/EGL_emulation( 1712): eglMakeCurrent: 0xb0685360: ver 2 0 (tinfo 0xb06836c0)
06-05 23:01:08.735 D/EGL_emulation( 1712): eglMakeCurrent: 0xb0685360: ver 2 0 (tinfo 0xb06836c0)
06-05 23:01:08.736 D/AndroidRuntime(13696): Calling main entry com.android.commands.am.Am
06-05 23:01:08.737 I/ActivityManager( 1631): Force stopping com.evancharlton.mileage appid=10326 user=0: start instr
06-05 23:01:08.737 I/ActivityManager( 1631): Killing 13644:com.evancharlton.mileage/u0a326 (adj 0): stop com.evancharlton.mileage
06-05 23:01:08.737 D/ActivityManager( 1631): cleanUpApplicationRecord -- 13644
06-05 23:01:08.738 I/WindowManager( 1631): Destroying surface Surface(name=com.evancharlton.mileage/com.evancharlton.mileage.charts.AverageVolumeChart) called by com.android.server.wm.WindowStateAnimator.destroySurface:2016 com.android.server.wm.WindowStateAnimator.destroySurfaceLocked:882 com.android.server.wm.WindowState.removeLocked:1456 com.android.server.wm.WindowManagerService.removeWindowInnerLocked:2484 com.android.server.wm.WindowManagerService.removeWindowLocked:2442 com.android.server.wm.WindowManagerService.removeWindowLocked:2311 com.android.server.wm.AppWindowToken.removeAllWindows:530 com.android.server.wm.AppWindowToken.removeAppFromTaskLocked:326 
06-05 23:01:08.739 W/ActivityManager( 1631): Crash of app com.evancharlton.mileage running instrumentation ComponentInfo{com.evancharlton.mileage.test/sh.calaba.instrumentationbackend.CalabashInstrumentationTestRunner}
06-05 23:01:08.739 I/ActivityManager( 1631): Force stopping com.evancharlton.mileage appid=10326 user=0: finished inst
06-05 23:01:08.742 I/art     (13706): Not late-enabling -Xcheck:jni (already on)
06-05 23:01:08.742 W/art     (13706): Unexpected CPU variant for X86 using defaults: x86
06-05 23:01:08.750 I/ActivityManager( 1631): Start proc 13706:com.evancharlton.mileage/u0a326 for added application com.evancharlton.mileage
06-05 23:01:08.750 D/AndroidRuntime(13696): Shutting down VM
06-05 23:01:08.750 D/EGL_emulation( 1712): eglMakeCurrent: 0xb0685360: ver 2 0 (tinfo 0xb06836c0)
06-05 23:01:08.752 D/EGL_emulation( 1712): eglMakeCurrent: 0xb0685360: ver 2 0 (tinfo 0xb06836c0)
06-05 23:01:08.755 W/System  (13706): ClassLoader referenced unknown path: /data/app/com.evancharlton.mileage.test-1/lib/x86
06-05 23:01:08.755 W/System  (13706): ClassLoader referenced unknown path: /data/app/com.evancharlton.mileage-1/lib/x86
06-05 23:01:08.758 W/System  (13706): ClassLoader referenced unknown path: 
06-05 23:01:08.761 I/System.out(13706): Main activity name automatically set to: com.evancharlton.mileage.Mileage
06-05 23:01:08.761 I/System.out(13706): Calabash did not load Mono. This is only a problem if you are trying to test a Mono application
06-05 23:01:08.761 I/calabash(13706): Test server port: 7102
06-05 23:01:08.762 I/InstrumentationBackend(13706): Added:'GetPreferences', with key:'get_preferences'
06-05 23:01:08.767 D/EGL_emulation( 1712): eglMakeCurrent: 0xb0685360: ver 2 0 (tinfo 0xb06836c0)
06-05 23:01:08.767 I/InstrumentationBackend(13706): Added:'SetPreferences', with key:'set_preferences'
06-05 23:01:08.767 I/InstrumentationBackend(13706): Added:'ClearPreferences', with key:'clear_preferences'
06-05 23:01:08.768 I/InstrumentationBackend(13706): Added:'PressElement', with key:'press_l10n_element'
06-05 23:01:08.768 I/InstrumentationBackend(13706): Added:'WaitForElement', with key:'wait_for_l10n_element'
06-05 23:01:08.768 I/InstrumentationBackend(13706): Added:'NullAction', with key:'nullAction'
06-05 23:01:08.768 I/InstrumentationBackend(13706): Added:'PressKey', with key:'press_key'
06-05 23:01:08.768 I/InstrumentationBackend(13706): Added:'SetActivityOrientation', with key:'set_activity_orientation'
06-05 23:01:08.768 I/InstrumentationBackend(13706): Added:'GetActivityOrientation', with key:'get_activity_orientation'
06-05 23:01:08.768 I/InstrumentationBackend(13706): Added:'FakeGPSLocation', with key:'set_gps_coordinates'
06-05 23:01:08.768 I/InstrumentationBackend(13706): Added:'SetPropertyByCssSelector', with key:'set_property_by_css_selector'
06-05 23:01:08.768 I/InstrumentationBackend(13706): Added:'GetUrl', with key:'get_url'
06-05 23:01:08.769 I/InstrumentationBackend(13706): Added:'ScrollTo', with key:'scroll_to'
06-05 23:01:08.769 I/InstrumentationBackend(13706): Added:'GetLoadProgress', with key:'get_load_progress'
06-05 23:01:08.769 I/InstrumentationBackend(13706): Added:'DumpHtml', with key:'dump_html'
06-05 23:01:08.769 I/InstrumentationBackend(13706): Added:'DumpBodyHtml', with key:'dump_body_html'
06-05 23:01:08.769 I/InstrumentationBackend(13706): Added:'EnterTextByCssSelector', with key:'enter_text_by_selector'
06-05 23:01:08.769 I/InstrumentationBackend(13706): Added:'AndroidSDKVersion', with key:'android_sdk_version'
06-05 23:01:08.769 I/InstrumentationBackend(13706): Added:'Version', with key:'version'
06-05 23:01:08.769 I/InstrumentationBackend(13706): Added:'Drag', with key:'drag'
06-05 23:01:08.769 I/InstrumentationBackend(13706): Added:'TouchCoordinates', with key:'touch_coordinate'
06-05 23:01:08.769 I/InstrumentationBackend(13706): Added:'LongPressCoordinate', with key:'long_press_coordinate'
06-05 23:01:08.769 I/InstrumentationBackend(13706): Added:'DragCoordinates', with key:'drag_coordinates'
06-05 23:01:08.769 I/InstrumentationBackend(13706): Added:'ResumeApplication', with key:'resume_application'
06-05 23:01:08.769 I/InstrumentationBackend(13706): Added:'Swipe', with key:'swipe'
06-05 23:01:08.770 I/InstrumentationBackend(13706): Added:'DoubleTapCoordinate', with key:'double_tap_coordinate'
06-05 23:01:08.770 I/InstrumentationBackend(13706): Added:'ClickOnScreen', with key:'click_on_screen'
06-05 23:01:08.770 I/InstrumentationBackend(13706): Added:'GetActivityName', with key:'get_activity_name'
06-05 23:01:08.770 I/InstrumentationBackend(13706): Added:'ScrollToView', with key:'scroll_to_view'
06-05 23:01:08.770 I/InstrumentationBackend(13706): Added:'ViewConfiguration', with key:'view_configuration'
06-05 23:01:08.770 I/InstrumentationBackend(13706): Added:'IsCurrentActivityFocused', with key:'is_current_activity_focused'
06-05 23:01:08.770 I/InstrumentationBackend(13706): Added:'SendTcp', with key:'send_tcp'
06-05 23:01:08.770 I/InstrumentationBackend(13706): Added:'DpToDevicePixel', with key:'dp_to_device_pixel'
06-05 23:01:08.770 I/InstrumentationBackend(13706): Added:'KeyboardEnterText', with key:'keyboard_enter_text'
06-05 23:01:08.770 I/InstrumentationBackend(13706): Added:'DeleteSurroundingText', with key:'delete_surrounding_text'
06-05 23:01:08.770 I/InstrumentationBackend(13706): Added:'SetComposingRegion', with key:'set_composing_region'
06-05 23:01:08.770 I/InstrumentationBackend(13706): Added:'SetSelection', with key:'set_selection'
06-05 23:01:08.770 I/InstrumentationBackend(13706): Added:'KeyboardKeyEvent', with key:'keyboard_key_event'
06-05 23:01:08.770 I/InstrumentationBackend(13706): Added:'PressUserActionButton', with key:'press_user_action_button'
06-05 23:01:08.770 I/InstrumentationBackend(13706): Added:'HideSoftKeyboard', with key:'hide_soft_keyboard'
06-05 23:01:08.770 I/InstrumentationBackend(13706): Added:'ListActions', with key:'list_actions'
06-05 23:01:08.770 I/calabash(13706): Instantiating http server at 7102
06-05 23:01:08.771 I/System.out(13706): HTTP Daemon listening on: 7102
06-05 23:01:08.772 D/EGL_emulation( 1712): eglMakeCurrent: 0xb0685360: ver 2 0 (tinfo 0xb06836c0)
06-05 23:01:08.783 W/InputDispatcher( 1631): channel '54eb32a com.evancharlton.mileage/com.evancharlton.mileage.Mileage (server)' ~ Consumer closed input channel or an error occurred.  events=0x9
06-05 23:01:08.783 E/InputDispatcher( 1631): channel '54eb32a com.evancharlton.mileage/com.evancharlton.mileage.Mileage (server)' ~ Channel is unrecoverably broken and will be disposed!
06-05 23:01:08.784 D/EGL_emulation( 1712): eglMakeCurrent: 0xb0685360: ver 2 0 (tinfo 0xb06836c0)
06-05 23:01:08.784 I/WindowManager( 1631): WIN DEATH: Window{54eb32a u0 com.evancharlton.mileage/com.evancharlton.mileage.Mileage EXITING}
06-05 23:01:08.784 W/InputDispatcher( 1631): Attempted to unregister already unregistered input channel '54eb32a com.evancharlton.mileage/com.evancharlton.mileage.Mileage (server)'
06-05 23:01:08.797 D/EGL_emulation( 1712): eglMakeCurrent: 0xb0685360: ver 2 0 (tinfo 0xb06836c0)
06-05 23:01:08.800 D/EGL_emulation( 1712): eglMakeCurrent: 0xb0685360: ver 2 0 (tinfo 0xb06836c0)
06-05 23:01:08.801 D/EGL_emulation( 1712): eglMakeCurrent: 0xb0685360: ver 2 0 (tinfo 0xb06836c0)
06-05 23:01:08.817 D/EGL_emulation( 1712): eglMakeCurrent: 0xb0685360: ver 2 0 (tinfo 0xb06836c0)
06-05 23:01:08.819 D/EGL_emulation( 1712): eglMakeCurrent: 0xb0685360: ver 2 0 (tinfo 0xb06836c0)
06-05 23:01:08.834 D/EGL_emulation( 1712): eglMakeCurrent: 0xb0685360: ver 2 0 (tinfo 0xb06836c0)
06-05 23:01:08.835 D/EGL_emulation( 1712): eglMakeCurrent: 0xb0685360: ver 2 0 (tinfo 0xb06836c0)
06-05 23:01:08.851 D/EGL_emulation( 1712): eglMakeCurrent: 0xb0685360: ver 2 0 (tinfo 0xb06836c0)
06-05 23:01:08.862 I/System.out(13706): URI: //ping
06-05 23:01:08.862 I/System.out(13706): params: {json={}
06-05 23:01:08.862 I/System.out(13706): }
06-05 23:01:08.865 I/System.out(13706): URI: //ping
06-05 23:01:08.865 I/System.out(13706): params: {json={}
06-05 23:01:08.865 I/System.out(13706): }
06-05 23:01:08.867 I/System.out(13706): URI: //ready
06-05 23:01:08.867 D/EGL_emulation( 1712): eglMakeCurrent: 0xb0685360: ver 2 0 (tinfo 0xb06836c0)
06-05 23:01:08.867 I/System.out(13706): params: {json={}
06-05 23:01:08.867 I/System.out(13706): }
06-05 23:01:08.868 D/EGL_emulation( 1712): eglMakeCurrent: 0xb0685360: ver 2 0 (tinfo 0xb06836c0)
06-05 23:01:08.869 I/System.out(13706): URI: //
06-05 23:01:08.869 I/System.out(13706): params: {json={"command":"version","arguments":[]}
06-05 23:01:08.869 I/System.out(13706): }
06-05 23:01:08.869 I/System.out(13706): header: {content-type=application/json;charset=utf-8, date=Sat, 06 Jun 2020 04:01:09 GMT, accept=*/*, host=127.0.0.1:34777, content-length=36, user-agent=HTTPClient/1.0 (2.8.3, ruby 2.5.1 (2018-03-29))}
06-05 23:01:08.869 I/System.out(13706): params: {json={"command":"version","arguments":[]}
06-05 23:01:08.869 I/System.out(13706): }
06-05 23:01:08.869 I/System.out(13706): ProP json = {"command":"version","arguments":[]}
06-05 23:01:08.869 I/System.out(13706): files: {}
06-05 23:01:08.869 I/System.out(13706): command: {"command":"version","arguments":[]}
06-05 23:01:08.872 I/InstrumentationBackend(13706): Got command:'Command:'Line:null,version', arguments:'[]'
06-05 23:01:08.877 I/System.out(13706): result:{"bonusInformation":[],"message":"0.9.8","success":true}
06-05 23:01:08.879 I/System.out(13706): URI: //start-application
06-05 23:01:08.879 I/System.out(13706): params: {json={"intent":null}
06-05 23:01:08.879 I/System.out(13706): }
06-05 23:01:08.884 D/EGL_emulation( 1712): eglMakeCurrent: 0xb0685360: ver 2 0 (tinfo 0xb06836c0)
06-05 23:01:08.885 D/EGL_emulation( 1712): eglMakeCurrent: 0xb0685360: ver 2 0 (tinfo 0xb06836c0)
06-05 23:01:08.888 I/ActivityManager( 1631): START u0 {act=android.intent.action.MAIN cat=[android.intent.category.LAUNCHER] flg=0x10200000 cmp=com.evancharlton.mileage/.Mileage} from uid 10326 on display 0
06-05 23:01:08.893 I/calabash(13706): newActivity1
06-05 23:01:08.902 I/calabash(13706): newActivity1
06-05 23:01:08.903 W/ActivityManager( 1631): Bad activity token: android.os.BinderProxy@5202e3a
06-05 23:01:08.903 W/ActivityManager( 1631): java.lang.ClassCastException: android.os.BinderProxy cannot be cast to com.android.server.am.ActivityRecord$Token
06-05 23:01:08.903 W/ActivityManager( 1631): 	at com.android.server.am.ActivityRecord.forTokenLocked(ActivityRecord.java:586)
06-05 23:01:08.903 W/ActivityManager( 1631): 	at com.android.server.am.ActivityRecord.isInStackLocked(ActivityRecord.java:1327)
06-05 23:01:08.903 W/ActivityManager( 1631): 	at com.android.server.am.ActivityRecord.getStackLocked(ActivityRecord.java:1332)
06-05 23:01:08.903 W/ActivityManager( 1631): 	at com.android.server.am.ActivityManagerService.getActivityDisplayId(ActivityManagerService.java:9806)
06-05 23:01:08.903 W/ActivityManager( 1631): 	at android.app.ActivityManagerNative.onTransact(ActivityManagerNative.java:2566)
06-05 23:01:08.903 W/ActivityManager( 1631): 	at com.android.server.am.ActivityManagerService.onTransact(ActivityManagerService.java:2757)
06-05 23:01:08.903 W/ActivityManager( 1631): 	at android.os.Binder.execTransact(Binder.java:565)
06-05 23:01:08.904 W/ActivityManager( 1631): Bad activity token: android.os.BinderProxy@5202e3a
06-05 23:01:08.904 W/ActivityManager( 1631): java.lang.ClassCastException: android.os.BinderProxy cannot be cast to com.android.server.am.ActivityRecord$Token
06-05 23:01:08.904 W/ActivityManager( 1631): 	at com.android.server.am.ActivityRecord.forTokenLocked(ActivityRecord.java:586)
06-05 23:01:08.904 W/ActivityManager( 1631): 	at com.android.server.am.ActivityRecord.isInStackLocked(ActivityRecord.java:1327)
06-05 23:01:08.904 W/ActivityManager( 1631): 	at com.android.server.am.ActivityManagerService.setTaskDescription(ActivityManagerService.java:9358)
06-05 23:01:08.904 W/ActivityManager( 1631): 	at android.app.ActivityManagerNative.onTransact(ActivityManagerNative.java:2639)
06-05 23:01:08.904 W/ActivityManager( 1631): 	at com.android.server.am.ActivityManagerService.onTransact(ActivityManagerService.java:2757)
06-05 23:01:08.904 W/ActivityManager( 1631): 	at android.os.Binder.execTransact(Binder.java:565)
06-05 23:01:08.904 W/ActivityManager( 1631): Bad activity token: android.os.BinderProxy@5202e3a
06-05 23:01:08.904 W/ActivityManager( 1631): java.lang.ClassCastException: android.os.BinderProxy cannot be cast to com.android.server.am.ActivityRecord$Token
06-05 23:01:08.904 W/ActivityManager( 1631): 	at com.android.server.am.ActivityRecord.forTokenLocked(ActivityRecord.java:586)
06-05 23:01:08.904 W/ActivityManager( 1631): 	at com.android.server.am.ActivityRecord.isInStackLocked(ActivityRecord.java:1327)
06-05 23:01:08.904 W/ActivityManager( 1631): 	at com.android.server.am.ActivityRecord.getStackLocked(ActivityRecord.java:1332)
06-05 23:01:08.904 W/ActivityManager( 1631): 	at com.android.server.am.ActivityManagerService.getActivityStackId(ActivityManagerService.java:9817)
06-05 23:01:08.904 W/ActivityManager( 1631): 	at android.app.ActivityManagerNative.onTransact(ActivityManagerNative.java:2856)
06-05 23:01:08.904 W/ActivityManager( 1631): 	at com.android.server.am.ActivityManagerService.onTransact(ActivityManagerService.java:2757)
06-05 23:01:08.904 W/ActivityManager( 1631): 	at android.os.Binder.execTransact(Binder.java:565)
06-05 23:01:08.917 D/gralloc_ranchu( 1347): gralloc_alloc: Creating ashmem region of size 9023488
06-05 23:01:08.924 W/ActivityManager( 1631): Bad activity token: android.os.BinderProxy@5202e3a
06-05 23:01:08.924 W/ActivityManager( 1631): java.lang.ClassCastException: android.os.BinderProxy cannot be cast to com.android.server.am.ActivityRecord$Token
06-05 23:01:08.924 W/ActivityManager( 1631): 	at com.android.server.am.ActivityRecord.forTokenLocked(ActivityRecord.java:586)
06-05 23:01:08.924 W/ActivityManager( 1631): 	at com.android.server.am.ActivityRecord.isInStackLocked(ActivityRecord.java:1327)
06-05 23:01:08.924 W/ActivityManager( 1631): 	at com.android.server.am.ActivityManagerService.getActivityOptions(ActivityManagerService.java:12559)
06-05 23:01:08.924 W/ActivityManager( 1631): 	at android.app.ActivityManagerNative.onTransact(ActivityManagerNative.java:1933)
06-05 23:01:08.924 W/ActivityManager( 1631): 	at com.android.server.am.ActivityManagerService.onTransact(ActivityManagerService.java:2757)
06-05 23:01:08.924 W/ActivityManager( 1631): 	at android.os.Binder.execTransact(Binder.java:565)
06-05 23:01:08.925 W/ActivityManager( 1631): Bad activity token: android.os.BinderProxy@5202e3a
06-05 23:01:08.925 W/ActivityManager( 1631): java.lang.ClassCastException: android.os.BinderProxy cannot be cast to com.android.server.am.ActivityRecord$Token
06-05 23:01:08.925 W/ActivityManager( 1631): 	at com.android.server.am.ActivityRecord.forTokenLocked(ActivityRecord.java:586)
06-05 23:01:08.925 W/ActivityManager( 1631): 	at com.android.server.am.ActivityRecord.isInStackLocked(ActivityRecord.java:1327)
06-05 23:01:08.925 W/ActivityManager( 1631): 	at com.android.server.am.ActivityManagerService.getActivityOptions(ActivityManagerService.java:12559)
06-05 23:01:08.925 W/ActivityManager( 1631): 	at android.app.ActivityManagerNative.onTransact(ActivityManagerNative.java:1933)
06-05 23:01:08.925 W/ActivityManager( 1631): 	at com.android.server.am.ActivityManagerService.onTransact(ActivityManagerService.java:2757)
06-05 23:01:08.925 W/ActivityManager( 1631): 	at android.os.Binder.execTransact(Binder.java:565)
06-05 23:01:08.946 V/PhoneStatusBar( 1712): setLightsOn(true)
06-05 23:01:08.951 D/EGL_emulation( 2076): eglMakeCurrent: 0xb0685360: ver 2 0 (tinfo 0xb06836b0)
06-05 23:01:08.952 D/EGL_emulation( 1712): eglMakeCurrent: 0xb0685360: ver 2 0 (tinfo 0xb06836c0)
06-05 23:01:08.952 V/PhoneStatusBar( 1712): setLightsOn(true)
06-05 23:01:08.967 D/gralloc_ranchu( 1347): gralloc_alloc: Creating ashmem region of size 9023488
06-05 23:01:08.967 D/EGL_emulation( 1712): eglMakeCurrent: 0xb0685360: ver 2 0 (tinfo 0xb06836c0)
06-05 23:01:08.972 D/        (13706): HostConnection::get() New Host Connection established 0x9421f040, tid 13706
06-05 23:01:08.973 D/EGL_emulation( 1712): eglMakeCurrent: 0xb0685360: ver 2 0 (tinfo 0xb06836c0)
06-05 23:01:08.973 V/PhoneStatusBar( 1712): setLightsOn(true)
06-05 23:01:09.006 D/EGL_emulation( 1712): eglMakeCurrent: 0xb0685360: ver 2 0 (tinfo 0xb06836c0)
06-05 23:01:09.009 D/EGL_emulation( 1712): eglMakeCurrent: 0xb0685360: ver 2 0 (tinfo 0xb06836c0)
06-05 23:01:09.011 D/EGL_emulation( 1712): eglMakeCurrent: 0xb0685360: ver 2 0 (tinfo 0xb06836c0)
06-05 23:01:09.019 D/EGL_emulation( 1712): eglMakeCurrent: 0xb0685360: ver 2 0 (tinfo 0xb06836c0)
06-05 23:01:09.021 D/EGL_emulation( 1712): eglMakeCurrent: 0xb0685360: ver 2 0 (tinfo 0xb06836c0)
06-05 23:01:09.034 D/EGL_emulation( 1712): eglMakeCurrent: 0xb0685360: ver 2 0 (tinfo 0xb06836c0)
06-05 23:01:09.035 D/EGL_emulation( 1712): eglMakeCurrent: 0xb0685360: ver 2 0 (tinfo 0xb06836c0)
06-05 23:01:09.050 D/EGL_emulation( 1712): eglMakeCurrent: 0xb0685360: ver 2 0 (tinfo 0xb06836c0)
06-05 23:01:09.051 D/gralloc_ranchu( 1347): gralloc_alloc: Creating ashmem region of size 9023488
06-05 23:01:09.058 D/EGL_emulation( 1712): eglMakeCurrent: 0xb0685360: ver 2 0 (tinfo 0xb06836c0)
06-05 23:01:09.067 D/EGL_emulation( 1712): eglMakeCurrent: 0xb0685360: ver 2 0 (tinfo 0xb06836c0)
06-05 23:01:09.067 I/ActivityManager( 1631): Displayed com.evancharlton.mileage/.Mileage: +176ms
06-05 23:01:09.067 V/PhoneStatusBar( 1712): setLightsOn(true)
06-05 23:01:09.076 D/EGL_emulation( 1712): eglMakeCurrent: 0xb0685360: ver 2 0 (tinfo 0xb06836c0)
06-05 23:01:09.086 I/WindowManager( 1631): Destroying surface Surface(name=com.evancharlton.mileage/com.evancharlton.mileage.Mileage) called by com.android.server.wm.WindowStateAnimator.destroySurface:2016 com.android.server.wm.WindowStateAnimator.destroySurfaceLocked:882 com.android.server.wm.WindowState.removeLocked:1456 com.android.server.wm.WindowManagerService.removeWindowInnerLocked:2484 com.android.server.wm.AppWindowToken.destroySurfaces:365 com.android.server.wm.WindowStateAnimator.finishExit:565 com.android.server.wm.AppWindowAnimator.stepAnimationLocked:427 com.android.server.wm.WindowAnimator.updateAppWindowsLocked:196 
06-05 23:01:09.089 D/EGL_emulation( 1712): eglMakeCurrent: 0xb0685360: ver 2 0 (tinfo 0xb06836c0)
06-05 23:01:09.090 D/EGL_emulation( 1712): eglMakeCurrent: 0xb0685360: ver 2 0 (tinfo 0xb06836c0)
06-05 23:01:09.101 D/EGL_emulation( 1712): eglMakeCurrent: 0xb0685360: ver 2 0 (tinfo 0xb06836c0)
06-05 23:01:09.101 V/PhoneStatusBar( 1712): setLightsOn(true)
06-05 23:01:09.102 D/EGL_emulation( 1712): eglMakeCurrent: 0xb0685360: ver 2 0 (tinfo 0xb06836c0)
06-05 23:01:09.108 I/System.out(13706): URI: //map
06-05 23:01:09.108 I/System.out(13706): params: {json={"query":"* marked:'Statistics'","operation":{"method_name":"query","arguments":[]}}
06-05 23:01:09.108 I/System.out(13706): }
06-05 23:01:09.117 D/EGL_emulation( 1712): eglMakeCurrent: 0xb0685360: ver 2 0 (tinfo 0xb06836c0)
06-05 23:01:09.118 D/EGL_emulation( 1712): eglMakeCurrent: 0xb0685360: ver 2 0 (tinfo 0xb06836c0)
06-05 23:01:09.125 W/ResourceType(13706): No package identifier when getting name for resource number 0x00000001
06-05 23:01:09.133 D/EGL_emulation( 1712): eglMakeCurrent: 0xb0685360: ver 2 0 (tinfo 0xb06836c0)
06-05 23:01:09.135 D/EGL_emulation( 1712): eglMakeCurrent: 0xb0685360: ver 2 0 (tinfo 0xb06836c0)
06-05 23:01:09.139 I/System.out(13706): URI: //gesture
06-05 23:01:09.139 I/System.out(13706): params: {json={"query_timeout":5.0,"gestures":[{"query_string":"* marked:'Statistics'","touches":[{"x":50,"y":50,"offset_x":0,"offset_y":0,"wait":0.0,"time":0.2,"release":true,"query_string":null}]}]}
06-05 23:01:09.139 I/System.out(13706): }
06-05 23:01:09.144 W/ResourceType(13706): No package identifier when getting name for resource number 0x00000001
06-05 23:01:09.150 D/EGL_emulation( 1712): eglMakeCurrent: 0xb0685360: ver 2 0 (tinfo 0xb06836c0)
06-05 23:01:09.157 D/EGL_emulation( 1712): eglMakeCurrent: 0xb0685360: ver 2 0 (tinfo 0xb06836c0)
06-05 23:01:09.170 D/EGL_emulation( 1712): eglMakeCurrent: 0xb0685360: ver 2 0 (tinfo 0xb06836c0)
06-05 23:01:09.175 D/EGL_emulation( 1712): eglMakeCurrent: 0xb0685360: ver 2 0 (tinfo 0xb06836c0)
06-05 23:01:09.267 I/WindowManager( 1631): Destroying surface Surface(name=Starting com.evancharlton.mileage) called by com.android.server.wm.WindowStateAnimator.destroySurface:2016 com.android.server.wm.WindowStateAnimator.destroySurfaceLocked:882 com.android.server.wm.WindowState.destroyOrSaveSurface:2100 com.android.server.wm.AppWindowToken.destroySurfaces:363 com.android.server.wm.WindowStateAnimator.finishExit:565 com.android.server.wm.WindowStateAnimator.stepAnimationLocked:491 com.android.server.wm.WindowAnimator.updateWindowsLocked:303 com.android.server.wm.WindowAnimator.animateLocked:704 
06-05 23:01:09.268 V/PhoneStatusBar( 1712): setLightsOn(true)
06-05 23:01:09.300 V/PhoneStatusBar( 1712): setLightsOn(true)
06-05 23:01:09.370 I/calabash(13706): newActivity1
06-05 23:01:09.380 I/System.out(13706): URI: //map
06-05 23:01:09.380 I/System.out(13706): params: {json={"query":"android.widget.ScrollView index:0","operation":{"method_name":"query","arguments":[]}}
06-05 23:01:09.380 I/System.out(13706): }
06-05 23:01:09.386 W/ActivityManager( 1631): Bad activity token: android.os.BinderProxy@c1b5724
06-05 23:01:09.386 W/ActivityManager( 1631): java.lang.ClassCastException: android.os.BinderProxy cannot be cast to com.android.server.am.ActivityRecord$Token
06-05 23:01:09.386 W/ActivityManager( 1631): 	at com.android.server.am.ActivityRecord.forTokenLocked(ActivityRecord.java:586)
06-05 23:01:09.386 W/ActivityManager( 1631): 	at com.android.server.am.ActivityRecord.isInStackLocked(ActivityRecord.java:1327)
06-05 23:01:09.386 W/ActivityManager( 1631): 	at com.android.server.am.ActivityRecord.getStackLocked(ActivityRecord.java:1332)
06-05 23:01:09.386 W/ActivityManager( 1631): 	at com.android.server.am.ActivityManagerService.getActivityDisplayId(ActivityManagerService.java:9806)
06-05 23:01:09.386 W/ActivityManager( 1631): 	at android.app.ActivityManagerNative.onTransact(ActivityManagerNative.java:2566)
06-05 23:01:09.386 W/ActivityManager( 1631): 	at com.android.server.am.ActivityManagerService.onTransact(ActivityManagerService.java:2757)
06-05 23:01:09.386 W/ActivityManager( 1631): 	at android.os.Binder.execTransact(Binder.java:565)
06-05 23:01:09.387 W/ActivityManager( 1631): Bad activity token: android.os.BinderProxy@c1b5724
06-05 23:01:09.387 W/ActivityManager( 1631): java.lang.ClassCastException: android.os.BinderProxy cannot be cast to com.android.server.am.ActivityRecord$Token
06-05 23:01:09.387 W/ActivityManager( 1631): 	at com.android.server.am.ActivityRecord.forTokenLocked(ActivityRecord.java:586)
06-05 23:01:09.387 W/ActivityManager( 1631): 	at com.android.server.am.ActivityRecord.isInStackLocked(ActivityRecord.java:1327)
06-05 23:01:09.387 W/ActivityManager( 1631): 	at com.android.server.am.ActivityManagerService.setTaskDescription(ActivityManagerService.java:9358)
06-05 23:01:09.387 W/ActivityManager( 1631): 	at android.app.ActivityManagerNative.onTransact(ActivityManagerNative.java:2639)
06-05 23:01:09.387 W/ActivityManager( 1631): 	at com.android.server.am.ActivityManagerService.onTransact(ActivityManagerService.java:2757)
06-05 23:01:09.387 W/ActivityManager( 1631): 	at android.os.Binder.execTransact(Binder.java:565)
06-05 23:01:09.387 W/ActivityManager( 1631): Bad activity token: android.os.BinderProxy@c1b5724
06-05 23:01:09.387 W/ActivityManager( 1631): java.lang.ClassCastException: android.os.BinderProxy cannot be cast to com.android.server.am.ActivityRecord$Token
06-05 23:01:09.387 W/ActivityManager( 1631): 	at com.android.server.am.ActivityRecord.forTokenLocked(ActivityRecord.java:586)
06-05 23:01:09.387 W/ActivityManager( 1631): 	at com.android.server.am.ActivityRecord.isInStackLocked(ActivityRecord.java:1327)
06-05 23:01:09.387 W/ActivityManager( 1631): 	at com.android.server.am.ActivityRecord.getStackLocked(ActivityRecord.java:1332)
06-05 23:01:09.387 W/ActivityManager( 1631): 	at com.android.server.am.ActivityManagerService.getActivityStackId(ActivityManagerService.java:9817)
06-05 23:01:09.387 W/ActivityManager( 1631): 	at android.app.ActivityManagerNative.onTransact(ActivityManagerNative.java:2856)
06-05 23:01:09.387 W/ActivityManager( 1631): 	at com.android.server.am.ActivityManagerService.onTransact(ActivityManagerService.java:2757)
06-05 23:01:09.387 W/ActivityManager( 1631): 	at android.os.Binder.execTransact(Binder.java:565)
06-05 23:01:09.393 D/VehicleStatisticsActivity(13706): Checking recalculation ...
06-05 23:01:09.393 D/VehicleStatisticsActivity(13706): Recalculation not necessary.
06-05 23:01:09.400 V/PhoneStatusBar( 1712): setLightsOn(true)
06-05 23:01:09.400 W/ActivityManager( 1631): Bad activity token: android.os.BinderProxy@c1b5724
06-05 23:01:09.400 W/ActivityManager( 1631): java.lang.ClassCastException: android.os.BinderProxy cannot be cast to com.android.server.am.ActivityRecord$Token
06-05 23:01:09.400 W/ActivityManager( 1631): 	at com.android.server.am.ActivityRecord.forTokenLocked(ActivityRecord.java:586)
06-05 23:01:09.400 W/ActivityManager( 1631): 	at com.android.server.am.ActivityRecord.isInStackLocked(ActivityRecord.java:1327)
06-05 23:01:09.400 W/ActivityManager( 1631): 	at com.android.server.am.ActivityManagerService.getActivityOptions(ActivityManagerService.java:12559)
06-05 23:01:09.400 W/ActivityManager( 1631): 	at android.app.ActivityManagerNative.onTransact(ActivityManagerNative.java:1933)
06-05 23:01:09.400 W/ActivityManager( 1631): 	at com.android.server.am.ActivityManagerService.onTransact(ActivityManagerService.java:2757)
06-05 23:01:09.400 W/ActivityManager( 1631): 	at android.os.Binder.execTransact(Binder.java:565)
06-05 23:01:09.401 W/ActivityManager( 1631): Bad activity token: android.os.BinderProxy@c1b5724
06-05 23:01:09.401 W/ActivityManager( 1631): java.lang.ClassCastException: android.os.BinderProxy cannot be cast to com.android.server.am.ActivityRecord$Token
06-05 23:01:09.401 W/ActivityManager( 1631): 	at com.android.server.am.ActivityRecord.forTokenLocked(ActivityRecord.java:586)
06-05 23:01:09.401 W/ActivityManager( 1631): 	at com.android.server.am.ActivityRecord.isInStackLocked(ActivityRecord.java:1327)
06-05 23:01:09.401 W/ActivityManager( 1631): 	at com.android.server.am.ActivityManagerService.getActivityOptions(ActivityManagerService.java:12559)
06-05 23:01:09.401 W/ActivityManager( 1631): 	at android.app.ActivityManagerNative.onTransact(ActivityManagerNative.java:1933)
06-05 23:01:09.401 W/ActivityManager( 1631): 	at com.android.server.am.ActivityManagerService.onTransact(ActivityManagerService.java:2757)
06-05 23:01:09.401 W/ActivityManager( 1631): 	at android.os.Binder.execTransact(Binder.java:565)
06-05 23:01:09.402 D/VehicleStatisticsActivity(13706): Checking recalculation ...
06-05 23:01:09.403 D/VehicleStatisticsActivity(13706): Recalculation not necessary.
06-05 23:01:09.482 I/System.out(13706): URI: //map
06-05 23:01:09.482 I/System.out(13706): params: {json={"query":"android.widget.AbsListView index:0","operation":{"method_name":"query","arguments":[]}}
06-05 23:01:09.482 I/System.out(13706): }
06-05 23:01:09.488 I/art     (13706): Do partial code cache collection, code=30KB, data=29KB
06-05 23:01:09.488 I/art     (13706): After code cache collection, code=29KB, data=28KB
06-05 23:01:09.488 I/art     (13706): Increasing code cache capacity to 128KB
06-05 23:01:09.500 I/System.out(13706): URI: //map
06-05 23:01:09.500 I/System.out(13706): params: {json={"query":"android.widget.AbsListView index:0","operation":{"method_name":"query","arguments":[]}}
06-05 23:01:09.500 I/System.out(13706): }
06-05 23:01:09.515 I/System.out(13706): URI: //map
06-05 23:01:09.515 I/System.out(13706): params: {json={"query":"android.widget.AbsListView index:0","operation":{"method_name":"query","arguments":[]}}
06-05 23:01:09.515 I/System.out(13706): }
06-05 23:01:09.530 I/System.out(13706): URI: //map
06-05 23:01:09.530 I/System.out(13706): params: {json={"query":"android.widget.AbsListView index:0","operation":{"method_name":"query","arguments":["getFirstVisiblePosition"]}}
06-05 23:01:09.530 I/System.out(13706): }
06-05 23:01:09.544 I/System.out(13706): URI: //map
06-05 23:01:09.544 I/System.out(13706): params: {json={"query":"android.widget.AbsListView index:0","operation":{"method_name":"query","arguments":["getLastVisiblePosition"]}}
06-05 23:01:09.544 I/System.out(13706): }
06-05 23:01:09.556 I/System.out(13706): URI: //map
06-05 23:01:09.556 I/System.out(13706): params: {json={"query":"android.widget.AbsListView index:0","operation":{"method_name":"query","arguments":[{"method_name":"setSelection","arguments":[26]}]}}
06-05 23:01:09.556 I/System.out(13706): }
06-05 23:01:09.573 I/System.out(13706): URI: //map
06-05 23:01:09.573 I/System.out(13706): params: {json={"query":"* marked:'Total fuel'","operation":{"method_name":"query","arguments":[]}}
06-05 23:01:09.573 I/System.out(13706): }
06-05 23:01:09.630 D/gralloc_ranchu( 1347): gralloc_alloc: Creating ashmem region of size 9023488
06-05 23:01:09.674 W/ResourceType(13706): No package identifier when getting name for resource number 0x00000001
06-05 23:01:09.683 V/PhoneStatusBar( 1712): setLightsOn(true)
06-05 23:01:09.684 V/PhoneStatusBar( 1712): setLightsOn(true)
06-05 23:01:09.685 W/OpenGLRenderer( 2076): Incorrectly called buildLayer on View: ShortcutAndWidgetContainer, destroying layer...
06-05 23:01:09.686 I/System.out(13706): URI: //gesture
06-05 23:01:09.686 I/System.out(13706): params: {json={"query_timeout":5.0,"gestures":[{"query_string":"* marked:'Total fuel'","touches":[{"x":50,"y":50,"offset_x":0,"offset_y":0,"wait":0.0,"time":0.2,"release":true,"query_string":null}]}]}
06-05 23:01:09.686 I/System.out(13706): }
06-05 23:01:09.690 W/ResourceType(13706): No package identifier when getting name for resource number 0x00000001
06-05 23:01:09.700 I/WindowManager( 1631): Destroying surface Surface(name=com.android.launcher3/com.android.launcher3.Launcher) called by com.android.server.wm.WindowStateAnimator.destroySurface:2016 com.android.server.wm.WindowStateAnimator.destroySurfaceLocked:882 com.android.server.wm.WindowState.destroyOrSaveSurface:2100 com.android.server.wm.AppWindowToken.destroySurfaces:363 com.android.server.wm.AppWindowToken.notifyAppStopped:389 com.android.server.wm.WindowManagerService.notifyAppStopped:4463 com.android.server.am.ActivityStack.activityStoppedLocked:1252 com.android.server.am.ActivityManagerService.activityStopped:6903 
06-05 23:01:09.701 V/PhoneStatusBar( 1712): setLightsOn(true)
06-05 23:01:09.917 I/ActivityManager( 1631): START u0 {cmp=com.evancharlton.mileage/.charts.TotalVolumeChart (has extras)} from uid 10326 on display 0
06-05 23:01:09.919 V/PhoneStatusBar( 1712): setLightsOn(true)
06-05 23:01:09.919 V/PhoneStatusBar( 1712): setLightsOn(true)
06-05 23:01:09.928 I/System.out(13706): URI: //map
06-05 23:01:09.928 I/System.out(13706): params: {json={"query":"* {text CONTAINS[c] 'Total fuel purchased'}","operation":{"method_name":"query","arguments":[]}}
06-05 23:01:09.928 I/System.out(13706): }
06-05 23:01:09.967 I/calabash(13706): newActivity1
06-05 23:01:09.969 W/aiCharts(13706): License file is invalid or missing. 
06-05 23:01:09.969 W/aiCharts(13706): Please place proper license.lic to /assets folder.
06-05 23:01:09.981 V/PhoneStatusBar( 1712): setLightsOn(true)
06-05 23:01:10.000 V/PhoneStatusBar( 1712): setLightsOn(true)
06-05 23:01:10.005 I/WindowManager( 1631): Destroying surface Surface(name=Creating chart…) called by com.android.server.wm.WindowStateAnimator.destroySurface:2016 com.android.server.wm.WindowStateAnimator.destroySurfaceLocked:882 com.android.server.wm.WindowState.removeLocked:1456 com.android.server.wm.WindowManagerService.removeWindowInnerLocked:2484 com.android.server.wm.WindowManagerService.removeWindowLocked:2442 com.android.server.wm.WindowManagerService.removeWindowLocked:2311 com.android.server.wm.WindowManagerService.removeWindow:2306 com.android.server.wm.Session.remove:202 
06-05 23:01:10.008 D/gralloc_ranchu( 1347): gralloc_alloc: Creating ashmem region of size 9023488
06-05 23:01:10.017 V/PhoneStatusBar( 1712): setLightsOn(true)
06-05 23:01:10.033 V/PhoneStatusBar( 1712): setLightsOn(true)
06-05 23:01:10.034 I/ActivityManager( 1631): Displayed com.evancharlton.mileage/.charts.TotalVolumeChart: +70ms
06-05 23:01:10.050 V/PhoneStatusBar( 1712): setLightsOn(true)
06-05 23:01:10.067 V/PhoneStatusBar( 1712): setLightsOn(true)
06-05 23:01:10.267 V/PhoneStatusBar( 1712): setLightsOn(true)
06-05 23:01:10.296 I/System.out(13706): URI: //map
06-05 23:01:10.296 I/System.out(13706): params: {json={"query":"* {text CONTAINS[c] 'Total fuel purchased'}","operation":{"method_name":"query","arguments":[]}}
06-05 23:01:10.296 I/System.out(13706): }
06-05 23:01:10.312 I/System.out(13706): URI: //
06-05 23:01:10.312 I/System.out(13706): params: {json={"command":"press_key","arguments":["KEYCODE_BACK"]}
06-05 23:01:10.312 I/System.out(13706): }
06-05 23:01:10.312 I/System.out(13706): header: {content-type=application/json;charset=utf-8, date=Sat, 06 Jun 2020 04:01:10 GMT, accept=*/*, host=127.0.0.1:34777, content-length=52, user-agent=HTTPClient/1.0 (2.8.3, ruby 2.5.1 (2018-03-29))}
06-05 23:01:10.312 I/System.out(13706): params: {json={"command":"press_key","arguments":["KEYCODE_BACK"]}
06-05 23:01:10.312 I/System.out(13706): }
06-05 23:01:10.312 I/System.out(13706): ProP json = {"command":"press_key","arguments":["KEYCODE_BACK"]}
06-05 23:01:10.312 I/System.out(13706): files: {}
06-05 23:01:10.312 I/System.out(13706): command: {"command":"press_key","arguments":["KEYCODE_BACK"]}
06-05 23:01:10.313 I/InstrumentationBackend(13706): Got command:'Command:'Line:null,press_key', arguments:'[KEYCODE_BACK]'
06-05 23:01:10.316 V/PhoneStatusBar( 1712): setLightsOn(true)
06-05 23:01:10.317 V/PhoneStatusBar( 1712): setLightsOn(true)
06-05 23:01:10.320 I/art     (13706): Do partial code cache collection, code=60KB, data=62KB
06-05 23:01:10.321 D/VehicleStatisticsActivity(13706): Checking recalculation ...
06-05 23:01:10.321 D/VehicleStatisticsActivity(13706): Recalculation not necessary.
06-05 23:01:10.322 I/System.out(13706): result:{"bonusInformation":[],"message":"","success":true}
06-05 23:01:10.322 I/art     (13706): After code cache collection, code=59KB, data=61KB
06-05 23:01:10.322 I/art     (13706): Increasing code cache capacity to 256KB
06-05 23:01:10.325 I/System.out(13706): URI: //map
06-05 23:01:10.325 I/System.out(13706): params: {json={"query":"* {text CONTAINS[c] 'Statistics'}","operation":{"method_name":"query","arguments":[]}}
06-05 23:01:10.325 I/System.out(13706): }
06-05 23:01:10.350 D/gralloc_ranchu( 1347): gralloc_alloc: Creating ashmem region of size 9023488
06-05 23:01:10.350 V/PhoneStatusBar( 1712): setLightsOn(true)
06-05 23:01:10.367 V/PhoneStatusBar( 1712): setLightsOn(true)
06-05 23:01:10.383 V/PhoneStatusBar( 1712): setLightsOn(true)
