--------- beginning of system
06-06 00:59:46.538 W/ActivityManager( 1631): Finishing task with all activities already finished
06-06 00:59:46.538 W/ActivityManager( 1631): Duplicate finish request for ActivityRecord{aa8c56d u0 com.evancharlton.mileage/.Mileage t10857 f}
--------- beginning of main
06-06 00:59:46.551 V/PhoneStatusBar( 1712): setLightsOn(true)
06-06 00:59:46.554 D/gralloc_ranchu( 1347): gralloc_alloc: Creating ashmem region of size 3145728
06-06 00:59:46.559 E/EGL_emulation( 1347): tid 1347: eglCreateSyncKHR(1901): error 0x3004 (EGL_BAD_ATTRIBUTE)
06-06 00:59:46.576 W/ActivityManager( 1631): Finishing task with all activities already finished
06-06 00:59:46.576 W/ActivityManager( 1631): Duplicate finish request for ActivityRecord{aa8c56d u0 com.evancharlton.mileage/.Mileage t10857 f}
06-06 00:59:46.576 W/ActivityManager( 1631): Finishing task with all activities already finished
06-06 00:59:46.576 W/ActivityManager( 1631): Duplicate finish request for ActivityRecord{aa8c56d u0 com.evancharlton.mileage/.Mileage t10857 f}
06-06 00:59:46.576 W/ActivityManager( 1631): Finishing task with all activities already finished
06-06 00:59:46.577 W/ActivityManager( 1631): Duplicate finish request for ActivityRecord{aa8c56d u0 com.evancharlton.mileage/.Mileage t10857 f}
06-06 00:59:46.577 W/ActivityManager( 1631): Finishing task with all activities already finished
06-06 00:59:46.577 W/ActivityManager( 1631): Duplicate finish request for ActivityRecord{aa8c56d u0 com.evancharlton.mileage/.Mileage t10857 f}
06-06 00:59:46.577 W/ActivityManager( 1631): Finishing task with all activities already finished
06-06 00:59:46.577 W/ActivityManager( 1631): Duplicate finish request for ActivityRecord{823206f u0 com.evancharlton.mileage/.charts.SouthChart t10857 f}
06-06 00:59:46.577 W/ActivityManager( 1631): Finishing task with all activities already finished
06-06 00:59:46.577 W/ActivityManager( 1631): Duplicate finish request for ActivityRecord{823206f u0 com.evancharlton.mileage/.charts.SouthChart t10857 f}
06-06 00:59:46.577 W/ActivityManager( 1631): Finishing task with all activities already finished
06-06 00:59:46.577 W/ActivityManager( 1631): Duplicate finish request for ActivityRecord{aa8c56d u0 com.evancharlton.mileage/.Mileage t10857 f}
06-06 00:59:46.577 W/ActivityManager( 1631): Finishing task with all activities already finished
06-06 00:59:46.577 W/ActivityManager( 1631): Duplicate finish request for ActivityRecord{aa8c56d u0 com.evancharlton.mileage/.Mileage t10857 f}
06-06 00:59:46.618 D/EGL_emulation( 2076): eglMakeCurrent: 0xb0685360: ver 2 0 (tinfo 0xb06836b0)
06-06 00:59:46.618 D/EGL_emulation( 1712): eglMakeCurrent: 0xb0685360: ver 2 0 (tinfo 0xb06836c0)
06-06 00:59:46.633 D/EGL_emulation( 1712): eglMakeCurrent: 0xb0685360: ver 2 0 (tinfo 0xb06836c0)
06-06 00:59:46.651 D/EGL_emulation( 1712): eglMakeCurrent: 0xb0685360: ver 2 0 (tinfo 0xb06836c0)
06-06 00:59:46.656 D/AndroidRuntime(24039): >>>>>> START com.android.internal.os.RuntimeInit uid 2000 <<<<<<
06-06 00:59:46.657 D/AndroidRuntime(24039): CheckJNI is ON
06-06 00:59:46.667 D/EGL_emulation( 1712): eglMakeCurrent: 0xb0685360: ver 2 0 (tinfo 0xb06836c0)
06-06 00:59:46.669 D/EGL_emulation( 1712): eglMakeCurrent: 0xb0685360: ver 2 0 (tinfo 0xb06836c0)
06-06 00:59:46.672 W/art     (24039): Unexpected CPU variant for X86 using defaults: x86
06-06 00:59:46.675 D/ICU     (24039): No timezone override file found: /data/misc/zoneinfo/current/icu/icu_tzdata.dat
06-06 00:59:46.684 D/EGL_emulation( 1712): eglMakeCurrent: 0xb0685360: ver 2 0 (tinfo 0xb06836c0)
06-06 00:59:46.686 E/memtrack(24039): Couldn't load memtrack module (No such file or directory)
06-06 00:59:46.686 E/android.os.Debug(24039): failed to load memtrack module: -2
06-06 00:59:46.686 I/Radio-JNI(24039): register_android_hardware_Radio DONE
06-06 00:59:46.687 D/EGL_emulation( 1712): eglMakeCurrent: 0xb0685360: ver 2 0 (tinfo 0xb06836c0)
06-06 00:59:46.693 D/AndroidRuntime(24039): Calling main entry com.android.commands.am.Am
06-06 00:59:46.695 I/ActivityManager( 1631): Force stopping com.evancharlton.mileage appid=10374 user=0: start instr
06-06 00:59:46.695 I/ActivityManager( 1631): Killing 23987:com.evancharlton.mileage/u0a374 (adj 0): stop com.evancharlton.mileage
06-06 00:59:46.695 D/ActivityManager( 1631): cleanUpApplicationRecord -- 23987
06-06 00:59:46.695 I/WindowManager( 1631): Destroying surface Surface(name=com.evancharlton.mileage/com.evancharlton.mileage.charts.SouthChart) called by com.android.server.wm.WindowStateAnimator.destroySurface:2016 com.android.server.wm.WindowStateAnimator.destroySurfaceLocked:882 com.android.server.wm.WindowState.removeLocked:1456 com.android.server.wm.WindowManagerService.removeWindowInnerLocked:2484 com.android.server.wm.WindowManagerService.removeWindowLocked:2442 com.android.server.wm.WindowManagerService.removeWindowLocked:2311 com.android.server.wm.AppWindowToken.removeAllWindows:530 com.android.server.wm.AppWindowToken.removeAppFromTaskLocked:326 
06-06 00:59:46.697 W/ActivityManager( 1631): Crash of app com.evancharlton.mileage running instrumentation ComponentInfo{com.evancharlton.mileage.test/sh.calaba.instrumentationbackend.CalabashInstrumentationTestRunner}
06-06 00:59:46.698 I/ActivityManager( 1631): Force stopping com.evancharlton.mileage appid=10374 user=0: finished inst
06-06 00:59:46.700 D/EGL_emulation( 1712): eglMakeCurrent: 0xb0685360: ver 2 0 (tinfo 0xb06836c0)
06-06 00:59:46.702 D/EGL_emulation( 1712): eglMakeCurrent: 0xb0685360: ver 2 0 (tinfo 0xb06836c0)
06-06 00:59:46.704 I/art     ( 1393): Starting a blocking GC HeapTrim
06-06 00:59:46.708 I/art     (24049): Not late-enabling -Xcheck:jni (already on)
06-06 00:59:46.708 W/art     (24049): Unexpected CPU variant for X86 using defaults: x86
06-06 00:59:46.708 I/ActivityManager( 1631): Start proc 24049:com.evancharlton.mileage/u0a374 for added application com.evancharlton.mileage
06-06 00:59:46.708 D/AndroidRuntime(24039): Shutting down VM
06-06 00:59:46.717 D/EGL_emulation( 1712): eglMakeCurrent: 0xb0685360: ver 2 0 (tinfo 0xb06836c0)
06-06 00:59:46.718 W/System  (24049): ClassLoader referenced unknown path: /data/app/com.evancharlton.mileage.test-1/lib/x86
06-06 00:59:46.718 W/System  (24049): ClassLoader referenced unknown path: /data/app/com.evancharlton.mileage-1/lib/x86
06-06 00:59:46.719 D/EGL_emulation( 1712): eglMakeCurrent: 0xb0685360: ver 2 0 (tinfo 0xb06836c0)
06-06 00:59:46.721 W/System  (24049): ClassLoader referenced unknown path: 
06-06 00:59:46.725 I/System.out(24049): Main activity name automatically set to: com.evancharlton.mileage.Mileage
06-06 00:59:46.726 I/System.out(24049): Calabash did not load Mono. This is only a problem if you are trying to test a Mono application
06-06 00:59:46.726 I/calabash(24049): Test server port: 7102
06-06 00:59:46.726 I/InstrumentationBackend(24049): Added:'GetPreferences', with key:'get_preferences'
06-06 00:59:46.730 I/InstrumentationBackend(24049): Added:'SetPreferences', with key:'set_preferences'
06-06 00:59:46.731 I/InstrumentationBackend(24049): Added:'ClearPreferences', with key:'clear_preferences'
06-06 00:59:46.731 I/InstrumentationBackend(24049): Added:'PressElement', with key:'press_l10n_element'
06-06 00:59:46.731 I/InstrumentationBackend(24049): Added:'WaitForElement', with key:'wait_for_l10n_element'
06-06 00:59:46.731 I/InstrumentationBackend(24049): Added:'NullAction', with key:'nullAction'
06-06 00:59:46.731 I/InstrumentationBackend(24049): Added:'PressKey', with key:'press_key'
06-06 00:59:46.731 I/InstrumentationBackend(24049): Added:'SetActivityOrientation', with key:'set_activity_orientation'
06-06 00:59:46.731 I/InstrumentationBackend(24049): Added:'GetActivityOrientation', with key:'get_activity_orientation'
06-06 00:59:46.731 I/InstrumentationBackend(24049): Added:'FakeGPSLocation', with key:'set_gps_coordinates'
06-06 00:59:46.731 I/InstrumentationBackend(24049): Added:'SetPropertyByCssSelector', with key:'set_property_by_css_selector'
06-06 00:59:46.731 I/InstrumentationBackend(24049): Added:'GetUrl', with key:'get_url'
06-06 00:59:46.731 I/InstrumentationBackend(24049): Added:'ScrollTo', with key:'scroll_to'
06-06 00:59:46.732 I/InstrumentationBackend(24049): Added:'GetLoadProgress', with key:'get_load_progress'
06-06 00:59:46.732 I/InstrumentationBackend(24049): Added:'DumpHtml', with key:'dump_html'
06-06 00:59:46.732 I/InstrumentationBackend(24049): Added:'DumpBodyHtml', with key:'dump_body_html'
06-06 00:59:46.732 I/InstrumentationBackend(24049): Added:'EnterTextByCssSelector', with key:'enter_text_by_selector'
06-06 00:59:46.732 I/InstrumentationBackend(24049): Added:'AndroidSDKVersion', with key:'android_sdk_version'
06-06 00:59:46.732 I/InstrumentationBackend(24049): Added:'Version', with key:'version'
06-06 00:59:46.732 I/InstrumentationBackend(24049): Added:'Drag', with key:'drag'
06-06 00:59:46.732 I/InstrumentationBackend(24049): Added:'TouchCoordinates', with key:'touch_coordinate'
06-06 00:59:46.732 I/InstrumentationBackend(24049): Added:'LongPressCoordinate', with key:'long_press_coordinate'
06-06 00:59:46.732 I/InstrumentationBackend(24049): Added:'DragCoordinates', with key:'drag_coordinates'
06-06 00:59:46.732 I/InstrumentationBackend(24049): Added:'ResumeApplication', with key:'resume_application'
06-06 00:59:46.732 I/InstrumentationBackend(24049): Added:'Swipe', with key:'swipe'
06-06 00:59:46.732 I/InstrumentationBackend(24049): Added:'DoubleTapCoordinate', with key:'double_tap_coordinate'
06-06 00:59:46.732 I/InstrumentationBackend(24049): Added:'ClickOnScreen', with key:'click_on_screen'
06-06 00:59:46.732 I/InstrumentationBackend(24049): Added:'GetActivityName', with key:'get_activity_name'
06-06 00:59:46.732 I/InstrumentationBackend(24049): Added:'ScrollToView', with key:'scroll_to_view'
06-06 00:59:46.732 I/InstrumentationBackend(24049): Added:'ViewConfiguration', with key:'view_configuration'
06-06 00:59:46.733 I/InstrumentationBackend(24049): Added:'IsCurrentActivityFocused', with key:'is_current_activity_focused'
06-06 00:59:46.733 I/InstrumentationBackend(24049): Added:'SendTcp', with key:'send_tcp'
06-06 00:59:46.733 I/InstrumentationBackend(24049): Added:'DpToDevicePixel', with key:'dp_to_device_pixel'
06-06 00:59:46.733 I/InstrumentationBackend(24049): Added:'KeyboardEnterText', with key:'keyboard_enter_text'
06-06 00:59:46.733 I/InstrumentationBackend(24049): Added:'DeleteSurroundingText', with key:'delete_surrounding_text'
06-06 00:59:46.733 I/InstrumentationBackend(24049): Added:'SetComposingRegion', with key:'set_composing_region'
06-06 00:59:46.733 I/InstrumentationBackend(24049): Added:'SetSelection', with key:'set_selection'
06-06 00:59:46.733 I/InstrumentationBackend(24049): Added:'KeyboardKeyEvent', with key:'keyboard_key_event'
06-06 00:59:46.733 I/InstrumentationBackend(24049): Added:'PressUserActionButton', with key:'press_user_action_button'
06-06 00:59:46.733 D/EGL_emulation( 1712): eglMakeCurrent: 0xb0685360: ver 2 0 (tinfo 0xb06836c0)
06-06 00:59:46.733 W/InputDispatcher( 1631): channel 'f1e8f20 com.evancharlton.mileage/com.evancharlton.mileage.Mileage (server)' ~ Consumer closed input channel or an error occurred.  events=0x9
06-06 00:59:46.733 E/InputDispatcher( 1631): channel 'f1e8f20 com.evancharlton.mileage/com.evancharlton.mileage.Mileage (server)' ~ Channel is unrecoverably broken and will be disposed!
06-06 00:59:46.734 I/WindowManager( 1631): WIN DEATH: Window{f1e8f20 u0 com.evancharlton.mileage/com.evancharlton.mileage.Mileage EXITING}
06-06 00:59:46.734 W/InputDispatcher( 1631): Attempted to unregister already unregistered input channel 'f1e8f20 com.evancharlton.mileage/com.evancharlton.mileage.Mileage (server)'
06-06 00:59:46.735 I/InstrumentationBackend(24049): Added:'HideSoftKeyboard', with key:'hide_soft_keyboard'
06-06 00:59:46.735 I/InstrumentationBackend(24049): Added:'ListActions', with key:'list_actions'
06-06 00:59:46.735 I/calabash(24049): Instantiating http server at 7102
06-06 00:59:46.735 I/System.out(24049): HTTP Daemon listening on: 7102
06-06 00:59:46.747 D/EGL_emulation( 1712): eglMakeCurrent: 0xb0685360: ver 2 0 (tinfo 0xb06836c0)
06-06 00:59:46.750 D/EGL_emulation( 1712): eglMakeCurrent: 0xb0685360: ver 2 0 (tinfo 0xb06836c0)
06-06 00:59:46.751 D/EGL_emulation( 1712): eglMakeCurrent: 0xb0685360: ver 2 0 (tinfo 0xb06836c0)
06-06 00:59:46.767 D/EGL_emulation( 1712): eglMakeCurrent: 0xb0685360: ver 2 0 (tinfo 0xb06836c0)
06-06 00:59:46.768 D/EGL_emulation( 1712): eglMakeCurrent: 0xb0685360: ver 2 0 (tinfo 0xb06836c0)
06-06 00:59:46.783 D/EGL_emulation( 1712): eglMakeCurrent: 0xb0685360: ver 2 0 (tinfo 0xb06836c0)
06-06 00:59:46.787 D/EGL_emulation( 1712): eglMakeCurrent: 0xb0685360: ver 2 0 (tinfo 0xb06836c0)
06-06 00:59:46.800 D/EGL_emulation( 1712): eglMakeCurrent: 0xb0685360: ver 2 0 (tinfo 0xb06836c0)
06-06 00:59:46.801 D/EGL_emulation( 1712): eglMakeCurrent: 0xb0685360: ver 2 0 (tinfo 0xb06836c0)
06-06 00:59:46.817 D/EGL_emulation( 1712): eglMakeCurrent: 0xb0685360: ver 2 0 (tinfo 0xb06836c0)
06-06 00:59:46.818 D/EGL_emulation( 1712): eglMakeCurrent: 0xb0685360: ver 2 0 (tinfo 0xb06836c0)
06-06 00:59:46.818 I/System.out(24049): URI: //ping
06-06 00:59:46.819 I/System.out(24049): params: {json={}
06-06 00:59:46.819 I/System.out(24049): }
06-06 00:59:46.821 I/System.out(24049): URI: //ping
06-06 00:59:46.821 I/System.out(24049): params: {json={}
06-06 00:59:46.821 I/System.out(24049): }
06-06 00:59:46.823 I/System.out(24049): URI: //ready
06-06 00:59:46.823 I/System.out(24049): params: {json={}
06-06 00:59:46.823 I/System.out(24049): }
06-06 00:59:46.826 I/System.out(24049): URI: //
06-06 00:59:46.826 I/System.out(24049): params: {json={"command":"version","arguments":[]}
06-06 00:59:46.826 I/System.out(24049): }
06-06 00:59:46.826 I/System.out(24049): header: {content-type=application/json;charset=utf-8, date=Sat, 06 Jun 2020 05:59:47 GMT, accept=*/*, host=127.0.0.1:34777, content-length=36, user-agent=HTTPClient/1.0 (2.8.3, ruby 2.5.1 (2018-03-29))}
06-06 00:59:46.826 I/System.out(24049): params: {json={"command":"version","arguments":[]}
06-06 00:59:46.826 I/System.out(24049): }
06-06 00:59:46.826 I/System.out(24049): ProP json = {"command":"version","arguments":[]}
06-06 00:59:46.826 I/System.out(24049): files: {}
06-06 00:59:46.826 I/System.out(24049): command: {"command":"version","arguments":[]}
06-06 00:59:46.829 I/InstrumentationBackend(24049): Got command:'Command:'Line:null,version', arguments:'[]'
06-06 00:59:46.834 D/EGL_emulation( 1712): eglMakeCurrent: 0xb0685360: ver 2 0 (tinfo 0xb06836c0)
06-06 00:59:46.836 I/System.out(24049): result:{"bonusInformation":[],"message":"0.9.8","success":true}
06-06 00:59:46.839 I/System.out(24049): URI: //start-application
06-06 00:59:46.839 I/System.out(24049): params: {json={"intent":null}
06-06 00:59:46.839 I/System.out(24049): }
06-06 00:59:46.848 I/ActivityManager( 1631): START u0 {act=android.intent.action.MAIN cat=[android.intent.category.LAUNCHER] flg=0x10200000 cmp=com.evancharlton.mileage/.Mileage} from uid 10374 on display 0
06-06 00:59:46.850 D/EGL_emulation( 1712): eglMakeCurrent: 0xb0685360: ver 2 0 (tinfo 0xb06836c0)
06-06 00:59:46.851 D/EGL_emulation( 1712): eglMakeCurrent: 0xb0685360: ver 2 0 (tinfo 0xb06836c0)
06-06 00:59:46.854 I/calabash(24049): newActivity1
06-06 00:59:46.863 I/calabash(24049): newActivity1
06-06 00:59:46.864 W/ActivityManager( 1631): Bad activity token: android.os.BinderProxy@953dbc8
06-06 00:59:46.864 W/ActivityManager( 1631): java.lang.ClassCastException: android.os.BinderProxy cannot be cast to com.android.server.am.ActivityRecord$Token
06-06 00:59:46.864 W/ActivityManager( 1631): 	at com.android.server.am.ActivityRecord.forTokenLocked(ActivityRecord.java:586)
06-06 00:59:46.864 W/ActivityManager( 1631): 	at com.android.server.am.ActivityRecord.isInStackLocked(ActivityRecord.java:1327)
06-06 00:59:46.864 W/ActivityManager( 1631): 	at com.android.server.am.ActivityRecord.getStackLocked(ActivityRecord.java:1332)
06-06 00:59:46.864 W/ActivityManager( 1631): 	at com.android.server.am.ActivityManagerService.getActivityDisplayId(ActivityManagerService.java:9806)
06-06 00:59:46.864 W/ActivityManager( 1631): 	at android.app.ActivityManagerNative.onTransact(ActivityManagerNative.java:2566)
06-06 00:59:46.864 W/ActivityManager( 1631): 	at com.android.server.am.ActivityManagerService.onTransact(ActivityManagerService.java:2757)
06-06 00:59:46.864 W/ActivityManager( 1631): 	at android.os.Binder.execTransact(Binder.java:565)
06-06 00:59:46.865 W/ActivityManager( 1631): Bad activity token: android.os.BinderProxy@953dbc8
06-06 00:59:46.865 W/ActivityManager( 1631): java.lang.ClassCastException: android.os.BinderProxy cannot be cast to com.android.server.am.ActivityRecord$Token
06-06 00:59:46.865 W/ActivityManager( 1631): 	at com.android.server.am.ActivityRecord.forTokenLocked(ActivityRecord.java:586)
06-06 00:59:46.865 W/ActivityManager( 1631): 	at com.android.server.am.ActivityRecord.isInStackLocked(ActivityRecord.java:1327)
06-06 00:59:46.865 W/ActivityManager( 1631): 	at com.android.server.am.ActivityManagerService.setTaskDescription(ActivityManagerService.java:9358)
06-06 00:59:46.865 W/ActivityManager( 1631): 	at android.app.ActivityManagerNative.onTransact(ActivityManagerNative.java:2639)
06-06 00:59:46.865 W/ActivityManager( 1631): 	at com.android.server.am.ActivityManagerService.onTransact(ActivityManagerService.java:2757)
06-06 00:59:46.865 W/ActivityManager( 1631): 	at android.os.Binder.execTransact(Binder.java:565)
06-06 00:59:46.865 W/ActivityManager( 1631): Bad activity token: android.os.BinderProxy@953dbc8
06-06 00:59:46.865 W/ActivityManager( 1631): java.lang.ClassCastException: android.os.BinderProxy cannot be cast to com.android.server.am.ActivityRecord$Token
06-06 00:59:46.865 W/ActivityManager( 1631): 	at com.android.server.am.ActivityRecord.forTokenLocked(ActivityRecord.java:586)
06-06 00:59:46.865 W/ActivityManager( 1631): 	at com.android.server.am.ActivityRecord.isInStackLocked(ActivityRecord.java:1327)
06-06 00:59:46.865 W/ActivityManager( 1631): 	at com.android.server.am.ActivityRecord.getStackLocked(ActivityRecord.java:1332)
06-06 00:59:46.865 W/ActivityManager( 1631): 	at com.android.server.am.ActivityManagerService.getActivityStackId(ActivityManagerService.java:9817)
06-06 00:59:46.865 W/ActivityManager( 1631): 	at android.app.ActivityManagerNative.onTransact(ActivityManagerNative.java:2856)
06-06 00:59:46.865 W/ActivityManager( 1631): 	at com.android.server.am.ActivityManagerService.onTransact(ActivityManagerService.java:2757)
06-06 00:59:46.865 W/ActivityManager( 1631): 	at android.os.Binder.execTransact(Binder.java:565)
06-06 00:59:46.867 D/gralloc_ranchu( 1347): gralloc_alloc: Creating ashmem region of size 9023488
06-06 00:59:46.889 W/ActivityManager( 1631): Bad activity token: android.os.BinderProxy@953dbc8
06-06 00:59:46.889 W/ActivityManager( 1631): java.lang.ClassCastException: android.os.BinderProxy cannot be cast to com.android.server.am.ActivityRecord$Token
06-06 00:59:46.889 W/ActivityManager( 1631): 	at com.android.server.am.ActivityRecord.forTokenLocked(ActivityRecord.java:586)
06-06 00:59:46.889 W/ActivityManager( 1631): 	at com.android.server.am.ActivityRecord.isInStackLocked(ActivityRecord.java:1327)
06-06 00:59:46.889 W/ActivityManager( 1631): 	at com.android.server.am.ActivityManagerService.getActivityOptions(ActivityManagerService.java:12559)
06-06 00:59:46.889 W/ActivityManager( 1631): 	at android.app.ActivityManagerNative.onTransact(ActivityManagerNative.java:1933)
06-06 00:59:46.889 W/ActivityManager( 1631): 	at com.android.server.am.ActivityManagerService.onTransact(ActivityManagerService.java:2757)
06-06 00:59:46.889 W/ActivityManager( 1631): 	at android.os.Binder.execTransact(Binder.java:565)
06-06 00:59:46.890 W/ActivityManager( 1631): Bad activity token: android.os.BinderProxy@953dbc8
06-06 00:59:46.890 W/ActivityManager( 1631): java.lang.ClassCastException: android.os.BinderProxy cannot be cast to com.android.server.am.ActivityRecord$Token
06-06 00:59:46.890 W/ActivityManager( 1631): 	at com.android.server.am.ActivityRecord.forTokenLocked(ActivityRecord.java:586)
06-06 00:59:46.890 W/ActivityManager( 1631): 	at com.android.server.am.ActivityRecord.isInStackLocked(ActivityRecord.java:1327)
06-06 00:59:46.890 W/ActivityManager( 1631): 	at com.android.server.am.ActivityManagerService.getActivityOptions(ActivityManagerService.java:12559)
06-06 00:59:46.890 W/ActivityManager( 1631): 	at android.app.ActivityManagerNative.onTransact(ActivityManagerNative.java:1933)
06-06 00:59:46.890 W/ActivityManager( 1631): 	at com.android.server.am.ActivityManagerService.onTransact(ActivityManagerService.java:2757)
06-06 00:59:46.890 W/ActivityManager( 1631): 	at android.os.Binder.execTransact(Binder.java:565)
06-06 00:59:46.895 V/PhoneStatusBar( 1712): setLightsOn(true)
06-06 00:59:46.900 D/EGL_emulation( 2076): eglMakeCurrent: 0xb0685360: ver 2 0 (tinfo 0xb06836b0)
06-06 00:59:46.902 D/EGL_emulation( 1712): eglMakeCurrent: 0xb0685360: ver 2 0 (tinfo 0xb06836c0)
06-06 00:59:46.902 V/PhoneStatusBar( 1712): setLightsOn(true)
06-06 00:59:46.917 D/EGL_emulation( 1712): eglMakeCurrent: 0xb0685360: ver 2 0 (tinfo 0xb06836c0)
06-06 00:59:46.918 D/EGL_emulation( 1712): eglMakeCurrent: 0xb0685360: ver 2 0 (tinfo 0xb06836c0)
06-06 00:59:46.919 V/PhoneStatusBar( 1712): setLightsOn(true)
06-06 00:59:46.933 D/gralloc_ranchu( 1347): gralloc_alloc: Creating ashmem region of size 9023488
06-06 00:59:46.933 D/EGL_emulation( 1712): eglMakeCurrent: 0xb0685360: ver 2 0 (tinfo 0xb06836c0)
06-06 00:59:46.940 D/        (24049): HostConnection::get() New Host Connection established 0xa2f6e080, tid 24049
06-06 00:59:46.941 D/EGL_emulation( 1712): eglMakeCurrent: 0xb0685360: ver 2 0 (tinfo 0xb06836c0)
06-06 00:59:46.941 V/PhoneStatusBar( 1712): setLightsOn(true)
06-06 00:59:47.006 D/EGL_emulation( 1712): eglMakeCurrent: 0xb0685360: ver 2 0 (tinfo 0xb06836c0)
06-06 00:59:47.011 D/EGL_emulation( 1712): eglMakeCurrent: 0xb0685360: ver 2 0 (tinfo 0xb06836c0)
06-06 00:59:47.013 D/EGL_emulation( 1712): eglMakeCurrent: 0xb0685360: ver 2 0 (tinfo 0xb06836c0)
06-06 00:59:47.017 D/EGL_emulation( 1712): eglMakeCurrent: 0xb0685360: ver 2 0 (tinfo 0xb06836c0)
06-06 00:59:47.020 D/EGL_emulation( 1712): eglMakeCurrent: 0xb0685360: ver 2 0 (tinfo 0xb06836c0)
06-06 00:59:47.034 D/EGL_emulation( 1712): eglMakeCurrent: 0xb0685360: ver 2 0 (tinfo 0xb06836c0)
06-06 00:59:47.035 D/EGL_emulation( 1712): eglMakeCurrent: 0xb0685360: ver 2 0 (tinfo 0xb06836c0)
06-06 00:59:47.050 D/EGL_emulation( 1712): eglMakeCurrent: 0xb0685360: ver 2 0 (tinfo 0xb06836c0)
06-06 00:59:47.050 D/gralloc_ranchu( 1347): gralloc_alloc: Creating ashmem region of size 9023488
06-06 00:59:47.050 I/ActivityManager( 1631): Displayed com.evancharlton.mileage/.Mileage: +198ms
06-06 00:59:47.052 I/WindowManager( 1631): Destroying surface Surface(name=com.evancharlton.mileage/com.evancharlton.mileage.Mileage) called by com.android.server.wm.WindowStateAnimator.destroySurface:2016 com.android.server.wm.WindowStateAnimator.destroySurfaceLocked:882 com.android.server.wm.WindowState.removeLocked:1456 com.android.server.wm.WindowManagerService.removeWindowInnerLocked:2484 com.android.server.wm.AppWindowToken.destroySurfaces:365 com.android.server.wm.WindowStateAnimator.finishExit:565 com.android.server.wm.AppWindowAnimator.stepAnimationLocked:427 com.android.server.wm.WindowAnimator.updateAppWindowsLocked:196 
06-06 00:59:47.064 D/EGL_emulation( 1712): eglMakeCurrent: 0xb0685360: ver 2 0 (tinfo 0xb06836c0)
06-06 00:59:47.070 D/EGL_emulation( 1712): eglMakeCurrent: 0xb0685360: ver 2 0 (tinfo 0xb06836c0)
06-06 00:59:47.082 D/EGL_emulation( 1712): eglMakeCurrent: 0xb0685360: ver 2 0 (tinfo 0xb06836c0)
06-06 00:59:47.086 D/EGL_emulation( 1712): eglMakeCurrent: 0xb0685360: ver 2 0 (tinfo 0xb06836c0)
06-06 00:59:47.086 V/PhoneStatusBar( 1712): setLightsOn(true)
06-06 00:59:47.087 D/EGL_emulation( 1712): eglMakeCurrent: 0xb0685360: ver 2 0 (tinfo 0xb06836c0)
06-06 00:59:47.100 D/EGL_emulation( 1712): eglMakeCurrent: 0xb0685360: ver 2 0 (tinfo 0xb06836c0)
06-06 00:59:47.101 D/EGL_emulation( 1712): eglMakeCurrent: 0xb0685360: ver 2 0 (tinfo 0xb06836c0)
06-06 00:59:47.106 I/System.out(24049): URI: //map
06-06 00:59:47.106 I/System.out(24049): params: {json={"query":"* marked:'Statistics'","operation":{"method_name":"query","arguments":[]}}
06-06 00:59:47.106 I/System.out(24049): }
06-06 00:59:47.116 D/EGL_emulation( 1712): eglMakeCurrent: 0xb0685360: ver 2 0 (tinfo 0xb06836c0)
06-06 00:59:47.118 D/EGL_emulation( 1712): eglMakeCurrent: 0xb0685360: ver 2 0 (tinfo 0xb06836c0)
06-06 00:59:47.119 W/ResourceType(24049): No package identifier when getting name for resource number 0x00000001
06-06 00:59:47.132 I/System.out(24049): URI: //gesture
06-06 00:59:47.134 I/System.out(24049): params: {json={"query_timeout":5.0,"gestures":[{"query_string":"* marked:'Statistics'","touches":[{"x":50,"y":50,"offset_x":0,"offset_y":0,"wait":0.0,"time":0.2,"release":true,"query_string":null}]}]}
06-06 00:59:47.134 I/System.out(24049): }
06-06 00:59:47.138 W/ResourceType(24049): No package identifier when getting name for resource number 0x00000001
06-06 00:59:47.200 V/PhoneStatusBar( 1712): setLightsOn(true)
06-06 00:59:47.250 I/WindowManager( 1631): Destroying surface Surface(name=Starting com.evancharlton.mileage) called by com.android.server.wm.WindowStateAnimator.destroySurface:2016 com.android.server.wm.WindowStateAnimator.destroySurfaceLocked:882 com.android.server.wm.WindowState.destroyOrSaveSurface:2100 com.android.server.wm.AppWindowToken.destroySurfaces:363 com.android.server.wm.WindowStateAnimator.finishExit:565 com.android.server.wm.WindowStateAnimator.stepAnimationLocked:491 com.android.server.wm.WindowAnimator.updateWindowsLocked:303 com.android.server.wm.WindowAnimator.animateLocked:704 
06-06 00:59:47.251 V/PhoneStatusBar( 1712): setLightsOn(true)
06-06 00:59:47.284 V/PhoneStatusBar( 1712): setLightsOn(true)
06-06 00:59:47.352 V/PhoneStatusBar( 1712): setLightsOn(true)
06-06 00:59:47.370 I/calabash(24049): newActivity1
06-06 00:59:47.384 I/System.out(24049): URI: //map
06-06 00:59:47.384 I/System.out(24049): params: {json={"query":"android.widget.ScrollView index:0","operation":{"method_name":"query","arguments":[]}}
06-06 00:59:47.384 I/System.out(24049): }
06-06 00:59:47.388 W/ActivityManager( 1631): Bad activity token: android.os.BinderProxy@c8fe236
06-06 00:59:47.388 W/ActivityManager( 1631): java.lang.ClassCastException: android.os.BinderProxy cannot be cast to com.android.server.am.ActivityRecord$Token
06-06 00:59:47.388 W/ActivityManager( 1631): 	at com.android.server.am.ActivityRecord.forTokenLocked(ActivityRecord.java:586)
06-06 00:59:47.388 W/ActivityManager( 1631): 	at com.android.server.am.ActivityRecord.isInStackLocked(ActivityRecord.java:1327)
06-06 00:59:47.388 W/ActivityManager( 1631): 	at com.android.server.am.ActivityRecord.getStackLocked(ActivityRecord.java:1332)
06-06 00:59:47.388 W/ActivityManager( 1631): 	at com.android.server.am.ActivityManagerService.getActivityDisplayId(ActivityManagerService.java:9806)
06-06 00:59:47.388 W/ActivityManager( 1631): 	at android.app.ActivityManagerNative.onTransact(ActivityManagerNative.java:2566)
06-06 00:59:47.388 W/ActivityManager( 1631): 	at com.android.server.am.ActivityManagerService.onTransact(ActivityManagerService.java:2757)
06-06 00:59:47.388 W/ActivityManager( 1631): 	at android.os.Binder.execTransact(Binder.java:565)
06-06 00:59:47.389 W/ActivityManager( 1631): Bad activity token: android.os.BinderProxy@c8fe236
06-06 00:59:47.389 W/ActivityManager( 1631): java.lang.ClassCastException: android.os.BinderProxy cannot be cast to com.android.server.am.ActivityRecord$Token
06-06 00:59:47.389 W/ActivityManager( 1631): 	at com.android.server.am.ActivityRecord.forTokenLocked(ActivityRecord.java:586)
06-06 00:59:47.389 W/ActivityManager( 1631): 	at com.android.server.am.ActivityRecord.isInStackLocked(ActivityRecord.java:1327)
06-06 00:59:47.389 W/ActivityManager( 1631): 	at com.android.server.am.ActivityManagerService.setTaskDescription(ActivityManagerService.java:9358)
06-06 00:59:47.389 W/ActivityManager( 1631): 	at android.app.ActivityManagerNative.onTransact(ActivityManagerNative.java:2639)
06-06 00:59:47.389 W/ActivityManager( 1631): 	at com.android.server.am.ActivityManagerService.onTransact(ActivityManagerService.java:2757)
06-06 00:59:47.389 W/ActivityManager( 1631): 	at android.os.Binder.execTransact(Binder.java:565)
06-06 00:59:47.389 W/ActivityManager( 1631): Bad activity token: android.os.BinderProxy@c8fe236
06-06 00:59:47.389 W/ActivityManager( 1631): java.lang.ClassCastException: android.os.BinderProxy cannot be cast to com.android.server.am.ActivityRecord$Token
06-06 00:59:47.389 W/ActivityManager( 1631): 	at com.android.server.am.ActivityRecord.forTokenLocked(ActivityRecord.java:586)
06-06 00:59:47.389 W/ActivityManager( 1631): 	at com.android.server.am.ActivityRecord.isInStackLocked(ActivityRecord.java:1327)
06-06 00:59:47.389 W/ActivityManager( 1631): 	at com.android.server.am.ActivityRecord.getStackLocked(ActivityRecord.java:1332)
06-06 00:59:47.389 W/ActivityManager( 1631): 	at com.android.server.am.ActivityManagerService.getActivityStackId(ActivityManagerService.java:9817)
06-06 00:59:47.389 W/ActivityManager( 1631): 	at android.app.ActivityManagerNative.onTransact(ActivityManagerNative.java:2856)
06-06 00:59:47.389 W/ActivityManager( 1631): 	at com.android.server.am.ActivityManagerService.onTransact(ActivityManagerService.java:2757)
06-06 00:59:47.389 W/ActivityManager( 1631): 	at android.os.Binder.execTransact(Binder.java:565)
06-06 00:59:47.394 D/VehicleStatisticsActivity(24049): Checking recalculation ...
06-06 00:59:47.395 D/VehicleStatisticsActivity(24049): Recalculation not necessary.
06-06 00:59:47.401 W/ActivityManager( 1631): Bad activity token: android.os.BinderProxy@c8fe236
06-06 00:59:47.401 W/ActivityManager( 1631): java.lang.ClassCastException: android.os.BinderProxy cannot be cast to com.android.server.am.ActivityRecord$Token
06-06 00:59:47.401 W/ActivityManager( 1631): 	at com.android.server.am.ActivityRecord.forTokenLocked(ActivityRecord.java:586)
06-06 00:59:47.401 W/ActivityManager( 1631): 	at com.android.server.am.ActivityRecord.isInStackLocked(ActivityRecord.java:1327)
06-06 00:59:47.401 W/ActivityManager( 1631): 	at com.android.server.am.ActivityManagerService.getActivityOptions(ActivityManagerService.java:12559)
06-06 00:59:47.401 W/ActivityManager( 1631): 	at android.app.ActivityManagerNative.onTransact(ActivityManagerNative.java:1933)
06-06 00:59:47.401 W/ActivityManager( 1631): 	at com.android.server.am.ActivityManagerService.onTransact(ActivityManagerService.java:2757)
06-06 00:59:47.401 W/ActivityManager( 1631): 	at android.os.Binder.execTransact(Binder.java:565)
06-06 00:59:47.402 W/ActivityManager( 1631): Bad activity token: android.os.BinderProxy@c8fe236
06-06 00:59:47.402 W/ActivityManager( 1631): java.lang.ClassCastException: android.os.BinderProxy cannot be cast to com.android.server.am.ActivityRecord$Token
06-06 00:59:47.402 W/ActivityManager( 1631): 	at com.android.server.am.ActivityRecord.forTokenLocked(ActivityRecord.java:586)
06-06 00:59:47.402 W/ActivityManager( 1631): 	at com.android.server.am.ActivityRecord.isInStackLocked(ActivityRecord.java:1327)
06-06 00:59:47.402 W/ActivityManager( 1631): 	at com.android.server.am.ActivityManagerService.getActivityOptions(ActivityManagerService.java:12559)
06-06 00:59:47.402 W/ActivityManager( 1631): 	at android.app.ActivityManagerNative.onTransact(ActivityManagerNative.java:1933)
06-06 00:59:47.402 W/ActivityManager( 1631): 	at com.android.server.am.ActivityManagerService.onTransact(ActivityManagerService.java:2757)
06-06 00:59:47.402 W/ActivityManager( 1631): 	at android.os.Binder.execTransact(Binder.java:565)
06-06 00:59:47.407 D/VehicleStatisticsActivity(24049): Checking recalculation ...
06-06 00:59:47.410 D/VehicleStatisticsActivity(24049): Recalculation not necessary.
06-06 00:59:47.505 I/System.out(24049): URI: //map
06-06 00:59:47.505 I/System.out(24049): params: {json={"query":"android.widget.AbsListView index:0","operation":{"method_name":"query","arguments":[]}}
06-06 00:59:47.505 I/System.out(24049): }
06-06 00:59:47.511 I/art     (24049): Do partial code cache collection, code=30KB, data=29KB
06-06 00:59:47.511 I/art     (24049): After code cache collection, code=29KB, data=28KB
06-06 00:59:47.511 I/art     (24049): Increasing code cache capacity to 128KB
06-06 00:59:47.523 I/System.out(24049): URI: //map
06-06 00:59:47.523 I/System.out(24049): params: {json={"query":"android.widget.AbsListView index:0","operation":{"method_name":"query","arguments":[]}}
06-06 00:59:47.523 I/System.out(24049): }
06-06 00:59:47.538 I/System.out(24049): URI: //map
06-06 00:59:47.538 I/System.out(24049): params: {json={"query":"android.widget.AbsListView index:0","operation":{"method_name":"query","arguments":[]}}
06-06 00:59:47.538 I/System.out(24049): }
06-06 00:59:47.551 I/System.out(24049): URI: //map
06-06 00:59:47.551 I/System.out(24049): params: {json={"query":"android.widget.AbsListView index:0","operation":{"method_name":"query","arguments":["getFirstVisiblePosition"]}}
06-06 00:59:47.551 I/System.out(24049): }
06-06 00:59:47.564 I/System.out(24049): URI: //map
06-06 00:59:47.564 I/System.out(24049): params: {json={"query":"android.widget.AbsListView index:0","operation":{"method_name":"query","arguments":["getLastVisiblePosition"]}}
06-06 00:59:47.564 I/System.out(24049): }
06-06 00:59:47.576 I/System.out(24049): URI: //map
06-06 00:59:47.576 I/System.out(24049): params: {json={"query":"android.widget.AbsListView index:0","operation":{"method_name":"query","arguments":[{"method_name":"setSelection","arguments":[26]}]}}
06-06 00:59:47.576 I/System.out(24049): }
06-06 00:59:47.593 I/System.out(24049): URI: //map
06-06 00:59:47.593 I/System.out(24049): params: {json={"query":"* marked:'East'","operation":{"method_name":"query","arguments":[]}}
06-06 00:59:47.593 I/System.out(24049): }
06-06 00:59:47.633 V/PhoneStatusBar( 1712): setLightsOn(true)
06-06 00:59:47.634 W/OpenGLRenderer( 2076): Incorrectly called buildLayer on View: ShortcutAndWidgetContainer, destroying layer...
06-06 00:59:47.634 V/PhoneStatusBar( 1712): setLightsOn(true)
06-06 00:59:47.634 D/gralloc_ranchu( 1347): gralloc_alloc: Creating ashmem region of size 9023488
06-06 00:59:47.651 V/PhoneStatusBar( 1712): setLightsOn(true)
06-06 00:59:47.651 I/WindowManager( 1631): Destroying surface Surface(name=com.android.launcher3/com.android.launcher3.Launcher) called by com.android.server.wm.WindowStateAnimator.destroySurface:2016 com.android.server.wm.WindowStateAnimator.destroySurfaceLocked:882 com.android.server.wm.WindowState.destroyOrSaveSurface:2100 com.android.server.wm.AppWindowToken.destroySurfaces:363 com.android.server.wm.AppWindowToken.notifyAppStopped:389 com.android.server.wm.WindowManagerService.notifyAppStopped:4463 com.android.server.am.ActivityStack.activityStoppedLocked:1252 com.android.server.am.ActivityManagerService.activityStopped:6903 
06-06 00:59:47.667 W/ResourceType(24049): No package identifier when getting name for resource number 0x00000001
06-06 00:59:47.678 I/System.out(24049): URI: //gesture
06-06 00:59:47.678 I/System.out(24049): params: {json={"query_timeout":5.0,"gestures":[{"query_string":"* marked:'East'","touches":[{"x":50,"y":50,"offset_x":0,"offset_y":0,"wait":0.0,"time":0.2,"release":true,"query_string":null}]}]}
06-06 00:59:47.678 I/System.out(24049): }
06-06 00:59:47.682 W/ResourceType(24049): No package identifier when getting name for resource number 0x00000001
06-06 00:59:47.917 I/ActivityManager( 1631): START u0 {cmp=com.evancharlton.mileage/.charts.EastChart (has extras)} from uid 10374 on display 0
06-06 00:59:47.918 V/PhoneStatusBar( 1712): setLightsOn(true)
06-06 00:59:47.919 V/PhoneStatusBar( 1712): setLightsOn(true)
06-06 00:59:47.927 I/System.out(24049): URI: //map
06-06 00:59:47.927 I/System.out(24049): params: {json={"query":"* {text CONTAINS[c] 'Farthest east fillup'}","operation":{"method_name":"query","arguments":[]}}
06-06 00:59:47.927 I/System.out(24049): }
06-06 00:59:47.977 I/calabash(24049): newActivity1
06-06 00:59:47.981 W/aiCharts(24049): License file is invalid or missing. 
06-06 00:59:47.981 W/aiCharts(24049): Please place proper license.lic to /assets folder.
06-06 00:59:47.994 V/PhoneStatusBar( 1712): setLightsOn(true)
06-06 00:59:48.016 V/PhoneStatusBar( 1712): setLightsOn(true)
06-06 00:59:48.022 I/WindowManager( 1631): Destroying surface Surface(name=Creating chart…) called by com.android.server.wm.WindowStateAnimator.destroySurface:2016 com.android.server.wm.WindowStateAnimator.destroySurfaceLocked:882 com.android.server.wm.WindowState.removeLocked:1456 com.android.server.wm.WindowManagerService.removeWindowInnerLocked:2484 com.android.server.wm.WindowManagerService.removeWindowLocked:2442 com.android.server.wm.WindowManagerService.removeWindowLocked:2311 com.android.server.wm.WindowManagerService.removeWindow:2306 com.android.server.wm.Session.remove:202 
06-06 00:59:48.025 D/gralloc_ranchu( 1347): gralloc_alloc: Creating ashmem region of size 9023488
06-06 00:59:48.033 V/PhoneStatusBar( 1712): setLightsOn(true)
06-06 00:59:48.057 I/ActivityManager( 1631): Displayed com.evancharlton.mileage/.charts.EastChart: +82ms
06-06 00:59:48.067 V/PhoneStatusBar( 1712): setLightsOn(true)
06-06 00:59:48.101 V/PhoneStatusBar( 1712): setLightsOn(true)
06-06 00:59:48.118 V/PhoneStatusBar( 1712): setLightsOn(true)
06-06 00:59:48.300 V/PhoneStatusBar( 1712): setLightsOn(true)
06-06 00:59:48.310 I/System.out(24049): URI: //map
06-06 00:59:48.310 I/System.out(24049): params: {json={"query":"* {text CONTAINS[c] 'Farthest east fillup'}","operation":{"method_name":"query","arguments":[]}}
06-06 00:59:48.310 I/System.out(24049): }
06-06 00:59:48.326 I/System.out(24049): URI: //
06-06 00:59:48.326 I/System.out(24049): params: {json={"command":"press_key","arguments":["KEYCODE_BACK"]}
06-06 00:59:48.326 I/System.out(24049): }
06-06 00:59:48.326 I/System.out(24049): header: {content-type=application/json;charset=utf-8, date=Sat, 06 Jun 2020 05:59:48 GMT, accept=*/*, host=127.0.0.1:34777, content-length=52, user-agent=HTTPClient/1.0 (2.8.3, ruby 2.5.1 (2018-03-29))}
06-06 00:59:48.326 I/System.out(24049): params: {json={"command":"press_key","arguments":["KEYCODE_BACK"]}
06-06 00:59:48.326 I/System.out(24049): }
06-06 00:59:48.326 I/System.out(24049): ProP json = {"command":"press_key","arguments":["KEYCODE_BACK"]}
06-06 00:59:48.326 I/System.out(24049): files: {}
06-06 00:59:48.326 I/System.out(24049): command: {"command":"press_key","arguments":["KEYCODE_BACK"]}
06-06 00:59:48.327 I/InstrumentationBackend(24049): Got command:'Command:'Line:null,press_key', arguments:'[KEYCODE_BACK]'
06-06 00:59:48.329 V/PhoneStatusBar( 1712): setLightsOn(true)
06-06 00:59:48.332 V/PhoneStatusBar( 1712): setLightsOn(true)
06-06 00:59:48.334 I/art     (24049): Do partial code cache collection, code=60KB, data=62KB
06-06 00:59:48.335 I/System.out(24049): result:{"bonusInformation":[],"message":"","success":true}
06-06 00:59:48.336 I/art     (24049): After code cache collection, code=60KB, data=61KB
06-06 00:59:48.336 I/art     (24049): Increasing code cache capacity to 256KB
06-06 00:59:48.336 D/VehicleStatisticsActivity(24049): Checking recalculation ...
06-06 00:59:48.337 D/VehicleStatisticsActivity(24049): Recalculation not necessary.
06-06 00:59:48.338 I/System.out(24049): URI: //map
06-06 00:59:48.338 I/System.out(24049): params: {json={"query":"* {text CONTAINS[c] 'Statistics'}","operation":{"method_name":"query","arguments":[]}}
06-06 00:59:48.338 I/System.out(24049): }
06-06 00:59:48.350 V/PhoneStatusBar( 1712): setLightsOn(true)
06-06 00:59:48.366 D/gralloc_ranchu( 1347): gralloc_alloc: Creating ashmem region of size 9023488
06-06 00:59:48.367 V/PhoneStatusBar( 1712): setLightsOn(true)
06-06 00:59:48.383 V/PhoneStatusBar( 1712): setLightsOn(true)
06-06 00:59:48.416 V/PhoneStatusBar( 1712): setLightsOn(true)
