--------- beginning of main
06-05 18:34:40.337 V/PhoneStatusBar( 1711): setLightsOn(true)
06-05 18:34:40.339 D/gralloc_ranchu( 1346): gralloc_alloc: Creating ashmem region of size 3145728
06-05 18:34:40.344 E/EGL_emulation( 1346): tid 1346: eglCreateSyncKHR(1901): error 0x3004 (EGL_BAD_ATTRIBUTE)
--------- beginning of system
06-05 18:34:40.355 W/ActivityManager( 1629): Finishing task with all activities already finished
06-05 18:34:40.355 W/ActivityManager( 1629): Duplicate finish request for ActivityRecord{aec58c3 u0 com.evancharlton.mileage/.Mileage t3088 f}
06-05 18:34:40.356 W/ActivityManager( 1629): Finishing task with all activities already finished
06-05 18:34:40.356 W/ActivityManager( 1629): Duplicate finish request for ActivityRecord{aec58c3 u0 com.evancharlton.mileage/.Mileage t3088 f}
06-05 18:34:40.356 W/ActivityManager( 1629): Finishing task with all activities already finished
06-05 18:34:40.356 W/ActivityManager( 1629): Duplicate finish request for ActivityRecord{aec58c3 u0 com.evancharlton.mileage/.Mileage t3088 f}
06-05 18:34:40.356 W/ActivityManager( 1629): Finishing task with all activities already finished
06-05 18:34:40.356 W/ActivityManager( 1629): Duplicate finish request for ActivityRecord{aec58c3 u0 com.evancharlton.mileage/.Mileage t3088 f}
06-05 18:34:40.356 W/ActivityManager( 1629): Finishing task with all activities already finished
06-05 18:34:40.356 W/ActivityManager( 1629): Duplicate finish request for ActivityRecord{aec58c3 u0 com.evancharlton.mileage/.Mileage t3088 f}
06-05 18:34:40.356 W/ActivityManager( 1629): Finishing task with all activities already finished
06-05 18:34:40.356 W/ActivityManager( 1629): Duplicate finish request for ActivityRecord{59cf415 u0 com.evancharlton.mileage/.charts.AveragePriceChart t3088 f}
06-05 18:34:40.356 W/ActivityManager( 1629): Finishing task with all activities already finished
06-05 18:34:40.356 W/ActivityManager( 1629): Duplicate finish request for ActivityRecord{59cf415 u0 com.evancharlton.mileage/.charts.AveragePriceChart t3088 f}
06-05 18:34:40.356 W/ActivityManager( 1629): Finishing task with all activities already finished
06-05 18:34:40.356 W/ActivityManager( 1629): Duplicate finish request for ActivityRecord{aec58c3 u0 com.evancharlton.mileage/.Mileage t3088 f}
06-05 18:34:40.356 W/ActivityManager( 1629): Finishing task with all activities already finished
06-05 18:34:40.356 W/ActivityManager( 1629): Duplicate finish request for ActivityRecord{aec58c3 u0 com.evancharlton.mileage/.Mileage t3088 f}
06-05 18:34:40.388 D/EGL_emulation( 2150): eglMakeCurrent: 0xb4f852a0: ver 2 0 (tinfo 0xb4f832e0)
06-05 18:34:40.389 D/EGL_emulation( 1711): eglMakeCurrent: 0xa5b6bd80: ver 2 0 (tinfo 0xb1367140)
06-05 18:34:40.404 D/EGL_emulation( 1711): eglMakeCurrent: 0xa5b6bd80: ver 2 0 (tinfo 0xb1367140)
06-05 18:34:40.422 D/EGL_emulation( 1711): eglMakeCurrent: 0xa5b6bd80: ver 2 0 (tinfo 0xb1367140)
06-05 18:34:40.435 D/AndroidRuntime( 6216): >>>>>> START com.android.internal.os.RuntimeInit uid 2000 <<<<<<
06-05 18:34:40.436 D/AndroidRuntime( 6216): CheckJNI is ON
06-05 18:34:40.437 D/EGL_emulation( 1711): eglMakeCurrent: 0xa5b6bd80: ver 2 0 (tinfo 0xb1367140)
06-05 18:34:40.439 D/EGL_emulation( 1711): eglMakeCurrent: 0xa5b6bd80: ver 2 0 (tinfo 0xb1367140)
06-05 18:34:40.449 W/art     ( 6216): Unexpected CPU variant for X86 using defaults: x86
06-05 18:34:40.451 D/ICU     ( 6216): No timezone override file found: /data/misc/zoneinfo/current/icu/icu_tzdata.dat
06-05 18:34:40.454 D/EGL_emulation( 1711): eglMakeCurrent: 0xa5b6bd80: ver 2 0 (tinfo 0xb1367140)
06-05 18:34:40.456 D/EGL_emulation( 1711): eglMakeCurrent: 0xa5b6bd80: ver 2 0 (tinfo 0xb1367140)
06-05 18:34:40.459 E/memtrack( 6216): Couldn't load memtrack module (No such file or directory)
06-05 18:34:40.459 E/android.os.Debug( 6216): failed to load memtrack module: -2
06-05 18:34:40.459 I/Radio-JNI( 6216): register_android_hardware_Radio DONE
06-05 18:34:40.465 D/AndroidRuntime( 6216): Calling main entry com.android.commands.am.Am
06-05 18:34:40.466 I/ActivityManager( 1629): Force stopping com.evancharlton.mileage appid=10160 user=0: start instr
06-05 18:34:40.466 I/ActivityManager( 1629): Killing 6165:com.evancharlton.mileage/u0a160 (adj 0): stop com.evancharlton.mileage
06-05 18:34:40.466 D/ActivityManager( 1629): cleanUpApplicationRecord -- 6165
06-05 18:34:40.466 I/WindowManager( 1629): Destroying surface Surface(name=com.evancharlton.mileage/com.evancharlton.mileage.charts.AveragePriceChart) called by com.android.server.wm.WindowStateAnimator.destroySurface:2016 com.android.server.wm.WindowStateAnimator.destroySurfaceLocked:882 com.android.server.wm.WindowState.removeLocked:1456 com.android.server.wm.WindowManagerService.removeWindowInnerLocked:2484 com.android.server.wm.WindowManagerService.removeWindowLocked:2442 com.android.server.wm.WindowManagerService.removeWindowLocked:2311 com.android.server.wm.AppWindowToken.removeAllWindows:530 com.android.server.wm.AppWindowToken.removeAppFromTaskLocked:326 
06-05 18:34:40.468 W/ActivityManager( 1629): Crash of app com.evancharlton.mileage running instrumentation ComponentInfo{com.evancharlton.mileage.test/sh.calaba.instrumentationbackend.CalabashInstrumentationTestRunner}
06-05 18:34:40.468 I/ActivityManager( 1629): Force stopping com.evancharlton.mileage appid=10160 user=0: finished inst
06-05 18:34:40.471 D/EGL_emulation( 1711): eglMakeCurrent: 0xa5b6bd80: ver 2 0 (tinfo 0xb1367140)
06-05 18:34:40.471 I/art     ( 6226): Not late-enabling -Xcheck:jni (already on)
06-05 18:34:40.471 W/art     ( 6226): Unexpected CPU variant for X86 using defaults: x86
06-05 18:34:40.472 D/EGL_emulation( 1711): eglMakeCurrent: 0xa5b6bd80: ver 2 0 (tinfo 0xb1367140)
06-05 18:34:40.479 I/ActivityManager( 1629): Start proc 6226:com.evancharlton.mileage/u0a160 for added application com.evancharlton.mileage
06-05 18:34:40.479 D/AndroidRuntime( 6216): Shutting down VM
06-05 18:34:40.484 W/System  ( 6226): ClassLoader referenced unknown path: /data/app/com.evancharlton.mileage.test-1/lib/x86
06-05 18:34:40.484 W/System  ( 6226): ClassLoader referenced unknown path: /data/app/com.evancharlton.mileage-1/lib/x86
06-05 18:34:40.487 W/System  ( 6226): ClassLoader referenced unknown path: 
06-05 18:34:40.487 D/EGL_emulation( 1711): eglMakeCurrent: 0xa5b6bd80: ver 2 0 (tinfo 0xb1367140)
06-05 18:34:40.489 D/EGL_emulation( 1711): eglMakeCurrent: 0xa5b6bd80: ver 2 0 (tinfo 0xb1367140)
06-05 18:34:40.492 I/System.out( 6226): Main activity name automatically set to: com.evancharlton.mileage.Mileage
06-05 18:34:40.492 I/System.out( 6226): Calabash did not load Mono. This is only a problem if you are trying to test a Mono application
06-05 18:34:40.492 I/calabash( 6226): Test server port: 7102
06-05 18:34:40.493 I/InstrumentationBackend( 6226): Added:'GetPreferences', with key:'get_preferences'
06-05 18:34:40.498 I/InstrumentationBackend( 6226): Added:'SetPreferences', with key:'set_preferences'
06-05 18:34:40.498 I/InstrumentationBackend( 6226): Added:'ClearPreferences', with key:'clear_preferences'
06-05 18:34:40.498 I/InstrumentationBackend( 6226): Added:'PressElement', with key:'press_l10n_element'
06-05 18:34:40.498 I/InstrumentationBackend( 6226): Added:'WaitForElement', with key:'wait_for_l10n_element'
06-05 18:34:40.498 I/InstrumentationBackend( 6226): Added:'NullAction', with key:'nullAction'
06-05 18:34:40.498 I/InstrumentationBackend( 6226): Added:'PressKey', with key:'press_key'
06-05 18:34:40.498 I/InstrumentationBackend( 6226): Added:'SetActivityOrientation', with key:'set_activity_orientation'
06-05 18:34:40.498 I/InstrumentationBackend( 6226): Added:'GetActivityOrientation', with key:'get_activity_orientation'
06-05 18:34:40.498 I/InstrumentationBackend( 6226): Added:'FakeGPSLocation', with key:'set_gps_coordinates'
06-05 18:34:40.498 I/InstrumentationBackend( 6226): Added:'SetPropertyByCssSelector', with key:'set_property_by_css_selector'
06-05 18:34:40.498 I/InstrumentationBackend( 6226): Added:'GetUrl', with key:'get_url'
06-05 18:34:40.498 I/InstrumentationBackend( 6226): Added:'ScrollTo', with key:'scroll_to'
06-05 18:34:40.499 I/InstrumentationBackend( 6226): Added:'GetLoadProgress', with key:'get_load_progress'
06-05 18:34:40.499 I/InstrumentationBackend( 6226): Added:'DumpHtml', with key:'dump_html'
06-05 18:34:40.499 I/InstrumentationBackend( 6226): Added:'DumpBodyHtml', with key:'dump_body_html'
06-05 18:34:40.499 I/InstrumentationBackend( 6226): Added:'EnterTextByCssSelector', with key:'enter_text_by_selector'
06-05 18:34:40.499 I/InstrumentationBackend( 6226): Added:'AndroidSDKVersion', with key:'android_sdk_version'
06-05 18:34:40.499 I/InstrumentationBackend( 6226): Added:'Version', with key:'version'
06-05 18:34:40.499 I/InstrumentationBackend( 6226): Added:'Drag', with key:'drag'
06-05 18:34:40.499 I/InstrumentationBackend( 6226): Added:'TouchCoordinates', with key:'touch_coordinate'
06-05 18:34:40.499 I/InstrumentationBackend( 6226): Added:'LongPressCoordinate', with key:'long_press_coordinate'
06-05 18:34:40.499 I/InstrumentationBackend( 6226): Added:'DragCoordinates', with key:'drag_coordinates'
06-05 18:34:40.499 I/InstrumentationBackend( 6226): Added:'ResumeApplication', with key:'resume_application'
06-05 18:34:40.499 I/InstrumentationBackend( 6226): Added:'Swipe', with key:'swipe'
06-05 18:34:40.499 I/InstrumentationBackend( 6226): Added:'DoubleTapCoordinate', with key:'double_tap_coordinate'
06-05 18:34:40.499 I/InstrumentationBackend( 6226): Added:'ClickOnScreen', with key:'click_on_screen'
06-05 18:34:40.499 I/InstrumentationBackend( 6226): Added:'GetActivityName', with key:'get_activity_name'
06-05 18:34:40.499 I/InstrumentationBackend( 6226): Added:'ScrollToView', with key:'scroll_to_view'
06-05 18:34:40.500 I/InstrumentationBackend( 6226): Added:'ViewConfiguration', with key:'view_configuration'
06-05 18:34:40.500 I/InstrumentationBackend( 6226): Added:'IsCurrentActivityFocused', with key:'is_current_activity_focused'
06-05 18:34:40.500 I/InstrumentationBackend( 6226): Added:'SendTcp', with key:'send_tcp'
06-05 18:34:40.500 I/InstrumentationBackend( 6226): Added:'DpToDevicePixel', with key:'dp_to_device_pixel'
06-05 18:34:40.500 I/InstrumentationBackend( 6226): Added:'KeyboardEnterText', with key:'keyboard_enter_text'
06-05 18:34:40.500 I/InstrumentationBackend( 6226): Added:'DeleteSurroundingText', with key:'delete_surrounding_text'
06-05 18:34:40.500 I/InstrumentationBackend( 6226): Added:'SetComposingRegion', with key:'set_composing_region'
06-05 18:34:40.500 I/InstrumentationBackend( 6226): Added:'SetSelection', with key:'set_selection'
06-05 18:34:40.500 I/InstrumentationBackend( 6226): Added:'KeyboardKeyEvent', with key:'keyboard_key_event'
06-05 18:34:40.500 I/InstrumentationBackend( 6226): Added:'PressUserActionButton', with key:'press_user_action_button'
06-05 18:34:40.500 I/InstrumentationBackend( 6226): Added:'HideSoftKeyboard', with key:'hide_soft_keyboard'
06-05 18:34:40.500 I/InstrumentationBackend( 6226): Added:'ListActions', with key:'list_actions'
06-05 18:34:40.500 I/calabash( 6226): Instantiating http server at 7102
06-05 18:34:40.501 I/WindowManager( 1629): WIN DEATH: Window{412726e u0 com.evancharlton.mileage/com.evancharlton.mileage.Mileage EXITING}
06-05 18:34:40.502 I/System.out( 6226): HTTP Daemon listening on: 7102
06-05 18:34:40.517 D/EGL_emulation( 1711): eglMakeCurrent: 0xa5b6bd80: ver 2 0 (tinfo 0xb1367140)
06-05 18:34:40.522 D/EGL_emulation( 1711): eglMakeCurrent: 0xa5b6bd80: ver 2 0 (tinfo 0xb1367140)
06-05 18:34:40.523 D/EGL_emulation( 1711): eglMakeCurrent: 0xa5b6bd80: ver 2 0 (tinfo 0xb1367140)
06-05 18:34:40.526 D/EGL_emulation( 1711): eglMakeCurrent: 0xa5b6bd80: ver 2 0 (tinfo 0xb1367140)
06-05 18:34:40.537 D/EGL_emulation( 1711): eglMakeCurrent: 0xa5b6bd80: ver 2 0 (tinfo 0xb1367140)
06-05 18:34:40.539 D/EGL_emulation( 1711): eglMakeCurrent: 0xa5b6bd80: ver 2 0 (tinfo 0xb1367140)
06-05 18:34:40.554 D/EGL_emulation( 1711): eglMakeCurrent: 0xa5b6bd80: ver 2 0 (tinfo 0xb1367140)
06-05 18:34:40.555 D/EGL_emulation( 1711): eglMakeCurrent: 0xa5b6bd80: ver 2 0 (tinfo 0xb1367140)
06-05 18:34:40.571 D/EGL_emulation( 1711): eglMakeCurrent: 0xa5b6bd80: ver 2 0 (tinfo 0xb1367140)
06-05 18:34:40.572 D/EGL_emulation( 1711): eglMakeCurrent: 0xa5b6bd80: ver 2 0 (tinfo 0xb1367140)
06-05 18:34:40.587 D/EGL_emulation( 1711): eglMakeCurrent: 0xa5b6bd80: ver 2 0 (tinfo 0xb1367140)
06-05 18:34:40.589 D/EGL_emulation( 1711): eglMakeCurrent: 0xa5b6bd80: ver 2 0 (tinfo 0xb1367140)
06-05 18:34:40.590 I/System.out( 6226): URI: //ping
06-05 18:34:40.590 I/System.out( 6226): params: {json={}
06-05 18:34:40.590 I/System.out( 6226): }
06-05 18:34:40.592 I/System.out( 6226): URI: //ping
06-05 18:34:40.592 I/System.out( 6226): params: {json={}
06-05 18:34:40.592 I/System.out( 6226): }
06-05 18:34:40.593 I/System.out( 6226): URI: //ready
06-05 18:34:40.593 I/System.out( 6226): params: {json={}
06-05 18:34:40.593 I/System.out( 6226): }
06-05 18:34:40.595 I/System.out( 6226): URI: //
06-05 18:34:40.595 I/System.out( 6226): params: {json={"command":"version","arguments":[]}
06-05 18:34:40.595 I/System.out( 6226): }
06-05 18:34:40.595 I/System.out( 6226): header: {content-type=application/json;charset=utf-8, date=Fri, 05 Jun 2020 23:34:40 GMT, accept=*/*, host=127.0.0.1:34783, content-length=36, user-agent=HTTPClient/1.0 (2.8.3, ruby 2.5.1 (2018-03-29))}
06-05 18:34:40.595 I/System.out( 6226): params: {json={"command":"version","arguments":[]}
06-05 18:34:40.595 I/System.out( 6226): }
06-05 18:34:40.595 I/System.out( 6226): ProP json = {"command":"version","arguments":[]}
06-05 18:34:40.595 I/System.out( 6226): files: {}
06-05 18:34:40.595 I/System.out( 6226): command: {"command":"version","arguments":[]}
06-05 18:34:40.598 I/InstrumentationBackend( 6226): Got command:'Command:'Line:null,version', arguments:'[]'
06-05 18:34:40.603 I/System.out( 6226): result:{"bonusInformation":[],"message":"0.9.8","success":true}
06-05 18:34:40.605 D/EGL_emulation( 1711): eglMakeCurrent: 0xa5b6bd80: ver 2 0 (tinfo 0xb1367140)
06-05 18:34:40.605 I/System.out( 6226): URI: //start-application
06-05 18:34:40.606 I/System.out( 6226): params: {json={"intent":null}
06-05 18:34:40.606 I/System.out( 6226): }
06-05 18:34:40.614 I/ActivityManager( 1629): START u0 {act=android.intent.action.MAIN cat=[android.intent.category.LAUNCHER] flg=0x10200000 cmp=com.evancharlton.mileage/.Mileage} from uid 10160 on display 0
06-05 18:34:40.619 I/calabash( 6226): newActivity1
06-05 18:34:40.627 I/calabash( 6226): newActivity1
06-05 18:34:40.628 W/ActivityManager( 1629): Bad activity token: android.os.BinderProxy@c486dd7
06-05 18:34:40.628 W/ActivityManager( 1629): java.lang.ClassCastException: android.os.BinderProxy cannot be cast to com.android.server.am.ActivityRecord$Token
06-05 18:34:40.628 W/ActivityManager( 1629): 	at com.android.server.am.ActivityRecord.forTokenLocked(ActivityRecord.java:586)
06-05 18:34:40.628 W/ActivityManager( 1629): 	at com.android.server.am.ActivityRecord.isInStackLocked(ActivityRecord.java:1327)
06-05 18:34:40.628 W/ActivityManager( 1629): 	at com.android.server.am.ActivityRecord.getStackLocked(ActivityRecord.java:1332)
06-05 18:34:40.628 W/ActivityManager( 1629): 	at com.android.server.am.ActivityManagerService.getActivityDisplayId(ActivityManagerService.java:9806)
06-05 18:34:40.628 W/ActivityManager( 1629): 	at android.app.ActivityManagerNative.onTransact(ActivityManagerNative.java:2566)
06-05 18:34:40.628 W/ActivityManager( 1629): 	at com.android.server.am.ActivityManagerService.onTransact(ActivityManagerService.java:2757)
06-05 18:34:40.628 W/ActivityManager( 1629): 	at android.os.Binder.execTransact(Binder.java:565)
06-05 18:34:40.629 W/ActivityManager( 1629): Bad activity token: android.os.BinderProxy@c486dd7
06-05 18:34:40.629 W/ActivityManager( 1629): java.lang.ClassCastException: android.os.BinderProxy cannot be cast to com.android.server.am.ActivityRecord$Token
06-05 18:34:40.629 W/ActivityManager( 1629): 	at com.android.server.am.ActivityRecord.forTokenLocked(ActivityRecord.java:586)
06-05 18:34:40.629 W/ActivityManager( 1629): 	at com.android.server.am.ActivityRecord.isInStackLocked(ActivityRecord.java:1327)
06-05 18:34:40.629 W/ActivityManager( 1629): 	at com.android.server.am.ActivityManagerService.setTaskDescription(ActivityManagerService.java:9358)
06-05 18:34:40.629 W/ActivityManager( 1629): 	at android.app.ActivityManagerNative.onTransact(ActivityManagerNative.java:2639)
06-05 18:34:40.629 W/ActivityManager( 1629): 	at com.android.server.am.ActivityManagerService.onTransact(ActivityManagerService.java:2757)
06-05 18:34:40.629 W/ActivityManager( 1629): 	at android.os.Binder.execTransact(Binder.java:565)
06-05 18:34:40.629 W/ActivityManager( 1629): Bad activity token: android.os.BinderProxy@c486dd7
06-05 18:34:40.629 W/ActivityManager( 1629): java.lang.ClassCastException: android.os.BinderProxy cannot be cast to com.android.server.am.ActivityRecord$Token
06-05 18:34:40.629 W/ActivityManager( 1629): 	at com.android.server.am.ActivityRecord.forTokenLocked(ActivityRecord.java:586)
06-05 18:34:40.629 W/ActivityManager( 1629): 	at com.android.server.am.ActivityRecord.isInStackLocked(ActivityRecord.java:1327)
06-05 18:34:40.629 W/ActivityManager( 1629): 	at com.android.server.am.ActivityRecord.getStackLocked(ActivityRecord.java:1332)
06-05 18:34:40.629 W/ActivityManager( 1629): 	at com.android.server.am.ActivityManagerService.getActivityStackId(ActivityManagerService.java:9817)
06-05 18:34:40.629 W/ActivityManager( 1629): 	at android.app.ActivityManagerNative.onTransact(ActivityManagerNative.java:2856)
06-05 18:34:40.629 W/ActivityManager( 1629): 	at com.android.server.am.ActivityManagerService.onTransact(ActivityManagerService.java:2757)
06-05 18:34:40.629 W/ActivityManager( 1629): 	at android.os.Binder.execTransact(Binder.java:565)
06-05 18:34:40.637 D/gralloc_ranchu( 1346): gralloc_alloc: Creating ashmem region of size 9023488
06-05 18:34:40.645 W/ActivityManager( 1629): Bad activity token: android.os.BinderProxy@c486dd7
06-05 18:34:40.645 W/ActivityManager( 1629): java.lang.ClassCastException: android.os.BinderProxy cannot be cast to com.android.server.am.ActivityRecord$Token
06-05 18:34:40.645 W/ActivityManager( 1629): 	at com.android.server.am.ActivityRecord.forTokenLocked(ActivityRecord.java:586)
06-05 18:34:40.645 W/ActivityManager( 1629): 	at com.android.server.am.ActivityRecord.isInStackLocked(ActivityRecord.java:1327)
06-05 18:34:40.645 W/ActivityManager( 1629): 	at com.android.server.am.ActivityManagerService.getActivityOptions(ActivityManagerService.java:12559)
06-05 18:34:40.645 W/ActivityManager( 1629): 	at android.app.ActivityManagerNative.onTransact(ActivityManagerNative.java:1933)
06-05 18:34:40.645 W/ActivityManager( 1629): 	at com.android.server.am.ActivityManagerService.onTransact(ActivityManagerService.java:2757)
06-05 18:34:40.645 W/ActivityManager( 1629): 	at android.os.Binder.execTransact(Binder.java:565)
06-05 18:34:40.645 W/ActivityManager( 1629): Bad activity token: android.os.BinderProxy@c486dd7
06-05 18:34:40.645 W/ActivityManager( 1629): java.lang.ClassCastException: android.os.BinderProxy cannot be cast to com.android.server.am.ActivityRecord$Token
06-05 18:34:40.645 W/ActivityManager( 1629): 	at com.android.server.am.ActivityRecord.forTokenLocked(ActivityRecord.java:586)
06-05 18:34:40.645 W/ActivityManager( 1629): 	at com.android.server.am.ActivityRecord.isInStackLocked(ActivityRecord.java:1327)
06-05 18:34:40.645 W/ActivityManager( 1629): 	at com.android.server.am.ActivityManagerService.getActivityOptions(ActivityManagerService.java:12559)
06-05 18:34:40.645 W/ActivityManager( 1629): 	at android.app.ActivityManagerNative.onTransact(ActivityManagerNative.java:1933)
06-05 18:34:40.645 W/ActivityManager( 1629): 	at com.android.server.am.ActivityManagerService.onTransact(ActivityManagerService.java:2757)
06-05 18:34:40.645 W/ActivityManager( 1629): 	at android.os.Binder.execTransact(Binder.java:565)
06-05 18:34:40.661 V/PhoneStatusBar( 1711): setLightsOn(true)
06-05 18:34:40.671 D/EGL_emulation( 2150): eglMakeCurrent: 0xb4f852a0: ver 2 0 (tinfo 0xb4f832e0)
06-05 18:34:40.673 D/EGL_emulation( 1711): eglMakeCurrent: 0xa5b6bd80: ver 2 0 (tinfo 0xb1367140)
06-05 18:34:40.673 V/PhoneStatusBar( 1711): setLightsOn(true)
06-05 18:34:40.687 D/gralloc_ranchu( 1346): gralloc_alloc: Creating ashmem region of size 9023488
06-05 18:34:40.691 D/EGL_emulation( 1711): eglMakeCurrent: 0xa5b6bd80: ver 2 0 (tinfo 0xb1367140)
06-05 18:34:40.692 D/        ( 6226): HostConnection::get() New Host Connection established 0x98c27500, tid 6226
06-05 18:34:40.726 D/EGL_emulation( 1711): eglMakeCurrent: 0xa5b6bd80: ver 2 0 (tinfo 0xb1367140)
06-05 18:34:40.727 V/PhoneStatusBar( 1711): setLightsOn(true)
06-05 18:34:40.730 D/EGL_emulation( 1711): eglMakeCurrent: 0xa5b6bd80: ver 2 0 (tinfo 0xb1367140)
06-05 18:34:40.735 D/EGL_emulation( 1711): eglMakeCurrent: 0xa5b6bd80: ver 2 0 (tinfo 0xb1367140)
06-05 18:34:40.738 D/EGL_emulation( 1711): eglMakeCurrent: 0xa5b6bd80: ver 2 0 (tinfo 0xb1367140)
06-05 18:34:40.739 D/EGL_emulation( 1711): eglMakeCurrent: 0xa5b6bd80: ver 2 0 (tinfo 0xb1367140)
06-05 18:34:40.754 D/EGL_emulation( 1711): eglMakeCurrent: 0xa5b6bd80: ver 2 0 (tinfo 0xb1367140)
06-05 18:34:40.756 D/EGL_emulation( 1711): eglMakeCurrent: 0xa5b6bd80: ver 2 0 (tinfo 0xb1367140)
06-05 18:34:40.771 D/EGL_emulation( 1711): eglMakeCurrent: 0xa5b6bd80: ver 2 0 (tinfo 0xb1367140)
06-05 18:34:40.771 D/gralloc_ranchu( 1346): gralloc_alloc: Creating ashmem region of size 9023488
06-05 18:34:40.779 D/EGL_emulation( 1711): eglMakeCurrent: 0xa5b6bd80: ver 2 0 (tinfo 0xb1367140)
06-05 18:34:40.789 I/ActivityManager( 1629): Displayed com.evancharlton.mileage/.Mileage: +172ms
06-05 18:34:40.790 D/EGL_emulation( 1711): eglMakeCurrent: 0xa5b6bd80: ver 2 0 (tinfo 0xb1367140)
06-05 18:34:40.799 D/EGL_emulation( 1711): eglMakeCurrent: 0xa5b6bd80: ver 2 0 (tinfo 0xb1367140)
06-05 18:34:40.800 V/PhoneStatusBar( 1711): setLightsOn(true)
06-05 18:34:40.804 D/EGL_emulation( 1711): eglMakeCurrent: 0xa5b6bd80: ver 2 0 (tinfo 0xb1367140)
06-05 18:34:40.811 D/EGL_emulation( 1711): eglMakeCurrent: 0xa5b6bd80: ver 2 0 (tinfo 0xb1367140)
06-05 18:34:40.821 I/WindowManager( 1629): Destroying surface Surface(name=com.evancharlton.mileage/com.evancharlton.mileage.Mileage) called by com.android.server.wm.WindowStateAnimator.destroySurface:2016 com.android.server.wm.WindowStateAnimator.destroySurfaceLocked:882 com.android.server.wm.WindowState.removeLocked:1456 com.android.server.wm.WindowManagerService.removeWindowInnerLocked:2484 com.android.server.wm.AppWindowToken.destroySurfaces:365 com.android.server.wm.WindowStateAnimator.finishExit:565 com.android.server.wm.AppWindowAnimator.stepAnimationLocked:427 com.android.server.wm.WindowAnimator.updateAppWindowsLocked:196 
06-05 18:34:40.821 D/EGL_emulation( 1711): eglMakeCurrent: 0xa5b6bd80: ver 2 0 (tinfo 0xb1367140)
06-05 18:34:40.824 D/EGL_emulation( 1711): eglMakeCurrent: 0xa5b6bd80: ver 2 0 (tinfo 0xb1367140)
06-05 18:34:40.827 I/System.out( 6226): URI: //map
06-05 18:34:40.827 I/System.out( 6226): params: {json={"query":"* marked:'Statistics'","operation":{"method_name":"query","arguments":[]}}
06-05 18:34:40.827 I/System.out( 6226): }
06-05 18:34:40.838 D/EGL_emulation( 1711): eglMakeCurrent: 0xa5b6bd80: ver 2 0 (tinfo 0xb1367140)
06-05 18:34:40.839 D/EGL_emulation( 1711): eglMakeCurrent: 0xa5b6bd80: ver 2 0 (tinfo 0xb1367140)
06-05 18:34:40.840 V/PhoneStatusBar( 1711): setLightsOn(true)
06-05 18:34:40.841 W/ResourceType( 6226): No package identifier when getting name for resource number 0x00000001
06-05 18:34:40.854 I/System.out( 6226): URI: //gesture
06-05 18:34:40.854 I/System.out( 6226): params: {json={"query_timeout":5.0,"gestures":[{"query_string":"* marked:'Statistics'","touches":[{"x":50,"y":50,"offset_x":0,"offset_y":0,"wait":0.0,"time":0.2,"release":true,"query_string":null}]}]}
06-05 18:34:40.854 I/System.out( 6226): }
06-05 18:34:40.854 D/EGL_emulation( 1711): eglMakeCurrent: 0xa5b6bd80: ver 2 0 (tinfo 0xb1367140)
06-05 18:34:40.856 D/EGL_emulation( 1711): eglMakeCurrent: 0xa5b6bd80: ver 2 0 (tinfo 0xb1367140)
06-05 18:34:40.859 W/ResourceType( 6226): No package identifier when getting name for resource number 0x00000001
06-05 18:34:40.871 D/EGL_emulation( 1711): eglMakeCurrent: 0xa5b6bd80: ver 2 0 (tinfo 0xb1367140)
06-05 18:34:40.880 D/EGL_emulation( 1711): eglMakeCurrent: 0xa5b6bd80: ver 2 0 (tinfo 0xb1367140)
06-05 18:34:40.896 D/EGL_emulation( 1711): eglMakeCurrent: 0xa5b6bd80: ver 2 0 (tinfo 0xb1367140)
06-05 18:34:40.938 V/PhoneStatusBar( 1711): setLightsOn(true)
06-05 18:34:40.987 I/WindowManager( 1629): Destroying surface Surface(name=Starting com.evancharlton.mileage) called by com.android.server.wm.WindowStateAnimator.destroySurface:2016 com.android.server.wm.WindowStateAnimator.destroySurfaceLocked:882 com.android.server.wm.WindowState.destroyOrSaveSurface:2100 com.android.server.wm.AppWindowToken.destroySurfaces:363 com.android.server.wm.WindowStateAnimator.finishExit:565 com.android.server.wm.WindowStateAnimator.stepAnimationLocked:491 com.android.server.wm.WindowAnimator.updateWindowsLocked:303 com.android.server.wm.WindowAnimator.animateLocked:704 
06-05 18:34:40.989 V/PhoneStatusBar( 1711): setLightsOn(true)
06-05 18:34:41.020 V/PhoneStatusBar( 1711): setLightsOn(true)
06-05 18:34:41.093 I/calabash( 6226): newActivity1
06-05 18:34:41.116 I/System.out( 6226): URI: //map
06-05 18:34:41.116 I/System.out( 6226): params: {json={"query":"android.widget.ScrollView index:0","operation":{"method_name":"query","arguments":[]}}
06-05 18:34:41.116 I/System.out( 6226): }
06-05 18:34:41.121 V/PhoneStatusBar( 1711): setLightsOn(true)
06-05 18:34:41.121 W/ActivityManager( 1629): Bad activity token: android.os.BinderProxy@ae2919
06-05 18:34:41.121 W/ActivityManager( 1629): java.lang.ClassCastException: android.os.BinderProxy cannot be cast to com.android.server.am.ActivityRecord$Token
06-05 18:34:41.121 W/ActivityManager( 1629): 	at com.android.server.am.ActivityRecord.forTokenLocked(ActivityRecord.java:586)
06-05 18:34:41.121 W/ActivityManager( 1629): 	at com.android.server.am.ActivityRecord.isInStackLocked(ActivityRecord.java:1327)
06-05 18:34:41.121 W/ActivityManager( 1629): 	at com.android.server.am.ActivityRecord.getStackLocked(ActivityRecord.java:1332)
06-05 18:34:41.121 W/ActivityManager( 1629): 	at com.android.server.am.ActivityManagerService.getActivityDisplayId(ActivityManagerService.java:9806)
06-05 18:34:41.121 W/ActivityManager( 1629): 	at android.app.ActivityManagerNative.onTransact(ActivityManagerNative.java:2566)
06-05 18:34:41.121 W/ActivityManager( 1629): 	at com.android.server.am.ActivityManagerService.onTransact(ActivityManagerService.java:2757)
06-05 18:34:41.121 W/ActivityManager( 1629): 	at android.os.Binder.execTransact(Binder.java:565)
06-05 18:34:41.123 W/ActivityManager( 1629): Bad activity token: android.os.BinderProxy@ae2919
06-05 18:34:41.123 W/ActivityManager( 1629): java.lang.ClassCastException: android.os.BinderProxy cannot be cast to com.android.server.am.ActivityRecord$Token
06-05 18:34:41.123 W/ActivityManager( 1629): 	at com.android.server.am.ActivityRecord.forTokenLocked(ActivityRecord.java:586)
06-05 18:34:41.123 W/ActivityManager( 1629): 	at com.android.server.am.ActivityRecord.isInStackLocked(ActivityRecord.java:1327)
06-05 18:34:41.123 W/ActivityManager( 1629): 	at com.android.server.am.ActivityManagerService.setTaskDescription(ActivityManagerService.java:9358)
06-05 18:34:41.123 W/ActivityManager( 1629): 	at android.app.ActivityManagerNative.onTransact(ActivityManagerNative.java:2639)
06-05 18:34:41.123 W/ActivityManager( 1629): 	at com.android.server.am.ActivityManagerService.onTransact(ActivityManagerService.java:2757)
06-05 18:34:41.123 W/ActivityManager( 1629): 	at android.os.Binder.execTransact(Binder.java:565)
06-05 18:34:41.123 W/ActivityManager( 1629): Bad activity token: android.os.BinderProxy@ae2919
06-05 18:34:41.123 W/ActivityManager( 1629): java.lang.ClassCastException: android.os.BinderProxy cannot be cast to com.android.server.am.ActivityRecord$Token
06-05 18:34:41.123 W/ActivityManager( 1629): 	at com.android.server.am.ActivityRecord.forTokenLocked(ActivityRecord.java:586)
06-05 18:34:41.123 W/ActivityManager( 1629): 	at com.android.server.am.ActivityRecord.isInStackLocked(ActivityRecord.java:1327)
06-05 18:34:41.123 W/ActivityManager( 1629): 	at com.android.server.am.ActivityRecord.getStackLocked(ActivityRecord.java:1332)
06-05 18:34:41.123 W/ActivityManager( 1629): 	at com.android.server.am.ActivityManagerService.getActivityStackId(ActivityManagerService.java:9817)
06-05 18:34:41.123 W/ActivityManager( 1629): 	at android.app.ActivityManagerNative.onTransact(ActivityManagerNative.java:2856)
06-05 18:34:41.123 W/ActivityManager( 1629): 	at com.android.server.am.ActivityManagerService.onTransact(ActivityManagerService.java:2757)
06-05 18:34:41.123 W/ActivityManager( 1629): 	at android.os.Binder.execTransact(Binder.java:565)
06-05 18:34:41.130 D/VehicleStatisticsActivity( 6226): Checking recalculation ...
06-05 18:34:41.131 D/VehicleStatisticsActivity( 6226): Recalculation not necessary.
06-05 18:34:41.154 W/ActivityManager( 1629): Bad activity token: android.os.BinderProxy@ae2919
06-05 18:34:41.154 W/ActivityManager( 1629): java.lang.ClassCastException: android.os.BinderProxy cannot be cast to com.android.server.am.ActivityRecord$Token
06-05 18:34:41.154 W/ActivityManager( 1629): 	at com.android.server.am.ActivityRecord.forTokenLocked(ActivityRecord.java:586)
06-05 18:34:41.154 W/ActivityManager( 1629): 	at com.android.server.am.ActivityRecord.isInStackLocked(ActivityRecord.java:1327)
06-05 18:34:41.154 W/ActivityManager( 1629): 	at com.android.server.am.ActivityManagerService.getActivityOptions(ActivityManagerService.java:12559)
06-05 18:34:41.154 W/ActivityManager( 1629): 	at android.app.ActivityManagerNative.onTransact(ActivityManagerNative.java:1933)
06-05 18:34:41.154 W/ActivityManager( 1629): 	at com.android.server.am.ActivityManagerService.onTransact(ActivityManagerService.java:2757)
06-05 18:34:41.154 W/ActivityManager( 1629): 	at android.os.Binder.execTransact(Binder.java:565)
06-05 18:34:41.155 W/ActivityManager( 1629): Bad activity token: android.os.BinderProxy@ae2919
06-05 18:34:41.155 W/ActivityManager( 1629): java.lang.ClassCastException: android.os.BinderProxy cannot be cast to com.android.server.am.ActivityRecord$Token
06-05 18:34:41.155 W/ActivityManager( 1629): 	at com.android.server.am.ActivityRecord.forTokenLocked(ActivityRecord.java:586)
06-05 18:34:41.155 W/ActivityManager( 1629): 	at com.android.server.am.ActivityRecord.isInStackLocked(ActivityRecord.java:1327)
06-05 18:34:41.155 W/ActivityManager( 1629): 	at com.android.server.am.ActivityManagerService.getActivityOptions(ActivityManagerService.java:12559)
06-05 18:34:41.155 W/ActivityManager( 1629): 	at android.app.ActivityManagerNative.onTransact(ActivityManagerNative.java:1933)
06-05 18:34:41.155 W/ActivityManager( 1629): 	at com.android.server.am.ActivityManagerService.onTransact(ActivityManagerService.java:2757)
06-05 18:34:41.155 W/ActivityManager( 1629): 	at android.os.Binder.execTransact(Binder.java:565)
06-05 18:34:41.156 D/VehicleStatisticsActivity( 6226): Checking recalculation ...
06-05 18:34:41.157 D/VehicleStatisticsActivity( 6226): Recalculation not necessary.
06-05 18:34:41.263 I/System.out( 6226): URI: //map
06-05 18:34:41.263 I/System.out( 6226): params: {json={"query":"android.widget.AbsListView index:0","operation":{"method_name":"query","arguments":[]}}
06-05 18:34:41.263 I/System.out( 6226): }
06-05 18:34:41.267 I/art     ( 6226): Do partial code cache collection, code=30KB, data=29KB
06-05 18:34:41.267 I/art     ( 6226): After code cache collection, code=29KB, data=28KB
06-05 18:34:41.267 I/art     ( 6226): Increasing code cache capacity to 128KB
06-05 18:34:41.277 I/System.out( 6226): URI: //map
06-05 18:34:41.277 I/System.out( 6226): params: {json={"query":"android.widget.AbsListView index:0","operation":{"method_name":"query","arguments":[]}}
06-05 18:34:41.277 I/System.out( 6226): }
06-05 18:34:41.290 I/System.out( 6226): URI: //map
06-05 18:34:41.290 I/System.out( 6226): params: {json={"query":"android.widget.AbsListView index:0","operation":{"method_name":"query","arguments":[]}}
06-05 18:34:41.290 I/System.out( 6226): }
06-05 18:34:41.306 I/System.out( 6226): URI: //map
06-05 18:34:41.306 I/System.out( 6226): params: {json={"query":"android.widget.AbsListView index:0","operation":{"method_name":"query","arguments":["getFirstVisiblePosition"]}}
06-05 18:34:41.306 I/System.out( 6226): }
06-05 18:34:41.318 I/System.out( 6226): URI: //map
06-05 18:34:41.318 I/System.out( 6226): params: {json={"query":"android.widget.AbsListView index:0","operation":{"method_name":"query","arguments":["getLastVisiblePosition"]}}
06-05 18:34:41.318 I/System.out( 6226): }
06-05 18:34:41.330 I/System.out( 6226): URI: //map
06-05 18:34:41.330 I/System.out( 6226): params: {json={"query":"android.widget.AbsListView index:0","operation":{"method_name":"query","arguments":[{"method_name":"setSelection","arguments":[26]}]}}
06-05 18:34:41.330 I/System.out( 6226): }
06-05 18:34:41.346 I/System.out( 6226): URI: //map
06-05 18:34:41.346 I/System.out( 6226): params: {json={"query":"* marked:'Minimum price'","operation":{"method_name":"query","arguments":[]}}
06-05 18:34:41.346 I/System.out( 6226): }
06-05 18:34:41.390 D/gralloc_ranchu( 1346): gralloc_alloc: Creating ashmem region of size 9023488
06-05 18:34:41.404 V/PhoneStatusBar( 1711): setLightsOn(true)
06-05 18:34:41.405 V/PhoneStatusBar( 1711): setLightsOn(true)
06-05 18:34:41.406 W/OpenGLRenderer( 2150): Incorrectly called buildLayer on View: ShortcutAndWidgetContainer, destroying layer...
06-05 18:34:41.421 V/PhoneStatusBar( 1711): setLightsOn(true)
06-05 18:34:41.422 I/WindowManager( 1629): Destroying surface Surface(name=com.android.launcher3/com.android.launcher3.Launcher) called by com.android.server.wm.WindowStateAnimator.destroySurface:2016 com.android.server.wm.WindowStateAnimator.destroySurfaceLocked:882 com.android.server.wm.WindowState.destroyOrSaveSurface:2100 com.android.server.wm.AppWindowToken.destroySurfaces:363 com.android.server.wm.AppWindowToken.notifyAppStopped:389 com.android.server.wm.WindowManagerService.notifyAppStopped:4463 com.android.server.am.ActivityStack.activityStoppedLocked:1252 com.android.server.am.ActivityManagerService.activityStopped:6903 
06-05 18:34:41.426 W/ResourceType( 6226): No package identifier when getting name for resource number 0x00000001
06-05 18:34:41.438 I/System.out( 6226): URI: //gesture
06-05 18:34:41.438 I/System.out( 6226): params: {json={"query_timeout":5.0,"gestures":[{"query_string":"* marked:'Minimum price'","touches":[{"x":50,"y":50,"offset_x":0,"offset_y":0,"wait":0.0,"time":0.2,"release":true,"query_string":null}]}]}
06-05 18:34:41.438 I/System.out( 6226): }
06-05 18:34:41.442 W/ResourceType( 6226): No package identifier when getting name for resource number 0x00000001
06-05 18:34:41.673 I/ActivityManager( 1629): START u0 {cmp=com.evancharlton.mileage/.charts.MinimumPriceChart (has extras)} from uid 10160 on display 0
06-05 18:34:41.676 V/PhoneStatusBar( 1711): setLightsOn(true)
06-05 18:34:41.679 V/PhoneStatusBar( 1711): setLightsOn(true)
06-05 18:34:41.704 I/System.out( 6226): URI: //map
06-05 18:34:41.704 I/System.out( 6226): params: {json={"query":"* {text CONTAINS[c] 'Least expensive fuel'}","operation":{"method_name":"query","arguments":[]}}
06-05 18:34:41.704 I/System.out( 6226): }
06-05 18:34:41.732 I/calabash( 6226): newActivity1
06-05 18:34:41.736 W/aiCharts( 6226): License file is invalid or missing. 
06-05 18:34:41.736 W/aiCharts( 6226): Please place proper license.lic to /assets folder.
06-05 18:34:41.750 V/PhoneStatusBar( 1711): setLightsOn(true)
06-05 18:34:41.770 V/PhoneStatusBar( 1711): setLightsOn(true)
06-05 18:34:41.777 I/WindowManager( 1629): Destroying surface Surface(name=Creating chart…) called by com.android.server.wm.WindowStateAnimator.destroySurface:2016 com.android.server.wm.WindowStateAnimator.destroySurfaceLocked:882 com.android.server.wm.WindowState.removeLocked:1456 com.android.server.wm.WindowManagerService.removeWindowInnerLocked:2484 com.android.server.wm.WindowManagerService.removeWindowLocked:2442 com.android.server.wm.WindowManagerService.removeWindowLocked:2311 com.android.server.wm.WindowManagerService.removeWindow:2306 com.android.server.wm.Session.remove:202 
06-05 18:34:41.781 D/gralloc_ranchu( 1346): gralloc_alloc: Creating ashmem region of size 9023488
06-05 18:34:41.788 V/PhoneStatusBar( 1711): setLightsOn(true)
06-05 18:34:41.820 V/PhoneStatusBar( 1711): setLightsOn(true)
06-05 18:34:41.822 I/ActivityManager( 1629): Displayed com.evancharlton.mileage/.charts.MinimumPriceChart: +93ms
06-05 18:34:41.837 V/PhoneStatusBar( 1711): setLightsOn(true)
06-05 18:34:41.854 V/PhoneStatusBar( 1711): setLightsOn(true)
06-05 18:34:42.056 V/PhoneStatusBar( 1711): setLightsOn(true)
06-05 18:34:42.073 I/System.out( 6226): URI: //map
06-05 18:34:42.073 I/System.out( 6226): params: {json={"query":"* {text CONTAINS[c] 'Least expensive fuel'}","operation":{"method_name":"query","arguments":[]}}
06-05 18:34:42.073 I/System.out( 6226): }
06-05 18:34:42.142 I/System.out( 6226): URI: //
06-05 18:34:42.143 I/System.out( 6226): params: {json={"command":"press_key","arguments":["KEYCODE_BACK"]}
06-05 18:34:42.143 I/System.out( 6226): }
06-05 18:34:42.143 I/System.out( 6226): header: {content-type=application/json;charset=utf-8, date=Fri, 05 Jun 2020 23:34:42 GMT, accept=*/*, host=127.0.0.1:34783, content-length=52, user-agent=HTTPClient/1.0 (2.8.3, ruby 2.5.1 (2018-03-29))}
06-05 18:34:42.143 I/System.out( 6226): params: {json={"command":"press_key","arguments":["KEYCODE_BACK"]}
06-05 18:34:42.143 I/System.out( 6226): }
06-05 18:34:42.143 I/System.out( 6226): ProP json = {"command":"press_key","arguments":["KEYCODE_BACK"]}
06-05 18:34:42.143 I/System.out( 6226): files: {}
06-05 18:34:42.143 I/System.out( 6226): command: {"command":"press_key","arguments":["KEYCODE_BACK"]}
06-05 18:34:42.148 I/InstrumentationBackend( 6226): Got command:'Command:'Line:null,press_key', arguments:'[KEYCODE_BACK]'
06-05 18:34:42.159 V/PhoneStatusBar( 1711): setLightsOn(true)
06-05 18:34:42.169 V/PhoneStatusBar( 1711): setLightsOn(true)
06-05 18:34:42.175 I/art     ( 6226): Do partial code cache collection, code=60KB, data=62KB
06-05 18:34:42.176 I/art     ( 6226): After code cache collection, code=60KB, data=62KB
06-05 18:34:42.176 I/art     ( 6226): Increasing code cache capacity to 256KB
06-05 18:34:42.178 I/System.out( 6226): result:{"bonusInformation":[],"message":"","success":true}
06-05 18:34:42.187 I/System.out( 6226): URI: //map
06-05 18:34:42.187 I/System.out( 6226): params: {json={"query":"* {text CONTAINS[c] 'Statistics'}","operation":{"method_name":"query","arguments":[]}}
06-05 18:34:42.187 I/System.out( 6226): }
06-05 18:34:42.188 D/VehicleStatisticsActivity( 6226): Checking recalculation ...
06-05 18:34:42.188 V/PhoneStatusBar( 1711): setLightsOn(true)
06-05 18:34:42.191 D/VehicleStatisticsActivity( 6226): Recalculation not necessary.
06-05 18:34:42.205 V/PhoneStatusBar( 1711): setLightsOn(true)
06-05 18:34:42.221 V/PhoneStatusBar( 1711): setLightsOn(true)
06-05 18:34:42.225 D/gralloc_ranchu( 1346): gralloc_alloc: Creating ashmem region of size 9023488
06-05 18:34:42.271 V/PhoneStatusBar( 1711): setLightsOn(true)
