--------- beginning of main
06-05 18:34:51.587 V/PhoneStatusBar( 1711): setLightsOn(true)
06-05 18:34:51.589 D/gralloc_ranchu( 1346): gralloc_alloc: Creating ashmem region of size 3145728
06-05 18:34:51.594 E/EGL_emulation( 1346): tid 1346: eglCreateSyncKHR(1901): error 0x3004 (EGL_BAD_ATTRIBUTE)
--------- beginning of system
06-05 18:34:51.606 W/ActivityManager( 1629): Finishing task with all activities already finished
06-05 18:34:51.606 W/ActivityManager( 1629): Duplicate finish request for ActivityRecord{65dd139 u0 com.evancharlton.mileage/.Mileage t3093 f}
06-05 18:34:51.606 W/ActivityManager( 1629): Finishing task with all activities already finished
06-05 18:34:51.607 W/ActivityManager( 1629): Duplicate finish request for ActivityRecord{65dd139 u0 com.evancharlton.mileage/.Mileage t3093 f}
06-05 18:34:51.607 W/ActivityManager( 1629): Finishing task with all activities already finished
06-05 18:34:51.607 W/ActivityManager( 1629): Duplicate finish request for ActivityRecord{65dd139 u0 com.evancharlton.mileage/.Mileage t3093 f}
06-05 18:34:51.607 W/ActivityManager( 1629): Finishing task with all activities already finished
06-05 18:34:51.607 W/ActivityManager( 1629): Duplicate finish request for ActivityRecord{65dd139 u0 com.evancharlton.mileage/.Mileage t3093 f}
06-05 18:34:51.607 W/ActivityManager( 1629): Finishing task with all activities already finished
06-05 18:34:51.607 W/ActivityManager( 1629): Duplicate finish request for ActivityRecord{65dd139 u0 com.evancharlton.mileage/.Mileage t3093 f}
06-05 18:34:51.607 W/ActivityManager( 1629): Finishing task with all activities already finished
06-05 18:34:51.607 W/ActivityManager( 1629): Duplicate finish request for ActivityRecord{46913db u0 com.evancharlton.mileage/.charts.AverageVolumeChart t3093 f}
06-05 18:34:51.607 W/ActivityManager( 1629): Finishing task with all activities already finished
06-05 18:34:51.607 W/ActivityManager( 1629): Duplicate finish request for ActivityRecord{46913db u0 com.evancharlton.mileage/.charts.AverageVolumeChart t3093 f}
06-05 18:34:51.607 W/ActivityManager( 1629): Finishing task with all activities already finished
06-05 18:34:51.607 W/ActivityManager( 1629): Duplicate finish request for ActivityRecord{65dd139 u0 com.evancharlton.mileage/.Mileage t3093 f}
06-05 18:34:51.608 W/ActivityManager( 1629): Finishing task with all activities already finished
06-05 18:34:51.608 W/ActivityManager( 1629): Duplicate finish request for ActivityRecord{65dd139 u0 com.evancharlton.mileage/.Mileage t3093 f}
06-05 18:34:51.624 D/EGL_emulation( 1711): eglMakeCurrent: 0xa5b6bd80: ver 2 0 (tinfo 0xb1367140)
06-05 18:34:51.630 W/art     ( 1629): Suspending all threads took: 7.516ms
06-05 18:34:51.636 I/art     ( 1629): Background partial concurrent mark sweep GC freed 11209(907KB) AllocSpace objects, 4(80KB) LOS objects, 17% free, 18MB/22MB, paused 8.539ms total 37.679ms
06-05 18:34:51.638 D/EGL_emulation( 1711): eglMakeCurrent: 0xa5b6bd80: ver 2 0 (tinfo 0xb1367140)
06-05 18:34:51.641 D/EGL_emulation( 2150): eglMakeCurrent: 0xb4f852a0: ver 2 0 (tinfo 0xb4f832e0)
06-05 18:34:51.688 D/EGL_emulation( 1711): eglMakeCurrent: 0xa5b6bd80: ver 2 0 (tinfo 0xb1367140)
06-05 18:34:51.704 D/EGL_emulation( 1711): eglMakeCurrent: 0xa5b6bd80: ver 2 0 (tinfo 0xb1367140)
06-05 18:34:51.709 D/EGL_emulation( 1711): eglMakeCurrent: 0xa5b6bd80: ver 2 0 (tinfo 0xb1367140)
06-05 18:34:51.721 D/EGL_emulation( 1711): eglMakeCurrent: 0xa5b6bd80: ver 2 0 (tinfo 0xb1367140)
06-05 18:34:51.724 D/EGL_emulation( 1711): eglMakeCurrent: 0xa5b6bd80: ver 2 0 (tinfo 0xb1367140)
06-05 18:34:51.737 D/EGL_emulation( 1711): eglMakeCurrent: 0xa5b6bd80: ver 2 0 (tinfo 0xb1367140)
06-05 18:34:51.739 D/EGL_emulation( 1711): eglMakeCurrent: 0xa5b6bd80: ver 2 0 (tinfo 0xb1367140)
06-05 18:34:51.749 D/AndroidRuntime( 6525): >>>>>> START com.android.internal.os.RuntimeInit uid 2000 <<<<<<
06-05 18:34:51.750 D/AndroidRuntime( 6525): CheckJNI is ON
06-05 18:34:51.754 D/EGL_emulation( 1711): eglMakeCurrent: 0xa5b6bd80: ver 2 0 (tinfo 0xb1367140)
06-05 18:34:51.756 D/EGL_emulation( 1711): eglMakeCurrent: 0xa5b6bd80: ver 2 0 (tinfo 0xb1367140)
06-05 18:34:51.765 W/art     ( 6525): Unexpected CPU variant for X86 using defaults: x86
06-05 18:34:51.767 D/ICU     ( 6525): No timezone override file found: /data/misc/zoneinfo/current/icu/icu_tzdata.dat
06-05 18:34:51.771 D/EGL_emulation( 1711): eglMakeCurrent: 0xa5b6bd80: ver 2 0 (tinfo 0xb1367140)
06-05 18:34:51.774 D/EGL_emulation( 1711): eglMakeCurrent: 0xa5b6bd80: ver 2 0 (tinfo 0xb1367140)
06-05 18:34:51.776 E/memtrack( 6525): Couldn't load memtrack module (No such file or directory)
06-05 18:34:51.777 E/android.os.Debug( 6525): failed to load memtrack module: -2
06-05 18:34:51.777 I/Radio-JNI( 6525): register_android_hardware_Radio DONE
06-05 18:34:51.783 D/AndroidRuntime( 6525): Calling main entry com.android.commands.am.Am
06-05 18:34:51.784 I/ActivityManager( 1629): Force stopping com.evancharlton.mileage appid=10160 user=0: start instr
06-05 18:34:51.784 I/ActivityManager( 1629): Killing 6473:com.evancharlton.mileage/u0a160 (adj 0): stop com.evancharlton.mileage
06-05 18:34:51.784 D/ActivityManager( 1629): cleanUpApplicationRecord -- 6473
06-05 18:34:51.785 I/WindowManager( 1629): Destroying surface Surface(name=com.evancharlton.mileage/com.evancharlton.mileage.charts.AverageVolumeChart) called by com.android.server.wm.WindowStateAnimator.destroySurface:2016 com.android.server.wm.WindowStateAnimator.destroySurfaceLocked:882 com.android.server.wm.WindowState.removeLocked:1456 com.android.server.wm.WindowManagerService.removeWindowInnerLocked:2484 com.android.server.wm.WindowManagerService.removeWindowLocked:2442 com.android.server.wm.WindowManagerService.removeWindowLocked:2311 com.android.server.wm.AppWindowToken.removeAllWindows:530 com.android.server.wm.AppWindowToken.removeAppFromTaskLocked:326 
06-05 18:34:51.787 D/EGL_emulation( 1711): eglMakeCurrent: 0xa5b6bd80: ver 2 0 (tinfo 0xb1367140)
06-05 18:34:51.790 W/ActivityManager( 1629): Crash of app com.evancharlton.mileage running instrumentation ComponentInfo{com.evancharlton.mileage.test/sh.calaba.instrumentationbackend.CalabashInstrumentationTestRunner}
06-05 18:34:51.790 I/ActivityManager( 1629): Force stopping com.evancharlton.mileage appid=10160 user=0: finished inst
06-05 18:34:51.790 D/EGL_emulation( 1711): eglMakeCurrent: 0xa5b6bd80: ver 2 0 (tinfo 0xb1367140)
06-05 18:34:51.796 I/art     ( 6535): Not late-enabling -Xcheck:jni (already on)
06-05 18:34:51.796 W/art     ( 6535): Unexpected CPU variant for X86 using defaults: x86
06-05 18:34:51.807 I/ActivityManager( 1629): Start proc 6535:com.evancharlton.mileage/u0a160 for added application com.evancharlton.mileage
06-05 18:34:51.808 D/AndroidRuntime( 6525): Shutting down VM
06-05 18:34:51.808 D/EGL_emulation( 1711): eglMakeCurrent: 0xa5b6bd80: ver 2 0 (tinfo 0xb1367140)
06-05 18:34:51.813 D/EGL_emulation( 1711): eglMakeCurrent: 0xa5b6bd80: ver 2 0 (tinfo 0xb1367140)
06-05 18:34:51.818 W/System  ( 6535): ClassLoader referenced unknown path: /data/app/com.evancharlton.mileage.test-1/lib/x86
06-05 18:34:51.818 W/System  ( 6535): ClassLoader referenced unknown path: /data/app/com.evancharlton.mileage-1/lib/x86
06-05 18:34:51.821 D/EGL_emulation( 1711): eglMakeCurrent: 0xa5b6bd80: ver 2 0 (tinfo 0xb1367140)
06-05 18:34:51.822 W/System  ( 6535): ClassLoader referenced unknown path: 
06-05 18:34:51.823 D/EGL_emulation( 1711): eglMakeCurrent: 0xa5b6bd80: ver 2 0 (tinfo 0xb1367140)
06-05 18:34:51.826 I/System.out( 6535): Main activity name automatically set to: com.evancharlton.mileage.Mileage
06-05 18:34:51.826 I/System.out( 6535): Calabash did not load Mono. This is only a problem if you are trying to test a Mono application
06-05 18:34:51.826 I/calabash( 6535): Test server port: 7102
06-05 18:34:51.827 I/InstrumentationBackend( 6535): Added:'GetPreferences', with key:'get_preferences'
06-05 18:34:51.831 I/WindowManager( 1629): WIN DEATH: Window{2499348 u0 com.evancharlton.mileage/com.evancharlton.mileage.Mileage EXITING}
06-05 18:34:51.837 I/InstrumentationBackend( 6535): Added:'SetPreferences', with key:'set_preferences'
06-05 18:34:51.837 I/InstrumentationBackend( 6535): Added:'ClearPreferences', with key:'clear_preferences'
06-05 18:34:51.837 I/InstrumentationBackend( 6535): Added:'PressElement', with key:'press_l10n_element'
06-05 18:34:51.837 I/InstrumentationBackend( 6535): Added:'WaitForElement', with key:'wait_for_l10n_element'
06-05 18:34:51.838 I/InstrumentationBackend( 6535): Added:'NullAction', with key:'nullAction'
06-05 18:34:51.838 I/InstrumentationBackend( 6535): Added:'PressKey', with key:'press_key'
06-05 18:34:51.838 I/InstrumentationBackend( 6535): Added:'SetActivityOrientation', with key:'set_activity_orientation'
06-05 18:34:51.838 I/InstrumentationBackend( 6535): Added:'GetActivityOrientation', with key:'get_activity_orientation'
06-05 18:34:51.838 I/InstrumentationBackend( 6535): Added:'FakeGPSLocation', with key:'set_gps_coordinates'
06-05 18:34:51.838 I/InstrumentationBackend( 6535): Added:'SetPropertyByCssSelector', with key:'set_property_by_css_selector'
06-05 18:34:51.838 I/InstrumentationBackend( 6535): Added:'GetUrl', with key:'get_url'
06-05 18:34:51.838 I/InstrumentationBackend( 6535): Added:'ScrollTo', with key:'scroll_to'
06-05 18:34:51.838 I/InstrumentationBackend( 6535): Added:'GetLoadProgress', with key:'get_load_progress'
06-05 18:34:51.838 I/InstrumentationBackend( 6535): Added:'DumpHtml', with key:'dump_html'
06-05 18:34:51.838 I/InstrumentationBackend( 6535): Added:'DumpBodyHtml', with key:'dump_body_html'
06-05 18:34:51.839 I/InstrumentationBackend( 6535): Added:'EnterTextByCssSelector', with key:'enter_text_by_selector'
06-05 18:34:51.839 I/InstrumentationBackend( 6535): Added:'AndroidSDKVersion', with key:'android_sdk_version'
06-05 18:34:51.839 I/InstrumentationBackend( 6535): Added:'Version', with key:'version'
06-05 18:34:51.839 I/InstrumentationBackend( 6535): Added:'Drag', with key:'drag'
06-05 18:34:51.839 I/InstrumentationBackend( 6535): Added:'TouchCoordinates', with key:'touch_coordinate'
06-05 18:34:51.839 I/InstrumentationBackend( 6535): Added:'LongPressCoordinate', with key:'long_press_coordinate'
06-05 18:34:51.839 I/InstrumentationBackend( 6535): Added:'DragCoordinates', with key:'drag_coordinates'
06-05 18:34:51.839 I/InstrumentationBackend( 6535): Added:'ResumeApplication', with key:'resume_application'
06-05 18:34:51.839 I/InstrumentationBackend( 6535): Added:'Swipe', with key:'swipe'
06-05 18:34:51.839 I/InstrumentationBackend( 6535): Added:'DoubleTapCoordinate', with key:'double_tap_coordinate'
06-05 18:34:51.839 I/InstrumentationBackend( 6535): Added:'ClickOnScreen', with key:'click_on_screen'
06-05 18:34:51.839 I/InstrumentationBackend( 6535): Added:'GetActivityName', with key:'get_activity_name'
06-05 18:34:51.839 I/InstrumentationBackend( 6535): Added:'ScrollToView', with key:'scroll_to_view'
06-05 18:34:51.839 I/InstrumentationBackend( 6535): Added:'ViewConfiguration', with key:'view_configuration'
06-05 18:34:51.840 I/InstrumentationBackend( 6535): Added:'IsCurrentActivityFocused', with key:'is_current_activity_focused'
06-05 18:34:51.840 I/InstrumentationBackend( 6535): Added:'SendTcp', with key:'send_tcp'
06-05 18:34:51.840 I/InstrumentationBackend( 6535): Added:'DpToDevicePixel', with key:'dp_to_device_pixel'
06-05 18:34:51.840 I/InstrumentationBackend( 6535): Added:'KeyboardEnterText', with key:'keyboard_enter_text'
06-05 18:34:51.840 I/InstrumentationBackend( 6535): Added:'DeleteSurroundingText', with key:'delete_surrounding_text'
06-05 18:34:51.840 I/InstrumentationBackend( 6535): Added:'SetComposingRegion', with key:'set_composing_region'
06-05 18:34:51.840 I/InstrumentationBackend( 6535): Added:'SetSelection', with key:'set_selection'
06-05 18:34:51.840 I/InstrumentationBackend( 6535): Added:'KeyboardKeyEvent', with key:'keyboard_key_event'
06-05 18:34:51.840 I/InstrumentationBackend( 6535): Added:'PressUserActionButton', with key:'press_user_action_button'
06-05 18:34:51.840 I/InstrumentationBackend( 6535): Added:'HideSoftKeyboard', with key:'hide_soft_keyboard'
06-05 18:34:51.840 I/InstrumentationBackend( 6535): Added:'ListActions', with key:'list_actions'
06-05 18:34:51.840 I/calabash( 6535): Instantiating http server at 7102
06-05 18:34:51.841 I/System.out( 6535): HTTP Daemon listening on: 7102
06-05 18:34:51.852 D/EGL_emulation( 1711): eglMakeCurrent: 0xa5b6bd80: ver 2 0 (tinfo 0xb1367140)
06-05 18:34:51.855 D/EGL_emulation( 1711): eglMakeCurrent: 0xa5b6bd80: ver 2 0 (tinfo 0xb1367140)
06-05 18:34:51.856 D/EGL_emulation( 1711): eglMakeCurrent: 0xa5b6bd80: ver 2 0 (tinfo 0xb1367140)
06-05 18:34:51.871 D/EGL_emulation( 1711): eglMakeCurrent: 0xa5b6bd80: ver 2 0 (tinfo 0xb1367140)
06-05 18:34:51.872 D/EGL_emulation( 1711): eglMakeCurrent: 0xa5b6bd80: ver 2 0 (tinfo 0xb1367140)
06-05 18:34:51.887 D/EGL_emulation( 1711): eglMakeCurrent: 0xa5b6bd80: ver 2 0 (tinfo 0xb1367140)
06-05 18:34:51.889 D/EGL_emulation( 1711): eglMakeCurrent: 0xa5b6bd80: ver 2 0 (tinfo 0xb1367140)
06-05 18:34:51.924 I/System.out( 6535): URI: //ping
06-05 18:34:51.924 I/System.out( 6535): params: {json={}
06-05 18:34:51.924 I/System.out( 6535): }
06-05 18:34:51.926 I/System.out( 6535): URI: //ping
06-05 18:34:51.926 I/System.out( 6535): params: {json={}
06-05 18:34:51.926 I/System.out( 6535): }
06-05 18:34:51.928 I/System.out( 6535): URI: //ready
06-05 18:34:51.928 I/System.out( 6535): params: {json={}
06-05 18:34:51.928 I/System.out( 6535): }
06-05 18:34:51.930 I/System.out( 6535): URI: //
06-05 18:34:51.930 I/System.out( 6535): params: {json={"command":"version","arguments":[]}
06-05 18:34:51.930 I/System.out( 6535): }
06-05 18:34:51.930 I/System.out( 6535): header: {content-type=application/json;charset=utf-8, date=Fri, 05 Jun 2020 23:34:52 GMT, accept=*/*, host=127.0.0.1:34783, content-length=36, user-agent=HTTPClient/1.0 (2.8.3, ruby 2.5.1 (2018-03-29))}
06-05 18:34:51.930 I/System.out( 6535): params: {json={"command":"version","arguments":[]}
06-05 18:34:51.930 I/System.out( 6535): }
06-05 18:34:51.930 I/System.out( 6535): ProP json = {"command":"version","arguments":[]}
06-05 18:34:51.930 I/System.out( 6535): files: {}
06-05 18:34:51.930 I/System.out( 6535): command: {"command":"version","arguments":[]}
06-05 18:34:51.933 I/InstrumentationBackend( 6535): Got command:'Command:'Line:null,version', arguments:'[]'
06-05 18:34:51.939 I/System.out( 6535): result:{"bonusInformation":[],"message":"0.9.8","success":true}
06-05 18:34:51.941 I/System.out( 6535): URI: //start-application
06-05 18:34:51.941 I/System.out( 6535): params: {json={"intent":null}
06-05 18:34:51.941 I/System.out( 6535): }
06-05 18:34:51.953 I/ActivityManager( 1629): START u0 {act=android.intent.action.MAIN cat=[android.intent.category.LAUNCHER] flg=0x10200000 cmp=com.evancharlton.mileage/.Mileage} from uid 10160 on display 0
06-05 18:34:51.961 I/calabash( 6535): newActivity1
06-05 18:34:51.971 I/calabash( 6535): newActivity1
06-05 18:34:51.973 W/ActivityManager( 1629): Bad activity token: android.os.BinderProxy@5684a84
06-05 18:34:51.973 W/ActivityManager( 1629): java.lang.ClassCastException: android.os.BinderProxy cannot be cast to com.android.server.am.ActivityRecord$Token
06-05 18:34:51.973 W/ActivityManager( 1629): 	at com.android.server.am.ActivityRecord.forTokenLocked(ActivityRecord.java:586)
06-05 18:34:51.973 W/ActivityManager( 1629): 	at com.android.server.am.ActivityRecord.isInStackLocked(ActivityRecord.java:1327)
06-05 18:34:51.973 W/ActivityManager( 1629): 	at com.android.server.am.ActivityRecord.getStackLocked(ActivityRecord.java:1332)
06-05 18:34:51.973 W/ActivityManager( 1629): 	at com.android.server.am.ActivityManagerService.getActivityDisplayId(ActivityManagerService.java:9806)
06-05 18:34:51.973 W/ActivityManager( 1629): 	at android.app.ActivityManagerNative.onTransact(ActivityManagerNative.java:2566)
06-05 18:34:51.973 W/ActivityManager( 1629): 	at com.android.server.am.ActivityManagerService.onTransact(ActivityManagerService.java:2757)
06-05 18:34:51.973 W/ActivityManager( 1629): 	at android.os.Binder.execTransact(Binder.java:565)
06-05 18:34:51.974 W/ActivityManager( 1629): Bad activity token: android.os.BinderProxy@5684a84
06-05 18:34:51.974 W/ActivityManager( 1629): java.lang.ClassCastException: android.os.BinderProxy cannot be cast to com.android.server.am.ActivityRecord$Token
06-05 18:34:51.974 W/ActivityManager( 1629): 	at com.android.server.am.ActivityRecord.forTokenLocked(ActivityRecord.java:586)
06-05 18:34:51.974 W/ActivityManager( 1629): 	at com.android.server.am.ActivityRecord.isInStackLocked(ActivityRecord.java:1327)
06-05 18:34:51.974 W/ActivityManager( 1629): 	at com.android.server.am.ActivityManagerService.setTaskDescription(ActivityManagerService.java:9358)
06-05 18:34:51.974 W/ActivityManager( 1629): 	at android.app.ActivityManagerNative.onTransact(ActivityManagerNative.java:2639)
06-05 18:34:51.974 W/ActivityManager( 1629): 	at com.android.server.am.ActivityManagerService.onTransact(ActivityManagerService.java:2757)
06-05 18:34:51.974 W/ActivityManager( 1629): 	at android.os.Binder.execTransact(Binder.java:565)
06-05 18:34:51.975 W/ActivityManager( 1629): Bad activity token: android.os.BinderProxy@5684a84
06-05 18:34:51.975 W/ActivityManager( 1629): java.lang.ClassCastException: android.os.BinderProxy cannot be cast to com.android.server.am.ActivityRecord$Token
06-05 18:34:51.975 W/ActivityManager( 1629): 	at com.android.server.am.ActivityRecord.forTokenLocked(ActivityRecord.java:586)
06-05 18:34:51.975 W/ActivityManager( 1629): 	at com.android.server.am.ActivityRecord.isInStackLocked(ActivityRecord.java:1327)
06-05 18:34:51.975 W/ActivityManager( 1629): 	at com.android.server.am.ActivityRecord.getStackLocked(ActivityRecord.java:1332)
06-05 18:34:51.975 W/ActivityManager( 1629): 	at com.android.server.am.ActivityManagerService.getActivityStackId(ActivityManagerService.java:9817)
06-05 18:34:51.975 W/ActivityManager( 1629): 	at android.app.ActivityManagerNative.onTransact(ActivityManagerNative.java:2856)
06-05 18:34:51.975 W/ActivityManager( 1629): 	at com.android.server.am.ActivityManagerService.onTransact(ActivityManagerService.java:2757)
06-05 18:34:51.975 W/ActivityManager( 1629): 	at android.os.Binder.execTransact(Binder.java:565)
06-05 18:34:51.989 D/gralloc_ranchu( 1346): gralloc_alloc: Creating ashmem region of size 9023488
06-05 18:34:51.999 W/ActivityManager( 1629): Bad activity token: android.os.BinderProxy@5684a84
06-05 18:34:51.999 W/ActivityManager( 1629): java.lang.ClassCastException: android.os.BinderProxy cannot be cast to com.android.server.am.ActivityRecord$Token
06-05 18:34:51.999 W/ActivityManager( 1629): 	at com.android.server.am.ActivityRecord.forTokenLocked(ActivityRecord.java:586)
06-05 18:34:51.999 W/ActivityManager( 1629): 	at com.android.server.am.ActivityRecord.isInStackLocked(ActivityRecord.java:1327)
06-05 18:34:51.999 W/ActivityManager( 1629): 	at com.android.server.am.ActivityManagerService.getActivityOptions(ActivityManagerService.java:12559)
06-05 18:34:51.999 W/ActivityManager( 1629): 	at android.app.ActivityManagerNative.onTransact(ActivityManagerNative.java:1933)
06-05 18:34:51.999 W/ActivityManager( 1629): 	at com.android.server.am.ActivityManagerService.onTransact(ActivityManagerService.java:2757)
06-05 18:34:51.999 W/ActivityManager( 1629): 	at android.os.Binder.execTransact(Binder.java:565)
06-05 18:34:52.000 W/ActivityManager( 1629): Bad activity token: android.os.BinderProxy@5684a84
06-05 18:34:52.000 W/ActivityManager( 1629): java.lang.ClassCastException: android.os.BinderProxy cannot be cast to com.android.server.am.ActivityRecord$Token
06-05 18:34:52.000 W/ActivityManager( 1629): 	at com.android.server.am.ActivityRecord.forTokenLocked(ActivityRecord.java:586)
06-05 18:34:52.000 W/ActivityManager( 1629): 	at com.android.server.am.ActivityRecord.isInStackLocked(ActivityRecord.java:1327)
06-05 18:34:52.000 W/ActivityManager( 1629): 	at com.android.server.am.ActivityManagerService.getActivityOptions(ActivityManagerService.java:12559)
06-05 18:34:52.000 W/ActivityManager( 1629): 	at android.app.ActivityManagerNative.onTransact(ActivityManagerNative.java:1933)
06-05 18:34:52.000 W/ActivityManager( 1629): 	at com.android.server.am.ActivityManagerService.onTransact(ActivityManagerService.java:2757)
06-05 18:34:52.000 W/ActivityManager( 1629): 	at android.os.Binder.execTransact(Binder.java:565)
06-05 18:34:52.042 D/EGL_emulation( 1711): eglMakeCurrent: 0xa5b6bd80: ver 2 0 (tinfo 0xb1367140)
06-05 18:34:52.043 V/PhoneStatusBar( 1711): setLightsOn(true)
06-05 18:34:52.048 D/EGL_emulation( 2150): eglMakeCurrent: 0xb4f852a0: ver 2 0 (tinfo 0xb4f832e0)
06-05 18:34:52.055 D/EGL_emulation( 1711): eglMakeCurrent: 0xa5b6bd80: ver 2 0 (tinfo 0xb1367140)
06-05 18:34:52.059 D/EGL_emulation( 1711): eglMakeCurrent: 0xa5b6bd80: ver 2 0 (tinfo 0xb1367140)
06-05 18:34:52.072 D/EGL_emulation( 1711): eglMakeCurrent: 0xa5b6bd80: ver 2 0 (tinfo 0xb1367140)
06-05 18:34:52.074 D/gralloc_ranchu( 1346): gralloc_alloc: Creating ashmem region of size 9023488
06-05 18:34:52.082 D/        ( 6535): HostConnection::get() New Host Connection established 0x98c25340, tid 6535
06-05 18:34:52.082 D/EGL_emulation( 1711): eglMakeCurrent: 0xa5b6bd80: ver 2 0 (tinfo 0xb1367140)
06-05 18:34:52.085 V/PhoneStatusBar( 1711): setLightsOn(true)
06-05 18:34:52.088 I/WindowManager( 1629): Destroying surface Surface(name=com.evancharlton.mileage/com.evancharlton.mileage.Mileage) called by com.android.server.wm.WindowStateAnimator.destroySurface:2016 com.android.server.wm.WindowStateAnimator.destroySurfaceLocked:882 com.android.server.wm.WindowState.removeLocked:1456 com.android.server.wm.WindowManagerService.removeWindowInnerLocked:2484 com.android.server.wm.AppWindowToken.destroySurfaces:365 com.android.server.wm.WindowStateAnimator.finishExit:565 com.android.server.wm.AppWindowAnimator.stepAnimationLocked:427 com.android.server.wm.WindowAnimator.updateAppWindowsLocked:196 
06-05 18:34:52.119 D/EGL_emulation( 1711): eglMakeCurrent: 0xa5b6bd80: ver 2 0 (tinfo 0xb1367140)
06-05 18:34:52.121 D/EGL_emulation( 1711): eglMakeCurrent: 0xa5b6bd80: ver 2 0 (tinfo 0xb1367140)
06-05 18:34:52.125 D/EGL_emulation( 1711): eglMakeCurrent: 0xa5b6bd80: ver 2 0 (tinfo 0xb1367140)
06-05 18:34:52.127 D/EGL_emulation( 1711): eglMakeCurrent: 0xa5b6bd80: ver 2 0 (tinfo 0xb1367140)
06-05 18:34:52.128 V/PhoneStatusBar( 1711): setLightsOn(true)
06-05 18:34:52.137 D/EGL_emulation( 1711): eglMakeCurrent: 0xa5b6bd80: ver 2 0 (tinfo 0xb1367140)
06-05 18:34:52.139 D/EGL_emulation( 1711): eglMakeCurrent: 0xa5b6bd80: ver 2 0 (tinfo 0xb1367140)
06-05 18:34:52.154 D/EGL_emulation( 1711): eglMakeCurrent: 0xa5b6bd80: ver 2 0 (tinfo 0xb1367140)
06-05 18:34:52.156 D/EGL_emulation( 1711): eglMakeCurrent: 0xa5b6bd80: ver 2 0 (tinfo 0xb1367140)
06-05 18:34:52.171 D/EGL_emulation( 1711): eglMakeCurrent: 0xa5b6bd80: ver 2 0 (tinfo 0xb1367140)
06-05 18:34:52.172 D/gralloc_ranchu( 1346): gralloc_alloc: Creating ashmem region of size 9023488
06-05 18:34:52.186 D/EGL_emulation( 1711): eglMakeCurrent: 0xa5b6bd80: ver 2 0 (tinfo 0xb1367140)
06-05 18:34:52.188 I/ActivityManager( 1629): Displayed com.evancharlton.mileage/.Mileage: +230ms
06-05 18:34:52.189 D/EGL_emulation( 1711): eglMakeCurrent: 0xa5b6bd80: ver 2 0 (tinfo 0xb1367140)
06-05 18:34:52.191 D/EGL_emulation( 1711): eglMakeCurrent: 0xa5b6bd80: ver 2 0 (tinfo 0xb1367140)
06-05 18:34:52.191 V/PhoneStatusBar( 1711): setLightsOn(true)
06-05 18:34:52.205 D/EGL_emulation( 1711): eglMakeCurrent: 0xa5b6bd80: ver 2 0 (tinfo 0xb1367140)
06-05 18:34:52.207 D/EGL_emulation( 1711): eglMakeCurrent: 0xa5b6bd80: ver 2 0 (tinfo 0xb1367140)
06-05 18:34:52.221 D/EGL_emulation( 1711): eglMakeCurrent: 0xa5b6bd80: ver 2 0 (tinfo 0xb1367140)
06-05 18:34:52.227 D/EGL_emulation( 1711): eglMakeCurrent: 0xa5b6bd80: ver 2 0 (tinfo 0xb1367140)
06-05 18:34:52.228 V/PhoneStatusBar( 1711): setLightsOn(true)
06-05 18:34:52.238 D/EGL_emulation( 1711): eglMakeCurrent: 0xa5b6bd80: ver 2 0 (tinfo 0xb1367140)
06-05 18:34:52.240 D/EGL_emulation( 1711): eglMakeCurrent: 0xa5b6bd80: ver 2 0 (tinfo 0xb1367140)
06-05 18:34:52.245 I/System.out( 6535): URI: //map
06-05 18:34:52.245 I/System.out( 6535): params: {json={"query":"* marked:'Statistics'","operation":{"method_name":"query","arguments":[]}}
06-05 18:34:52.245 I/System.out( 6535): }
06-05 18:34:52.254 D/EGL_emulation( 1711): eglMakeCurrent: 0xa5b6bd80: ver 2 0 (tinfo 0xb1367140)
06-05 18:34:52.258 W/ResourceType( 6535): No package identifier when getting name for resource number 0x00000001
06-05 18:34:52.277 I/System.out( 6535): URI: //gesture
06-05 18:34:52.277 I/System.out( 6535): params: {json={"query_timeout":5.0,"gestures":[{"query_string":"* marked:'Statistics'","touches":[{"x":50,"y":50,"offset_x":0,"offset_y":0,"wait":0.0,"time":0.2,"release":true,"query_string":null}]}]}
06-05 18:34:52.277 I/System.out( 6535): }
06-05 18:34:52.283 W/ResourceType( 6535): No package identifier when getting name for resource number 0x00000001
06-05 18:34:52.387 I/WindowManager( 1629): Destroying surface Surface(name=Starting com.evancharlton.mileage) called by com.android.server.wm.WindowStateAnimator.destroySurface:2016 com.android.server.wm.WindowStateAnimator.destroySurfaceLocked:882 com.android.server.wm.WindowState.destroyOrSaveSurface:2100 com.android.server.wm.AppWindowToken.destroySurfaces:363 com.android.server.wm.WindowStateAnimator.finishExit:565 com.android.server.wm.WindowStateAnimator.stepAnimationLocked:491 com.android.server.wm.WindowAnimator.updateWindowsLocked:303 com.android.server.wm.WindowAnimator.animateLocked:704 
06-05 18:34:52.388 V/PhoneStatusBar( 1711): setLightsOn(true)
06-05 18:34:52.420 V/PhoneStatusBar( 1711): setLightsOn(true)
06-05 18:34:52.487 V/PhoneStatusBar( 1711): setLightsOn(true)
06-05 18:34:52.506 I/calabash( 6535): newActivity1
06-05 18:34:52.518 I/System.out( 6535): URI: //map
06-05 18:34:52.518 I/System.out( 6535): params: {json={"query":"android.widget.ScrollView index:0","operation":{"method_name":"query","arguments":[]}}
06-05 18:34:52.518 I/System.out( 6535): }
06-05 18:34:52.520 W/ActivityManager( 1629): Bad activity token: android.os.BinderProxy@f6b6452
06-05 18:34:52.520 W/ActivityManager( 1629): java.lang.ClassCastException: android.os.BinderProxy cannot be cast to com.android.server.am.ActivityRecord$Token
06-05 18:34:52.520 W/ActivityManager( 1629): 	at com.android.server.am.ActivityRecord.forTokenLocked(ActivityRecord.java:586)
06-05 18:34:52.520 W/ActivityManager( 1629): 	at com.android.server.am.ActivityRecord.isInStackLocked(ActivityRecord.java:1327)
06-05 18:34:52.520 W/ActivityManager( 1629): 	at com.android.server.am.ActivityRecord.getStackLocked(ActivityRecord.java:1332)
06-05 18:34:52.520 W/ActivityManager( 1629): 	at com.android.server.am.ActivityManagerService.getActivityDisplayId(ActivityManagerService.java:9806)
06-05 18:34:52.520 W/ActivityManager( 1629): 	at android.app.ActivityManagerNative.onTransact(ActivityManagerNative.java:2566)
06-05 18:34:52.520 W/ActivityManager( 1629): 	at com.android.server.am.ActivityManagerService.onTransact(ActivityManagerService.java:2757)
06-05 18:34:52.520 W/ActivityManager( 1629): 	at android.os.Binder.execTransact(Binder.java:565)
06-05 18:34:52.522 W/ActivityManager( 1629): Bad activity token: android.os.BinderProxy@f6b6452
06-05 18:34:52.522 W/ActivityManager( 1629): java.lang.ClassCastException: android.os.BinderProxy cannot be cast to com.android.server.am.ActivityRecord$Token
06-05 18:34:52.522 W/ActivityManager( 1629): 	at com.android.server.am.ActivityRecord.forTokenLocked(ActivityRecord.java:586)
06-05 18:34:52.522 W/ActivityManager( 1629): 	at com.android.server.am.ActivityRecord.isInStackLocked(ActivityRecord.java:1327)
06-05 18:34:52.522 W/ActivityManager( 1629): 	at com.android.server.am.ActivityManagerService.setTaskDescription(ActivityManagerService.java:9358)
06-05 18:34:52.522 W/ActivityManager( 1629): 	at android.app.ActivityManagerNative.onTransact(ActivityManagerNative.java:2639)
06-05 18:34:52.522 W/ActivityManager( 1629): 	at com.android.server.am.ActivityManagerService.onTransact(ActivityManagerService.java:2757)
06-05 18:34:52.522 W/ActivityManager( 1629): 	at android.os.Binder.execTransact(Binder.java:565)
06-05 18:34:52.522 W/ActivityManager( 1629): Bad activity token: android.os.BinderProxy@f6b6452
06-05 18:34:52.522 W/ActivityManager( 1629): java.lang.ClassCastException: android.os.BinderProxy cannot be cast to com.android.server.am.ActivityRecord$Token
06-05 18:34:52.522 W/ActivityManager( 1629): 	at com.android.server.am.ActivityRecord.forTokenLocked(ActivityRecord.java:586)
06-05 18:34:52.522 W/ActivityManager( 1629): 	at com.android.server.am.ActivityRecord.isInStackLocked(ActivityRecord.java:1327)
06-05 18:34:52.522 W/ActivityManager( 1629): 	at com.android.server.am.ActivityRecord.getStackLocked(ActivityRecord.java:1332)
06-05 18:34:52.522 W/ActivityManager( 1629): 	at com.android.server.am.ActivityManagerService.getActivityStackId(ActivityManagerService.java:9817)
06-05 18:34:52.522 W/ActivityManager( 1629): 	at android.app.ActivityManagerNative.onTransact(ActivityManagerNative.java:2856)
06-05 18:34:52.522 W/ActivityManager( 1629): 	at com.android.server.am.ActivityManagerService.onTransact(ActivityManagerService.java:2757)
06-05 18:34:52.522 W/ActivityManager( 1629): 	at android.os.Binder.execTransact(Binder.java:565)
06-05 18:34:52.529 D/VehicleStatisticsActivity( 6535): Checking recalculation ...
06-05 18:34:52.530 D/VehicleStatisticsActivity( 6535): Recalculation not necessary.
06-05 18:34:52.554 W/ActivityManager( 1629): Bad activity token: android.os.BinderProxy@f6b6452
06-05 18:34:52.554 W/ActivityManager( 1629): java.lang.ClassCastException: android.os.BinderProxy cannot be cast to com.android.server.am.ActivityRecord$Token
06-05 18:34:52.554 W/ActivityManager( 1629): 	at com.android.server.am.ActivityRecord.forTokenLocked(ActivityRecord.java:586)
06-05 18:34:52.554 W/ActivityManager( 1629): 	at com.android.server.am.ActivityRecord.isInStackLocked(ActivityRecord.java:1327)
06-05 18:34:52.554 W/ActivityManager( 1629): 	at com.android.server.am.ActivityManagerService.getActivityOptions(ActivityManagerService.java:12559)
06-05 18:34:52.554 W/ActivityManager( 1629): 	at android.app.ActivityManagerNative.onTransact(ActivityManagerNative.java:1933)
06-05 18:34:52.554 W/ActivityManager( 1629): 	at com.android.server.am.ActivityManagerService.onTransact(ActivityManagerService.java:2757)
06-05 18:34:52.554 W/ActivityManager( 1629): 	at android.os.Binder.execTransact(Binder.java:565)
06-05 18:34:52.555 W/ActivityManager( 1629): Bad activity token: android.os.BinderProxy@f6b6452
06-05 18:34:52.555 W/ActivityManager( 1629): java.lang.ClassCastException: android.os.BinderProxy cannot be cast to com.android.server.am.ActivityRecord$Token
06-05 18:34:52.555 W/ActivityManager( 1629): 	at com.android.server.am.ActivityRecord.forTokenLocked(ActivityRecord.java:586)
06-05 18:34:52.555 W/ActivityManager( 1629): 	at com.android.server.am.ActivityRecord.isInStackLocked(ActivityRecord.java:1327)
06-05 18:34:52.555 W/ActivityManager( 1629): 	at com.android.server.am.ActivityManagerService.getActivityOptions(ActivityManagerService.java:12559)
06-05 18:34:52.555 W/ActivityManager( 1629): 	at android.app.ActivityManagerNative.onTransact(ActivityManagerNative.java:1933)
06-05 18:34:52.555 W/ActivityManager( 1629): 	at com.android.server.am.ActivityManagerService.onTransact(ActivityManagerService.java:2757)
06-05 18:34:52.555 W/ActivityManager( 1629): 	at android.os.Binder.execTransact(Binder.java:565)
06-05 18:34:52.556 D/VehicleStatisticsActivity( 6535): Checking recalculation ...
06-05 18:34:52.557 D/VehicleStatisticsActivity( 6535): Recalculation not necessary.
06-05 18:34:52.638 I/System.out( 6535): URI: //map
06-05 18:34:52.638 I/System.out( 6535): params: {json={"query":"android.widget.AbsListView index:0","operation":{"method_name":"query","arguments":[]}}
06-05 18:34:52.638 I/System.out( 6535): }
06-05 18:34:52.643 I/art     ( 6535): Do partial code cache collection, code=30KB, data=29KB
06-05 18:34:52.643 I/art     ( 6535): After code cache collection, code=29KB, data=28KB
06-05 18:34:52.644 I/art     ( 6535): Increasing code cache capacity to 128KB
06-05 18:34:52.653 I/System.out( 6535): URI: //map
06-05 18:34:52.653 I/System.out( 6535): params: {json={"query":"android.widget.AbsListView index:0","operation":{"method_name":"query","arguments":[]}}
06-05 18:34:52.653 I/System.out( 6535): }
06-05 18:34:52.668 I/System.out( 6535): URI: //map
06-05 18:34:52.668 I/System.out( 6535): params: {json={"query":"android.widget.AbsListView index:0","operation":{"method_name":"query","arguments":[]}}
06-05 18:34:52.668 I/System.out( 6535): }
06-05 18:34:52.682 I/System.out( 6535): URI: //map
06-05 18:34:52.682 I/System.out( 6535): params: {json={"query":"android.widget.AbsListView index:0","operation":{"method_name":"query","arguments":["getFirstVisiblePosition"]}}
06-05 18:34:52.682 I/System.out( 6535): }
06-05 18:34:52.697 I/System.out( 6535): URI: //map
06-05 18:34:52.697 I/System.out( 6535): params: {json={"query":"android.widget.AbsListView index:0","operation":{"method_name":"query","arguments":["getLastVisiblePosition"]}}
06-05 18:34:52.697 I/System.out( 6535): }
06-05 18:34:52.710 I/System.out( 6535): URI: //map
06-05 18:34:52.710 I/System.out( 6535): params: {json={"query":"android.widget.AbsListView index:0","operation":{"method_name":"query","arguments":[{"method_name":"setSelection","arguments":[26]}]}}
06-05 18:34:52.710 I/System.out( 6535): }
06-05 18:34:52.727 I/System.out( 6535): URI: //map
06-05 18:34:52.727 I/System.out( 6535): params: {json={"query":"* marked:'Total fuel'","operation":{"method_name":"query","arguments":[]}}
06-05 18:34:52.727 I/System.out( 6535): }
06-05 18:34:52.775 D/gralloc_ranchu( 1346): gralloc_alloc: Creating ashmem region of size 9023488
06-05 18:34:52.787 V/PhoneStatusBar( 1711): setLightsOn(true)
06-05 18:34:52.788 V/PhoneStatusBar( 1711): setLightsOn(true)
06-05 18:34:52.790 W/OpenGLRenderer( 2150): Incorrectly called buildLayer on View: ShortcutAndWidgetContainer, destroying layer...
06-05 18:34:52.805 I/WindowManager( 1629): Destroying surface Surface(name=com.android.launcher3/com.android.launcher3.Launcher) called by com.android.server.wm.WindowStateAnimator.destroySurface:2016 com.android.server.wm.WindowStateAnimator.destroySurfaceLocked:882 com.android.server.wm.WindowState.destroyOrSaveSurface:2100 com.android.server.wm.AppWindowToken.destroySurfaces:363 com.android.server.wm.AppWindowToken.notifyAppStopped:389 com.android.server.wm.WindowManagerService.notifyAppStopped:4463 com.android.server.am.ActivityStack.activityStoppedLocked:1252 com.android.server.am.ActivityManagerService.activityStopped:6903 
06-05 18:34:52.805 V/PhoneStatusBar( 1711): setLightsOn(true)
06-05 18:34:52.827 W/ResourceType( 6535): No package identifier when getting name for resource number 0x00000001
06-05 18:34:52.840 I/System.out( 6535): URI: //gesture
06-05 18:34:52.840 I/System.out( 6535): params: {json={"query_timeout":5.0,"gestures":[{"query_string":"* marked:'Total fuel'","touches":[{"x":50,"y":50,"offset_x":0,"offset_y":0,"wait":0.0,"time":0.2,"release":true,"query_string":null}]}]}
06-05 18:34:52.840 I/System.out( 6535): }
06-05 18:34:52.845 W/ResourceType( 6535): No package identifier when getting name for resource number 0x00000001
06-05 18:34:53.073 I/ActivityManager( 1629): START u0 {cmp=com.evancharlton.mileage/.charts.TotalVolumeChart (has extras)} from uid 10160 on display 0
06-05 18:34:53.078 V/PhoneStatusBar( 1711): setLightsOn(true)
06-05 18:34:53.081 V/PhoneStatusBar( 1711): setLightsOn(true)
06-05 18:34:53.106 I/System.out( 6535): URI: //map
06-05 18:34:53.106 I/System.out( 6535): params: {json={"query":"* {text CONTAINS[c] 'Total fuel purchased'}","operation":{"method_name":"query","arguments":[]}}
06-05 18:34:53.106 I/System.out( 6535): }
06-05 18:34:53.132 I/calabash( 6535): newActivity1
06-05 18:34:53.135 W/aiCharts( 6535): License file is invalid or missing. 
06-05 18:34:53.135 W/aiCharts( 6535): Please place proper license.lic to /assets folder.
06-05 18:34:53.148 V/PhoneStatusBar( 1711): setLightsOn(true)
06-05 18:34:53.170 V/PhoneStatusBar( 1711): setLightsOn(true)
06-05 18:34:53.176 I/WindowManager( 1629): Destroying surface Surface(name=Creating chart…) called by com.android.server.wm.WindowStateAnimator.destroySurface:2016 com.android.server.wm.WindowStateAnimator.destroySurfaceLocked:882 com.android.server.wm.WindowState.removeLocked:1456 com.android.server.wm.WindowManagerService.removeWindowInnerLocked:2484 com.android.server.wm.WindowManagerService.removeWindowLocked:2442 com.android.server.wm.WindowManagerService.removeWindowLocked:2311 com.android.server.wm.WindowManagerService.removeWindow:2306 com.android.server.wm.Session.remove:202 
06-05 18:34:53.179 D/gralloc_ranchu( 1346): gralloc_alloc: Creating ashmem region of size 9023488
06-05 18:34:53.187 V/PhoneStatusBar( 1711): setLightsOn(true)
06-05 18:34:53.204 V/PhoneStatusBar( 1711): setLightsOn(true)
06-05 18:34:53.220 I/ActivityManager( 1629): Displayed com.evancharlton.mileage/.charts.TotalVolumeChart: +91ms
06-05 18:34:53.237 V/PhoneStatusBar( 1711): setLightsOn(true)
06-05 18:34:53.438 V/PhoneStatusBar( 1711): setLightsOn(true)
06-05 18:34:53.470 I/System.out( 6535): URI: //map
06-05 18:34:53.470 I/System.out( 6535): params: {json={"query":"* {text CONTAINS[c] 'Total fuel purchased'}","operation":{"method_name":"query","arguments":[]}}
06-05 18:34:53.470 I/System.out( 6535): }
06-05 18:34:53.490 I/System.out( 6535): URI: //
06-05 18:34:53.490 I/System.out( 6535): params: {json={"command":"press_key","arguments":["KEYCODE_BACK"]}
06-05 18:34:53.490 I/System.out( 6535): }
06-05 18:34:53.490 I/System.out( 6535): header: {content-type=application/json;charset=utf-8, date=Fri, 05 Jun 2020 23:34:53 GMT, accept=*/*, host=127.0.0.1:34783, content-length=52, user-agent=HTTPClient/1.0 (2.8.3, ruby 2.5.1 (2018-03-29))}
06-05 18:34:53.490 I/System.out( 6535): params: {json={"command":"press_key","arguments":["KEYCODE_BACK"]}
06-05 18:34:53.490 I/System.out( 6535): }
06-05 18:34:53.490 I/System.out( 6535): ProP json = {"command":"press_key","arguments":["KEYCODE_BACK"]}
06-05 18:34:53.490 I/System.out( 6535): files: {}
06-05 18:34:53.490 I/System.out( 6535): command: {"command":"press_key","arguments":["KEYCODE_BACK"]}
06-05 18:34:53.492 I/InstrumentationBackend( 6535): Got command:'Command:'Line:null,press_key', arguments:'[KEYCODE_BACK]'
06-05 18:34:53.495 V/PhoneStatusBar( 1711): setLightsOn(true)
06-05 18:34:53.502 V/PhoneStatusBar( 1711): setLightsOn(true)
06-05 18:34:53.506 I/art     ( 6535): Do partial code cache collection, code=60KB, data=62KB
06-05 18:34:53.506 I/art     ( 6535): After code cache collection, code=59KB, data=61KB
06-05 18:34:53.506 I/art     ( 6535): Increasing code cache capacity to 256KB
06-05 18:34:53.506 I/System.out( 6535): result:{"bonusInformation":[],"message":"","success":true}
06-05 18:34:53.508 D/VehicleStatisticsActivity( 6535): Checking recalculation ...
06-05 18:34:53.509 D/VehicleStatisticsActivity( 6535): Recalculation not necessary.
06-05 18:34:53.519 I/System.out( 6535): URI: //map
06-05 18:34:53.519 I/System.out( 6535): params: {json={"query":"* {text CONTAINS[c] 'Statistics'}","operation":{"method_name":"query","arguments":[]}}
06-05 18:34:53.519 I/System.out( 6535): }
06-05 18:34:53.521 V/PhoneStatusBar( 1711): setLightsOn(true)
06-05 18:34:53.537 D/gralloc_ranchu( 1346): gralloc_alloc: Creating ashmem region of size 9023488
06-05 18:34:53.537 V/PhoneStatusBar( 1711): setLightsOn(true)
06-05 18:34:53.554 V/PhoneStatusBar( 1711): setLightsOn(true)
06-05 18:34:53.587 V/PhoneStatusBar( 1711): setLightsOn(true)
