--------- beginning of main
06-06 00:59:38.733 V/PhoneStatusBar( 1712): setLightsOn(true)
06-06 00:59:38.735 D/gralloc_ranchu( 1347): gralloc_alloc: Creating ashmem region of size 3145728
06-06 00:59:38.739 E/EGL_emulation( 1347): tid 1347: eglCreateSyncKHR(1901): error 0x3004 (EGL_BAD_ATTRIBUTE)
--------- beginning of system
06-06 00:59:38.749 W/ActivityManager( 1631): Finishing task with all activities already finished
06-06 00:59:38.749 W/ActivityManager( 1631): Duplicate finish request for ActivityRecord{b94a7a1 u0 com.evancharlton.mileage/.Mileage t10853 f}
06-06 00:59:38.749 W/ActivityManager( 1631): Finishing task with all activities already finished
06-06 00:59:38.749 W/ActivityManager( 1631): Duplicate finish request for ActivityRecord{b94a7a1 u0 com.evancharlton.mileage/.Mileage t10853 f}
06-06 00:59:38.749 W/ActivityManager( 1631): Finishing task with all activities already finished
06-06 00:59:38.749 W/ActivityManager( 1631): Duplicate finish request for ActivityRecord{b94a7a1 u0 com.evancharlton.mileage/.Mileage t10853 f}
06-06 00:59:38.749 W/ActivityManager( 1631): Finishing task with all activities already finished
06-06 00:59:38.749 W/ActivityManager( 1631): Duplicate finish request for ActivityRecord{b94a7a1 u0 com.evancharlton.mileage/.Mileage t10853 f}
06-06 00:59:38.750 W/ActivityManager( 1631): Finishing task with all activities already finished
06-06 00:59:38.750 W/ActivityManager( 1631): Duplicate finish request for ActivityRecord{b94a7a1 u0 com.evancharlton.mileage/.Mileage t10853 f}
06-06 00:59:38.750 W/ActivityManager( 1631): Finishing task with all activities already finished
06-06 00:59:38.750 W/ActivityManager( 1631): Duplicate finish request for ActivityRecord{3ddab03 u0 com.evancharlton.mileage/.charts.AverageVolumeChart t10853 f}
06-06 00:59:38.750 W/ActivityManager( 1631): Finishing task with all activities already finished
06-06 00:59:38.750 W/ActivityManager( 1631): Duplicate finish request for ActivityRecord{3ddab03 u0 com.evancharlton.mileage/.charts.AverageVolumeChart t10853 f}
06-06 00:59:38.750 W/ActivityManager( 1631): Finishing task with all activities already finished
06-06 00:59:38.750 W/ActivityManager( 1631): Duplicate finish request for ActivityRecord{b94a7a1 u0 com.evancharlton.mileage/.Mileage t10853 f}
06-06 00:59:38.750 W/ActivityManager( 1631): Finishing task with all activities already finished
06-06 00:59:38.750 W/ActivityManager( 1631): Duplicate finish request for ActivityRecord{b94a7a1 u0 com.evancharlton.mileage/.Mileage t10853 f}
06-06 00:59:38.768 D/EGL_emulation( 2076): eglMakeCurrent: 0xb0685360: ver 2 0 (tinfo 0xb06836b0)
06-06 00:59:38.786 D/EGL_emulation( 1712): eglMakeCurrent: 0xb0685360: ver 2 0 (tinfo 0xb06836c0)
06-06 00:59:38.800 D/EGL_emulation( 1712): eglMakeCurrent: 0xb0685360: ver 2 0 (tinfo 0xb06836c0)
06-06 00:59:38.802 D/EGL_emulation( 1712): eglMakeCurrent: 0xb0685360: ver 2 0 (tinfo 0xb06836c0)
06-06 00:59:38.817 D/EGL_emulation( 1712): eglMakeCurrent: 0xb0685360: ver 2 0 (tinfo 0xb06836c0)
06-06 00:59:38.818 D/EGL_emulation( 1712): eglMakeCurrent: 0xb0685360: ver 2 0 (tinfo 0xb06836c0)
06-06 00:59:38.833 D/EGL_emulation( 1712): eglMakeCurrent: 0xb0685360: ver 2 0 (tinfo 0xb06836c0)
06-06 00:59:38.835 D/EGL_emulation( 1712): eglMakeCurrent: 0xb0685360: ver 2 0 (tinfo 0xb06836c0)
06-06 00:59:38.850 D/EGL_emulation( 1712): eglMakeCurrent: 0xb0685360: ver 2 0 (tinfo 0xb06836c0)
06-06 00:59:38.854 D/EGL_emulation( 1712): eglMakeCurrent: 0xb0685360: ver 2 0 (tinfo 0xb06836c0)
06-06 00:59:38.867 D/EGL_emulation( 1712): eglMakeCurrent: 0xb0685360: ver 2 0 (tinfo 0xb06836c0)
06-06 00:59:38.869 D/EGL_emulation( 1712): eglMakeCurrent: 0xb0685360: ver 2 0 (tinfo 0xb06836c0)
06-06 00:59:38.883 D/EGL_emulation( 1712): eglMakeCurrent: 0xb0685360: ver 2 0 (tinfo 0xb06836c0)
06-06 00:59:38.887 D/EGL_emulation( 1712): eglMakeCurrent: 0xb0685360: ver 2 0 (tinfo 0xb06836c0)
06-06 00:59:38.894 D/AndroidRuntime(23795): >>>>>> START com.android.internal.os.RuntimeInit uid 2000 <<<<<<
06-06 00:59:38.895 D/AndroidRuntime(23795): CheckJNI is ON
06-06 00:59:38.900 D/EGL_emulation( 1712): eglMakeCurrent: 0xb0685360: ver 2 0 (tinfo 0xb06836c0)
06-06 00:59:38.901 D/EGL_emulation( 1712): eglMakeCurrent: 0xb0685360: ver 2 0 (tinfo 0xb06836c0)
06-06 00:59:38.906 W/art     (23795): Unexpected CPU variant for X86 using defaults: x86
06-06 00:59:38.908 D/ICU     (23795): No timezone override file found: /data/misc/zoneinfo/current/icu/icu_tzdata.dat
06-06 00:59:38.915 E/memtrack(23795): Couldn't load memtrack module (No such file or directory)
06-06 00:59:38.915 E/android.os.Debug(23795): failed to load memtrack module: -2
06-06 00:59:38.915 I/Radio-JNI(23795): register_android_hardware_Radio DONE
06-06 00:59:38.916 D/EGL_emulation( 1712): eglMakeCurrent: 0xb0685360: ver 2 0 (tinfo 0xb06836c0)
06-06 00:59:38.918 D/EGL_emulation( 1712): eglMakeCurrent: 0xb0685360: ver 2 0 (tinfo 0xb06836c0)
06-06 00:59:38.920 D/AndroidRuntime(23795): Calling main entry com.android.commands.am.Am
06-06 00:59:38.921 I/ActivityManager( 1631): Force stopping com.evancharlton.mileage appid=10374 user=0: start instr
06-06 00:59:38.921 I/ActivityManager( 1631): Killing 23743:com.evancharlton.mileage/u0a374 (adj 0): stop com.evancharlton.mileage
06-06 00:59:38.922 D/ActivityManager( 1631): cleanUpApplicationRecord -- 23743
06-06 00:59:38.922 I/WindowManager( 1631): Destroying surface Surface(name=com.evancharlton.mileage/com.evancharlton.mileage.charts.AverageVolumeChart) called by com.android.server.wm.WindowStateAnimator.destroySurface:2016 com.android.server.wm.WindowStateAnimator.destroySurfaceLocked:882 com.android.server.wm.WindowState.removeLocked:1456 com.android.server.wm.WindowManagerService.removeWindowInnerLocked:2484 com.android.server.wm.WindowManagerService.removeWindowLocked:2442 com.android.server.wm.WindowManagerService.removeWindowLocked:2311 com.android.server.wm.AppWindowToken.removeAllWindows:530 com.android.server.wm.AppWindowToken.removeAppFromTaskLocked:326 
06-06 00:59:38.923 W/ActivityManager( 1631): Crash of app com.evancharlton.mileage running instrumentation ComponentInfo{com.evancharlton.mileage.test/sh.calaba.instrumentationbackend.CalabashInstrumentationTestRunner}
06-06 00:59:38.923 I/ActivityManager( 1631): Force stopping com.evancharlton.mileage appid=10374 user=0: finished inst
06-06 00:59:38.925 I/art     (23805): Not late-enabling -Xcheck:jni (already on)
06-06 00:59:38.926 W/art     (23805): Unexpected CPU variant for X86 using defaults: x86
06-06 00:59:38.933 D/EGL_emulation( 1712): eglMakeCurrent: 0xb0685360: ver 2 0 (tinfo 0xb06836c0)
06-06 00:59:38.934 I/ActivityManager( 1631): Start proc 23805:com.evancharlton.mileage/u0a374 for added application com.evancharlton.mileage
06-06 00:59:38.934 D/AndroidRuntime(23795): Shutting down VM
06-06 00:59:38.936 D/EGL_emulation( 1712): eglMakeCurrent: 0xb0685360: ver 2 0 (tinfo 0xb06836c0)
06-06 00:59:38.940 W/System  (23805): ClassLoader referenced unknown path: /data/app/com.evancharlton.mileage.test-1/lib/x86
06-06 00:59:38.940 W/System  (23805): ClassLoader referenced unknown path: /data/app/com.evancharlton.mileage-1/lib/x86
06-06 00:59:38.942 W/System  (23805): ClassLoader referenced unknown path: 
06-06 00:59:38.945 I/System.out(23805): Main activity name automatically set to: com.evancharlton.mileage.Mileage
06-06 00:59:38.945 I/System.out(23805): Calabash did not load Mono. This is only a problem if you are trying to test a Mono application
06-06 00:59:38.946 I/calabash(23805): Test server port: 7102
06-06 00:59:38.946 I/InstrumentationBackend(23805): Added:'GetPreferences', with key:'get_preferences'
06-06 00:59:38.949 I/InstrumentationBackend(23805): Added:'SetPreferences', with key:'set_preferences'
06-06 00:59:38.949 I/InstrumentationBackend(23805): Added:'ClearPreferences', with key:'clear_preferences'
06-06 00:59:38.949 I/InstrumentationBackend(23805): Added:'PressElement', with key:'press_l10n_element'
06-06 00:59:38.950 I/InstrumentationBackend(23805): Added:'WaitForElement', with key:'wait_for_l10n_element'
06-06 00:59:38.950 I/InstrumentationBackend(23805): Added:'NullAction', with key:'nullAction'
06-06 00:59:38.950 I/InstrumentationBackend(23805): Added:'PressKey', with key:'press_key'
06-06 00:59:38.950 I/InstrumentationBackend(23805): Added:'SetActivityOrientation', with key:'set_activity_orientation'
06-06 00:59:38.950 I/InstrumentationBackend(23805): Added:'GetActivityOrientation', with key:'get_activity_orientation'
06-06 00:59:38.950 I/InstrumentationBackend(23805): Added:'FakeGPSLocation', with key:'set_gps_coordinates'
06-06 00:59:38.950 I/InstrumentationBackend(23805): Added:'SetPropertyByCssSelector', with key:'set_property_by_css_selector'
06-06 00:59:38.950 D/EGL_emulation( 1712): eglMakeCurrent: 0xb0685360: ver 2 0 (tinfo 0xb06836c0)
06-06 00:59:38.950 I/InstrumentationBackend(23805): Added:'GetUrl', with key:'get_url'
06-06 00:59:38.950 I/InstrumentationBackend(23805): Added:'ScrollTo', with key:'scroll_to'
06-06 00:59:38.950 I/InstrumentationBackend(23805): Added:'GetLoadProgress', with key:'get_load_progress'
06-06 00:59:38.950 I/InstrumentationBackend(23805): Added:'DumpHtml', with key:'dump_html'
06-06 00:59:38.950 I/InstrumentationBackend(23805): Added:'DumpBodyHtml', with key:'dump_body_html'
06-06 00:59:38.950 I/InstrumentationBackend(23805): Added:'EnterTextByCssSelector', with key:'enter_text_by_selector'
06-06 00:59:38.951 I/InstrumentationBackend(23805): Added:'AndroidSDKVersion', with key:'android_sdk_version'
06-06 00:59:38.951 I/InstrumentationBackend(23805): Added:'Version', with key:'version'
06-06 00:59:38.951 I/InstrumentationBackend(23805): Added:'Drag', with key:'drag'
06-06 00:59:38.951 I/InstrumentationBackend(23805): Added:'TouchCoordinates', with key:'touch_coordinate'
06-06 00:59:38.951 I/InstrumentationBackend(23805): Added:'LongPressCoordinate', with key:'long_press_coordinate'
06-06 00:59:38.951 I/InstrumentationBackend(23805): Added:'DragCoordinates', with key:'drag_coordinates'
06-06 00:59:38.951 I/InstrumentationBackend(23805): Added:'ResumeApplication', with key:'resume_application'
06-06 00:59:38.951 I/InstrumentationBackend(23805): Added:'Swipe', with key:'swipe'
06-06 00:59:38.951 I/InstrumentationBackend(23805): Added:'DoubleTapCoordinate', with key:'double_tap_coordinate'
06-06 00:59:38.951 I/InstrumentationBackend(23805): Added:'ClickOnScreen', with key:'click_on_screen'
06-06 00:59:38.951 I/InstrumentationBackend(23805): Added:'GetActivityName', with key:'get_activity_name'
06-06 00:59:38.951 I/InstrumentationBackend(23805): Added:'ScrollToView', with key:'scroll_to_view'
06-06 00:59:38.951 I/InstrumentationBackend(23805): Added:'ViewConfiguration', with key:'view_configuration'
06-06 00:59:38.951 I/InstrumentationBackend(23805): Added:'IsCurrentActivityFocused', with key:'is_current_activity_focused'
06-06 00:59:38.951 I/InstrumentationBackend(23805): Added:'SendTcp', with key:'send_tcp'
06-06 00:59:38.951 I/InstrumentationBackend(23805): Added:'DpToDevicePixel', with key:'dp_to_device_pixel'
06-06 00:59:38.951 I/InstrumentationBackend(23805): Added:'KeyboardEnterText', with key:'keyboard_enter_text'
06-06 00:59:38.951 I/InstrumentationBackend(23805): Added:'DeleteSurroundingText', with key:'delete_surrounding_text'
06-06 00:59:38.951 I/InstrumentationBackend(23805): Added:'SetComposingRegion', with key:'set_composing_region'
06-06 00:59:38.951 I/InstrumentationBackend(23805): Added:'SetSelection', with key:'set_selection'
06-06 00:59:38.951 I/InstrumentationBackend(23805): Added:'KeyboardKeyEvent', with key:'keyboard_key_event'
06-06 00:59:38.951 D/EGL_emulation( 1712): eglMakeCurrent: 0xb0685360: ver 2 0 (tinfo 0xb06836c0)
06-06 00:59:38.951 I/InstrumentationBackend(23805): Added:'PressUserActionButton', with key:'press_user_action_button'
06-06 00:59:38.952 I/InstrumentationBackend(23805): Added:'HideSoftKeyboard', with key:'hide_soft_keyboard'
06-06 00:59:38.952 I/InstrumentationBackend(23805): Added:'ListActions', with key:'list_actions'
06-06 00:59:38.952 I/calabash(23805): Instantiating http server at 7102
06-06 00:59:38.952 I/System.out(23805): HTTP Daemon listening on: 7102
06-06 00:59:38.968 D/EGL_emulation( 1712): eglMakeCurrent: 0xb0685360: ver 2 0 (tinfo 0xb06836c0)
06-06 00:59:38.975 D/EGL_emulation( 1712): eglMakeCurrent: 0xb0685360: ver 2 0 (tinfo 0xb06836c0)
06-06 00:59:38.986 W/InputDispatcher( 1631): channel '41ee6e4 com.evancharlton.mileage/com.evancharlton.mileage.Mileage (server)' ~ Consumer closed input channel or an error occurred.  events=0x9
06-06 00:59:38.986 I/WindowManager( 1631): WIN DEATH: Window{41ee6e4 u0 com.evancharlton.mileage/com.evancharlton.mileage.Mileage EXITING}
06-06 00:59:38.986 E/InputDispatcher( 1631): channel '41ee6e4 com.evancharlton.mileage/com.evancharlton.mileage.Mileage (server)' ~ Channel is unrecoverably broken and will be disposed!
06-06 00:59:38.986 W/InputDispatcher( 1631): Attempted to unregister already unregistered input channel '41ee6e4 com.evancharlton.mileage/com.evancharlton.mileage.Mileage (server)'
06-06 00:59:38.987 D/EGL_emulation( 1712): eglMakeCurrent: 0xb0685360: ver 2 0 (tinfo 0xb06836c0)
06-06 00:59:39.014 D/EGL_emulation( 1712): eglMakeCurrent: 0xb0685360: ver 2 0 (tinfo 0xb06836c0)
06-06 00:59:39.017 D/EGL_emulation( 1712): eglMakeCurrent: 0xb0685360: ver 2 0 (tinfo 0xb06836c0)
06-06 00:59:39.043 I/System.out(23805): URI: //ping
06-06 00:59:39.043 I/System.out(23805): params: {json={}
06-06 00:59:39.043 I/System.out(23805): }
06-06 00:59:39.046 I/System.out(23805): URI: //ping
06-06 00:59:39.046 I/System.out(23805): params: {json={}
06-06 00:59:39.046 I/System.out(23805): }
06-06 00:59:39.048 I/System.out(23805): URI: //ready
06-06 00:59:39.048 I/System.out(23805): params: {json={}
06-06 00:59:39.048 I/System.out(23805): }
06-06 00:59:39.051 I/System.out(23805): URI: //
06-06 00:59:39.051 I/System.out(23805): params: {json={"command":"version","arguments":[]}
06-06 00:59:39.051 I/System.out(23805): }
06-06 00:59:39.051 I/System.out(23805): header: {content-type=application/json;charset=utf-8, date=Sat, 06 Jun 2020 05:59:39 GMT, accept=*/*, host=127.0.0.1:34777, content-length=36, user-agent=HTTPClient/1.0 (2.8.3, ruby 2.5.1 (2018-03-29))}
06-06 00:59:39.051 I/System.out(23805): params: {json={"command":"version","arguments":[]}
06-06 00:59:39.051 I/System.out(23805): }
06-06 00:59:39.051 I/System.out(23805): ProP json = {"command":"version","arguments":[]}
06-06 00:59:39.051 I/System.out(23805): files: {}
06-06 00:59:39.051 I/System.out(23805): command: {"command":"version","arguments":[]}
06-06 00:59:39.054 I/InstrumentationBackend(23805): Got command:'Command:'Line:null,version', arguments:'[]'
06-06 00:59:39.061 I/System.out(23805): result:{"bonusInformation":[],"message":"0.9.8","success":true}
06-06 00:59:39.064 I/System.out(23805): URI: //start-application
06-06 00:59:39.064 I/System.out(23805): params: {json={"intent":null}
06-06 00:59:39.064 I/System.out(23805): }
06-06 00:59:39.073 I/ActivityManager( 1631): START u0 {act=android.intent.action.MAIN cat=[android.intent.category.LAUNCHER] flg=0x10200000 cmp=com.evancharlton.mileage/.Mileage} from uid 10374 on display 0
06-06 00:59:39.080 I/calabash(23805): newActivity1
06-06 00:59:39.089 I/calabash(23805): newActivity1
06-06 00:59:39.090 W/ActivityManager( 1631): Bad activity token: android.os.BinderProxy@a48730c
06-06 00:59:39.090 W/ActivityManager( 1631): java.lang.ClassCastException: android.os.BinderProxy cannot be cast to com.android.server.am.ActivityRecord$Token
06-06 00:59:39.090 W/ActivityManager( 1631): 	at com.android.server.am.ActivityRecord.forTokenLocked(ActivityRecord.java:586)
06-06 00:59:39.090 W/ActivityManager( 1631): 	at com.android.server.am.ActivityRecord.isInStackLocked(ActivityRecord.java:1327)
06-06 00:59:39.090 W/ActivityManager( 1631): 	at com.android.server.am.ActivityRecord.getStackLocked(ActivityRecord.java:1332)
06-06 00:59:39.090 W/ActivityManager( 1631): 	at com.android.server.am.ActivityManagerService.getActivityDisplayId(ActivityManagerService.java:9806)
06-06 00:59:39.090 W/ActivityManager( 1631): 	at android.app.ActivityManagerNative.onTransact(ActivityManagerNative.java:2566)
06-06 00:59:39.090 W/ActivityManager( 1631): 	at com.android.server.am.ActivityManagerService.onTransact(ActivityManagerService.java:2757)
06-06 00:59:39.090 W/ActivityManager( 1631): 	at android.os.Binder.execTransact(Binder.java:565)
06-06 00:59:39.091 W/ActivityManager( 1631): Bad activity token: android.os.BinderProxy@a48730c
06-06 00:59:39.091 W/ActivityManager( 1631): java.lang.ClassCastException: android.os.BinderProxy cannot be cast to com.android.server.am.ActivityRecord$Token
06-06 00:59:39.091 W/ActivityManager( 1631): 	at com.android.server.am.ActivityRecord.forTokenLocked(ActivityRecord.java:586)
06-06 00:59:39.091 W/ActivityManager( 1631): 	at com.android.server.am.ActivityRecord.isInStackLocked(ActivityRecord.java:1327)
06-06 00:59:39.091 W/ActivityManager( 1631): 	at com.android.server.am.ActivityManagerService.setTaskDescription(ActivityManagerService.java:9358)
06-06 00:59:39.091 W/ActivityManager( 1631): 	at android.app.ActivityManagerNative.onTransact(ActivityManagerNative.java:2639)
06-06 00:59:39.091 W/ActivityManager( 1631): 	at com.android.server.am.ActivityManagerService.onTransact(ActivityManagerService.java:2757)
06-06 00:59:39.091 W/ActivityManager( 1631): 	at android.os.Binder.execTransact(Binder.java:565)
06-06 00:59:39.091 W/ActivityManager( 1631): Bad activity token: android.os.BinderProxy@a48730c
06-06 00:59:39.091 W/ActivityManager( 1631): java.lang.ClassCastException: android.os.BinderProxy cannot be cast to com.android.server.am.ActivityRecord$Token
06-06 00:59:39.091 W/ActivityManager( 1631): 	at com.android.server.am.ActivityRecord.forTokenLocked(ActivityRecord.java:586)
06-06 00:59:39.091 W/ActivityManager( 1631): 	at com.android.server.am.ActivityRecord.isInStackLocked(ActivityRecord.java:1327)
06-06 00:59:39.091 W/ActivityManager( 1631): 	at com.android.server.am.ActivityRecord.getStackLocked(ActivityRecord.java:1332)
06-06 00:59:39.091 W/ActivityManager( 1631): 	at com.android.server.am.ActivityManagerService.getActivityStackId(ActivityManagerService.java:9817)
06-06 00:59:39.091 W/ActivityManager( 1631): 	at android.app.ActivityManagerNative.onTransact(ActivityManagerNative.java:2856)
06-06 00:59:39.091 W/ActivityManager( 1631): 	at com.android.server.am.ActivityManagerService.onTransact(ActivityManagerService.java:2757)
06-06 00:59:39.091 W/ActivityManager( 1631): 	at android.os.Binder.execTransact(Binder.java:565)
06-06 00:59:39.100 D/gralloc_ranchu( 1347): gralloc_alloc: Creating ashmem region of size 9023488
06-06 00:59:39.109 W/ActivityManager( 1631): Bad activity token: android.os.BinderProxy@a48730c
06-06 00:59:39.109 W/ActivityManager( 1631): java.lang.ClassCastException: android.os.BinderProxy cannot be cast to com.android.server.am.ActivityRecord$Token
06-06 00:59:39.109 W/ActivityManager( 1631): 	at com.android.server.am.ActivityRecord.forTokenLocked(ActivityRecord.java:586)
06-06 00:59:39.109 W/ActivityManager( 1631): 	at com.android.server.am.ActivityRecord.isInStackLocked(ActivityRecord.java:1327)
06-06 00:59:39.109 W/ActivityManager( 1631): 	at com.android.server.am.ActivityManagerService.getActivityOptions(ActivityManagerService.java:12559)
06-06 00:59:39.109 W/ActivityManager( 1631): 	at android.app.ActivityManagerNative.onTransact(ActivityManagerNative.java:1933)
06-06 00:59:39.109 W/ActivityManager( 1631): 	at com.android.server.am.ActivityManagerService.onTransact(ActivityManagerService.java:2757)
06-06 00:59:39.109 W/ActivityManager( 1631): 	at android.os.Binder.execTransact(Binder.java:565)
06-06 00:59:39.109 W/ActivityManager( 1631): Bad activity token: android.os.BinderProxy@a48730c
06-06 00:59:39.109 W/ActivityManager( 1631): java.lang.ClassCastException: android.os.BinderProxy cannot be cast to com.android.server.am.ActivityRecord$Token
06-06 00:59:39.109 W/ActivityManager( 1631): 	at com.android.server.am.ActivityRecord.forTokenLocked(ActivityRecord.java:586)
06-06 00:59:39.109 W/ActivityManager( 1631): 	at com.android.server.am.ActivityRecord.isInStackLocked(ActivityRecord.java:1327)
06-06 00:59:39.109 W/ActivityManager( 1631): 	at com.android.server.am.ActivityManagerService.getActivityOptions(ActivityManagerService.java:12559)
06-06 00:59:39.109 W/ActivityManager( 1631): 	at android.app.ActivityManagerNative.onTransact(ActivityManagerNative.java:1933)
06-06 00:59:39.109 W/ActivityManager( 1631): 	at com.android.server.am.ActivityManagerService.onTransact(ActivityManagerService.java:2757)
06-06 00:59:39.109 W/ActivityManager( 1631): 	at android.os.Binder.execTransact(Binder.java:565)
06-06 00:59:39.138 V/PhoneStatusBar( 1712): setLightsOn(true)
06-06 00:59:39.149 D/gralloc_ranchu( 1347): gralloc_alloc: Creating ashmem region of size 9023488
06-06 00:59:39.156 D/EGL_emulation( 2076): eglMakeCurrent: 0xb0685360: ver 2 0 (tinfo 0xb06836b0)
06-06 00:59:39.156 D/EGL_emulation( 1712): eglMakeCurrent: 0xb0685360: ver 2 0 (tinfo 0xb06836c0)
06-06 00:59:39.156 D/        (23805): HostConnection::get() New Host Connection established 0x94220080, tid 23805
06-06 00:59:39.205 D/EGL_emulation( 1712): eglMakeCurrent: 0xb0685360: ver 2 0 (tinfo 0xb06836c0)
06-06 00:59:39.206 I/WindowManager( 1631): Destroying surface Surface(name=com.evancharlton.mileage/com.evancharlton.mileage.Mileage) called by com.android.server.wm.WindowStateAnimator.destroySurface:2016 com.android.server.wm.WindowStateAnimator.destroySurfaceLocked:882 com.android.server.wm.WindowState.removeLocked:1456 com.android.server.wm.WindowManagerService.removeWindowInnerLocked:2484 com.android.server.wm.AppWindowToken.destroySurfaces:365 com.android.server.wm.WindowStateAnimator.finishExit:565 com.android.server.wm.AppWindowAnimator.stepAnimationLocked:427 com.android.server.wm.WindowAnimator.updateAppWindowsLocked:196 
06-06 00:59:39.207 D/EGL_emulation( 1712): eglMakeCurrent: 0xb0685360: ver 2 0 (tinfo 0xb06836c0)
06-06 00:59:39.210 D/EGL_emulation( 1712): eglMakeCurrent: 0xb0685360: ver 2 0 (tinfo 0xb06836c0)
06-06 00:59:39.225 D/EGL_emulation( 1712): eglMakeCurrent: 0xb0685360: ver 2 0 (tinfo 0xb06836c0)
06-06 00:59:39.227 V/PhoneStatusBar( 1712): setLightsOn(true)
06-06 00:59:39.228 D/EGL_emulation( 1712): eglMakeCurrent: 0xb0685360: ver 2 0 (tinfo 0xb06836c0)
06-06 00:59:39.234 D/EGL_emulation( 1712): eglMakeCurrent: 0xb0685360: ver 2 0 (tinfo 0xb06836c0)
06-06 00:59:39.235 D/EGL_emulation( 1712): eglMakeCurrent: 0xb0685360: ver 2 0 (tinfo 0xb06836c0)
06-06 00:59:39.250 D/EGL_emulation( 1712): eglMakeCurrent: 0xb0685360: ver 2 0 (tinfo 0xb06836c0)
06-06 00:59:39.250 I/ActivityManager( 1631): Displayed com.evancharlton.mileage/.Mileage: +174ms
06-06 00:59:39.251 D/gralloc_ranchu( 1347): gralloc_alloc: Creating ashmem region of size 9023488
06-06 00:59:39.263 D/EGL_emulation( 1712): eglMakeCurrent: 0xb0685360: ver 2 0 (tinfo 0xb06836c0)
06-06 00:59:39.276 D/EGL_emulation( 1712): eglMakeCurrent: 0xb0685360: ver 2 0 (tinfo 0xb06836c0)
06-06 00:59:39.279 D/EGL_emulation( 1712): eglMakeCurrent: 0xb0685360: ver 2 0 (tinfo 0xb06836c0)
06-06 00:59:39.292 D/EGL_emulation( 1712): eglMakeCurrent: 0xb0685360: ver 2 0 (tinfo 0xb06836c0)
06-06 00:59:39.292 V/PhoneStatusBar( 1712): setLightsOn(true)
06-06 00:59:39.295 D/EGL_emulation( 1712): eglMakeCurrent: 0xb0685360: ver 2 0 (tinfo 0xb06836c0)
06-06 00:59:39.300 D/EGL_emulation( 1712): eglMakeCurrent: 0xb0685360: ver 2 0 (tinfo 0xb06836c0)
06-06 00:59:39.309 D/EGL_emulation( 1712): eglMakeCurrent: 0xb0685360: ver 2 0 (tinfo 0xb06836c0)
06-06 00:59:39.317 D/EGL_emulation( 1712): eglMakeCurrent: 0xb0685360: ver 2 0 (tinfo 0xb06836c0)
06-06 00:59:39.318 D/EGL_emulation( 1712): eglMakeCurrent: 0xb0685360: ver 2 0 (tinfo 0xb06836c0)
06-06 00:59:39.324 I/System.out(23805): URI: //map
06-06 00:59:39.324 I/System.out(23805): params: {json={"query":"* marked:'Statistics'","operation":{"method_name":"query","arguments":[]}}
06-06 00:59:39.324 I/System.out(23805): }
06-06 00:59:39.333 D/EGL_emulation( 1712): eglMakeCurrent: 0xb0685360: ver 2 0 (tinfo 0xb06836c0)
06-06 00:59:39.335 D/EGL_emulation( 1712): eglMakeCurrent: 0xb0685360: ver 2 0 (tinfo 0xb06836c0)
06-06 00:59:39.336 W/ResourceType(23805): No package identifier when getting name for resource number 0x00000001
06-06 00:59:39.349 I/System.out(23805): URI: //gesture
06-06 00:59:39.349 I/System.out(23805): params: {json={"query_timeout":5.0,"gestures":[{"query_string":"* marked:'Statistics'","touches":[{"x":50,"y":50,"offset_x":0,"offset_y":0,"wait":0.0,"time":0.2,"release":true,"query_string":null}]}]}
06-06 00:59:39.349 I/System.out(23805): }
06-06 00:59:39.351 D/EGL_emulation( 1712): eglMakeCurrent: 0xb0685360: ver 2 0 (tinfo 0xb06836c0)
06-06 00:59:39.352 D/EGL_emulation( 1712): eglMakeCurrent: 0xb0685360: ver 2 0 (tinfo 0xb06836c0)
06-06 00:59:39.355 W/ResourceType(23805): No package identifier when getting name for resource number 0x00000001
06-06 00:59:39.367 D/EGL_emulation( 1712): eglMakeCurrent: 0xb0685360: ver 2 0 (tinfo 0xb06836c0)
06-06 00:59:39.382 D/EGL_emulation( 1712): eglMakeCurrent: 0xb0685360: ver 2 0 (tinfo 0xb06836c0)
06-06 00:59:39.450 I/WindowManager( 1631): Destroying surface Surface(name=Starting com.evancharlton.mileage) called by com.android.server.wm.WindowStateAnimator.destroySurface:2016 com.android.server.wm.WindowStateAnimator.destroySurfaceLocked:882 com.android.server.wm.WindowState.destroyOrSaveSurface:2100 com.android.server.wm.AppWindowToken.destroySurfaces:363 com.android.server.wm.WindowStateAnimator.finishExit:565 com.android.server.wm.WindowStateAnimator.stepAnimationLocked:491 com.android.server.wm.WindowAnimator.updateWindowsLocked:303 com.android.server.wm.WindowAnimator.animateLocked:704 
06-06 00:59:39.452 V/PhoneStatusBar( 1712): setLightsOn(true)
06-06 00:59:39.483 V/PhoneStatusBar( 1712): setLightsOn(true)
06-06 00:59:39.585 I/calabash(23805): newActivity1
06-06 00:59:39.594 I/System.out(23805): URI: //map
06-06 00:59:39.594 I/System.out(23805): params: {json={"query":"android.widget.ScrollView index:0","operation":{"method_name":"query","arguments":[]}}
06-06 00:59:39.594 I/System.out(23805): }
06-06 00:59:39.598 W/ActivityManager( 1631): Bad activity token: android.os.BinderProxy@35ab9e6
06-06 00:59:39.598 W/ActivityManager( 1631): java.lang.ClassCastException: android.os.BinderProxy cannot be cast to com.android.server.am.ActivityRecord$Token
06-06 00:59:39.598 W/ActivityManager( 1631): 	at com.android.server.am.ActivityRecord.forTokenLocked(ActivityRecord.java:586)
06-06 00:59:39.598 W/ActivityManager( 1631): 	at com.android.server.am.ActivityRecord.isInStackLocked(ActivityRecord.java:1327)
06-06 00:59:39.598 W/ActivityManager( 1631): 	at com.android.server.am.ActivityRecord.getStackLocked(ActivityRecord.java:1332)
06-06 00:59:39.598 W/ActivityManager( 1631): 	at com.android.server.am.ActivityManagerService.getActivityDisplayId(ActivityManagerService.java:9806)
06-06 00:59:39.598 W/ActivityManager( 1631): 	at android.app.ActivityManagerNative.onTransact(ActivityManagerNative.java:2566)
06-06 00:59:39.598 W/ActivityManager( 1631): 	at com.android.server.am.ActivityManagerService.onTransact(ActivityManagerService.java:2757)
06-06 00:59:39.598 W/ActivityManager( 1631): 	at android.os.Binder.execTransact(Binder.java:565)
06-06 00:59:39.599 W/ActivityManager( 1631): Bad activity token: android.os.BinderProxy@35ab9e6
06-06 00:59:39.599 W/ActivityManager( 1631): java.lang.ClassCastException: android.os.BinderProxy cannot be cast to com.android.server.am.ActivityRecord$Token
06-06 00:59:39.599 W/ActivityManager( 1631): 	at com.android.server.am.ActivityRecord.forTokenLocked(ActivityRecord.java:586)
06-06 00:59:39.599 W/ActivityManager( 1631): 	at com.android.server.am.ActivityRecord.isInStackLocked(ActivityRecord.java:1327)
06-06 00:59:39.599 W/ActivityManager( 1631): 	at com.android.server.am.ActivityManagerService.setTaskDescription(ActivityManagerService.java:9358)
06-06 00:59:39.599 W/ActivityManager( 1631): 	at android.app.ActivityManagerNative.onTransact(ActivityManagerNative.java:2639)
06-06 00:59:39.599 W/ActivityManager( 1631): 	at com.android.server.am.ActivityManagerService.onTransact(ActivityManagerService.java:2757)
06-06 00:59:39.599 W/ActivityManager( 1631): 	at android.os.Binder.execTransact(Binder.java:565)
06-06 00:59:39.599 W/ActivityManager( 1631): Bad activity token: android.os.BinderProxy@35ab9e6
06-06 00:59:39.599 W/ActivityManager( 1631): java.lang.ClassCastException: android.os.BinderProxy cannot be cast to com.android.server.am.ActivityRecord$Token
06-06 00:59:39.599 W/ActivityManager( 1631): 	at com.android.server.am.ActivityRecord.forTokenLocked(ActivityRecord.java:586)
06-06 00:59:39.599 W/ActivityManager( 1631): 	at com.android.server.am.ActivityRecord.isInStackLocked(ActivityRecord.java:1327)
06-06 00:59:39.599 W/ActivityManager( 1631): 	at com.android.server.am.ActivityRecord.getStackLocked(ActivityRecord.java:1332)
06-06 00:59:39.599 W/ActivityManager( 1631): 	at com.android.server.am.ActivityManagerService.getActivityStackId(ActivityManagerService.java:9817)
06-06 00:59:39.599 W/ActivityManager( 1631): 	at android.app.ActivityManagerNative.onTransact(ActivityManagerNative.java:2856)
06-06 00:59:39.599 W/ActivityManager( 1631): 	at com.android.server.am.ActivityManagerService.onTransact(ActivityManagerService.java:2757)
06-06 00:59:39.599 W/ActivityManager( 1631): 	at android.os.Binder.execTransact(Binder.java:565)
06-06 00:59:39.601 V/PhoneStatusBar( 1712): setLightsOn(true)
06-06 00:59:39.607 D/VehicleStatisticsActivity(23805): Checking recalculation ...
06-06 00:59:39.608 D/VehicleStatisticsActivity(23805): Recalculation not necessary.
06-06 00:59:39.617 W/ActivityManager( 1631): Bad activity token: android.os.BinderProxy@35ab9e6
06-06 00:59:39.617 W/ActivityManager( 1631): java.lang.ClassCastException: android.os.BinderProxy cannot be cast to com.android.server.am.ActivityRecord$Token
06-06 00:59:39.617 W/ActivityManager( 1631): 	at com.android.server.am.ActivityRecord.forTokenLocked(ActivityRecord.java:586)
06-06 00:59:39.617 W/ActivityManager( 1631): 	at com.android.server.am.ActivityRecord.isInStackLocked(ActivityRecord.java:1327)
06-06 00:59:39.617 W/ActivityManager( 1631): 	at com.android.server.am.ActivityManagerService.getActivityOptions(ActivityManagerService.java:12559)
06-06 00:59:39.617 W/ActivityManager( 1631): 	at android.app.ActivityManagerNative.onTransact(ActivityManagerNative.java:1933)
06-06 00:59:39.617 W/ActivityManager( 1631): 	at com.android.server.am.ActivityManagerService.onTransact(ActivityManagerService.java:2757)
06-06 00:59:39.617 W/ActivityManager( 1631): 	at android.os.Binder.execTransact(Binder.java:565)
06-06 00:59:39.618 W/ActivityManager( 1631): Bad activity token: android.os.BinderProxy@35ab9e6
06-06 00:59:39.618 W/ActivityManager( 1631): java.lang.ClassCastException: android.os.BinderProxy cannot be cast to com.android.server.am.ActivityRecord$Token
06-06 00:59:39.618 W/ActivityManager( 1631): 	at com.android.server.am.ActivityRecord.forTokenLocked(ActivityRecord.java:586)
06-06 00:59:39.618 W/ActivityManager( 1631): 	at com.android.server.am.ActivityRecord.isInStackLocked(ActivityRecord.java:1327)
06-06 00:59:39.618 W/ActivityManager( 1631): 	at com.android.server.am.ActivityManagerService.getActivityOptions(ActivityManagerService.java:12559)
06-06 00:59:39.618 W/ActivityManager( 1631): 	at android.app.ActivityManagerNative.onTransact(ActivityManagerNative.java:1933)
06-06 00:59:39.618 W/ActivityManager( 1631): 	at com.android.server.am.ActivityManagerService.onTransact(ActivityManagerService.java:2757)
06-06 00:59:39.618 W/ActivityManager( 1631): 	at android.os.Binder.execTransact(Binder.java:565)
06-06 00:59:39.620 D/VehicleStatisticsActivity(23805): Checking recalculation ...
06-06 00:59:39.621 D/VehicleStatisticsActivity(23805): Recalculation not necessary.
06-06 00:59:39.705 I/System.out(23805): URI: //map
06-06 00:59:39.705 I/System.out(23805): params: {json={"query":"android.widget.AbsListView index:0","operation":{"method_name":"query","arguments":[]}}
06-06 00:59:39.705 I/System.out(23805): }
06-06 00:59:39.709 I/art     (23805): Do partial code cache collection, code=30KB, data=29KB
06-06 00:59:39.709 I/art     (23805): After code cache collection, code=29KB, data=28KB
06-06 00:59:39.709 I/art     (23805): Increasing code cache capacity to 128KB
06-06 00:59:39.719 I/System.out(23805): URI: //map
06-06 00:59:39.719 I/System.out(23805): params: {json={"query":"android.widget.AbsListView index:0","operation":{"method_name":"query","arguments":[]}}
06-06 00:59:39.719 I/System.out(23805): }
06-06 00:59:39.735 I/System.out(23805): URI: //map
06-06 00:59:39.735 I/System.out(23805): params: {json={"query":"android.widget.AbsListView index:0","operation":{"method_name":"query","arguments":[]}}
06-06 00:59:39.735 I/System.out(23805): }
06-06 00:59:39.751 I/System.out(23805): URI: //map
06-06 00:59:39.751 I/System.out(23805): params: {json={"query":"android.widget.AbsListView index:0","operation":{"method_name":"query","arguments":["getFirstVisiblePosition"]}}
06-06 00:59:39.751 I/System.out(23805): }
06-06 00:59:39.764 I/System.out(23805): URI: //map
06-06 00:59:39.764 I/System.out(23805): params: {json={"query":"android.widget.AbsListView index:0","operation":{"method_name":"query","arguments":["getLastVisiblePosition"]}}
06-06 00:59:39.764 I/System.out(23805): }
06-06 00:59:39.778 I/System.out(23805): URI: //map
06-06 00:59:39.778 I/System.out(23805): params: {json={"query":"android.widget.AbsListView index:0","operation":{"method_name":"query","arguments":[{"method_name":"setSelection","arguments":[26]}]}}
06-06 00:59:39.778 I/System.out(23805): }
06-06 00:59:39.797 I/System.out(23805): URI: //map
06-06 00:59:39.797 I/System.out(23805): params: {json={"query":"* marked:'Total fuel'","operation":{"method_name":"query","arguments":[]}}
06-06 00:59:39.797 I/System.out(23805): }
06-06 00:59:39.840 D/gralloc_ranchu( 1347): gralloc_alloc: Creating ashmem region of size 9023488
06-06 00:59:39.882 W/ResourceType(23805): No package identifier when getting name for resource number 0x00000001
06-06 00:59:39.894 I/System.out(23805): URI: //gesture
06-06 00:59:39.894 I/System.out(23805): params: {json={"query_timeout":5.0,"gestures":[{"query_string":"* marked:'Total fuel'","touches":[{"x":50,"y":50,"offset_x":0,"offset_y":0,"wait":0.0,"time":0.2,"release":true,"query_string":null}]}]}
06-06 00:59:39.894 I/System.out(23805): }
06-06 00:59:39.897 W/ResourceType(23805): No package identifier when getting name for resource number 0x00000001
06-06 00:59:39.899 V/PhoneStatusBar( 1712): setLightsOn(true)
06-06 00:59:39.901 V/PhoneStatusBar( 1712): setLightsOn(true)
06-06 00:59:39.902 W/OpenGLRenderer( 2076): Incorrectly called buildLayer on View: ShortcutAndWidgetContainer, destroying layer...
06-06 00:59:39.917 V/PhoneStatusBar( 1712): setLightsOn(true)
06-06 00:59:39.918 I/WindowManager( 1631): Destroying surface Surface(name=com.android.launcher3/com.android.launcher3.Launcher) called by com.android.server.wm.WindowStateAnimator.destroySurface:2016 com.android.server.wm.WindowStateAnimator.destroySurfaceLocked:882 com.android.server.wm.WindowState.destroyOrSaveSurface:2100 com.android.server.wm.AppWindowToken.destroySurfaces:363 com.android.server.wm.AppWindowToken.notifyAppStopped:389 com.android.server.wm.WindowManagerService.notifyAppStopped:4463 com.android.server.am.ActivityStack.activityStoppedLocked:1252 com.android.server.am.ActivityManagerService.activityStopped:6903 
06-06 00:59:40.134 I/ActivityManager( 1631): START u0 {cmp=com.evancharlton.mileage/.charts.TotalVolumeChart (has extras)} from uid 10374 on display 0
06-06 00:59:40.135 V/PhoneStatusBar( 1712): setLightsOn(true)
06-06 00:59:40.135 V/PhoneStatusBar( 1712): setLightsOn(true)
06-06 00:59:40.143 I/System.out(23805): URI: //map
06-06 00:59:40.143 I/System.out(23805): params: {json={"query":"* {text CONTAINS[c] 'Total fuel purchased'}","operation":{"method_name":"query","arguments":[]}}
06-06 00:59:40.143 I/System.out(23805): }
06-06 00:59:40.190 I/calabash(23805): newActivity1
06-06 00:59:40.193 W/aiCharts(23805): License file is invalid or missing. 
06-06 00:59:40.193 W/aiCharts(23805): Please place proper license.lic to /assets folder.
06-06 00:59:40.207 V/PhoneStatusBar( 1712): setLightsOn(true)
06-06 00:59:40.233 V/PhoneStatusBar( 1712): setLightsOn(true)
06-06 00:59:40.239 I/WindowManager( 1631): Destroying surface Surface(name=Creating chart…) called by com.android.server.wm.WindowStateAnimator.destroySurface:2016 com.android.server.wm.WindowStateAnimator.destroySurfaceLocked:882 com.android.server.wm.WindowState.removeLocked:1456 com.android.server.wm.WindowManagerService.removeWindowInnerLocked:2484 com.android.server.wm.WindowManagerService.removeWindowLocked:2442 com.android.server.wm.WindowManagerService.removeWindowLocked:2311 com.android.server.wm.WindowManagerService.removeWindow:2306 com.android.server.wm.Session.remove:202 
06-06 00:59:40.242 D/gralloc_ranchu( 1347): gralloc_alloc: Creating ashmem region of size 9023488
06-06 00:59:40.250 V/PhoneStatusBar( 1712): setLightsOn(true)
06-06 00:59:40.290 I/ActivityManager( 1631): Displayed com.evancharlton.mileage/.charts.TotalVolumeChart: +103ms
06-06 00:59:40.300 V/PhoneStatusBar( 1712): setLightsOn(true)
06-06 00:59:40.333 V/PhoneStatusBar( 1712): setLightsOn(true)
06-06 00:59:40.350 V/PhoneStatusBar( 1712): setLightsOn(true)
06-06 00:59:40.525 I/System.out(23805): URI: //map
06-06 00:59:40.525 I/System.out(23805): params: {json={"query":"* {text CONTAINS[c] 'Total fuel purchased'}","operation":{"method_name":"query","arguments":[]}}
06-06 00:59:40.525 I/System.out(23805): }
06-06 00:59:40.534 V/PhoneStatusBar( 1712): setLightsOn(true)
06-06 00:59:40.543 I/System.out(23805): URI: //
06-06 00:59:40.543 I/System.out(23805): params: {json={"command":"press_key","arguments":["KEYCODE_BACK"]}
06-06 00:59:40.543 I/System.out(23805): }
06-06 00:59:40.543 I/System.out(23805): header: {content-type=application/json;charset=utf-8, date=Sat, 06 Jun 2020 05:59:40 GMT, accept=*/*, host=127.0.0.1:34777, content-length=52, user-agent=HTTPClient/1.0 (2.8.3, ruby 2.5.1 (2018-03-29))}
06-06 00:59:40.543 I/System.out(23805): params: {json={"command":"press_key","arguments":["KEYCODE_BACK"]}
06-06 00:59:40.543 I/System.out(23805): }
06-06 00:59:40.543 I/System.out(23805): ProP json = {"command":"press_key","arguments":["KEYCODE_BACK"]}
06-06 00:59:40.543 I/System.out(23805): files: {}
06-06 00:59:40.543 I/System.out(23805): command: {"command":"press_key","arguments":["KEYCODE_BACK"]}
06-06 00:59:40.544 I/InstrumentationBackend(23805): Got command:'Command:'Line:null,press_key', arguments:'[KEYCODE_BACK]'
06-06 00:59:40.546 I/art     (23805): Do partial code cache collection, code=60KB, data=62KB
06-06 00:59:40.546 I/art     (23805): After code cache collection, code=59KB, data=61KB
06-06 00:59:40.546 I/art     (23805): Increasing code cache capacity to 256KB
06-06 00:59:40.547 V/PhoneStatusBar( 1712): setLightsOn(true)
06-06 00:59:40.549 V/PhoneStatusBar( 1712): setLightsOn(true)
06-06 00:59:40.553 I/System.out(23805): result:{"bonusInformation":[],"message":"","success":true}
06-06 00:59:40.556 I/System.out(23805): URI: //map
06-06 00:59:40.556 I/System.out(23805): params: {json={"query":"* {text CONTAINS[c] 'Statistics'}","operation":{"method_name":"query","arguments":[]}}
06-06 00:59:40.556 I/System.out(23805): }
06-06 00:59:40.556 D/VehicleStatisticsActivity(23805): Checking recalculation ...
06-06 00:59:40.557 D/VehicleStatisticsActivity(23805): Recalculation not necessary.
06-06 00:59:40.567 V/PhoneStatusBar( 1712): setLightsOn(true)
06-06 00:59:40.583 D/gralloc_ranchu( 1347): gralloc_alloc: Creating ashmem region of size 9023488
06-06 00:59:40.583 V/PhoneStatusBar( 1712): setLightsOn(true)
06-06 00:59:40.600 V/PhoneStatusBar( 1712): setLightsOn(true)
06-06 00:59:40.616 V/PhoneStatusBar( 1712): setLightsOn(true)
