--------- beginning of main
06-06 17:45:19.598 V/PhoneStatusBar( 1713): setLightsOn(true)
06-06 17:45:19.601 D/gralloc_ranchu( 1348): gralloc_alloc: Creating ashmem region of size 3145728
06-06 17:45:19.606 E/EGL_emulation( 1348): tid 1348: eglCreateSyncKHR(1901): error 0x3004 (EGL_BAD_ATTRIBUTE)
--------- beginning of system
06-06 17:45:19.617 W/ActivityManager( 1631): Finishing task with all activities already finished
06-06 17:45:19.617 W/ActivityManager( 1631): Duplicate finish request for ActivityRecord{e71e72b u0 com.evancharlton.mileage/.Mileage t24708 f}
06-06 17:45:19.617 W/ActivityManager( 1631): Finishing task with all activities already finished
06-06 17:45:19.617 W/ActivityManager( 1631): Duplicate finish request for ActivityRecord{e71e72b u0 com.evancharlton.mileage/.Mileage t24708 f}
06-06 17:45:19.618 W/ActivityManager( 1631): Finishing task with all activities already finished
06-06 17:45:19.618 W/ActivityManager( 1631): Duplicate finish request for ActivityRecord{e71e72b u0 com.evancharlton.mileage/.Mileage t24708 f}
06-06 17:45:19.618 W/ActivityManager( 1631): Finishing task with all activities already finished
06-06 17:45:19.618 W/ActivityManager( 1631): Duplicate finish request for ActivityRecord{e71e72b u0 com.evancharlton.mileage/.Mileage t24708 f}
06-06 17:45:19.618 W/ActivityManager( 1631): Finishing task with all activities already finished
06-06 17:45:19.618 W/ActivityManager( 1631): Duplicate finish request for ActivityRecord{e71e72b u0 com.evancharlton.mileage/.Mileage t24708 f}
06-06 17:45:19.618 W/ActivityManager( 1631): Finishing task with all activities already finished
06-06 17:45:19.618 W/ActivityManager( 1631): Duplicate finish request for ActivityRecord{3c6801 u0 com.evancharlton.mileage/.charts.AveragePriceChart t24708 f}
06-06 17:45:19.618 W/ActivityManager( 1631): Finishing task with all activities already finished
06-06 17:45:19.618 W/ActivityManager( 1631): Duplicate finish request for ActivityRecord{3c6801 u0 com.evancharlton.mileage/.charts.AveragePriceChart t24708 f}
06-06 17:45:19.618 W/ActivityManager( 1631): Finishing task with all activities already finished
06-06 17:45:19.618 W/ActivityManager( 1631): Duplicate finish request for ActivityRecord{e71e72b u0 com.evancharlton.mileage/.Mileage t24708 f}
06-06 17:45:19.618 W/ActivityManager( 1631): Finishing task with all activities already finished
06-06 17:45:19.618 W/ActivityManager( 1631): Duplicate finish request for ActivityRecord{e71e72b u0 com.evancharlton.mileage/.Mileage t24708 f}
06-06 17:45:19.651 D/EGL_emulation( 2106): eglMakeCurrent: 0xa6a85300: ver 2 0 (tinfo 0xa6a83220)
06-06 17:45:19.666 D/EGL_emulation( 1713): eglMakeCurrent: 0xa6a85780: ver 2 0 (tinfo 0xa6a83640)
06-06 17:45:19.681 D/EGL_emulation( 1713): eglMakeCurrent: 0xa6a85780: ver 2 0 (tinfo 0xa6a83640)
06-06 17:45:19.683 D/EGL_emulation( 1713): eglMakeCurrent: 0xa6a85780: ver 2 0 (tinfo 0xa6a83640)
06-06 17:45:19.698 D/EGL_emulation( 1713): eglMakeCurrent: 0xa6a85780: ver 2 0 (tinfo 0xa6a83640)
06-06 17:45:19.700 D/EGL_emulation( 1713): eglMakeCurrent: 0xa6a85780: ver 2 0 (tinfo 0xa6a83640)
06-06 17:45:19.715 D/EGL_emulation( 1713): eglMakeCurrent: 0xa6a85780: ver 2 0 (tinfo 0xa6a83640)
06-06 17:45:19.717 D/EGL_emulation( 1713): eglMakeCurrent: 0xa6a85780: ver 2 0 (tinfo 0xa6a83640)
06-06 17:45:19.732 D/EGL_emulation( 1713): eglMakeCurrent: 0xa6a85780: ver 2 0 (tinfo 0xa6a83640)
06-06 17:45:19.734 D/EGL_emulation( 1713): eglMakeCurrent: 0xa6a85780: ver 2 0 (tinfo 0xa6a83640)
06-06 17:45:19.747 D/AndroidRuntime(16765): >>>>>> START com.android.internal.os.RuntimeInit uid 2000 <<<<<<
06-06 17:45:19.748 D/AndroidRuntime(16765): CheckJNI is ON
06-06 17:45:19.748 D/EGL_emulation( 1713): eglMakeCurrent: 0xa6a85780: ver 2 0 (tinfo 0xa6a83640)
06-06 17:45:19.750 D/EGL_emulation( 1713): eglMakeCurrent: 0xa6a85780: ver 2 0 (tinfo 0xa6a83640)
06-06 17:45:19.761 W/art     (16765): Unexpected CPU variant for X86 using defaults: x86
06-06 17:45:19.764 D/ICU     (16765): No timezone override file found: /data/misc/zoneinfo/current/icu/icu_tzdata.dat
06-06 17:45:19.765 D/EGL_emulation( 1713): eglMakeCurrent: 0xa6a85780: ver 2 0 (tinfo 0xa6a83640)
06-06 17:45:19.767 D/EGL_emulation( 1713): eglMakeCurrent: 0xa6a85780: ver 2 0 (tinfo 0xa6a83640)
06-06 17:45:19.773 E/memtrack(16765): Couldn't load memtrack module (No such file or directory)
06-06 17:45:19.773 E/android.os.Debug(16765): failed to load memtrack module: -2
06-06 17:45:19.774 I/Radio-JNI(16765): register_android_hardware_Radio DONE
06-06 17:45:19.778 D/AndroidRuntime(16765): Calling main entry com.android.commands.am.Am
06-06 17:45:19.780 I/ActivityManager( 1631): Force stopping com.evancharlton.mileage appid=10728 user=0: start instr
06-06 17:45:19.780 I/ActivityManager( 1631): Killing 16712:com.evancharlton.mileage/u0a728 (adj 0): stop com.evancharlton.mileage
06-06 17:45:19.780 D/ActivityManager( 1631): cleanUpApplicationRecord -- 16712
06-06 17:45:19.781 I/WindowManager( 1631): Destroying surface Surface(name=com.evancharlton.mileage/com.evancharlton.mileage.charts.AveragePriceChart) called by com.android.server.wm.WindowStateAnimator.destroySurface:2016 com.android.server.wm.WindowStateAnimator.destroySurfaceLocked:882 com.android.server.wm.WindowState.removeLocked:1456 com.android.server.wm.WindowManagerService.removeWindowInnerLocked:2484 com.android.server.wm.WindowManagerService.removeWindowLocked:2442 com.android.server.wm.WindowManagerService.removeWindowLocked:2311 com.android.server.wm.AppWindowToken.removeAllWindows:530 com.android.server.wm.AppWindowToken.removeAppFromTaskLocked:326 
06-06 17:45:19.787 D/EGL_emulation( 1713): eglMakeCurrent: 0xa6a85780: ver 2 0 (tinfo 0xa6a83640)
06-06 17:45:19.789 W/ActivityManager( 1631): Crash of app com.evancharlton.mileage running instrumentation ComponentInfo{com.evancharlton.mileage.test/sh.calaba.instrumentationbackend.CalabashInstrumentationTestRunner}
06-06 17:45:19.789 I/ActivityManager( 1631): Force stopping com.evancharlton.mileage appid=10728 user=0: finished inst
06-06 17:45:19.790 D/EGL_emulation( 1713): eglMakeCurrent: 0xa6a85780: ver 2 0 (tinfo 0xa6a83640)
06-06 17:45:19.792 I/art     (16775): Not late-enabling -Xcheck:jni (already on)
06-06 17:45:19.792 W/art     (16775): Unexpected CPU variant for X86 using defaults: x86
06-06 17:45:19.798 D/EGL_emulation( 1713): eglMakeCurrent: 0xa6a85780: ver 2 0 (tinfo 0xa6a83640)
06-06 17:45:19.800 D/EGL_emulation( 1713): eglMakeCurrent: 0xa6a85780: ver 2 0 (tinfo 0xa6a83640)
06-06 17:45:19.800 I/ActivityManager( 1631): Start proc 16775:com.evancharlton.mileage/u0a728 for added application com.evancharlton.mileage
06-06 17:45:19.800 D/AndroidRuntime(16765): Shutting down VM
06-06 17:45:19.804 W/System  (16775): ClassLoader referenced unknown path: /data/app/com.evancharlton.mileage.test-1/lib/x86
06-06 17:45:19.804 W/System  (16775): ClassLoader referenced unknown path: /data/app/com.evancharlton.mileage-1/lib/x86
06-06 17:45:19.806 W/System  (16775): ClassLoader referenced unknown path: 
06-06 17:45:19.810 I/System.out(16775): Main activity name automatically set to: com.evancharlton.mileage.Mileage
06-06 17:45:19.810 I/System.out(16775): Calabash did not load Mono. This is only a problem if you are trying to test a Mono application
06-06 17:45:19.810 I/calabash(16775): Test server port: 7102
06-06 17:45:19.811 I/InstrumentationBackend(16775): Added:'GetPreferences', with key:'get_preferences'
06-06 17:45:19.815 D/EGL_emulation( 1713): eglMakeCurrent: 0xa6a85780: ver 2 0 (tinfo 0xa6a83640)
06-06 17:45:19.816 I/InstrumentationBackend(16775): Added:'SetPreferences', with key:'set_preferences'
06-06 17:45:19.816 I/InstrumentationBackend(16775): Added:'ClearPreferences', with key:'clear_preferences'
06-06 17:45:19.816 I/InstrumentationBackend(16775): Added:'PressElement', with key:'press_l10n_element'
06-06 17:45:19.816 I/InstrumentationBackend(16775): Added:'WaitForElement', with key:'wait_for_l10n_element'
06-06 17:45:19.816 I/InstrumentationBackend(16775): Added:'NullAction', with key:'nullAction'
06-06 17:45:19.816 I/InstrumentationBackend(16775): Added:'PressKey', with key:'press_key'
06-06 17:45:19.816 I/InstrumentationBackend(16775): Added:'SetActivityOrientation', with key:'set_activity_orientation'
06-06 17:45:19.816 I/InstrumentationBackend(16775): Added:'GetActivityOrientation', with key:'get_activity_orientation'
06-06 17:45:19.816 I/InstrumentationBackend(16775): Added:'FakeGPSLocation', with key:'set_gps_coordinates'
06-06 17:45:19.816 I/InstrumentationBackend(16775): Added:'SetPropertyByCssSelector', with key:'set_property_by_css_selector'
06-06 17:45:19.816 I/InstrumentationBackend(16775): Added:'GetUrl', with key:'get_url'
06-06 17:45:19.817 I/InstrumentationBackend(16775): Added:'ScrollTo', with key:'scroll_to'
06-06 17:45:19.817 I/InstrumentationBackend(16775): Added:'GetLoadProgress', with key:'get_load_progress'
06-06 17:45:19.817 I/InstrumentationBackend(16775): Added:'DumpHtml', with key:'dump_html'
06-06 17:45:19.817 I/InstrumentationBackend(16775): Added:'DumpBodyHtml', with key:'dump_body_html'
06-06 17:45:19.817 I/InstrumentationBackend(16775): Added:'EnterTextByCssSelector', with key:'enter_text_by_selector'
06-06 17:45:19.817 D/EGL_emulation( 1713): eglMakeCurrent: 0xa6a85780: ver 2 0 (tinfo 0xa6a83640)
06-06 17:45:19.817 I/InstrumentationBackend(16775): Added:'AndroidSDKVersion', with key:'android_sdk_version'
06-06 17:45:19.817 I/InstrumentationBackend(16775): Added:'Version', with key:'version'
06-06 17:45:19.818 I/InstrumentationBackend(16775): Added:'Drag', with key:'drag'
06-06 17:45:19.818 I/InstrumentationBackend(16775): Added:'TouchCoordinates', with key:'touch_coordinate'
06-06 17:45:19.818 I/InstrumentationBackend(16775): Added:'LongPressCoordinate', with key:'long_press_coordinate'
06-06 17:45:19.818 I/InstrumentationBackend(16775): Added:'DragCoordinates', with key:'drag_coordinates'
06-06 17:45:19.818 I/InstrumentationBackend(16775): Added:'ResumeApplication', with key:'resume_application'
06-06 17:45:19.818 I/InstrumentationBackend(16775): Added:'Swipe', with key:'swipe'
06-06 17:45:19.818 I/InstrumentationBackend(16775): Added:'DoubleTapCoordinate', with key:'double_tap_coordinate'
06-06 17:45:19.818 I/InstrumentationBackend(16775): Added:'ClickOnScreen', with key:'click_on_screen'
06-06 17:45:19.818 I/InstrumentationBackend(16775): Added:'GetActivityName', with key:'get_activity_name'
06-06 17:45:19.818 I/InstrumentationBackend(16775): Added:'ScrollToView', with key:'scroll_to_view'
06-06 17:45:19.818 I/InstrumentationBackend(16775): Added:'ViewConfiguration', with key:'view_configuration'
06-06 17:45:19.818 I/InstrumentationBackend(16775): Added:'IsCurrentActivityFocused', with key:'is_current_activity_focused'
06-06 17:45:19.818 I/InstrumentationBackend(16775): Added:'SendTcp', with key:'send_tcp'
06-06 17:45:19.818 I/InstrumentationBackend(16775): Added:'DpToDevicePixel', with key:'dp_to_device_pixel'
06-06 17:45:19.818 I/InstrumentationBackend(16775): Added:'KeyboardEnterText', with key:'keyboard_enter_text'
06-06 17:45:19.818 I/InstrumentationBackend(16775): Added:'DeleteSurroundingText', with key:'delete_surrounding_text'
06-06 17:45:19.818 I/InstrumentationBackend(16775): Added:'SetComposingRegion', with key:'set_composing_region'
06-06 17:45:19.819 I/InstrumentationBackend(16775): Added:'SetSelection', with key:'set_selection'
06-06 17:45:19.819 I/InstrumentationBackend(16775): Added:'KeyboardKeyEvent', with key:'keyboard_key_event'
06-06 17:45:19.819 I/InstrumentationBackend(16775): Added:'PressUserActionButton', with key:'press_user_action_button'
06-06 17:45:19.819 I/InstrumentationBackend(16775): Added:'HideSoftKeyboard', with key:'hide_soft_keyboard'
06-06 17:45:19.819 I/InstrumentationBackend(16775): Added:'ListActions', with key:'list_actions'
06-06 17:45:19.819 I/calabash(16775): Instantiating http server at 7102
06-06 17:45:19.819 I/System.out(16775): HTTP Daemon listening on: 7102
06-06 17:45:19.828 I/WindowManager( 1631): WIN DEATH: Window{ee373f6 u0 com.evancharlton.mileage/com.evancharlton.mileage.Mileage EXITING}
06-06 17:45:19.851 D/EGL_emulation( 1713): eglMakeCurrent: 0xa6a85780: ver 2 0 (tinfo 0xa6a83640)
06-06 17:45:19.855 D/EGL_emulation( 1713): eglMakeCurrent: 0xa6a85780: ver 2 0 (tinfo 0xa6a83640)
06-06 17:45:19.857 D/EGL_emulation( 1713): eglMakeCurrent: 0xa6a85780: ver 2 0 (tinfo 0xa6a83640)
06-06 17:45:19.858 D/EGL_emulation( 1713): eglMakeCurrent: 0xa6a85780: ver 2 0 (tinfo 0xa6a83640)
06-06 17:45:19.882 D/EGL_emulation( 1713): eglMakeCurrent: 0xa6a85780: ver 2 0 (tinfo 0xa6a83640)
06-06 17:45:19.886 D/EGL_emulation( 1713): eglMakeCurrent: 0xa6a85780: ver 2 0 (tinfo 0xa6a83640)
06-06 17:45:19.899 D/EGL_emulation( 1713): eglMakeCurrent: 0xa6a85780: ver 2 0 (tinfo 0xa6a83640)
06-06 17:45:19.909 I/System.out(16775): URI: //ping
06-06 17:45:19.909 I/System.out(16775): params: {json={}
06-06 17:45:19.909 I/System.out(16775): }
06-06 17:45:19.912 I/System.out(16775): URI: //ping
06-06 17:45:19.912 I/System.out(16775): params: {json={}
06-06 17:45:19.912 I/System.out(16775): }
06-06 17:45:19.915 I/System.out(16775): URI: //ready
06-06 17:45:19.915 I/System.out(16775): params: {json={}
06-06 17:45:19.915 I/System.out(16775): }
06-06 17:45:19.917 I/System.out(16775): URI: //
06-06 17:45:19.917 I/System.out(16775): params: {json={"command":"version","arguments":[]}
06-06 17:45:19.917 I/System.out(16775): }
06-06 17:45:19.917 I/System.out(16775): header: {content-type=application/json;charset=utf-8, date=Sat, 06 Jun 2020 22:45:20 GMT, accept=*/*, host=127.0.0.1:34784, content-length=36, user-agent=HTTPClient/1.0 (2.8.3, ruby 2.5.1 (2018-03-29))}
06-06 17:45:19.917 I/System.out(16775): params: {json={"command":"version","arguments":[]}
06-06 17:45:19.917 I/System.out(16775): }
06-06 17:45:19.917 I/System.out(16775): ProP json = {"command":"version","arguments":[]}
06-06 17:45:19.917 I/System.out(16775): files: {}
06-06 17:45:19.917 I/System.out(16775): command: {"command":"version","arguments":[]}
06-06 17:45:19.920 I/InstrumentationBackend(16775): Got command:'Command:'Line:null,version', arguments:'[]'
06-06 17:45:19.927 I/System.out(16775): result:{"bonusInformation":[],"message":"0.9.8","success":true}
06-06 17:45:19.930 I/System.out(16775): URI: //start-application
06-06 17:45:19.930 I/System.out(16775): params: {json={"intent":null}
06-06 17:45:19.930 I/System.out(16775): }
06-06 17:45:19.941 I/ActivityManager( 1631): START u0 {act=android.intent.action.MAIN cat=[android.intent.category.LAUNCHER] flg=0x10200000 cmp=com.evancharlton.mileage/.Mileage} from uid 10728 on display 0
06-06 17:45:19.948 I/calabash(16775): newActivity1
06-06 17:45:19.957 I/calabash(16775): newActivity1
06-06 17:45:19.958 W/ActivityManager( 1631): Bad activity token: android.os.BinderProxy@3529863
06-06 17:45:19.958 W/ActivityManager( 1631): java.lang.ClassCastException: android.os.BinderProxy cannot be cast to com.android.server.am.ActivityRecord$Token
06-06 17:45:19.958 W/ActivityManager( 1631): 	at com.android.server.am.ActivityRecord.forTokenLocked(ActivityRecord.java:586)
06-06 17:45:19.958 W/ActivityManager( 1631): 	at com.android.server.am.ActivityRecord.isInStackLocked(ActivityRecord.java:1327)
06-06 17:45:19.958 W/ActivityManager( 1631): 	at com.android.server.am.ActivityRecord.getStackLocked(ActivityRecord.java:1332)
06-06 17:45:19.958 W/ActivityManager( 1631): 	at com.android.server.am.ActivityManagerService.getActivityDisplayId(ActivityManagerService.java:9806)
06-06 17:45:19.958 W/ActivityManager( 1631): 	at android.app.ActivityManagerNative.onTransact(ActivityManagerNative.java:2566)
06-06 17:45:19.958 W/ActivityManager( 1631): 	at com.android.server.am.ActivityManagerService.onTransact(ActivityManagerService.java:2757)
06-06 17:45:19.958 W/ActivityManager( 1631): 	at android.os.Binder.execTransact(Binder.java:565)
06-06 17:45:19.959 W/ActivityManager( 1631): Bad activity token: android.os.BinderProxy@3529863
06-06 17:45:19.959 W/ActivityManager( 1631): java.lang.ClassCastException: android.os.BinderProxy cannot be cast to com.android.server.am.ActivityRecord$Token
06-06 17:45:19.959 W/ActivityManager( 1631): 	at com.android.server.am.ActivityRecord.forTokenLocked(ActivityRecord.java:586)
06-06 17:45:19.959 W/ActivityManager( 1631): 	at com.android.server.am.ActivityRecord.isInStackLocked(ActivityRecord.java:1327)
06-06 17:45:19.959 W/ActivityManager( 1631): 	at com.android.server.am.ActivityManagerService.setTaskDescription(ActivityManagerService.java:9358)
06-06 17:45:19.959 W/ActivityManager( 1631): 	at android.app.ActivityManagerNative.onTransact(ActivityManagerNative.java:2639)
06-06 17:45:19.959 W/ActivityManager( 1631): 	at com.android.server.am.ActivityManagerService.onTransact(ActivityManagerService.java:2757)
06-06 17:45:19.959 W/ActivityManager( 1631): 	at android.os.Binder.execTransact(Binder.java:565)
06-06 17:45:19.960 W/ActivityManager( 1631): Bad activity token: android.os.BinderProxy@3529863
06-06 17:45:19.960 W/ActivityManager( 1631): java.lang.ClassCastException: android.os.BinderProxy cannot be cast to com.android.server.am.ActivityRecord$Token
06-06 17:45:19.960 W/ActivityManager( 1631): 	at com.android.server.am.ActivityRecord.forTokenLocked(ActivityRecord.java:586)
06-06 17:45:19.960 W/ActivityManager( 1631): 	at com.android.server.am.ActivityRecord.isInStackLocked(ActivityRecord.java:1327)
06-06 17:45:19.960 W/ActivityManager( 1631): 	at com.android.server.am.ActivityRecord.getStackLocked(ActivityRecord.java:1332)
06-06 17:45:19.960 W/ActivityManager( 1631): 	at com.android.server.am.ActivityManagerService.getActivityStackId(ActivityManagerService.java:9817)
06-06 17:45:19.960 W/ActivityManager( 1631): 	at android.app.ActivityManagerNative.onTransact(ActivityManagerNative.java:2856)
06-06 17:45:19.960 W/ActivityManager( 1631): 	at com.android.server.am.ActivityManagerService.onTransact(ActivityManagerService.java:2757)
06-06 17:45:19.960 W/ActivityManager( 1631): 	at android.os.Binder.execTransact(Binder.java:565)
06-06 17:45:19.965 D/gralloc_ranchu( 1348): gralloc_alloc: Creating ashmem region of size 9023488
06-06 17:45:19.982 W/ActivityManager( 1631): Bad activity token: android.os.BinderProxy@3529863
06-06 17:45:19.982 W/ActivityManager( 1631): java.lang.ClassCastException: android.os.BinderProxy cannot be cast to com.android.server.am.ActivityRecord$Token
06-06 17:45:19.982 W/ActivityManager( 1631): 	at com.android.server.am.ActivityRecord.forTokenLocked(ActivityRecord.java:586)
06-06 17:45:19.982 W/ActivityManager( 1631): 	at com.android.server.am.ActivityRecord.isInStackLocked(ActivityRecord.java:1327)
06-06 17:45:19.982 W/ActivityManager( 1631): 	at com.android.server.am.ActivityManagerService.getActivityOptions(ActivityManagerService.java:12559)
06-06 17:45:19.982 W/ActivityManager( 1631): 	at android.app.ActivityManagerNative.onTransact(ActivityManagerNative.java:1933)
06-06 17:45:19.982 W/ActivityManager( 1631): 	at com.android.server.am.ActivityManagerService.onTransact(ActivityManagerService.java:2757)
06-06 17:45:19.982 W/ActivityManager( 1631): 	at android.os.Binder.execTransact(Binder.java:565)
06-06 17:45:19.983 W/ActivityManager( 1631): Bad activity token: android.os.BinderProxy@3529863
06-06 17:45:19.983 W/ActivityManager( 1631): java.lang.ClassCastException: android.os.BinderProxy cannot be cast to com.android.server.am.ActivityRecord$Token
06-06 17:45:19.983 W/ActivityManager( 1631): 	at com.android.server.am.ActivityRecord.forTokenLocked(ActivityRecord.java:586)
06-06 17:45:19.983 W/ActivityManager( 1631): 	at com.android.server.am.ActivityRecord.isInStackLocked(ActivityRecord.java:1327)
06-06 17:45:19.983 W/ActivityManager( 1631): 	at com.android.server.am.ActivityManagerService.getActivityOptions(ActivityManagerService.java:12559)
06-06 17:45:19.983 W/ActivityManager( 1631): 	at android.app.ActivityManagerNative.onTransact(ActivityManagerNative.java:1933)
06-06 17:45:19.983 W/ActivityManager( 1631): 	at com.android.server.am.ActivityManagerService.onTransact(ActivityManagerService.java:2757)
06-06 17:45:19.983 W/ActivityManager( 1631): 	at android.os.Binder.execTransact(Binder.java:565)
06-06 17:45:19.993 V/PhoneStatusBar( 1713): setLightsOn(true)
06-06 17:45:19.999 D/EGL_emulation( 2106): eglMakeCurrent: 0xa6a85300: ver 2 0 (tinfo 0xa6a83220)
06-06 17:45:20.003 D/EGL_emulation( 1713): eglMakeCurrent: 0xa6a85780: ver 2 0 (tinfo 0xa6a83640)
06-06 17:45:20.015 D/gralloc_ranchu( 1348): gralloc_alloc: Creating ashmem region of size 9023488
06-06 17:45:20.015 D/EGL_emulation( 1713): eglMakeCurrent: 0xa6a85780: ver 2 0 (tinfo 0xa6a83640)
06-06 17:45:20.025 D/        (16775): HostConnection::get() New Host Connection established 0x954a8480, tid 16775
06-06 17:45:20.026 D/EGL_emulation( 1713): eglMakeCurrent: 0xa6a85780: ver 2 0 (tinfo 0xa6a83640)
06-06 17:45:20.027 V/PhoneStatusBar( 1713): setLightsOn(true)
06-06 17:45:20.078 D/EGL_emulation( 1713): eglMakeCurrent: 0xa6a85780: ver 2 0 (tinfo 0xa6a83640)
06-06 17:45:20.081 D/EGL_emulation( 1713): eglMakeCurrent: 0xa6a85780: ver 2 0 (tinfo 0xa6a83640)
06-06 17:45:20.083 D/EGL_emulation( 1713): eglMakeCurrent: 0xa6a85780: ver 2 0 (tinfo 0xa6a83640)
06-06 17:45:20.083 I/WindowManager( 1631): Destroying surface Surface(name=com.evancharlton.mileage/com.evancharlton.mileage.Mileage) called by com.android.server.wm.WindowStateAnimator.destroySurface:2016 com.android.server.wm.WindowStateAnimator.destroySurfaceLocked:882 com.android.server.wm.WindowState.removeLocked:1456 com.android.server.wm.WindowManagerService.removeWindowInnerLocked:2484 com.android.server.wm.AppWindowToken.destroySurfaces:365 com.android.server.wm.WindowStateAnimator.finishExit:565 com.android.server.wm.AppWindowAnimator.stepAnimationLocked:427 com.android.server.wm.WindowAnimator.updateAppWindowsLocked:196 
06-06 17:45:20.085 D/EGL_emulation( 1713): eglMakeCurrent: 0xa6a85780: ver 2 0 (tinfo 0xa6a83640)
06-06 17:45:20.098 D/EGL_emulation( 1713): eglMakeCurrent: 0xa6a85780: ver 2 0 (tinfo 0xa6a83640)
06-06 17:45:20.100 D/EGL_emulation( 1713): eglMakeCurrent: 0xa6a85780: ver 2 0 (tinfo 0xa6a83640)
06-06 17:45:20.100 V/PhoneStatusBar( 1713): setLightsOn(true)
06-06 17:45:20.116 D/EGL_emulation( 1713): eglMakeCurrent: 0xa6a85780: ver 2 0 (tinfo 0xa6a83640)
06-06 17:45:20.116 D/gralloc_ranchu( 1348): gralloc_alloc: Creating ashmem region of size 9023488
06-06 17:45:20.137 D/EGL_emulation( 1713): eglMakeCurrent: 0xa6a85780: ver 2 0 (tinfo 0xa6a83640)
06-06 17:45:20.139 I/ActivityManager( 1631): Displayed com.evancharlton.mileage/.Mileage: +194ms
06-06 17:45:20.139 D/EGL_emulation( 1713): eglMakeCurrent: 0xa6a85780: ver 2 0 (tinfo 0xa6a83640)
06-06 17:45:20.151 D/EGL_emulation( 1713): eglMakeCurrent: 0xa6a85780: ver 2 0 (tinfo 0xa6a83640)
06-06 17:45:20.151 V/PhoneStatusBar( 1713): setLightsOn(true)
06-06 17:45:20.154 D/EGL_emulation( 1713): eglMakeCurrent: 0xa6a85780: ver 2 0 (tinfo 0xa6a83640)
06-06 17:45:20.155 D/EGL_emulation( 1713): eglMakeCurrent: 0xa6a85780: ver 2 0 (tinfo 0xa6a83640)
06-06 17:45:20.165 D/EGL_emulation( 1713): eglMakeCurrent: 0xa6a85780: ver 2 0 (tinfo 0xa6a83640)
06-06 17:45:20.166 D/EGL_emulation( 1713): eglMakeCurrent: 0xa6a85780: ver 2 0 (tinfo 0xa6a83640)
06-06 17:45:20.167 V/PhoneStatusBar( 1713): setLightsOn(true)
06-06 17:45:20.182 D/EGL_emulation( 1713): eglMakeCurrent: 0xa6a85780: ver 2 0 (tinfo 0xa6a83640)
06-06 17:45:20.183 D/EGL_emulation( 1713): eglMakeCurrent: 0xa6a85780: ver 2 0 (tinfo 0xa6a83640)
06-06 17:45:20.188 I/System.out(16775): URI: //map
06-06 17:45:20.188 I/System.out(16775): params: {json={"query":"* marked:'Statistics'","operation":{"method_name":"query","arguments":[]}}
06-06 17:45:20.188 I/System.out(16775): }
06-06 17:45:20.198 D/EGL_emulation( 1713): eglMakeCurrent: 0xa6a85780: ver 2 0 (tinfo 0xa6a83640)
06-06 17:45:20.201 D/EGL_emulation( 1713): eglMakeCurrent: 0xa6a85780: ver 2 0 (tinfo 0xa6a83640)
06-06 17:45:20.201 W/ResourceType(16775): No package identifier when getting name for resource number 0x00000001
06-06 17:45:20.215 D/EGL_emulation( 1713): eglMakeCurrent: 0xa6a85780: ver 2 0 (tinfo 0xa6a83640)
06-06 17:45:20.216 I/System.out(16775): URI: //gesture
06-06 17:45:20.216 I/System.out(16775): params: {json={"query_timeout":5.0,"gestures":[{"query_string":"* marked:'Statistics'","touches":[{"x":50,"y":50,"offset_x":0,"offset_y":0,"wait":0.0,"time":0.2,"release":true,"query_string":null}]}]}
06-06 17:45:20.216 I/System.out(16775): }
06-06 17:45:20.221 W/ResourceType(16775): No package identifier when getting name for resource number 0x00000001
06-06 17:45:20.331 I/WindowManager( 1631): Destroying surface Surface(name=Starting com.evancharlton.mileage) called by com.android.server.wm.WindowStateAnimator.destroySurface:2016 com.android.server.wm.WindowStateAnimator.destroySurfaceLocked:882 com.android.server.wm.WindowState.destroyOrSaveSurface:2100 com.android.server.wm.AppWindowToken.destroySurfaces:363 com.android.server.wm.WindowStateAnimator.finishExit:565 com.android.server.wm.WindowStateAnimator.stepAnimationLocked:491 com.android.server.wm.WindowAnimator.updateWindowsLocked:303 com.android.server.wm.WindowAnimator.animateLocked:704 
06-06 17:45:20.333 V/PhoneStatusBar( 1713): setLightsOn(true)
06-06 17:45:20.365 V/PhoneStatusBar( 1713): setLightsOn(true)
06-06 17:45:20.448 V/PhoneStatusBar( 1713): setLightsOn(true)
06-06 17:45:20.450 I/calabash(16775): newActivity1
06-06 17:45:20.459 I/System.out(16775): URI: //map
06-06 17:45:20.459 I/System.out(16775): params: {json={"query":"android.widget.ScrollView index:0","operation":{"method_name":"query","arguments":[]}}
06-06 17:45:20.459 I/System.out(16775): }
06-06 17:45:20.461 W/ActivityManager( 1631): Bad activity token: android.os.BinderProxy@2d58689
06-06 17:45:20.461 W/ActivityManager( 1631): java.lang.ClassCastException: android.os.BinderProxy cannot be cast to com.android.server.am.ActivityRecord$Token
06-06 17:45:20.461 W/ActivityManager( 1631): 	at com.android.server.am.ActivityRecord.forTokenLocked(ActivityRecord.java:586)
06-06 17:45:20.461 W/ActivityManager( 1631): 	at com.android.server.am.ActivityRecord.isInStackLocked(ActivityRecord.java:1327)
06-06 17:45:20.461 W/ActivityManager( 1631): 	at com.android.server.am.ActivityRecord.getStackLocked(ActivityRecord.java:1332)
06-06 17:45:20.461 W/ActivityManager( 1631): 	at com.android.server.am.ActivityManagerService.getActivityDisplayId(ActivityManagerService.java:9806)
06-06 17:45:20.461 W/ActivityManager( 1631): 	at android.app.ActivityManagerNative.onTransact(ActivityManagerNative.java:2566)
06-06 17:45:20.461 W/ActivityManager( 1631): 	at com.android.server.am.ActivityManagerService.onTransact(ActivityManagerService.java:2757)
06-06 17:45:20.461 W/ActivityManager( 1631): 	at android.os.Binder.execTransact(Binder.java:565)
06-06 17:45:20.461 W/ActivityManager( 1631): Bad activity token: android.os.BinderProxy@2d58689
06-06 17:45:20.461 W/ActivityManager( 1631): java.lang.ClassCastException: android.os.BinderProxy cannot be cast to com.android.server.am.ActivityRecord$Token
06-06 17:45:20.461 W/ActivityManager( 1631): 	at com.android.server.am.ActivityRecord.forTokenLocked(ActivityRecord.java:586)
06-06 17:45:20.461 W/ActivityManager( 1631): 	at com.android.server.am.ActivityRecord.isInStackLocked(ActivityRecord.java:1327)
06-06 17:45:20.461 W/ActivityManager( 1631): 	at com.android.server.am.ActivityManagerService.setTaskDescription(ActivityManagerService.java:9358)
06-06 17:45:20.461 W/ActivityManager( 1631): 	at android.app.ActivityManagerNative.onTransact(ActivityManagerNative.java:2639)
06-06 17:45:20.461 W/ActivityManager( 1631): 	at com.android.server.am.ActivityManagerService.onTransact(ActivityManagerService.java:2757)
06-06 17:45:20.461 W/ActivityManager( 1631): 	at android.os.Binder.execTransact(Binder.java:565)
06-06 17:45:20.462 W/ActivityManager( 1631): Bad activity token: android.os.BinderProxy@2d58689
06-06 17:45:20.462 W/ActivityManager( 1631): java.lang.ClassCastException: android.os.BinderProxy cannot be cast to com.android.server.am.ActivityRecord$Token
06-06 17:45:20.462 W/ActivityManager( 1631): 	at com.android.server.am.ActivityRecord.forTokenLocked(ActivityRecord.java:586)
06-06 17:45:20.462 W/ActivityManager( 1631): 	at com.android.server.am.ActivityRecord.isInStackLocked(ActivityRecord.java:1327)
06-06 17:45:20.462 W/ActivityManager( 1631): 	at com.android.server.am.ActivityRecord.getStackLocked(ActivityRecord.java:1332)
06-06 17:45:20.462 W/ActivityManager( 1631): 	at com.android.server.am.ActivityManagerService.getActivityStackId(ActivityManagerService.java:9817)
06-06 17:45:20.462 W/ActivityManager( 1631): 	at android.app.ActivityManagerNative.onTransact(ActivityManagerNative.java:2856)
06-06 17:45:20.462 W/ActivityManager( 1631): 	at com.android.server.am.ActivityManagerService.onTransact(ActivityManagerService.java:2757)
06-06 17:45:20.462 W/ActivityManager( 1631): 	at android.os.Binder.execTransact(Binder.java:565)
06-06 17:45:20.469 D/VehicleStatisticsActivity(16775): Checking recalculation ...
06-06 17:45:20.470 D/VehicleStatisticsActivity(16775): Recalculation not necessary.
06-06 17:45:20.482 W/ActivityManager( 1631): Bad activity token: android.os.BinderProxy@2d58689
06-06 17:45:20.482 W/ActivityManager( 1631): java.lang.ClassCastException: android.os.BinderProxy cannot be cast to com.android.server.am.ActivityRecord$Token
06-06 17:45:20.482 W/ActivityManager( 1631): 	at com.android.server.am.ActivityRecord.forTokenLocked(ActivityRecord.java:586)
06-06 17:45:20.482 W/ActivityManager( 1631): 	at com.android.server.am.ActivityRecord.isInStackLocked(ActivityRecord.java:1327)
06-06 17:45:20.482 W/ActivityManager( 1631): 	at com.android.server.am.ActivityManagerService.getActivityOptions(ActivityManagerService.java:12559)
06-06 17:45:20.482 W/ActivityManager( 1631): 	at android.app.ActivityManagerNative.onTransact(ActivityManagerNative.java:1933)
06-06 17:45:20.482 W/ActivityManager( 1631): 	at com.android.server.am.ActivityManagerService.onTransact(ActivityManagerService.java:2757)
06-06 17:45:20.482 W/ActivityManager( 1631): 	at android.os.Binder.execTransact(Binder.java:565)
06-06 17:45:20.482 W/ActivityManager( 1631): Bad activity token: android.os.BinderProxy@2d58689
06-06 17:45:20.482 W/ActivityManager( 1631): java.lang.ClassCastException: android.os.BinderProxy cannot be cast to com.android.server.am.ActivityRecord$Token
06-06 17:45:20.482 W/ActivityManager( 1631): 	at com.android.server.am.ActivityRecord.forTokenLocked(ActivityRecord.java:586)
06-06 17:45:20.482 W/ActivityManager( 1631): 	at com.android.server.am.ActivityRecord.isInStackLocked(ActivityRecord.java:1327)
06-06 17:45:20.482 W/ActivityManager( 1631): 	at com.android.server.am.ActivityManagerService.getActivityOptions(ActivityManagerService.java:12559)
06-06 17:45:20.482 W/ActivityManager( 1631): 	at android.app.ActivityManagerNative.onTransact(ActivityManagerNative.java:1933)
06-06 17:45:20.482 W/ActivityManager( 1631): 	at com.android.server.am.ActivityManagerService.onTransact(ActivityManagerService.java:2757)
06-06 17:45:20.482 W/ActivityManager( 1631): 	at android.os.Binder.execTransact(Binder.java:565)
06-06 17:45:20.484 D/VehicleStatisticsActivity(16775): Checking recalculation ...
06-06 17:45:20.485 D/VehicleStatisticsActivity(16775): Recalculation not necessary.
06-06 17:45:20.580 I/System.out(16775): URI: //map
06-06 17:45:20.580 I/System.out(16775): params: {json={"query":"android.widget.AbsListView index:0","operation":{"method_name":"query","arguments":[]}}
06-06 17:45:20.580 I/System.out(16775): }
06-06 17:45:20.581 V/PhoneStatusBar( 1713): setLightsOn(true)
06-06 17:45:20.585 I/art     (16775): Do partial code cache collection, code=30KB, data=29KB
06-06 17:45:20.585 I/art     (16775): After code cache collection, code=29KB, data=28KB
06-06 17:45:20.585 I/art     (16775): Increasing code cache capacity to 128KB
06-06 17:45:20.596 I/System.out(16775): URI: //map
06-06 17:45:20.596 I/System.out(16775): params: {json={"query":"android.widget.AbsListView index:0","operation":{"method_name":"query","arguments":[]}}
06-06 17:45:20.596 I/System.out(16775): }
06-06 17:45:20.611 I/System.out(16775): URI: //map
06-06 17:45:20.611 I/System.out(16775): params: {json={"query":"android.widget.AbsListView index:0","operation":{"method_name":"query","arguments":[]}}
06-06 17:45:20.611 I/System.out(16775): }
06-06 17:45:20.626 I/System.out(16775): URI: //map
06-06 17:45:20.627 I/System.out(16775): params: {json={"query":"android.widget.AbsListView index:0","operation":{"method_name":"query","arguments":["getFirstVisiblePosition"]}}
06-06 17:45:20.627 I/System.out(16775): }
06-06 17:45:20.639 I/System.out(16775): URI: //map
06-06 17:45:20.639 I/System.out(16775): params: {json={"query":"android.widget.AbsListView index:0","operation":{"method_name":"query","arguments":["getLastVisiblePosition"]}}
06-06 17:45:20.639 I/System.out(16775): }
06-06 17:45:20.653 I/System.out(16775): URI: //map
06-06 17:45:20.653 I/System.out(16775): params: {json={"query":"android.widget.AbsListView index:0","operation":{"method_name":"query","arguments":[{"method_name":"setSelection","arguments":[26]}]}}
06-06 17:45:20.653 I/System.out(16775): }
06-06 17:45:20.672 I/System.out(16775): URI: //map
06-06 17:45:20.673 I/System.out(16775): params: {json={"query":"* marked:'Minimum price'","operation":{"method_name":"query","arguments":[]}}
06-06 17:45:20.673 I/System.out(16775): }
06-06 17:45:20.742 D/gralloc_ranchu( 1348): gralloc_alloc: Creating ashmem region of size 9023488
06-06 17:45:20.749 V/PhoneStatusBar( 1713): setLightsOn(true)
06-06 17:45:20.750 V/PhoneStatusBar( 1713): setLightsOn(true)
06-06 17:45:20.751 W/OpenGLRenderer( 2106): Incorrectly called buildLayer on View: ShortcutAndWidgetContainer, destroying layer...
06-06 17:45:20.768 V/PhoneStatusBar( 1713): setLightsOn(true)
06-06 17:45:20.785 I/WindowManager( 1631): Destroying surface Surface(name=com.android.launcher3/com.android.launcher3.Launcher) called by com.android.server.wm.WindowStateAnimator.destroySurface:2016 com.android.server.wm.WindowStateAnimator.destroySurfaceLocked:882 com.android.server.wm.WindowState.destroyOrSaveSurface:2100 com.android.server.wm.AppWindowToken.destroySurfaces:363 com.android.server.wm.AppWindowToken.notifyAppStopped:389 com.android.server.wm.WindowManagerService.notifyAppStopped:4463 com.android.server.am.ActivityStack.activityStoppedLocked:1252 com.android.server.am.ActivityManagerService.activityStopped:6903 
06-06 17:45:20.804 W/ResourceType(16775): No package identifier when getting name for resource number 0x00000001
06-06 17:45:20.815 I/System.out(16775): URI: //gesture
06-06 17:45:20.815 I/System.out(16775): params: {json={"query_timeout":5.0,"gestures":[{"query_string":"* marked:'Minimum price'","touches":[{"x":50,"y":50,"offset_x":0,"offset_y":0,"wait":0.0,"time":0.2,"release":true,"query_string":null}]}]}
06-06 17:45:20.815 I/System.out(16775): }
06-06 17:45:20.819 W/ResourceType(16775): No package identifier when getting name for resource number 0x00000001
06-06 17:45:21.048 I/ActivityManager( 1631): START u0 {cmp=com.evancharlton.mileage/.charts.MinimumPriceChart (has extras)} from uid 10728 on display 0
06-06 17:45:21.049 V/PhoneStatusBar( 1713): setLightsOn(true)
06-06 17:45:21.050 V/PhoneStatusBar( 1713): setLightsOn(true)
06-06 17:45:21.058 I/System.out(16775): URI: //map
06-06 17:45:21.058 I/System.out(16775): params: {json={"query":"* {text CONTAINS[c] 'Least expensive fuel'}","operation":{"method_name":"query","arguments":[]}}
06-06 17:45:21.058 I/System.out(16775): }
06-06 17:45:21.104 I/calabash(16775): newActivity1
06-06 17:45:21.107 W/aiCharts(16775): License file is invalid or missing. 
06-06 17:45:21.107 W/aiCharts(16775): Please place proper license.lic to /assets folder.
06-06 17:45:21.120 V/PhoneStatusBar( 1713): setLightsOn(true)
06-06 17:45:21.148 V/PhoneStatusBar( 1713): setLightsOn(true)
06-06 17:45:21.153 I/WindowManager( 1631): Destroying surface Surface(name=Creating chart…) called by com.android.server.wm.WindowStateAnimator.destroySurface:2016 com.android.server.wm.WindowStateAnimator.destroySurfaceLocked:882 com.android.server.wm.WindowState.removeLocked:1456 com.android.server.wm.WindowManagerService.removeWindowInnerLocked:2484 com.android.server.wm.WindowManagerService.removeWindowLocked:2442 com.android.server.wm.WindowManagerService.removeWindowLocked:2311 com.android.server.wm.WindowManagerService.removeWindow:2306 com.android.server.wm.Session.remove:202 
06-06 17:45:21.156 D/gralloc_ranchu( 1348): gralloc_alloc: Creating ashmem region of size 9023488
06-06 17:45:21.165 V/PhoneStatusBar( 1713): setLightsOn(true)
06-06 17:45:21.192 I/ActivityManager( 1631): Displayed com.evancharlton.mileage/.charts.MinimumPriceChart: +90ms
06-06 17:45:21.198 V/PhoneStatusBar( 1713): setLightsOn(true)
06-06 17:45:21.232 V/PhoneStatusBar( 1713): setLightsOn(true)
06-06 17:45:21.248 V/PhoneStatusBar( 1713): setLightsOn(true)
06-06 17:45:21.432 V/PhoneStatusBar( 1713): setLightsOn(true)
06-06 17:45:21.435 I/System.out(16775): URI: //map
06-06 17:45:21.435 I/System.out(16775): params: {json={"query":"* {text CONTAINS[c] 'Least expensive fuel'}","operation":{"method_name":"query","arguments":[]}}
06-06 17:45:21.435 I/System.out(16775): }
06-06 17:45:21.455 I/System.out(16775): URI: //
06-06 17:45:21.455 I/System.out(16775): params: {json={"command":"press_key","arguments":["KEYCODE_BACK"]}
06-06 17:45:21.455 I/System.out(16775): }
06-06 17:45:21.455 I/System.out(16775): header: {content-type=application/json;charset=utf-8, date=Sat, 06 Jun 2020 22:45:21 GMT, accept=*/*, host=127.0.0.1:34784, content-length=52, user-agent=HTTPClient/1.0 (2.8.3, ruby 2.5.1 (2018-03-29))}
06-06 17:45:21.455 I/System.out(16775): params: {json={"command":"press_key","arguments":["KEYCODE_BACK"]}
06-06 17:45:21.455 I/System.out(16775): }
06-06 17:45:21.455 I/System.out(16775): ProP json = {"command":"press_key","arguments":["KEYCODE_BACK"]}
06-06 17:45:21.455 I/System.out(16775): files: {}
06-06 17:45:21.455 I/System.out(16775): command: {"command":"press_key","arguments":["KEYCODE_BACK"]}
06-06 17:45:21.456 I/InstrumentationBackend(16775): Got command:'Command:'Line:null,press_key', arguments:'[KEYCODE_BACK]'
06-06 17:45:21.459 V/PhoneStatusBar( 1713): setLightsOn(true)
06-06 17:45:21.461 V/PhoneStatusBar( 1713): setLightsOn(true)
06-06 17:45:21.463 I/art     (16775): Do partial code cache collection, code=60KB, data=62KB
06-06 17:45:21.463 I/art     (16775): After code cache collection, code=59KB, data=61KB
06-06 17:45:21.463 I/art     (16775): Increasing code cache capacity to 256KB
06-06 17:45:21.463 I/System.out(16775): result:{"bonusInformation":[],"message":"","success":true}
06-06 17:45:21.464 D/VehicleStatisticsActivity(16775): Checking recalculation ...
06-06 17:45:21.465 V/PhoneStatusBar( 1713): setLightsOn(true)
06-06 17:45:21.465 D/VehicleStatisticsActivity(16775): Recalculation not necessary.
06-06 17:45:21.466 I/System.out(16775): URI: //map
06-06 17:45:21.466 I/System.out(16775): params: {json={"query":"* {text CONTAINS[c] 'Statistics'}","operation":{"method_name":"query","arguments":[]}}
06-06 17:45:21.466 I/System.out(16775): }
06-06 17:45:21.481 D/gralloc_ranchu( 1348): gralloc_alloc: Creating ashmem region of size 9023488
06-06 17:45:21.482 V/PhoneStatusBar( 1713): setLightsOn(true)
06-06 17:45:21.498 V/PhoneStatusBar( 1713): setLightsOn(true)
06-06 17:45:21.514 V/PhoneStatusBar( 1713): setLightsOn(true)
