--------- beginning of main
06-05 21:21:49.278 V/PhoneStatusBar( 1711): setLightsOn(true)
06-05 21:21:49.282 D/gralloc_ranchu( 1347): gralloc_alloc: Creating ashmem region of size 3145728
06-05 21:21:49.289 E/EGL_emulation( 1347): tid 1347: eglCreateSyncKHR(1901): error 0x3004 (EGL_BAD_ATTRIBUTE)
--------- beginning of system
06-05 21:21:49.305 W/ActivityManager( 1630): Finishing task with all activities already finished
06-05 21:21:49.305 W/ActivityManager( 1630): Duplicate finish request for ActivityRecord{28ed34c u0 com.evancharlton.mileage/.Mileage t7510 f}
06-05 21:21:49.305 W/ActivityManager( 1630): Finishing task with all activities already finished
06-05 21:21:49.305 W/ActivityManager( 1630): Duplicate finish request for ActivityRecord{28ed34c u0 com.evancharlton.mileage/.Mileage t7510 f}
06-05 21:21:49.305 W/ActivityManager( 1630): Finishing task with all activities already finished
06-05 21:21:49.305 W/ActivityManager( 1630): Duplicate finish request for ActivityRecord{28ed34c u0 com.evancharlton.mileage/.Mileage t7510 f}
06-05 21:21:49.305 W/ActivityManager( 1630): Finishing task with all activities already finished
06-05 21:21:49.305 W/ActivityManager( 1630): Duplicate finish request for ActivityRecord{28ed34c u0 com.evancharlton.mileage/.Mileage t7510 f}
06-05 21:21:49.306 W/ActivityManager( 1630): Finishing task with all activities already finished
06-05 21:21:49.306 W/ActivityManager( 1630): Duplicate finish request for ActivityRecord{28ed34c u0 com.evancharlton.mileage/.Mileage t7510 f}
06-05 21:21:49.306 W/ActivityManager( 1630): Finishing task with all activities already finished
06-05 21:21:49.306 W/ActivityManager( 1630): Duplicate finish request for ActivityRecord{605940a u0 com.evancharlton.mileage/.charts.NorthChart t7510 f}
06-05 21:21:49.306 W/ActivityManager( 1630): Finishing task with all activities already finished
06-05 21:21:49.306 W/ActivityManager( 1630): Duplicate finish request for ActivityRecord{605940a u0 com.evancharlton.mileage/.charts.NorthChart t7510 f}
06-05 21:21:49.306 W/ActivityManager( 1630): Finishing task with all activities already finished
06-05 21:21:49.306 W/ActivityManager( 1630): Duplicate finish request for ActivityRecord{28ed34c u0 com.evancharlton.mileage/.Mileage t7510 f}
06-05 21:21:49.306 W/ActivityManager( 1630): Finishing task with all activities already finished
06-05 21:21:49.306 W/ActivityManager( 1630): Duplicate finish request for ActivityRecord{28ed34c u0 com.evancharlton.mileage/.Mileage t7510 f}
06-05 21:21:49.345 D/EGL_emulation( 2083): eglMakeCurrent: 0xb0f85240: ver 2 0 (tinfo 0xb0f832d0)
06-05 21:21:49.346 D/EGL_emulation( 1711): eglMakeCurrent: 0xb0f853c0: ver 2 0 (tinfo 0xb0f833e0)
06-05 21:21:49.361 D/EGL_emulation( 1711): eglMakeCurrent: 0xb0f853c0: ver 2 0 (tinfo 0xb0f833e0)
06-05 21:21:49.379 D/EGL_emulation( 1711): eglMakeCurrent: 0xb0f853c0: ver 2 0 (tinfo 0xb0f833e0)
06-05 21:21:49.394 D/EGL_emulation( 1711): eglMakeCurrent: 0xb0f853c0: ver 2 0 (tinfo 0xb0f833e0)
06-05 21:21:49.396 D/EGL_emulation( 1711): eglMakeCurrent: 0xb0f853c0: ver 2 0 (tinfo 0xb0f833e0)
06-05 21:21:49.411 D/EGL_emulation( 1711): eglMakeCurrent: 0xb0f853c0: ver 2 0 (tinfo 0xb0f833e0)
06-05 21:21:49.412 D/EGL_emulation( 1711): eglMakeCurrent: 0xb0f853c0: ver 2 0 (tinfo 0xb0f833e0)
06-05 21:21:49.425 D/AndroidRuntime(10321): >>>>>> START com.android.internal.os.RuntimeInit uid 2000 <<<<<<
06-05 21:21:49.426 D/AndroidRuntime(10321): CheckJNI is ON
06-05 21:21:49.428 D/EGL_emulation( 1711): eglMakeCurrent: 0xb0f853c0: ver 2 0 (tinfo 0xb0f833e0)
06-05 21:21:49.429 D/EGL_emulation( 1711): eglMakeCurrent: 0xb0f853c0: ver 2 0 (tinfo 0xb0f833e0)
06-05 21:21:49.437 W/art     (10321): Unexpected CPU variant for X86 using defaults: x86
06-05 21:21:49.439 D/ICU     (10321): No timezone override file found: /data/misc/zoneinfo/current/icu/icu_tzdata.dat
06-05 21:21:49.444 D/EGL_emulation( 1711): eglMakeCurrent: 0xb0f853c0: ver 2 0 (tinfo 0xb0f833e0)
06-05 21:21:49.447 E/memtrack(10321): Couldn't load memtrack module (No such file or directory)
06-05 21:21:49.447 E/android.os.Debug(10321): failed to load memtrack module: -2
06-05 21:21:49.447 I/Radio-JNI(10321): register_android_hardware_Radio DONE
06-05 21:21:49.447 D/EGL_emulation( 1711): eglMakeCurrent: 0xb0f853c0: ver 2 0 (tinfo 0xb0f833e0)
06-05 21:21:49.452 D/AndroidRuntime(10321): Calling main entry com.android.commands.am.Am
06-05 21:21:49.453 I/ActivityManager( 1630): Force stopping com.evancharlton.mileage appid=10286 user=0: start instr
06-05 21:21:49.453 I/ActivityManager( 1630): Killing 10269:com.evancharlton.mileage/u0a286 (adj 0): stop com.evancharlton.mileage
06-05 21:21:49.453 D/ActivityManager( 1630): cleanUpApplicationRecord -- 10269
06-05 21:21:49.453 I/WindowManager( 1630): Destroying surface Surface(name=com.evancharlton.mileage/com.evancharlton.mileage.charts.NorthChart) called by com.android.server.wm.WindowStateAnimator.destroySurface:2016 com.android.server.wm.WindowStateAnimator.destroySurfaceLocked:882 com.android.server.wm.WindowState.removeLocked:1456 com.android.server.wm.WindowManagerService.removeWindowInnerLocked:2484 com.android.server.wm.WindowManagerService.removeWindowLocked:2442 com.android.server.wm.WindowManagerService.removeWindowLocked:2311 com.android.server.wm.AppWindowToken.removeAllWindows:530 com.android.server.wm.AppWindowToken.removeAppFromTaskLocked:326 
06-05 21:21:49.454 W/ActivityManager( 1630): Crash of app com.evancharlton.mileage running instrumentation ComponentInfo{com.evancharlton.mileage.test/sh.calaba.instrumentationbackend.CalabashInstrumentationTestRunner}
06-05 21:21:49.455 I/ActivityManager( 1630): Force stopping com.evancharlton.mileage appid=10286 user=0: finished inst
06-05 21:21:49.457 I/art     (10331): Not late-enabling -Xcheck:jni (already on)
06-05 21:21:49.457 W/art     (10331): Unexpected CPU variant for X86 using defaults: x86
06-05 21:21:49.461 D/EGL_emulation( 1711): eglMakeCurrent: 0xb0f853c0: ver 2 0 (tinfo 0xb0f833e0)
06-05 21:21:49.462 D/EGL_emulation( 1711): eglMakeCurrent: 0xb0f853c0: ver 2 0 (tinfo 0xb0f833e0)
06-05 21:21:49.465 I/ActivityManager( 1630): Start proc 10331:com.evancharlton.mileage/u0a286 for added application com.evancharlton.mileage
06-05 21:21:49.465 D/AndroidRuntime(10321): Shutting down VM
06-05 21:21:49.469 W/System  (10331): ClassLoader referenced unknown path: /data/app/com.evancharlton.mileage.test-1/lib/x86
06-05 21:21:49.469 W/System  (10331): ClassLoader referenced unknown path: /data/app/com.evancharlton.mileage-1/lib/x86
06-05 21:21:49.471 W/System  (10331): ClassLoader referenced unknown path: 
06-05 21:21:49.475 I/System.out(10331): Main activity name automatically set to: com.evancharlton.mileage.Mileage
06-05 21:21:49.475 I/System.out(10331): Calabash did not load Mono. This is only a problem if you are trying to test a Mono application
06-05 21:21:49.475 I/calabash(10331): Test server port: 7102
06-05 21:21:49.476 I/InstrumentationBackend(10331): Added:'GetPreferences', with key:'get_preferences'
06-05 21:21:49.477 D/EGL_emulation( 1711): eglMakeCurrent: 0xb0f853c0: ver 2 0 (tinfo 0xb0f833e0)
06-05 21:21:49.479 D/EGL_emulation( 1711): eglMakeCurrent: 0xb0f853c0: ver 2 0 (tinfo 0xb0f833e0)
06-05 21:21:49.481 I/InstrumentationBackend(10331): Added:'SetPreferences', with key:'set_preferences'
06-05 21:21:49.481 I/InstrumentationBackend(10331): Added:'ClearPreferences', with key:'clear_preferences'
06-05 21:21:49.482 I/InstrumentationBackend(10331): Added:'PressElement', with key:'press_l10n_element'
06-05 21:21:49.482 I/InstrumentationBackend(10331): Added:'WaitForElement', with key:'wait_for_l10n_element'
06-05 21:21:49.482 I/InstrumentationBackend(10331): Added:'NullAction', with key:'nullAction'
06-05 21:21:49.482 I/InstrumentationBackend(10331): Added:'PressKey', with key:'press_key'
06-05 21:21:49.482 I/InstrumentationBackend(10331): Added:'SetActivityOrientation', with key:'set_activity_orientation'
06-05 21:21:49.482 I/InstrumentationBackend(10331): Added:'GetActivityOrientation', with key:'get_activity_orientation'
06-05 21:21:49.482 I/InstrumentationBackend(10331): Added:'FakeGPSLocation', with key:'set_gps_coordinates'
06-05 21:21:49.482 I/InstrumentationBackend(10331): Added:'SetPropertyByCssSelector', with key:'set_property_by_css_selector'
06-05 21:21:49.482 I/InstrumentationBackend(10331): Added:'GetUrl', with key:'get_url'
06-05 21:21:49.482 I/InstrumentationBackend(10331): Added:'ScrollTo', with key:'scroll_to'
06-05 21:21:49.483 I/InstrumentationBackend(10331): Added:'GetLoadProgress', with key:'get_load_progress'
06-05 21:21:49.483 I/InstrumentationBackend(10331): Added:'DumpHtml', with key:'dump_html'
06-05 21:21:49.483 I/InstrumentationBackend(10331): Added:'DumpBodyHtml', with key:'dump_body_html'
06-05 21:21:49.483 I/InstrumentationBackend(10331): Added:'EnterTextByCssSelector', with key:'enter_text_by_selector'
06-05 21:21:49.483 I/InstrumentationBackend(10331): Added:'AndroidSDKVersion', with key:'android_sdk_version'
06-05 21:21:49.483 I/InstrumentationBackend(10331): Added:'Version', with key:'version'
06-05 21:21:49.483 I/InstrumentationBackend(10331): Added:'Drag', with key:'drag'
06-05 21:21:49.483 I/InstrumentationBackend(10331): Added:'TouchCoordinates', with key:'touch_coordinate'
06-05 21:21:49.483 I/InstrumentationBackend(10331): Added:'LongPressCoordinate', with key:'long_press_coordinate'
06-05 21:21:49.483 I/InstrumentationBackend(10331): Added:'DragCoordinates', with key:'drag_coordinates'
06-05 21:21:49.483 I/InstrumentationBackend(10331): Added:'ResumeApplication', with key:'resume_application'
06-05 21:21:49.483 I/InstrumentationBackend(10331): Added:'Swipe', with key:'swipe'
06-05 21:21:49.483 I/InstrumentationBackend(10331): Added:'DoubleTapCoordinate', with key:'double_tap_coordinate'
06-05 21:21:49.484 I/InstrumentationBackend(10331): Added:'ClickOnScreen', with key:'click_on_screen'
06-05 21:21:49.484 I/InstrumentationBackend(10331): Added:'GetActivityName', with key:'get_activity_name'
06-05 21:21:49.484 I/InstrumentationBackend(10331): Added:'ScrollToView', with key:'scroll_to_view'
06-05 21:21:49.484 I/InstrumentationBackend(10331): Added:'ViewConfiguration', with key:'view_configuration'
06-05 21:21:49.484 I/InstrumentationBackend(10331): Added:'IsCurrentActivityFocused', with key:'is_current_activity_focused'
06-05 21:21:49.484 I/InstrumentationBackend(10331): Added:'SendTcp', with key:'send_tcp'
06-05 21:21:49.484 I/InstrumentationBackend(10331): Added:'DpToDevicePixel', with key:'dp_to_device_pixel'
06-05 21:21:49.484 I/InstrumentationBackend(10331): Added:'KeyboardEnterText', with key:'keyboard_enter_text'
06-05 21:21:49.484 I/InstrumentationBackend(10331): Added:'DeleteSurroundingText', with key:'delete_surrounding_text'
06-05 21:21:49.484 I/InstrumentationBackend(10331): Added:'SetComposingRegion', with key:'set_composing_region'
06-05 21:21:49.484 I/InstrumentationBackend(10331): Added:'SetSelection', with key:'set_selection'
06-05 21:21:49.484 I/InstrumentationBackend(10331): Added:'KeyboardKeyEvent', with key:'keyboard_key_event'
06-05 21:21:49.484 I/InstrumentationBackend(10331): Added:'PressUserActionButton', with key:'press_user_action_button'
06-05 21:21:49.484 I/InstrumentationBackend(10331): Added:'HideSoftKeyboard', with key:'hide_soft_keyboard'
06-05 21:21:49.484 I/InstrumentationBackend(10331): Added:'ListActions', with key:'list_actions'
06-05 21:21:49.484 I/calabash(10331): Instantiating http server at 7102
06-05 21:21:49.485 I/System.out(10331): HTTP Daemon listening on: 7102
06-05 21:21:49.494 D/EGL_emulation( 1711): eglMakeCurrent: 0xb0f853c0: ver 2 0 (tinfo 0xb0f833e0)
06-05 21:21:49.496 D/EGL_emulation( 1711): eglMakeCurrent: 0xb0f853c0: ver 2 0 (tinfo 0xb0f833e0)
06-05 21:21:49.508 I/WindowManager( 1630): WIN DEATH: Window{474a28b u0 com.evancharlton.mileage/com.evancharlton.mileage.Mileage EXITING}
06-05 21:21:49.508 W/Looper  ( 1630): Ignoring unexpected epoll events 0x11 on fd 201 that is no longer registered.
06-05 21:21:49.519 D/EGL_emulation( 1711): eglMakeCurrent: 0xb0f853c0: ver 2 0 (tinfo 0xb0f833e0)
06-05 21:21:49.522 D/EGL_emulation( 1711): eglMakeCurrent: 0xb0f853c0: ver 2 0 (tinfo 0xb0f833e0)
06-05 21:21:49.527 D/EGL_emulation( 1711): eglMakeCurrent: 0xb0f853c0: ver 2 0 (tinfo 0xb0f833e0)
06-05 21:21:49.529 D/EGL_emulation( 1711): eglMakeCurrent: 0xb0f853c0: ver 2 0 (tinfo 0xb0f833e0)
06-05 21:21:49.544 D/EGL_emulation( 1711): eglMakeCurrent: 0xb0f853c0: ver 2 0 (tinfo 0xb0f833e0)
06-05 21:21:49.546 D/EGL_emulation( 1711): eglMakeCurrent: 0xb0f853c0: ver 2 0 (tinfo 0xb0f833e0)
06-05 21:21:49.562 D/EGL_emulation( 1711): eglMakeCurrent: 0xb0f853c0: ver 2 0 (tinfo 0xb0f833e0)
06-05 21:21:49.574 I/System.out(10331): URI: //ping
06-05 21:21:49.574 I/System.out(10331): params: {json={}
06-05 21:21:49.574 I/System.out(10331): }
06-05 21:21:49.576 I/System.out(10331): URI: //ping
06-05 21:21:49.576 I/System.out(10331): params: {json={}
06-05 21:21:49.576 I/System.out(10331): }
06-05 21:21:49.577 D/EGL_emulation( 1711): eglMakeCurrent: 0xb0f853c0: ver 2 0 (tinfo 0xb0f833e0)
06-05 21:21:49.579 D/EGL_emulation( 1711): eglMakeCurrent: 0xb0f853c0: ver 2 0 (tinfo 0xb0f833e0)
06-05 21:21:49.582 I/System.out(10331): URI: //ready
06-05 21:21:49.582 I/System.out(10331): params: {json={}
06-05 21:21:49.582 I/System.out(10331): }
06-05 21:21:49.584 I/System.out(10331): URI: //
06-05 21:21:49.584 I/System.out(10331): params: {json={"command":"version","arguments":[]}
06-05 21:21:49.584 I/System.out(10331): }
06-05 21:21:49.584 I/System.out(10331): header: {content-type=application/json;charset=utf-8, date=Sat, 06 Jun 2020 02:21:50 GMT, accept=*/*, host=127.0.0.1:34777, content-length=36, user-agent=HTTPClient/1.0 (2.8.3, ruby 2.5.1 (2018-03-29))}
06-05 21:21:49.584 I/System.out(10331): params: {json={"command":"version","arguments":[]}
06-05 21:21:49.584 I/System.out(10331): }
06-05 21:21:49.584 I/System.out(10331): ProP json = {"command":"version","arguments":[]}
06-05 21:21:49.584 I/System.out(10331): files: {}
06-05 21:21:49.584 I/System.out(10331): command: {"command":"version","arguments":[]}
06-05 21:21:49.586 I/InstrumentationBackend(10331): Got command:'Command:'Line:null,version', arguments:'[]'
06-05 21:21:49.592 I/System.out(10331): result:{"bonusInformation":[],"message":"0.9.8","success":true}
06-05 21:21:49.594 I/System.out(10331): URI: //start-application
06-05 21:21:49.594 I/System.out(10331): params: {json={"intent":null}
06-05 21:21:49.594 I/System.out(10331): }
06-05 21:21:49.602 I/ActivityManager( 1630): START u0 {act=android.intent.action.MAIN cat=[android.intent.category.LAUNCHER] flg=0x10200000 cmp=com.evancharlton.mileage/.Mileage} from uid 10286 on display 0
06-05 21:21:49.608 I/calabash(10331): newActivity1
06-05 21:21:49.616 I/calabash(10331): newActivity1
06-05 21:21:49.617 W/ActivityManager( 1630): Bad activity token: android.os.BinderProxy@59c70a4
06-05 21:21:49.617 W/ActivityManager( 1630): java.lang.ClassCastException: android.os.BinderProxy cannot be cast to com.android.server.am.ActivityRecord$Token
06-05 21:21:49.617 W/ActivityManager( 1630): 	at com.android.server.am.ActivityRecord.forTokenLocked(ActivityRecord.java:586)
06-05 21:21:49.617 W/ActivityManager( 1630): 	at com.android.server.am.ActivityRecord.isInStackLocked(ActivityRecord.java:1327)
06-05 21:21:49.617 W/ActivityManager( 1630): 	at com.android.server.am.ActivityRecord.getStackLocked(ActivityRecord.java:1332)
06-05 21:21:49.617 W/ActivityManager( 1630): 	at com.android.server.am.ActivityManagerService.getActivityDisplayId(ActivityManagerService.java:9806)
06-05 21:21:49.617 W/ActivityManager( 1630): 	at android.app.ActivityManagerNative.onTransact(ActivityManagerNative.java:2566)
06-05 21:21:49.617 W/ActivityManager( 1630): 	at com.android.server.am.ActivityManagerService.onTransact(ActivityManagerService.java:2757)
06-05 21:21:49.617 W/ActivityManager( 1630): 	at android.os.Binder.execTransact(Binder.java:565)
06-05 21:21:49.618 W/ActivityManager( 1630): Bad activity token: android.os.BinderProxy@59c70a4
06-05 21:21:49.618 W/ActivityManager( 1630): java.lang.ClassCastException: android.os.BinderProxy cannot be cast to com.android.server.am.ActivityRecord$Token
06-05 21:21:49.618 W/ActivityManager( 1630): 	at com.android.server.am.ActivityRecord.forTokenLocked(ActivityRecord.java:586)
06-05 21:21:49.618 W/ActivityManager( 1630): 	at com.android.server.am.ActivityRecord.isInStackLocked(ActivityRecord.java:1327)
06-05 21:21:49.618 W/ActivityManager( 1630): 	at com.android.server.am.ActivityManagerService.setTaskDescription(ActivityManagerService.java:9358)
06-05 21:21:49.618 W/ActivityManager( 1630): 	at android.app.ActivityManagerNative.onTransact(ActivityManagerNative.java:2639)
06-05 21:21:49.618 W/ActivityManager( 1630): 	at com.android.server.am.ActivityManagerService.onTransact(ActivityManagerService.java:2757)
06-05 21:21:49.618 W/ActivityManager( 1630): 	at android.os.Binder.execTransact(Binder.java:565)
06-05 21:21:49.618 W/ActivityManager( 1630): Bad activity token: android.os.BinderProxy@59c70a4
06-05 21:21:49.618 W/ActivityManager( 1630): java.lang.ClassCastException: android.os.BinderProxy cannot be cast to com.android.server.am.ActivityRecord$Token
06-05 21:21:49.618 W/ActivityManager( 1630): 	at com.android.server.am.ActivityRecord.forTokenLocked(ActivityRecord.java:586)
06-05 21:21:49.618 W/ActivityManager( 1630): 	at com.android.server.am.ActivityRecord.isInStackLocked(ActivityRecord.java:1327)
06-05 21:21:49.618 W/ActivityManager( 1630): 	at com.android.server.am.ActivityRecord.getStackLocked(ActivityRecord.java:1332)
06-05 21:21:49.618 W/ActivityManager( 1630): 	at com.android.server.am.ActivityManagerService.getActivityStackId(ActivityManagerService.java:9817)
06-05 21:21:49.618 W/ActivityManager( 1630): 	at android.app.ActivityManagerNative.onTransact(ActivityManagerNative.java:2856)
06-05 21:21:49.618 W/ActivityManager( 1630): 	at com.android.server.am.ActivityManagerService.onTransact(ActivityManagerService.java:2757)
06-05 21:21:49.618 W/ActivityManager( 1630): 	at android.os.Binder.execTransact(Binder.java:565)
06-05 21:21:49.628 D/gralloc_ranchu( 1347): gralloc_alloc: Creating ashmem region of size 9023488
06-05 21:21:49.634 W/ActivityManager( 1630): Bad activity token: android.os.BinderProxy@59c70a4
06-05 21:21:49.634 W/ActivityManager( 1630): java.lang.ClassCastException: android.os.BinderProxy cannot be cast to com.android.server.am.ActivityRecord$Token
06-05 21:21:49.634 W/ActivityManager( 1630): 	at com.android.server.am.ActivityRecord.forTokenLocked(ActivityRecord.java:586)
06-05 21:21:49.634 W/ActivityManager( 1630): 	at com.android.server.am.ActivityRecord.isInStackLocked(ActivityRecord.java:1327)
06-05 21:21:49.634 W/ActivityManager( 1630): 	at com.android.server.am.ActivityManagerService.getActivityOptions(ActivityManagerService.java:12559)
06-05 21:21:49.634 W/ActivityManager( 1630): 	at android.app.ActivityManagerNative.onTransact(ActivityManagerNative.java:1933)
06-05 21:21:49.634 W/ActivityManager( 1630): 	at com.android.server.am.ActivityManagerService.onTransact(ActivityManagerService.java:2757)
06-05 21:21:49.634 W/ActivityManager( 1630): 	at android.os.Binder.execTransact(Binder.java:565)
06-05 21:21:49.634 W/ActivityManager( 1630): Bad activity token: android.os.BinderProxy@59c70a4
06-05 21:21:49.634 W/ActivityManager( 1630): java.lang.ClassCastException: android.os.BinderProxy cannot be cast to com.android.server.am.ActivityRecord$Token
06-05 21:21:49.634 W/ActivityManager( 1630): 	at com.android.server.am.ActivityRecord.forTokenLocked(ActivityRecord.java:586)
06-05 21:21:49.634 W/ActivityManager( 1630): 	at com.android.server.am.ActivityRecord.isInStackLocked(ActivityRecord.java:1327)
06-05 21:21:49.634 W/ActivityManager( 1630): 	at com.android.server.am.ActivityManagerService.getActivityOptions(ActivityManagerService.java:12559)
06-05 21:21:49.634 W/ActivityManager( 1630): 	at android.app.ActivityManagerNative.onTransact(ActivityManagerNative.java:1933)
06-05 21:21:49.634 W/ActivityManager( 1630): 	at com.android.server.am.ActivityManagerService.onTransact(ActivityManagerService.java:2757)
06-05 21:21:49.634 W/ActivityManager( 1630): 	at android.os.Binder.execTransact(Binder.java:565)
06-05 21:21:49.654 V/PhoneStatusBar( 1711): setLightsOn(true)
06-05 21:21:49.661 D/EGL_emulation( 2083): eglMakeCurrent: 0xb0f85240: ver 2 0 (tinfo 0xb0f832d0)
06-05 21:21:49.663 D/EGL_emulation( 1711): eglMakeCurrent: 0xb0f853c0: ver 2 0 (tinfo 0xb0f833e0)
06-05 21:21:49.677 D/gralloc_ranchu( 1347): gralloc_alloc: Creating ashmem region of size 9023488
06-05 21:21:49.678 D/EGL_emulation( 1711): eglMakeCurrent: 0xb0f853c0: ver 2 0 (tinfo 0xb0f833e0)
06-05 21:21:49.681 D/        (10331): HostConnection::get() New Host Connection established 0xa4a94500, tid 10331
06-05 21:21:49.682 D/EGL_emulation( 1711): eglMakeCurrent: 0xb0f853c0: ver 2 0 (tinfo 0xb0f833e0)
06-05 21:21:49.682 V/PhoneStatusBar( 1711): setLightsOn(true)
06-05 21:21:49.710 D/EGL_emulation( 1711): eglMakeCurrent: 0xb0f853c0: ver 2 0 (tinfo 0xb0f833e0)
06-05 21:21:49.712 D/EGL_emulation( 1711): eglMakeCurrent: 0xb0f853c0: ver 2 0 (tinfo 0xb0f833e0)
06-05 21:21:49.714 D/EGL_emulation( 1711): eglMakeCurrent: 0xb0f853c0: ver 2 0 (tinfo 0xb0f833e0)
06-05 21:21:49.715 D/EGL_emulation( 1711): eglMakeCurrent: 0xb0f853c0: ver 2 0 (tinfo 0xb0f833e0)
06-05 21:21:49.725 I/ActivityManager( 1630): Displayed com.evancharlton.mileage/.Mileage: +119ms
06-05 21:21:49.728 D/gralloc_ranchu( 1347): gralloc_alloc: Creating ashmem region of size 9023488
06-05 21:21:49.728 D/EGL_emulation( 1711): eglMakeCurrent: 0xb0f853c0: ver 2 0 (tinfo 0xb0f833e0)
06-05 21:21:49.740 D/EGL_emulation( 1711): eglMakeCurrent: 0xb0f853c0: ver 2 0 (tinfo 0xb0f833e0)
06-05 21:21:49.749 D/EGL_emulation( 1711): eglMakeCurrent: 0xb0f853c0: ver 2 0 (tinfo 0xb0f833e0)
06-05 21:21:49.752 D/EGL_emulation( 1711): eglMakeCurrent: 0xb0f853c0: ver 2 0 (tinfo 0xb0f833e0)
06-05 21:21:49.752 V/PhoneStatusBar( 1711): setLightsOn(true)
06-05 21:21:49.761 D/EGL_emulation( 1711): eglMakeCurrent: 0xb0f853c0: ver 2 0 (tinfo 0xb0f833e0)
06-05 21:21:49.763 D/EGL_emulation( 1711): eglMakeCurrent: 0xb0f853c0: ver 2 0 (tinfo 0xb0f833e0)
06-05 21:21:49.768 I/System.out(10331): URI: //map
06-05 21:21:49.768 I/System.out(10331): params: {json={"query":"* marked:'Statistics'","operation":{"method_name":"query","arguments":[]}}
06-05 21:21:49.768 I/System.out(10331): }
06-05 21:21:49.777 I/WindowManager( 1630): Destroying surface Surface(name=com.evancharlton.mileage/com.evancharlton.mileage.Mileage) called by com.android.server.wm.WindowStateAnimator.destroySurface:2016 com.android.server.wm.WindowStateAnimator.destroySurfaceLocked:882 com.android.server.wm.WindowState.removeLocked:1456 com.android.server.wm.WindowManagerService.removeWindowInnerLocked:2484 com.android.server.wm.AppWindowToken.destroySurfaces:365 com.android.server.wm.WindowStateAnimator.finishExit:565 com.android.server.wm.AppWindowAnimator.stepAnimationLocked:427 com.android.server.wm.WindowAnimator.updateAppWindowsLocked:196 
06-05 21:21:49.778 D/EGL_emulation( 1711): eglMakeCurrent: 0xb0f853c0: ver 2 0 (tinfo 0xb0f833e0)
06-05 21:21:49.779 W/ResourceType(10331): No package identifier when getting name for resource number 0x00000001
06-05 21:21:49.780 D/EGL_emulation( 1711): eglMakeCurrent: 0xb0f853c0: ver 2 0 (tinfo 0xb0f833e0)
06-05 21:21:49.792 I/System.out(10331): URI: //gesture
06-05 21:21:49.792 I/System.out(10331): params: {json={"query_timeout":5.0,"gestures":[{"query_string":"* marked:'Statistics'","touches":[{"x":50,"y":50,"offset_x":0,"offset_y":0,"wait":0.0,"time":0.2,"release":true,"query_string":null}]}]}
06-05 21:21:49.792 I/System.out(10331): }
06-05 21:21:49.795 D/EGL_emulation( 1711): eglMakeCurrent: 0xb0f853c0: ver 2 0 (tinfo 0xb0f833e0)
06-05 21:21:49.796 D/EGL_emulation( 1711): eglMakeCurrent: 0xb0f853c0: ver 2 0 (tinfo 0xb0f833e0)
06-05 21:21:49.797 V/PhoneStatusBar( 1711): setLightsOn(true)
06-05 21:21:49.799 W/ResourceType(10331): No package identifier when getting name for resource number 0x00000001
06-05 21:21:49.811 D/EGL_emulation( 1711): eglMakeCurrent: 0xb0f853c0: ver 2 0 (tinfo 0xb0f833e0)
06-05 21:21:49.819 D/EGL_emulation( 1711): eglMakeCurrent: 0xb0f853c0: ver 2 0 (tinfo 0xb0f833e0)
06-05 21:21:49.834 D/EGL_emulation( 1711): eglMakeCurrent: 0xb0f853c0: ver 2 0 (tinfo 0xb0f833e0)
06-05 21:21:49.844 D/EGL_emulation( 1711): eglMakeCurrent: 0xb0f853c0: ver 2 0 (tinfo 0xb0f833e0)
06-05 21:21:49.848 D/EGL_emulation( 1711): eglMakeCurrent: 0xb0f853c0: ver 2 0 (tinfo 0xb0f833e0)
06-05 21:21:49.849 D/EGL_emulation( 1711): eglMakeCurrent: 0xb0f853c0: ver 2 0 (tinfo 0xb0f833e0)
06-05 21:21:49.861 D/EGL_emulation( 1711): eglMakeCurrent: 0xb0f853c0: ver 2 0 (tinfo 0xb0f833e0)
06-05 21:21:49.863 D/EGL_emulation( 1711): eglMakeCurrent: 0xb0f853c0: ver 2 0 (tinfo 0xb0f833e0)
06-05 21:21:49.878 D/EGL_emulation( 1711): eglMakeCurrent: 0xb0f853c0: ver 2 0 (tinfo 0xb0f833e0)
06-05 21:21:49.910 I/WindowManager( 1630): Destroying surface Surface(name=Starting com.evancharlton.mileage) called by com.android.server.wm.WindowStateAnimator.destroySurface:2016 com.android.server.wm.WindowStateAnimator.destroySurfaceLocked:882 com.android.server.wm.WindowState.destroyOrSaveSurface:2100 com.android.server.wm.AppWindowToken.destroySurfaces:363 com.android.server.wm.WindowStateAnimator.finishExit:565 com.android.server.wm.WindowStateAnimator.stepAnimationLocked:491 com.android.server.wm.WindowAnimator.updateWindowsLocked:303 com.android.server.wm.WindowAnimator.animateLocked:704 
06-05 21:21:49.912 V/PhoneStatusBar( 1711): setLightsOn(true)
06-05 21:21:49.915 V/PhoneStatusBar( 1711): setLightsOn(true)
06-05 21:21:50.030 I/calabash(10331): newActivity1
06-05 21:21:50.039 I/System.out(10331): URI: //map
06-05 21:21:50.039 I/System.out(10331): params: {json={"query":"android.widget.ScrollView index:0","operation":{"method_name":"query","arguments":[]}}
06-05 21:21:50.039 I/System.out(10331): }
06-05 21:21:50.044 W/ActivityManager( 1630): Bad activity token: android.os.BinderProxy@cdcf0be
06-05 21:21:50.044 W/ActivityManager( 1630): java.lang.ClassCastException: android.os.BinderProxy cannot be cast to com.android.server.am.ActivityRecord$Token
06-05 21:21:50.044 W/ActivityManager( 1630): 	at com.android.server.am.ActivityRecord.forTokenLocked(ActivityRecord.java:586)
06-05 21:21:50.044 W/ActivityManager( 1630): 	at com.android.server.am.ActivityRecord.isInStackLocked(ActivityRecord.java:1327)
06-05 21:21:50.044 W/ActivityManager( 1630): 	at com.android.server.am.ActivityRecord.getStackLocked(ActivityRecord.java:1332)
06-05 21:21:50.044 W/ActivityManager( 1630): 	at com.android.server.am.ActivityManagerService.getActivityDisplayId(ActivityManagerService.java:9806)
06-05 21:21:50.044 W/ActivityManager( 1630): 	at android.app.ActivityManagerNative.onTransact(ActivityManagerNative.java:2566)
06-05 21:21:50.044 W/ActivityManager( 1630): 	at com.android.server.am.ActivityManagerService.onTransact(ActivityManagerService.java:2757)
06-05 21:21:50.044 W/ActivityManager( 1630): 	at android.os.Binder.execTransact(Binder.java:565)
06-05 21:21:50.046 W/ActivityManager( 1630): Bad activity token: android.os.BinderProxy@cdcf0be
06-05 21:21:50.046 W/ActivityManager( 1630): java.lang.ClassCastException: android.os.BinderProxy cannot be cast to com.android.server.am.ActivityRecord$Token
06-05 21:21:50.046 W/ActivityManager( 1630): 	at com.android.server.am.ActivityRecord.forTokenLocked(ActivityRecord.java:586)
06-05 21:21:50.046 W/ActivityManager( 1630): 	at com.android.server.am.ActivityRecord.isInStackLocked(ActivityRecord.java:1327)
06-05 21:21:50.046 W/ActivityManager( 1630): 	at com.android.server.am.ActivityManagerService.setTaskDescription(ActivityManagerService.java:9358)
06-05 21:21:50.046 W/ActivityManager( 1630): 	at android.app.ActivityManagerNative.onTransact(ActivityManagerNative.java:2639)
06-05 21:21:50.046 W/ActivityManager( 1630): 	at com.android.server.am.ActivityManagerService.onTransact(ActivityManagerService.java:2757)
06-05 21:21:50.046 W/ActivityManager( 1630): 	at android.os.Binder.execTransact(Binder.java:565)
06-05 21:21:50.046 W/ActivityManager( 1630): Bad activity token: android.os.BinderProxy@cdcf0be
06-05 21:21:50.046 W/ActivityManager( 1630): java.lang.ClassCastException: android.os.BinderProxy cannot be cast to com.android.server.am.ActivityRecord$Token
06-05 21:21:50.046 W/ActivityManager( 1630): 	at com.android.server.am.ActivityRecord.forTokenLocked(ActivityRecord.java:586)
06-05 21:21:50.046 W/ActivityManager( 1630): 	at com.android.server.am.ActivityRecord.isInStackLocked(ActivityRecord.java:1327)
06-05 21:21:50.046 W/ActivityManager( 1630): 	at com.android.server.am.ActivityRecord.getStackLocked(ActivityRecord.java:1332)
06-05 21:21:50.046 W/ActivityManager( 1630): 	at com.android.server.am.ActivityManagerService.getActivityStackId(ActivityManagerService.java:9817)
06-05 21:21:50.046 W/ActivityManager( 1630): 	at android.app.ActivityManagerNative.onTransact(ActivityManagerNative.java:2856)
06-05 21:21:50.046 W/ActivityManager( 1630): 	at com.android.server.am.ActivityManagerService.onTransact(ActivityManagerService.java:2757)
06-05 21:21:50.046 W/ActivityManager( 1630): 	at android.os.Binder.execTransact(Binder.java:565)
06-05 21:21:50.052 D/VehicleStatisticsActivity(10331): Checking recalculation ...
06-05 21:21:50.053 D/VehicleStatisticsActivity(10331): Recalculation not necessary.
06-05 21:21:50.054 W/ActivityManager( 1630): Bad activity token: android.os.BinderProxy@cdcf0be
06-05 21:21:50.054 W/ActivityManager( 1630): java.lang.ClassCastException: android.os.BinderProxy cannot be cast to com.android.server.am.ActivityRecord$Token
06-05 21:21:50.054 W/ActivityManager( 1630): 	at com.android.server.am.ActivityRecord.forTokenLocked(ActivityRecord.java:586)
06-05 21:21:50.054 W/ActivityManager( 1630): 	at com.android.server.am.ActivityRecord.isInStackLocked(ActivityRecord.java:1327)
06-05 21:21:50.054 W/ActivityManager( 1630): 	at com.android.server.am.ActivityManagerService.getActivityOptions(ActivityManagerService.java:12559)
06-05 21:21:50.054 W/ActivityManager( 1630): 	at android.app.ActivityManagerNative.onTransact(ActivityManagerNative.java:1933)
06-05 21:21:50.054 W/ActivityManager( 1630): 	at com.android.server.am.ActivityManagerService.onTransact(ActivityManagerService.java:2757)
06-05 21:21:50.054 W/ActivityManager( 1630): 	at android.os.Binder.execTransact(Binder.java:565)
06-05 21:21:50.055 W/ActivityManager( 1630): Bad activity token: android.os.BinderProxy@cdcf0be
06-05 21:21:50.055 W/ActivityManager( 1630): java.lang.ClassCastException: android.os.BinderProxy cannot be cast to com.android.server.am.ActivityRecord$Token
06-05 21:21:50.055 W/ActivityManager( 1630): 	at com.android.server.am.ActivityRecord.forTokenLocked(ActivityRecord.java:586)
06-05 21:21:50.055 W/ActivityManager( 1630): 	at com.android.server.am.ActivityRecord.isInStackLocked(ActivityRecord.java:1327)
06-05 21:21:50.055 W/ActivityManager( 1630): 	at com.android.server.am.ActivityManagerService.getActivityOptions(ActivityManagerService.java:12559)
06-05 21:21:50.055 W/ActivityManager( 1630): 	at android.app.ActivityManagerNative.onTransact(ActivityManagerNative.java:1933)
06-05 21:21:50.055 W/ActivityManager( 1630): 	at com.android.server.am.ActivityManagerService.onTransact(ActivityManagerService.java:2757)
06-05 21:21:50.055 W/ActivityManager( 1630): 	at android.os.Binder.execTransact(Binder.java:565)
06-05 21:21:50.056 D/VehicleStatisticsActivity(10331): Checking recalculation ...
06-05 21:21:50.057 D/VehicleStatisticsActivity(10331): Recalculation not necessary.
06-05 21:21:50.097 V/PhoneStatusBar( 1711): setLightsOn(true)
06-05 21:21:50.125 I/System.out(10331): URI: //map
06-05 21:21:50.125 I/System.out(10331): params: {json={"query":"android.widget.AbsListView index:0","operation":{"method_name":"query","arguments":[]}}
06-05 21:21:50.125 I/System.out(10331): }
06-05 21:21:50.131 I/art     (10331): Do partial code cache collection, code=30KB, data=29KB
06-05 21:21:50.131 I/art     (10331): After code cache collection, code=29KB, data=28KB
06-05 21:21:50.131 I/art     (10331): Increasing code cache capacity to 128KB
06-05 21:21:50.141 I/System.out(10331): URI: //map
06-05 21:21:50.141 I/System.out(10331): params: {json={"query":"android.widget.AbsListView index:0","operation":{"method_name":"query","arguments":[]}}
06-05 21:21:50.141 I/System.out(10331): }
06-05 21:21:50.157 I/System.out(10331): URI: //map
06-05 21:21:50.157 I/System.out(10331): params: {json={"query":"android.widget.AbsListView index:0","operation":{"method_name":"query","arguments":[]}}
06-05 21:21:50.157 I/System.out(10331): }
06-05 21:21:50.171 I/System.out(10331): URI: //map
06-05 21:21:50.171 I/System.out(10331): params: {json={"query":"android.widget.AbsListView index:0","operation":{"method_name":"query","arguments":["getFirstVisiblePosition"]}}
06-05 21:21:50.171 I/System.out(10331): }
06-05 21:21:50.182 I/System.out(10331): URI: //map
06-05 21:21:50.182 I/System.out(10331): params: {json={"query":"android.widget.AbsListView index:0","operation":{"method_name":"query","arguments":["getLastVisiblePosition"]}}
06-05 21:21:50.182 I/System.out(10331): }
06-05 21:21:50.197 I/System.out(10331): URI: //map
06-05 21:21:50.197 I/System.out(10331): params: {json={"query":"android.widget.AbsListView index:0","operation":{"method_name":"query","arguments":[{"method_name":"setSelection","arguments":[26]}]}}
06-05 21:21:50.197 I/System.out(10331): }
06-05 21:21:50.213 I/System.out(10331): URI: //map
06-05 21:21:50.213 I/System.out(10331): params: {json={"query":"* marked:'South'","operation":{"method_name":"query","arguments":[]}}
06-05 21:21:50.213 I/System.out(10331): }
06-05 21:21:50.245 D/gralloc_ranchu( 1347): gralloc_alloc: Creating ashmem region of size 9023488
06-05 21:21:50.279 W/ResourceType(10331): No package identifier when getting name for resource number 0x00000001
06-05 21:21:50.290 I/System.out(10331): URI: //gesture
06-05 21:21:50.290 I/System.out(10331): params: {json={"query_timeout":5.0,"gestures":[{"query_string":"* marked:'South'","touches":[{"x":50,"y":50,"offset_x":0,"offset_y":0,"wait":0.0,"time":0.2,"release":true,"query_string":null}]}]}
06-05 21:21:50.290 I/System.out(10331): }
06-05 21:21:50.294 W/ResourceType(10331): No package identifier when getting name for resource number 0x00000001
06-05 21:21:50.395 V/PhoneStatusBar( 1711): setLightsOn(true)
06-05 21:21:50.396 V/PhoneStatusBar( 1711): setLightsOn(true)
06-05 21:21:50.397 W/OpenGLRenderer( 2083): Incorrectly called buildLayer on View: ShortcutAndWidgetContainer, destroying layer...
06-05 21:21:50.411 I/WindowManager( 1630): Destroying surface Surface(name=com.android.launcher3/com.android.launcher3.Launcher) called by com.android.server.wm.WindowStateAnimator.destroySurface:2016 com.android.server.wm.WindowStateAnimator.destroySurfaceLocked:882 com.android.server.wm.WindowState.destroyOrSaveSurface:2100 com.android.server.wm.AppWindowToken.destroySurfaces:363 com.android.server.wm.AppWindowToken.notifyAppStopped:389 com.android.server.wm.WindowManagerService.notifyAppStopped:4463 com.android.server.am.ActivityStack.activityStoppedLocked:1252 com.android.server.am.ActivityManagerService.activityStopped:6903 
06-05 21:21:50.412 V/PhoneStatusBar( 1711): setLightsOn(true)
06-05 21:21:50.528 I/ActivityManager( 1630): START u0 {cmp=com.evancharlton.mileage/.charts.SouthChart (has extras)} from uid 10286 on display 0
06-05 21:21:50.529 V/PhoneStatusBar( 1711): setLightsOn(true)
06-05 21:21:50.530 V/PhoneStatusBar( 1711): setLightsOn(true)
06-05 21:21:50.539 I/System.out(10331): URI: //map
06-05 21:21:50.539 I/System.out(10331): params: {json={"query":"* {text CONTAINS[c] 'Farthest south fillup'}","operation":{"method_name":"query","arguments":[]}}
06-05 21:21:50.539 I/System.out(10331): }
06-05 21:21:50.578 I/calabash(10331): newActivity1
06-05 21:21:50.581 W/aiCharts(10331): License file is invalid or missing. 
06-05 21:21:50.581 W/aiCharts(10331): Please place proper license.lic to /assets folder.
06-05 21:21:50.593 V/PhoneStatusBar( 1711): setLightsOn(true)
06-05 21:21:50.611 V/PhoneStatusBar( 1711): setLightsOn(true)
06-05 21:21:50.615 I/WindowManager( 1630): Destroying surface Surface(name=Creating chart…) called by com.android.server.wm.WindowStateAnimator.destroySurface:2016 com.android.server.wm.WindowStateAnimator.destroySurfaceLocked:882 com.android.server.wm.WindowState.removeLocked:1456 com.android.server.wm.WindowManagerService.removeWindowInnerLocked:2484 com.android.server.wm.WindowManagerService.removeWindowLocked:2442 com.android.server.wm.WindowManagerService.removeWindowLocked:2311 com.android.server.wm.WindowManagerService.removeWindow:2306 com.android.server.wm.Session.remove:202 
06-05 21:21:50.618 D/gralloc_ranchu( 1347): gralloc_alloc: Creating ashmem region of size 9023488
06-05 21:21:50.627 V/PhoneStatusBar( 1711): setLightsOn(true)
06-05 21:21:50.641 I/ActivityManager( 1630): Displayed com.evancharlton.mileage/.charts.SouthChart: +66ms
06-05 21:21:50.644 V/PhoneStatusBar( 1711): setLightsOn(true)
06-05 21:21:50.679 V/PhoneStatusBar( 1711): setLightsOn(true)
06-05 21:21:50.704 V/PhoneStatusBar( 1711): setLightsOn(true)
06-05 21:21:50.881 V/PhoneStatusBar( 1711): setLightsOn(true)
06-05 21:21:50.911 I/System.out(10331): URI: //map
06-05 21:21:50.912 I/System.out(10331): params: {json={"query":"* {text CONTAINS[c] 'Farthest south fillup'}","operation":{"method_name":"query","arguments":[]}}
06-05 21:21:50.912 I/System.out(10331): }
06-05 21:21:50.945 I/System.out(10331): URI: //
06-05 21:21:50.945 I/System.out(10331): params: {json={"command":"press_key","arguments":["KEYCODE_BACK"]}
06-05 21:21:50.945 I/System.out(10331): }
06-05 21:21:50.945 I/System.out(10331): header: {content-type=application/json;charset=utf-8, date=Sat, 06 Jun 2020 02:21:51 GMT, accept=*/*, host=127.0.0.1:34777, content-length=52, user-agent=HTTPClient/1.0 (2.8.3, ruby 2.5.1 (2018-03-29))}
06-05 21:21:50.945 I/System.out(10331): params: {json={"command":"press_key","arguments":["KEYCODE_BACK"]}
06-05 21:21:50.945 I/System.out(10331): }
06-05 21:21:50.945 I/System.out(10331): ProP json = {"command":"press_key","arguments":["KEYCODE_BACK"]}
06-05 21:21:50.945 I/System.out(10331): files: {}
06-05 21:21:50.945 I/System.out(10331): command: {"command":"press_key","arguments":["KEYCODE_BACK"]}
06-05 21:21:50.947 I/InstrumentationBackend(10331): Got command:'Command:'Line:null,press_key', arguments:'[KEYCODE_BACK]'
06-05 21:21:50.950 V/PhoneStatusBar( 1711): setLightsOn(true)
06-05 21:21:50.953 V/PhoneStatusBar( 1711): setLightsOn(true)
06-05 21:21:50.954 I/System.out(10331): result:{"bonusInformation":[],"message":"","success":true}
06-05 21:21:50.955 I/art     (10331): Do partial code cache collection, code=60KB, data=62KB
06-05 21:21:50.955 I/art     (10331): After code cache collection, code=59KB, data=61KB
06-05 21:21:50.955 I/art     (10331): Increasing code cache capacity to 256KB
06-05 21:21:50.956 D/VehicleStatisticsActivity(10331): Checking recalculation ...
06-05 21:21:50.957 D/VehicleStatisticsActivity(10331): Recalculation not necessary.
06-05 21:21:50.957 I/System.out(10331): URI: //map
06-05 21:21:50.957 I/System.out(10331): params: {json={"query":"* {text CONTAINS[c] 'Statistics'}","operation":{"method_name":"query","arguments":[]}}
06-05 21:21:50.957 I/System.out(10331): }
06-05 21:21:50.964 V/PhoneStatusBar( 1711): setLightsOn(true)
06-05 21:21:50.978 D/gralloc_ranchu( 1347): gralloc_alloc: Creating ashmem region of size 9023488
06-05 21:21:50.979 V/PhoneStatusBar( 1711): setLightsOn(true)
06-05 21:21:50.994 V/PhoneStatusBar( 1711): setLightsOn(true)
06-05 21:21:51.044 V/PhoneStatusBar( 1711): setLightsOn(true)
